<?xml version="1.0" encoding="UTF-8" standalone="yes"?>
<cinemas>
    <cinema name="Cineworld Aberdeen - Queens Links" root="http://www1.cineworld.co.uk/" url="cinemas/aberdeen-queens-links" id="1" phone="0871 200 2000" address="Queens Links Leisure Park, Links Road, Aberdeen" postcode="AB24 5EN">
        <listing>
            <film title="A Dog's Journey" rating="PG" url="films/a-dogs-journey" edi="255103" release="03/05/2019">
                <shows>
                    <show time="2019-05-06T12:15:00" url="https://booking.cineworld.co.uk/booking/8014/114521" audioType="audio described"/>
                    <show time="2019-05-06T14:50:00" url="https://booking.cineworld.co.uk/booking/8014/114522" audioType="audio described"/>
                    <show time="2019-05-06T17:30:00" url="https://booking.cineworld.co.uk/booking/8014/114647" audioType="audio described"/>
                    <show time="2019-05-07T10:50:00" url="https://booking.cineworld.co.uk/booking/8014/114532" audioType="audio described"/>
                    <show time="2019-05-07T13:20:00" url="https://booking.cineworld.co.uk/booking/8014/114533" audioType="audio described"/>
                    <show time="2019-05-07T15:50:00" url="https://booking.cineworld.co.uk/booking/8014/114534" audioType="audio described"/>
                    <show time="2019-05-07T17:30:00" url="https://booking.cineworld.co.uk/booking/8014/114648" audioType="audio described"/>
                    <show time="2019-05-08T10:50:00" url="https://booking.cineworld.co.uk/booking/8014/114535" audioType="audio described"/>
                    <show time="2019-05-08T13:20:00" url="https://booking.cineworld.co.uk/booking/8014/114536" audioType="audio described"/>
                    <show time="2019-05-08T15:50:00" url="https://booking.cineworld.co.uk/booking/8014/114537" audioType="audio described"/>
                    <show time="2019-05-08T17:30:00" url="https://booking.cineworld.co.uk/booking/8014/114562" audioType="audio described"/>
                    <show time="2019-05-09T10:50:00" url="https://booking.cineworld.co.uk/booking/8014/114559" audioType="audio described"/>
                    <show time="2019-05-09T13:20:00" url="https://booking.cineworld.co.uk/booking/8014/114560" audioType="audio described"/>
                    <show time="2019-05-09T15:50:00" url="https://booking.cineworld.co.uk/booking/8014/114561" audioType="audio described"/>
                    <show time="2019-05-09T17:30:00" url="https://booking.cineworld.co.uk/booking/8014/114649" audioType="audio described"/>
                </shows>
            </film>
            <film title="Andre Rieu 2019 Maastricht Concert Shall We Dance?" rating="PG" url="films/andre-rieu-2019-maastricht-concert-shall-we-dance" edi="255443" release="27/07/2019">
                <shows>
                    <show time="2019-07-27T19:00:00" url="https://booking.cineworld.co.uk/booking/8014/111111"/>
                    <show time="2019-07-28T15:00:00" url="https://booking.cineworld.co.uk/booking/8014/111112"/>
                </shows>
            </film>
            <film title="(3D) Avengers: Endgame" rating="12A" url="films/avengers-endgame" edi="174256" release="25/04/2019">
                <shows>
                    <show time="2019-05-06T20:00:00" url="https://booking.cineworld.co.uk/booking/8014/114330" videoType="3d" audioType="audio described"/>
                    <show time="2019-05-07T20:00:00" url="https://booking.cineworld.co.uk/booking/8014/114492" videoType="3d" audioType="audio described"/>
                    <show time="2019-05-09T20:00:00" url="https://booking.cineworld.co.uk/booking/8014/114494" videoType="3d" audioType="audio described"/>
                </shows>
            </film>
            <film title="(2D) Avengers: Endgame" rating="12A" url="films/avengers-endgame" edi="169126" release="25/04/2019">
                <shows>
                    <show time="2019-05-06T10:00:00" url="https://booking.cineworld.co.uk/booking/8014/114312" audioType="audio described"/>
                    <show time="2019-05-06T10:40:00" url="https://booking.cineworld.co.uk/booking/8014/114298" audioType="audio described"/>
                    <show time="2019-05-06T11:20:00" url="https://booking.cineworld.co.uk/booking/8014/114288" audioType="audio described"/>
                    <show time="2019-05-06T12:40:00" url="https://booking.cineworld.co.uk/booking/8014/114323" audioType="audio described"/>
                    <show time="2019-05-06T14:00:00" url="https://booking.cineworld.co.uk/booking/8014/114313" audioType="audio described"/>
                    <show time="2019-05-06T14:40:00" url="https://booking.cineworld.co.uk/booking/8014/114299" audioType="audio described"/>
                    <show time="2019-05-06T15:20:00" url="https://booking.cineworld.co.uk/booking/8014/114289" audioType="audio described"/>
                    <show time="2019-05-06T16:40:00" url="https://booking.cineworld.co.uk/booking/8014/114324" audioType="audio described"/>
                    <show time="2019-05-06T18:00:00" url="https://booking.cineworld.co.uk/booking/8014/114307" audioType="audio described"/>
                    <show time="2019-05-06T18:40:00" url="https://booking.cineworld.co.uk/booking/8014/114303" audioType="audio described" subtitled="true"/>
                    <show time="2019-05-06T19:20:00" url="https://booking.cineworld.co.uk/booking/8014/114283" audioType="audio described"/>
                    <show time="2019-05-06T20:40:00" url="https://booking.cineworld.co.uk/booking/8014/114318" audioType="audio described"/>
                    <show time="2019-05-07T10:40:00" url="https://booking.cineworld.co.uk/booking/8014/114482" audioType="audio described"/>
                    <show time="2019-05-07T11:20:00" url="https://booking.cineworld.co.uk/booking/8014/114464" audioType="audio described"/>
                    <show time="2019-05-07T12:40:00" url="https://booking.cineworld.co.uk/booking/8014/114473" audioType="audio described"/>
                    <show time="2019-05-07T14:00:00" url="https://booking.cineworld.co.uk/booking/8014/114488" audioType="audio described"/>
                    <show time="2019-05-07T14:40:00" url="https://booking.cineworld.co.uk/booking/8014/114483" audioType="audio described"/>
                    <show time="2019-05-07T15:20:00" url="https://booking.cineworld.co.uk/booking/8014/114465" audioType="audio described"/>
                    <show time="2019-05-07T16:40:00" url="https://booking.cineworld.co.uk/booking/8014/114474" audioType="audio described"/>
                    <show time="2019-05-07T18:00:00" url="https://booking.cineworld.co.uk/booking/8014/114489" audioType="audio described"/>
                    <show time="2019-05-07T18:40:00" url="https://booking.cineworld.co.uk/booking/8014/114484" audioType="audio described"/>
                    <show time="2019-05-07T19:20:00" url="https://booking.cineworld.co.uk/booking/8014/114466" audioType="audio described"/>
                    <show time="2019-05-07T20:40:00" url="https://booking.cineworld.co.uk/booking/8014/114475" audioType="audio described"/>
                    <show time="2019-05-08T10:40:00" url="https://booking.cineworld.co.uk/booking/8014/114485" audioType="audio described"/>
                    <show time="2019-05-08T11:20:00" url="https://booking.cineworld.co.uk/booking/8014/114467" audioType="audio described"/>
                    <show time="2019-05-08T12:40:00" url="https://booking.cineworld.co.uk/booking/8014/114476" audioType="audio described"/>
                    <show time="2019-05-08T14:00:00" url="https://booking.cineworld.co.uk/booking/8014/114650" audioType="audio described"/>
                    <show time="2019-05-08T14:40:00" url="https://booking.cineworld.co.uk/booking/8014/114486" audioType="audio described"/>
                    <show time="2019-05-08T15:20:00" url="https://booking.cineworld.co.uk/booking/8014/114468" audioType="audio described"/>
                    <show time="2019-05-08T16:40:00" url="https://booking.cineworld.co.uk/booking/8014/114477" audioType="audio described"/>
                    <show time="2019-05-08T18:00:00" url="https://booking.cineworld.co.uk/booking/8014/114651" audioType="audio described"/>
                    <show time="2019-05-08T18:40:00" url="https://booking.cineworld.co.uk/booking/8014/114487" audioType="audio described"/>
                    <show time="2019-05-08T19:20:00" url="https://booking.cineworld.co.uk/booking/8014/114469" audioType="audio described"/>
                    <show time="2019-05-08T20:40:00" url="https://booking.cineworld.co.uk/booking/8014/114478" audioType="audio described"/>
                    <show time="2019-05-09T10:40:00" url="https://booking.cineworld.co.uk/booking/8014/114552" audioType="audio described"/>
                    <show time="2019-05-09T11:20:00" url="https://booking.cineworld.co.uk/booking/8014/114470" audioType="audio described"/>
                    <show time="2019-05-09T12:40:00" url="https://booking.cineworld.co.uk/booking/8014/114479" audioType="audio described"/>
                    <show time="2019-05-09T14:00:00" url="https://booking.cineworld.co.uk/booking/8014/114490" audioType="audio described"/>
                    <show time="2019-05-09T14:40:00" url="https://booking.cineworld.co.uk/booking/8014/114553" audioType="audio described"/>
                    <show time="2019-05-09T15:20:00" url="https://booking.cineworld.co.uk/booking/8014/114471" audioType="audio described"/>
                    <show time="2019-05-09T16:40:00" url="https://booking.cineworld.co.uk/booking/8014/114480" audioType="audio described"/>
                    <show time="2019-05-09T18:00:00" url="https://booking.cineworld.co.uk/booking/8014/114491" audioType="audio described"/>
                    <show time="2019-05-09T19:20:00" url="https://booking.cineworld.co.uk/booking/8014/114472" audioType="audio described"/>
                    <show time="2019-05-09T20:40:00" url="https://booking.cineworld.co.uk/booking/8014/114481" audioType="audio described"/>
                </shows>
            </film>
            <film title="Beats : Unlimited Screening" rating="18" url="films/beats-unlimited-screening" edi="801824" release="08/05/2019">
                <shows>
                    <show time="2019-05-08T20:00:00" url="https://booking.cineworld.co.uk/booking/8014/114279" audioType="audio described"/>
                </shows>
            </film>
            <film title="Booksmart: Unlimited Screening" rating="15" url="films/booksmart-unlimited-screening" edi="801833" release="06/05/2019">
                <shows>
                    <show time="2019-05-06T19:45:00" url="https://booking.cineworld.co.uk/booking/8014/114441" audioType="audio described"/>
                </shows>
            </film>
            <film title="(2D) Captain Marvel" rating="12A" url="films/captain-marvel" edi="169122" release="08/03/2019">
                <shows>
                    <show time="2019-05-07T14:40:00" url="https://booking.cineworld.co.uk/booking/8014/114633" audioType="audio described"/>
                    <show time="2019-05-08T14:30:00" url="https://booking.cineworld.co.uk/booking/8014/114566" audioType="audio described"/>
                    <show time="2019-05-09T14:30:00" url="https://booking.cineworld.co.uk/booking/8014/114634" audioType="audio described"/>
                </shows>
            </film>
            <film title="M4J How To Train Your Dragon: The Hidden World" rating="PG" url="films/how-to-train-your-dragon-the-hidden-world-movies-for-juniors" edi="801822" release="01/02/2019">
                <shows>
                    <show time="2019-05-06T10:00:00" url="https://booking.cineworld.co.uk/booking/8014/114556" audioType="audio described"/>
                    <show time="2019-05-07T10:15:00" url="https://booking.cineworld.co.uk/booking/8014/114691" audioType="audio described"/>
                </shows>
            </film>
            <film title="Long Shot" rating="15" url="films/long-shot" edi="240058" release="03/05/2019">
                <shows>
                    <show time="2019-05-06T14:00:00" url="https://booking.cineworld.co.uk/booking/8014/114581"/>
                    <show time="2019-05-06T17:00:00" url="https://booking.cineworld.co.uk/booking/8014/114588"/>
                    <show time="2019-05-06T19:50:00" url="https://booking.cineworld.co.uk/booking/8014/114589"/>
                    <show time="2019-05-07T11:10:00" url="https://booking.cineworld.co.uk/booking/8014/114572"/>
                    <show time="2019-05-07T14:00:00" url="https://booking.cineworld.co.uk/booking/8014/114576"/>
                    <show time="2019-05-07T17:00:00" url="https://booking.cineworld.co.uk/booking/8014/114590"/>
                    <show time="2019-05-07T19:50:00" url="https://booking.cineworld.co.uk/booking/8014/114591"/>
                    <show time="2019-05-08T11:10:00" url="https://booking.cineworld.co.uk/booking/8014/114573"/>
                    <show time="2019-05-08T14:00:00" url="https://booking.cineworld.co.uk/booking/8014/114577"/>
                    <show time="2019-05-08T17:00:00" url="https://booking.cineworld.co.uk/booking/8014/114592"/>
                    <show time="2019-05-08T19:50:00" url="https://booking.cineworld.co.uk/booking/8014/114593"/>
                    <show time="2019-05-09T11:10:00" url="https://booking.cineworld.co.uk/booking/8014/114574"/>
                    <show time="2019-05-09T14:00:00" url="https://booking.cineworld.co.uk/booking/8014/114578"/>
                    <show time="2019-05-09T17:00:00" url="https://booking.cineworld.co.uk/booking/8014/114594"/>
                    <show time="2019-05-09T19:50:00" url="https://booking.cineworld.co.uk/booking/8014/114595"/>
                </shows>
            </film>
            <film title="Missing Link" rating="PG" url="films/missing-link" edi="258465" release="05/04/2019">
                <shows>
                    <show time="2019-05-06T11:30:00" url="https://booking.cineworld.co.uk/booking/8014/114570" audioType="audio described"/>
                    <show time="2019-05-07T10:50:00" url="https://booking.cineworld.co.uk/booking/8014/114690" audioType="audio described"/>
                </shows>
            </film>
            <film title="Paw Patrol: Mighty Pups - The Movie" rating="TBC" url="films/paw-patrol-mighty-pups" edi="261550" release="17/05/2019">
                <shows>
                    <show time="2019-05-18T11:20:00" url="https://booking.cineworld.co.uk/booking/8014/114036"/>
                    <show time="2019-05-18T13:10:00" url="https://booking.cineworld.co.uk/booking/8014/114037"/>
                    <show time="2019-05-18T15:00:00" url="https://booking.cineworld.co.uk/booking/8014/114038"/>
                    <show time="2019-05-19T11:20:00" url="https://booking.cineworld.co.uk/booking/8014/114039"/>
                    <show time="2019-05-19T13:10:00" url="https://booking.cineworld.co.uk/booking/8014/114040"/>
                    <show time="2019-05-19T15:00:00" url="https://booking.cineworld.co.uk/booking/8014/114041"/>
                </shows>
            </film>
            <film title="(3D) Detective Pikachu" rating="PG" url="films/pokemon-detective-pikachu" edi="245036" release="10/05/2019">
                <shows>
                    <show time="2019-05-10T11:10:00" url="https://booking.cineworld.co.uk/booking/8014/114669" videoType="3d" audioType="audio described"/>
                    <show time="2019-05-10T13:40:00" url="https://booking.cineworld.co.uk/booking/8014/114670" videoType="3d" audioType="audio described"/>
                    <show time="2019-05-10T16:10:00" url="https://booking.cineworld.co.uk/booking/8014/114671" videoType="3d" audioType="audio described"/>
                    <show time="2019-05-11T11:10:00" url="https://booking.cineworld.co.uk/booking/8014/114676" videoType="3d" audioType="audio described"/>
                    <show time="2019-05-11T13:40:00" url="https://booking.cineworld.co.uk/booking/8014/114677" videoType="3d" audioType="audio described"/>
                    <show time="2019-05-11T16:10:00" url="https://booking.cineworld.co.uk/booking/8014/114678" videoType="3d" audioType="audio described"/>
                    <show time="2019-05-12T11:10:00" url="https://booking.cineworld.co.uk/booking/8014/114683" videoType="3d" audioType="audio described"/>
                    <show time="2019-05-12T13:40:00" url="https://booking.cineworld.co.uk/booking/8014/114684" videoType="3d" audioType="audio described"/>
                    <show time="2019-05-12T16:10:00" url="https://booking.cineworld.co.uk/booking/8014/114685" videoType="3d" audioType="audio described"/>
                </shows>
            </film>
            <film title="(2D) Detective Pikachu" rating="PG" url="films/pokemon-detective-pikachu" edi="244991" release="10/05/2019">
                <shows>
                    <show time="2019-05-10T12:30:00" url="https://booking.cineworld.co.uk/booking/8014/114667" audioType="audio described"/>
                    <show time="2019-05-10T15:00:00" url="https://booking.cineworld.co.uk/booking/8014/114668" audioType="audio described"/>
                    <show time="2019-05-10T17:30:00" url="https://booking.cineworld.co.uk/booking/8014/114665" audioType="audio described"/>
                    <show time="2019-05-10T20:00:00" url="https://booking.cineworld.co.uk/booking/8014/114666" audioType="audio described"/>
                    <show time="2019-05-11T10:00:00" url="https://booking.cineworld.co.uk/booking/8014/114687" audioType="audio described"/>
                    <show time="2019-05-11T12:30:00" url="https://booking.cineworld.co.uk/booking/8014/114674" audioType="audio described"/>
                    <show time="2019-05-11T15:00:00" url="https://booking.cineworld.co.uk/booking/8014/114675" audioType="audio described"/>
                    <show time="2019-05-11T17:30:00" url="https://booking.cineworld.co.uk/booking/8014/114672" audioType="audio described"/>
                    <show time="2019-05-11T20:00:00" url="https://booking.cineworld.co.uk/booking/8014/114673" audioType="audio described"/>
                    <show time="2019-05-12T10:00:00" url="https://booking.cineworld.co.uk/booking/8014/114686" audioType="audio described"/>
                    <show time="2019-05-12T12:30:00" url="https://booking.cineworld.co.uk/booking/8014/114679" audioType="audio described"/>
                    <show time="2019-05-12T15:00:00" url="https://booking.cineworld.co.uk/booking/8014/114680" audioType="audio described"/>
                    <show time="2019-05-12T17:30:00" url="https://booking.cineworld.co.uk/booking/8014/114681" audioType="audio described"/>
                    <show time="2019-05-12T20:00:00" url="https://booking.cineworld.co.uk/booking/8014/114682" audioType="audio described"/>
                </shows>
            </film>
            <film title="(2D) Shazam!" rating="12A" url="films/shazam" edi="169941" release="05/04/2019">
                <shows>
                    <show time="2019-05-07T10:50:00" url="https://booking.cineworld.co.uk/booking/8014/114564" audioType="audio described"/>
                    <show time="2019-05-07T20:50:00" url="https://booking.cineworld.co.uk/booking/8014/114546" audioType="audio described"/>
                    <show time="2019-05-08T10:50:00" url="https://booking.cineworld.co.uk/booking/8014/114628" audioType="audio described"/>
                    <show time="2019-05-08T20:50:00" url="https://booking.cineworld.co.uk/booking/8014/114547" audioType="audio described"/>
                    <show time="2019-05-09T10:50:00" url="https://booking.cineworld.co.uk/booking/8014/114565" audioType="audio described"/>
                    <show time="2019-05-09T20:50:00" url="https://booking.cineworld.co.uk/booking/8014/114557" audioType="audio described"/>
                </shows>
            </film>
            <film title="M4J Spider-Man: Into The Spider-Verse" rating="PG" url="films/spider-man-into-the-spider-verse-movies-for-juniors" edi="801735" release="15/02/2019">
                <shows>
                    <show time="2019-05-06T10:30:00" url="https://booking.cineworld.co.uk/booking/8014/114654" audioType="audio described"/>
                </shows>
            </film>
            <film title="Take That - Greatest Hits Live" rating="12A" url="films/take-that-greatest-hits-live" edi="270195" release="08/06/2019">
                <shows>
                    <show time="2019-06-08T20:00:00" url="https://booking.cineworld.co.uk/booking/8014/114331"/>
                </shows>
            </film>
            <film title="The Curse Of La Llorona" rating="15" url="films/the-curse-of-la-llorona" edi="250922" release="03/05/2019">
                <shows>
                    <show time="2019-05-06T13:10:00" url="https://booking.cineworld.co.uk/booking/8014/114614" audioType="audio described"/>
                    <show time="2019-05-06T15:30:00" url="https://booking.cineworld.co.uk/booking/8014/114615" audioType="audio described"/>
                    <show time="2019-05-06T17:50:00" url="https://booking.cineworld.co.uk/booking/8014/114602" audioType="audio described"/>
                    <show time="2019-05-06T20:10:00" url="https://booking.cineworld.co.uk/booking/8014/114603" audioType="audio described"/>
                    <show time="2019-05-07T13:10:00" url="https://booking.cineworld.co.uk/booking/8014/114618" audioType="audio described"/>
                    <show time="2019-05-07T15:30:00" url="https://booking.cineworld.co.uk/booking/8014/114619" audioType="audio described"/>
                    <show time="2019-05-07T17:50:00" url="https://booking.cineworld.co.uk/booking/8014/114604" audioType="audio described"/>
                    <show time="2019-05-07T20:10:00" url="https://booking.cineworld.co.uk/booking/8014/114605" audioType="audio described"/>
                    <show time="2019-05-08T10:50:00" url="https://booking.cineworld.co.uk/booking/8014/114626" audioType="audio described"/>
                    <show time="2019-05-08T13:10:00" url="https://booking.cineworld.co.uk/booking/8014/114620" audioType="audio described"/>
                    <show time="2019-05-08T15:30:00" url="https://booking.cineworld.co.uk/booking/8014/114621" audioType="audio described"/>
                    <show time="2019-05-08T17:50:00" url="https://booking.cineworld.co.uk/booking/8014/114606" audioType="audio described"/>
                    <show time="2019-05-08T20:10:00" url="https://booking.cineworld.co.uk/booking/8014/114607" audioType="audio described"/>
                    <show time="2019-05-09T10:50:00" url="https://booking.cineworld.co.uk/booking/8014/114655" audioType="audio described"/>
                    <show time="2019-05-09T13:10:00" url="https://booking.cineworld.co.uk/booking/8014/114656" audioType="audio described"/>
                    <show time="2019-05-09T15:30:00" url="https://booking.cineworld.co.uk/booking/8014/114657" audioType="audio described"/>
                    <show time="2019-05-09T17:50:00" url="https://booking.cineworld.co.uk/booking/8014/114658" audioType="audio described"/>
                    <show time="2019-05-09T20:10:00" url="https://booking.cineworld.co.uk/booking/8014/114659" audioType="audio described"/>
                </shows>
            </film>
            <film title="The Secret Life Of Pets 2" rating="U" url="films/the-secret-life-of-pets-2" edi="192838" release="24/05/2019">
                <shows>
                    <show time="2019-05-24T12:30:00" url="https://booking.cineworld.co.uk/booking/8014/113312" audioType="audio described"/>
                    <show time="2019-05-24T14:45:00" url="https://booking.cineworld.co.uk/booking/8014/113313" audioType="audio described"/>
                    <show time="2019-05-24T17:00:00" url="https://booking.cineworld.co.uk/booking/8014/113314" audioType="audio described"/>
                    <show time="2019-05-25T10:15:00" url="https://booking.cineworld.co.uk/booking/8014/113315" audioType="audio described"/>
                    <show time="2019-05-25T12:30:00" url="https://booking.cineworld.co.uk/booking/8014/113316" audioType="audio described"/>
                    <show time="2019-05-25T14:45:00" url="https://booking.cineworld.co.uk/booking/8014/113317" audioType="audio described"/>
                    <show time="2019-05-25T17:00:00" url="https://booking.cineworld.co.uk/booking/8014/113318" audioType="audio described"/>
                    <show time="2019-05-26T10:15:00" url="https://booking.cineworld.co.uk/booking/8014/113327" audioType="audio described"/>
                    <show time="2019-05-26T12:30:00" url="https://booking.cineworld.co.uk/booking/8014/113328" audioType="audio described"/>
                    <show time="2019-05-26T14:45:00" url="https://booking.cineworld.co.uk/booking/8014/113329" audioType="audio described"/>
                    <show time="2019-05-26T17:00:00" url="https://booking.cineworld.co.uk/booking/8014/113330" audioType="audio described"/>
                    <show time="2019-05-27T10:15:00" url="https://booking.cineworld.co.uk/booking/8014/113319" audioType="audio described"/>
                    <show time="2019-05-27T12:30:00" url="https://booking.cineworld.co.uk/booking/8014/113320" audioType="audio described"/>
                    <show time="2019-05-27T14:45:00" url="https://booking.cineworld.co.uk/booking/8014/113321" audioType="audio described"/>
                    <show time="2019-05-27T17:00:00" url="https://booking.cineworld.co.uk/booking/8014/113322" audioType="audio described"/>
                    <show time="2019-05-28T12:30:00" url="https://booking.cineworld.co.uk/booking/8014/113324" audioType="audio described"/>
                    <show time="2019-05-28T14:45:00" url="https://booking.cineworld.co.uk/booking/8014/113325" audioType="audio described"/>
                    <show time="2019-05-28T17:00:00" url="https://booking.cineworld.co.uk/booking/8014/113326" audioType="audio described"/>
                </shows>
            </film>
            <film title="Tolkien" rating="12A" url="films/tolkien" edi="271425" release="03/05/2019">
                <shows>
                    <show time="2019-05-06T11:40:00" url="https://booking.cineworld.co.uk/booking/8014/114548" audioType="audio described"/>
                    <show time="2019-05-06T14:20:00" url="https://booking.cineworld.co.uk/booking/8014/114549" audioType="audio described"/>
                    <show time="2019-05-06T17:00:00" url="https://booking.cineworld.co.uk/booking/8014/114550" audioType="audio described"/>
                    <show time="2019-05-06T19:40:00" url="https://booking.cineworld.co.uk/booking/8014/114551" audioType="audio described"/>
                    <show time="2019-05-07T11:40:00" url="https://booking.cineworld.co.uk/booking/8014/114514"/>
                    <show time="2019-05-07T14:20:00" url="https://booking.cineworld.co.uk/booking/8014/114515"/>
                    <show time="2019-05-07T17:00:00" url="https://booking.cineworld.co.uk/booking/8014/114506"/>
                    <show time="2019-05-07T19:40:00" url="https://booking.cineworld.co.uk/booking/8014/114507"/>
                    <show time="2019-05-08T11:40:00" url="https://booking.cineworld.co.uk/booking/8014/114516"/>
                    <show time="2019-05-08T14:20:00" url="https://booking.cineworld.co.uk/booking/8014/114517"/>
                    <show time="2019-05-08T17:00:00" url="https://booking.cineworld.co.uk/booking/8014/114508"/>
                    <show time="2019-05-08T19:40:00" url="https://booking.cineworld.co.uk/booking/8014/114509"/>
                    <show time="2019-05-09T11:40:00" url="https://booking.cineworld.co.uk/booking/8014/114518"/>
                    <show time="2019-05-09T14:20:00" url="https://booking.cineworld.co.uk/booking/8014/114519"/>
                    <show time="2019-05-09T17:00:00" url="https://booking.cineworld.co.uk/booking/8014/114510"/>
                    <show time="2019-05-09T19:40:00" url="https://booking.cineworld.co.uk/booking/8014/114511"/>
                </shows>
            </film>
            <film title="Wild Rose" rating="15" url="films/wild-rose" edi="247600" release="12/04/2019">
                <shows>
                    <show time="2019-05-06T17:30:00" url="https://booking.cineworld.co.uk/booking/8014/114520" audioType="audio described"/>
                    <show time="2019-05-07T18:20:00" url="https://booking.cineworld.co.uk/booking/8014/114541" audioType="audio described"/>
                    <show time="2019-05-08T12:00:00" url="https://booking.cineworld.co.uk/booking/8014/114567" audioType="audio described"/>
                    <show time="2019-05-08T18:20:00" url="https://booking.cineworld.co.uk/booking/8014/114542" audioType="audio described"/>
                    <show time="2019-05-09T12:00:00" url="https://booking.cineworld.co.uk/booking/8014/114631" audioType="audio described"/>
                    <show time="2019-05-09T18:20:00" url="https://booking.cineworld.co.uk/booking/8014/114558" audioType="audio described"/>
                </shows>
            </film>
            <film title="(2D) Wonder Park" rating="PG" url="films/wonder-park" edi="194897" release="12/04/2019">
                <shows>
                    <show time="2019-05-06T10:30:00" url="https://booking.cineworld.co.uk/booking/8014/114641" audioType="audio described"/>
                    <show time="2019-05-06T12:50:00" url="https://booking.cineworld.co.uk/booking/8014/114642" audioType="audio described"/>
                    <show time="2019-05-06T15:10:00" url="https://booking.cineworld.co.uk/booking/8014/114643" audioType="audio described"/>
                    <show time="2019-05-07T10:20:00" url="https://booking.cineworld.co.uk/booking/8014/114688" audioType="audio described"/>
                    <show time="2019-05-07T12:30:00" url="https://booking.cineworld.co.uk/booking/8014/114689" audioType="audio described"/>
                </shows>
            </film>
            <film title="(3D) X-Men: Dark Phoenix" rating="TBC" url="films/x-men-dark-phoenix" edi="246006" release="05/06/2019">
                <shows>
                    <show time="2019-06-05T17:45:00" url="https://booking.cineworld.co.uk/booking/8014/114443" videoType="3d" audioType="audio described"/>
                    <show time="2019-06-06T17:45:00" url="https://booking.cineworld.co.uk/booking/8014/114448" videoType="3d" audioType="audio described"/>
                    <show time="2019-06-07T17:45:00" url="https://booking.cineworld.co.uk/booking/8014/114452" videoType="3d" audioType="audio described"/>
                    <show time="2019-06-08T17:45:00" url="https://booking.cineworld.co.uk/booking/8014/114456" videoType="3d" audioType="audio described"/>
                    <show time="2019-06-09T17:45:00" url="https://booking.cineworld.co.uk/booking/8014/114460" videoType="3d" audioType="audio described"/>
                </shows>
            </film>
            <film title="X-Men: Dark Phoenix" rating="TBC" url="films/x-men-dark-phoenix" edi="220087" release="05/06/2019">
                <shows>
                    <show time="2019-06-05T12:15:00" url="https://booking.cineworld.co.uk/booking/8014/114445" audioType="audio described"/>
                    <show time="2019-06-05T15:00:00" url="https://booking.cineworld.co.uk/booking/8014/114444" audioType="audio described"/>
                    <show time="2019-06-05T20:30:00" url="https://booking.cineworld.co.uk/booking/8014/114442" audioType="audio described"/>
                    <show time="2019-06-06T12:15:00" url="https://booking.cineworld.co.uk/booking/8014/114446" audioType="audio described"/>
                    <show time="2019-06-06T15:00:00" url="https://booking.cineworld.co.uk/booking/8014/114447" audioType="audio described"/>
                    <show time="2019-06-06T20:30:00" url="https://booking.cineworld.co.uk/booking/8014/114449" audioType="audio described"/>
                    <show time="2019-06-07T12:15:00" url="https://booking.cineworld.co.uk/booking/8014/114450" audioType="audio described"/>
                    <show time="2019-06-07T15:00:00" url="https://booking.cineworld.co.uk/booking/8014/114451" audioType="audio described"/>
                    <show time="2019-06-07T20:30:00" url="https://booking.cineworld.co.uk/booking/8014/114453" audioType="audio described"/>
                    <show time="2019-06-08T12:15:00" url="https://booking.cineworld.co.uk/booking/8014/114454" audioType="audio described"/>
                    <show time="2019-06-08T15:00:00" url="https://booking.cineworld.co.uk/booking/8014/114455" audioType="audio described"/>
                    <show time="2019-06-08T20:30:00" url="https://booking.cineworld.co.uk/booking/8014/114457" audioType="audio described"/>
                    <show time="2019-06-09T12:15:00" url="https://booking.cineworld.co.uk/booking/8014/114458" audioType="audio described"/>
                    <show time="2019-06-09T15:00:00" url="https://booking.cineworld.co.uk/booking/8014/114459" audioType="audio described"/>
                    <show time="2019-06-09T20:30:00" url="https://booking.cineworld.co.uk/booking/8014/114461" audioType="audio described"/>
                </shows>
            </film>
        </listing>
    </cinema>
    <cinema name="Cineworld Aberdeen - Union Square" root="http://www1.cineworld.co.uk/" url="cinemas/aberdeen-union-square" id="78" phone="0871 200 2000" address="Union Square, Guild Square, Aberdeen" postcode="AB11 5RG">
        <listing>
            <film title="A Dog's Journey" rating="PG" url="films/a-dogs-journey" edi="255103" release="03/05/2019">
                <shows>
                    <show time="2019-05-06T11:20:00" url="https://booking.cineworld.co.uk/booking/8018/128003" audioType="audio described"/>
                    <show time="2019-05-06T14:10:00" url="https://booking.cineworld.co.uk/booking/8018/128004" audioType="audio described"/>
                    <show time="2019-05-06T16:50:00" url="https://booking.cineworld.co.uk/booking/8018/128005" audioType="audio described"/>
                    <show time="2019-05-06T18:10:00" url="https://booking.cineworld.co.uk/booking/8018/128060" audioType="audio described"/>
                    <show time="2019-05-07T11:30:00" url="https://booking.cineworld.co.uk/booking/8018/128015" audioType="audio described"/>
                    <show time="2019-05-07T14:10:00" url="https://booking.cineworld.co.uk/booking/8018/128016" audioType="audio described"/>
                    <show time="2019-05-07T16:50:00" url="https://booking.cineworld.co.uk/booking/8018/128017" audioType="audio described"/>
                    <show time="2019-05-07T18:10:00" url="https://booking.cineworld.co.uk/booking/8018/127942" audioType="audio described"/>
                    <show time="2019-05-08T11:30:00" url="https://booking.cineworld.co.uk/booking/8018/127977" audioType="audio described"/>
                    <show time="2019-05-08T14:10:00" url="https://booking.cineworld.co.uk/booking/8018/127978" audioType="audio described"/>
                    <show time="2019-05-08T16:50:00" url="https://booking.cineworld.co.uk/booking/8018/127979" audioType="audio described"/>
                    <show time="2019-05-08T18:10:00" url="https://booking.cineworld.co.uk/booking/8018/127943" audioType="audio described"/>
                    <show time="2019-05-09T11:30:00" url="https://booking.cineworld.co.uk/booking/8018/127980" audioType="audio described"/>
                    <show time="2019-05-09T14:10:00" url="https://booking.cineworld.co.uk/booking/8018/127981" audioType="audio described"/>
                    <show time="2019-05-09T16:50:00" url="https://booking.cineworld.co.uk/booking/8018/127982" audioType="audio described"/>
                    <show time="2019-05-09T18:10:00" url="https://booking.cineworld.co.uk/booking/8018/128061" audioType="audio described"/>
                </shows>
            </film>
            <film title="Andre Rieu 2019 Maastricht Concert Shall We Dance?" rating="PG" url="films/andre-rieu-2019-maastricht-concert-shall-we-dance" edi="255443" release="27/07/2019">
                <shows>
                    <show time="2019-07-27T19:00:00" url="https://booking.cineworld.co.uk/booking/8018/123918"/>
                    <show time="2019-07-28T15:00:00" url="https://booking.cineworld.co.uk/booking/8018/123919"/>
                </shows>
            </film>
            <film title="Asbury Park : Riot, Redemtpion, Rock &amp; Roll" rating="12A" url="films/asbury-park-riot-redemption-rock-n-roll" edi="272389" release="22/05/2019">
                <shows>
                    <show time="2019-05-22T19:30:00" url="https://booking.cineworld.co.uk/booking/8018/126267"/>
                </shows>
            </film>
            <film title="Autism Friendly Screening: Secret Life Of Pets 2" rating="U" url="films/autism-friendly-screening-secret-life-of-pets-2" edi="801857" release="02/06/2019">
                <shows>
                    <show time="2019-06-02T11:00:00" url="https://booking.cineworld.co.uk/booking/8018/128145" audioType="audio described"/>
                </shows>
            </film>
            <film title="(3D) Avengers: Endgame" rating="12A" url="films/avengers-endgame" edi="174256" release="25/04/2019">
                <shows>
                    <show time="2019-05-06T15:00:00" url="https://booking.cineworld.co.uk/booking/8018/127677" videoType="3d" audioType="audio described"/>
                    <show time="2019-05-06T19:00:00" url="https://booking.cineworld.co.uk/booking/8018/127678" videoType="3d" audioType="audio described"/>
                    <show time="2019-05-07T15:00:00" url="https://booking.cineworld.co.uk/booking/8018/128074" videoType="3d" audioType="audio described"/>
                    <show time="2019-05-07T19:00:00" url="https://booking.cineworld.co.uk/booking/8018/128079" videoType="3d" audioType="audio described"/>
                    <show time="2019-05-08T15:00:00" url="https://booking.cineworld.co.uk/booking/8018/128076" videoType="3d" audioType="audio described"/>
                    <show time="2019-05-08T19:00:00" url="https://booking.cineworld.co.uk/booking/8018/128080" videoType="3d" audioType="audio described"/>
                    <show time="2019-05-09T15:00:00" url="https://booking.cineworld.co.uk/booking/8018/128078" videoType="3d" audioType="audio described"/>
                    <show time="2019-05-09T19:00:00" url="https://booking.cineworld.co.uk/booking/8018/128081" videoType="3d" audioType="audio described"/>
                </shows>
            </film>
            <film title="(4DX 3D) Avengers: ENDGAME" rating="12A" url="films/avengers-endgame" edi="801784" release="25/04/2019">
                <shows>
                    <show time="2019-05-06T11:50:00" url="https://booking.cineworld.co.uk/booking/8018/127718" videoType="3d" audioType="audio described"/>
                    <show time="2019-05-06T15:50:00" url="https://booking.cineworld.co.uk/booking/8018/127719" videoType="3d" audioType="audio described"/>
                    <show time="2019-05-06T20:00:00" url="https://booking.cineworld.co.uk/booking/8018/127720" videoType="3d" audioType="audio described"/>
                    <show time="2019-05-07T11:50:00" url="https://booking.cineworld.co.uk/booking/8018/127925" videoType="3d" audioType="audio described"/>
                    <show time="2019-05-07T15:50:00" url="https://booking.cineworld.co.uk/booking/8018/127926" videoType="3d" audioType="audio described"/>
                    <show time="2019-05-07T20:00:00" url="https://booking.cineworld.co.uk/booking/8018/127922" videoType="3d" audioType="audio described"/>
                    <show time="2019-05-08T11:50:00" url="https://booking.cineworld.co.uk/booking/8018/127927" videoType="3d" audioType="audio described"/>
                    <show time="2019-05-08T15:50:00" url="https://booking.cineworld.co.uk/booking/8018/127928" videoType="3d" audioType="audio described"/>
                    <show time="2019-05-08T20:00:00" url="https://booking.cineworld.co.uk/booking/8018/127923" videoType="3d" audioType="audio described"/>
                    <show time="2019-05-09T11:50:00" url="https://booking.cineworld.co.uk/booking/8018/127929" videoType="3d" audioType="audio described"/>
                    <show time="2019-05-09T15:50:00" url="https://booking.cineworld.co.uk/booking/8018/127930" videoType="3d" audioType="audio described"/>
                    <show time="2019-05-09T20:00:00" url="https://booking.cineworld.co.uk/booking/8018/127924" videoType="3d" audioType="audio described"/>
                </shows>
            </film>
            <film title="(2D) Avengers: Endgame" rating="12A" url="films/avengers-endgame" edi="169126" release="25/04/2019">
                <shows>
                    <show time="2019-05-06T10:20:00" url="https://booking.cineworld.co.uk/booking/8018/127704" audioType="audio described"/>
                    <show time="2019-05-06T11:10:00" url="https://booking.cineworld.co.uk/booking/8018/128113" audioType="audio described"/>
                    <show time="2019-05-06T12:30:00" url="https://booking.cineworld.co.uk/booking/8018/127691" audioType="audio described"/>
                    <show time="2019-05-06T13:40:00" url="https://booking.cineworld.co.uk/booking/8018/127716" audioType="audio described"/>
                    <show time="2019-05-06T14:20:00" url="https://booking.cineworld.co.uk/booking/8018/127705" audioType="audio described"/>
                    <show time="2019-05-06T16:30:00" url="https://booking.cineworld.co.uk/booking/8018/127692" audioType="audio described"/>
                    <show time="2019-05-06T18:00:00" url="https://booking.cineworld.co.uk/booking/8018/127717" audioType="audio described"/>
                    <show time="2019-05-06T18:30:00" url="https://booking.cineworld.co.uk/booking/8018/127706" audioType="audio described"/>
                    <show time="2019-05-06T19:30:00" url="https://booking.cineworld.co.uk/booking/8018/127697" audioType="audio described"/>
                    <show time="2019-05-06T20:30:00" url="https://booking.cineworld.co.uk/booking/8018/127693" audioType="audio described"/>
                    <show time="2019-05-07T10:20:00" url="https://booking.cineworld.co.uk/booking/8018/127931" audioType="audio described"/>
                    <show time="2019-05-07T11:10:00" url="https://booking.cineworld.co.uk/booking/8018/128115" audioType="audio described"/>
                    <show time="2019-05-07T12:30:00" url="https://booking.cineworld.co.uk/booking/8018/127990" audioType="audio described"/>
                    <show time="2019-05-07T14:20:00" url="https://booking.cineworld.co.uk/booking/8018/127932" audioType="audio described"/>
                    <show time="2019-05-07T16:30:00" url="https://booking.cineworld.co.uk/booking/8018/127991" audioType="audio described"/>
                    <show time="2019-05-07T18:00:00" url="https://booking.cineworld.co.uk/booking/8018/127974" audioType="audio described"/>
                    <show time="2019-05-07T18:30:00" url="https://booking.cineworld.co.uk/booking/8018/127937" audioType="audio described"/>
                    <show time="2019-05-07T19:30:00" url="https://booking.cineworld.co.uk/booking/8018/128002" audioType="audio described"/>
                    <show time="2019-05-07T20:30:00" url="https://booking.cineworld.co.uk/booking/8018/127996" audioType="audio described"/>
                    <show time="2019-05-08T10:20:00" url="https://booking.cineworld.co.uk/booking/8018/127933" audioType="audio described"/>
                    <show time="2019-05-08T11:10:00" url="https://booking.cineworld.co.uk/booking/8018/128116" audioType="audio described"/>
                    <show time="2019-05-08T12:30:00" url="https://booking.cineworld.co.uk/booking/8018/127992" audioType="audio described"/>
                    <show time="2019-05-08T14:20:00" url="https://booking.cineworld.co.uk/booking/8018/127934" audioType="audio described"/>
                    <show time="2019-05-08T16:30:00" url="https://booking.cineworld.co.uk/booking/8018/127993" audioType="audio described"/>
                    <show time="2019-05-08T18:30:00" url="https://booking.cineworld.co.uk/booking/8018/127938" audioType="audio described"/>
                    <show time="2019-05-08T19:30:00" url="https://booking.cineworld.co.uk/booking/8018/127975" audioType="audio described"/>
                    <show time="2019-05-08T20:30:00" url="https://booking.cineworld.co.uk/booking/8018/127997" audioType="audio described"/>
                    <show time="2019-05-09T10:20:00" url="https://booking.cineworld.co.uk/booking/8018/127935" audioType="audio described"/>
                    <show time="2019-05-09T11:10:00" url="https://booking.cineworld.co.uk/booking/8018/128117" audioType="audio described"/>
                    <show time="2019-05-09T12:30:00" url="https://booking.cineworld.co.uk/booking/8018/127994" audioType="audio described"/>
                    <show time="2019-05-09T14:20:00" url="https://booking.cineworld.co.uk/booking/8018/127936" audioType="audio described"/>
                    <show time="2019-05-09T16:30:00" url="https://booking.cineworld.co.uk/booking/8018/127995" audioType="audio described"/>
                    <show time="2019-05-09T18:30:00" url="https://booking.cineworld.co.uk/booking/8018/127939" audioType="audio described"/>
                    <show time="2019-05-09T19:30:00" url="https://booking.cineworld.co.uk/booking/8018/127976" audioType="audio described"/>
                    <show time="2019-05-09T20:30:00" url="https://booking.cineworld.co.uk/booking/8018/127998" audioType="audio described"/>
                </shows>
            </film>
            <film title="Beats" rating="18" url="films/beats" edi="264080" release="09/05/2019">
                <shows>
                    <show time="2019-05-09T20:00:00" url="https://booking.cineworld.co.uk/booking/8018/127843"/>
                </shows>
            </film>
            <film title="Beats" rating="18" url="films/beats" edi="264080" release="17/05/2019">
                <shows>
                    <show time="2019-05-09T20:00:00" url="https://booking.cineworld.co.uk/booking/8018/127843"/>
                </shows>
            </film>
            <film title="Beats : Unlimited Screening" rating="18" url="films/beats-unlimited-screening" edi="801824" release="08/05/2019">
                <shows>
                    <show time="2019-05-08T20:00:00" url="https://booking.cineworld.co.uk/booking/8018/127660" audioType="audio described"/>
                </shows>
            </film>
            <film title="Bolshoi Ballet 2019 : Carmen Suite / Petrushka" rating="12A" url="films/bolshoi-ballet-2019-carmen-suite-petrushka" edi="251616" release="19/05/2019">
                <shows>
                    <show time="2019-05-19T16:00:00" url="https://booking.cineworld.co.uk/booking/8018/110528"/>
                </shows>
            </film>
            <film title="Booksmart: Unlimited Screening" rating="15" url="films/booksmart-unlimited-screening" edi="801833" release="06/05/2019">
                <shows>
                    <show time="2019-05-06T19:45:00" url="https://booking.cineworld.co.uk/booking/8018/127846" audioType="audio described"/>
                </shows>
            </film>
            <film title="Dr Strangelove (Or How I Learned To Stop...) [GCF]" rating="PG" url="films/dr-strangelove-or-how-i-learned-to-stop-worrying-and-love-the-bomb" edi="445976" release="20/05/2019">
                <shows>
                    <show time="2019-05-20T20:00:00" url="https://booking.cineworld.co.uk/booking/8018/128121"/>
                </shows>
            </film>
            <film title="Dumbo" rating="PG" url="films/dumbo" edi="192491" release="29/03/2019">
                <shows>
                    <show time="2019-05-06T10:10:00" url="https://booking.cineworld.co.uk/booking/8018/128063" audioType="audio described"/>
                    <show time="2019-05-06T12:50:00" url="https://booking.cineworld.co.uk/booking/8018/128064" audioType="audio described"/>
                </shows>
            </film>
            <film title="Everybody's Talking About Jamie Encore" rating="12A" url="films/everybodys-talking-about-jamie-encore" edi="249936" release="13/06/2019">
                <shows>
                    <show time="2019-06-13T19:00:00" url="https://booking.cineworld.co.uk/booking/8018/127370"/>
                </shows>
            </film>
            <film title="Greta" rating="15" url="films/greta" edi="245161" release="18/04/2019">
                <shows>
                    <show time="2019-05-07T10:30:00" url="https://booking.cineworld.co.uk/booking/8018/127984" audioType="audio described"/>
                    <show time="2019-05-07T13:00:00" url="https://booking.cineworld.co.uk/booking/8018/127985" audioType="audio described"/>
                    <show time="2019-05-07T15:30:00" url="https://booking.cineworld.co.uk/booking/8018/127986" audioType="audio described"/>
                    <show time="2019-05-08T12:20:00" url="https://booking.cineworld.co.uk/booking/8018/128020" audioType="audio described"/>
                    <show time="2019-05-08T14:50:00" url="https://booking.cineworld.co.uk/booking/8018/128021" audioType="audio described"/>
                    <show time="2019-05-08T17:20:00" url="https://booking.cineworld.co.uk/booking/8018/128018" audioType="audio described"/>
                    <show time="2019-05-09T12:20:00" url="https://booking.cineworld.co.uk/booking/8018/128022" audioType="audio described"/>
                    <show time="2019-05-09T14:50:00" url="https://booking.cineworld.co.uk/booking/8018/128023" audioType="audio described"/>
                    <show time="2019-05-09T17:20:00" url="https://booking.cineworld.co.uk/booking/8018/128019" audioType="audio described"/>
                </shows>
            </film>
            <film title="M4J How To Train Your Dragon: The Hidden World" rating="PG" url="films/how-to-train-your-dragon-the-hidden-world-movies-for-juniors" edi="801822" release="01/02/2019">
                <shows>
                    <show time="2019-05-06T10:00:00" url="https://booking.cineworld.co.uk/booking/8018/128105" audioType="audio described"/>
                    <show time="2019-05-07T10:10:00" url="https://booking.cineworld.co.uk/booking/8018/128144" audioType="audio described"/>
                </shows>
            </film>
            <film title="Liam Gallagher: As It Was + Live Performance" rating="TBC" url="films/liam-gallagher-as-it-was-live-performance" edi="274849" release="06/06/2019">
                <shows>
                    <show time="2019-06-06T19:30:00" url="https://booking.cineworld.co.uk/booking/8018/128146"/>
                </shows>
            </film>
            <film title="Long Shot" rating="15" url="films/long-shot" edi="240058" release="03/05/2019">
                <shows>
                    <show time="2019-05-06T11:50:00" url="https://booking.cineworld.co.uk/booking/8018/127911" audioType="audio described"/>
                    <show time="2019-05-06T14:40:00" url="https://booking.cineworld.co.uk/booking/8018/127912" audioType="audio described"/>
                    <show time="2019-05-06T17:30:00" url="https://booking.cineworld.co.uk/booking/8018/127913" audioType="audio described" subtitled="true"/>
                    <show time="2019-05-06T20:50:00" url="https://booking.cineworld.co.uk/booking/8018/128065" audioType="audio described"/>
                    <show time="2019-05-07T11:50:00" url="https://booking.cineworld.co.uk/booking/8018/127897" audioType="audio described"/>
                    <show time="2019-05-07T14:40:00" url="https://booking.cineworld.co.uk/booking/8018/127898" audioType="audio described"/>
                    <show time="2019-05-07T17:50:00" url="https://booking.cineworld.co.uk/booking/8018/127916" audioType="audio described"/>
                    <show time="2019-05-07T20:40:00" url="https://booking.cineworld.co.uk/booking/8018/127917" audioType="audio described"/>
                    <show time="2019-05-08T11:50:00" url="https://booking.cineworld.co.uk/booking/8018/127899" audioType="audio described"/>
                    <show time="2019-05-08T14:40:00" url="https://booking.cineworld.co.uk/booking/8018/127900" audioType="audio described"/>
                    <show time="2019-05-08T17:50:00" url="https://booking.cineworld.co.uk/booking/8018/127918" audioType="audio described"/>
                    <show time="2019-05-08T20:40:00" url="https://booking.cineworld.co.uk/booking/8018/127919" audioType="audio described"/>
                    <show time="2019-05-09T11:50:00" url="https://booking.cineworld.co.uk/booking/8018/127901" audioType="audio described"/>
                    <show time="2019-05-09T14:40:00" url="https://booking.cineworld.co.uk/booking/8018/127902" audioType="audio described"/>
                    <show time="2019-05-09T17:50:00" url="https://booking.cineworld.co.uk/booking/8018/127920" audioType="audio described"/>
                    <show time="2019-05-09T20:40:00" url="https://booking.cineworld.co.uk/booking/8018/127921" audioType="audio described"/>
                </shows>
            </film>
            <film title="Margaret Atwood : Live In Cinemas" rating="12A" url="films/margaret-atwood-live-in-cinemas" edi="272858" release="10/09/2019">
                <shows>
                    <show time="2019-09-10T19:30:00" url="https://booking.cineworld.co.uk/booking/8018/125961"/>
                </shows>
            </film>
            <film title="Matthew Bourne's Swan Lake (2019)" rating="PG" url="films/matthew-bournes-swan-lake" edi="269440" release="21/05/2019">
                <shows>
                    <show time="2019-05-21T15:45:00" url="https://booking.cineworld.co.uk/booking/8018/124301"/>
                    <show time="2019-05-21T18:30:00" url="https://booking.cineworld.co.uk/booking/8018/124302"/>
                </shows>
            </film>
            <film title="MET Opera 2019 Dialogues Des Carmelites" rating="12A" url="films/met-opera-2019-dialogues-des-carmelites" edi="249481" release="11/05/2019">
                <shows>
                    <show time="2019-05-11T17:00:00" url="https://booking.cineworld.co.uk/booking/8018/117706"/>
                </shows>
            </film>
            <film title="NT Live: All My Sons" rating="12A" url="films/nt-live-all-my-sons" edi="263592" release="14/05/2019">
                <shows>
                    <show time="2019-05-14T19:00:00" url="https://booking.cineworld.co.uk/booking/8018/121588"/>
                </shows>
            </film>
            <film title="NT Live : One Man, Two Guvnors (Encore)" rating="12A" url="films/nt-live-one-man-two-guvnors-encore" edi="266343" release="26/09/2019">
                <shows>
                    <show time="2019-09-26T19:00:00" url="https://booking.cineworld.co.uk/booking/8018/127374"/>
                </shows>
            </film>
            <film title="NT Live : Small Island" rating="12A" url="films/nt-live-small-island" edi="270872" release="27/06/2019">
                <shows>
                    <show time="2019-06-27T19:00:00" url="https://booking.cineworld.co.uk/booking/8018/123905"/>
                </shows>
            </film>
            <film title="NT Live : The Lehman Trilogy" rating="12A" url="films/nt-live-the-lehman-trilogy" edi="266345" release="25/07/2019">
                <shows>
                    <show time="2019-07-25T19:00:00" url="https://booking.cineworld.co.uk/booking/8018/127373"/>
                </shows>
            </film>
            <film title="Pavarotti plus Q&amp;A" rating="TBC" url="films/pavarotti-plus-qa" edi="801820" release="13/07/2019">
                <shows>
                    <show time="2019-07-13T19:00:00" url="https://booking.cineworld.co.uk/booking/8018/128118"/>
                </shows>
            </film>
            <film title="Paw Patrol: Mighty Pups - The Movie" rating="TBC" url="films/paw-patrol-mighty-pups" edi="261550" release="17/05/2019">
                <shows>
                    <show time="2019-05-17T16:00:00" url="https://booking.cineworld.co.uk/booking/8018/127378" audioType="audio described"/>
                    <show time="2019-05-18T10:30:00" url="https://booking.cineworld.co.uk/booking/8018/127379" audioType="audio described"/>
                    <show time="2019-05-18T12:20:00" url="https://booking.cineworld.co.uk/booking/8018/127380" audioType="audio described"/>
                    <show time="2019-05-18T14:10:00" url="https://booking.cineworld.co.uk/booking/8018/127381" audioType="audio described"/>
                    <show time="2019-05-18T16:00:00" url="https://booking.cineworld.co.uk/booking/8018/127382" audioType="audio described"/>
                    <show time="2019-05-19T10:30:00" url="https://booking.cineworld.co.uk/booking/8018/127383" audioType="audio described"/>
                    <show time="2019-05-19T12:20:00" url="https://booking.cineworld.co.uk/booking/8018/127384" audioType="audio described"/>
                    <show time="2019-05-19T14:10:00" url="https://booking.cineworld.co.uk/booking/8018/127385" audioType="audio described"/>
                    <show time="2019-05-19T16:00:00" url="https://booking.cineworld.co.uk/booking/8018/127386" audioType="audio described"/>
                </shows>
            </film>
            <film title="Peppa Pig: Festival Of Fun" rating="U" url="films/peppa-pig-festival-of-fun" edi="256539" release="05/04/2019">
                <shows>
                    <show time="2019-05-06T10:10:00" url="https://booking.cineworld.co.uk/booking/8018/128110" audioType="audio described"/>
                </shows>
            </film>
            <film title="(2D) Detective Pikachu" rating="PG" url="films/pokemon-detective-pikachu" edi="244991" release="10/05/2019">
                <shows>
                    <show time="2019-05-10T10:30:00" url="https://booking.cineworld.co.uk/booking/8018/128138" audioType="audio described"/>
                    <show time="2019-05-10T13:00:00" url="https://booking.cineworld.co.uk/booking/8018/128139" audioType="audio described"/>
                    <show time="2019-05-10T14:10:00" url="https://booking.cineworld.co.uk/booking/8018/128129" audioType="audio described"/>
                    <show time="2019-05-10T16:50:00" url="https://booking.cineworld.co.uk/booking/8018/128130" audioType="audio described"/>
                    <show time="2019-05-10T19:30:00" url="https://booking.cineworld.co.uk/booking/8018/128131" audioType="audio described"/>
                    <show time="2019-05-11T10:30:00" url="https://booking.cineworld.co.uk/booking/8018/128140" audioType="audio described"/>
                    <show time="2019-05-11T13:00:00" url="https://booking.cineworld.co.uk/booking/8018/128141" audioType="audio described"/>
                    <show time="2019-05-11T14:10:00" url="https://booking.cineworld.co.uk/booking/8018/128132" audioType="audio described"/>
                    <show time="2019-05-11T16:50:00" url="https://booking.cineworld.co.uk/booking/8018/128133" audioType="audio described"/>
                    <show time="2019-05-11T19:30:00" url="https://booking.cineworld.co.uk/booking/8018/128134" audioType="audio described"/>
                    <show time="2019-05-12T10:30:00" url="https://booking.cineworld.co.uk/booking/8018/128142" audioType="audio described"/>
                    <show time="2019-05-12T13:00:00" url="https://booking.cineworld.co.uk/booking/8018/128143" audioType="audio described"/>
                    <show time="2019-05-12T14:10:00" url="https://booking.cineworld.co.uk/booking/8018/128135" audioType="audio described"/>
                    <show time="2019-05-12T19:30:00" url="https://booking.cineworld.co.uk/booking/8018/128137" audioType="audio described"/>
                </shows>
            </film>
            <film title="(4DX 3D) Pokemon Detective Pikachu" rating="PG" url="films/pokemon-detective-pikachu" edi="801828" release="10/05/2019">
                <shows>
                    <show time="2019-05-10T11:40:00" url="https://booking.cineworld.co.uk/booking/8018/128123" videoType="3d" audioType="audio described"/>
                    <show time="2019-05-10T18:10:00" url="https://booking.cineworld.co.uk/booking/8018/128124" videoType="3d" audioType="audio described"/>
                    <show time="2019-05-11T11:40:00" url="https://booking.cineworld.co.uk/booking/8018/128125" videoType="3d" audioType="audio described"/>
                    <show time="2019-05-11T18:10:00" url="https://booking.cineworld.co.uk/booking/8018/128126" videoType="3d" audioType="audio described"/>
                    <show time="2019-05-12T11:40:00" url="https://booking.cineworld.co.uk/booking/8018/128127" videoType="3d" audioType="audio described"/>
                    <show time="2019-05-12T18:10:00" url="https://booking.cineworld.co.uk/booking/8018/128128" videoType="3d" audioType="audio described"/>
                </shows>
            </film>
            <film title="Red Joan" rating="12A" url="films/red-joan" edi="251781" release="19/04/2019">
                <shows>
                    <show time="2019-05-06T15:40:00" url="https://booking.cineworld.co.uk/booking/8018/128069" audioType="audio described"/>
                    <show time="2019-05-07T10:40:00" url="https://booking.cineworld.co.uk/booking/8018/127953" audioType="audio described"/>
                    <show time="2019-05-07T13:10:00" url="https://booking.cineworld.co.uk/booking/8018/127954" audioType="audio described"/>
                    <show time="2019-05-07T15:40:00" url="https://booking.cineworld.co.uk/booking/8018/127955" audioType="audio described"/>
                    <show time="2019-05-07T20:50:00" url="https://booking.cineworld.co.uk/booking/8018/127956" audioType="audio described"/>
                    <show time="2019-05-08T10:40:00" url="https://booking.cineworld.co.uk/booking/8018/127957" audioType="audio described"/>
                    <show time="2019-05-08T13:10:00" url="https://booking.cineworld.co.uk/booking/8018/127958" audioType="audio described"/>
                    <show time="2019-05-08T15:40:00" url="https://booking.cineworld.co.uk/booking/8018/127959" audioType="audio described"/>
                    <show time="2019-05-08T20:50:00" url="https://booking.cineworld.co.uk/booking/8018/127960" audioType="audio described"/>
                    <show time="2019-05-09T13:10:00" url="https://booking.cineworld.co.uk/booking/8018/128071" audioType="audio described"/>
                    <show time="2019-05-09T15:40:00" url="https://booking.cineworld.co.uk/booking/8018/128072" audioType="audio described"/>
                    <show time="2019-05-09T20:50:00" url="https://booking.cineworld.co.uk/booking/8018/128070" audioType="audio described"/>
                </shows>
            </film>
            <film title="ROH Royal Ballet Live 2019 Romeo And Juliet" rating="12A" url="films/roh-royal-ballet-live-2019-romeo-and-juliet" edi="252213" release="11/06/2019">
                <shows>
                    <show time="2019-06-11T19:15:00" url="https://booking.cineworld.co.uk/booking/8018/110854"/>
                </shows>
            </film>
            <film title="ROH Royal Ballet Live 2019 Triple Bill" rating="12A" url="films/roh-royal-ballet-live-2019-triple-bill" edi="252209" release="16/05/2019">
                <shows>
                    <show time="2019-05-16T19:00:00" url="https://booking.cineworld.co.uk/booking/8018/110853"/>
                </shows>
            </film>
            <film title="RSC Live : Measure For Measure" rating="12A" url="films/rsc-live-measure-for-measure" edi="263087" release="31/07/2019">
                <shows>
                    <show time="2019-07-31T19:00:00" url="https://booking.cineworld.co.uk/booking/8018/119753"/>
                </shows>
            </film>
            <film title="RSC Live : The Taming Of The Shrew" rating="12A" url="films/rsc-live-the-taming-of-the-shrew" edi="263085" release="05/06/2019">
                <shows>
                    <show time="2019-06-05T19:00:00" url="https://booking.cineworld.co.uk/booking/8018/119752"/>
                </shows>
            </film>
            <film title="Saving Private Ryan (D-Day 75th Anniversary)" rating="15" url="films/saving-private-ryan-d-day-75th-anniversary" edi="275478" release="06/06/2019">
                <shows>
                    <show time="2019-06-06T19:30:00" url="https://booking.cineworld.co.uk/booking/8018/128122" audioType="audio described"/>
                </shows>
            </film>
            <film title="M4J Spider-Man: Into The Spider-Verse" rating="PG" url="films/spider-man-into-the-spider-verse-movies-for-juniors" edi="801735" release="15/02/2019">
                <shows>
                    <show time="2019-05-06T10:30:00" url="https://booking.cineworld.co.uk/booking/8018/127989" audioType="audio described"/>
                </shows>
            </film>
            <film title="Take That - Greatest Hits Live" rating="12A" url="films/take-that-greatest-hits-live" edi="270195" release="08/06/2019">
                <shows>
                    <show time="2019-06-08T20:00:00" url="https://booking.cineworld.co.uk/booking/8018/128120"/>
                    <show time="2019-06-08T20:00:00" url="https://booking.cineworld.co.uk/booking/8018/125986"/>
                </shows>
            </film>
            <film title="The Curse Of La Llorona" rating="15" url="films/the-curse-of-la-llorona" edi="250922" release="03/05/2019">
                <shows>
                    <show time="2019-05-06T11:30:00" url="https://booking.cineworld.co.uk/booking/8018/128032" audioType="audio described"/>
                    <show time="2019-05-06T14:00:00" url="https://booking.cineworld.co.uk/booking/8018/128033" audioType="audio described"/>
                    <show time="2019-05-06T16:20:00" url="https://booking.cineworld.co.uk/booking/8018/128034" audioType="audio described"/>
                    <show time="2019-05-06T18:40:00" url="https://booking.cineworld.co.uk/booking/8018/128038" audioType="audio described"/>
                    <show time="2019-05-06T21:00:00" url="https://booking.cineworld.co.uk/booking/8018/128035" audioType="audio described"/>
                    <show time="2019-05-07T11:40:00" url="https://booking.cineworld.co.uk/booking/8018/128050" audioType="audio described"/>
                    <show time="2019-05-07T14:00:00" url="https://booking.cineworld.co.uk/booking/8018/128051" audioType="audio described"/>
                    <show time="2019-05-07T16:20:00" url="https://booking.cineworld.co.uk/booking/8018/128052" audioType="audio described"/>
                    <show time="2019-05-07T18:40:00" url="https://booking.cineworld.co.uk/booking/8018/128041" audioType="audio described"/>
                    <show time="2019-05-07T21:00:00" url="https://booking.cineworld.co.uk/booking/8018/128042" audioType="audio described"/>
                    <show time="2019-05-08T11:40:00" url="https://booking.cineworld.co.uk/booking/8018/128053" audioType="audio described"/>
                    <show time="2019-05-08T14:00:00" url="https://booking.cineworld.co.uk/booking/8018/128054" audioType="audio described"/>
                    <show time="2019-05-08T16:20:00" url="https://booking.cineworld.co.uk/booking/8018/128055" audioType="audio described"/>
                    <show time="2019-05-08T18:40:00" url="https://booking.cineworld.co.uk/booking/8018/128043" audioType="audio described"/>
                    <show time="2019-05-08T21:00:00" url="https://booking.cineworld.co.uk/booking/8018/128044" audioType="audio described"/>
                    <show time="2019-05-09T11:40:00" url="https://booking.cineworld.co.uk/booking/8018/128056" audioType="audio described"/>
                    <show time="2019-05-09T14:00:00" url="https://booking.cineworld.co.uk/booking/8018/128057" audioType="audio described"/>
                    <show time="2019-05-09T16:20:00" url="https://booking.cineworld.co.uk/booking/8018/128058" audioType="audio described"/>
                    <show time="2019-05-09T18:40:00" url="https://booking.cineworld.co.uk/booking/8018/128045" audioType="audio described"/>
                    <show time="2019-05-09T21:00:00" url="https://booking.cineworld.co.uk/booking/8018/128046" audioType="audio described"/>
                </shows>
            </film>
            <film title="The Merry Wives Of Windsor Live from Shakespeare G" rating="12A" url="films/the-merry-wives-of-windsor-live-from-shakespeares-globe" edi="268829" release="20/06/2019">
                <shows>
                    <show time="2019-06-20T19:20:00" url="https://booking.cineworld.co.uk/booking/8018/124305"/>
                </shows>
            </film>
            <film title="The Secret Life Of Pets 2" rating="U" url="films/the-secret-life-of-pets-2" edi="192838" release="24/05/2019">
                <shows>
                    <show time="2019-05-24T12:15:00" url="https://booking.cineworld.co.uk/booking/8018/126561" audioType="audio described"/>
                    <show time="2019-05-24T14:30:00" url="https://booking.cineworld.co.uk/booking/8018/126562" audioType="audio described"/>
                    <show time="2019-05-24T16:45:00" url="https://booking.cineworld.co.uk/booking/8018/126563" audioType="audio described"/>
                    <show time="2019-05-25T10:00:00" url="https://booking.cineworld.co.uk/booking/8018/126564" audioType="audio described"/>
                    <show time="2019-05-25T12:15:00" url="https://booking.cineworld.co.uk/booking/8018/126565" audioType="audio described"/>
                    <show time="2019-05-25T14:30:00" url="https://booking.cineworld.co.uk/booking/8018/126566" audioType="audio described"/>
                    <show time="2019-05-25T16:45:00" url="https://booking.cineworld.co.uk/booking/8018/126567" audioType="audio described"/>
                    <show time="2019-05-26T10:00:00" url="https://booking.cineworld.co.uk/booking/8018/126568" audioType="audio described"/>
                    <show time="2019-05-26T12:15:00" url="https://booking.cineworld.co.uk/booking/8018/126569" audioType="audio described"/>
                    <show time="2019-05-26T14:30:00" url="https://booking.cineworld.co.uk/booking/8018/126570" audioType="audio described"/>
                    <show time="2019-05-26T16:45:00" url="https://booking.cineworld.co.uk/booking/8018/126571" audioType="audio described"/>
                    <show time="2019-05-27T10:00:00" url="https://booking.cineworld.co.uk/booking/8018/126572" audioType="audio described"/>
                    <show time="2019-05-27T12:15:00" url="https://booking.cineworld.co.uk/booking/8018/126573" audioType="audio described"/>
                    <show time="2019-05-27T14:30:00" url="https://booking.cineworld.co.uk/booking/8018/126574" audioType="audio described"/>
                    <show time="2019-05-27T16:45:00" url="https://booking.cineworld.co.uk/booking/8018/126575" audioType="audio described"/>
                    <show time="2019-05-28T12:15:00" url="https://booking.cineworld.co.uk/booking/8018/126576" audioType="audio described"/>
                    <show time="2019-05-28T14:30:00" url="https://booking.cineworld.co.uk/booking/8018/126577" audioType="audio described"/>
                    <show time="2019-05-28T16:45:00" url="https://booking.cineworld.co.uk/booking/8018/126578" audioType="audio described"/>
                </shows>
            </film>
            <film title="Tolkien" rating="12A" url="films/tolkien" edi="271425" release="03/05/2019">
                <shows>
                    <show time="2019-05-06T11:40:00" url="https://booking.cineworld.co.uk/booking/8018/127961" audioType="audio described"/>
                    <show time="2019-05-06T14:30:00" url="https://booking.cineworld.co.uk/booking/8018/127962" audioType="audio described"/>
                    <show time="2019-05-06T17:10:00" url="https://booking.cineworld.co.uk/booking/8018/127963" audioType="audio described"/>
                    <show time="2019-05-06T20:20:00" url="https://booking.cineworld.co.uk/booking/8018/127894" audioType="audio described"/>
                    <show time="2019-05-07T12:10:00" url="https://booking.cineworld.co.uk/booking/8018/128094" audioType="audio described"/>
                    <show time="2019-05-07T14:50:00" url="https://booking.cineworld.co.uk/booking/8018/128095" audioType="audio described"/>
                    <show time="2019-05-07T17:30:00" url="https://booking.cineworld.co.uk/booking/8018/128088" audioType="audio described"/>
                    <show time="2019-05-07T20:10:00" url="https://booking.cineworld.co.uk/booking/8018/128089" audioType="audio described"/>
                    <show time="2019-05-08T10:00:00" url="https://booking.cineworld.co.uk/booking/8018/128098" audioType="audio described"/>
                    <show time="2019-05-08T12:10:00" url="https://booking.cineworld.co.uk/booking/8018/128096" audioType="audio described"/>
                    <show time="2019-05-08T14:50:00" url="https://booking.cineworld.co.uk/booking/8018/128097" audioType="audio described"/>
                    <show time="2019-05-08T17:30:00" url="https://booking.cineworld.co.uk/booking/8018/128090" audioType="audio described"/>
                    <show time="2019-05-08T20:10:00" url="https://booking.cineworld.co.uk/booking/8018/128091" audioType="audio described"/>
                    <show time="2019-05-09T12:10:00" url="https://booking.cineworld.co.uk/booking/8018/127966" audioType="audio described"/>
                    <show time="2019-05-09T14:50:00" url="https://booking.cineworld.co.uk/booking/8018/127967" audioType="audio described"/>
                    <show time="2019-05-09T17:30:00" url="https://booking.cineworld.co.uk/booking/8018/127964" audioType="audio described"/>
                    <show time="2019-05-09T20:10:00" url="https://booking.cineworld.co.uk/booking/8018/127965" audioType="audio described"/>
                </shows>
            </film>
            <film title="Victoria - Northern Ballet" rating="PG" url="films/victoria-northern-ballet" edi="270190" release="25/06/2019">
                <shows>
                    <show time="2019-06-25T19:15:00" url="https://booking.cineworld.co.uk/booking/8018/123903"/>
                </shows>
            </film>
            <film title="Westlife : The Twenty Tour Live" rating="12A" url="films/westlife-the-twenty-tour-live-from-croke-park" edi="270186" release="06/07/2019">
                <shows>
                    <show time="2019-07-06T20:00:00" url="https://booking.cineworld.co.uk/booking/8018/127375"/>
                </shows>
            </film>
            <film title="X-Men: Dark Phoenix" rating="TBC" url="films/x-men-dark-phoenix" edi="220087" release="05/06/2019">
                <shows>
                    <show time="2019-06-05T11:15:00" url="https://booking.cineworld.co.uk/booking/8018/127847" audioType="audio described"/>
                    <show time="2019-06-05T14:00:00" url="https://booking.cineworld.co.uk/booking/8018/127848" audioType="audio described"/>
                    <show time="2019-06-05T16:45:00" url="https://booking.cineworld.co.uk/booking/8018/127849" audioType="audio described"/>
                    <show time="2019-06-05T19:30:00" url="https://booking.cineworld.co.uk/booking/8018/127850" audioType="audio described"/>
                    <show time="2019-06-06T11:15:00" url="https://booking.cineworld.co.uk/booking/8018/127851" audioType="audio described"/>
                    <show time="2019-06-06T14:00:00" url="https://booking.cineworld.co.uk/booking/8018/127852" audioType="audio described"/>
                    <show time="2019-06-06T16:45:00" url="https://booking.cineworld.co.uk/booking/8018/127853" audioType="audio described"/>
                    <show time="2019-06-06T19:30:00" url="https://booking.cineworld.co.uk/booking/8018/127854" audioType="audio described"/>
                    <show time="2019-06-07T11:15:00" url="https://booking.cineworld.co.uk/booking/8018/127875" audioType="audio described"/>
                    <show time="2019-06-07T14:00:00" url="https://booking.cineworld.co.uk/booking/8018/127876" audioType="audio described"/>
                    <show time="2019-06-07T16:45:00" url="https://booking.cineworld.co.uk/booking/8018/127877" audioType="audio described"/>
                    <show time="2019-06-07T19:30:00" url="https://booking.cineworld.co.uk/booking/8018/127878" audioType="audio described"/>
                    <show time="2019-06-08T11:15:00" url="https://booking.cineworld.co.uk/booking/8018/127883" audioType="audio described"/>
                    <show time="2019-06-08T14:00:00" url="https://booking.cineworld.co.uk/booking/8018/127884" audioType="audio described"/>
                    <show time="2019-06-08T16:45:00" url="https://booking.cineworld.co.uk/booking/8018/127885" audioType="audio described"/>
                    <show time="2019-06-08T19:30:00" url="https://booking.cineworld.co.uk/booking/8018/127886" audioType="audio described"/>
                    <show time="2019-06-09T11:15:00" url="https://booking.cineworld.co.uk/booking/8018/127879" audioType="audio described"/>
                    <show time="2019-06-09T14:00:00" url="https://booking.cineworld.co.uk/booking/8018/127880" audioType="audio described"/>
                    <show time="2019-06-09T16:45:00" url="https://booking.cineworld.co.uk/booking/8018/127881" audioType="audio described"/>
                    <show time="2019-06-09T19:30:00" url="https://booking.cineworld.co.uk/booking/8018/127882" audioType="audio described"/>
                </shows>
            </film>
            <film title="(4DX 3D) X-Men: Dark Phoenix" rating="TBC" url="films/x-men-dark-phoenix" edi="801831" release="05/06/2019">
                <shows>
                    <show time="2019-06-05T12:30:00" url="https://booking.cineworld.co.uk/booking/8018/127855" videoType="3d" audioType="audio described"/>
                    <show time="2019-06-05T15:15:00" url="https://booking.cineworld.co.uk/booking/8018/127856" videoType="3d" audioType="audio described"/>
                    <show time="2019-06-05T18:00:00" url="https://booking.cineworld.co.uk/booking/8018/127857" videoType="3d" audioType="audio described"/>
                    <show time="2019-06-05T20:45:00" url="https://booking.cineworld.co.uk/booking/8018/127858" videoType="3d" audioType="audio described"/>
                    <show time="2019-06-06T12:30:00" url="https://booking.cineworld.co.uk/booking/8018/127859" videoType="3d" audioType="audio described"/>
                    <show time="2019-06-06T15:15:00" url="https://booking.cineworld.co.uk/booking/8018/127860" videoType="3d" audioType="audio described"/>
                    <show time="2019-06-06T18:00:00" url="https://booking.cineworld.co.uk/booking/8018/127861" videoType="3d" audioType="audio described"/>
                    <show time="2019-06-06T20:45:00" url="https://booking.cineworld.co.uk/booking/8018/127862" videoType="3d" audioType="audio described"/>
                    <show time="2019-06-07T12:30:00" url="https://booking.cineworld.co.uk/booking/8018/127863" videoType="3d" audioType="audio described"/>
                    <show time="2019-06-07T15:15:00" url="https://booking.cineworld.co.uk/booking/8018/127864" videoType="3d" audioType="audio described"/>
                    <show time="2019-06-07T18:00:00" url="https://booking.cineworld.co.uk/booking/8018/127865" videoType="3d" audioType="audio described"/>
                    <show time="2019-06-07T20:45:00" url="https://booking.cineworld.co.uk/booking/8018/127866" videoType="3d" audioType="audio described"/>
                    <show time="2019-06-08T12:30:00" url="https://booking.cineworld.co.uk/booking/8018/127867" videoType="3d" audioType="audio described"/>
                    <show time="2019-06-08T15:15:00" url="https://booking.cineworld.co.uk/booking/8018/127868" videoType="3d" audioType="audio described"/>
                    <show time="2019-06-08T18:00:00" url="https://booking.cineworld.co.uk/booking/8018/127869" videoType="3d" audioType="audio described"/>
                    <show time="2019-06-08T20:45:00" url="https://booking.cineworld.co.uk/booking/8018/127870" videoType="3d" audioType="audio described"/>
                    <show time="2019-06-09T12:30:00" url="https://booking.cineworld.co.uk/booking/8018/127871" videoType="3d" audioType="audio described"/>
                    <show time="2019-06-09T15:15:00" url="https://booking.cineworld.co.uk/booking/8018/127872" videoType="3d" audioType="audio described"/>
                    <show time="2019-06-09T18:00:00" url="https://booking.cineworld.co.uk/booking/8018/127873" videoType="3d" audioType="audio described"/>
                    <show time="2019-06-09T20:45:00" url="https://booking.cineworld.co.uk/booking/8018/127874" videoType="3d" audioType="audio described"/>
                </shows>
            </film>
        </listing>
    </cinema>
    <cinema name="Cineworld Aldershot" root="http://www1.cineworld.co.uk/" url="cinemas/aldershot" id="87" phone="0871 200 2000" address="Westgate, Aldershot" postcode="GU11 1WG">
        <listing>
            <film title="A Dog's Journey" rating="PG" url="films/a-dogs-journey" edi="255103" release="03/05/2019">
                <shows>
                    <show time="2019-05-06T12:00:00" url="https://booking.cineworld.co.uk/booking/8015/79544" audioType="audio described"/>
                    <show time="2019-05-06T14:40:00" url="https://booking.cineworld.co.uk/booking/8015/79545" audioType="audio described"/>
                    <show time="2019-05-06T17:10:00" url="https://booking.cineworld.co.uk/booking/8015/79546" audioType="audio described"/>
                    <show time="2019-05-07T12:00:00" url="https://booking.cineworld.co.uk/booking/8015/79529" audioType="audio described"/>
                    <show time="2019-05-07T14:40:00" url="https://booking.cineworld.co.uk/booking/8015/79530" audioType="audio described"/>
                    <show time="2019-05-07T17:10:00" url="https://booking.cineworld.co.uk/booking/8015/79531" audioType="audio described"/>
                    <show time="2019-05-08T12:00:00" url="https://booking.cineworld.co.uk/booking/8015/79580" audioType="audio described"/>
                    <show time="2019-05-08T14:40:00" url="https://booking.cineworld.co.uk/booking/8015/79581" audioType="audio described"/>
                    <show time="2019-05-08T17:10:00" url="https://booking.cineworld.co.uk/booking/8015/79582" audioType="audio described"/>
                    <show time="2019-05-09T12:00:00" url="https://booking.cineworld.co.uk/booking/8015/79532" audioType="audio described"/>
                    <show time="2019-05-09T14:40:00" url="https://booking.cineworld.co.uk/booking/8015/79533" audioType="audio described"/>
                    <show time="2019-05-09T17:10:00" url="https://booking.cineworld.co.uk/booking/8015/79534" audioType="audio described"/>
                </shows>
            </film>
            <film title="Andre Rieu 2019 Maastricht Concert Shall We Dance?" rating="PG" url="films/andre-rieu-2019-maastricht-concert-shall-we-dance" edi="255443" release="27/07/2019">
                <shows>
                    <show time="2019-07-27T19:00:00" url="https://booking.cineworld.co.uk/booking/8015/76841"/>
                    <show time="2019-07-28T15:00:00" url="https://booking.cineworld.co.uk/booking/8015/76842"/>
                </shows>
            </film>
            <film title="Autism Friendly Screening: Missing Link" rating="PG" url="films/autism-friendly-screening-missing-link" edi="801813" release="15/04/2019">
                <shows>
                    <show time="2019-05-15T11:00:00" url="https://booking.cineworld.co.uk/booking/8015/78857"/>
                </shows>
            </film>
            <film title="Autism Friendly Screening: Secret Life Of Pets 2" rating="U" url="films/autism-friendly-screening-secret-life-of-pets-2" edi="801857" release="02/06/2019">
                <shows>
                    <show time="2019-06-02T11:00:00" url="https://booking.cineworld.co.uk/booking/8015/79620"/>
                </shows>
            </film>
            <film title="(3D) Avengers: Endgame" rating="12A" url="films/avengers-endgame" edi="174256" release="25/04/2019">
                <shows>
                    <show time="2019-05-07T19:45:00" url="https://booking.cineworld.co.uk/booking/8015/79518" videoType="3d" audioType="audio described"/>
                    <show time="2019-05-09T19:45:00" url="https://booking.cineworld.co.uk/booking/8015/79519" videoType="3d" audioType="audio described"/>
                </shows>
            </film>
            <film title="(2D) Avengers: Endgame" rating="12A" url="films/avengers-endgame" edi="169126" release="25/04/2019">
                <shows>
                    <show time="2019-05-06T10:00:00" url="https://booking.cineworld.co.uk/booking/8015/79346" audioType="audio described"/>
                    <show time="2019-05-06T11:00:00" url="https://booking.cineworld.co.uk/booking/8015/79337" audioType="audio described"/>
                    <show time="2019-05-06T12:30:00" url="https://booking.cineworld.co.uk/booking/8015/79328" audioType="audio described"/>
                    <show time="2019-05-06T12:30:00" url="https://booking.cineworld.co.uk/booking/8015/79328" audioType="audio described" sessionType="dbox"/>
                    <show time="2019-05-06T14:00:00" url="https://booking.cineworld.co.uk/booking/8015/79347" audioType="audio described"/>
                    <show time="2019-05-06T14:10:00" url="https://booking.cineworld.co.uk/booking/8015/79623" audioType="audio described"/>
                    <show time="2019-05-06T15:00:00" url="https://booking.cineworld.co.uk/booking/8015/79338" audioType="audio described"/>
                    <show time="2019-05-06T16:30:00" url="https://booking.cineworld.co.uk/booking/8015/79329" audioType="audio described"/>
                    <show time="2019-05-06T16:30:00" url="https://booking.cineworld.co.uk/booking/8015/79329" audioType="audio described" sessionType="dbox"/>
                    <show time="2019-05-06T18:00:00" url="https://booking.cineworld.co.uk/booking/8015/79348" audioType="audio described"/>
                    <show time="2019-05-06T19:00:00" url="https://booking.cineworld.co.uk/booking/8015/79339" audioType="audio described"/>
                    <show time="2019-05-06T20:30:00" url="https://booking.cineworld.co.uk/booking/8015/79330" audioType="audio described"/>
                    <show time="2019-05-06T20:30:00" url="https://booking.cineworld.co.uk/booking/8015/79330" audioType="audio described" sessionType="dbox"/>
                    <show time="2019-05-07T11:00:00" url="https://booking.cineworld.co.uk/booking/8015/79586" audioType="audio described"/>
                    <show time="2019-05-07T12:30:00" url="https://booking.cineworld.co.uk/booking/8015/79595" audioType="audio described"/>
                    <show time="2019-05-07T12:30:00" url="https://booking.cineworld.co.uk/booking/8015/79595" audioType="audio described" sessionType="dbox"/>
                    <show time="2019-05-07T14:00:00" url="https://booking.cineworld.co.uk/booking/8015/79576" audioType="audio described"/>
                    <show time="2019-05-07T15:00:00" url="https://booking.cineworld.co.uk/booking/8015/79587" audioType="audio described"/>
                    <show time="2019-05-07T16:30:00" url="https://booking.cineworld.co.uk/booking/8015/79596" audioType="audio described"/>
                    <show time="2019-05-07T16:30:00" url="https://booking.cineworld.co.uk/booking/8015/79596" audioType="audio described" sessionType="dbox"/>
                    <show time="2019-05-07T18:00:00" url="https://booking.cineworld.co.uk/booking/8015/79577" audioType="audio described"/>
                    <show time="2019-05-07T19:00:00" url="https://booking.cineworld.co.uk/booking/8015/79588" audioType="audio described"/>
                    <show time="2019-05-07T20:30:00" url="https://booking.cineworld.co.uk/booking/8015/79597" audioType="audio described"/>
                    <show time="2019-05-07T20:30:00" url="https://booking.cineworld.co.uk/booking/8015/79597" audioType="audio described" sessionType="dbox"/>
                    <show time="2019-05-08T11:00:00" url="https://booking.cineworld.co.uk/booking/8015/79589" audioType="audio described"/>
                    <show time="2019-05-08T12:30:00" url="https://booking.cineworld.co.uk/booking/8015/79598" audioType="audio described"/>
                    <show time="2019-05-08T12:30:00" url="https://booking.cineworld.co.uk/booking/8015/79598" audioType="audio described" sessionType="dbox"/>
                    <show time="2019-05-08T14:00:00" url="https://booking.cineworld.co.uk/booking/8015/79516" audioType="audio described"/>
                    <show time="2019-05-08T15:00:00" url="https://booking.cineworld.co.uk/booking/8015/79590" audioType="audio described"/>
                    <show time="2019-05-08T16:30:00" url="https://booking.cineworld.co.uk/booking/8015/79599" audioType="audio described"/>
                    <show time="2019-05-08T16:30:00" url="https://booking.cineworld.co.uk/booking/8015/79599" audioType="audio described" sessionType="dbox"/>
                    <show time="2019-05-08T18:00:00" url="https://booking.cineworld.co.uk/booking/8015/79517" audioType="audio described"/>
                    <show time="2019-05-08T19:00:00" url="https://booking.cineworld.co.uk/booking/8015/79591" audioType="audio described"/>
                    <show time="2019-05-08T20:30:00" url="https://booking.cineworld.co.uk/booking/8015/79600" audioType="audio described"/>
                    <show time="2019-05-08T20:30:00" url="https://booking.cineworld.co.uk/booking/8015/79600" audioType="audio described" sessionType="dbox"/>
                    <show time="2019-05-09T11:00:00" url="https://booking.cineworld.co.uk/booking/8015/79592" audioType="audio described"/>
                    <show time="2019-05-09T12:30:00" url="https://booking.cineworld.co.uk/booking/8015/79601" audioType="audio described"/>
                    <show time="2019-05-09T12:30:00" url="https://booking.cineworld.co.uk/booking/8015/79601" audioType="audio described" sessionType="dbox"/>
                    <show time="2019-05-09T14:00:00" url="https://booking.cineworld.co.uk/booking/8015/79578" audioType="audio described"/>
                    <show time="2019-05-09T15:00:00" url="https://booking.cineworld.co.uk/booking/8015/79593" audioType="audio described"/>
                    <show time="2019-05-09T16:30:00" url="https://booking.cineworld.co.uk/booking/8015/79602" audioType="audio described"/>
                    <show time="2019-05-09T16:30:00" url="https://booking.cineworld.co.uk/booking/8015/79602" audioType="audio described" sessionType="dbox"/>
                    <show time="2019-05-09T18:00:00" url="https://booking.cineworld.co.uk/booking/8015/79579" audioType="audio described"/>
                    <show time="2019-05-09T19:00:00" url="https://booking.cineworld.co.uk/booking/8015/79594" audioType="audio described"/>
                    <show time="2019-05-09T20:30:00" url="https://booking.cineworld.co.uk/booking/8015/79603" audioType="audio described"/>
                    <show time="2019-05-09T20:30:00" url="https://booking.cineworld.co.uk/booking/8015/79603" audioType="audio described" sessionType="dbox"/>
                </shows>
            </film>
            <film title="Beats : Unlimited Screening" rating="18" url="films/beats-unlimited-screening" edi="801824" release="08/05/2019">
                <shows>
                    <show time="2019-05-08T20:00:00" url="https://booking.cineworld.co.uk/booking/8015/79312" audioType="audio described"/>
                </shows>
            </film>
            <film title="Booksmart: Unlimited Screening" rating="15" url="films/booksmart-unlimited-screening" edi="801833" release="06/05/2019">
                <shows>
                    <show time="2019-05-06T19:45:00" url="https://booking.cineworld.co.uk/booking/8015/79430" audioType="audio described"/>
                </shows>
            </film>
            <film title="Dumbo" rating="PG" url="films/dumbo" edi="192491" release="29/03/2019">
                <shows>
                    <show time="2019-05-06T10:40:00" url="https://booking.cineworld.co.uk/booking/8015/79535" audioType="audio described"/>
                    <show time="2019-05-06T13:20:00" url="https://booking.cineworld.co.uk/booking/8015/79536" audioType="audio described"/>
                    <show time="2019-05-07T13:20:00" url="https://booking.cineworld.co.uk/booking/8015/79550" audioType="audio described"/>
                    <show time="2019-05-08T13:20:00" url="https://booking.cineworld.co.uk/booking/8015/79551" audioType="audio described"/>
                    <show time="2019-05-09T13:20:00" url="https://booking.cineworld.co.uk/booking/8015/79552" audioType="audio described"/>
                </shows>
            </film>
            <film title="Everybody's Talking About Jamie Encore" rating="12A" url="films/everybodys-talking-about-jamie-encore" edi="249936" release="13/06/2019">
                <shows>
                    <show time="2019-06-13T19:00:00" url="https://booking.cineworld.co.uk/booking/8015/79096"/>
                </shows>
            </film>
            <film title="Long Shot" rating="15" url="films/long-shot" edi="240058" release="03/05/2019">
                <shows>
                    <show time="2019-05-06T11:20:00" url="https://booking.cineworld.co.uk/booking/8015/79500" audioType="audio described"/>
                    <show time="2019-05-06T14:20:00" url="https://booking.cineworld.co.uk/booking/8015/79501" audioType="audio described"/>
                    <show time="2019-05-06T17:20:00" url="https://booking.cineworld.co.uk/booking/8015/79502" audioType="audio described"/>
                    <show time="2019-05-06T20:20:00" url="https://booking.cineworld.co.uk/booking/8015/79503" audioType="audio described"/>
                    <show time="2019-05-07T11:20:00" url="https://booking.cineworld.co.uk/booking/8015/79504" audioType="audio described"/>
                    <show time="2019-05-07T14:20:00" url="https://booking.cineworld.co.uk/booking/8015/79505" audioType="audio described"/>
                    <show time="2019-05-07T17:20:00" url="https://booking.cineworld.co.uk/booking/8015/79506" audioType="audio described"/>
                    <show time="2019-05-07T20:20:00" url="https://booking.cineworld.co.uk/booking/8015/79507" audioType="audio described"/>
                    <show time="2019-05-08T11:20:00" url="https://booking.cineworld.co.uk/booking/8015/79508" audioType="audio described"/>
                    <show time="2019-05-08T14:20:00" url="https://booking.cineworld.co.uk/booking/8015/79509" audioType="audio described"/>
                    <show time="2019-05-08T17:20:00" url="https://booking.cineworld.co.uk/booking/8015/79510" audioType="audio described"/>
                    <show time="2019-05-08T20:20:00" url="https://booking.cineworld.co.uk/booking/8015/79511" audioType="audio described"/>
                    <show time="2019-05-09T11:20:00" url="https://booking.cineworld.co.uk/booking/8015/79512" audioType="audio described"/>
                    <show time="2019-05-09T14:20:00" url="https://booking.cineworld.co.uk/booking/8015/79513" audioType="audio described"/>
                    <show time="2019-05-09T17:20:00" url="https://booking.cineworld.co.uk/booking/8015/79514" audioType="audio described"/>
                    <show time="2019-05-09T20:20:00" url="https://booking.cineworld.co.uk/booking/8015/79515" audioType="audio described"/>
                </shows>
            </film>
            <film title="Margaret Atwood : Live In Cinemas" rating="12A" url="films/margaret-atwood-live-in-cinemas" edi="272858" release="10/09/2019">
                <shows>
                    <show time="2019-09-10T19:30:00" url="https://booking.cineworld.co.uk/booking/8015/78083"/>
                </shows>
            </film>
            <film title="Matthew Bourne's Swan Lake (2019)" rating="PG" url="films/matthew-bournes-swan-lake" edi="269440" release="21/05/2019">
                <shows>
                    <show time="2019-05-21T15:45:00" url="https://booking.cineworld.co.uk/booking/8015/77033"/>
                    <show time="2019-05-21T18:30:00" url="https://booking.cineworld.co.uk/booking/8015/77034"/>
                </shows>
            </film>
            <film title="NT Live: All My Sons" rating="12A" url="films/nt-live-all-my-sons" edi="263592" release="14/05/2019">
                <shows>
                    <show time="2019-05-14T19:00:00" url="https://booking.cineworld.co.uk/booking/8015/75400"/>
                </shows>
            </film>
            <film title="NT Live : One Man, Two Guvnors (Encore)" rating="12A" url="films/nt-live-one-man-two-guvnors-encore" edi="266343" release="26/09/2019">
                <shows>
                    <show time="2019-09-26T19:00:00" url="https://booking.cineworld.co.uk/booking/8015/79111"/>
                </shows>
            </film>
            <film title="NT Live : Small Island" rating="12A" url="films/nt-live-small-island" edi="270872" release="27/06/2019">
                <shows>
                    <show time="2019-06-27T19:00:00" url="https://booking.cineworld.co.uk/booking/8015/76826"/>
                </shows>
            </film>
            <film title="NT Live : The Lehman Trilogy" rating="12A" url="films/nt-live-the-lehman-trilogy" edi="266345" release="25/07/2019">
                <shows>
                    <show time="2019-07-25T19:00:00" url="https://booking.cineworld.co.uk/booking/8015/79099"/>
                </shows>
            </film>
            <film title="Pavarotti plus Q&amp;A" rating="TBC" url="films/pavarotti-plus-qa" edi="801820" release="13/07/2019">
                <shows>
                    <show time="2019-07-13T19:00:00" url="https://booking.cineworld.co.uk/booking/8015/79607"/>
                </shows>
            </film>
            <film title="Paw Patrol: Mighty Pups - The Movie" rating="TBC" url="films/paw-patrol-mighty-pups" edi="261550" release="17/05/2019">
                <shows>
                    <show time="2019-05-17T16:00:00" url="https://booking.cineworld.co.uk/booking/8015/79102" audioType="audio described"/>
                    <show time="2019-05-18T10:30:00" url="https://booking.cineworld.co.uk/booking/8015/79103" audioType="audio described"/>
                    <show time="2019-05-18T12:20:00" url="https://booking.cineworld.co.uk/booking/8015/79104" audioType="audio described"/>
                    <show time="2019-05-18T14:10:00" url="https://booking.cineworld.co.uk/booking/8015/79105" audioType="audio described"/>
                    <show time="2019-05-18T16:00:00" url="https://booking.cineworld.co.uk/booking/8015/79109" audioType="audio described"/>
                    <show time="2019-05-19T10:30:00" url="https://booking.cineworld.co.uk/booking/8015/79106" audioType="audio described"/>
                    <show time="2019-05-19T12:20:00" url="https://booking.cineworld.co.uk/booking/8015/79107" audioType="audio described"/>
                    <show time="2019-05-19T14:10:00" url="https://booking.cineworld.co.uk/booking/8015/79108" audioType="audio described"/>
                    <show time="2019-05-19T16:00:00" url="https://booking.cineworld.co.uk/booking/8015/79110" audioType="audio described"/>
                </shows>
            </film>
            <film title="Peppa Pig: Festival Of Fun" rating="U" url="films/peppa-pig-festival-of-fun" edi="256539" release="05/04/2019">
                <shows>
                    <show time="2019-05-06T10:10:00" url="https://booking.cineworld.co.uk/booking/8015/79553" audioType="audio described"/>
                </shows>
            </film>
            <film title="(2D) Detective Pikachu" rating="PG" url="films/pokemon-detective-pikachu" edi="244991" release="10/05/2019">
                <shows>
                    <show time="2019-05-10T11:40:00" url="https://booking.cineworld.co.uk/booking/8015/79608" audioType="audio described"/>
                    <show time="2019-05-10T11:40:00" url="https://booking.cineworld.co.uk/booking/8015/79608" audioType="audio described" sessionType="dbox"/>
                    <show time="2019-05-10T14:20:00" url="https://booking.cineworld.co.uk/booking/8015/79609" audioType="audio described"/>
                    <show time="2019-05-10T14:20:00" url="https://booking.cineworld.co.uk/booking/8015/79609" audioType="audio described" sessionType="dbox"/>
                    <show time="2019-05-10T17:00:00" url="https://booking.cineworld.co.uk/booking/8015/79610" audioType="audio described"/>
                    <show time="2019-05-10T19:40:00" url="https://booking.cineworld.co.uk/booking/8015/79611" audioType="audio described"/>
                    <show time="2019-05-11T11:40:00" url="https://booking.cineworld.co.uk/booking/8015/79612" audioType="audio described"/>
                    <show time="2019-05-11T11:40:00" url="https://booking.cineworld.co.uk/booking/8015/79612" audioType="audio described" sessionType="dbox"/>
                    <show time="2019-05-11T14:20:00" url="https://booking.cineworld.co.uk/booking/8015/79613" audioType="audio described"/>
                    <show time="2019-05-11T17:00:00" url="https://booking.cineworld.co.uk/booking/8015/79614" audioType="audio described"/>
                    <show time="2019-05-11T19:40:00" url="https://booking.cineworld.co.uk/booking/8015/79615" audioType="audio described"/>
                    <show time="2019-05-12T11:40:00" url="https://booking.cineworld.co.uk/booking/8015/79616" audioType="audio described"/>
                    <show time="2019-05-12T14:20:00" url="https://booking.cineworld.co.uk/booking/8015/79617" audioType="audio described" subtitled="true"/>
                    <show time="2019-05-12T14:20:00" url="https://booking.cineworld.co.uk/booking/8015/79617" audioType="audio described" sessionType="dbox" subtitled="true"/>
                    <show time="2019-05-12T17:00:00" url="https://booking.cineworld.co.uk/booking/8015/79618" audioType="audio described"/>
                    <show time="2019-05-12T17:00:00" url="https://booking.cineworld.co.uk/booking/8015/79618" audioType="audio described" sessionType="dbox"/>
                    <show time="2019-05-12T19:40:00" url="https://booking.cineworld.co.uk/booking/8015/79619" audioType="audio described"/>
                    <show time="2019-05-12T19:40:00" url="https://booking.cineworld.co.uk/booking/8015/79619" audioType="audio described" sessionType="dbox"/>
                </shows>
            </film>
            <film title="Red Joan" rating="12A" url="films/red-joan" edi="251781" release="19/04/2019">
                <shows>
                    <show time="2019-05-07T11:30:00" url="https://booking.cineworld.co.uk/booking/8015/79584" audioType="audio described"/>
                    <show time="2019-05-08T11:30:00" url="https://booking.cineworld.co.uk/booking/8015/79539" audioType="audio described"/>
                    <show time="2019-05-09T11:30:00" url="https://booking.cineworld.co.uk/booking/8015/79585" audioType="audio described"/>
                </shows>
            </film>
            <film title="ROH Royal Ballet Live 2019 Romeo And Juliet" rating="12A" url="films/roh-royal-ballet-live-2019-romeo-and-juliet" edi="252213" release="11/06/2019">
                <shows>
                    <show time="2019-06-11T19:15:00" url="https://booking.cineworld.co.uk/booking/8015/68337"/>
                </shows>
            </film>
            <film title="ROH Royal Ballet Live 2019 Triple Bill" rating="12A" url="films/roh-royal-ballet-live-2019-triple-bill" edi="252209" release="16/05/2019">
                <shows>
                    <show time="2019-05-16T19:15:00" url="https://booking.cineworld.co.uk/booking/8015/68336"/>
                </shows>
            </film>
            <film title="RSC Live : Measure For Measure" rating="12A" url="films/rsc-live-measure-for-measure" edi="263087" release="31/07/2019">
                <shows>
                    <show time="2019-07-31T19:00:00" url="https://booking.cineworld.co.uk/booking/8015/74272"/>
                </shows>
            </film>
            <film title="RSC Live : The Taming Of The Shrew" rating="12A" url="films/rsc-live-the-taming-of-the-shrew" edi="263085" release="05/06/2019">
                <shows>
                    <show time="2019-06-05T19:00:00" url="https://booking.cineworld.co.uk/booking/8015/74271"/>
                </shows>
            </film>
            <film title="M4J Spider-Man: Into The Spider-Verse" rating="PG" url="films/spider-man-into-the-spider-verse-movies-for-juniors" edi="801735" release="15/02/2019">
                <shows>
                    <show time="2019-05-06T10:00:00" url="https://booking.cineworld.co.uk/booking/8015/79606" audioType="audio described"/>
                </shows>
            </film>
            <film title="Take That - Greatest Hits Live" rating="12A" url="films/take-that-greatest-hits-live" edi="270195" release="08/06/2019">
                <shows>
                    <show time="2019-06-08T20:00:00" url="https://booking.cineworld.co.uk/booking/8015/78096"/>
                </shows>
            </film>
            <film title="The Curse Of La Llorona" rating="15" url="films/the-curse-of-la-llorona" edi="250922" release="03/05/2019">
                <shows>
                    <show time="2019-05-06T16:00:00" url="https://booking.cineworld.co.uk/booking/8015/79540" audioType="audio described" subtitled="true"/>
                    <show time="2019-05-06T18:20:00" url="https://booking.cineworld.co.uk/booking/8015/79541" audioType="audio described"/>
                    <show time="2019-05-06T20:40:00" url="https://booking.cineworld.co.uk/booking/8015/79542" audioType="audio described"/>
                    <show time="2019-05-07T16:00:00" url="https://booking.cineworld.co.uk/booking/8015/79560" audioType="audio described"/>
                    <show time="2019-05-07T18:20:00" url="https://booking.cineworld.co.uk/booking/8015/79561" audioType="audio described"/>
                    <show time="2019-05-07T20:40:00" url="https://booking.cineworld.co.uk/booking/8015/79562" audioType="audio described"/>
                    <show time="2019-05-08T16:00:00" url="https://booking.cineworld.co.uk/booking/8015/79563" audioType="audio described"/>
                    <show time="2019-05-08T18:20:00" url="https://booking.cineworld.co.uk/booking/8015/79564" audioType="audio described"/>
                    <show time="2019-05-08T20:40:00" url="https://booking.cineworld.co.uk/booking/8015/79565" audioType="audio described"/>
                    <show time="2019-05-09T16:00:00" url="https://booking.cineworld.co.uk/booking/8015/79566" audioType="audio described"/>
                    <show time="2019-05-09T18:20:00" url="https://booking.cineworld.co.uk/booking/8015/79567" audioType="audio described"/>
                    <show time="2019-05-09T20:40:00" url="https://booking.cineworld.co.uk/booking/8015/79568" audioType="audio described"/>
                </shows>
            </film>
            <film title="The Merry Wives Of Windsor Live from Shakespeare G" rating="12A" url="films/the-merry-wives-of-windsor-live-from-shakespeares-globe" edi="268829" release="20/06/2019">
                <shows>
                    <show time="2019-06-20T19:20:00" url="https://booking.cineworld.co.uk/booking/8015/77036"/>
                </shows>
            </film>
            <film title="The Secret Life Of Pets 2" rating="U" url="films/the-secret-life-of-pets-2" edi="192838" release="24/05/2019">
                <shows>
                    <show time="2019-05-24T10:00:00" url="https://booking.cineworld.co.uk/booking/8015/78424" audioType="audio described"/>
                    <show time="2019-05-24T12:15:00" url="https://booking.cineworld.co.uk/booking/8015/78425" audioType="audio described"/>
                    <show time="2019-05-24T14:30:00" url="https://booking.cineworld.co.uk/booking/8015/78426" audioType="audio described"/>
                    <show time="2019-05-24T16:45:00" url="https://booking.cineworld.co.uk/booking/8015/78427" audioType="audio described"/>
                    <show time="2019-05-25T10:00:00" url="https://booking.cineworld.co.uk/booking/8015/78436" audioType="audio described"/>
                    <show time="2019-05-25T12:15:00" url="https://booking.cineworld.co.uk/booking/8015/78437" audioType="audio described"/>
                    <show time="2019-05-25T14:30:00" url="https://booking.cineworld.co.uk/booking/8015/78438" audioType="audio described"/>
                    <show time="2019-05-25T16:45:00" url="https://booking.cineworld.co.uk/booking/8015/78439" audioType="audio described"/>
                    <show time="2019-05-26T10:00:00" url="https://booking.cineworld.co.uk/booking/8015/78440" audioType="audio described"/>
                    <show time="2019-05-26T12:15:00" url="https://booking.cineworld.co.uk/booking/8015/78441" audioType="audio described"/>
                    <show time="2019-05-26T14:30:00" url="https://booking.cineworld.co.uk/booking/8015/78442" audioType="audio described"/>
                    <show time="2019-05-26T16:45:00" url="https://booking.cineworld.co.uk/booking/8015/78443" audioType="audio described"/>
                    <show time="2019-05-27T10:00:00" url="https://booking.cineworld.co.uk/booking/8015/78428" audioType="audio described"/>
                    <show time="2019-05-27T12:15:00" url="https://booking.cineworld.co.uk/booking/8015/78429" audioType="audio described"/>
                    <show time="2019-05-27T14:30:00" url="https://booking.cineworld.co.uk/booking/8015/78430" audioType="audio described"/>
                    <show time="2019-05-27T16:45:00" url="https://booking.cineworld.co.uk/booking/8015/78431" audioType="audio described"/>
                    <show time="2019-05-28T10:00:00" url="https://booking.cineworld.co.uk/booking/8015/78432" audioType="audio described"/>
                    <show time="2019-05-28T12:15:00" url="https://booking.cineworld.co.uk/booking/8015/78433" audioType="audio described"/>
                    <show time="2019-05-28T14:30:00" url="https://booking.cineworld.co.uk/booking/8015/78434" audioType="audio described"/>
                    <show time="2019-05-28T16:45:00" url="https://booking.cineworld.co.uk/booking/8015/78435" audioType="audio described"/>
                </shows>
            </film>
            <film title="Tolkien" rating="12A" url="films/tolkien" edi="271425" release="03/05/2019">
                <shows>
                    <show time="2019-05-06T12:10:00" url="https://booking.cineworld.co.uk/booking/8015/79472" audioType="audio described"/>
                    <show time="2019-05-06T17:30:00" url="https://booking.cineworld.co.uk/booking/8015/79474" audioType="audio described"/>
                    <show time="2019-05-06T20:10:00" url="https://booking.cineworld.co.uk/booking/8015/79475" audioType="audio described"/>
                    <show time="2019-05-07T12:10:00" url="https://booking.cineworld.co.uk/booking/8015/79476" audioType="audio described"/>
                    <show time="2019-05-07T14:50:00" url="https://booking.cineworld.co.uk/booking/8015/79477" audioType="audio described"/>
                    <show time="2019-05-07T17:30:00" url="https://booking.cineworld.co.uk/booking/8015/79478" audioType="audio described"/>
                    <show time="2019-05-07T20:10:00" url="https://booking.cineworld.co.uk/booking/8015/79479" audioType="audio described"/>
                    <show time="2019-05-08T12:10:00" url="https://booking.cineworld.co.uk/booking/8015/79480" audioType="audio described"/>
                    <show time="2019-05-08T14:50:00" url="https://booking.cineworld.co.uk/booking/8015/79481" audioType="audio described"/>
                    <show time="2019-05-08T17:30:00" url="https://booking.cineworld.co.uk/booking/8015/79482" audioType="audio described"/>
                    <show time="2019-05-08T20:10:00" url="https://booking.cineworld.co.uk/booking/8015/79483" audioType="audio described"/>
                    <show time="2019-05-09T12:10:00" url="https://booking.cineworld.co.uk/booking/8015/79484" audioType="audio described"/>
                    <show time="2019-05-09T14:50:00" url="https://booking.cineworld.co.uk/booking/8015/79485" audioType="audio described"/>
                    <show time="2019-05-09T17:30:00" url="https://booking.cineworld.co.uk/booking/8015/79486" audioType="audio described"/>
                    <show time="2019-05-09T20:10:00" url="https://booking.cineworld.co.uk/booking/8015/79487" audioType="audio described"/>
                </shows>
            </film>
            <film title="Victoria - Northern Ballet" rating="PG" url="films/victoria-northern-ballet" edi="270190" release="25/06/2019">
                <shows>
                    <show time="2019-06-25T19:30:00" url="https://booking.cineworld.co.uk/booking/8015/76827"/>
                </shows>
            </film>
            <film title="Westlife : The Twenty Tour Live" rating="12A" url="films/westlife-the-twenty-tour-live-from-croke-park" edi="270186" release="06/07/2019">
                <shows>
                    <show time="2019-07-06T20:00:00" url="https://booking.cineworld.co.uk/booking/8015/79101"/>
                </shows>
            </film>
            <film title="(2D) Wonder Park" rating="PG" url="films/wonder-park" edi="194897" release="12/04/2019">
                <shows>
                    <show time="2019-05-06T10:00:00" url="https://booking.cineworld.co.uk/booking/8015/79459" audioType="audio described"/>
                </shows>
            </film>
            <film title="(3D) X-Men: Dark Phoenix" rating="TBC" url="films/x-men-dark-phoenix" edi="246006" release="05/06/2019">
                <shows>
                    <show time="2019-06-05T17:45:00" url="https://booking.cineworld.co.uk/booking/8015/79447" videoType="3d" audioType="audio described"/>
                    <show time="2019-06-06T17:45:00" url="https://booking.cineworld.co.uk/booking/8015/79448" videoType="3d" audioType="audio described"/>
                    <show time="2019-06-07T17:45:00" url="https://booking.cineworld.co.uk/booking/8015/79449" videoType="3d" audioType="audio described"/>
                    <show time="2019-06-08T17:45:00" url="https://booking.cineworld.co.uk/booking/8015/79450" videoType="3d" audioType="audio described"/>
                    <show time="2019-06-09T17:45:00" url="https://booking.cineworld.co.uk/booking/8015/79451" videoType="3d" audioType="audio described"/>
                </shows>
            </film>
            <film title="X-Men: Dark Phoenix" rating="TBC" url="films/x-men-dark-phoenix" edi="220087" release="05/06/2019">
                <shows>
                    <show time="2019-06-05T12:15:00" url="https://booking.cineworld.co.uk/booking/8015/79441" audioType="audio described"/>
                    <show time="2019-06-05T15:00:00" url="https://booking.cineworld.co.uk/booking/8015/79442" audioType="audio described"/>
                    <show time="2019-06-05T20:30:00" url="https://booking.cineworld.co.uk/booking/8015/79443" audioType="audio described"/>
                    <show time="2019-06-06T12:15:00" url="https://booking.cineworld.co.uk/booking/8015/79444" audioType="audio described"/>
                    <show time="2019-06-06T15:00:00" url="https://booking.cineworld.co.uk/booking/8015/79445" audioType="audio described"/>
                    <show time="2019-06-06T20:30:00" url="https://booking.cineworld.co.uk/booking/8015/79446" audioType="audio described"/>
                    <show time="2019-06-07T12:15:00" url="https://booking.cineworld.co.uk/booking/8015/79432" audioType="audio described"/>
                    <show time="2019-06-07T15:00:00" url="https://booking.cineworld.co.uk/booking/8015/79433" audioType="audio described"/>
                    <show time="2019-06-07T20:30:00" url="https://booking.cineworld.co.uk/booking/8015/79434" audioType="audio described"/>
                    <show time="2019-06-08T12:15:00" url="https://booking.cineworld.co.uk/booking/8015/79435" audioType="audio described"/>
                    <show time="2019-06-08T15:00:00" url="https://booking.cineworld.co.uk/booking/8015/79436" audioType="audio described"/>
                    <show time="2019-06-08T20:30:00" url="https://booking.cineworld.co.uk/booking/8015/79437" audioType="audio described"/>
                    <show time="2019-06-09T12:15:00" url="https://booking.cineworld.co.uk/booking/8015/79438" audioType="audio described"/>
                    <show time="2019-06-09T15:00:00" url="https://booking.cineworld.co.uk/booking/8015/79439" audioType="audio described"/>
                    <show time="2019-06-09T20:30:00" url="https://booking.cineworld.co.uk/booking/8015/79440" audioType="audio described"/>
                </shows>
            </film>
        </listing>
    </cinema>
    <cinema name="Cineworld Ashford" root="http://www1.cineworld.co.uk/" url="cinemas/ashford" id="12" phone="0871 200 2000" address="Eureka Entertainment Centre , Rutherford Road, Ashford" postcode="TN25 4BN">
        <listing>
            <film title="A Dog's Journey" rating="PG" url="films/a-dogs-journey" edi="255103" release="03/05/2019">
                <shows>
                    <show time="2019-05-06T11:30:00" url="https://booking.cineworld.co.uk/booking/8016/142838" audioType="audio described"/>
                    <show time="2019-05-06T14:00:00" url="https://booking.cineworld.co.uk/booking/8016/142839" audioType="audio described"/>
                    <show time="2019-05-06T16:30:00" url="https://booking.cineworld.co.uk/booking/8016/142840" audioType="audio described"/>
                    <show time="2019-05-06T18:15:00" url="https://booking.cineworld.co.uk/booking/8016/142901" audioType="audio described"/>
                    <show time="2019-05-07T11:30:00" url="https://booking.cineworld.co.uk/booking/8016/142844" audioType="audio described"/>
                    <show time="2019-05-07T14:00:00" url="https://booking.cineworld.co.uk/booking/8016/142845" audioType="audio described"/>
                    <show time="2019-05-07T16:30:00" url="https://booking.cineworld.co.uk/booking/8016/142846" audioType="audio described"/>
                    <show time="2019-05-07T18:15:00" url="https://booking.cineworld.co.uk/booking/8016/142902" audioType="audio described"/>
                    <show time="2019-05-08T11:30:00" url="https://booking.cineworld.co.uk/booking/8016/142847" audioType="audio described"/>
                    <show time="2019-05-08T14:00:00" url="https://booking.cineworld.co.uk/booking/8016/142848" audioType="audio described"/>
                    <show time="2019-05-08T16:30:00" url="https://booking.cineworld.co.uk/booking/8016/142849" audioType="audio described"/>
                    <show time="2019-05-08T18:15:00" url="https://booking.cineworld.co.uk/booking/8016/142903" audioType="audio described"/>
                    <show time="2019-05-09T11:30:00" url="https://booking.cineworld.co.uk/booking/8016/142850" audioType="audio described"/>
                    <show time="2019-05-09T14:00:00" url="https://booking.cineworld.co.uk/booking/8016/142851" audioType="audio described"/>
                    <show time="2019-05-09T16:30:00" url="https://booking.cineworld.co.uk/booking/8016/142852" audioType="audio described"/>
                    <show time="2019-05-09T18:15:00" url="https://booking.cineworld.co.uk/booking/8016/142904" audioType="audio described"/>
                </shows>
            </film>
            <film title="Andre Rieu 2019 Maastricht Concert Shall We Dance?" rating="PG" url="films/andre-rieu-2019-maastricht-concert-shall-we-dance" edi="255443" release="27/07/2019">
                <shows>
                    <show time="2019-07-27T19:00:00" url="https://booking.cineworld.co.uk/booking/8016/138352"/>
                    <show time="2019-07-28T15:00:00" url="https://booking.cineworld.co.uk/booking/8016/138353"/>
                </shows>
            </film>
            <film title="Asbury Park : Riot, Redemtpion, Rock &amp; Roll" rating="12A" url="films/asbury-park-riot-redemption-rock-n-roll" edi="272389" release="22/05/2019">
                <shows>
                    <show time="2019-05-22T19:30:00" url="https://booking.cineworld.co.uk/booking/8016/140863"/>
                </shows>
            </film>
            <film title="Autism Friendly Screening: Secret Life Of Pets 2" rating="U" url="films/autism-friendly-screening-secret-life-of-pets-2" edi="801857" release="02/06/2019">
                <shows>
                    <show time="2019-06-02T11:00:00" url="https://booking.cineworld.co.uk/booking/8016/143013"/>
                </shows>
            </film>
            <film title="(3D) Avengers: Endgame" rating="12A" url="films/avengers-endgame" edi="174256" release="25/04/2019">
                <shows>
                    <show time="2019-05-06T12:05:00" url="https://booking.cineworld.co.uk/booking/8016/142494" videoType="3d" audioType="audio described"/>
                    <show time="2019-05-06T16:00:00" url="https://booking.cineworld.co.uk/booking/8016/142495" videoType="3d" audioType="audio described"/>
                    <show time="2019-05-06T19:00:00" url="https://booking.cineworld.co.uk/booking/8016/142501" videoType="3d" audioType="audio described"/>
                    <show time="2019-05-06T20:00:00" url="https://booking.cineworld.co.uk/booking/8016/142496" videoType="3d" audioType="audio described"/>
                    <show time="2019-05-07T12:00:00" url="https://booking.cineworld.co.uk/booking/8016/142770" videoType="3d" audioType="audio described"/>
                    <show time="2019-05-07T16:00:00" url="https://booking.cineworld.co.uk/booking/8016/142771" videoType="3d" audioType="audio described"/>
                    <show time="2019-05-07T19:00:00" url="https://booking.cineworld.co.uk/booking/8016/142789" videoType="3d" audioType="audio described"/>
                    <show time="2019-05-07T20:00:00" url="https://booking.cineworld.co.uk/booking/8016/142768" videoType="3d" audioType="audio described"/>
                    <show time="2019-05-08T12:00:00" url="https://booking.cineworld.co.uk/booking/8016/142738" videoType="3d" audioType="audio described"/>
                    <show time="2019-05-08T16:00:00" url="https://booking.cineworld.co.uk/booking/8016/142739" videoType="3d" audioType="audio described"/>
                    <show time="2019-05-08T19:00:00" url="https://booking.cineworld.co.uk/booking/8016/142790" videoType="3d" audioType="audio described"/>
                    <show time="2019-05-09T12:00:00" url="https://booking.cineworld.co.uk/booking/8016/142772" videoType="3d" audioType="audio described"/>
                    <show time="2019-05-09T16:00:00" url="https://booking.cineworld.co.uk/booking/8016/142773" videoType="3d" audioType="audio described"/>
                    <show time="2019-05-09T19:00:00" url="https://booking.cineworld.co.uk/booking/8016/142791" videoType="3d" audioType="audio described"/>
                    <show time="2019-05-09T20:00:00" url="https://booking.cineworld.co.uk/booking/8016/142769" videoType="3d" audioType="audio described"/>
                </shows>
            </film>
            <film title="(2D) Avengers: Endgame" rating="12A" url="films/avengers-endgame" edi="169126" release="25/04/2019">
                <shows>
                    <show time="2019-05-06T10:10:00" url="https://booking.cineworld.co.uk/booking/8016/142498" audioType="audio described"/>
                    <show time="2019-05-06T11:10:00" url="https://booking.cineworld.co.uk/booking/8016/142504" audioType="audio described"/>
                    <show time="2019-05-06T12:30:00" url="https://booking.cineworld.co.uk/booking/8016/142491" audioType="audio described"/>
                    <show time="2019-05-06T13:30:00" url="https://booking.cineworld.co.uk/booking/8016/142786" audioType="audio described"/>
                    <show time="2019-05-06T13:40:00" url="https://booking.cineworld.co.uk/booking/8016/142502" audioType="audio described"/>
                    <show time="2019-05-06T14:20:00" url="https://booking.cineworld.co.uk/booking/8016/142499" audioType="audio described"/>
                    <show time="2019-05-06T15:10:00" url="https://booking.cineworld.co.uk/booking/8016/142505" audioType="audio described"/>
                    <show time="2019-05-06T16:30:00" url="https://booking.cineworld.co.uk/booking/8016/142492" audioType="audio described"/>
                    <show time="2019-05-06T17:30:00" url="https://booking.cineworld.co.uk/booking/8016/142787" audioType="audio described"/>
                    <show time="2019-05-06T18:00:00" url="https://booking.cineworld.co.uk/booking/8016/142503" audioType="audio described"/>
                    <show time="2019-05-06T18:30:00" url="https://booking.cineworld.co.uk/booking/8016/142500" audioType="audio described"/>
                    <show time="2019-05-06T19:20:00" url="https://booking.cineworld.co.uk/booking/8016/142506" audioType="audio described"/>
                    <show time="2019-05-06T20:30:00" url="https://booking.cineworld.co.uk/booking/8016/142493" audioType="audio described"/>
                    <show time="2019-05-06T21:00:00" url="https://booking.cineworld.co.uk/booking/8016/142795" audioType="audio described"/>
                    <show time="2019-05-06T21:30:00" url="https://booking.cineworld.co.uk/booking/8016/142788" audioType="audio described"/>
                    <show time="2019-05-07T11:10:00" url="https://booking.cineworld.co.uk/booking/8016/142811" audioType="audio described"/>
                    <show time="2019-05-07T12:30:00" url="https://booking.cineworld.co.uk/booking/8016/142732" audioType="audio described"/>
                    <show time="2019-05-07T13:30:00" url="https://booking.cineworld.co.uk/booking/8016/142756" audioType="audio described"/>
                    <show time="2019-05-07T13:40:00" url="https://booking.cineworld.co.uk/booking/8016/142805" audioType="audio described"/>
                    <show time="2019-05-07T14:20:00" url="https://booking.cineworld.co.uk/booking/8016/142780" audioType="audio described"/>
                    <show time="2019-05-07T15:10:00" url="https://booking.cineworld.co.uk/booking/8016/142812" audioType="audio described"/>
                    <show time="2019-05-07T16:30:00" url="https://booking.cineworld.co.uk/booking/8016/142733" audioType="audio described"/>
                    <show time="2019-05-07T17:30:00" url="https://booking.cineworld.co.uk/booking/8016/142749" audioType="audio described"/>
                    <show time="2019-05-07T18:00:00" url="https://booking.cineworld.co.uk/booking/8016/142802" audioType="audio described"/>
                    <show time="2019-05-07T18:30:00" url="https://booking.cineworld.co.uk/booking/8016/142777" audioType="audio described"/>
                    <show time="2019-05-07T19:20:00" url="https://booking.cineworld.co.uk/booking/8016/142808" audioType="audio described"/>
                    <show time="2019-05-07T19:40:00" url="https://booking.cineworld.co.uk/booking/8016/142774" audioType="audio described"/>
                    <show time="2019-05-07T20:20:00" url="https://booking.cineworld.co.uk/booking/8016/142734" audioType="audio described"/>
                    <show time="2019-05-07T21:00:00" url="https://booking.cineworld.co.uk/booking/8016/142750" audioType="audio described"/>
                    <show time="2019-05-07T21:00:00" url="https://booking.cineworld.co.uk/booking/8016/142796" audioType="audio described"/>
                    <show time="2019-05-08T11:10:00" url="https://booking.cineworld.co.uk/booking/8016/142813" audioType="audio described"/>
                    <show time="2019-05-08T12:30:00" url="https://booking.cineworld.co.uk/booking/8016/142766" audioType="audio described"/>
                    <show time="2019-05-08T13:30:00" url="https://booking.cineworld.co.uk/booking/8016/142757" audioType="audio described"/>
                    <show time="2019-05-08T13:40:00" url="https://booking.cineworld.co.uk/booking/8016/142806" audioType="audio described"/>
                    <show time="2019-05-08T14:20:00" url="https://booking.cineworld.co.uk/booking/8016/142781" audioType="audio described"/>
                    <show time="2019-05-08T15:10:00" url="https://booking.cineworld.co.uk/booking/8016/142814" audioType="audio described"/>
                    <show time="2019-05-08T16:30:00" url="https://booking.cineworld.co.uk/booking/8016/142767" audioType="audio described"/>
                    <show time="2019-05-08T17:30:00" url="https://booking.cineworld.co.uk/booking/8016/142751" audioType="audio described"/>
                    <show time="2019-05-08T18:00:00" url="https://booking.cineworld.co.uk/booking/8016/142803" audioType="audio described"/>
                    <show time="2019-05-08T18:30:00" url="https://booking.cineworld.co.uk/booking/8016/142778" audioType="audio described"/>
                    <show time="2019-05-08T19:20:00" url="https://booking.cineworld.co.uk/booking/8016/142809" audioType="audio described"/>
                    <show time="2019-05-08T19:40:00" url="https://booking.cineworld.co.uk/booking/8016/142775" audioType="audio described"/>
                    <show time="2019-05-08T20:30:00" url="https://booking.cineworld.co.uk/booking/8016/142765" audioType="audio described"/>
                    <show time="2019-05-08T21:00:00" url="https://booking.cineworld.co.uk/booking/8016/142797" audioType="audio described"/>
                    <show time="2019-05-08T21:00:00" url="https://booking.cineworld.co.uk/booking/8016/142752" audioType="audio described"/>
                    <show time="2019-05-09T11:10:00" url="https://booking.cineworld.co.uk/booking/8016/142815" audioType="audio described"/>
                    <show time="2019-05-09T12:30:00" url="https://booking.cineworld.co.uk/booking/8016/142735" audioType="audio described"/>
                    <show time="2019-05-09T13:30:00" url="https://booking.cineworld.co.uk/booking/8016/142758" audioType="audio described" subtitled="true"/>
                    <show time="2019-05-09T13:40:00" url="https://booking.cineworld.co.uk/booking/8016/142807" audioType="audio described"/>
                    <show time="2019-05-09T14:20:00" url="https://booking.cineworld.co.uk/booking/8016/142782" audioType="audio described"/>
                    <show time="2019-05-09T15:10:00" url="https://booking.cineworld.co.uk/booking/8016/142816" audioType="audio described"/>
                    <show time="2019-05-09T16:30:00" url="https://booking.cineworld.co.uk/booking/8016/142736" audioType="audio described"/>
                    <show time="2019-05-09T17:30:00" url="https://booking.cineworld.co.uk/booking/8016/142753" audioType="audio described"/>
                    <show time="2019-05-09T18:00:00" url="https://booking.cineworld.co.uk/booking/8016/142804" audioType="audio described"/>
                    <show time="2019-05-09T18:30:00" url="https://booking.cineworld.co.uk/booking/8016/142779" audioType="audio described"/>
                    <show time="2019-05-09T19:20:00" url="https://booking.cineworld.co.uk/booking/8016/142810" audioType="audio described"/>
                    <show time="2019-05-09T19:40:00" url="https://booking.cineworld.co.uk/booking/8016/142776" audioType="audio described"/>
                    <show time="2019-05-09T20:20:00" url="https://booking.cineworld.co.uk/booking/8016/142737" audioType="audio described"/>
                    <show time="2019-05-09T21:00:00" url="https://booking.cineworld.co.uk/booking/8016/142798" audioType="audio described"/>
                    <show time="2019-05-09T21:00:00" url="https://booking.cineworld.co.uk/booking/8016/142754" audioType="audio described"/>
                </shows>
            </film>
            <film title="Beats : Unlimited Screening" rating="18" url="films/beats-unlimited-screening" edi="801824" release="08/05/2019">
                <shows>
                    <show time="2019-05-08T20:00:00" url="https://booking.cineworld.co.uk/booking/8016/142441" audioType="audio described"/>
                </shows>
            </film>
            <film title="Bolshoi Ballet 2019 : Carmen Suite / Petrushka" rating="12A" url="films/bolshoi-ballet-2019-carmen-suite-petrushka" edi="251616" release="19/05/2019">
                <shows>
                    <show time="2019-05-19T16:00:00" url="https://booking.cineworld.co.uk/booking/8016/123377" audioType="audio described"/>
                </shows>
            </film>
            <film title="Booksmart: Unlimited Screening" rating="15" url="films/booksmart-unlimited-screening" edi="801833" release="06/05/2019">
                <shows>
                    <show time="2019-05-06T19:45:00" url="https://booking.cineworld.co.uk/booking/8016/142687" audioType="audio described"/>
                </shows>
            </film>
            <film title="(2D) Captain Marvel" rating="12A" url="films/captain-marvel" edi="169122" release="08/03/2019">
                <shows>
                    <show time="2019-05-06T12:30:00" url="https://booking.cineworld.co.uk/booking/8016/142829" audioType="audio described"/>
                    <show time="2019-05-06T15:20:00" url="https://booking.cineworld.co.uk/booking/8016/142830" audioType="audio described"/>
                    <show time="2019-05-07T12:30:00" url="https://booking.cineworld.co.uk/booking/8016/142821" audioType="audio described"/>
                    <show time="2019-05-07T15:20:00" url="https://booking.cineworld.co.uk/booking/8016/142822" audioType="audio described"/>
                    <show time="2019-05-08T12:30:00" url="https://booking.cineworld.co.uk/booking/8016/142823" audioType="audio described"/>
                    <show time="2019-05-08T15:20:00" url="https://booking.cineworld.co.uk/booking/8016/142824" audioType="audio described"/>
                    <show time="2019-05-09T12:30:00" url="https://booking.cineworld.co.uk/booking/8016/142825" audioType="audio described"/>
                    <show time="2019-05-09T15:20:00" url="https://booking.cineworld.co.uk/booking/8016/142826" audioType="audio described"/>
                </shows>
            </film>
            <film title="Dr Strangelove (Or How I Learned To Stop...) [GCF]" rating="PG" url="films/dr-strangelove-or-how-i-learned-to-stop-worrying-and-love-the-bomb" edi="445976" release="20/05/2019">
                <shows>
                    <show time="2019-05-20T20:00:00" url="https://booking.cineworld.co.uk/booking/8016/142997"/>
                </shows>
            </film>
            <film title="Dumbo" rating="PG" url="films/dumbo" edi="192491" release="29/03/2019">
                <shows>
                    <show time="2019-05-06T11:50:00" url="https://booking.cineworld.co.uk/booking/8016/142940" audioType="audio described"/>
                    <show time="2019-05-06T14:30:00" url="https://booking.cineworld.co.uk/booking/8016/142941" audioType="audio described"/>
                    <show time="2019-05-07T11:50:00" url="https://booking.cineworld.co.uk/booking/8016/142948" audioType="audio described"/>
                    <show time="2019-05-07T14:30:00" url="https://booking.cineworld.co.uk/booking/8016/142949" audioType="audio described"/>
                    <show time="2019-05-08T11:50:00" url="https://booking.cineworld.co.uk/booking/8016/142950" audioType="audio described"/>
                    <show time="2019-05-08T14:30:00" url="https://booking.cineworld.co.uk/booking/8016/142951" audioType="audio described"/>
                    <show time="2019-05-09T11:50:00" url="https://booking.cineworld.co.uk/booking/8016/142952" audioType="audio described"/>
                    <show time="2019-05-09T14:30:00" url="https://booking.cineworld.co.uk/booking/8016/142953" audioType="audio described"/>
                </shows>
            </film>
            <film title="Glyndebourne 2019 : Cinderella (Cendrillon)" rating="12A" url="films/glyndebourne-2019-cinderella-cendrillon-live" edi="273307" release="30/06/2019">
                <shows>
                    <show time="2019-06-30T17:30:00" url="https://booking.cineworld.co.uk/booking/8016/140855"/>
                </shows>
            </film>
            <film title="Glyndebourne 2019: The Barber Of Seville (Il barbi" rating="12A" url="films/glyndebourne-2019-the-barber-of-seville-il-barbiere-di-siviglia-recorded" edi="273300" release="14/07/2019">
                <shows>
                    <show time="2019-07-14T17:30:00" url="https://booking.cineworld.co.uk/booking/8016/140856" audioType="audio described"/>
                </shows>
            </film>
            <film title="Glyndebourne 2019: The Magic Flute (Die Zauberflt" rating="12A" url="films/glyndebourne-2019-the-magic-flute-die-zauberflte-live" edi="273310" release="04/08/2019">
                <shows>
                    <show time="2019-08-04T17:30:00" url="https://booking.cineworld.co.uk/booking/8016/140857"/>
                </shows>
            </film>
            <film title="M4J How To Train Your Dragon: The Hidden World" rating="PG" url="films/how-to-train-your-dragon-the-hidden-world-movies-for-juniors" edi="801822" release="01/02/2019">
                <shows>
                    <show time="2019-05-06T10:00:00" url="https://booking.cineworld.co.uk/booking/8016/142744" audioType="audio described"/>
                </shows>
            </film>
            <film title="Long Shot" rating="15" url="films/long-shot" edi="240058" release="03/05/2019">
                <shows>
                    <show time="2019-05-06T11:20:00" url="https://booking.cineworld.co.uk/booking/8016/142965" audioType="audio described"/>
                    <show time="2019-05-06T14:10:00" url="https://booking.cineworld.co.uk/booking/8016/142966" audioType="audio described" subtitled="true"/>
                    <show time="2019-05-06T17:00:00" url="https://booking.cineworld.co.uk/booking/8016/142967" audioType="audio described"/>
                    <show time="2019-05-06T19:50:00" url="https://booking.cineworld.co.uk/booking/8016/142968" audioType="audio described"/>
                    <show time="2019-05-07T11:20:00" url="https://booking.cineworld.co.uk/booking/8016/142975" audioType="audio described"/>
                    <show time="2019-05-07T14:10:00" url="https://booking.cineworld.co.uk/booking/8016/142976" audioType="audio described"/>
                    <show time="2019-05-07T17:00:00" url="https://booking.cineworld.co.uk/booking/8016/142969" audioType="audio described"/>
                    <show time="2019-05-07T19:50:00" url="https://booking.cineworld.co.uk/booking/8016/142970" audioType="audio described"/>
                    <show time="2019-05-08T11:20:00" url="https://booking.cineworld.co.uk/booking/8016/142977" audioType="audio described"/>
                    <show time="2019-05-08T14:10:00" url="https://booking.cineworld.co.uk/booking/8016/142978" audioType="audio described"/>
                    <show time="2019-05-08T17:00:00" url="https://booking.cineworld.co.uk/booking/8016/142971" audioType="audio described"/>
                    <show time="2019-05-08T19:50:00" url="https://booking.cineworld.co.uk/booking/8016/142972" audioType="audio described"/>
                    <show time="2019-05-09T11:20:00" url="https://booking.cineworld.co.uk/booking/8016/142979" audioType="audio described"/>
                    <show time="2019-05-09T14:10:00" url="https://booking.cineworld.co.uk/booking/8016/142980" audioType="audio described"/>
                    <show time="2019-05-09T17:00:00" url="https://booking.cineworld.co.uk/booking/8016/142973" audioType="audio described"/>
                    <show time="2019-05-09T19:50:00" url="https://booking.cineworld.co.uk/booking/8016/142974" audioType="audio described"/>
                </shows>
            </film>
            <film title="Margaret Atwood : Live In Cinemas" rating="12A" url="films/margaret-atwood-live-in-cinemas" edi="272858" release="10/09/2019">
                <shows>
                    <show time="2019-09-10T19:30:00" url="https://booking.cineworld.co.uk/booking/8016/140537"/>
                </shows>
            </film>
            <film title="Matthew Bourne's Swan Lake (2019)" rating="PG" url="films/matthew-bournes-swan-lake" edi="269440" release="21/05/2019">
                <shows>
                    <show time="2019-05-21T15:45:00" url="https://booking.cineworld.co.uk/booking/8016/138717"/>
                    <show time="2019-05-21T18:30:00" url="https://booking.cineworld.co.uk/booking/8016/138718"/>
                </shows>
            </film>
            <film title="MET Opera 2019 Dialogues Des Carmelites" rating="12A" url="films/met-opera-2019-dialogues-des-carmelites" edi="249481" release="11/05/2019">
                <shows>
                    <show time="2019-05-11T17:00:00" url="https://booking.cineworld.co.uk/booking/8016/131388"/>
                </shows>
            </film>
            <film title="Missing Link" rating="PG" url="films/missing-link" edi="258465" release="05/04/2019">
                <shows>
                    <show time="2019-05-06T11:15:00" url="https://booking.cineworld.co.uk/booking/8016/142985" audioType="audio described"/>
                    <show time="2019-05-07T11:15:00" url="https://booking.cineworld.co.uk/booking/8016/142987" audioType="audio described"/>
                    <show time="2019-05-08T11:15:00" url="https://booking.cineworld.co.uk/booking/8016/142988" audioType="audio described"/>
                    <show time="2019-05-09T11:15:00" url="https://booking.cineworld.co.uk/booking/8016/142989" audioType="audio described"/>
                </shows>
            </film>
            <film title="NT Live: All My Sons" rating="12A" url="films/nt-live-all-my-sons" edi="263592" release="14/05/2019">
                <shows>
                    <show time="2019-05-14T19:00:00" url="https://booking.cineworld.co.uk/booking/8016/135742"/>
                </shows>
            </film>
            <film title="NT Live : One Man, Two Guvnors (Encore)" rating="12A" url="films/nt-live-one-man-two-guvnors-encore" edi="266343" release="26/09/2019">
                <shows>
                    <show time="2019-09-26T19:00:00" url="https://booking.cineworld.co.uk/booking/8016/142092"/>
                </shows>
            </film>
            <film title="NT Live : Small Island" rating="12A" url="films/nt-live-small-island" edi="270872" release="27/06/2019">
                <shows>
                    <show time="2019-06-27T19:00:00" url="https://booking.cineworld.co.uk/booking/8016/138337"/>
                </shows>
            </film>
            <film title="NT Live : The Lehman Trilogy" rating="12A" url="films/nt-live-the-lehman-trilogy" edi="266345" release="25/07/2019">
                <shows>
                    <show time="2019-07-25T19:00:00" url="https://booking.cineworld.co.uk/booking/8016/142091"/>
                </shows>
            </film>
            <film title="Pavarotti plus Q&amp;A" rating="TBC" url="films/pavarotti-plus-qa" edi="801820" release="13/07/2019">
                <shows>
                    <show time="2019-07-13T19:00:00" url="https://booking.cineworld.co.uk/booking/8016/142996"/>
                </shows>
            </film>
            <film title="Paw Patrol: Mighty Pups - The Movie" rating="TBC" url="films/paw-patrol-mighty-pups" edi="261550" release="17/05/2019">
                <shows>
                    <show time="2019-05-17T16:00:00" url="https://booking.cineworld.co.uk/booking/8016/142097" audioType="audio described"/>
                    <show time="2019-05-18T10:30:00" url="https://booking.cineworld.co.uk/booking/8016/142098" audioType="audio described"/>
                    <show time="2019-05-18T12:20:00" url="https://booking.cineworld.co.uk/booking/8016/142099" audioType="audio described"/>
                    <show time="2019-05-18T14:10:00" url="https://booking.cineworld.co.uk/booking/8016/142100" audioType="audio described"/>
                    <show time="2019-05-18T16:00:00" url="https://booking.cineworld.co.uk/booking/8016/142101" audioType="audio described"/>
                    <show time="2019-05-19T10:30:00" url="https://booking.cineworld.co.uk/booking/8016/142102" audioType="audio described"/>
                    <show time="2019-05-19T12:20:00" url="https://booking.cineworld.co.uk/booking/8016/142103" audioType="audio described"/>
                    <show time="2019-05-19T14:10:00" url="https://booking.cineworld.co.uk/booking/8016/142104" audioType="audio described"/>
                    <show time="2019-05-19T16:00:00" url="https://booking.cineworld.co.uk/booking/8016/142105" audioType="audio described"/>
                </shows>
            </film>
            <film title="Peppa Pig: Festival Of Fun" rating="U" url="films/peppa-pig-festival-of-fun" edi="256539" release="05/04/2019">
                <shows>
                    <show time="2019-05-06T10:10:00" url="https://booking.cineworld.co.uk/booking/8016/142956" audioType="audio described"/>
                </shows>
            </film>
            <film title="(2D) Detective Pikachu" rating="PG" url="films/pokemon-detective-pikachu" edi="244991" release="10/05/2019">
                <shows>
                    <show time="2019-05-10T12:30:00" url="https://booking.cineworld.co.uk/booking/8016/142999" audioType="audio described"/>
                    <show time="2019-05-10T15:00:00" url="https://booking.cineworld.co.uk/booking/8016/143000" audioType="audio described"/>
                    <show time="2019-05-10T17:30:00" url="https://booking.cineworld.co.uk/booking/8016/143001" audioType="audio described"/>
                    <show time="2019-05-10T20:00:00" url="https://booking.cineworld.co.uk/booking/8016/143002" audioType="audio described"/>
                    <show time="2019-05-11T10:00:00" url="https://booking.cineworld.co.uk/booking/8016/143011" audioType="audio described"/>
                    <show time="2019-05-11T12:30:00" url="https://booking.cineworld.co.uk/booking/8016/143003" audioType="audio described"/>
                    <show time="2019-05-11T15:00:00" url="https://booking.cineworld.co.uk/booking/8016/143004" audioType="audio described"/>
                    <show time="2019-05-11T17:30:00" url="https://booking.cineworld.co.uk/booking/8016/143005" audioType="audio described"/>
                    <show time="2019-05-11T20:00:00" url="https://booking.cineworld.co.uk/booking/8016/143006" audioType="audio described"/>
                    <show time="2019-05-12T10:00:00" url="https://booking.cineworld.co.uk/booking/8016/143012" audioType="audio described"/>
                    <show time="2019-05-12T12:30:00" url="https://booking.cineworld.co.uk/booking/8016/143007" audioType="audio described"/>
                    <show time="2019-05-12T15:00:00" url="https://booking.cineworld.co.uk/booking/8016/143008" audioType="audio described"/>
                    <show time="2019-05-12T17:30:00" url="https://booking.cineworld.co.uk/booking/8016/143009" audioType="audio described"/>
                    <show time="2019-05-12T20:00:00" url="https://booking.cineworld.co.uk/booking/8016/143010" audioType="audio described"/>
                </shows>
            </film>
            <film title="Red Joan" rating="12A" url="films/red-joan" edi="251781" release="19/04/2019">
                <shows>
                    <show time="2019-05-06T17:10:00" url="https://booking.cineworld.co.uk/booking/8016/142892" audioType="audio described"/>
                    <show time="2019-05-07T11:00:00" url="https://booking.cineworld.co.uk/booking/8016/142889" audioType="audio described"/>
                    <show time="2019-05-07T17:10:00" url="https://booking.cineworld.co.uk/booking/8016/142896" audioType="audio described"/>
                    <show time="2019-05-08T11:00:00" url="https://booking.cineworld.co.uk/booking/8016/142890" audioType="audio described"/>
                    <show time="2019-05-08T17:10:00" url="https://booking.cineworld.co.uk/booking/8016/142897" audioType="audio described"/>
                    <show time="2019-05-09T11:00:00" url="https://booking.cineworld.co.uk/booking/8016/142891" audioType="audio described"/>
                    <show time="2019-05-09T17:10:00" url="https://booking.cineworld.co.uk/booking/8016/142898" audioType="audio described"/>
                </shows>
            </film>
            <film title="ROH Royal Ballet Live 2019 Romeo And Juliet" rating="12A" url="films/roh-royal-ballet-live-2019-romeo-and-juliet" edi="252213" release="11/06/2019">
                <shows>
                    <show time="2019-06-11T19:15:00" url="https://booking.cineworld.co.uk/booking/8016/123390"/>
                </shows>
            </film>
            <film title="ROH Royal Ballet Live 2019 Triple Bill" rating="12A" url="films/roh-royal-ballet-live-2019-triple-bill" edi="252209" release="16/05/2019">
                <shows>
                    <show time="2019-05-16T19:15:00" url="https://booking.cineworld.co.uk/booking/8016/123389"/>
                </shows>
            </film>
            <film title="RSC Live : Measure For Measure" rating="12A" url="films/rsc-live-measure-for-measure" edi="263087" release="31/07/2019">
                <shows>
                    <show time="2019-07-31T19:00:00" url="https://booking.cineworld.co.uk/booking/8016/133630"/>
                </shows>
            </film>
            <film title="RSC Live : The Taming Of The Shrew" rating="12A" url="films/rsc-live-the-taming-of-the-shrew" edi="263085" release="05/06/2019">
                <shows>
                    <show time="2019-06-05T19:00:00" url="https://booking.cineworld.co.uk/booking/8016/133629"/>
                </shows>
            </film>
            <film title="Saving Private Ryan (D-Day 75th Anniversary)" rating="15" url="films/saving-private-ryan-d-day-75th-anniversary" edi="275478" release="06/06/2019">
                <shows>
                    <show time="2019-06-06T19:30:00" url="https://booking.cineworld.co.uk/booking/8016/142998" audioType="audio described"/>
                </shows>
            </film>
            <film title="(2D) Shazam!" rating="12A" url="films/shazam" edi="169941" release="05/04/2019">
                <shows>
                    <show time="2019-05-06T10:30:00" url="https://booking.cineworld.co.uk/booking/8016/142883" audioType="audio described"/>
                    <show time="2019-05-07T11:20:00" url="https://booking.cineworld.co.uk/booking/8016/142885" audioType="audio described"/>
                    <show time="2019-05-08T11:20:00" url="https://booking.cineworld.co.uk/booking/8016/142886" audioType="audio described"/>
                    <show time="2019-05-09T11:20:00" url="https://booking.cineworld.co.uk/booking/8016/142887" audioType="audio described"/>
                </shows>
            </film>
            <film title="M4J Spider-Man: Into The Spider-Verse" rating="PG" url="films/spider-man-into-the-spider-verse-movies-for-juniors" edi="801735" release="15/02/2019">
                <shows>
                    <show time="2019-05-06T10:00:00" url="https://booking.cineworld.co.uk/booking/8016/142742" audioType="audio described"/>
                </shows>
            </film>
            <film title="Take That - Greatest Hits Live" rating="12A" url="films/take-that-greatest-hits-live" edi="270195" release="08/06/2019">
                <shows>
                    <show time="2019-06-08T20:00:00" url="https://booking.cineworld.co.uk/booking/8016/140564"/>
                </shows>
            </film>
            <film title="The Curse Of La Llorona" rating="15" url="films/the-curse-of-la-llorona" edi="250922" release="03/05/2019">
                <shows>
                    <show time="2019-05-06T11:30:00" url="https://booking.cineworld.co.uk/booking/8016/142905" audioType="audio described"/>
                    <show time="2019-05-06T13:50:00" url="https://booking.cineworld.co.uk/booking/8016/142906" audioType="audio described"/>
                    <show time="2019-05-06T16:10:00" url="https://booking.cineworld.co.uk/booking/8016/142907" audioType="audio described"/>
                    <show time="2019-05-06T18:40:00" url="https://booking.cineworld.co.uk/booking/8016/142908" audioType="audio described"/>
                    <show time="2019-05-06T21:10:00" url="https://booking.cineworld.co.uk/booking/8016/142909" audioType="audio described"/>
                    <show time="2019-05-07T11:30:00" url="https://booking.cineworld.co.uk/booking/8016/142931" audioType="audio described"/>
                    <show time="2019-05-07T13:50:00" url="https://booking.cineworld.co.uk/booking/8016/142932" audioType="audio described"/>
                    <show time="2019-05-07T16:10:00" url="https://booking.cineworld.co.uk/booking/8016/142933" audioType="audio described"/>
                    <show time="2019-05-07T18:40:00" url="https://booking.cineworld.co.uk/booking/8016/142922" audioType="audio described"/>
                    <show time="2019-05-07T21:10:00" url="https://booking.cineworld.co.uk/booking/8016/142923" audioType="audio described"/>
                    <show time="2019-05-08T11:30:00" url="https://booking.cineworld.co.uk/booking/8016/142934" audioType="audio described"/>
                    <show time="2019-05-08T13:50:00" url="https://booking.cineworld.co.uk/booking/8016/142935" audioType="audio described"/>
                    <show time="2019-05-08T16:10:00" url="https://booking.cineworld.co.uk/booking/8016/142936" audioType="audio described"/>
                    <show time="2019-05-08T18:40:00" url="https://booking.cineworld.co.uk/booking/8016/142924" audioType="audio described"/>
                    <show time="2019-05-08T21:10:00" url="https://booking.cineworld.co.uk/booking/8016/142925" audioType="audio described"/>
                    <show time="2019-05-09T11:30:00" url="https://booking.cineworld.co.uk/booking/8016/142937" audioType="audio described"/>
                    <show time="2019-05-09T13:50:00" url="https://booking.cineworld.co.uk/booking/8016/142938" audioType="audio described"/>
                    <show time="2019-05-09T16:10:00" url="https://booking.cineworld.co.uk/booking/8016/142939" audioType="audio described"/>
                    <show time="2019-05-09T18:40:00" url="https://booking.cineworld.co.uk/booking/8016/142926" audioType="audio described"/>
                    <show time="2019-05-09T21:10:00" url="https://booking.cineworld.co.uk/booking/8016/142927" audioType="audio described"/>
                </shows>
            </film>
            <film title="The Merry Wives Of Windsor Live from Shakespeare G" rating="12A" url="films/the-merry-wives-of-windsor-live-from-shakespeares-globe" edi="268829" release="20/06/2019">
                <shows>
                    <show time="2019-06-20T19:20:00" url="https://booking.cineworld.co.uk/booking/8016/138720"/>
                </shows>
            </film>
            <film title="The Secret Life Of Pets 2" rating="U" url="films/the-secret-life-of-pets-2" edi="192838" release="24/05/2019">
                <shows>
                    <show time="2019-05-24T10:00:00" url="https://booking.cineworld.co.uk/booking/8016/141141" audioType="audio described"/>
                    <show time="2019-05-24T12:15:00" url="https://booking.cineworld.co.uk/booking/8016/141142" audioType="audio described"/>
                    <show time="2019-05-24T14:30:00" url="https://booking.cineworld.co.uk/booking/8016/141143" audioType="audio described"/>
                    <show time="2019-05-24T16:45:00" url="https://booking.cineworld.co.uk/booking/8016/141144" audioType="audio described"/>
                    <show time="2019-05-25T10:00:00" url="https://booking.cineworld.co.uk/booking/8016/141145" audioType="audio described"/>
                    <show time="2019-05-25T12:15:00" url="https://booking.cineworld.co.uk/booking/8016/141146" audioType="audio described"/>
                    <show time="2019-05-25T14:30:00" url="https://booking.cineworld.co.uk/booking/8016/141147" audioType="audio described"/>
                    <show time="2019-05-25T16:45:00" url="https://booking.cineworld.co.uk/booking/8016/141148" audioType="audio described"/>
                    <show time="2019-05-26T10:00:00" url="https://booking.cineworld.co.uk/booking/8016/141149" audioType="audio described"/>
                    <show time="2019-05-26T12:15:00" url="https://booking.cineworld.co.uk/booking/8016/141150" audioType="audio described"/>
                    <show time="2019-05-26T14:30:00" url="https://booking.cineworld.co.uk/booking/8016/141151" audioType="audio described"/>
                    <show time="2019-05-26T16:45:00" url="https://booking.cineworld.co.uk/booking/8016/141152" audioType="audio described"/>
                    <show time="2019-05-27T10:00:00" url="https://booking.cineworld.co.uk/booking/8016/141153" audioType="audio described"/>
                    <show time="2019-05-27T12:15:00" url="https://booking.cineworld.co.uk/booking/8016/141154" audioType="audio described"/>
                    <show time="2019-05-27T14:30:00" url="https://booking.cineworld.co.uk/booking/8016/141155" audioType="audio described"/>
                    <show time="2019-05-27T16:45:00" url="https://booking.cineworld.co.uk/booking/8016/141156" audioType="audio described"/>
                    <show time="2019-05-28T10:00:00" url="https://booking.cineworld.co.uk/booking/8016/141157" audioType="audio described"/>
                    <show time="2019-05-28T12:15:00" url="https://booking.cineworld.co.uk/booking/8016/141158" audioType="audio described"/>
                    <show time="2019-05-28T14:30:00" url="https://booking.cineworld.co.uk/booking/8016/141159" audioType="audio described"/>
                    <show time="2019-05-28T16:45:00" url="https://booking.cineworld.co.uk/booking/8016/141160" audioType="audio described"/>
                </shows>
            </film>
            <film title="Tolkien" rating="12A" url="films/tolkien" edi="271425" release="03/05/2019">
                <shows>
                    <show time="2019-05-06T12:20:00" url="https://booking.cineworld.co.uk/booking/8016/142873" audioType="audio described"/>
                    <show time="2019-05-06T15:00:00" url="https://booking.cineworld.co.uk/booking/8016/142874" audioType="audio described"/>
                    <show time="2019-05-06T17:40:00" url="https://booking.cineworld.co.uk/booking/8016/142875" audioType="audio described"/>
                    <show time="2019-05-06T20:20:00" url="https://booking.cineworld.co.uk/booking/8016/142876" audioType="audio described"/>
                    <show time="2019-05-07T12:20:00" url="https://booking.cineworld.co.uk/booking/8016/142863" audioType="audio described"/>
                    <show time="2019-05-07T15:00:00" url="https://booking.cineworld.co.uk/booking/8016/142864" audioType="audio described" subtitled="true"/>
                    <show time="2019-05-07T17:40:00" url="https://booking.cineworld.co.uk/booking/8016/142855" audioType="audio described"/>
                    <show time="2019-05-07T20:20:00" url="https://booking.cineworld.co.uk/booking/8016/142856" audioType="audio described"/>
                    <show time="2019-05-08T12:20:00" url="https://booking.cineworld.co.uk/booking/8016/142865" audioType="audio described"/>
                    <show time="2019-05-08T15:00:00" url="https://booking.cineworld.co.uk/booking/8016/142866" audioType="audio described"/>
                    <show time="2019-05-08T17:40:00" url="https://booking.cineworld.co.uk/booking/8016/142857" audioType="audio described"/>
                    <show time="2019-05-08T20:20:00" url="https://booking.cineworld.co.uk/booking/8016/142858" audioType="audio described"/>
                    <show time="2019-05-09T12:20:00" url="https://booking.cineworld.co.uk/booking/8016/142867" audioType="audio described"/>
                    <show time="2019-05-09T15:00:00" url="https://booking.cineworld.co.uk/booking/8016/142868" audioType="audio described"/>
                    <show time="2019-05-09T17:40:00" url="https://booking.cineworld.co.uk/booking/8016/142859" audioType="audio described"/>
                    <show time="2019-05-09T20:20:00" url="https://booking.cineworld.co.uk/booking/8016/142860" audioType="audio described"/>
                </shows>
            </film>
            <film title="Victoria - Northern Ballet" rating="PG" url="films/victoria-northern-ballet" edi="270190" release="25/06/2019">
                <shows>
                    <show time="2019-06-25T19:30:00" url="https://booking.cineworld.co.uk/booking/8016/138338"/>
                </shows>
            </film>
            <film title="Westlife : The Twenty Tour Live" rating="12A" url="films/westlife-the-twenty-tour-live-from-croke-park" edi="270186" release="06/07/2019">
                <shows>
                    <show time="2019-07-06T20:00:00" url="https://booking.cineworld.co.uk/booking/8016/142093"/>
                </shows>
            </film>
            <film title="(2D) Wonder Park" rating="PG" url="films/wonder-park" edi="194897" release="12/04/2019">
                <shows>
                    <show time="2019-05-06T10:20:00" url="https://booking.cineworld.co.uk/booking/8016/142982" audioType="audio described"/>
                </shows>
            </film>
            <film title="(3D) X-Men: Dark Phoenix" rating="TBC" url="films/x-men-dark-phoenix" edi="246006" release="05/06/2019">
                <shows>
                    <show time="2019-06-05T20:00:00" url="https://booking.cineworld.co.uk/booking/8016/142693" videoType="3d" audioType="audio described"/>
                    <show time="2019-06-06T20:00:00" url="https://booking.cineworld.co.uk/booking/8016/142694" videoType="3d" audioType="audio described"/>
                    <show time="2019-06-07T20:00:00" url="https://booking.cineworld.co.uk/booking/8016/142699" videoType="3d" audioType="audio described"/>
                    <show time="2019-06-08T20:00:00" url="https://booking.cineworld.co.uk/booking/8016/142704" videoType="3d" audioType="audio described"/>
                    <show time="2019-06-09T20:00:00" url="https://booking.cineworld.co.uk/booking/8016/142709" videoType="3d" audioType="audio described"/>
                </shows>
            </film>
            <film title="X-Men: Dark Phoenix" rating="TBC" url="films/x-men-dark-phoenix" edi="220087" release="05/06/2019">
                <shows>
                    <show time="2019-06-05T12:30:00" url="https://booking.cineworld.co.uk/booking/8016/142689" audioType="audio described"/>
                    <show time="2019-06-05T15:20:00" url="https://booking.cineworld.co.uk/booking/8016/142690" audioType="audio described"/>
                    <show time="2019-06-05T18:10:00" url="https://booking.cineworld.co.uk/booking/8016/142691" audioType="audio described"/>
                    <show time="2019-06-05T21:00:00" url="https://booking.cineworld.co.uk/booking/8016/142692" audioType="audio described"/>
                    <show time="2019-06-06T12:30:00" url="https://booking.cineworld.co.uk/booking/8016/142695" audioType="audio described"/>
                    <show time="2019-06-06T15:20:00" url="https://booking.cineworld.co.uk/booking/8016/142696" audioType="audio described"/>
                    <show time="2019-06-06T18:10:00" url="https://booking.cineworld.co.uk/booking/8016/142697" audioType="audio described"/>
                    <show time="2019-06-06T21:00:00" url="https://booking.cineworld.co.uk/booking/8016/142698" audioType="audio described"/>
                    <show time="2019-06-07T12:30:00" url="https://booking.cineworld.co.uk/booking/8016/142700" audioType="audio described"/>
                    <show time="2019-06-07T15:20:00" url="https://booking.cineworld.co.uk/booking/8016/142701" audioType="audio described"/>
                    <show time="2019-06-07T18:10:00" url="https://booking.cineworld.co.uk/booking/8016/142702" audioType="audio described"/>
                    <show time="2019-06-07T21:00:00" url="https://booking.cineworld.co.uk/booking/8016/142703" audioType="audio described"/>
                    <show time="2019-06-08T12:30:00" url="https://booking.cineworld.co.uk/booking/8016/142705" audioType="audio described"/>
                    <show time="2019-06-08T15:20:00" url="https://booking.cineworld.co.uk/booking/8016/142706" audioType="audio described"/>
                    <show time="2019-06-08T18:10:00" url="https://booking.cineworld.co.uk/booking/8016/142707" audioType="audio described"/>
                    <show time="2019-06-08T21:00:00" url="https://booking.cineworld.co.uk/booking/8016/142708" audioType="audio described"/>
                    <show time="2019-06-09T12:30:00" url="https://booking.cineworld.co.uk/booking/8016/142710" audioType="audio described"/>
                    <show time="2019-06-09T15:20:00" url="https://booking.cineworld.co.uk/booking/8016/142711" audioType="audio described"/>
                    <show time="2019-06-09T18:10:00" url="https://booking.cineworld.co.uk/booking/8016/142712" audioType="audio described"/>
                    <show time="2019-06-09T21:00:00" url="https://booking.cineworld.co.uk/booking/8016/142713" audioType="audio described"/>
                </shows>
            </film>
        </listing>
    </cinema>
    <cinema name="Cineworld Ashton-under-Lyne" root="http://www1.cineworld.co.uk/" url="cinemas/ashton-under-lyne" id="23" phone="0871 200 2000" address="Ashton Leisure Park , Fold Way, Ashton-under-Lyne" postcode="OL7 0PG">
        <listing>
            <film title="A Dog's Journey" rating="PG" url="films/a-dogs-journey" edi="255103" release="03/05/2019">
                <shows>
                    <show time="2019-05-06T11:10:00" url="https://booking.cineworld.co.uk/booking/8017/167640" audioType="audio described"/>
                    <show time="2019-05-06T13:50:00" url="https://booking.cineworld.co.uk/booking/8017/167641" audioType="audio described"/>
                    <show time="2019-05-06T15:30:00" url="https://booking.cineworld.co.uk/booking/8017/167573" audioType="audio described"/>
                    <show time="2019-05-06T18:15:00" url="https://booking.cineworld.co.uk/booking/8017/167574" audioType="audio described"/>
                    <show time="2019-05-07T15:30:00" url="https://booking.cineworld.co.uk/booking/8017/167643" audioType="audio described"/>
                    <show time="2019-05-07T18:15:00" url="https://booking.cineworld.co.uk/booking/8017/167644" audioType="audio described"/>
                    <show time="2019-05-08T15:30:00" url="https://booking.cineworld.co.uk/booking/8017/167646" audioType="audio described"/>
                    <show time="2019-05-08T18:15:00" url="https://booking.cineworld.co.uk/booking/8017/167647" audioType="audio described"/>
                    <show time="2019-05-09T15:30:00" url="https://booking.cineworld.co.uk/booking/8017/167649" audioType="audio described"/>
                    <show time="2019-05-09T18:15:00" url="https://booking.cineworld.co.uk/booking/8017/167650" audioType="audio described"/>
                </shows>
            </film>
            <film title="Andre Rieu 2019 Maastricht Concert Shall We Dance?" rating="PG" url="films/andre-rieu-2019-maastricht-concert-shall-we-dance" edi="255443" release="27/07/2019">
                <shows>
                    <show time="2019-07-27T19:00:00" url="https://booking.cineworld.co.uk/booking/8017/163548"/>
                    <show time="2019-07-28T15:00:00" url="https://booking.cineworld.co.uk/booking/8017/163549"/>
                </shows>
            </film>
            <film title="Autism Friendly Screening: Secret Life Of Pets 2" rating="U" url="films/autism-friendly-screening-secret-life-of-pets-2" edi="801857" release="02/06/2019">
                <shows>
                    <show time="2019-06-02T11:00:00" url="https://booking.cineworld.co.uk/booking/8017/167671"/>
                </shows>
            </film>
            <film title="(IMAX 3-D) Avengers: Endgame" rating="12A" url="films/avengers-endgame" edi="230548" release="25/04/2019">
                <shows>
                    <show time="2019-05-06T11:50:00" url="https://booking.cineworld.co.uk/booking/8017/167205" videoType="imax 3d"/>
                    <show time="2019-05-06T15:50:00" url="https://booking.cineworld.co.uk/booking/8017/167206" videoType="imax 3d"/>
                    <show time="2019-05-06T20:00:00" url="https://booking.cineworld.co.uk/booking/8017/167207" videoType="imax 3d"/>
                    <show time="2019-05-07T15:50:00" url="https://booking.cineworld.co.uk/booking/8017/167598" videoType="imax 3d"/>
                    <show time="2019-05-07T20:00:00" url="https://booking.cineworld.co.uk/booking/8017/167599" videoType="imax 3d"/>
                    <show time="2019-05-08T15:50:00" url="https://booking.cineworld.co.uk/booking/8017/167600" videoType="imax 3d"/>
                    <show time="2019-05-08T20:00:00" url="https://booking.cineworld.co.uk/booking/8017/167601" videoType="imax 3d"/>
                    <show time="2019-05-09T15:50:00" url="https://booking.cineworld.co.uk/booking/8017/167602" videoType="imax 3d"/>
                    <show time="2019-05-09T20:00:00" url="https://booking.cineworld.co.uk/booking/8017/167603" videoType="imax 3d"/>
                </shows>
            </film>
            <film title="(3D) Avengers: Endgame" rating="12A" url="films/avengers-endgame" edi="174256" release="25/04/2019">
                <shows>
                    <show time="2019-05-06T11:00:00" url="https://booking.cineworld.co.uk/booking/8017/167249" videoType="3d" audioType="audio described"/>
                    <show time="2019-05-07T15:00:00" url="https://booking.cineworld.co.uk/booking/8017/167592" videoType="3d" audioType="audio described"/>
                    <show time="2019-05-07T19:00:00" url="https://booking.cineworld.co.uk/booking/8017/167593" videoType="3d" audioType="audio described"/>
                    <show time="2019-05-08T15:00:00" url="https://booking.cineworld.co.uk/booking/8017/167594" videoType="3d" audioType="audio described"/>
                    <show time="2019-05-09T15:00:00" url="https://booking.cineworld.co.uk/booking/8017/167596" videoType="3d" audioType="audio described"/>
                    <show time="2019-05-09T19:00:00" url="https://booking.cineworld.co.uk/booking/8017/167597" videoType="3d" audioType="audio described"/>
                </shows>
            </film>
            <film title="(2D) Avengers: Endgame" rating="12A" url="films/avengers-endgame" edi="169126" release="25/04/2019">
                <shows>
                    <show time="2019-05-06T10:20:00" url="https://booking.cineworld.co.uk/booking/8017/167254" audioType="audio described"/>
                    <show time="2019-05-06T12:30:00" url="https://booking.cineworld.co.uk/booking/8017/167246" audioType="audio described"/>
                    <show time="2019-05-06T12:50:00" url="https://booking.cineworld.co.uk/booking/8017/167682" audioType="audio described"/>
                    <show time="2019-05-06T13:40:00" url="https://booking.cineworld.co.uk/booking/8017/167252" audioType="audio described"/>
                    <show time="2019-05-06T14:20:00" url="https://booking.cineworld.co.uk/booking/8017/167255" audioType="audio described"/>
                    <show time="2019-05-06T15:00:00" url="https://booking.cineworld.co.uk/booking/8017/167250" audioType="audio described"/>
                    <show time="2019-05-06T16:30:00" url="https://booking.cineworld.co.uk/booking/8017/167247" audioType="audio described"/>
                    <show time="2019-05-06T18:00:00" url="https://booking.cineworld.co.uk/booking/8017/167253" audioType="audio described"/>
                    <show time="2019-05-06T18:30:00" url="https://booking.cineworld.co.uk/booking/8017/167545" audioType="audio described"/>
                    <show time="2019-05-06T19:00:00" url="https://booking.cineworld.co.uk/booking/8017/167591" audioType="audio described"/>
                    <show time="2019-05-06T20:30:00" url="https://booking.cineworld.co.uk/booking/8017/167248" audioType="audio described"/>
                    <show time="2019-05-06T21:00:00" url="https://booking.cineworld.co.uk/booking/8017/167562" audioType="audio described"/>
                    <show time="2019-05-07T14:20:00" url="https://booking.cineworld.co.uk/booking/8017/167619" audioType="audio described"/>
                    <show time="2019-05-07T16:30:00" url="https://booking.cineworld.co.uk/booking/8017/167531" audioType="audio described"/>
                    <show time="2019-05-07T18:00:00" url="https://booking.cineworld.co.uk/booking/8017/167607" audioType="audio described" subtitled="true"/>
                    <show time="2019-05-07T18:30:00" url="https://booking.cineworld.co.uk/booking/8017/167620" audioType="audio described"/>
                    <show time="2019-05-07T19:30:00" url="https://booking.cineworld.co.uk/booking/8017/167581" audioType="audio described"/>
                    <show time="2019-05-07T20:30:00" url="https://booking.cineworld.co.uk/booking/8017/167532" audioType="audio described"/>
                    <show time="2019-05-07T21:00:00" url="https://booking.cineworld.co.uk/booking/8017/167645" audioType="audio described"/>
                    <show time="2019-05-08T14:20:00" url="https://booking.cineworld.co.uk/booking/8017/167621" audioType="audio described"/>
                    <show time="2019-05-08T16:30:00" url="https://booking.cineworld.co.uk/booking/8017/167533" audioType="audio described"/>
                    <show time="2019-05-08T18:00:00" url="https://booking.cineworld.co.uk/booking/8017/167608" audioType="audio described"/>
                    <show time="2019-05-08T18:30:00" url="https://booking.cineworld.co.uk/booking/8017/167622" audioType="audio described"/>
                    <show time="2019-05-08T19:00:00" url="https://booking.cineworld.co.uk/booking/8017/167595" audioType="audio described"/>
                    <show time="2019-05-08T20:30:00" url="https://booking.cineworld.co.uk/booking/8017/167534" audioType="audio described"/>
                    <show time="2019-05-08T21:00:00" url="https://booking.cineworld.co.uk/booking/8017/167648" audioType="audio described"/>
                    <show time="2019-05-09T14:20:00" url="https://booking.cineworld.co.uk/booking/8017/167623" audioType="audio described"/>
                    <show time="2019-05-09T16:30:00" url="https://booking.cineworld.co.uk/booking/8017/167535" audioType="audio described"/>
                    <show time="2019-05-09T18:00:00" url="https://booking.cineworld.co.uk/booking/8017/167609" audioType="audio described"/>
                    <show time="2019-05-09T18:30:00" url="https://booking.cineworld.co.uk/booking/8017/167624" audioType="audio described" subtitled="true"/>
                    <show time="2019-05-09T19:30:00" url="https://booking.cineworld.co.uk/booking/8017/167584" audioType="audio described"/>
                    <show time="2019-05-09T20:30:00" url="https://booking.cineworld.co.uk/booking/8017/167536" audioType="audio described"/>
                    <show time="2019-05-09T21:00:00" url="https://booking.cineworld.co.uk/booking/8017/167651" audioType="audio described"/>
                </shows>
            </film>
            <film title="Beats : Unlimited Screening" rating="18" url="films/beats-unlimited-screening" edi="801824" release="08/05/2019">
                <shows>
                    <show time="2019-05-08T20:00:00" url="https://booking.cineworld.co.uk/booking/8017/167195" audioType="audio described"/>
                </shows>
            </film>
            <film title="Booksmart: Unlimited Screening" rating="15" url="films/booksmart-unlimited-screening" edi="801833" release="06/05/2019">
                <shows>
                    <show time="2019-05-06T19:45:00" url="https://booking.cineworld.co.uk/booking/8017/167402" audioType="audio described"/>
                </shows>
            </film>
            <film title="(2D) Captain Marvel" rating="12A" url="films/captain-marvel" edi="169122" release="08/03/2019">
                <shows>
                    <show time="2019-05-06T16:40:00" url="https://booking.cineworld.co.uk/booking/8017/167642"/>
                    <show time="2019-05-07T15:10:00" url="https://booking.cineworld.co.uk/booking/8017/167610"/>
                    <show time="2019-05-08T15:10:00" url="https://booking.cineworld.co.uk/booking/8017/167611"/>
                    <show time="2019-05-09T15:10:00" url="https://booking.cineworld.co.uk/booking/8017/167612"/>
                </shows>
            </film>
            <film title="Dumbo" rating="PG" url="films/dumbo" edi="192491" release="29/03/2019">
                <shows>
                    <show time="2019-05-06T10:10:00" url="https://booking.cineworld.co.uk/booking/8017/167577" audioType="audio described"/>
                    <show time="2019-05-06T12:50:00" url="https://booking.cineworld.co.uk/booking/8017/167578" audioType="audio described"/>
                    <show time="2019-05-07T14:10:00" url="https://booking.cineworld.co.uk/booking/8017/167579" audioType="audio described"/>
                    <show time="2019-05-07T16:50:00" url="https://booking.cineworld.co.uk/booking/8017/167580" audioType="audio described"/>
                    <show time="2019-05-08T14:10:00" url="https://booking.cineworld.co.uk/booking/8017/167585" audioType="audio described"/>
                    <show time="2019-05-08T16:50:00" url="https://booking.cineworld.co.uk/booking/8017/167586" audioType="audio described"/>
                    <show time="2019-05-09T14:10:00" url="https://booking.cineworld.co.uk/booking/8017/167582" audioType="audio described"/>
                    <show time="2019-05-09T16:50:00" url="https://booking.cineworld.co.uk/booking/8017/167583" audioType="audio described"/>
                </shows>
            </film>
            <film title="M4J How To Train Your Dragon: The Hidden World" rating="PG" url="films/how-to-train-your-dragon-the-hidden-world-movies-for-juniors" edi="801822" release="01/02/2019">
                <shows>
                    <show time="2019-05-06T10:00:00" url="https://booking.cineworld.co.uk/booking/8017/167653" audioType="audio described"/>
                </shows>
            </film>
            <film title="Long Shot" rating="15" url="films/long-shot" edi="240058" release="03/05/2019">
                <shows>
                    <show time="2019-05-06T11:20:00" url="https://booking.cineworld.co.uk/booking/8017/167558" audioType="audio described"/>
                    <show time="2019-05-06T14:10:00" url="https://booking.cineworld.co.uk/booking/8017/167559" audioType="audio described"/>
                    <show time="2019-05-06T17:00:00" url="https://booking.cineworld.co.uk/booking/8017/167560" audioType="audio described" subtitled="true"/>
                    <show time="2019-05-06T19:50:00" url="https://booking.cineworld.co.uk/booking/8017/167561" audioType="audio described"/>
                    <show time="2019-05-07T14:10:00" url="https://booking.cineworld.co.uk/booking/8017/167523" audioType="audio described"/>
                    <show time="2019-05-07T17:00:00" url="https://booking.cineworld.co.uk/booking/8017/167524" audioType="audio described"/>
                    <show time="2019-05-07T19:50:00" url="https://booking.cineworld.co.uk/booking/8017/167525" audioType="audio described"/>
                    <show time="2019-05-08T14:10:00" url="https://booking.cineworld.co.uk/booking/8017/167526" audioType="audio described"/>
                    <show time="2019-05-08T17:00:00" url="https://booking.cineworld.co.uk/booking/8017/167527" audioType="audio described"/>
                    <show time="2019-05-08T19:45:00" url="https://booking.cineworld.co.uk/booking/8017/167587" audioType="audio described"/>
                    <show time="2019-05-09T14:10:00" url="https://booking.cineworld.co.uk/booking/8017/167528" audioType="audio described"/>
                    <show time="2019-05-09T17:00:00" url="https://booking.cineworld.co.uk/booking/8017/167529" audioType="audio described"/>
                    <show time="2019-05-09T19:50:00" url="https://booking.cineworld.co.uk/booking/8017/167530" audioType="audio described"/>
                </shows>
            </film>
            <film title="Margaret Atwood : Live In Cinemas" rating="12A" url="films/margaret-atwood-live-in-cinemas" edi="272858" release="10/09/2019">
                <shows>
                    <show time="2019-09-10T19:30:00" url="https://booking.cineworld.co.uk/booking/8017/165702"/>
                </shows>
            </film>
            <film title="MET Opera 2019 Dialogues Des Carmelites" rating="12A" url="films/met-opera-2019-dialogues-des-carmelites" edi="249481" release="11/05/2019">
                <shows>
                    <show time="2019-05-11T17:00:00" url="https://booking.cineworld.co.uk/booking/8017/155238"/>
                </shows>
            </film>
            <film title="NT Live: All My Sons" rating="12A" url="films/nt-live-all-my-sons" edi="263592" release="14/05/2019">
                <shows>
                    <show time="2019-05-14T19:00:00" url="https://booking.cineworld.co.uk/booking/8017/160392"/>
                </shows>
            </film>
            <film title="NT Live : One Man, Two Guvnors (Encore)" rating="12A" url="films/nt-live-one-man-two-guvnors-encore" edi="266343" release="26/09/2019">
                <shows>
                    <show time="2019-09-26T19:00:00" url="https://booking.cineworld.co.uk/booking/8017/166916"/>
                </shows>
            </film>
            <film title="NT Live : The Lehman Trilogy" rating="12A" url="films/nt-live-the-lehman-trilogy" edi="266345" release="25/07/2019">
                <shows>
                    <show time="2019-07-25T19:00:00" url="https://booking.cineworld.co.uk/booking/8017/166915"/>
                </shows>
            </film>
            <film title="Paw Patrol: Mighty Pups - The Movie" rating="TBC" url="films/paw-patrol-mighty-pups" edi="261550" release="17/05/2019">
                <shows>
                    <show time="2019-05-17T16:00:00" url="https://booking.cineworld.co.uk/booking/8017/166919" audioType="audio described"/>
                    <show time="2019-05-18T10:30:00" url="https://booking.cineworld.co.uk/booking/8017/166920" audioType="audio described"/>
                    <show time="2019-05-18T12:20:00" url="https://booking.cineworld.co.uk/booking/8017/166921" audioType="audio described"/>
                    <show time="2019-05-18T14:10:00" url="https://booking.cineworld.co.uk/booking/8017/166922" audioType="audio described"/>
                    <show time="2019-05-18T16:00:00" url="https://booking.cineworld.co.uk/booking/8017/166923" audioType="audio described"/>
                    <show time="2019-05-19T10:30:00" url="https://booking.cineworld.co.uk/booking/8017/166924" audioType="audio described"/>
                    <show time="2019-05-19T12:20:00" url="https://booking.cineworld.co.uk/booking/8017/166925" audioType="audio described"/>
                    <show time="2019-05-19T14:10:00" url="https://booking.cineworld.co.uk/booking/8017/166926" audioType="audio described"/>
                    <show time="2019-05-19T16:00:00" url="https://booking.cineworld.co.uk/booking/8017/166927" audioType="audio described"/>
                </shows>
            </film>
            <film title="(2D) Detective Pikachu" rating="PG" url="films/pokemon-detective-pikachu" edi="244991" release="10/05/2019">
                <shows>
                    <show time="2019-05-10T15:00:00" url="https://booking.cineworld.co.uk/booking/8017/167657" audioType="audio described"/>
                    <show time="2019-05-10T17:40:00" url="https://booking.cineworld.co.uk/booking/8017/167658" audioType="audio described"/>
                    <show time="2019-05-10T20:20:00" url="https://booking.cineworld.co.uk/booking/8017/167659" audioType="audio described"/>
                    <show time="2019-05-11T12:30:00" url="https://booking.cineworld.co.uk/booking/8017/167669" audioType="audio described"/>
                    <show time="2019-05-11T15:00:00" url="https://booking.cineworld.co.uk/booking/8017/167661" audioType="audio described"/>
                    <show time="2019-05-11T17:40:00" url="https://booking.cineworld.co.uk/booking/8017/167662" audioType="audio described"/>
                    <show time="2019-05-11T20:20:00" url="https://booking.cineworld.co.uk/booking/8017/167663" audioType="audio described"/>
                    <show time="2019-05-12T12:30:00" url="https://booking.cineworld.co.uk/booking/8017/167670" audioType="audio described"/>
                    <show time="2019-05-12T15:00:00" url="https://booking.cineworld.co.uk/booking/8017/167665" audioType="audio described"/>
                    <show time="2019-05-12T17:40:00" url="https://booking.cineworld.co.uk/booking/8017/167666" audioType="audio described"/>
                    <show time="2019-05-12T20:20:00" url="https://booking.cineworld.co.uk/booking/8017/167667" audioType="audio described"/>
                </shows>
            </film>
            <film title="(IMAX) Pokemon Detective Pikachu" rating="PG" url="films/pokemon-detective-pikachu" edi="245038" release="10/05/2019">
                <shows>
                    <show time="2019-05-10T17:00:00" url="https://booking.cineworld.co.uk/booking/8017/167660" videoType="imax" audioType="audio described"/>
                    <show time="2019-05-11T17:00:00" url="https://booking.cineworld.co.uk/booking/8017/167664" videoType="imax" audioType="audio described"/>
                    <show time="2019-05-12T17:00:00" url="https://booking.cineworld.co.uk/booking/8017/167668" videoType="imax" audioType="audio described"/>
                </shows>
            </film>
            <film title="Red Joan" rating="12A" url="films/red-joan" edi="251781" release="19/04/2019">
                <shows>
                    <show time="2019-05-07T14:00:00" url="https://booking.cineworld.co.uk/booking/8017/167654" audioType="audio described"/>
                    <show time="2019-05-08T14:00:00" url="https://booking.cineworld.co.uk/booking/8017/167655" audioType="audio described"/>
                    <show time="2019-05-09T14:00:00" url="https://booking.cineworld.co.uk/booking/8017/167656" audioType="audio described"/>
                </shows>
            </film>
            <film title="RSC Live : Measure For Measure" rating="12A" url="films/rsc-live-measure-for-measure" edi="263087" release="31/07/2019">
                <shows>
                    <show time="2019-07-31T19:00:00" url="https://booking.cineworld.co.uk/booking/8017/157921"/>
                </shows>
            </film>
            <film title="M4J Spider-Man: Into The Spider-Verse" rating="PG" url="films/spider-man-into-the-spider-verse-movies-for-juniors" edi="801735" release="15/02/2019">
                <shows>
                    <show time="2019-05-06T10:50:00" url="https://booking.cineworld.co.uk/booking/8017/167615" audioType="audio described"/>
                </shows>
            </film>
            <film title="The Curse Of La Llorona" rating="15" url="films/the-curse-of-la-llorona" edi="250922" release="03/05/2019">
                <shows>
                    <show time="2019-05-06T10:30:00" url="https://booking.cineworld.co.uk/booking/8017/167478" audioType="audio described"/>
                    <show time="2019-05-06T16:20:00" url="https://booking.cineworld.co.uk/booking/8017/167480" audioType="audio described"/>
                    <show time="2019-05-06T18:40:00" url="https://booking.cineworld.co.uk/booking/8017/167481" audioType="audio described"/>
                    <show time="2019-05-06T21:00:00" url="https://booking.cineworld.co.uk/booking/8017/167482" audioType="audio described"/>
                    <show time="2019-05-07T14:00:00" url="https://booking.cineworld.co.uk/booking/8017/167483" audioType="audio described"/>
                    <show time="2019-05-07T16:20:00" url="https://booking.cineworld.co.uk/booking/8017/167484" audioType="audio described"/>
                    <show time="2019-05-07T18:40:00" url="https://booking.cineworld.co.uk/booking/8017/167485" audioType="audio described"/>
                    <show time="2019-05-07T21:00:00" url="https://booking.cineworld.co.uk/booking/8017/167486" audioType="audio described"/>
                    <show time="2019-05-08T14:00:00" url="https://booking.cineworld.co.uk/booking/8017/167487" audioType="audio described"/>
                    <show time="2019-05-08T16:20:00" url="https://booking.cineworld.co.uk/booking/8017/167488" audioType="audio described"/>
                    <show time="2019-05-08T18:40:00" url="https://booking.cineworld.co.uk/booking/8017/167489" audioType="audio described"/>
                    <show time="2019-05-08T21:00:00" url="https://booking.cineworld.co.uk/booking/8017/167490" audioType="audio described"/>
                    <show time="2019-05-09T14:00:00" url="https://booking.cineworld.co.uk/booking/8017/167491" audioType="audio described"/>
                    <show time="2019-05-09T16:20:00" url="https://booking.cineworld.co.uk/booking/8017/167492" audioType="audio described"/>
                    <show time="2019-05-09T18:40:00" url="https://booking.cineworld.co.uk/booking/8017/167493" audioType="audio described"/>
                    <show time="2019-05-09T21:00:00" url="https://booking.cineworld.co.uk/booking/8017/167494" audioType="audio described"/>
                </shows>
            </film>
            <film title="The Secret Life Of Pets 2" rating="U" url="films/the-secret-life-of-pets-2" edi="192838" release="24/05/2019">
                <shows>
                    <show time="2019-05-24T10:00:00" url="https://booking.cineworld.co.uk/booking/8017/166135" audioType="audio described"/>
                    <show time="2019-05-24T12:15:00" url="https://booking.cineworld.co.uk/booking/8017/166136" audioType="audio described"/>
                    <show time="2019-05-24T14:30:00" url="https://booking.cineworld.co.uk/booking/8017/166137" audioType="audio described"/>
                    <show time="2019-05-24T16:45:00" url="https://booking.cineworld.co.uk/booking/8017/166138" audioType="audio described"/>
                    <show time="2019-05-25T10:00:00" url="https://booking.cineworld.co.uk/booking/8017/166139" audioType="audio described"/>
                    <show time="2019-05-25T12:15:00" url="https://booking.cineworld.co.uk/booking/8017/166140" audioType="audio described"/>
                    <show time="2019-05-25T14:30:00" url="https://booking.cineworld.co.uk/booking/8017/166141" audioType="audio described"/>
                    <show time="2019-05-25T16:45:00" url="https://booking.cineworld.co.uk/booking/8017/166142" audioType="audio described"/>
                    <show time="2019-05-26T10:00:00" url="https://booking.cineworld.co.uk/booking/8017/166143" audioType="audio described"/>
                    <show time="2019-05-26T12:15:00" url="https://booking.cineworld.co.uk/booking/8017/166144" audioType="audio described"/>
                    <show time="2019-05-26T14:30:00" url="https://booking.cineworld.co.uk/booking/8017/166145" audioType="audio described"/>
                    <show time="2019-05-26T16:45:00" url="https://booking.cineworld.co.uk/booking/8017/166146" audioType="audio described"/>
                    <show time="2019-05-27T10:00:00" url="https://booking.cineworld.co.uk/booking/8017/166147" audioType="audio described"/>
                    <show time="2019-05-27T12:15:00" url="https://booking.cineworld.co.uk/booking/8017/166148" audioType="audio described"/>
                    <show time="2019-05-27T14:30:00" url="https://booking.cineworld.co.uk/booking/8017/166149" audioType="audio described"/>
                    <show time="2019-05-27T16:45:00" url="https://booking.cineworld.co.uk/booking/8017/166150" audioType="audio described"/>
                    <show time="2019-05-28T10:00:00" url="https://booking.cineworld.co.uk/booking/8017/166151" audioType="audio described"/>
                    <show time="2019-05-28T12:15:00" url="https://booking.cineworld.co.uk/booking/8017/166152" audioType="audio described"/>
                    <show time="2019-05-28T14:30:00" url="https://booking.cineworld.co.uk/booking/8017/166153" audioType="audio described"/>
                    <show time="2019-05-28T16:45:00" url="https://booking.cineworld.co.uk/booking/8017/166154" audioType="audio described"/>
                </shows>
            </film>
            <film title="Tolkien" rating="12A" url="films/tolkien" edi="271425" release="03/05/2019">
                <shows>
                    <show time="2019-05-06T12:10:00" url="https://booking.cineworld.co.uk/booking/8017/167510" audioType="audio described"/>
                    <show time="2019-05-06T14:50:00" url="https://booking.cineworld.co.uk/booking/8017/167511" audioType="audio described"/>
                    <show time="2019-05-06T17:30:00" url="https://booking.cineworld.co.uk/booking/8017/167512" audioType="audio described"/>
                    <show time="2019-05-06T20:10:00" url="https://booking.cineworld.co.uk/booking/8017/167513" audioType="audio described"/>
                    <show time="2019-05-07T14:50:00" url="https://booking.cineworld.co.uk/booking/8017/167514" audioType="audio described"/>
                    <show time="2019-05-07T17:30:00" url="https://booking.cineworld.co.uk/booking/8017/167515" audioType="audio described"/>
                    <show time="2019-05-07T20:10:00" url="https://booking.cineworld.co.uk/booking/8017/167516" audioType="audio described"/>
                    <show time="2019-05-08T14:50:00" url="https://booking.cineworld.co.uk/booking/8017/167517" audioType="audio described"/>
                    <show time="2019-05-08T17:30:00" url="https://booking.cineworld.co.uk/booking/8017/167518" audioType="audio described"/>
                    <show time="2019-05-08T20:10:00" url="https://booking.cineworld.co.uk/booking/8017/167519" audioType="audio described"/>
                    <show time="2019-05-09T14:50:00" url="https://booking.cineworld.co.uk/booking/8017/167520" audioType="audio described"/>
                    <show time="2019-05-09T17:30:00" url="https://booking.cineworld.co.uk/booking/8017/167521" audioType="audio described"/>
                    <show time="2019-05-09T20:10:00" url="https://booking.cineworld.co.uk/booking/8017/167522" audioType="audio described"/>
                </shows>
            </film>
            <film title="Victoria - Northern Ballet" rating="PG" url="films/victoria-northern-ballet" edi="270190" release="25/06/2019">
                <shows>
                    <show time="2019-06-25T19:30:00" url="https://booking.cineworld.co.uk/booking/8017/163525"/>
                </shows>
            </film>
            <film title="(2D) Wonder Park" rating="PG" url="films/wonder-park" edi="194897" release="12/04/2019">
                <shows>
                    <show time="2019-05-06T10:00:00" url="https://booking.cineworld.co.uk/booking/8017/167497" audioType="audio described"/>
                </shows>
            </film>
            <film title="X-Men: Dark Phoenix" rating="TBC" url="films/x-men-dark-phoenix" edi="220087" release="05/06/2019">
                <shows>
                    <show time="2019-06-05T13:45:00" url="https://booking.cineworld.co.uk/booking/8017/167435" audioType="audio described"/>
                    <show time="2019-06-05T16:30:00" url="https://booking.cineworld.co.uk/booking/8017/167436" audioType="audio described"/>
                    <show time="2019-06-05T19:15:00" url="https://booking.cineworld.co.uk/booking/8017/167437" audioType="audio described"/>
                    <show time="2019-06-07T13:45:00" url="https://booking.cineworld.co.uk/booking/8017/167432" audioType="audio described"/>
                    <show time="2019-06-07T16:30:00" url="https://booking.cineworld.co.uk/booking/8017/167433" audioType="audio described"/>
                    <show time="2019-06-07T19:15:00" url="https://booking.cineworld.co.uk/booking/8017/167434" audioType="audio described"/>
                    <show time="2019-06-08T13:45:00" url="https://booking.cineworld.co.uk/booking/8017/167429" audioType="audio described"/>
                    <show time="2019-06-08T16:30:00" url="https://booking.cineworld.co.uk/booking/8017/167430" audioType="audio described"/>
                    <show time="2019-06-08T19:15:00" url="https://booking.cineworld.co.uk/booking/8017/167431" audioType="audio described"/>
                    <show time="2019-06-09T13:45:00" url="https://booking.cineworld.co.uk/booking/8017/167421" audioType="audio described"/>
                    <show time="2019-06-09T16:30:00" url="https://booking.cineworld.co.uk/booking/8017/167427" audioType="audio described"/>
                    <show time="2019-06-09T19:15:00" url="https://booking.cineworld.co.uk/booking/8017/167428" audioType="audio described"/>
                </shows>
            </film>
        </listing>
    </cinema>
    <cinema name="Cineworld Basildon" root="http://www1.cineworld.co.uk/" url="cinemas/basildon" id="104" phone="0871 200 2000" address="Festival Leisure Park, Basildon" postcode="SS14 3WB">
        <listing>
            <film title="A Dog's Journey" rating="PG" url="films/a-dogs-journey" edi="255103" release="03/05/2019">
                <shows>
                    <show time="2019-05-06T10:40:00" url="https://booking.cineworld.co.uk/booking/8113/75174"/>
                    <show time="2019-05-06T13:20:00" url="https://booking.cineworld.co.uk/booking/8113/75175"/>
                    <show time="2019-05-06T16:00:00" url="https://booking.cineworld.co.uk/booking/8113/75176"/>
                    <show time="2019-05-06T17:50:00" url="https://booking.cineworld.co.uk/booking/8113/75453" audioType="audio described"/>
                    <show time="2019-05-07T10:40:00" url="https://booking.cineworld.co.uk/booking/8113/75177"/>
                    <show time="2019-05-07T13:20:00" url="https://booking.cineworld.co.uk/booking/8113/75178"/>
                    <show time="2019-05-07T16:10:00" url="https://booking.cineworld.co.uk/booking/8113/75179"/>
                    <show time="2019-05-07T17:50:00" url="https://booking.cineworld.co.uk/booking/8113/75454" audioType="audio described"/>
                    <show time="2019-05-08T10:40:00" url="https://booking.cineworld.co.uk/booking/8113/75180"/>
                    <show time="2019-05-08T13:20:00" url="https://booking.cineworld.co.uk/booking/8113/75181"/>
                    <show time="2019-05-08T16:00:00" url="https://booking.cineworld.co.uk/booking/8113/75182"/>
                    <show time="2019-05-08T17:50:00" url="https://booking.cineworld.co.uk/booking/8113/75455" audioType="audio described"/>
                    <show time="2019-05-09T10:40:00" url="https://booking.cineworld.co.uk/booking/8113/75183"/>
                    <show time="2019-05-09T13:20:00" url="https://booking.cineworld.co.uk/booking/8113/75184"/>
                    <show time="2019-05-09T16:00:00" url="https://booking.cineworld.co.uk/booking/8113/75185"/>
                    <show time="2019-05-09T17:50:00" url="https://booking.cineworld.co.uk/booking/8113/75456" audioType="audio described"/>
                </shows>
            </film>
            <film title="An American In Paris : The Musi" rating="PG" url="films/an-american-in-paris-the-musical-2019-encore" edi="243197" release="07/05/2019">
                <shows>
                    <show time="2019-05-07T19:00:00" url="https://booking.cineworld.co.uk/booking/8113/73615"/>
                </shows>
            </film>
            <film title="Andre Rieu 2019 Maastricht Concert Shall We Dance?" rating="PG" url="films/andre-rieu-2019-maastricht-concert-shall-we-dance" edi="255443" release="27/07/2019">
                <shows>
                    <show time="2019-07-27T19:00:00" url="https://booking.cineworld.co.uk/booking/8113/68792"/>
                    <show time="2019-07-28T15:00:00" url="https://booking.cineworld.co.uk/booking/8113/68793"/>
                </shows>
            </film>
            <film title="Asbury Park : Riot, Redemtpion, Rock &amp; Roll" rating="12A" url="films/asbury-park-riot-redemption-rock-n-roll" edi="272389" release="22/05/2019">
                <shows>
                    <show time="2019-05-22T19:30:00" url="https://booking.cineworld.co.uk/booking/8113/72450"/>
                </shows>
            </film>
            <film title="Autism Friendly Screening: Secret Life Of Pets 2" rating="U" url="films/autism-friendly-screening-secret-life-of-pets-2" edi="801857" release="02/06/2019">
                <shows>
                    <show time="2019-06-02T11:00:00" url="https://booking.cineworld.co.uk/booking/8113/75582" audioType="audio described"/>
                </shows>
            </film>
            <film title="(IMAX 3-D) Avengers: Endgame" rating="12A" url="films/avengers-endgame" edi="230548" release="25/04/2019">
                <shows>
                    <show time="2019-05-06T11:20:00" url="https://booking.cineworld.co.uk/booking/8113/74764" videoType="imax 3d"/>
                    <show time="2019-05-06T15:20:00" url="https://booking.cineworld.co.uk/booking/8113/74765" videoType="imax 3d"/>
                    <show time="2019-05-06T19:20:00" url="https://booking.cineworld.co.uk/booking/8113/74766" videoType="imax 3d"/>
                    <show time="2019-05-07T11:20:00" url="https://booking.cineworld.co.uk/booking/8113/75156" videoType="imax 3d"/>
                    <show time="2019-05-07T15:20:00" url="https://booking.cineworld.co.uk/booking/8113/75157" videoType="imax 3d"/>
                    <show time="2019-05-07T19:20:00" url="https://booking.cineworld.co.uk/booking/8113/75158" videoType="imax 3d"/>
                    <show time="2019-05-08T11:20:00" url="https://booking.cineworld.co.uk/booking/8113/75159" videoType="imax 3d"/>
                    <show time="2019-05-08T15:20:00" url="https://booking.cineworld.co.uk/booking/8113/75160" videoType="imax 3d"/>
                    <show time="2019-05-08T19:20:00" url="https://booking.cineworld.co.uk/booking/8113/75161" videoType="imax 3d"/>
                    <show time="2019-05-09T11:20:00" url="https://booking.cineworld.co.uk/booking/8113/75162" videoType="imax 3d"/>
                    <show time="2019-05-09T15:20:00" url="https://booking.cineworld.co.uk/booking/8113/75163" videoType="imax 3d"/>
                    <show time="2019-05-09T19:20:00" url="https://booking.cineworld.co.uk/booking/8113/75164" videoType="imax 3d"/>
                </shows>
            </film>
            <film title="(3D) Avengers: Endgame" rating="12A" url="films/avengers-endgame" edi="174256" release="25/04/2019">
                <shows>
                    <show time="2019-05-09T19:40:00" url="https://booking.cineworld.co.uk/booking/8113/75423" videoType="3d" audioType="audio described"/>
                </shows>
            </film>
            <film title="(4DX 3D) Avengers: ENDGAME" rating="12A" url="films/avengers-endgame" edi="801784" release="25/04/2019">
                <shows>
                    <show time="2019-05-06T12:20:00" url="https://booking.cineworld.co.uk/booking/8113/74767" videoType="3d" audioType="audio described"/>
                    <show time="2019-05-06T16:20:00" url="https://booking.cineworld.co.uk/booking/8113/74768" videoType="3d" audioType="audio described"/>
                    <show time="2019-05-06T20:20:00" url="https://booking.cineworld.co.uk/booking/8113/74769" videoType="3d" audioType="audio described"/>
                    <show time="2019-05-07T12:20:00" url="https://booking.cineworld.co.uk/booking/8113/75254" videoType="3d" audioType="audio described"/>
                    <show time="2019-05-07T16:20:00" url="https://booking.cineworld.co.uk/booking/8113/75255" videoType="3d" audioType="audio described"/>
                    <show time="2019-05-07T20:20:00" url="https://booking.cineworld.co.uk/booking/8113/75256" videoType="3d" audioType="audio described"/>
                    <show time="2019-05-08T12:20:00" url="https://booking.cineworld.co.uk/booking/8113/75257" videoType="3d" audioType="audio described"/>
                    <show time="2019-05-08T16:20:00" url="https://booking.cineworld.co.uk/booking/8113/75258" videoType="3d" audioType="audio described"/>
                    <show time="2019-05-08T20:20:00" url="https://booking.cineworld.co.uk/booking/8113/75259" videoType="3d" audioType="audio described"/>
                    <show time="2019-05-09T12:20:00" url="https://booking.cineworld.co.uk/booking/8113/75260" videoType="3d" audioType="audio described"/>
                    <show time="2019-05-09T16:20:00" url="https://booking.cineworld.co.uk/booking/8113/75261" videoType="3d" audioType="audio described"/>
                    <show time="2019-05-09T20:20:00" url="https://booking.cineworld.co.uk/booking/8113/75262" videoType="3d" audioType="audio described"/>
                </shows>
            </film>
            <film title="(2D) Avengers: Endgame" rating="12A" url="films/avengers-endgame" edi="169126" release="25/04/2019">
                <shows>
                    <show time="2019-05-06T09:15:00" url="https://booking.cineworld.co.uk/booking/8113/75518" audioType="audio described"/>
                    <show time="2019-05-06T10:00:00" url="https://booking.cineworld.co.uk/booking/8113/74779"/>
                    <show time="2019-05-06T10:30:00" url="https://booking.cineworld.co.uk/booking/8113/75221" audioType="audio described"/>
                    <show time="2019-05-06T10:50:00" url="https://booking.cineworld.co.uk/booking/8113/74774" audioType="audio described"/>
                    <show time="2019-05-06T11:50:00" url="https://booking.cineworld.co.uk/booking/8113/74770"/>
                    <show time="2019-05-06T12:50:00" url="https://booking.cineworld.co.uk/booking/8113/75332" audioType="audio described"/>
                    <show time="2019-05-06T13:10:00" url="https://booking.cineworld.co.uk/booking/8113/74782" audioType="audio described"/>
                    <show time="2019-05-06T13:30:00" url="https://booking.cineworld.co.uk/booking/8113/75412" audioType="audio described"/>
                    <show time="2019-05-06T14:00:00" url="https://booking.cineworld.co.uk/booking/8113/74780"/>
                    <show time="2019-05-06T14:30:00" url="https://booking.cineworld.co.uk/booking/8113/75222" audioType="audio described"/>
                    <show time="2019-05-06T14:50:00" url="https://booking.cineworld.co.uk/booking/8113/74775" audioType="audio described"/>
                    <show time="2019-05-06T15:50:00" url="https://booking.cineworld.co.uk/booking/8113/74771"/>
                    <show time="2019-05-06T16:50:00" url="https://booking.cineworld.co.uk/booking/8113/75333" audioType="audio described"/>
                    <show time="2019-05-06T17:10:00" url="https://booking.cineworld.co.uk/booking/8113/74783" audioType="audio described"/>
                    <show time="2019-05-06T17:30:00" url="https://booking.cineworld.co.uk/booking/8113/75413" audioType="audio described"/>
                    <show time="2019-05-06T18:00:00" url="https://booking.cineworld.co.uk/booking/8113/74781"/>
                    <show time="2019-05-06T18:30:00" url="https://booking.cineworld.co.uk/booking/8113/74777" audioType="audio described"/>
                    <show time="2019-05-06T19:00:00" url="https://booking.cineworld.co.uk/booking/8113/74776" audioType="audio described"/>
                    <show time="2019-05-06T20:00:00" url="https://booking.cineworld.co.uk/booking/8113/74772"/>
                    <show time="2019-05-06T20:40:00" url="https://booking.cineworld.co.uk/booking/8113/74773" audioType="audio described"/>
                    <show time="2019-05-06T21:10:00" url="https://booking.cineworld.co.uk/booking/8113/74784" audioType="audio described"/>
                    <show time="2019-05-06T21:30:00" url="https://booking.cineworld.co.uk/booking/8113/75414" audioType="audio described"/>
                    <show time="2019-05-06T21:45:00" url="https://booking.cineworld.co.uk/booking/8113/75517"/>
                    <show time="2019-05-07T10:00:00" url="https://booking.cineworld.co.uk/booking/8113/75245"/>
                    <show time="2019-05-07T10:30:00" url="https://booking.cineworld.co.uk/booking/8113/75224" audioType="audio described"/>
                    <show time="2019-05-07T10:50:00" url="https://booking.cineworld.co.uk/booking/8113/75232" audioType="audio described"/>
                    <show time="2019-05-07T11:50:00" url="https://booking.cineworld.co.uk/booking/8113/75375"/>
                    <show time="2019-05-07T12:50:00" url="https://booking.cineworld.co.uk/booking/8113/75358"/>
                    <show time="2019-05-07T13:10:00" url="https://booking.cineworld.co.uk/booking/8113/75198" audioType="audio described"/>
                    <show time="2019-05-07T13:30:00" url="https://booking.cineworld.co.uk/booking/8113/75415" audioType="audio described"/>
                    <show time="2019-05-07T14:00:00" url="https://booking.cineworld.co.uk/booking/8113/75246"/>
                    <show time="2019-05-07T14:30:00" url="https://booking.cineworld.co.uk/booking/8113/75225" audioType="audio described"/>
                    <show time="2019-05-07T14:50:00" url="https://booking.cineworld.co.uk/booking/8113/75233" audioType="audio described"/>
                    <show time="2019-05-07T15:50:00" url="https://booking.cineworld.co.uk/booking/8113/75376"/>
                    <show time="2019-05-07T16:50:00" url="https://booking.cineworld.co.uk/booking/8113/75359"/>
                    <show time="2019-05-07T17:10:00" url="https://booking.cineworld.co.uk/booking/8113/75199" audioType="audio described"/>
                    <show time="2019-05-07T17:30:00" url="https://booking.cineworld.co.uk/booking/8113/75416" audioType="audio described"/>
                    <show time="2019-05-07T18:00:00" url="https://booking.cineworld.co.uk/booking/8113/75247"/>
                    <show time="2019-05-07T18:30:00" url="https://booking.cineworld.co.uk/booking/8113/75223" audioType="audio described"/>
                    <show time="2019-05-07T18:50:00" url="https://booking.cineworld.co.uk/booking/8113/75234" audioType="audio described"/>
                    <show time="2019-05-07T20:00:00" url="https://booking.cineworld.co.uk/booking/8113/75377"/>
                    <show time="2019-05-07T20:40:00" url="https://booking.cineworld.co.uk/booking/8113/75263" audioType="audio described"/>
                    <show time="2019-05-07T21:10:00" url="https://booking.cineworld.co.uk/booking/8113/75200" audioType="audio described"/>
                    <show time="2019-05-07T21:30:00" url="https://booking.cineworld.co.uk/booking/8113/75417" audioType="audio described"/>
                    <show time="2019-05-07T21:45:00" url="https://booking.cineworld.co.uk/booking/8113/75519"/>
                    <show time="2019-05-08T10:00:00" url="https://booking.cineworld.co.uk/booking/8113/75248"/>
                    <show time="2019-05-08T10:30:00" url="https://booking.cineworld.co.uk/booking/8113/75227" audioType="audio described"/>
                    <show time="2019-05-08T10:50:00" url="https://booking.cineworld.co.uk/booking/8113/75235" audioType="audio described"/>
                    <show time="2019-05-08T11:50:00" url="https://booking.cineworld.co.uk/booking/8113/75378"/>
                    <show time="2019-05-08T12:50:00" url="https://booking.cineworld.co.uk/booking/8113/75360"/>
                    <show time="2019-05-08T13:10:00" url="https://booking.cineworld.co.uk/booking/8113/75201" audioType="audio described"/>
                    <show time="2019-05-08T13:30:00" url="https://booking.cineworld.co.uk/booking/8113/75418" audioType="audio described"/>
                    <show time="2019-05-08T14:00:00" url="https://booking.cineworld.co.uk/booking/8113/75249"/>
                    <show time="2019-05-08T14:30:00" url="https://booking.cineworld.co.uk/booking/8113/75228" audioType="audio described"/>
                    <show time="2019-05-08T14:50:00" url="https://booking.cineworld.co.uk/booking/8113/75236" audioType="audio described"/>
                    <show time="2019-05-08T15:50:00" url="https://booking.cineworld.co.uk/booking/8113/75379"/>
                    <show time="2019-05-08T16:50:00" url="https://booking.cineworld.co.uk/booking/8113/75361"/>
                    <show time="2019-05-08T17:10:00" url="https://booking.cineworld.co.uk/booking/8113/75202" audioType="audio described"/>
                    <show time="2019-05-08T17:30:00" url="https://booking.cineworld.co.uk/booking/8113/75419" audioType="audio described"/>
                    <show time="2019-05-08T18:00:00" url="https://booking.cineworld.co.uk/booking/8113/75250"/>
                    <show time="2019-05-08T18:30:00" url="https://booking.cineworld.co.uk/booking/8113/75226" audioType="audio described"/>
                    <show time="2019-05-08T19:00:00" url="https://booking.cineworld.co.uk/booking/8113/75237" audioType="audio described"/>
                    <show time="2019-05-08T19:50:00" url="https://booking.cineworld.co.uk/booking/8113/75380"/>
                    <show time="2019-05-08T20:40:00" url="https://booking.cineworld.co.uk/booking/8113/75334" audioType="audio described"/>
                    <show time="2019-05-08T21:10:00" url="https://booking.cineworld.co.uk/booking/8113/75203" audioType="audio described"/>
                    <show time="2019-05-08T21:30:00" url="https://booking.cineworld.co.uk/booking/8113/75420" audioType="audio described"/>
                    <show time="2019-05-08T21:45:00" url="https://booking.cineworld.co.uk/booking/8113/75522"/>
                    <show time="2019-05-09T09:20:00" url="https://booking.cineworld.co.uk/booking/8113/75523" audioType="audio described" subtitled="true"/>
                    <show time="2019-05-09T10:00:00" url="https://booking.cineworld.co.uk/booking/8113/75251"/>
                    <show time="2019-05-09T10:30:00" url="https://booking.cineworld.co.uk/booking/8113/75230" audioType="audio described"/>
                    <show time="2019-05-09T10:50:00" url="https://booking.cineworld.co.uk/booking/8113/75238" audioType="audio described"/>
                    <show time="2019-05-09T11:50:00" url="https://booking.cineworld.co.uk/booking/8113/75381"/>
                    <show time="2019-05-09T12:50:00" url="https://booking.cineworld.co.uk/booking/8113/75362"/>
                    <show time="2019-05-09T13:10:00" url="https://booking.cineworld.co.uk/booking/8113/75204" audioType="audio described"/>
                    <show time="2019-05-09T13:30:00" url="https://booking.cineworld.co.uk/booking/8113/75337" audioType="audio described"/>
                    <show time="2019-05-09T14:00:00" url="https://booking.cineworld.co.uk/booking/8113/75252"/>
                    <show time="2019-05-09T14:30:00" url="https://booking.cineworld.co.uk/booking/8113/75231" audioType="audio described"/>
                    <show time="2019-05-09T14:50:00" url="https://booking.cineworld.co.uk/booking/8113/75239" audioType="audio described"/>
                    <show time="2019-05-09T15:50:00" url="https://booking.cineworld.co.uk/booking/8113/75382"/>
                    <show time="2019-05-09T16:50:00" url="https://booking.cineworld.co.uk/booking/8113/75363"/>
                    <show time="2019-05-09T17:10:00" url="https://booking.cineworld.co.uk/booking/8113/75205" audioType="audio described"/>
                    <show time="2019-05-09T17:30:00" url="https://booking.cineworld.co.uk/booking/8113/75336" audioType="audio described"/>
                    <show time="2019-05-09T18:00:00" url="https://booking.cineworld.co.uk/booking/8113/75253"/>
                    <show time="2019-05-09T18:30:00" url="https://booking.cineworld.co.uk/booking/8113/75229" audioType="audio described"/>
                    <show time="2019-05-09T19:00:00" url="https://booking.cineworld.co.uk/booking/8113/75240" audioType="audio described"/>
                    <show time="2019-05-09T20:00:00" url="https://booking.cineworld.co.uk/booking/8113/75383"/>
                    <show time="2019-05-09T20:40:00" url="https://booking.cineworld.co.uk/booking/8113/75264" audioType="audio described"/>
                    <show time="2019-05-09T21:10:00" url="https://booking.cineworld.co.uk/booking/8113/75206" audioType="audio described"/>
                    <show time="2019-05-09T21:30:00" url="https://booking.cineworld.co.uk/booking/8113/75335" audioType="audio described"/>
                    <show time="2019-05-09T21:45:00" url="https://booking.cineworld.co.uk/booking/8113/75525"/>
                </shows>
            </film>
            <film title="Beats : Unlimited Screening" rating="18" url="films/beats-unlimited-screening" edi="801824" release="08/05/2019">
                <shows>
                    <show time="2019-05-08T20:00:00" url="https://booking.cineworld.co.uk/booking/8113/74700" audioType="audio described"/>
                </shows>
            </film>
            <film title="Booksmart: Unlimited Screening" rating="15" url="films/booksmart-unlimited-screening" edi="801833" release="06/05/2019">
                <shows>
                    <show time="2019-05-06T19:45:00" url="https://booking.cineworld.co.uk/booking/8113/75049"/>
                </shows>
            </film>
            <film title="(2D) Captain Marvel" rating="12A" url="films/captain-marvel" edi="169122" release="08/03/2019">
                <shows>
                    <show time="2019-05-06T11:00:00" url="https://booking.cineworld.co.uk/booking/8113/75393" audioType="audio described"/>
                    <show time="2019-05-06T16:40:00" url="https://booking.cineworld.co.uk/booking/8113/75395" audioType="audio described"/>
                    <show time="2019-05-06T20:30:00" url="https://booking.cineworld.co.uk/booking/8113/75440" audioType="audio described"/>
                    <show time="2019-05-07T11:00:00" url="https://booking.cineworld.co.uk/booking/8113/75396" audioType="audio described"/>
                    <show time="2019-05-07T16:40:00" url="https://booking.cineworld.co.uk/booking/8113/75398" audioType="audio described"/>
                    <show time="2019-05-07T20:30:00" url="https://booking.cineworld.co.uk/booking/8113/75499" audioType="audio described"/>
                    <show time="2019-05-08T11:00:00" url="https://booking.cineworld.co.uk/booking/8113/75399" audioType="audio described"/>
                    <show time="2019-05-08T16:40:00" url="https://booking.cineworld.co.uk/booking/8113/75401" audioType="audio described"/>
                    <show time="2019-05-08T20:30:00" url="https://booking.cineworld.co.uk/booking/8113/75500" audioType="audio described"/>
                    <show time="2019-05-09T11:00:00" url="https://booking.cineworld.co.uk/booking/8113/75402" audioType="audio described"/>
                    <show time="2019-05-09T16:40:00" url="https://booking.cineworld.co.uk/booking/8113/75404" audioType="audio described"/>
                    <show time="2019-05-09T20:30:00" url="https://booking.cineworld.co.uk/booking/8113/75501" audioType="audio described"/>
                </shows>
            </film>
            <film title="Dr Strangelove (Or How I Learned To Stop...) [GCF]" rating="PG" url="films/dr-strangelove-or-how-i-learned-to-stop-worrying-and-love-the-bomb" edi="445976" release="20/05/2019">
                <shows>
                    <show time="2019-05-20T20:00:00" url="https://booking.cineworld.co.uk/booking/8113/75580"/>
                </shows>
            </film>
            <film title="Dumbo" rating="PG" url="films/dumbo" edi="192491" release="29/03/2019">
                <shows>
                    <show time="2019-05-06T11:40:00" url="https://booking.cineworld.co.uk/booking/8113/75364"/>
                    <show time="2019-05-06T14:20:00" url="https://booking.cineworld.co.uk/booking/8113/75365"/>
                    <show time="2019-05-06T17:00:00" url="https://booking.cineworld.co.uk/booking/8113/75366" audioType="audio described"/>
                    <show time="2019-05-07T16:00:00" url="https://booking.cineworld.co.uk/booking/8113/75340" audioType="audio described"/>
                    <show time="2019-05-08T17:00:00" url="https://booking.cineworld.co.uk/booking/8113/75265" audioType="audio described"/>
                    <show time="2019-05-09T17:00:00" url="https://booking.cineworld.co.uk/booking/8113/75430" audioType="audio described"/>
                </shows>
            </film>
            <film title="Everybody's Talking About Jamie Encore" rating="12A" url="films/everybodys-talking-about-jamie-encore" edi="249936" release="13/06/2019">
                <shows>
                    <show time="2019-06-13T19:00:00" url="https://booking.cineworld.co.uk/booking/8113/74231"/>
                </shows>
            </film>
            <film title="Glyndebourne 2019 : Cinderella (Cendrillon)" rating="12A" url="films/glyndebourne-2019-cinderella-cendrillon-live" edi="273307" release="30/06/2019">
                <shows>
                    <show time="2019-06-30T17:30:00" url="https://booking.cineworld.co.uk/booking/8113/72437"/>
                </shows>
            </film>
            <film title="Glyndebourne 2019: The Barber Of Seville (Il barbi" rating="12A" url="films/glyndebourne-2019-the-barber-of-seville-il-barbiere-di-siviglia-recorded" edi="273300" release="14/07/2019">
                <shows>
                    <show time="2019-07-14T17:30:00" url="https://booking.cineworld.co.uk/booking/8113/72438"/>
                </shows>
            </film>
            <film title="Glyndebourne 2019: The Magic Flute (Die Zauberflt" rating="12A" url="films/glyndebourne-2019-the-magic-flute-die-zauberflte-live" edi="273310" release="04/08/2019">
                <shows>
                    <show time="2019-08-04T17:30:00" url="https://booking.cineworld.co.uk/booking/8113/72439"/>
                </shows>
            </film>
            <film title="Greta" rating="15" url="films/greta" edi="245161" release="18/04/2019">
                <shows>
                    <show time="2019-05-07T10:45:00" url="https://booking.cineworld.co.uk/booking/8113/75208" audioType="audio described"/>
                    <show time="2019-05-08T10:45:00" url="https://booking.cineworld.co.uk/booking/8113/75209" audioType="audio described"/>
                    <show time="2019-05-09T10:45:00" url="https://booking.cineworld.co.uk/booking/8113/75210" audioType="audio described"/>
                </shows>
            </film>
            <film title="M4J How To Train Your Dragon: The Hidden World" rating="PG" url="films/how-to-train-your-dragon-the-hidden-world-movies-for-juniors" edi="801822" release="01/02/2019">
                <shows>
                    <show time="2019-05-06T09:50:00" url="https://booking.cineworld.co.uk/booking/8113/75346" audioType="audio described"/>
                </shows>
            </film>
            <film title="Little" rating="12A" url="films/little" edi="250296" release="12/04/2019">
                <shows>
                    <show time="2019-05-07T10:30:00" url="https://booking.cineworld.co.uk/booking/8113/75341" audioType="audio described"/>
                    <show time="2019-05-09T11:30:00" url="https://booking.cineworld.co.uk/booking/8113/75431" audioType="audio described"/>
                </shows>
            </film>
            <film title="Long Shot" rating="15" url="films/long-shot" edi="240058" release="03/05/2019">
                <shows>
                    <show time="2019-05-06T09:15:00" url="https://booking.cineworld.co.uk/booking/8113/75526" audioType="audio described"/>
                    <show time="2019-05-06T11:50:00" url="https://booking.cineworld.co.uk/booking/8113/75275" audioType="audio described"/>
                    <show time="2019-05-06T14:40:00" url="https://booking.cineworld.co.uk/booking/8113/75276" audioType="audio described"/>
                    <show time="2019-05-06T17:40:00" url="https://booking.cineworld.co.uk/booking/8113/75277" audioType="audio described"/>
                    <show time="2019-05-06T19:30:00" url="https://booking.cineworld.co.uk/booking/8113/75408" audioType="audio described"/>
                    <show time="2019-05-06T20:50:00" url="https://booking.cineworld.co.uk/booking/8113/75342" audioType="audio described"/>
                    <show time="2019-05-07T11:40:00" url="https://booking.cineworld.co.uk/booking/8113/75278" audioType="audio described"/>
                    <show time="2019-05-07T14:40:00" url="https://booking.cineworld.co.uk/booking/8113/75279" audioType="audio described"/>
                    <show time="2019-05-07T17:40:00" url="https://booking.cineworld.co.uk/booking/8113/75280" audioType="audio described"/>
                    <show time="2019-05-07T19:30:00" url="https://booking.cineworld.co.uk/booking/8113/75407" audioType="audio described"/>
                    <show time="2019-05-07T20:50:00" url="https://booking.cineworld.co.uk/booking/8113/75370"/>
                    <show time="2019-05-08T11:40:00" url="https://booking.cineworld.co.uk/booking/8113/75343" audioType="audio described"/>
                    <show time="2019-05-08T14:40:00" url="https://booking.cineworld.co.uk/booking/8113/75344" audioType="audio described"/>
                    <show time="2019-05-08T17:40:00" url="https://booking.cineworld.co.uk/booking/8113/75345" audioType="audio described"/>
                    <show time="2019-05-08T19:30:00" url="https://booking.cineworld.co.uk/booking/8113/75406" audioType="audio described"/>
                    <show time="2019-05-08T20:50:00" url="https://booking.cineworld.co.uk/booking/8113/75371"/>
                    <show time="2019-05-09T11:40:00" url="https://booking.cineworld.co.uk/booking/8113/75281" audioType="audio described"/>
                    <show time="2019-05-09T14:40:00" url="https://booking.cineworld.co.uk/booking/8113/75282" audioType="audio described"/>
                    <show time="2019-05-09T17:40:00" url="https://booking.cineworld.co.uk/booking/8113/75283" audioType="audio described"/>
                    <show time="2019-05-09T19:30:00" url="https://booking.cineworld.co.uk/booking/8113/75405" audioType="audio described"/>
                    <show time="2019-05-09T20:50:00" url="https://booking.cineworld.co.uk/booking/8113/75372"/>
                </shows>
            </film>
            <film title="Margaret Atwood : Live In Cinemas" rating="12A" url="films/margaret-atwood-live-in-cinemas" edi="272858" release="10/09/2019">
                <shows>
                    <show time="2019-09-10T19:30:00" url="https://booking.cineworld.co.uk/booking/8113/72016"/>
                </shows>
            </film>
            <film title="Matthew Bourne's Swan Lake (2019)" rating="PG" url="films/matthew-bournes-swan-lake" edi="269440" release="21/05/2019">
                <shows>
                    <show time="2019-05-21T15:45:00" url="https://booking.cineworld.co.uk/booking/8113/69349"/>
                    <show time="2019-05-21T18:35:00" url="https://booking.cineworld.co.uk/booking/8113/69350"/>
                </shows>
            </film>
            <film title="MET Opera 2019 Dialogues Des Carmelites" rating="12A" url="films/met-opera-2019-dialogues-des-carmelites" edi="249481" release="11/05/2019">
                <shows>
                    <show time="2019-05-11T17:00:00" url="https://booking.cineworld.co.uk/booking/8113/58324"/>
                </shows>
            </film>
            <film title="NT Live: All My Sons" rating="12A" url="films/nt-live-all-my-sons" edi="263592" release="14/05/2019">
                <shows>
                    <show time="2019-05-14T19:00:00" url="https://booking.cineworld.co.uk/booking/8113/64961"/>
                </shows>
            </film>
            <film title="NT Live : Small Island" rating="12A" url="films/nt-live-small-island" edi="270872" release="27/06/2019">
                <shows>
                    <show time="2019-06-27T19:00:00" url="https://booking.cineworld.co.uk/booking/8113/68775"/>
                </shows>
            </film>
            <film title="On The Basis Of Sex" rating="12A" url="films/on-the-basis-of-sex" edi="245224" release="22/02/2019">
                <shows>
                    <show time="2019-05-08T11:30:00" url="https://booking.cineworld.co.uk/booking/8113/75498" audioType="audio described"/>
                </shows>
            </film>
            <film title="Pavarotti plus Q&amp;A" rating="TBC" url="films/pavarotti-plus-qa" edi="801820" release="13/07/2019">
                <shows>
                    <show time="2019-07-13T19:00:00" url="https://booking.cineworld.co.uk/booking/8113/75502"/>
                </shows>
            </film>
            <film title="Paw Patrol: Mighty Pups - The Movie" rating="TBC" url="films/paw-patrol-mighty-pups" edi="261550" release="17/05/2019">
                <shows>
                    <show time="2019-05-17T16:00:00" url="https://booking.cineworld.co.uk/booking/8113/74237" audioType="audio described"/>
                    <show time="2019-05-18T10:30:00" url="https://booking.cineworld.co.uk/booking/8113/74238" audioType="audio described"/>
                    <show time="2019-05-18T12:20:00" url="https://booking.cineworld.co.uk/booking/8113/74239" audioType="audio described"/>
                    <show time="2019-05-18T14:10:00" url="https://booking.cineworld.co.uk/booking/8113/74240" audioType="audio described"/>
                    <show time="2019-05-18T16:00:00" url="https://booking.cineworld.co.uk/booking/8113/74241" audioType="audio described"/>
                    <show time="2019-05-19T10:30:00" url="https://booking.cineworld.co.uk/booking/8113/74242" audioType="audio described"/>
                    <show time="2019-05-19T12:20:00" url="https://booking.cineworld.co.uk/booking/8113/74243" audioType="audio described"/>
                    <show time="2019-05-19T14:10:00" url="https://booking.cineworld.co.uk/booking/8113/74244" audioType="audio described"/>
                    <show time="2019-05-19T16:00:00" url="https://booking.cineworld.co.uk/booking/8113/74245" audioType="audio described"/>
                </shows>
            </film>
            <film title="Peppa Pig: Festival Of Fun" rating="U" url="films/peppa-pig-festival-of-fun" edi="256539" release="05/04/2019">
                <shows>
                    <show time="2019-05-06T11:30:00" url="https://booking.cineworld.co.uk/booking/8113/75433" audioType="audio described"/>
                </shows>
            </film>
            <film title="Pet Sematary" rating="15" url="films/pet-sematary" edi="245615" release="05/04/2019">
                <shows>
                    <show time="2019-05-07T13:20:00" url="https://booking.cineworld.co.uk/booking/8113/75349" audioType="audio described"/>
                    <show time="2019-05-08T14:20:00" url="https://booking.cineworld.co.uk/booking/8113/75284" audioType="audio described"/>
                    <show time="2019-05-09T14:20:00" url="https://booking.cineworld.co.uk/booking/8113/75435" audioType="audio described"/>
                </shows>
            </film>
            <film title="(3D) Detective Pikachu" rating="PG" url="films/pokemon-detective-pikachu" edi="245036" release="10/05/2019">
                <shows>
                    <show time="2019-05-10T13:20:00" url="https://booking.cineworld.co.uk/booking/8113/75574" videoType="3d" audioType="audio described"/>
                    <show time="2019-05-10T15:50:00" url="https://booking.cineworld.co.uk/booking/8113/75575" videoType="3d" audioType="audio described"/>
                    <show time="2019-05-11T13:20:00" url="https://booking.cineworld.co.uk/booking/8113/75576" videoType="3d" audioType="audio described"/>
                    <show time="2019-05-11T15:50:00" url="https://booking.cineworld.co.uk/booking/8113/75577" videoType="3d" audioType="audio described"/>
                    <show time="2019-05-12T13:20:00" url="https://booking.cineworld.co.uk/booking/8113/75578" videoType="3d" audioType="audio described"/>
                    <show time="2019-05-12T15:50:00" url="https://booking.cineworld.co.uk/booking/8113/75579" videoType="3d" audioType="audio described"/>
                </shows>
            </film>
            <film title="(2D) Detective Pikachu" rating="PG" url="films/pokemon-detective-pikachu" edi="244991" release="10/05/2019">
                <shows>
                    <show time="2019-05-10T11:20:00" url="https://booking.cineworld.co.uk/booking/8113/75565"/>
                    <show time="2019-05-10T14:00:00" url="https://booking.cineworld.co.uk/booking/8113/75566"/>
                    <show time="2019-05-10T16:30:00" url="https://booking.cineworld.co.uk/booking/8113/75567"/>
                    <show time="2019-05-10T19:20:00" url="https://booking.cineworld.co.uk/booking/8113/75562" audioType="audio described"/>
                    <show time="2019-05-11T11:20:00" url="https://booking.cineworld.co.uk/booking/8113/75568"/>
                    <show time="2019-05-11T14:00:00" url="https://booking.cineworld.co.uk/booking/8113/75569"/>
                    <show time="2019-05-11T16:30:00" url="https://booking.cineworld.co.uk/booking/8113/75570"/>
                    <show time="2019-05-11T19:20:00" url="https://booking.cineworld.co.uk/booking/8113/75563" audioType="audio described"/>
                    <show time="2019-05-12T11:20:00" url="https://booking.cineworld.co.uk/booking/8113/75571"/>
                    <show time="2019-05-12T14:00:00" url="https://booking.cineworld.co.uk/booking/8113/75572"/>
                    <show time="2019-05-12T16:30:00" url="https://booking.cineworld.co.uk/booking/8113/75573"/>
                    <show time="2019-05-12T19:20:00" url="https://booking.cineworld.co.uk/booking/8113/75564" audioType="audio described"/>
                </shows>
            </film>
            <film title="(ScreenX) Pokemon Detective Pikachu" rating="PG" url="films/pokemon-detective-pikachu" edi="801830" release="10/05/2019">
                <shows>
                    <show time="2019-05-10T10:00:00" url="https://booking.cineworld.co.uk/booking/8113/75547" audioType="audio described"/>
                    <show time="2019-05-10T12:30:00" url="https://booking.cineworld.co.uk/booking/8113/75548" audioType="audio described"/>
                    <show time="2019-05-10T15:10:00" url="https://booking.cineworld.co.uk/booking/8113/75549" audioType="audio described"/>
                    <show time="2019-05-10T17:40:00" url="https://booking.cineworld.co.uk/booking/8113/75556" audioType="audio described"/>
                    <show time="2019-05-10T20:10:00" url="https://booking.cineworld.co.uk/booking/8113/75557" audioType="audio described"/>
                    <show time="2019-05-11T10:00:00" url="https://booking.cineworld.co.uk/booking/8113/75550" audioType="audio described"/>
                    <show time="2019-05-11T12:30:00" url="https://booking.cineworld.co.uk/booking/8113/75551" audioType="audio described"/>
                    <show time="2019-05-11T15:10:00" url="https://booking.cineworld.co.uk/booking/8113/75552" audioType="audio described"/>
                    <show time="2019-05-11T17:40:00" url="https://booking.cineworld.co.uk/booking/8113/75558" audioType="audio described"/>
                    <show time="2019-05-11T20:10:00" url="https://booking.cineworld.co.uk/booking/8113/75559" audioType="audio described"/>
                    <show time="2019-05-12T10:00:00" url="https://booking.cineworld.co.uk/booking/8113/75553" audioType="audio described"/>
                    <show time="2019-05-12T12:30:00" url="https://booking.cineworld.co.uk/booking/8113/75554" audioType="audio described"/>
                    <show time="2019-05-12T15:10:00" url="https://booking.cineworld.co.uk/booking/8113/75555" audioType="audio described"/>
                    <show time="2019-05-12T17:40:00" url="https://booking.cineworld.co.uk/booking/8113/75560" audioType="audio described"/>
                    <show time="2019-05-12T20:10:00" url="https://booking.cineworld.co.uk/booking/8113/75561" audioType="audio described"/>
                </shows>
            </film>
            <film title="(4DX 3D) Pokemon Detective Pikachu" rating="PG" url="films/pokemon-detective-pikachu" edi="801828" release="10/05/2019">
                <shows>
                    <show time="2019-05-10T11:50:00" url="https://booking.cineworld.co.uk/booking/8113/75541" videoType="3d" audioType="audio described"/>
                    <show time="2019-05-10T18:20:00" url="https://booking.cineworld.co.uk/booking/8113/75544" videoType="3d" audioType="audio described"/>
                    <show time="2019-05-11T11:50:00" url="https://booking.cineworld.co.uk/booking/8113/75542" videoType="3d" audioType="audio described"/>
                    <show time="2019-05-11T18:20:00" url="https://booking.cineworld.co.uk/booking/8113/75545" videoType="3d" audioType="audio described"/>
                    <show time="2019-05-12T11:50:00" url="https://booking.cineworld.co.uk/booking/8113/75543" videoType="3d" audioType="audio described"/>
                    <show time="2019-05-12T18:20:00" url="https://booking.cineworld.co.uk/booking/8113/75546" videoType="3d" audioType="audio described"/>
                </shows>
            </film>
            <film title="Red Joan" rating="12A" url="films/red-joan" edi="251781" release="19/04/2019">
                <shows>
                    <show time="2019-05-07T10:10:00" url="https://booking.cineworld.co.uk/booking/8113/75460" audioType="audio described"/>
                    <show time="2019-05-07T12:40:00" url="https://booking.cineworld.co.uk/booking/8113/75461" audioType="audio described"/>
                    <show time="2019-05-07T15:10:00" url="https://booking.cineworld.co.uk/booking/8113/75462" audioType="audio described"/>
                    <show time="2019-05-08T10:10:00" url="https://booking.cineworld.co.uk/booking/8113/75463" audioType="audio described"/>
                    <show time="2019-05-08T12:40:00" url="https://booking.cineworld.co.uk/booking/8113/75464" audioType="audio described"/>
                    <show time="2019-05-08T15:10:00" url="https://booking.cineworld.co.uk/booking/8113/75465" audioType="audio described"/>
                    <show time="2019-05-09T10:10:00" url="https://booking.cineworld.co.uk/booking/8113/75466" audioType="audio described"/>
                    <show time="2019-05-09T12:40:00" url="https://booking.cineworld.co.uk/booking/8113/75467" audioType="audio described"/>
                    <show time="2019-05-09T15:10:00" url="https://booking.cineworld.co.uk/booking/8113/75468" audioType="audio described"/>
                </shows>
            </film>
            <film title="ROH Royal Ballet Live 2019 Romeo And Juliet" rating="12A" url="films/roh-royal-ballet-live-2019-romeo-and-juliet" edi="252213" release="11/06/2019">
                <shows>
                    <show time="2019-06-11T19:15:00" url="https://booking.cineworld.co.uk/booking/8113/46718"/>
                </shows>
            </film>
            <film title="ROH Royal Ballet Live 2019 Triple Bill" rating="12A" url="films/roh-royal-ballet-live-2019-triple-bill" edi="252209" release="16/05/2019">
                <shows>
                    <show time="2019-05-16T19:15:00" url="https://booking.cineworld.co.uk/booking/8113/46717"/>
                </shows>
            </film>
            <film title="RSC Live : Measure For Measure" rating="12A" url="films/rsc-live-measure-for-measure" edi="263087" release="31/07/2019">
                <shows>
                    <show time="2019-07-31T19:00:00" url="https://booking.cineworld.co.uk/booking/8113/61772"/>
                </shows>
            </film>
            <film title="RSC Live : The Taming Of The Shrew" rating="12A" url="films/rsc-live-the-taming-of-the-shrew" edi="263085" release="05/06/2019">
                <shows>
                    <show time="2019-06-05T19:00:00" url="https://booking.cineworld.co.uk/booking/8113/61771"/>
                </shows>
            </film>
            <film title="Saving Private Ryan (D-Day 75th Anniversary)" rating="15" url="films/saving-private-ryan-d-day-75th-anniversary" edi="275478" release="06/06/2019">
                <shows>
                    <show time="2019-06-06T19:30:00" url="https://booking.cineworld.co.uk/booking/8113/75581" audioType="audio described"/>
                </shows>
            </film>
            <film title="(2D) Shazam!" rating="12A" url="films/shazam" edi="169941" release="05/04/2019">
                <shows>
                    <show time="2019-05-06T13:50:00" url="https://booking.cineworld.co.uk/booking/8113/75530" audioType="audio described"/>
                    <show time="2019-05-07T10:20:00" url="https://booking.cineworld.co.uk/booking/8113/75421" audioType="audio described"/>
                    <show time="2019-05-07T13:50:00" url="https://booking.cineworld.co.uk/booking/8113/75531" audioType="audio described"/>
                    <show time="2019-05-08T10:20:00" url="https://booking.cineworld.co.uk/booking/8113/75422" audioType="audio described"/>
                    <show time="2019-05-08T13:50:00" url="https://booking.cineworld.co.uk/booking/8113/75532" audioType="audio described"/>
                    <show time="2019-05-09T10:20:00" url="https://booking.cineworld.co.uk/booking/8113/75339" audioType="audio described"/>
                    <show time="2019-05-09T13:50:00" url="https://booking.cineworld.co.uk/booking/8113/75533" audioType="audio described"/>
                </shows>
            </film>
            <film title="M4J Spider-Man: Into The Spider-Verse" rating="PG" url="films/spider-man-into-the-spider-verse-movies-for-juniors" edi="801735" release="15/02/2019">
                <shows>
                    <show time="2019-05-06T10:20:00" url="https://booking.cineworld.co.uk/booking/8113/75212" audioType="audio described"/>
                </shows>
            </film>
            <film title="Take That - Greatest Hits Live" rating="12A" url="films/take-that-greatest-hits-live" edi="270195" release="08/06/2019">
                <shows>
                    <show time="2019-06-08T20:00:00" url="https://booking.cineworld.co.uk/booking/8113/72062"/>
                    <show time="2019-06-08T20:00:00" url="https://booking.cineworld.co.uk/booking/8113/75534"/>
                </shows>
            </film>
            <film title="The Curse Of La Llorona" rating="15" url="films/the-curse-of-la-llorona" edi="250922" release="03/05/2019">
                <shows>
                    <show time="2019-05-06T10:10:00" url="https://booking.cineworld.co.uk/booking/8113/75585" audioType="audio described"/>
                    <show time="2019-05-06T12:30:00" url="https://booking.cineworld.co.uk/booking/8113/75591" audioType="audio described"/>
                    <show time="2019-05-06T15:00:00" url="https://booking.cineworld.co.uk/booking/8113/75587" audioType="audio described"/>
                    <show time="2019-05-06T17:20:00" url="https://booking.cineworld.co.uk/booking/8113/75590" audioType="audio described"/>
                    <show time="2019-05-06T18:40:00" url="https://booking.cineworld.co.uk/booking/8113/75192"/>
                    <show time="2019-05-06T19:40:00" url="https://booking.cineworld.co.uk/booking/8113/75588" audioType="audio described"/>
                    <show time="2019-05-06T21:00:00" url="https://booking.cineworld.co.uk/booking/8113/75193"/>
                    <show time="2019-05-06T21:50:00" url="https://booking.cineworld.co.uk/booking/8113/75589" audioType="audio described"/>
                    <show time="2019-05-07T18:40:00" url="https://booking.cineworld.co.uk/booking/8113/75350" audioType="audio described"/>
                    <show time="2019-05-07T21:00:00" url="https://booking.cineworld.co.uk/booking/8113/75351" audioType="audio described"/>
                    <show time="2019-05-08T18:40:00" url="https://booking.cineworld.co.uk/booking/8113/75194"/>
                    <show time="2019-05-08T21:00:00" url="https://booking.cineworld.co.uk/booking/8113/75195"/>
                    <show time="2019-05-09T18:40:00" url="https://booking.cineworld.co.uk/booking/8113/75196"/>
                    <show time="2019-05-09T21:00:00" url="https://booking.cineworld.co.uk/booking/8113/75197"/>
                </shows>
            </film>
            <film title="(ScreenX) The Curse Of La Llorona" rating="15" url="films/the-curse-of-la-llorona" edi="801829" release="03/05/2019">
                <shows>
                    <show time="2019-05-08T10:10:00" url="https://booking.cineworld.co.uk/booking/8113/75313" audioType="audio described"/>
                    <show time="2019-05-08T12:30:00" url="https://booking.cineworld.co.uk/booking/8113/75314" audioType="audio described"/>
                    <show time="2019-05-08T15:00:00" url="https://booking.cineworld.co.uk/booking/8113/75315" audioType="audio described"/>
                    <show time="2019-05-08T17:20:00" url="https://booking.cineworld.co.uk/booking/8113/75316" audioType="audio described"/>
                    <show time="2019-05-08T19:40:00" url="https://booking.cineworld.co.uk/booking/8113/75317" audioType="audio described"/>
                    <show time="2019-05-08T21:50:00" url="https://booking.cineworld.co.uk/booking/8113/75521" audioType="audio described"/>
                    <show time="2019-05-09T10:10:00" url="https://booking.cineworld.co.uk/booking/8113/75318" audioType="audio described"/>
                    <show time="2019-05-09T12:30:00" url="https://booking.cineworld.co.uk/booking/8113/75319" audioType="audio described"/>
                    <show time="2019-05-09T15:00:00" url="https://booking.cineworld.co.uk/booking/8113/75320" audioType="audio described"/>
                    <show time="2019-05-09T17:20:00" url="https://booking.cineworld.co.uk/booking/8113/75321" audioType="audio described"/>
                    <show time="2019-05-09T19:40:00" url="https://booking.cineworld.co.uk/booking/8113/75322" audioType="audio described"/>
                    <show time="2019-05-09T21:50:00" url="https://booking.cineworld.co.uk/booking/8113/75524" audioType="audio described"/>
                </shows>
            </film>
            <film title="The Merry Wives Of Windsor Live from Shakespeare G" rating="12A" url="films/the-merry-wives-of-windsor-live-from-shakespeares-globe" edi="268829" release="20/06/2019">
                <shows>
                    <show time="2019-06-20T19:20:00" url="https://booking.cineworld.co.uk/booking/8113/69352"/>
                </shows>
            </film>
            <film title="The Secret Life Of Pets 2" rating="U" url="films/the-secret-life-of-pets-2" edi="192838" release="24/05/2019">
                <shows>
                    <show time="2019-05-24T10:00:00" url="https://booking.cineworld.co.uk/booking/8113/72906"/>
                    <show time="2019-05-24T12:15:00" url="https://booking.cineworld.co.uk/booking/8113/72907"/>
                    <show time="2019-05-24T14:30:00" url="https://booking.cineworld.co.uk/booking/8113/72908"/>
                    <show time="2019-05-24T16:45:00" url="https://booking.cineworld.co.uk/booking/8113/72909"/>
                    <show time="2019-05-25T10:00:00" url="https://booking.cineworld.co.uk/booking/8113/72910" audioType="audio described"/>
                    <show time="2019-05-25T12:15:00" url="https://booking.cineworld.co.uk/booking/8113/72911" audioType="audio described"/>
                    <show time="2019-05-25T14:30:00" url="https://booking.cineworld.co.uk/booking/8113/72912" audioType="audio described"/>
                    <show time="2019-05-25T16:45:00" url="https://booking.cineworld.co.uk/booking/8113/72913" audioType="audio described"/>
                    <show time="2019-05-26T10:00:00" url="https://booking.cineworld.co.uk/booking/8113/72914" audioType="audio described"/>
                    <show time="2019-05-26T12:15:00" url="https://booking.cineworld.co.uk/booking/8113/72915" audioType="audio described"/>
                    <show time="2019-05-26T14:30:00" url="https://booking.cineworld.co.uk/booking/8113/72916" audioType="audio described"/>
                    <show time="2019-05-26T16:45:00" url="https://booking.cineworld.co.uk/booking/8113/72917" audioType="audio described"/>
                    <show time="2019-05-27T10:00:00" url="https://booking.cineworld.co.uk/booking/8113/72918" audioType="audio described"/>
                    <show time="2019-05-27T12:15:00" url="https://booking.cineworld.co.uk/booking/8113/72919" audioType="audio described"/>
                    <show time="2019-05-27T14:30:00" url="https://booking.cineworld.co.uk/booking/8113/72920" audioType="audio described"/>
                    <show time="2019-05-27T16:45:00" url="https://booking.cineworld.co.uk/booking/8113/72921" audioType="audio described"/>
                    <show time="2019-05-28T10:00:00" url="https://booking.cineworld.co.uk/booking/8113/72922" audioType="audio described"/>
                    <show time="2019-05-28T12:15:00" url="https://booking.cineworld.co.uk/booking/8113/72923" audioType="audio described"/>
                    <show time="2019-05-28T14:30:00" url="https://booking.cineworld.co.uk/booking/8113/72924" audioType="audio described"/>
                    <show time="2019-05-28T16:45:00" url="https://booking.cineworld.co.uk/booking/8113/72925" audioType="audio described"/>
                </shows>
            </film>
            <film title="Tolkien" rating="12A" url="films/tolkien" edi="271425" release="03/05/2019">
                <shows>
                    <show time="2019-05-06T12:00:00" url="https://booking.cineworld.co.uk/booking/8113/75478" audioType="audio described"/>
                    <show time="2019-05-06T14:40:00" url="https://booking.cineworld.co.uk/booking/8113/75479" audioType="audio described"/>
                    <show time="2019-05-06T17:20:00" url="https://booking.cineworld.co.uk/booking/8113/75480" audioType="audio described"/>
                    <show time="2019-05-06T20:10:00" url="https://booking.cineworld.co.uk/booking/8113/75481" audioType="audio described"/>
                    <show time="2019-05-07T12:00:00" url="https://booking.cineworld.co.uk/booking/8113/75486" audioType="audio described"/>
                    <show time="2019-05-07T14:40:00" url="https://booking.cineworld.co.uk/booking/8113/75487" audioType="audio described"/>
                    <show time="2019-05-07T17:20:00" url="https://booking.cineworld.co.uk/booking/8113/75488" audioType="audio described"/>
                    <show time="2019-05-07T20:10:00" url="https://booking.cineworld.co.uk/booking/8113/75489" audioType="audio described"/>
                    <show time="2019-05-08T12:00:00" url="https://booking.cineworld.co.uk/booking/8113/75490" audioType="audio described"/>
                    <show time="2019-05-08T14:40:00" url="https://booking.cineworld.co.uk/booking/8113/75491" audioType="audio described"/>
                    <show time="2019-05-08T17:20:00" url="https://booking.cineworld.co.uk/booking/8113/75492" audioType="audio described"/>
                    <show time="2019-05-08T20:10:00" url="https://booking.cineworld.co.uk/booking/8113/75493" audioType="audio described"/>
                    <show time="2019-05-09T12:00:00" url="https://booking.cineworld.co.uk/booking/8113/75494" audioType="audio described"/>
                    <show time="2019-05-09T14:40:00" url="https://booking.cineworld.co.uk/booking/8113/75495" audioType="audio described"/>
                    <show time="2019-05-09T17:20:00" url="https://booking.cineworld.co.uk/booking/8113/75496" audioType="audio described"/>
                    <show time="2019-05-09T20:10:00" url="https://booking.cineworld.co.uk/booking/8113/75497" audioType="audio described"/>
                </shows>
            </film>
            <film title="Victoria - Northern Ballet" rating="PG" url="films/victoria-northern-ballet" edi="270190" release="25/06/2019">
                <shows>
                    <show time="2019-06-25T19:30:00" url="https://booking.cineworld.co.uk/booking/8113/68776"/>
                </shows>
            </film>
            <film title="Westlife : The Twenty Tour Live" rating="12A" url="films/westlife-the-twenty-tour-live-from-croke-park" edi="270186" release="06/07/2019">
                <shows>
                    <show time="2019-07-06T20:00:00" url="https://booking.cineworld.co.uk/booking/8113/74236"/>
                </shows>
            </film>
            <film title="(2D) Wonder Park" rating="PG" url="films/wonder-park" edi="194897" release="12/04/2019">
                <shows>
                    <show time="2019-05-06T11:10:00" url="https://booking.cineworld.co.uk/booking/8113/75447" audioType="audio described"/>
                    <show time="2019-05-06T13:20:00" url="https://booking.cineworld.co.uk/booking/8113/75448" audioType="audio described"/>
                    <show time="2019-05-06T15:30:00" url="https://booking.cineworld.co.uk/booking/8113/75449" audioType="audio described"/>
                </shows>
            </film>
            <film title="(IMAX 3-D) X-Men: Dark Phoenix" rating="TBC" url="films/x-men-dark-phoenix" edi="277442" release="05/06/2019">
                <shows>
                    <show time="2019-06-05T11:10:00" url="https://booking.cineworld.co.uk/booking/8113/75063" videoType="imax 3d"/>
                    <show time="2019-06-05T14:00:00" url="https://booking.cineworld.co.uk/booking/8113/75064" videoType="imax 3d"/>
                    <show time="2019-06-05T16:50:00" url="https://booking.cineworld.co.uk/booking/8113/75065" videoType="imax 3d"/>
                    <show time="2019-06-05T19:45:00" url="https://booking.cineworld.co.uk/booking/8113/75066" videoType="imax 3d"/>
                    <show time="2019-06-06T11:10:00" url="https://booking.cineworld.co.uk/booking/8113/75067" videoType="imax 3d"/>
                    <show time="2019-06-06T14:00:00" url="https://booking.cineworld.co.uk/booking/8113/75068" videoType="imax 3d"/>
                    <show time="2019-06-06T16:50:00" url="https://booking.cineworld.co.uk/booking/8113/75069" videoType="imax 3d"/>
                    <show time="2019-06-06T19:45:00" url="https://booking.cineworld.co.uk/booking/8113/75070" videoType="imax 3d"/>
                    <show time="2019-06-07T11:10:00" url="https://booking.cineworld.co.uk/booking/8113/75081" videoType="imax 3d"/>
                    <show time="2019-06-07T14:00:00" url="https://booking.cineworld.co.uk/booking/8113/75082" videoType="imax 3d"/>
                    <show time="2019-06-07T16:50:00" url="https://booking.cineworld.co.uk/booking/8113/75083" videoType="imax 3d"/>
                    <show time="2019-06-07T19:45:00" url="https://booking.cineworld.co.uk/booking/8113/75084" videoType="imax 3d"/>
                    <show time="2019-06-08T11:10:00" url="https://booking.cineworld.co.uk/booking/8113/75085" videoType="imax 3d"/>
                    <show time="2019-06-08T14:00:00" url="https://booking.cineworld.co.uk/booking/8113/75086" videoType="imax 3d"/>
                    <show time="2019-06-08T16:50:00" url="https://booking.cineworld.co.uk/booking/8113/75087" videoType="imax 3d"/>
                    <show time="2019-06-08T19:45:00" url="https://booking.cineworld.co.uk/booking/8113/75088" videoType="imax 3d"/>
                    <show time="2019-06-09T11:10:00" url="https://booking.cineworld.co.uk/booking/8113/75089" videoType="imax 3d"/>
                    <show time="2019-06-09T14:00:00" url="https://booking.cineworld.co.uk/booking/8113/75090" videoType="imax 3d"/>
                    <show time="2019-06-09T16:50:00" url="https://booking.cineworld.co.uk/booking/8113/75091" videoType="imax 3d"/>
                    <show time="2019-06-09T19:45:00" url="https://booking.cineworld.co.uk/booking/8113/75092" videoType="imax 3d"/>
                </shows>
            </film>
            <film title="X-Men: Dark Phoenix" rating="TBC" url="films/x-men-dark-phoenix" edi="220087" release="05/06/2019">
                <shows>
                    <show time="2019-06-05T12:00:00" url="https://booking.cineworld.co.uk/booking/8113/75071"/>
                    <show time="2019-06-05T14:50:00" url="https://booking.cineworld.co.uk/booking/8113/75072"/>
                    <show time="2019-06-05T17:40:00" url="https://booking.cineworld.co.uk/booking/8113/75073"/>
                    <show time="2019-06-05T19:00:00" url="https://booking.cineworld.co.uk/booking/8113/75079" audioType="audio described"/>
                    <show time="2019-06-05T20:30:00" url="https://booking.cineworld.co.uk/booking/8113/75074"/>
                    <show time="2019-06-06T12:00:00" url="https://booking.cineworld.co.uk/booking/8113/75075"/>
                    <show time="2019-06-06T14:50:00" url="https://booking.cineworld.co.uk/booking/8113/75076"/>
                    <show time="2019-06-06T17:40:00" url="https://booking.cineworld.co.uk/booking/8113/75077"/>
                    <show time="2019-06-06T19:00:00" url="https://booking.cineworld.co.uk/booking/8113/75080" audioType="audio described"/>
                    <show time="2019-06-06T20:30:00" url="https://booking.cineworld.co.uk/booking/8113/75078"/>
                    <show time="2019-06-07T12:00:00" url="https://booking.cineworld.co.uk/booking/8113/75113"/>
                    <show time="2019-06-07T14:50:00" url="https://booking.cineworld.co.uk/booking/8113/75114"/>
                    <show time="2019-06-07T17:40:00" url="https://booking.cineworld.co.uk/booking/8113/75119"/>
                    <show time="2019-06-07T19:00:00" url="https://booking.cineworld.co.uk/booking/8113/75108" audioType="audio described"/>
                    <show time="2019-06-07T20:30:00" url="https://booking.cineworld.co.uk/booking/8113/75120"/>
                    <show time="2019-06-07T22:00:00" url="https://booking.cineworld.co.uk/booking/8113/75111" audioType="audio described"/>
                    <show time="2019-06-08T12:00:00" url="https://booking.cineworld.co.uk/booking/8113/75125" audioType="audio described"/>
                    <show time="2019-06-08T14:50:00" url="https://booking.cineworld.co.uk/booking/8113/75126" audioType="audio described"/>
                    <show time="2019-06-08T17:40:00" url="https://booking.cineworld.co.uk/booking/8113/75123" audioType="audio described"/>
                    <show time="2019-06-08T19:00:00" url="https://booking.cineworld.co.uk/booking/8113/75109" audioType="audio described"/>
                    <show time="2019-06-08T20:30:00" url="https://booking.cineworld.co.uk/booking/8113/75124" audioType="audio described"/>
                    <show time="2019-06-08T22:00:00" url="https://booking.cineworld.co.uk/booking/8113/75112" audioType="audio described"/>
                    <show time="2019-06-09T12:00:00" url="https://booking.cineworld.co.uk/booking/8113/75117"/>
                    <show time="2019-06-09T14:50:00" url="https://booking.cineworld.co.uk/booking/8113/75118"/>
                    <show time="2019-06-09T17:40:00" url="https://booking.cineworld.co.uk/booking/8113/75121"/>
                    <show time="2019-06-09T19:00:00" url="https://booking.cineworld.co.uk/booking/8113/75110" audioType="audio described"/>
                    <show time="2019-06-09T20:30:00" url="https://booking.cineworld.co.uk/booking/8113/75122"/>
                </shows>
            </film>
            <film title="(4DX 3D) X-Men: Dark Phoenix" rating="TBC" url="films/x-men-dark-phoenix" edi="801831" release="05/06/2019">
                <shows>
                    <show time="2019-06-05T10:10:00" url="https://booking.cineworld.co.uk/booking/8113/75053" videoType="3d" audioType="audio described"/>
                    <show time="2019-06-05T13:00:00" url="https://booking.cineworld.co.uk/booking/8113/75054" videoType="3d" audioType="audio described"/>
                    <show time="2019-06-05T15:40:00" url="https://booking.cineworld.co.uk/booking/8113/75055" videoType="3d" audioType="audio described"/>
                    <show time="2019-06-05T18:20:00" url="https://booking.cineworld.co.uk/booking/8113/75056" videoType="3d" audioType="audio described"/>
                    <show time="2019-06-05T21:15:00" url="https://booking.cineworld.co.uk/booking/8113/75057" videoType="3d" audioType="audio described"/>
                    <show time="2019-06-06T10:10:00" url="https://booking.cineworld.co.uk/booking/8113/75058" videoType="3d" audioType="audio described"/>
                    <show time="2019-06-06T13:00:00" url="https://booking.cineworld.co.uk/booking/8113/75059" videoType="3d" audioType="audio described"/>
                    <show time="2019-06-06T15:40:00" url="https://booking.cineworld.co.uk/booking/8113/75060" videoType="3d" audioType="audio described"/>
                    <show time="2019-06-06T18:20:00" url="https://booking.cineworld.co.uk/booking/8113/75061" videoType="3d" audioType="audio described"/>
                    <show time="2019-06-06T21:15:00" url="https://booking.cineworld.co.uk/booking/8113/75062" videoType="3d" audioType="audio described"/>
                    <show time="2019-06-07T10:10:00" url="https://booking.cineworld.co.uk/booking/8113/75093" videoType="3d" audioType="audio described"/>
                    <show time="2019-06-07T13:00:00" url="https://booking.cineworld.co.uk/booking/8113/75094" videoType="3d" audioType="audio described"/>
                    <show time="2019-06-07T15:40:00" url="https://booking.cineworld.co.uk/booking/8113/75095" videoType="3d" audioType="audio described"/>
                    <show time="2019-06-07T18:20:00" url="https://booking.cineworld.co.uk/booking/8113/75096" videoType="3d" audioType="audio described"/>
                    <show time="2019-06-07T21:15:00" url="https://booking.cineworld.co.uk/booking/8113/75097" videoType="3d" audioType="audio described"/>
                    <show time="2019-06-08T10:10:00" url="https://booking.cineworld.co.uk/booking/8113/75098" videoType="3d" audioType="audio described"/>
                    <show time="2019-06-08T13:00:00" url="https://booking.cineworld.co.uk/booking/8113/75099" videoType="3d" audioType="audio described"/>
                    <show time="2019-06-08T15:40:00" url="https://booking.cineworld.co.uk/booking/8113/75100" videoType="3d" audioType="audio described"/>
                    <show time="2019-06-08T18:20:00" url="https://booking.cineworld.co.uk/booking/8113/75101" videoType="3d" audioType="audio described"/>
                    <show time="2019-06-08T21:15:00" url="https://booking.cineworld.co.uk/booking/8113/75102" videoType="3d" audioType="audio described"/>
                    <show time="2019-06-09T10:10:00" url="https://booking.cineworld.co.uk/booking/8113/75103" videoType="3d" audioType="audio described"/>
                    <show time="2019-06-09T13:00:00" url="https://booking.cineworld.co.uk/booking/8113/75104" videoType="3d" audioType="audio described"/>
                    <show time="2019-06-09T15:40:00" url="https://booking.cineworld.co.uk/booking/8113/75105" videoType="3d" audioType="audio described"/>
                    <show time="2019-06-09T18:20:00" url="https://booking.cineworld.co.uk/booking/8113/75106" videoType="3d" audioType="audio described"/>
                    <show time="2019-06-09T21:15:00" url="https://booking.cineworld.co.uk/booking/8113/75107" videoType="3d" audioType="audio described"/>
                </shows>
            </film>
        </listing>
    </cinema>
    <cinema name="Cineworld Bedford" root="http://www1.cineworld.co.uk/" url="cinemas/bedford" id="34" phone="0871 200 2000" address="Aspects Leisure Park, Newnham Avenue, Bedford" postcode="MK41 9LW">
        <listing>
            <film title="A Dog's Journey" rating="PG" url="films/a-dogs-journey" edi="255103" release="03/05/2019">
                <shows>
                    <show time="2019-05-06T10:40:00" url="https://booking.cineworld.co.uk/booking/8019/65485" audioType="audio described"/>
                    <show time="2019-05-06T13:20:00" url="https://booking.cineworld.co.uk/booking/8019/65486" audioType="audio described"/>
                    <show time="2019-05-06T16:00:00" url="https://booking.cineworld.co.uk/booking/8019/65487" audioType="audio described"/>
                    <show time="2019-05-07T16:00:00" url="https://booking.cineworld.co.uk/booking/8019/65504" audioType="audio described"/>
                    <show time="2019-05-08T16:10:00" url="https://booking.cineworld.co.uk/booking/8019/65519" audioType="audio described"/>
                    <show time="2019-05-09T16:00:00" url="https://booking.cineworld.co.uk/booking/8019/65535" audioType="audio described"/>
                </shows>
            </film>
            <film title="Andre Rieu 2019 Maastricht Concert Shall We Dance?" rating="PG" url="films/andre-rieu-2019-maastricht-concert-shall-we-dance" edi="255443" release="27/07/2019">
                <shows>
                    <show time="2019-07-27T19:00:00" url="https://booking.cineworld.co.uk/booking/8019/63412"/>
                    <show time="2019-07-28T15:00:00" url="https://booking.cineworld.co.uk/booking/8019/63413"/>
                </shows>
            </film>
            <film title="Autism Friendly Screening: Secret Life Of Pets 2" rating="U" url="films/autism-friendly-screening-secret-life-of-pets-2" edi="801857" release="02/06/2019">
                <shows>
                    <show time="2019-06-02T11:00:00" url="https://booking.cineworld.co.uk/booking/8019/65553"/>
                </shows>
            </film>
            <film title="(2D) Avengers: Endgame" rating="12A" url="films/avengers-endgame" edi="169126" release="25/04/2019">
                <shows>
                    <show time="2019-05-06T10:30:00" url="https://booking.cineworld.co.uk/booking/8019/65363" audioType="audio described"/>
                    <show time="2019-05-06T11:30:00" url="https://booking.cineworld.co.uk/booking/8019/65357" audioType="audio described"/>
                    <show time="2019-05-06T12:30:00" url="https://booking.cineworld.co.uk/booking/8019/65360" audioType="audio described"/>
                    <show time="2019-05-06T13:30:00" url="https://booking.cineworld.co.uk/booking/8019/65482" audioType="audio described"/>
                    <show time="2019-05-06T14:30:00" url="https://booking.cineworld.co.uk/booking/8019/65361" audioType="audio described"/>
                    <show time="2019-05-06T15:30:00" url="https://booking.cineworld.co.uk/booking/8019/65355" audioType="audio described"/>
                    <show time="2019-05-06T16:30:00" url="https://booking.cineworld.co.uk/booking/8019/65358" audioType="audio described"/>
                    <show time="2019-05-06T18:30:00" url="https://booking.cineworld.co.uk/booking/8019/65362" audioType="audio described"/>
                    <show time="2019-05-06T20:30:00" url="https://booking.cineworld.co.uk/booking/8019/65359" audioType="audio described"/>
                    <show time="2019-05-07T14:30:00" url="https://booking.cineworld.co.uk/booking/8019/65499" audioType="audio described"/>
                    <show time="2019-05-07T15:30:00" url="https://booking.cineworld.co.uk/booking/8019/65490" audioType="audio described"/>
                    <show time="2019-05-07T16:30:00" url="https://booking.cineworld.co.uk/booking/8019/65492" audioType="audio described"/>
                    <show time="2019-05-07T18:30:00" url="https://booking.cineworld.co.uk/booking/8019/65500" audioType="audio described"/>
                    <show time="2019-05-07T19:30:00" url="https://booking.cineworld.co.uk/booking/8019/65491" audioType="audio described"/>
                    <show time="2019-05-07T20:30:00" url="https://booking.cineworld.co.uk/booking/8019/65493" audioType="audio described"/>
                    <show time="2019-05-08T14:30:00" url="https://booking.cineworld.co.uk/booking/8019/65514" audioType="audio described"/>
                    <show time="2019-05-08T15:30:00" url="https://booking.cineworld.co.uk/booking/8019/65512" audioType="audio described"/>
                    <show time="2019-05-08T16:30:00" url="https://booking.cineworld.co.uk/booking/8019/65507" audioType="audio described"/>
                    <show time="2019-05-08T18:30:00" url="https://booking.cineworld.co.uk/booking/8019/65515" audioType="audio described"/>
                    <show time="2019-05-08T20:30:00" url="https://booking.cineworld.co.uk/booking/8019/65508" audioType="audio described"/>
                    <show time="2019-05-09T14:30:00" url="https://booking.cineworld.co.uk/booking/8019/65530" audioType="audio described"/>
                    <show time="2019-05-09T15:30:00" url="https://booking.cineworld.co.uk/booking/8019/65522" audioType="audio described"/>
                    <show time="2019-05-09T16:30:00" url="https://booking.cineworld.co.uk/booking/8019/65525" audioType="audio described"/>
                    <show time="2019-05-09T18:30:00" url="https://booking.cineworld.co.uk/booking/8019/65531" audioType="audio described" subtitled="true"/>
                    <show time="2019-05-09T19:30:00" url="https://booking.cineworld.co.uk/booking/8019/65523" audioType="audio described"/>
                    <show time="2019-05-09T20:30:00" url="https://booking.cineworld.co.uk/booking/8019/65526" audioType="audio described"/>
                </shows>
            </film>
            <film title="Beats : Unlimited Screening" rating="18" url="films/beats-unlimited-screening" edi="801824" release="08/05/2019">
                <shows>
                    <show time="2019-05-08T20:00:00" url="https://booking.cineworld.co.uk/booking/8019/65330" audioType="audio described"/>
                </shows>
            </film>
            <film title="Bolshoi Ballet 2019 : Carmen Suite / Petrushka" rating="12A" url="films/bolshoi-ballet-2019-carmen-suite-petrushka" edi="251616" release="19/05/2019">
                <shows>
                    <show time="2019-05-19T16:00:00" url="https://booking.cineworld.co.uk/booking/8019/56223"/>
                </shows>
            </film>
            <film title="Booksmart: Unlimited Screening" rating="15" url="films/booksmart-unlimited-screening" edi="801833" release="06/05/2019">
                <shows>
                    <show time="2019-05-06T19:45:00" url="https://booking.cineworld.co.uk/booking/8019/65412" audioType="audio described"/>
                </shows>
            </film>
            <film title="Dumbo" rating="PG" url="films/dumbo" edi="192491" release="29/03/2019">
                <shows>
                    <show time="2019-05-06T10:50:00" url="https://booking.cineworld.co.uk/booking/8019/65481" audioType="audio described"/>
                </shows>
            </film>
            <film title="Everybody's Talking About Jamie Encore" rating="12A" url="films/everybodys-talking-about-jamie-encore" edi="249936" release="13/06/2019">
                <shows>
                    <show time="2019-06-13T19:00:00" url="https://booking.cineworld.co.uk/booking/8019/65153"/>
                </shows>
            </film>
            <film title="Glyndebourne 2019 : Cinderella (Cendrillon)" rating="12A" url="films/glyndebourne-2019-cinderella-cendrillon-live" edi="273307" release="30/06/2019">
                <shows>
                    <show time="2019-06-30T17:30:00" url="https://booking.cineworld.co.uk/booking/8019/64494"/>
                </shows>
            </film>
            <film title="Glyndebourne 2019: The Barber Of Seville (Il barbi" rating="12A" url="films/glyndebourne-2019-the-barber-of-seville-il-barbiere-di-siviglia-recorded" edi="273300" release="14/07/2019">
                <shows>
                    <show time="2019-07-14T17:30:00" url="https://booking.cineworld.co.uk/booking/8019/64495"/>
                </shows>
            </film>
            <film title="Glyndebourne 2019: The Magic Flute (Die Zauberflt" rating="12A" url="films/glyndebourne-2019-the-magic-flute-die-zauberflte-live" edi="273310" release="04/08/2019">
                <shows>
                    <show time="2019-08-04T17:30:00" url="https://booking.cineworld.co.uk/booking/8019/64496"/>
                </shows>
            </film>
            <film title="Long Shot" rating="15" url="films/long-shot" edi="240058" release="03/05/2019">
                <shows>
                    <show time="2019-05-06T11:20:00" url="https://booking.cineworld.co.uk/booking/8019/65477" audioType="audio described"/>
                    <show time="2019-05-06T14:10:00" url="https://booking.cineworld.co.uk/booking/8019/65478" audioType="audio described"/>
                    <show time="2019-05-06T17:00:00" url="https://booking.cineworld.co.uk/booking/8019/65479" audioType="audio described"/>
                    <show time="2019-05-06T19:50:00" url="https://booking.cineworld.co.uk/booking/8019/65480" audioType="audio described"/>
                    <show time="2019-05-07T14:10:00" url="https://booking.cineworld.co.uk/booking/8019/65496" audioType="audio described"/>
                    <show time="2019-05-07T17:00:00" url="https://booking.cineworld.co.uk/booking/8019/65497" audioType="audio described"/>
                    <show time="2019-05-07T19:50:00" url="https://booking.cineworld.co.uk/booking/8019/65498" audioType="audio described"/>
                    <show time="2019-05-08T14:10:00" url="https://booking.cineworld.co.uk/booking/8019/65510" audioType="audio described"/>
                    <show time="2019-05-08T17:00:00" url="https://booking.cineworld.co.uk/booking/8019/65511" audioType="audio described"/>
                    <show time="2019-05-08T20:10:00" url="https://booking.cineworld.co.uk/booking/8019/65516" audioType="audio described"/>
                    <show time="2019-05-09T14:10:00" url="https://booking.cineworld.co.uk/booking/8019/65527" audioType="audio described"/>
                    <show time="2019-05-09T17:00:00" url="https://booking.cineworld.co.uk/booking/8019/65528" audioType="audio described"/>
                    <show time="2019-05-09T19:50:00" url="https://booking.cineworld.co.uk/booking/8019/65529" audioType="audio described"/>
                </shows>
            </film>
            <film title="Margaret Atwood : Live In Cinemas" rating="12A" url="films/margaret-atwood-live-in-cinemas" edi="272858" release="10/09/2019">
                <shows>
                    <show time="2019-09-10T19:30:00" url="https://booking.cineworld.co.uk/booking/8019/64370"/>
                </shows>
            </film>
            <film title="Matthew Bourne's Swan Lake (2019)" rating="PG" url="films/matthew-bournes-swan-lake" edi="269440" release="21/05/2019">
                <shows>
                    <show time="2019-05-21T15:45:00" url="https://booking.cineworld.co.uk/booking/8019/63608"/>
                    <show time="2019-05-21T18:30:00" url="https://booking.cineworld.co.uk/booking/8019/63609"/>
                </shows>
            </film>
            <film title="MET Opera 2019 Dialogues Des Carmelites" rating="12A" url="films/met-opera-2019-dialogues-des-carmelites" edi="249481" release="11/05/2019">
                <shows>
                    <show time="2019-05-11T17:00:00" url="https://booking.cineworld.co.uk/booking/8019/60248"/>
                </shows>
            </film>
            <film title="NT Live: All My Sons" rating="12A" url="films/nt-live-all-my-sons" edi="263592" release="14/05/2019">
                <shows>
                    <show time="2019-05-14T19:00:00" url="https://booking.cineworld.co.uk/booking/8019/62201"/>
                </shows>
            </film>
            <film title="NT Live : One Man, Two Guvnors (Encore)" rating="12A" url="films/nt-live-one-man-two-guvnors-encore" edi="266343" release="26/09/2019">
                <shows>
                    <show time="2019-09-26T19:00:00" url="https://booking.cineworld.co.uk/booking/8019/65157"/>
                </shows>
            </film>
            <film title="NT Live : Small Island" rating="12A" url="films/nt-live-small-island" edi="270872" release="27/06/2019">
                <shows>
                    <show time="2019-06-27T19:00:00" url="https://booking.cineworld.co.uk/booking/8019/63393"/>
                </shows>
            </film>
            <film title="NT Live : The Lehman Trilogy" rating="12A" url="films/nt-live-the-lehman-trilogy" edi="266345" release="25/07/2019">
                <shows>
                    <show time="2019-07-25T19:00:00" url="https://booking.cineworld.co.uk/booking/8019/65156"/>
                </shows>
            </film>
            <film title="Pavarotti plus Q&amp;A" rating="TBC" url="films/pavarotti-plus-qa" edi="801820" release="13/07/2019">
                <shows>
                    <show time="2019-07-13T19:00:00" url="https://booking.cineworld.co.uk/booking/8019/65439"/>
                </shows>
            </film>
            <film title="Paw Patrol: Mighty Pups - The Movie" rating="TBC" url="films/paw-patrol-mighty-pups" edi="261550" release="17/05/2019">
                <shows>
                    <show time="2019-05-17T16:00:00" url="https://booking.cineworld.co.uk/booking/8019/65162" audioType="audio described"/>
                    <show time="2019-05-18T10:30:00" url="https://booking.cineworld.co.uk/booking/8019/65163" audioType="audio described"/>
                    <show time="2019-05-18T12:20:00" url="https://booking.cineworld.co.uk/booking/8019/65164" audioType="audio described"/>
                    <show time="2019-05-18T14:10:00" url="https://booking.cineworld.co.uk/booking/8019/65165" audioType="audio described"/>
                    <show time="2019-05-18T16:00:00" url="https://booking.cineworld.co.uk/booking/8019/65166" audioType="audio described"/>
                    <show time="2019-05-19T10:30:00" url="https://booking.cineworld.co.uk/booking/8019/65167" audioType="audio described"/>
                    <show time="2019-05-19T12:20:00" url="https://booking.cineworld.co.uk/booking/8019/65168" audioType="audio described"/>
                    <show time="2019-05-19T14:10:00" url="https://booking.cineworld.co.uk/booking/8019/65169" audioType="audio described"/>
                    <show time="2019-05-19T16:00:00" url="https://booking.cineworld.co.uk/booking/8019/65170" audioType="audio described"/>
                </shows>
            </film>
            <film title="(3D) Detective Pikachu" rating="PG" url="films/pokemon-detective-pikachu" edi="245036" release="10/05/2019">
                <shows>
                    <show time="2019-05-10T17:10:00" url="https://booking.cineworld.co.uk/booking/8019/65542" videoType="3d" audioType="audio described"/>
                    <show time="2019-05-11T12:00:00" url="https://booking.cineworld.co.uk/booking/8019/65547" videoType="3d" audioType="audio described"/>
                    <show time="2019-05-11T17:10:00" url="https://booking.cineworld.co.uk/booking/8019/65545" videoType="3d" audioType="audio described"/>
                    <show time="2019-05-12T12:00:00" url="https://booking.cineworld.co.uk/booking/8019/65548" videoType="3d" audioType="audio described"/>
                    <show time="2019-05-12T17:10:00" url="https://booking.cineworld.co.uk/booking/8019/65550" videoType="3d" audioType="audio described"/>
                </shows>
            </film>
            <film title="(2D) Detective Pikachu" rating="PG" url="films/pokemon-detective-pikachu" edi="244991" release="10/05/2019">
                <shows>
                    <show time="2019-05-10T14:40:00" url="https://booking.cineworld.co.uk/booking/8019/65541" audioType="audio described"/>
                    <show time="2019-05-10T19:40:00" url="https://booking.cineworld.co.uk/booking/8019/65543" audioType="audio described"/>
                    <show time="2019-05-11T14:40:00" url="https://booking.cineworld.co.uk/booking/8019/65544" audioType="audio described"/>
                    <show time="2019-05-11T19:40:00" url="https://booking.cineworld.co.uk/booking/8019/65546" audioType="audio described"/>
                    <show time="2019-05-12T14:40:00" url="https://booking.cineworld.co.uk/booking/8019/65549" audioType="audio described"/>
                    <show time="2019-05-12T19:40:00" url="https://booking.cineworld.co.uk/booking/8019/65551" audioType="audio described"/>
                </shows>
            </film>
            <film title="Red Joan" rating="12A" url="films/red-joan" edi="251781" release="19/04/2019">
                <shows>
                    <show time="2019-05-07T14:00:00" url="https://booking.cineworld.co.uk/booking/8019/65494" audioType="audio described"/>
                    <show time="2019-05-08T14:00:00" url="https://booking.cineworld.co.uk/booking/8019/65509" audioType="audio described"/>
                    <show time="2019-05-09T14:00:00" url="https://booking.cineworld.co.uk/booking/8019/65524" audioType="audio described"/>
                </shows>
            </film>
            <film title="ROH Royal Ballet Live 2019 Romeo And Juliet" rating="12A" url="films/roh-royal-ballet-live-2019-romeo-and-juliet" edi="252213" release="11/06/2019">
                <shows>
                    <show time="2019-06-11T19:15:00" url="https://booking.cineworld.co.uk/booking/8019/56422"/>
                </shows>
            </film>
            <film title="ROH Royal Ballet Live 2019 Triple Bill" rating="12A" url="films/roh-royal-ballet-live-2019-triple-bill" edi="252209" release="16/05/2019">
                <shows>
                    <show time="2019-05-16T19:15:00" url="https://booking.cineworld.co.uk/booking/8019/56421"/>
                </shows>
            </film>
            <film title="RSC Live : Measure For Measure" rating="12A" url="films/rsc-live-measure-for-measure" edi="263087" release="31/07/2019">
                <shows>
                    <show time="2019-07-31T19:00:00" url="https://booking.cineworld.co.uk/booking/8019/61316"/>
                </shows>
            </film>
            <film title="RSC Live : The Taming Of The Shrew" rating="12A" url="films/rsc-live-the-taming-of-the-shrew" edi="263085" release="05/06/2019">
                <shows>
                    <show time="2019-06-05T19:00:00" url="https://booking.cineworld.co.uk/booking/8019/61315"/>
                </shows>
            </film>
            <film title="M4J Spider-Man: Into The Spider-Verse" rating="PG" url="films/spider-man-into-the-spider-verse-movies-for-juniors" edi="801735" release="15/02/2019">
                <shows>
                    <show time="2019-05-06T10:00:00" url="https://booking.cineworld.co.uk/booking/8019/65476" audioType="audio described"/>
                </shows>
            </film>
            <film title="Take That - Greatest Hits Live" rating="12A" url="films/take-that-greatest-hits-live" edi="270195" release="08/06/2019">
                <shows>
                    <show time="2019-06-08T20:00:00" url="https://booking.cineworld.co.uk/booking/8019/64382"/>
                </shows>
            </film>
            <film title="The Curse Of La Llorona" rating="15" url="films/the-curse-of-la-llorona" edi="250922" release="03/05/2019">
                <shows>
                    <show time="2019-05-06T18:40:00" url="https://booking.cineworld.co.uk/booking/8019/65488" audioType="audio described"/>
                    <show time="2019-05-06T21:00:00" url="https://booking.cineworld.co.uk/booking/8019/65489" audioType="audio described"/>
                    <show time="2019-05-07T18:40:00" url="https://booking.cineworld.co.uk/booking/8019/65505" audioType="audio described"/>
                    <show time="2019-05-07T21:00:00" url="https://booking.cineworld.co.uk/booking/8019/65506" audioType="audio described"/>
                    <show time="2019-05-08T18:50:00" url="https://booking.cineworld.co.uk/booking/8019/65520" audioType="audio described"/>
                    <show time="2019-05-08T21:10:00" url="https://booking.cineworld.co.uk/booking/8019/65521" audioType="audio described"/>
                    <show time="2019-05-09T18:40:00" url="https://booking.cineworld.co.uk/booking/8019/65536" audioType="audio described"/>
                    <show time="2019-05-09T21:00:00" url="https://booking.cineworld.co.uk/booking/8019/65537" audioType="audio described"/>
                </shows>
            </film>
            <film title="The Secret Life Of Pets 2" rating="U" url="films/the-secret-life-of-pets-2" edi="192838" release="24/05/2019">
                <shows>
                    <show time="2019-05-24T14:30:00" url="https://booking.cineworld.co.uk/booking/8019/64620" audioType="audio described"/>
                    <show time="2019-05-24T16:45:00" url="https://booking.cineworld.co.uk/booking/8019/64621" audioType="audio described"/>
                    <show time="2019-05-25T10:00:00" url="https://booking.cineworld.co.uk/booking/8019/64622" audioType="audio described"/>
                    <show time="2019-05-25T12:15:00" url="https://booking.cineworld.co.uk/booking/8019/64623" audioType="audio described"/>
                    <show time="2019-05-25T14:30:00" url="https://booking.cineworld.co.uk/booking/8019/64624" audioType="audio described"/>
                    <show time="2019-05-25T16:45:00" url="https://booking.cineworld.co.uk/booking/8019/64625" audioType="audio described"/>
                    <show time="2019-05-26T10:00:00" url="https://booking.cineworld.co.uk/booking/8019/64626" audioType="audio described"/>
                    <show time="2019-05-26T12:15:00" url="https://booking.cineworld.co.uk/booking/8019/64627" audioType="audio described"/>
                    <show time="2019-05-26T14:30:00" url="https://booking.cineworld.co.uk/booking/8019/64628" audioType="audio described"/>
                    <show time="2019-05-26T16:45:00" url="https://booking.cineworld.co.uk/booking/8019/64629" audioType="audio described"/>
                    <show time="2019-05-27T10:00:00" url="https://booking.cineworld.co.uk/booking/8019/64630" audioType="audio described"/>
                    <show time="2019-05-27T12:15:00" url="https://booking.cineworld.co.uk/booking/8019/64631" audioType="audio described"/>
                    <show time="2019-05-27T14:30:00" url="https://booking.cineworld.co.uk/booking/8019/64632" audioType="audio described"/>
                    <show time="2019-05-27T16:45:00" url="https://booking.cineworld.co.uk/booking/8019/64633" audioType="audio described"/>
                    <show time="2019-05-28T10:00:00" url="https://booking.cineworld.co.uk/booking/8019/64634" audioType="audio described"/>
                    <show time="2019-05-28T12:15:00" url="https://booking.cineworld.co.uk/booking/8019/64635" audioType="audio described"/>
                    <show time="2019-05-28T14:30:00" url="https://booking.cineworld.co.uk/booking/8019/64636" audioType="audio described"/>
                    <show time="2019-05-28T16:45:00" url="https://booking.cineworld.co.uk/booking/8019/64637" audioType="audio described"/>
                </shows>
            </film>
            <film title="Tolkien" rating="12A" url="films/tolkien" edi="271425" release="03/05/2019">
                <shows>
                    <show time="2019-05-06T17:30:00" url="https://booking.cineworld.co.uk/booking/8019/65483" audioType="audio described"/>
                    <show time="2019-05-06T20:10:00" url="https://booking.cineworld.co.uk/booking/8019/65484" audioType="audio described"/>
                    <show time="2019-05-07T14:50:00" url="https://booking.cineworld.co.uk/booking/8019/65503" audioType="audio described"/>
                    <show time="2019-05-07T17:30:00" url="https://booking.cineworld.co.uk/booking/8019/65501" audioType="audio described"/>
                    <show time="2019-05-07T20:10:00" url="https://booking.cineworld.co.uk/booking/8019/65502" audioType="audio described"/>
                    <show time="2019-05-08T14:50:00" url="https://booking.cineworld.co.uk/booking/8019/65517" audioType="audio described"/>
                    <show time="2019-05-08T17:30:00" url="https://booking.cineworld.co.uk/booking/8019/65518" audioType="audio described"/>
                    <show time="2019-05-08T19:30:00" url="https://booking.cineworld.co.uk/booking/8019/65513" audioType="audio described"/>
                    <show time="2019-05-09T14:50:00" url="https://booking.cineworld.co.uk/booking/8019/65532" audioType="audio described"/>
                    <show time="2019-05-09T17:30:00" url="https://booking.cineworld.co.uk/booking/8019/65533" audioType="audio described"/>
                    <show time="2019-05-09T20:10:00" url="https://booking.cineworld.co.uk/booking/8019/65534" audioType="audio described"/>
                </shows>
            </film>
            <film title="Victoria - Northern Ballet" rating="PG" url="films/victoria-northern-ballet" edi="270190" release="25/06/2019">
                <shows>
                    <show time="2019-06-25T19:30:00" url="https://booking.cineworld.co.uk/booking/8019/63394"/>
                </shows>
            </film>
            <film title="Westlife : The Twenty Tour Live" rating="12A" url="films/westlife-the-twenty-tour-live-from-croke-park" edi="270186" release="06/07/2019">
                <shows>
                    <show time="2019-07-06T20:00:00" url="https://booking.cineworld.co.uk/booking/8019/65158"/>
                </shows>
            </film>
            <film title="(3D) X-Men: Dark Phoenix" rating="TBC" url="films/x-men-dark-phoenix" edi="246006" release="05/06/2019">
                <shows>
                    <show time="2019-06-05T17:45:00" url="https://booking.cineworld.co.uk/booking/8019/65413" videoType="3d" audioType="audio described"/>
                    <show time="2019-06-06T17:45:00" url="https://booking.cineworld.co.uk/booking/8019/65416" videoType="3d" audioType="audio described"/>
                    <show time="2019-06-07T17:45:00" url="https://booking.cineworld.co.uk/booking/8019/65419" videoType="3d" audioType="audio described"/>
                    <show time="2019-06-08T17:45:00" url="https://booking.cineworld.co.uk/booking/8019/65422" videoType="3d" audioType="audio described"/>
                    <show time="2019-06-09T17:45:00" url="https://booking.cineworld.co.uk/booking/8019/65426" videoType="3d" audioType="audio described"/>
                </shows>
            </film>
            <film title="X-Men: Dark Phoenix" rating="TBC" url="films/x-men-dark-phoenix" edi="220087" release="05/06/2019">
                <shows>
                    <show time="2019-06-05T15:00:00" url="https://booking.cineworld.co.uk/booking/8019/65415" audioType="audio described"/>
                    <show time="2019-06-05T20:30:00" url="https://booking.cineworld.co.uk/booking/8019/65414" audioType="audio described"/>
                    <show time="2019-06-06T15:00:00" url="https://booking.cineworld.co.uk/booking/8019/65418" audioType="audio described"/>
                    <show time="2019-06-06T20:30:00" url="https://booking.cineworld.co.uk/booking/8019/65417" audioType="audio described"/>
                    <show time="2019-06-07T15:00:00" url="https://booking.cineworld.co.uk/booking/8019/65421" audioType="audio described"/>
                    <show time="2019-06-07T20:30:00" url="https://booking.cineworld.co.uk/booking/8019/65420" audioType="audio described"/>
                    <show time="2019-06-08T12:15:00" url="https://booking.cineworld.co.uk/booking/8019/65425" audioType="audio described"/>
                    <show time="2019-06-08T15:00:00" url="https://booking.cineworld.co.uk/booking/8019/65424" audioType="audio described"/>
                    <show time="2019-06-08T20:30:00" url="https://booking.cineworld.co.uk/booking/8019/65423" audioType="audio described"/>
                    <show time="2019-06-09T12:15:00" url="https://booking.cineworld.co.uk/booking/8019/65429" audioType="audio described"/>
                    <show time="2019-06-09T15:00:00" url="https://booking.cineworld.co.uk/booking/8019/65428" audioType="audio described"/>
                    <show time="2019-06-09T20:30:00" url="https://booking.cineworld.co.uk/booking/8019/65427" audioType="audio described"/>
                </shows>
            </film>
        </listing>
    </cinema>
    <cinema name="Cineworld Birmingham - Broad Street" root="http://www1.cineworld.co.uk/" url="cinemas/birmingham-broad-street" id="56" phone="0871 200 2000" address="181 Broad Street, Birmingham" postcode="B15 1DA">
        <listing>
            <film title="A Dog's Journey" rating="PG" url="films/a-dogs-journey" edi="255103" release="03/05/2019">
                <shows>
                    <show time="2019-05-06T11:20:00" url="https://booking.cineworld.co.uk/booking/8022/156052" audioType="audio described"/>
                    <show time="2019-05-06T14:00:00" url="https://booking.cineworld.co.uk/booking/8022/156053" audioType="audio described"/>
                    <show time="2019-05-06T16:40:00" url="https://booking.cineworld.co.uk/booking/8022/156054" audioType="audio described"/>
                    <show time="2019-05-07T10:20:00" url="https://booking.cineworld.co.uk/booking/8022/155985" audioType="audio described"/>
                    <show time="2019-05-07T14:00:00" url="https://booking.cineworld.co.uk/booking/8022/156055" audioType="audio described"/>
                    <show time="2019-05-07T16:40:00" url="https://booking.cineworld.co.uk/booking/8022/156056" audioType="audio described"/>
                    <show time="2019-05-08T10:20:00" url="https://booking.cineworld.co.uk/booking/8022/155986" audioType="audio described"/>
                    <show time="2019-05-08T14:00:00" url="https://booking.cineworld.co.uk/booking/8022/156057" audioType="audio described"/>
                    <show time="2019-05-08T16:40:00" url="https://booking.cineworld.co.uk/booking/8022/156058" audioType="audio described"/>
                    <show time="2019-05-09T10:20:00" url="https://booking.cineworld.co.uk/booking/8022/155987" audioType="audio described"/>
                    <show time="2019-05-09T14:00:00" url="https://booking.cineworld.co.uk/booking/8022/156059" audioType="audio described"/>
                    <show time="2019-05-09T16:40:00" url="https://booking.cineworld.co.uk/booking/8022/156060" audioType="audio described"/>
                </shows>
            </film>
            <film title="Andre Rieu 2019 Maastricht Concert Shall We Dance?" rating="PG" url="films/andre-rieu-2019-maastricht-concert-shall-we-dance" edi="255443" release="27/07/2019">
                <shows>
                    <show time="2019-07-27T19:00:00" url="https://booking.cineworld.co.uk/booking/8022/151066"/>
                    <show time="2019-07-28T15:00:00" url="https://booking.cineworld.co.uk/booking/8022/151067"/>
                </shows>
            </film>
            <film title="Autism Friendly Screening: Secret Life Of Pets 2" rating="U" url="films/autism-friendly-screening-secret-life-of-pets-2" edi="801857" release="02/06/2019">
                <shows>
                    <show time="2019-06-02T11:00:00" url="https://booking.cineworld.co.uk/booking/8022/156109"/>
                </shows>
            </film>
            <film title="(IMAX 3-D) Avengers: Endgame" rating="12A" url="films/avengers-endgame" edi="230548" release="25/04/2019">
                <shows>
                    <show time="2019-05-06T11:10:00" url="https://booking.cineworld.co.uk/booking/8022/155552" videoType="imax 3d"/>
                    <show time="2019-05-06T15:10:00" url="https://booking.cineworld.co.uk/booking/8022/155553" videoType="imax 3d"/>
                    <show time="2019-05-06T19:20:00" url="https://booking.cineworld.co.uk/booking/8022/155554" videoType="imax 3d"/>
                    <show time="2019-05-07T11:10:00" url="https://booking.cineworld.co.uk/booking/8022/155915" videoType="imax 3d"/>
                    <show time="2019-05-07T15:10:00" url="https://booking.cineworld.co.uk/booking/8022/155916" videoType="imax 3d"/>
                    <show time="2019-05-07T19:20:00" url="https://booking.cineworld.co.uk/booking/8022/155917" videoType="imax 3d"/>
                    <show time="2019-05-08T11:10:00" url="https://booking.cineworld.co.uk/booking/8022/155918" videoType="imax 3d"/>
                    <show time="2019-05-08T15:10:00" url="https://booking.cineworld.co.uk/booking/8022/155919" videoType="imax 3d"/>
                    <show time="2019-05-08T19:20:00" url="https://booking.cineworld.co.uk/booking/8022/155920" videoType="imax 3d"/>
                    <show time="2019-05-09T11:10:00" url="https://booking.cineworld.co.uk/booking/8022/155921" videoType="imax 3d"/>
                    <show time="2019-05-09T15:10:00" url="https://booking.cineworld.co.uk/booking/8022/155922" videoType="imax 3d"/>
                    <show time="2019-05-09T19:20:00" url="https://booking.cineworld.co.uk/booking/8022/155923" videoType="imax 3d"/>
                </shows>
            </film>
            <film title="(3D) Avengers: Endgame" rating="12A" url="films/avengers-endgame" edi="174256" release="25/04/2019">
                <shows>
                    <show time="2019-05-06T18:30:00" url="https://booking.cineworld.co.uk/booking/8022/155534" videoType="3d" audioType="audio described"/>
                    <show time="2019-05-07T18:30:00" url="https://booking.cineworld.co.uk/booking/8022/155851" videoType="3d" audioType="audio described"/>
                    <show time="2019-05-08T18:30:00" url="https://booking.cineworld.co.uk/booking/8022/155854" videoType="3d" audioType="audio described"/>
                    <show time="2019-05-09T18:30:00" url="https://booking.cineworld.co.uk/booking/8022/156061" videoType="3d" audioType="audio described"/>
                </shows>
            </film>
            <film title="(4DX 3D) Avengers: ENDGAME" rating="12A" url="films/avengers-endgame" edi="801784" release="25/04/2019">
                <shows>
                    <show time="2019-05-06T12:30:00" url="https://booking.cineworld.co.uk/booking/8022/155543" videoType="3d" audioType="audio described"/>
                    <show time="2019-05-06T16:30:00" url="https://booking.cineworld.co.uk/booking/8022/155544" videoType="3d" audioType="audio described"/>
                    <show time="2019-05-06T20:30:00" url="https://booking.cineworld.co.uk/booking/8022/155545" videoType="3d" audioType="audio described"/>
                    <show time="2019-05-07T12:30:00" url="https://booking.cineworld.co.uk/booking/8022/155857" videoType="3d" audioType="audio described"/>
                    <show time="2019-05-07T16:30:00" url="https://booking.cineworld.co.uk/booking/8022/155858" videoType="3d" audioType="audio described"/>
                    <show time="2019-05-07T20:30:00" url="https://booking.cineworld.co.uk/booking/8022/155859" videoType="3d" audioType="audio described"/>
                    <show time="2019-05-08T12:30:00" url="https://booking.cineworld.co.uk/booking/8022/155860" videoType="3d" audioType="audio described"/>
                    <show time="2019-05-08T16:30:00" url="https://booking.cineworld.co.uk/booking/8022/155861" videoType="3d" audioType="audio described"/>
                    <show time="2019-05-08T20:30:00" url="https://booking.cineworld.co.uk/booking/8022/155862" videoType="3d" audioType="audio described"/>
                    <show time="2019-05-09T12:30:00" url="https://booking.cineworld.co.uk/booking/8022/155863" videoType="3d" audioType="audio described"/>
                    <show time="2019-05-09T16:30:00" url="https://booking.cineworld.co.uk/booking/8022/155864" videoType="3d" audioType="audio described"/>
                    <show time="2019-05-09T20:30:00" url="https://booking.cineworld.co.uk/booking/8022/155865" videoType="3d" audioType="audio described"/>
                </shows>
            </film>
            <film title="(2D) Avengers: Endgame" rating="12A" url="films/avengers-endgame" edi="169126" release="25/04/2019">
                <shows>
                    <show time="2019-05-06T10:10:00" url="https://booking.cineworld.co.uk/booking/8022/155532" audioType="audio described"/>
                    <show time="2019-05-06T11:50:00" url="https://booking.cineworld.co.uk/booking/8022/155524" audioType="audio described"/>
                    <show time="2019-05-06T13:00:00" url="https://booking.cineworld.co.uk/booking/8022/155869" audioType="audio described"/>
                    <show time="2019-05-06T13:40:00" url="https://booking.cineworld.co.uk/booking/8022/155535" audioType="audio described"/>
                    <show time="2019-05-06T14:20:00" url="https://booking.cineworld.co.uk/booking/8022/155533" audioType="audio described"/>
                    <show time="2019-05-06T14:40:00" url="https://booking.cineworld.co.uk/booking/8022/156030" audioType="audio described"/>
                    <show time="2019-05-06T15:50:00" url="https://booking.cineworld.co.uk/booking/8022/155525" audioType="audio described"/>
                    <show time="2019-05-06T17:00:00" url="https://booking.cineworld.co.uk/booking/8022/155870" audioType="audio described"/>
                    <show time="2019-05-06T18:00:00" url="https://booking.cineworld.co.uk/booking/8022/155536" audioType="audio described"/>
                    <show time="2019-05-06T19:00:00" url="https://booking.cineworld.co.uk/booking/8022/155529" audioType="audio described"/>
                    <show time="2019-05-06T19:40:00" url="https://booking.cineworld.co.uk/booking/8022/155509" audioType="audio described"/>
                    <show time="2019-05-06T20:00:00" url="https://booking.cineworld.co.uk/booking/8022/155526" audioType="audio described"/>
                    <show time="2019-05-06T21:50:00" url="https://booking.cineworld.co.uk/booking/8022/155907" audioType="audio described"/>
                    <show time="2019-05-07T10:10:00" url="https://booking.cineworld.co.uk/booking/8022/155849" audioType="audio described"/>
                    <show time="2019-05-07T11:50:00" url="https://booking.cineworld.co.uk/booking/8022/155924" audioType="audio described"/>
                    <show time="2019-05-07T13:00:00" url="https://booking.cineworld.co.uk/booking/8022/155974" audioType="audio described"/>
                    <show time="2019-05-07T13:40:00" url="https://booking.cineworld.co.uk/booking/8022/155897" audioType="audio described"/>
                    <show time="2019-05-07T14:20:00" url="https://booking.cineworld.co.uk/booking/8022/155850" audioType="audio described"/>
                    <show time="2019-05-07T14:40:00" url="https://booking.cineworld.co.uk/booking/8022/156031" audioType="audio described"/>
                    <show time="2019-05-07T15:50:00" url="https://booking.cineworld.co.uk/booking/8022/155925" audioType="audio described"/>
                    <show time="2019-05-07T17:00:00" url="https://booking.cineworld.co.uk/booking/8022/155975" audioType="audio described"/>
                    <show time="2019-05-07T17:30:00" url="https://booking.cineworld.co.uk/booking/8022/155871" audioType="audio described"/>
                    <show time="2019-05-07T18:00:00" url="https://booking.cineworld.co.uk/booking/8022/155898" audioType="audio described"/>
                    <show time="2019-05-07T19:00:00" url="https://booking.cineworld.co.uk/booking/8022/156032" audioType="audio described"/>
                    <show time="2019-05-07T20:00:00" url="https://booking.cineworld.co.uk/booking/8022/155926" audioType="audio described"/>
                    <show time="2019-05-07T21:00:00" url="https://booking.cineworld.co.uk/booking/8022/155976" audioType="audio described"/>
                    <show time="2019-05-07T21:50:00" url="https://booking.cineworld.co.uk/booking/8022/155899" audioType="audio described"/>
                    <show time="2019-05-08T10:10:00" url="https://booking.cineworld.co.uk/booking/8022/155852" audioType="audio described"/>
                    <show time="2019-05-08T11:50:00" url="https://booking.cineworld.co.uk/booking/8022/155927" audioType="audio described"/>
                    <show time="2019-05-08T13:00:00" url="https://booking.cineworld.co.uk/booking/8022/155977" audioType="audio described"/>
                    <show time="2019-05-08T13:40:00" url="https://booking.cineworld.co.uk/booking/8022/155900" audioType="audio described"/>
                    <show time="2019-05-08T14:20:00" url="https://booking.cineworld.co.uk/booking/8022/155853" audioType="audio described"/>
                    <show time="2019-05-08T14:40:00" url="https://booking.cineworld.co.uk/booking/8022/156033" audioType="audio described"/>
                    <show time="2019-05-08T15:50:00" url="https://booking.cineworld.co.uk/booking/8022/155928" audioType="audio described"/>
                    <show time="2019-05-08T17:00:00" url="https://booking.cineworld.co.uk/booking/8022/155978" audioType="audio described"/>
                    <show time="2019-05-08T17:30:00" url="https://booking.cineworld.co.uk/booking/8022/155872" audioType="audio described" subtitled="true"/>
                    <show time="2019-05-08T18:00:00" url="https://booking.cineworld.co.uk/booking/8022/155901" audioType="audio described"/>
                    <show time="2019-05-08T19:00:00" url="https://booking.cineworld.co.uk/booking/8022/156034" audioType="audio described"/>
                    <show time="2019-05-08T20:00:00" url="https://booking.cineworld.co.uk/booking/8022/155929" audioType="audio described"/>
                    <show time="2019-05-08T21:00:00" url="https://booking.cineworld.co.uk/booking/8022/155979" audioType="audio described"/>
                    <show time="2019-05-08T21:50:00" url="https://booking.cineworld.co.uk/booking/8022/155902" audioType="audio described"/>
                    <show time="2019-05-09T10:10:00" url="https://booking.cineworld.co.uk/booking/8022/155855" audioType="audio described"/>
                    <show time="2019-05-09T11:50:00" url="https://booking.cineworld.co.uk/booking/8022/155930" audioType="audio described"/>
                    <show time="2019-05-09T13:00:00" url="https://booking.cineworld.co.uk/booking/8022/155980" audioType="audio described"/>
                    <show time="2019-05-09T13:40:00" url="https://booking.cineworld.co.uk/booking/8022/155903" audioType="audio described"/>
                    <show time="2019-05-09T14:20:00" url="https://booking.cineworld.co.uk/booking/8022/155856" audioType="audio described"/>
                    <show time="2019-05-09T14:40:00" url="https://booking.cineworld.co.uk/booking/8022/156035" audioType="audio described"/>
                    <show time="2019-05-09T15:50:00" url="https://booking.cineworld.co.uk/booking/8022/155931" audioType="audio described"/>
                    <show time="2019-05-09T17:00:00" url="https://booking.cineworld.co.uk/booking/8022/155981" audioType="audio described"/>
                    <show time="2019-05-09T17:30:00" url="https://booking.cineworld.co.uk/booking/8022/155873" audioType="audio described"/>
                    <show time="2019-05-09T18:00:00" url="https://booking.cineworld.co.uk/booking/8022/155904" audioType="audio described"/>
                    <show time="2019-05-09T19:00:00" url="https://booking.cineworld.co.uk/booking/8022/156036" audioType="audio described"/>
                    <show time="2019-05-09T19:40:00" url="https://booking.cineworld.co.uk/booking/8022/155824" audioType="audio described"/>
                    <show time="2019-05-09T21:00:00" url="https://booking.cineworld.co.uk/booking/8022/155982" audioType="audio described"/>
                    <show time="2019-05-09T21:50:00" url="https://booking.cineworld.co.uk/booking/8022/155905" audioType="audio described"/>
                </shows>
            </film>
            <film title="Beats" rating="18" url="films/beats" edi="264080" release="09/05/2019">
                <shows>
                    <show time="2019-05-09T20:00:00" url="https://booking.cineworld.co.uk/booking/8022/155720"/>
                </shows>
            </film>
            <film title="Beats" rating="18" url="films/beats" edi="264080" release="17/05/2019">
                <shows>
                    <show time="2019-05-09T20:00:00" url="https://booking.cineworld.co.uk/booking/8022/155720"/>
                </shows>
            </film>
            <film title="Beats : Unlimited Screening" rating="18" url="films/beats-unlimited-screening" edi="801824" release="08/05/2019">
                <shows>
                    <show time="2019-05-08T20:00:00" url="https://booking.cineworld.co.uk/booking/8022/155555" audioType="audio described"/>
                </shows>
            </film>
            <film title="Blank (Hindi)" rating="12A" url="films/blank-hindi" edi="276806" release="03/05/2019">
                <shows>
                    <show time="2019-05-06T19:30:00" url="https://booking.cineworld.co.uk/booking/8022/156066"/>
                    <show time="2019-05-07T19:30:00" url="https://booking.cineworld.co.uk/booking/8022/156067"/>
                    <show time="2019-05-08T19:30:00" url="https://booking.cineworld.co.uk/booking/8022/156068"/>
                    <show time="2019-05-09T19:40:00" url="https://booking.cineworld.co.uk/booking/8022/156069"/>
                </shows>
            </film>
            <film title="Booksmart: Unlimited Screening" rating="15" url="films/booksmart-unlimited-screening" edi="801833" release="06/05/2019">
                <shows>
                    <show time="2019-05-06T19:45:00" url="https://booking.cineworld.co.uk/booking/8022/155746" audioType="audio described"/>
                </shows>
            </film>
            <film title="(2D) Captain Marvel" rating="12A" url="films/captain-marvel" edi="169122" release="08/03/2019">
                <shows>
                    <show time="2019-05-06T16:30:00" url="https://booking.cineworld.co.uk/booking/8022/155983"/>
                    <show time="2019-05-07T10:45:00" url="https://booking.cineworld.co.uk/booking/8022/155909"/>
                    <show time="2019-05-07T14:30:00" url="https://booking.cineworld.co.uk/booking/8022/155877"/>
                    <show time="2019-05-08T10:45:00" url="https://booking.cineworld.co.uk/booking/8022/155910"/>
                    <show time="2019-05-08T14:30:00" url="https://booking.cineworld.co.uk/booking/8022/155878"/>
                    <show time="2019-05-09T10:45:00" url="https://booking.cineworld.co.uk/booking/8022/155911"/>
                    <show time="2019-05-09T14:30:00" url="https://booking.cineworld.co.uk/booking/8022/155879"/>
                </shows>
            </film>
            <film title="Dr Strangelove (Or How I Learned To Stop...) [GCF]" rating="PG" url="films/dr-strangelove-or-how-i-learned-to-stop-worrying-and-love-the-bomb" edi="445976" release="20/05/2019">
                <shows>
                    <show time="2019-05-20T20:00:00" url="https://booking.cineworld.co.uk/booking/8022/156107"/>
                </shows>
            </film>
            <film title="Dumbo" rating="PG" url="films/dumbo" edi="192491" release="29/03/2019">
                <shows>
                    <show time="2019-05-06T11:00:00" url="https://booking.cineworld.co.uk/booking/8022/155988" audioType="audio described"/>
                    <show time="2019-05-06T13:50:00" url="https://booking.cineworld.co.uk/booking/8022/155989" audioType="audio described"/>
                    <show time="2019-05-07T11:20:00" url="https://booking.cineworld.co.uk/booking/8022/156072" audioType="audio described"/>
                    <show time="2019-05-08T11:20:00" url="https://booking.cineworld.co.uk/booking/8022/156073" audioType="audio described"/>
                    <show time="2019-05-09T11:20:00" url="https://booking.cineworld.co.uk/booking/8022/156074" audioType="audio described"/>
                </shows>
            </film>
            <film title="Everybody's Talking About Jamie Encore" rating="12A" url="films/everybodys-talking-about-jamie-encore" edi="249936" release="13/06/2019">
                <shows>
                    <show time="2019-06-13T19:00:00" url="https://booking.cineworld.co.uk/booking/8022/155122"/>
                </shows>
            </film>
            <film title="Greta" rating="15" url="films/greta" edi="245161" release="18/04/2019">
                <shows>
                    <show time="2019-05-07T12:00:00" url="https://booking.cineworld.co.uk/booking/8022/155882" audioType="audio described"/>
                    <show time="2019-05-08T12:00:00" url="https://booking.cineworld.co.uk/booking/8022/155883" audioType="audio described"/>
                    <show time="2019-05-09T12:00:00" url="https://booking.cineworld.co.uk/booking/8022/155884" audioType="audio described"/>
                </shows>
            </film>
            <film title="M4J How To Train Your Dragon: The Hidden World" rating="PG" url="films/how-to-train-your-dragon-the-hidden-world-movies-for-juniors" edi="801822" release="01/02/2019">
                <shows>
                    <show time="2019-05-06T10:00:00" url="https://booking.cineworld.co.uk/booking/8022/155934" audioType="audio described"/>
                </shows>
            </film>
            <film title="Little" rating="12A" url="films/little" edi="250296" release="12/04/2019">
                <shows>
                    <show time="2019-05-06T11:00:00" url="https://booking.cineworld.co.uk/booking/8022/156083"/>
                </shows>
            </film>
            <film title="Long Shot" rating="15" url="films/long-shot" edi="240058" release="03/05/2019">
                <shows>
                    <show time="2019-05-06T11:00:00" url="https://booking.cineworld.co.uk/booking/8022/155834" audioType="audio described"/>
                    <show time="2019-05-06T14:00:00" url="https://booking.cineworld.co.uk/booking/8022/155835" audioType="audio described"/>
                    <show time="2019-05-06T16:50:00" url="https://booking.cineworld.co.uk/booking/8022/155836" audioType="audio described"/>
                    <show time="2019-05-06T20:50:00" url="https://booking.cineworld.co.uk/booking/8022/155994" audioType="audio described"/>
                    <show time="2019-05-07T11:00:00" url="https://booking.cineworld.co.uk/booking/8022/155837" audioType="audio described"/>
                    <show time="2019-05-07T14:00:00" url="https://booking.cineworld.co.uk/booking/8022/155838" audioType="audio described"/>
                    <show time="2019-05-07T16:50:00" url="https://booking.cineworld.co.uk/booking/8022/155839" audioType="audio described"/>
                    <show time="2019-05-07T19:40:00" url="https://booking.cineworld.co.uk/booking/8022/155846" audioType="audio described"/>
                    <show time="2019-05-07T20:50:00" url="https://booking.cineworld.co.uk/booking/8022/155995" audioType="audio described" subtitled="true"/>
                    <show time="2019-05-08T11:00:00" url="https://booking.cineworld.co.uk/booking/8022/155840" audioType="audio described"/>
                    <show time="2019-05-08T14:00:00" url="https://booking.cineworld.co.uk/booking/8022/155841" audioType="audio described"/>
                    <show time="2019-05-08T16:50:00" url="https://booking.cineworld.co.uk/booking/8022/155842" audioType="audio described"/>
                    <show time="2019-05-08T20:50:00" url="https://booking.cineworld.co.uk/booking/8022/155996" audioType="audio described"/>
                    <show time="2019-05-09T11:00:00" url="https://booking.cineworld.co.uk/booking/8022/155843" audioType="audio described"/>
                    <show time="2019-05-09T14:00:00" url="https://booking.cineworld.co.uk/booking/8022/155844" audioType="audio described"/>
                    <show time="2019-05-09T16:50:00" url="https://booking.cineworld.co.uk/booking/8022/155845" audioType="audio described"/>
                    <show time="2019-05-09T20:50:00" url="https://booking.cineworld.co.uk/booking/8022/155997" audioType="audio described"/>
                </shows>
            </film>
            <film title="Margaret Atwood : Live In Cinemas" rating="12A" url="films/margaret-atwood-live-in-cinemas" edi="272858" release="10/09/2019">
                <shows>
                    <show time="2019-09-10T19:30:00" url="https://booking.cineworld.co.uk/booking/8022/153437"/>
                </shows>
            </film>
            <film title="Matthew Bourne's Swan Lake (2019)" rating="PG" url="films/matthew-bournes-swan-lake" edi="269440" release="21/05/2019">
                <shows>
                    <show time="2019-05-21T15:45:00" url="https://booking.cineworld.co.uk/booking/8022/151468"/>
                    <show time="2019-05-21T18:30:00" url="https://booking.cineworld.co.uk/booking/8022/151469"/>
                </shows>
            </film>
            <film title="MET Opera 2019 Dialogues Des Carmelites" rating="12A" url="films/met-opera-2019-dialogues-des-carmelites" edi="249481" release="11/05/2019">
                <shows>
                    <show time="2019-05-11T17:00:00" url="https://booking.cineworld.co.uk/booking/8022/143583"/>
                </shows>
            </film>
            <film title="NT Live: All My Sons" rating="12A" url="films/nt-live-all-my-sons" edi="263592" release="14/05/2019">
                <shows>
                    <show time="2019-05-14T19:00:00" url="https://booking.cineworld.co.uk/booking/8022/148200"/>
                </shows>
            </film>
            <film title="NT Live : One Man, Two Guvnors (Encore)" rating="12A" url="films/nt-live-one-man-two-guvnors-encore" edi="266343" release="26/09/2019">
                <shows>
                    <show time="2019-09-26T19:00:00" url="https://booking.cineworld.co.uk/booking/8022/155126"/>
                </shows>
            </film>
            <film title="NT Live : Small Island" rating="12A" url="films/nt-live-small-island" edi="270872" release="27/06/2019">
                <shows>
                    <show time="2019-06-27T19:00:00" url="https://booking.cineworld.co.uk/booking/8022/151047"/>
                </shows>
            </film>
            <film title="NT Live : The Lehman Trilogy" rating="12A" url="films/nt-live-the-lehman-trilogy" edi="266345" release="25/07/2019">
                <shows>
                    <show time="2019-07-25T19:00:00" url="https://booking.cineworld.co.uk/booking/8022/155125"/>
                </shows>
            </film>
            <film title="Paw Patrol: Mighty Pups - The Movie" rating="TBC" url="films/paw-patrol-mighty-pups" edi="261550" release="17/05/2019">
                <shows>
                    <show time="2019-05-17T10:30:00" url="https://booking.cineworld.co.uk/booking/8022/155127" audioType="audio described"/>
                    <show time="2019-05-17T12:20:00" url="https://booking.cineworld.co.uk/booking/8022/155129" audioType="audio described"/>
                    <show time="2019-05-17T14:10:00" url="https://booking.cineworld.co.uk/booking/8022/155130" audioType="audio described"/>
                    <show time="2019-05-17T16:00:00" url="https://booking.cineworld.co.uk/booking/8022/155128" audioType="audio described"/>
                    <show time="2019-05-18T10:30:00" url="https://booking.cineworld.co.uk/booking/8022/155131" audioType="audio described"/>
                    <show time="2019-05-18T12:20:00" url="https://booking.cineworld.co.uk/booking/8022/155132" audioType="audio described"/>
                    <show time="2019-05-18T14:10:00" url="https://booking.cineworld.co.uk/booking/8022/155133" audioType="audio described"/>
                    <show time="2019-05-18T16:00:00" url="https://booking.cineworld.co.uk/booking/8022/155134" audioType="audio described"/>
                    <show time="2019-05-19T10:30:00" url="https://booking.cineworld.co.uk/booking/8022/155135" audioType="audio described"/>
                    <show time="2019-05-19T12:20:00" url="https://booking.cineworld.co.uk/booking/8022/155136" audioType="audio described"/>
                    <show time="2019-05-19T14:10:00" url="https://booking.cineworld.co.uk/booking/8022/155137" audioType="audio described"/>
                    <show time="2019-05-19T16:00:00" url="https://booking.cineworld.co.uk/booking/8022/155138" audioType="audio described"/>
                </shows>
            </film>
            <film title="(3D) Detective Pikachu" rating="PG" url="films/pokemon-detective-pikachu" edi="245036" release="10/05/2019">
                <shows>
                    <show time="2019-05-11T13:10:00" url="https://booking.cineworld.co.uk/booking/8022/156097" videoType="3d" audioType="audio described"/>
                    <show time="2019-05-11T15:40:00" url="https://booking.cineworld.co.uk/booking/8022/156098" videoType="3d" audioType="audio described"/>
                    <show time="2019-05-12T13:10:00" url="https://booking.cineworld.co.uk/booking/8022/156099" videoType="3d" audioType="audio described"/>
                    <show time="2019-05-12T15:40:00" url="https://booking.cineworld.co.uk/booking/8022/156100" videoType="3d" audioType="audio described"/>
                </shows>
            </film>
            <film title="(2D) Detective Pikachu" rating="PG" url="films/pokemon-detective-pikachu" edi="244991" release="10/05/2019">
                <shows>
                    <show time="2019-05-10T12:20:00" url="https://booking.cineworld.co.uk/booking/8022/156087" audioType="audio described"/>
                    <show time="2019-05-10T14:50:00" url="https://booking.cineworld.co.uk/booking/8022/156088" audioType="audio described"/>
                    <show time="2019-05-10T17:20:00" url="https://booking.cineworld.co.uk/booking/8022/156089" audioType="audio described"/>
                    <show time="2019-05-10T19:50:00" url="https://booking.cineworld.co.uk/booking/8022/156090" audioType="audio described"/>
                    <show time="2019-05-11T12:20:00" url="https://booking.cineworld.co.uk/booking/8022/156091" audioType="audio described"/>
                    <show time="2019-05-11T14:50:00" url="https://booking.cineworld.co.uk/booking/8022/156092" audioType="audio described"/>
                    <show time="2019-05-11T17:20:00" url="https://booking.cineworld.co.uk/booking/8022/156093" audioType="audio described"/>
                    <show time="2019-05-11T19:50:00" url="https://booking.cineworld.co.uk/booking/8022/156094" audioType="audio described"/>
                    <show time="2019-05-12T12:20:00" url="https://booking.cineworld.co.uk/booking/8022/156101" audioType="audio described"/>
                    <show time="2019-05-12T14:50:00" url="https://booking.cineworld.co.uk/booking/8022/156102" audioType="audio described"/>
                    <show time="2019-05-12T17:20:00" url="https://booking.cineworld.co.uk/booking/8022/156103" audioType="audio described"/>
                    <show time="2019-05-12T19:50:00" url="https://booking.cineworld.co.uk/booking/8022/156104" audioType="audio described"/>
                </shows>
            </film>
            <film title="(4DX 3D) Pokemon Detective Pikachu" rating="PG" url="films/pokemon-detective-pikachu" edi="801828" release="10/05/2019">
                <shows>
                    <show time="2019-05-10T11:30:00" url="https://booking.cineworld.co.uk/booking/8022/156085" videoType="3d" audioType="audio described"/>
                    <show time="2019-05-10T18:00:00" url="https://booking.cineworld.co.uk/booking/8022/156086" videoType="3d" audioType="audio described"/>
                    <show time="2019-05-11T11:30:00" url="https://booking.cineworld.co.uk/booking/8022/156095" videoType="3d" audioType="audio described"/>
                    <show time="2019-05-11T18:00:00" url="https://booking.cineworld.co.uk/booking/8022/156096" videoType="3d" audioType="audio described"/>
                    <show time="2019-05-12T11:30:00" url="https://booking.cineworld.co.uk/booking/8022/156105" videoType="3d" audioType="audio described"/>
                    <show time="2019-05-12T18:00:00" url="https://booking.cineworld.co.uk/booking/8022/156106" videoType="3d" audioType="audio described"/>
                </shows>
            </film>
            <film title="ROH Royal Ballet Live 2019 Romeo And Juliet" rating="12A" url="films/roh-royal-ballet-live-2019-romeo-and-juliet" edi="252213" release="11/06/2019">
                <shows>
                    <show time="2019-06-11T19:15:00" url="https://booking.cineworld.co.uk/booking/8022/135198"/>
                </shows>
            </film>
            <film title="ROH Royal Ballet Live 2019 Triple Bill" rating="12A" url="films/roh-royal-ballet-live-2019-triple-bill" edi="252209" release="16/05/2019">
                <shows>
                    <show time="2019-05-16T19:15:00" url="https://booking.cineworld.co.uk/booking/8022/135197"/>
                </shows>
            </film>
            <film title="RSC Live : Measure For Measure" rating="12A" url="films/rsc-live-measure-for-measure" edi="263087" release="31/07/2019">
                <shows>
                    <show time="2019-07-31T19:00:00" url="https://booking.cineworld.co.uk/booking/8022/145957"/>
                </shows>
            </film>
            <film title="RSC Live : The Taming Of The Shrew" rating="12A" url="films/rsc-live-the-taming-of-the-shrew" edi="263085" release="05/06/2019">
                <shows>
                    <show time="2019-06-05T19:00:00" url="https://booking.cineworld.co.uk/booking/8022/145956"/>
                </shows>
            </film>
            <film title="Saving Private Ryan (D-Day 75th Anniversary)" rating="15" url="films/saving-private-ryan-d-day-75th-anniversary" edi="275478" release="06/06/2019">
                <shows>
                    <show time="2019-06-06T19:30:00" url="https://booking.cineworld.co.uk/booking/8022/156108" audioType="audio described"/>
                </shows>
            </film>
            <film title="(2D) Shazam!" rating="12A" url="films/shazam" edi="169941" release="05/04/2019">
                <shows>
                    <show time="2019-05-06T11:40:00" url="https://booking.cineworld.co.uk/booking/8022/156040" audioType="audio described"/>
                    <show time="2019-05-07T11:40:00" url="https://booking.cineworld.co.uk/booking/8022/156039" audioType="audio described"/>
                    <show time="2019-05-08T11:40:00" url="https://booking.cineworld.co.uk/booking/8022/156038" audioType="audio described"/>
                    <show time="2019-05-09T11:40:00" url="https://booking.cineworld.co.uk/booking/8022/156037" audioType="audio described"/>
                </shows>
            </film>
            <film title="M4J Spider-Man: Into The Spider-Verse" rating="PG" url="films/spider-man-into-the-spider-verse-movies-for-juniors" edi="801735" release="15/02/2019">
                <shows>
                    <show time="2019-05-06T10:15:00" url="https://booking.cineworld.co.uk/booking/8022/155885" audioType="audio described"/>
                </shows>
            </film>
            <film title="Take That - Greatest Hits Live" rating="12A" url="films/take-that-greatest-hits-live" edi="270195" release="08/06/2019">
                <shows>
                    <show time="2019-06-08T20:00:00" url="https://booking.cineworld.co.uk/booking/8022/153466"/>
                </shows>
            </film>
            <film title="The Curse Of La Llorona" rating="15" url="films/the-curse-of-la-llorona" edi="250922" release="03/05/2019">
                <shows>
                    <show time="2019-05-06T13:50:00" url="https://booking.cineworld.co.uk/booking/8022/156007" audioType="audio described"/>
                    <show time="2019-05-06T16:10:00" url="https://booking.cineworld.co.uk/booking/8022/156008" audioType="audio described"/>
                    <show time="2019-05-06T18:30:00" url="https://booking.cineworld.co.uk/booking/8022/156009" audioType="audio described"/>
                    <show time="2019-05-06T21:15:00" url="https://booking.cineworld.co.uk/booking/8022/155891" audioType="audio described"/>
                    <show time="2019-05-07T11:30:00" url="https://booking.cineworld.co.uk/booking/8022/156010" audioType="audio described"/>
                    <show time="2019-05-07T13:50:00" url="https://booking.cineworld.co.uk/booking/8022/156011" audioType="audio described"/>
                    <show time="2019-05-07T16:10:00" url="https://booking.cineworld.co.uk/booking/8022/156012" audioType="audio described"/>
                    <show time="2019-05-07T18:30:00" url="https://booking.cineworld.co.uk/booking/8022/156013" audioType="audio described"/>
                    <show time="2019-05-07T21:15:00" url="https://booking.cineworld.co.uk/booking/8022/155892" audioType="audio described"/>
                    <show time="2019-05-08T11:30:00" url="https://booking.cineworld.co.uk/booking/8022/156014" audioType="audio described"/>
                    <show time="2019-05-08T13:50:00" url="https://booking.cineworld.co.uk/booking/8022/156015" audioType="audio described"/>
                    <show time="2019-05-08T16:10:00" url="https://booking.cineworld.co.uk/booking/8022/156016" audioType="audio described"/>
                    <show time="2019-05-08T18:30:00" url="https://booking.cineworld.co.uk/booking/8022/156017" audioType="audio described"/>
                    <show time="2019-05-08T21:15:00" url="https://booking.cineworld.co.uk/booking/8022/155893" audioType="audio described"/>
                    <show time="2019-05-09T11:30:00" url="https://booking.cineworld.co.uk/booking/8022/156018" audioType="audio described"/>
                    <show time="2019-05-09T13:50:00" url="https://booking.cineworld.co.uk/booking/8022/156019" audioType="audio described"/>
                    <show time="2019-05-09T16:10:00" url="https://booking.cineworld.co.uk/booking/8022/156020" audioType="audio described"/>
                    <show time="2019-05-09T18:30:00" url="https://booking.cineworld.co.uk/booking/8022/156021" audioType="audio described"/>
                    <show time="2019-05-09T21:15:00" url="https://booking.cineworld.co.uk/booking/8022/155894" audioType="audio described"/>
                </shows>
            </film>
            <film title="The Merry Wives Of Windsor Live from Shakespeare G" rating="12A" url="films/the-merry-wives-of-windsor-live-from-shakespeares-globe" edi="268829" release="20/06/2019">
                <shows>
                    <show time="2019-06-20T19:20:00" url="https://booking.cineworld.co.uk/booking/8022/151471"/>
                </shows>
            </film>
            <film title="The Secret Life Of Pets 2" rating="U" url="films/the-secret-life-of-pets-2" edi="192838" release="24/05/2019">
                <shows>
                    <show time="2019-05-24T10:00:00" url="https://booking.cineworld.co.uk/booking/8022/154131" audioType="audio described"/>
                    <show time="2019-05-24T12:15:00" url="https://booking.cineworld.co.uk/booking/8022/154132" audioType="audio described"/>
                    <show time="2019-05-24T14:30:00" url="https://booking.cineworld.co.uk/booking/8022/154133" audioType="audio described"/>
                    <show time="2019-05-24T16:45:00" url="https://booking.cineworld.co.uk/booking/8022/154134" audioType="audio described"/>
                    <show time="2019-05-25T10:00:00" url="https://booking.cineworld.co.uk/booking/8022/154135" audioType="audio described"/>
                    <show time="2019-05-25T12:15:00" url="https://booking.cineworld.co.uk/booking/8022/154136" audioType="audio described"/>
                    <show time="2019-05-25T14:30:00" url="https://booking.cineworld.co.uk/booking/8022/154137" audioType="audio described"/>
                    <show time="2019-05-25T16:45:00" url="https://booking.cineworld.co.uk/booking/8022/154138" audioType="audio described"/>
                    <show time="2019-05-26T10:00:00" url="https://booking.cineworld.co.uk/booking/8022/154139" audioType="audio described"/>
                    <show time="2019-05-26T12:15:00" url="https://booking.cineworld.co.uk/booking/8022/154140" audioType="audio described"/>
                    <show time="2019-05-26T14:30:00" url="https://booking.cineworld.co.uk/booking/8022/154141" audioType="audio described"/>
                    <show time="2019-05-26T16:45:00" url="https://booking.cineworld.co.uk/booking/8022/154142" audioType="audio described"/>
                    <show time="2019-05-27T10:00:00" url="https://booking.cineworld.co.uk/booking/8022/154143" audioType="audio described"/>
                    <show time="2019-05-27T12:15:00" url="https://booking.cineworld.co.uk/booking/8022/154144" audioType="audio described"/>
                    <show time="2019-05-27T14:30:00" url="https://booking.cineworld.co.uk/booking/8022/154145" audioType="audio described"/>
                    <show time="2019-05-27T16:45:00" url="https://booking.cineworld.co.uk/booking/8022/154146" audioType="audio described"/>
                    <show time="2019-05-28T10:00:00" url="https://booking.cineworld.co.uk/booking/8022/154147" audioType="audio described"/>
                    <show time="2019-05-28T12:15:00" url="https://booking.cineworld.co.uk/booking/8022/154148" audioType="audio described"/>
                    <show time="2019-05-28T14:30:00" url="https://booking.cineworld.co.uk/booking/8022/154149" audioType="audio described"/>
                    <show time="2019-05-28T16:45:00" url="https://booking.cineworld.co.uk/booking/8022/154150" audioType="audio described"/>
                </shows>
            </film>
            <film title="Tolkien" rating="12A" url="films/tolkien" edi="271425" release="03/05/2019">
                <shows>
                    <show time="2019-05-06T12:10:00" url="https://booking.cineworld.co.uk/booking/8022/155949" audioType="audio described"/>
                    <show time="2019-05-06T14:50:00" url="https://booking.cineworld.co.uk/booking/8022/155950" audioType="audio described"/>
                    <show time="2019-05-06T17:30:00" url="https://booking.cineworld.co.uk/booking/8022/155951" audioType="audio described"/>
                    <show time="2019-05-06T20:15:00" url="https://booking.cineworld.co.uk/booking/8022/155952" audioType="audio described"/>
                    <show time="2019-05-07T12:10:00" url="https://booking.cineworld.co.uk/booking/8022/155953" audioType="audio described"/>
                    <show time="2019-05-07T14:50:00" url="https://booking.cineworld.co.uk/booking/8022/155954" audioType="audio described"/>
                    <show time="2019-05-07T17:30:00" url="https://booking.cineworld.co.uk/booking/8022/155955" audioType="audio described"/>
                    <show time="2019-05-07T20:15:00" url="https://booking.cineworld.co.uk/booking/8022/155956" audioType="audio described"/>
                    <show time="2019-05-08T12:10:00" url="https://booking.cineworld.co.uk/booking/8022/155957" audioType="audio described"/>
                    <show time="2019-05-08T14:50:00" url="https://booking.cineworld.co.uk/booking/8022/155958" audioType="audio described"/>
                    <show time="2019-05-08T17:30:00" url="https://booking.cineworld.co.uk/booking/8022/155959" audioType="audio described"/>
                    <show time="2019-05-08T20:15:00" url="https://booking.cineworld.co.uk/booking/8022/155960" audioType="audio described"/>
                    <show time="2019-05-09T12:10:00" url="https://booking.cineworld.co.uk/booking/8022/155961" audioType="audio described"/>
                    <show time="2019-05-09T14:50:00" url="https://booking.cineworld.co.uk/booking/8022/155962" audioType="audio described"/>
                    <show time="2019-05-09T17:30:00" url="https://booking.cineworld.co.uk/booking/8022/155963" audioType="audio described"/>
                    <show time="2019-05-09T20:15:00" url="https://booking.cineworld.co.uk/booking/8022/155964" audioType="audio described" subtitled="true"/>
                </shows>
            </film>
            <film title="Victoria - Northern Ballet" rating="PG" url="films/victoria-northern-ballet" edi="270190" release="25/06/2019">
                <shows>
                    <show time="2019-06-25T19:30:00" url="https://booking.cineworld.co.uk/booking/8022/151048"/>
                </shows>
            </film>
            <film title="Westlife : The Twenty Tour Live" rating="12A" url="films/westlife-the-twenty-tour-live-from-croke-park" edi="270186" release="06/07/2019">
                <shows>
                    <show time="2019-07-06T20:00:00" url="https://booking.cineworld.co.uk/booking/8022/155556"/>
                </shows>
            </film>
            <film title="(2D) Wonder Park" rating="PG" url="films/wonder-park" edi="194897" release="12/04/2019">
                <shows>
                    <show time="2019-05-06T11:30:00" url="https://booking.cineworld.co.uk/booking/8022/155914" audioType="audio described"/>
                </shows>
            </film>
            <film title="(IMAX 3-D) X-Men: Dark Phoenix" rating="TBC" url="films/x-men-dark-phoenix" edi="277442" release="05/06/2019">
                <shows>
                    <show time="2019-06-05T11:30:00" url="https://booking.cineworld.co.uk/booking/8022/155753" videoType="imax 3d"/>
                    <show time="2019-06-05T14:20:00" url="https://booking.cineworld.co.uk/booking/8022/155754" videoType="imax 3d"/>
                    <show time="2019-06-05T17:10:00" url="https://booking.cineworld.co.uk/booking/8022/155755" videoType="imax 3d"/>
                    <show time="2019-06-05T20:00:00" url="https://booking.cineworld.co.uk/booking/8022/155756" videoType="imax 3d"/>
                    <show time="2019-06-06T11:30:00" url="https://booking.cineworld.co.uk/booking/8022/155776" videoType="imax 3d"/>
                    <show time="2019-06-06T14:20:00" url="https://booking.cineworld.co.uk/booking/8022/155777" videoType="imax 3d"/>
                    <show time="2019-06-06T17:10:00" url="https://booking.cineworld.co.uk/booking/8022/155778" videoType="imax 3d"/>
                    <show time="2019-06-06T20:00:00" url="https://booking.cineworld.co.uk/booking/8022/155779" videoType="imax 3d"/>
                    <show time="2019-06-07T11:30:00" url="https://booking.cineworld.co.uk/booking/8022/155780" videoType="imax 3d"/>
                    <show time="2019-06-07T14:20:00" url="https://booking.cineworld.co.uk/booking/8022/155781" videoType="imax 3d"/>
                    <show time="2019-06-07T17:10:00" url="https://booking.cineworld.co.uk/booking/8022/155782" videoType="imax 3d"/>
                    <show time="2019-06-07T20:00:00" url="https://booking.cineworld.co.uk/booking/8022/155783" videoType="imax 3d"/>
                    <show time="2019-06-08T11:30:00" url="https://booking.cineworld.co.uk/booking/8022/155784" videoType="imax 3d"/>
                    <show time="2019-06-08T14:20:00" url="https://booking.cineworld.co.uk/booking/8022/155785" videoType="imax 3d"/>
                    <show time="2019-06-08T17:10:00" url="https://booking.cineworld.co.uk/booking/8022/155786" videoType="imax 3d"/>
                    <show time="2019-06-08T20:00:00" url="https://booking.cineworld.co.uk/booking/8022/155787" videoType="imax 3d"/>
                    <show time="2019-06-09T11:30:00" url="https://booking.cineworld.co.uk/booking/8022/155788" videoType="imax 3d"/>
                    <show time="2019-06-09T14:20:00" url="https://booking.cineworld.co.uk/booking/8022/155789" videoType="imax 3d"/>
                    <show time="2019-06-09T17:10:00" url="https://booking.cineworld.co.uk/booking/8022/155790" videoType="imax 3d"/>
                    <show time="2019-06-09T20:00:00" url="https://booking.cineworld.co.uk/booking/8022/155791" videoType="imax 3d"/>
                </shows>
            </film>
            <film title="X-Men: Dark Phoenix" rating="TBC" url="films/x-men-dark-phoenix" edi="220087" release="05/06/2019">
                <shows>
                    <show time="2019-06-05T13:30:00" url="https://booking.cineworld.co.uk/booking/8022/155757" audioType="audio described"/>
                    <show time="2019-06-05T16:20:00" url="https://booking.cineworld.co.uk/booking/8022/155758" audioType="audio described"/>
                    <show time="2019-06-05T19:10:00" url="https://booking.cineworld.co.uk/booking/8022/155759" audioType="audio described"/>
                    <show time="2019-06-06T13:30:00" url="https://booking.cineworld.co.uk/booking/8022/155760" audioType="audio described"/>
                    <show time="2019-06-06T16:20:00" url="https://booking.cineworld.co.uk/booking/8022/155761" audioType="audio described"/>
                    <show time="2019-06-06T19:10:00" url="https://booking.cineworld.co.uk/booking/8022/155762" audioType="audio described"/>
                    <show time="2019-06-07T13:30:00" url="https://booking.cineworld.co.uk/booking/8022/155763" audioType="audio described"/>
                    <show time="2019-06-07T16:20:00" url="https://booking.cineworld.co.uk/booking/8022/155764" audioType="audio described"/>
                    <show time="2019-06-07T19:10:00" url="https://booking.cineworld.co.uk/booking/8022/155765" audioType="audio described"/>
                    <show time="2019-06-08T13:30:00" url="https://booking.cineworld.co.uk/booking/8022/155766" audioType="audio described"/>
                    <show time="2019-06-08T16:20:00" url="https://booking.cineworld.co.uk/booking/8022/155767" audioType="audio described"/>
                    <show time="2019-06-08T19:10:00" url="https://booking.cineworld.co.uk/booking/8022/155768" audioType="audio described"/>
                    <show time="2019-06-09T13:30:00" url="https://booking.cineworld.co.uk/booking/8022/155769" audioType="audio described"/>
                    <show time="2019-06-09T16:20:00" url="https://booking.cineworld.co.uk/booking/8022/155770" audioType="audio described"/>
                    <show time="2019-06-09T19:10:00" url="https://booking.cineworld.co.uk/booking/8022/155771" audioType="audio described"/>
                </shows>
            </film>
            <film title="(4DX 3D) X-Men: Dark Phoenix" rating="TBC" url="films/x-men-dark-phoenix" edi="801831" release="05/06/2019">
                <shows>
                    <show time="2019-06-05T12:30:00" url="https://booking.cineworld.co.uk/booking/8022/155749" videoType="3d" audioType="audio described"/>
                    <show time="2019-06-05T15:20:00" url="https://booking.cineworld.co.uk/booking/8022/155750" videoType="3d" audioType="audio described"/>
                    <show time="2019-06-05T18:10:00" url="https://booking.cineworld.co.uk/booking/8022/155751" videoType="3d" audioType="audio described"/>
                    <show time="2019-06-05T21:00:00" url="https://booking.cineworld.co.uk/booking/8022/155752" videoType="3d" audioType="audio described"/>
                    <show time="2019-06-06T12:30:00" url="https://booking.cineworld.co.uk/booking/8022/155772" videoType="3d" audioType="audio described"/>
                    <show time="2019-06-06T15:20:00" url="https://booking.cineworld.co.uk/booking/8022/155773" videoType="3d" audioType="audio described"/>
                    <show time="2019-06-06T18:10:00" url="https://booking.cineworld.co.uk/booking/8022/155774" videoType="3d" audioType="audio described"/>
                    <show time="2019-06-06T21:00:00" url="https://booking.cineworld.co.uk/booking/8022/155775" videoType="3d" audioType="audio described"/>
                    <show time="2019-06-07T12:30:00" url="https://booking.cineworld.co.uk/booking/8022/155792" videoType="3d" audioType="audio described"/>
                    <show time="2019-06-07T15:20:00" url="https://booking.cineworld.co.uk/booking/8022/155793" videoType="3d" audioType="audio described"/>
                    <show time="2019-06-07T18:10:00" url="https://booking.cineworld.co.uk/booking/8022/155794" videoType="3d" audioType="audio described"/>
                    <show time="2019-06-07T21:00:00" url="https://booking.cineworld.co.uk/booking/8022/155795" videoType="3d" audioType="audio described"/>
                    <show time="2019-06-08T12:30:00" url="https://booking.cineworld.co.uk/booking/8022/155796" videoType="3d" audioType="audio described"/>
                    <show time="2019-06-08T15:20:00" url="https://booking.cineworld.co.uk/booking/8022/155797" videoType="3d" audioType="audio described"/>
                    <show time="2019-06-08T18:10:00" url="https://booking.cineworld.co.uk/booking/8022/155798" videoType="3d" audioType="audio described"/>
                    <show time="2019-06-08T21:00:00" url="https://booking.cineworld.co.uk/booking/8022/155799" videoType="3d" audioType="audio described"/>
                    <show time="2019-06-09T12:30:00" url="https://booking.cineworld.co.uk/booking/8022/155800" videoType="3d" audioType="audio described"/>
                    <show time="2019-06-09T15:20:00" url="https://booking.cineworld.co.uk/booking/8022/155801" videoType="3d" audioType="audio described"/>
                    <show time="2019-06-09T18:10:00" url="https://booking.cineworld.co.uk/booking/8022/155802" videoType="3d" audioType="audio described"/>
                    <show time="2019-06-09T21:00:00" url="https://booking.cineworld.co.uk/booking/8022/155803" videoType="3d" audioType="audio described"/>
                </shows>
            </film>
        </listing>
    </cinema>
    <cinema name="Cineworld Birmingham - NEC" root="http://www1.cineworld.co.uk/" url="cinemas/birmingham-nec" id="96" phone="0871 200 2000" address="Resorts World, Pendigo Way, Birmingham" postcode="B40 1PU">
        <listing>
            <film title="A Dog's Journey" rating="PG" url="films/a-dogs-journey" edi="255103" release="03/05/2019">
                <shows>
                    <show time="2019-05-06T11:30:00" url="https://booking.cineworld.co.uk/booking/8102/60954" audioType="audio described"/>
                    <show time="2019-05-06T14:10:00" url="https://booking.cineworld.co.uk/booking/8102/60955" audioType="audio described"/>
                    <show time="2019-05-06T15:30:00" url="https://booking.cineworld.co.uk/booking/8102/61045" audioType="audio described"/>
                    <show time="2019-05-06T18:10:00" url="https://booking.cineworld.co.uk/booking/8102/61046" audioType="audio described"/>
                    <show time="2019-05-07T12:50:00" url="https://booking.cineworld.co.uk/booking/8102/61032" audioType="audio described"/>
                    <show time="2019-05-07T15:30:00" url="https://booking.cineworld.co.uk/booking/8102/61033" audioType="audio described"/>
                    <show time="2019-05-07T18:10:00" url="https://booking.cineworld.co.uk/booking/8102/61034" audioType="audio described"/>
                    <show time="2019-05-08T12:50:00" url="https://booking.cineworld.co.uk/booking/8102/61035" audioType="audio described"/>
                    <show time="2019-05-08T15:30:00" url="https://booking.cineworld.co.uk/booking/8102/61036" audioType="audio described"/>
                    <show time="2019-05-08T18:10:00" url="https://booking.cineworld.co.uk/booking/8102/61037" audioType="audio described"/>
                    <show time="2019-05-09T12:50:00" url="https://booking.cineworld.co.uk/booking/8102/61038" audioType="audio described"/>
                    <show time="2019-05-09T15:30:00" url="https://booking.cineworld.co.uk/booking/8102/61039" audioType="audio described"/>
                    <show time="2019-05-09T18:10:00" url="https://booking.cineworld.co.uk/booking/8102/61040" audioType="audio described"/>
                </shows>
            </film>
            <film title="Andre Rieu 2019 Maastricht Concert Shall We Dance?" rating="PG" url="films/andre-rieu-2019-maastricht-concert-shall-we-dance" edi="255443" release="27/07/2019">
                <shows>
                    <show time="2019-07-27T19:00:00" url="https://booking.cineworld.co.uk/booking/8102/57246"/>
                    <show time="2019-07-28T15:00:00" url="https://booking.cineworld.co.uk/booking/8102/57247"/>
                </shows>
            </film>
            <film title="(IMAX 3-D) Avengers: Endgame" rating="12A" url="films/avengers-endgame" edi="230548" release="25/04/2019">
                <shows>
                    <show time="2019-05-06T11:10:00" url="https://booking.cineworld.co.uk/booking/8102/60755" videoType="imax 3d"/>
                    <show time="2019-05-06T15:10:00" url="https://booking.cineworld.co.uk/booking/8102/60719" videoType="imax 3d"/>
                    <show time="2019-05-06T19:20:00" url="https://booking.cineworld.co.uk/booking/8102/60720" videoType="imax 3d"/>
                    <show time="2019-05-07T15:20:00" url="https://booking.cineworld.co.uk/booking/8102/60998" videoType="imax 3d"/>
                    <show time="2019-05-07T19:20:00" url="https://booking.cineworld.co.uk/booking/8102/60999" videoType="imax 3d"/>
                    <show time="2019-05-08T15:20:00" url="https://booking.cineworld.co.uk/booking/8102/61000" videoType="imax 3d"/>
                    <show time="2019-05-08T19:20:00" url="https://booking.cineworld.co.uk/booking/8102/61001" videoType="imax 3d"/>
                    <show time="2019-05-09T15:20:00" url="https://booking.cineworld.co.uk/booking/8102/61002" videoType="imax 3d"/>
                    <show time="2019-05-09T19:20:00" url="https://booking.cineworld.co.uk/booking/8102/61003" videoType="imax 3d"/>
                </shows>
            </film>
            <film title="(3D) Avengers: Endgame" rating="12A" url="films/avengers-endgame" edi="174256" release="25/04/2019">
                <shows>
                    <show time="2019-05-06T12:00:00" url="https://booking.cineworld.co.uk/booking/8102/60772" videoType="3d" audioType="audio described"/>
                    <show time="2019-05-06T16:00:00" url="https://booking.cineworld.co.uk/booking/8102/60773" videoType="3d" audioType="audio described"/>
                    <show time="2019-05-06T19:00:00" url="https://booking.cineworld.co.uk/booking/8102/60778" videoType="3d" audioType="audio described"/>
                    <show time="2019-05-06T19:50:00" url="https://booking.cineworld.co.uk/booking/8102/60774" videoType="3d" audioType="audio described"/>
                    <show time="2019-05-07T16:00:00" url="https://booking.cineworld.co.uk/booking/8102/61146" videoType="3d" audioType="audio described"/>
                    <show time="2019-05-07T19:00:00" url="https://booking.cineworld.co.uk/booking/8102/61136" videoType="3d" audioType="audio described"/>
                    <show time="2019-05-07T20:00:00" url="https://booking.cineworld.co.uk/booking/8102/61147" videoType="3d" audioType="audio described"/>
                    <show time="2019-05-08T16:00:00" url="https://booking.cineworld.co.uk/booking/8102/61145" videoType="3d" audioType="audio described"/>
                    <show time="2019-05-08T19:00:00" url="https://booking.cineworld.co.uk/booking/8102/61137" videoType="3d" audioType="audio described"/>
                    <show time="2019-05-09T16:00:00" url="https://booking.cineworld.co.uk/booking/8102/61143" videoType="3d" audioType="audio described"/>
                    <show time="2019-05-09T19:00:00" url="https://booking.cineworld.co.uk/booking/8102/61138" videoType="3d" audioType="audio described"/>
                    <show time="2019-05-09T20:00:00" url="https://booking.cineworld.co.uk/booking/8102/61144" videoType="3d" audioType="audio described"/>
                </shows>
            </film>
            <film title="(2D) Avengers: Endgame" rating="12A" url="films/avengers-endgame" edi="169126" release="25/04/2019">
                <shows>
                    <show time="2019-05-06T10:10:00" url="https://booking.cineworld.co.uk/booking/8102/60749" audioType="audio described"/>
                    <show time="2019-05-06T12:30:00" url="https://booking.cineworld.co.uk/booking/8102/60734" audioType="audio described"/>
                    <show time="2019-05-06T13:40:00" url="https://booking.cineworld.co.uk/booking/8102/60760" audioType="audio described"/>
                    <show time="2019-05-06T14:20:00" url="https://booking.cineworld.co.uk/booking/8102/60750" audioType="audio described"/>
                    <show time="2019-05-06T14:50:00" url="https://booking.cineworld.co.uk/booking/8102/61132" audioType="audio described"/>
                    <show time="2019-05-06T16:30:00" url="https://booking.cineworld.co.uk/booking/8102/60735" audioType="audio described"/>
                    <show time="2019-05-06T18:00:00" url="https://booking.cineworld.co.uk/booking/8102/60761" audioType="audio described"/>
                    <show time="2019-05-06T18:30:00" url="https://booking.cineworld.co.uk/booking/8102/60754" audioType="audio described"/>
                    <show time="2019-05-06T20:30:00" url="https://booking.cineworld.co.uk/booking/8102/60736" audioType="audio described"/>
                    <show time="2019-05-06T21:00:00" url="https://booking.cineworld.co.uk/booking/8102/61025" audioType="audio described"/>
                    <show time="2019-05-06T21:50:00" url="https://booking.cineworld.co.uk/booking/8102/60985" audioType="audio described"/>
                    <show time="2019-05-07T12:30:00" url="https://booking.cineworld.co.uk/booking/8102/61004" audioType="audio described"/>
                    <show time="2019-05-07T13:40:00" url="https://booking.cineworld.co.uk/booking/8102/60986" audioType="audio described"/>
                    <show time="2019-05-07T14:20:00" url="https://booking.cineworld.co.uk/booking/8102/61016" audioType="audio described"/>
                    <show time="2019-05-07T14:50:00" url="https://booking.cineworld.co.uk/booking/8102/61133" audioType="audio described"/>
                    <show time="2019-05-07T16:30:00" url="https://booking.cineworld.co.uk/booking/8102/61005" audioType="audio described"/>
                    <show time="2019-05-07T18:00:00" url="https://booking.cineworld.co.uk/booking/8102/60987" audioType="audio described"/>
                    <show time="2019-05-07T18:30:00" url="https://booking.cineworld.co.uk/booking/8102/61017" audioType="audio described"/>
                    <show time="2019-05-07T19:40:00" url="https://booking.cineworld.co.uk/booking/8102/61108" audioType="audio described"/>
                    <show time="2019-05-07T20:30:00" url="https://booking.cineworld.co.uk/booking/8102/61006" audioType="audio described"/>
                    <show time="2019-05-07T21:00:00" url="https://booking.cineworld.co.uk/booking/8102/61026" audioType="audio described"/>
                    <show time="2019-05-07T21:50:00" url="https://booking.cineworld.co.uk/booking/8102/60988" audioType="audio described"/>
                    <show time="2019-05-08T12:30:00" url="https://booking.cineworld.co.uk/booking/8102/61007" audioType="audio described"/>
                    <show time="2019-05-08T13:40:00" url="https://booking.cineworld.co.uk/booking/8102/60989" audioType="audio described"/>
                    <show time="2019-05-08T14:20:00" url="https://booking.cineworld.co.uk/booking/8102/61018" audioType="audio described"/>
                    <show time="2019-05-08T14:50:00" url="https://booking.cineworld.co.uk/booking/8102/61134" audioType="audio described"/>
                    <show time="2019-05-08T16:30:00" url="https://booking.cineworld.co.uk/booking/8102/61008" audioType="audio described"/>
                    <show time="2019-05-08T18:00:00" url="https://booking.cineworld.co.uk/booking/8102/60990" audioType="audio described"/>
                    <show time="2019-05-08T18:30:00" url="https://booking.cineworld.co.uk/booking/8102/61019" audioType="audio described"/>
                    <show time="2019-05-08T19:50:00" url="https://booking.cineworld.co.uk/booking/8102/61142" audioType="audio described"/>
                    <show time="2019-05-08T20:30:00" url="https://booking.cineworld.co.uk/booking/8102/61009" audioType="audio described"/>
                    <show time="2019-05-08T21:00:00" url="https://booking.cineworld.co.uk/booking/8102/61027" audioType="audio described"/>
                    <show time="2019-05-08T21:50:00" url="https://booking.cineworld.co.uk/booking/8102/60991" audioType="audio described"/>
                    <show time="2019-05-09T12:30:00" url="https://booking.cineworld.co.uk/booking/8102/61010" audioType="audio described"/>
                    <show time="2019-05-09T13:40:00" url="https://booking.cineworld.co.uk/booking/8102/60992" audioType="audio described"/>
                    <show time="2019-05-09T14:20:00" url="https://booking.cineworld.co.uk/booking/8102/61020" audioType="audio described"/>
                    <show time="2019-05-09T14:50:00" url="https://booking.cineworld.co.uk/booking/8102/61135" audioType="audio described"/>
                    <show time="2019-05-09T16:30:00" url="https://booking.cineworld.co.uk/booking/8102/61011" audioType="audio described"/>
                    <show time="2019-05-09T18:00:00" url="https://booking.cineworld.co.uk/booking/8102/60993" audioType="audio described" subtitled="true"/>
                    <show time="2019-05-09T18:30:00" url="https://booking.cineworld.co.uk/booking/8102/61021" audioType="audio described"/>
                    <show time="2019-05-09T19:40:00" url="https://booking.cineworld.co.uk/booking/8102/61109" audioType="audio described"/>
                    <show time="2019-05-09T20:30:00" url="https://booking.cineworld.co.uk/booking/8102/61012" audioType="audio described"/>
                    <show time="2019-05-09T21:00:00" url="https://booking.cineworld.co.uk/booking/8102/61028" audioType="audio described"/>
                    <show time="2019-05-09T21:50:00" url="https://booking.cineworld.co.uk/booking/8102/60994" audioType="audio described"/>
                </shows>
            </film>
            <film title="Beats : Unlimited Screening" rating="18" url="films/beats-unlimited-screening" edi="801824" release="08/05/2019">
                <shows>
                    <show time="2019-05-08T20:00:00" url="https://booking.cineworld.co.uk/booking/8102/60717" audioType="audio described"/>
                </shows>
            </film>
            <film title="Booksmart: Unlimited Screening" rating="15" url="films/booksmart-unlimited-screening" edi="801833" release="06/05/2019">
                <shows>
                    <show time="2019-05-06T19:45:00" url="https://booking.cineworld.co.uk/booking/8102/60916" audioType="audio described"/>
                </shows>
            </film>
            <film title="(2D) Captain Marvel" rating="12A" url="films/captain-marvel" edi="169122" release="08/03/2019">
                <shows>
                    <show time="2019-05-06T10:40:00" url="https://booking.cineworld.co.uk/booking/8102/60996"/>
                    <show time="2019-05-07T14:40:00" url="https://booking.cineworld.co.uk/booking/8102/61085"/>
                    <show time="2019-05-08T14:40:00" url="https://booking.cineworld.co.uk/booking/8102/61086"/>
                    <show time="2019-05-09T14:40:00" url="https://booking.cineworld.co.uk/booking/8102/61087"/>
                </shows>
            </film>
            <film title="Dr Strangelove (Or How I Learned To Stop...) [GCF]" rating="PG" url="films/dr-strangelove-or-how-i-learned-to-stop-worrying-and-love-the-bomb" edi="445976" release="20/05/2019">
                <shows>
                    <show time="2019-05-30T20:00:00" url="https://booking.cineworld.co.uk/booking/8102/61156"/>
                </shows>
            </film>
            <film title="Dumbo" rating="PG" url="films/dumbo" edi="192491" release="29/03/2019">
                <shows>
                    <show time="2019-05-06T11:50:00" url="https://booking.cineworld.co.uk/booking/8102/61141" audioType="audio described"/>
                    <show time="2019-05-06T17:00:00" url="https://booking.cineworld.co.uk/booking/8102/60956" audioType="audio described"/>
                    <show time="2019-05-07T17:00:00" url="https://booking.cineworld.co.uk/booking/8102/61117" audioType="audio described"/>
                    <show time="2019-05-08T17:00:00" url="https://booking.cineworld.co.uk/booking/8102/61118" audioType="audio described"/>
                    <show time="2019-05-09T17:00:00" url="https://booking.cineworld.co.uk/booking/8102/61119" audioType="audio described"/>
                </shows>
            </film>
            <film title="M4J How To Train Your Dragon: The Hidden World" rating="PG" url="films/how-to-train-your-dragon-the-hidden-world-movies-for-juniors" edi="801822" release="01/02/2019">
                <shows>
                    <show time="2019-05-06T10:20:00" url="https://booking.cineworld.co.uk/booking/8102/61052" audioType="audio described"/>
                </shows>
            </film>
            <film title="Little" rating="12A" url="films/little" edi="250296" release="12/04/2019">
                <shows>
                    <show time="2019-05-07T12:30:00" url="https://booking.cineworld.co.uk/booking/8102/61057"/>
                    <show time="2019-05-08T12:30:00" url="https://booking.cineworld.co.uk/booking/8102/61058"/>
                    <show time="2019-05-09T12:30:00" url="https://booking.cineworld.co.uk/booking/8102/61059"/>
                </shows>
            </film>
            <film title="Long Shot" rating="15" url="films/long-shot" edi="240058" release="03/05/2019">
                <shows>
                    <show time="2019-05-06T11:40:00" url="https://booking.cineworld.co.uk/booking/8102/61102" audioType="audio described"/>
                    <show time="2019-05-06T14:40:00" url="https://booking.cineworld.co.uk/booking/8102/61103" audioType="audio described"/>
                    <show time="2019-05-06T17:50:00" url="https://booking.cineworld.co.uk/booking/8102/61104" audioType="audio described"/>
                    <show time="2019-05-06T20:40:00" url="https://booking.cineworld.co.uk/booking/8102/61105" audioType="audio described"/>
                    <show time="2019-05-07T14:00:00" url="https://booking.cineworld.co.uk/booking/8102/61121" audioType="audio described"/>
                    <show time="2019-05-07T17:50:00" url="https://booking.cineworld.co.uk/booking/8102/61088" audioType="audio described"/>
                    <show time="2019-05-07T20:40:00" url="https://booking.cineworld.co.uk/booking/8102/61089" audioType="audio described"/>
                    <show time="2019-05-08T14:00:00" url="https://booking.cineworld.co.uk/booking/8102/61122" audioType="audio described"/>
                    <show time="2019-05-08T17:50:00" url="https://booking.cineworld.co.uk/booking/8102/61090" audioType="audio described"/>
                    <show time="2019-05-08T20:40:00" url="https://booking.cineworld.co.uk/booking/8102/61091" audioType="audio described"/>
                    <show time="2019-05-09T14:00:00" url="https://booking.cineworld.co.uk/booking/8102/61123" audioType="audio described"/>
                    <show time="2019-05-09T17:50:00" url="https://booking.cineworld.co.uk/booking/8102/61092" audioType="audio described"/>
                    <show time="2019-05-09T20:40:00" url="https://booking.cineworld.co.uk/booking/8102/61093" audioType="audio described"/>
                </shows>
            </film>
            <film title="Margaret Atwood : Live In Cinemas" rating="12A" url="films/margaret-atwood-live-in-cinemas" edi="272858" release="10/09/2019">
                <shows>
                    <show time="2019-09-10T19:30:00" url="https://booking.cineworld.co.uk/booking/8102/59021"/>
                </shows>
            </film>
            <film title="Missing Link" rating="PG" url="films/missing-link" edi="258465" release="05/04/2019">
                <shows>
                    <show time="2019-05-06T10:50:00" url="https://booking.cineworld.co.uk/booking/8102/61124"/>
                </shows>
            </film>
            <film title="NT Live: All My Sons" rating="12A" url="films/nt-live-all-my-sons" edi="263592" release="14/05/2019">
                <shows>
                    <show time="2019-05-14T19:00:00" url="https://booking.cineworld.co.uk/booking/8102/55013"/>
                </shows>
            </film>
            <film title="NT Live : One Man, Two Guvnors (Encore)" rating="12A" url="films/nt-live-one-man-two-guvnors-encore" edi="266343" release="26/09/2019">
                <shows>
                    <show time="2019-09-26T19:00:00" url="https://booking.cineworld.co.uk/booking/8102/60389"/>
                </shows>
            </film>
            <film title="NT Live : Small Island" rating="12A" url="films/nt-live-small-island" edi="270872" release="27/06/2019">
                <shows>
                    <show time="2019-06-27T19:00:00" url="https://booking.cineworld.co.uk/booking/8102/57234"/>
                </shows>
            </film>
            <film title="NT Live : The Lehman Trilogy" rating="12A" url="films/nt-live-the-lehman-trilogy" edi="266345" release="25/07/2019">
                <shows>
                    <show time="2019-07-25T19:00:00" url="https://booking.cineworld.co.uk/booking/8102/60388"/>
                </shows>
            </film>
            <film title="Pavarotti plus Q&amp;A" rating="TBC" url="films/pavarotti-plus-qa" edi="801820" release="13/07/2019">
                <shows>
                    <show time="2019-07-13T19:00:00" url="https://booking.cineworld.co.uk/booking/8102/61155"/>
                </shows>
            </film>
            <film title="Paw Patrol: Mighty Pups - The Movie" rating="TBC" url="films/paw-patrol-mighty-pups" edi="261550" release="17/05/2019">
                <shows>
                    <show time="2019-05-18T11:20:00" url="https://booking.cineworld.co.uk/booking/8102/60390" audioType="audio described"/>
                    <show time="2019-05-18T13:10:00" url="https://booking.cineworld.co.uk/booking/8102/60391" audioType="audio described"/>
                    <show time="2019-05-18T15:00:00" url="https://booking.cineworld.co.uk/booking/8102/60392" audioType="audio described"/>
                    <show time="2019-05-19T11:20:00" url="https://booking.cineworld.co.uk/booking/8102/60393" audioType="audio described"/>
                    <show time="2019-05-19T13:10:00" url="https://booking.cineworld.co.uk/booking/8102/60394" audioType="audio described"/>
                    <show time="2019-05-19T15:00:00" url="https://booking.cineworld.co.uk/booking/8102/60395" audioType="audio described"/>
                </shows>
            </film>
            <film title="Peppa Pig: Festival Of Fun" rating="U" url="films/peppa-pig-festival-of-fun" edi="256539" release="05/04/2019">
                <shows>
                    <show time="2019-05-06T10:00:00" url="https://booking.cineworld.co.uk/booking/8102/61154" audioType="audio described"/>
                </shows>
            </film>
            <film title="(3D) Detective Pikachu" rating="PG" url="films/pokemon-detective-pikachu" edi="245036" release="10/05/2019">
                <shows>
                    <show time="2019-05-10T13:20:00" url="https://booking.cineworld.co.uk/booking/8102/61181" videoType="3d" audioType="audio described"/>
                    <show time="2019-05-10T16:00:00" url="https://booking.cineworld.co.uk/booking/8102/61182" videoType="3d" audioType="audio described"/>
                    <show time="2019-05-10T18:30:00" url="https://booking.cineworld.co.uk/booking/8102/61183" videoType="3d" audioType="audio described"/>
                    <show time="2019-05-11T13:20:00" url="https://booking.cineworld.co.uk/booking/8102/61184" videoType="3d" audioType="audio described"/>
                    <show time="2019-05-11T16:00:00" url="https://booking.cineworld.co.uk/booking/8102/61185" videoType="3d" audioType="audio described"/>
                    <show time="2019-05-11T18:30:00" url="https://booking.cineworld.co.uk/booking/8102/61186" videoType="3d" audioType="audio described"/>
                    <show time="2019-05-12T13:20:00" url="https://booking.cineworld.co.uk/booking/8102/61187" videoType="3d" audioType="audio described"/>
                    <show time="2019-05-12T16:00:00" url="https://booking.cineworld.co.uk/booking/8102/61188" videoType="3d" audioType="audio described"/>
                    <show time="2019-05-12T18:30:00" url="https://booking.cineworld.co.uk/booking/8102/61189" videoType="3d" audioType="audio described"/>
                </shows>
            </film>
            <film title="(2D) Detective Pikachu" rating="PG" url="films/pokemon-detective-pikachu" edi="244991" release="10/05/2019">
                <shows>
                    <show time="2019-05-10T12:40:00" url="https://booking.cineworld.co.uk/booking/8102/61163" audioType="audio described"/>
                    <show time="2019-05-10T15:10:00" url="https://booking.cineworld.co.uk/booking/8102/61164" audioType="audio described"/>
                    <show time="2019-05-10T17:40:00" url="https://booking.cineworld.co.uk/booking/8102/61165" audioType="audio described"/>
                    <show time="2019-05-10T20:10:00" url="https://booking.cineworld.co.uk/booking/8102/61166" audioType="audio described"/>
                    <show time="2019-05-11T10:00:00" url="https://booking.cineworld.co.uk/booking/8102/61167" audioType="audio described"/>
                    <show time="2019-05-11T11:30:00" url="https://booking.cineworld.co.uk/booking/8102/61177" audioType="audio described"/>
                    <show time="2019-05-11T12:40:00" url="https://booking.cineworld.co.uk/booking/8102/61168" audioType="audio described"/>
                    <show time="2019-05-11T14:00:00" url="https://booking.cineworld.co.uk/booking/8102/61178" audioType="audio described"/>
                    <show time="2019-05-11T15:10:00" url="https://booking.cineworld.co.uk/booking/8102/61169" audioType="audio described"/>
                    <show time="2019-05-11T17:40:00" url="https://booking.cineworld.co.uk/booking/8102/61170" audioType="audio described"/>
                    <show time="2019-05-11T20:10:00" url="https://booking.cineworld.co.uk/booking/8102/61171" audioType="audio described"/>
                    <show time="2019-05-12T10:00:00" url="https://booking.cineworld.co.uk/booking/8102/61172" audioType="audio described"/>
                    <show time="2019-05-12T11:30:00" url="https://booking.cineworld.co.uk/booking/8102/61179" audioType="audio described"/>
                    <show time="2019-05-12T12:40:00" url="https://booking.cineworld.co.uk/booking/8102/61173" audioType="audio described"/>
                    <show time="2019-05-12T14:00:00" url="https://booking.cineworld.co.uk/booking/8102/61180" audioType="audio described"/>
                    <show time="2019-05-12T15:10:00" url="https://booking.cineworld.co.uk/booking/8102/61174" audioType="audio described"/>
                    <show time="2019-05-12T17:40:00" url="https://booking.cineworld.co.uk/booking/8102/61175" audioType="audio described"/>
                    <show time="2019-05-12T20:10:00" url="https://booking.cineworld.co.uk/booking/8102/61176" audioType="audio described"/>
                </shows>
            </film>
            <film title="(IMAX) Pokemon Detective Pikachu" rating="PG" url="films/pokemon-detective-pikachu" edi="245038" release="10/05/2019">
                <shows>
                    <show time="2019-05-10T17:00:00" url="https://booking.cineworld.co.uk/booking/8102/61158" videoType="imax" audioType="audio described"/>
                    <show time="2019-05-11T10:40:00" url="https://booking.cineworld.co.uk/booking/8102/61159" videoType="imax" audioType="audio described"/>
                    <show time="2019-05-11T17:00:00" url="https://booking.cineworld.co.uk/booking/8102/61160" videoType="imax" audioType="audio described"/>
                    <show time="2019-05-12T10:40:00" url="https://booking.cineworld.co.uk/booking/8102/61161" videoType="imax" audioType="audio described"/>
                    <show time="2019-05-12T17:00:00" url="https://booking.cineworld.co.uk/booking/8102/61162" videoType="imax" audioType="audio described"/>
                </shows>
            </film>
            <film title="Saving Private Ryan (D-Day 75th Anniversary)" rating="15" url="films/saving-private-ryan-d-day-75th-anniversary" edi="275478" release="06/06/2019">
                <shows>
                    <show time="2019-06-06T20:00:00" url="https://booking.cineworld.co.uk/booking/8102/61157" audioType="audio described"/>
                </shows>
            </film>
            <film title="M4J Spider-Man: Into The Spider-Verse" rating="PG" url="films/spider-man-into-the-spider-verse-movies-for-juniors" edi="801735" release="15/02/2019">
                <shows>
                    <show time="2019-05-06T10:00:00" url="https://booking.cineworld.co.uk/booking/8102/61015" audioType="audio described"/>
                </shows>
            </film>
            <film title="Take That - Greatest Hits Live" rating="12A" url="films/take-that-greatest-hits-live" edi="270195" release="08/06/2019">
                <shows>
                    <show time="2019-06-08T20:00:00" url="https://booking.cineworld.co.uk/booking/8102/59022"/>
                </shows>
            </film>
            <film title="The Curse Of La Llorona" rating="15" url="films/the-curse-of-la-llorona" edi="250922" release="03/05/2019">
                <shows>
                    <show time="2019-05-06T13:20:00" url="https://booking.cineworld.co.uk/booking/8102/61125" audioType="audio described"/>
                    <show time="2019-05-06T15:50:00" url="https://booking.cineworld.co.uk/booking/8102/61126" audioType="audio described"/>
                    <show time="2019-05-06T18:20:00" url="https://booking.cineworld.co.uk/booking/8102/61127" audioType="audio described"/>
                    <show time="2019-05-06T20:50:00" url="https://booking.cineworld.co.uk/booking/8102/61128" audioType="audio described"/>
                    <show time="2019-05-07T13:20:00" url="https://booking.cineworld.co.uk/booking/8102/60970" audioType="audio described"/>
                    <show time="2019-05-07T15:50:00" url="https://booking.cineworld.co.uk/booking/8102/60971" audioType="audio described"/>
                    <show time="2019-05-07T18:20:00" url="https://booking.cineworld.co.uk/booking/8102/60972" audioType="audio described"/>
                    <show time="2019-05-07T20:50:00" url="https://booking.cineworld.co.uk/booking/8102/60973" audioType="audio described"/>
                    <show time="2019-05-08T13:20:00" url="https://booking.cineworld.co.uk/booking/8102/60974" audioType="audio described"/>
                    <show time="2019-05-08T15:50:00" url="https://booking.cineworld.co.uk/booking/8102/60975" audioType="audio described"/>
                    <show time="2019-05-08T18:20:00" url="https://booking.cineworld.co.uk/booking/8102/60976" audioType="audio described"/>
                    <show time="2019-05-08T20:50:00" url="https://booking.cineworld.co.uk/booking/8102/60977" audioType="audio described"/>
                    <show time="2019-05-09T13:20:00" url="https://booking.cineworld.co.uk/booking/8102/60978" audioType="audio described"/>
                    <show time="2019-05-09T15:50:00" url="https://booking.cineworld.co.uk/booking/8102/60979" audioType="audio described"/>
                    <show time="2019-05-09T18:20:00" url="https://booking.cineworld.co.uk/booking/8102/60980" audioType="audio described"/>
                    <show time="2019-05-09T20:50:00" url="https://booking.cineworld.co.uk/booking/8102/60981" audioType="audio described"/>
                </shows>
            </film>
            <film title="The Secret Life Of Pets 2" rating="U" url="films/the-secret-life-of-pets-2" edi="192838" release="24/05/2019">
                <shows>
                    <show time="2019-05-24T12:30:00" url="https://booking.cineworld.co.uk/booking/8102/59542" audioType="audio described"/>
                    <show time="2019-05-24T14:45:00" url="https://booking.cineworld.co.uk/booking/8102/59543" audioType="audio described"/>
                    <show time="2019-05-24T17:00:00" url="https://booking.cineworld.co.uk/booking/8102/59544" audioType="audio described"/>
                    <show time="2019-05-25T10:15:00" url="https://booking.cineworld.co.uk/booking/8102/59553" audioType="audio described"/>
                    <show time="2019-05-25T12:30:00" url="https://booking.cineworld.co.uk/booking/8102/59554" audioType="audio described"/>
                    <show time="2019-05-25T14:45:00" url="https://booking.cineworld.co.uk/booking/8102/59555" audioType="audio described"/>
                    <show time="2019-05-25T17:00:00" url="https://booking.cineworld.co.uk/booking/8102/59556" audioType="audio described"/>
                    <show time="2019-05-26T10:15:00" url="https://booking.cineworld.co.uk/booking/8102/59549" audioType="audio described"/>
                    <show time="2019-05-26T12:30:00" url="https://booking.cineworld.co.uk/booking/8102/59550" audioType="audio described"/>
                    <show time="2019-05-26T14:45:00" url="https://booking.cineworld.co.uk/booking/8102/59551" audioType="audio described"/>
                    <show time="2019-05-26T17:00:00" url="https://booking.cineworld.co.uk/booking/8102/59552" audioType="audio described"/>
                    <show time="2019-05-27T10:15:00" url="https://booking.cineworld.co.uk/booking/8102/59545" audioType="audio described"/>
                    <show time="2019-05-27T12:30:00" url="https://booking.cineworld.co.uk/booking/8102/59546" audioType="audio described"/>
                    <show time="2019-05-27T14:45:00" url="https://booking.cineworld.co.uk/booking/8102/59547" audioType="audio described"/>
                    <show time="2019-05-27T17:00:00" url="https://booking.cineworld.co.uk/booking/8102/59548" audioType="audio described"/>
                    <show time="2019-05-28T10:15:00" url="https://booking.cineworld.co.uk/booking/8102/59557" audioType="audio described"/>
                    <show time="2019-05-28T12:30:00" url="https://booking.cineworld.co.uk/booking/8102/59558" audioType="audio described"/>
                    <show time="2019-05-28T14:45:00" url="https://booking.cineworld.co.uk/booking/8102/59559" audioType="audio described"/>
                    <show time="2019-05-28T17:00:00" url="https://booking.cineworld.co.uk/booking/8102/59560" audioType="audio described"/>
                </shows>
            </film>
            <film title="Tolkien" rating="12A" url="films/tolkien" edi="271425" release="03/05/2019">
                <shows>
                    <show time="2019-05-06T12:10:00" url="https://booking.cineworld.co.uk/booking/8102/61077" audioType="audio described"/>
                    <show time="2019-05-06T15:00:00" url="https://booking.cineworld.co.uk/booking/8102/61078" audioType="audio described"/>
                    <show time="2019-05-06T17:40:00" url="https://booking.cineworld.co.uk/booking/8102/61079" audioType="audio described"/>
                    <show time="2019-05-06T20:20:00" url="https://booking.cineworld.co.uk/booking/8102/61080" audioType="audio described"/>
                    <show time="2019-05-07T13:00:00" url="https://booking.cineworld.co.uk/booking/8102/61149" audioType="audio described"/>
                    <show time="2019-05-07T15:00:00" url="https://booking.cineworld.co.uk/booking/8102/61060" audioType="audio described"/>
                    <show time="2019-05-07T17:40:00" url="https://booking.cineworld.co.uk/booking/8102/61061" audioType="audio described"/>
                    <show time="2019-05-07T20:20:00" url="https://booking.cineworld.co.uk/booking/8102/61062" audioType="audio described"/>
                    <show time="2019-05-08T13:00:00" url="https://booking.cineworld.co.uk/booking/8102/61150" audioType="audio described"/>
                    <show time="2019-05-08T15:00:00" url="https://booking.cineworld.co.uk/booking/8102/61063" audioType="audio described"/>
                    <show time="2019-05-08T17:40:00" url="https://booking.cineworld.co.uk/booking/8102/61064" audioType="audio described"/>
                    <show time="2019-05-08T20:20:00" url="https://booking.cineworld.co.uk/booking/8102/61065" audioType="audio described"/>
                    <show time="2019-05-09T13:00:00" url="https://booking.cineworld.co.uk/booking/8102/61151" audioType="audio described"/>
                    <show time="2019-05-09T15:00:00" url="https://booking.cineworld.co.uk/booking/8102/61066" audioType="audio described"/>
                    <show time="2019-05-09T17:40:00" url="https://booking.cineworld.co.uk/booking/8102/61067" audioType="audio described"/>
                    <show time="2019-05-09T20:20:00" url="https://booking.cineworld.co.uk/booking/8102/61068" audioType="audio described"/>
                </shows>
            </film>
            <film title="Westlife : The Twenty Tour Live" rating="12A" url="films/westlife-the-twenty-tour-live-from-croke-park" edi="270186" release="06/07/2019">
                <shows>
                    <show time="2019-07-06T20:00:00" url="https://booking.cineworld.co.uk/booking/8102/60901"/>
                </shows>
            </film>
            <film title="(2D) Wonder Park" rating="PG" url="films/wonder-park" edi="194897" release="12/04/2019">
                <shows>
                    <show time="2019-05-06T10:00:00" url="https://booking.cineworld.co.uk/booking/8102/61055" audioType="audio described"/>
                    <show time="2019-05-06T13:00:00" url="https://booking.cineworld.co.uk/booking/8102/61031" audioType="audio described"/>
                </shows>
            </film>
            <film title="(IMAX 3-D) X-Men: Dark Phoenix" rating="TBC" url="films/x-men-dark-phoenix" edi="277442" release="05/06/2019">
                <shows>
                    <show time="2019-06-07T14:10:00" url="https://booking.cineworld.co.uk/booking/8102/60929" videoType="imax 3d"/>
                    <show time="2019-06-07T17:00:00" url="https://booking.cineworld.co.uk/booking/8102/60930" videoType="imax 3d"/>
                    <show time="2019-06-07T19:50:00" url="https://booking.cineworld.co.uk/booking/8102/60931" videoType="imax 3d"/>
                    <show time="2019-06-08T14:10:00" url="https://booking.cineworld.co.uk/booking/8102/60935" videoType="imax 3d"/>
                    <show time="2019-06-08T17:00:00" url="https://booking.cineworld.co.uk/booking/8102/60936" videoType="imax 3d"/>
                    <show time="2019-06-08T19:50:00" url="https://booking.cineworld.co.uk/booking/8102/60937" videoType="imax 3d"/>
                    <show time="2019-06-09T14:10:00" url="https://booking.cineworld.co.uk/booking/8102/60941" videoType="imax 3d"/>
                    <show time="2019-06-09T17:00:00" url="https://booking.cineworld.co.uk/booking/8102/60942" videoType="imax 3d"/>
                    <show time="2019-06-09T19:50:00" url="https://booking.cineworld.co.uk/booking/8102/60943" videoType="imax 3d"/>
                </shows>
            </film>
            <film title="X-Men: Dark Phoenix" rating="TBC" url="films/x-men-dark-phoenix" edi="220087" release="05/06/2019">
                <shows>
                    <show time="2019-06-07T15:10:00" url="https://booking.cineworld.co.uk/booking/8102/60932" audioType="audio described"/>
                    <show time="2019-06-07T18:00:00" url="https://booking.cineworld.co.uk/booking/8102/60933" audioType="audio described"/>
                    <show time="2019-06-07T20:50:00" url="https://booking.cineworld.co.uk/booking/8102/60934" audioType="audio described"/>
                    <show time="2019-06-08T15:10:00" url="https://booking.cineworld.co.uk/booking/8102/60938" audioType="audio described"/>
                    <show time="2019-06-08T18:00:00" url="https://booking.cineworld.co.uk/booking/8102/60939" audioType="audio described"/>
                    <show time="2019-06-08T20:50:00" url="https://booking.cineworld.co.uk/booking/8102/60940" audioType="audio described"/>
                    <show time="2019-06-09T15:10:00" url="https://booking.cineworld.co.uk/booking/8102/60944" audioType="audio described"/>
                    <show time="2019-06-09T18:00:00" url="https://booking.cineworld.co.uk/booking/8102/60945" audioType="audio described"/>
                    <show time="2019-06-09T20:50:00" url="https://booking.cineworld.co.uk/booking/8102/60946" audioType="audio described"/>
                </shows>
            </film>
        </listing>
    </cinema>
    <cinema name="Cineworld Boldon Tyne and Wear" root="http://www1.cineworld.co.uk/" url="cinemas/boldon-tyne-and-wear" id="67" phone="0871 200 2000" address="Boldon Leisure Park, Bolden Colliery, Tyne and Wear" postcode="NE35 9PB">
        <listing>
            <film title="A Dog's Journey" rating="PG" url="films/a-dogs-journey" edi="255103" release="03/05/2019">
                <shows>
                    <show time="2019-05-06T10:20:00" url="https://booking.cineworld.co.uk/booking/8029/134047" audioType="audio described"/>
                    <show time="2019-05-06T12:50:00" url="https://booking.cineworld.co.uk/booking/8029/134048" audioType="audio described"/>
                    <show time="2019-05-06T15:30:00" url="https://booking.cineworld.co.uk/booking/8029/134049" audioType="audio described"/>
                    <show time="2019-05-06T18:10:00" url="https://booking.cineworld.co.uk/booking/8029/134050" audioType="audio described"/>
                    <show time="2019-05-07T12:50:00" url="https://booking.cineworld.co.uk/booking/8029/134051"/>
                    <show time="2019-05-07T15:30:00" url="https://booking.cineworld.co.uk/booking/8029/134052"/>
                    <show time="2019-05-07T18:10:00" url="https://booking.cineworld.co.uk/booking/8029/134053"/>
                    <show time="2019-05-08T12:50:00" url="https://booking.cineworld.co.uk/booking/8029/134054" audioType="audio described"/>
                    <show time="2019-05-08T15:30:00" url="https://booking.cineworld.co.uk/booking/8029/134055" audioType="audio described"/>
                    <show time="2019-05-08T18:10:00" url="https://booking.cineworld.co.uk/booking/8029/134056" audioType="audio described"/>
                    <show time="2019-05-09T12:50:00" url="https://booking.cineworld.co.uk/booking/8029/134057" audioType="audio described"/>
                    <show time="2019-05-09T15:30:00" url="https://booking.cineworld.co.uk/booking/8029/134058" audioType="audio described"/>
                    <show time="2019-05-09T18:10:00" url="https://booking.cineworld.co.uk/booking/8029/134059" audioType="audio described"/>
                </shows>
            </film>
            <film title="Andre Rieu 2019 Maastricht Concert Shall We Dance?" rating="PG" url="films/andre-rieu-2019-maastricht-concert-shall-we-dance" edi="255443" release="27/07/2019">
                <shows>
                    <show time="2019-07-27T19:00:00" url="https://booking.cineworld.co.uk/booking/8029/129930"/>
                    <show time="2019-07-28T15:00:00" url="https://booking.cineworld.co.uk/booking/8029/129931"/>
                </shows>
            </film>
            <film title="(3D) Avengers: Endgame" rating="12A" url="films/avengers-endgame" edi="174256" release="25/04/2019">
                <shows>
                    <show time="2019-05-06T12:00:00" url="https://booking.cineworld.co.uk/booking/8029/133674" videoType="3d" audioType="audio described"/>
                    <show time="2019-05-06T16:00:00" url="https://booking.cineworld.co.uk/booking/8029/133675" videoType="3d" audioType="audio described"/>
                    <show time="2019-05-06T19:00:00" url="https://booking.cineworld.co.uk/booking/8029/133681" videoType="3d" audioType="audio described"/>
                    <show time="2019-05-06T20:00:00" url="https://booking.cineworld.co.uk/booking/8029/133676" videoType="3d" audioType="audio described"/>
                    <show time="2019-05-07T12:00:00" url="https://booking.cineworld.co.uk/booking/8029/133905" videoType="3d" audioType="audio described"/>
                    <show time="2019-05-07T16:00:00" url="https://booking.cineworld.co.uk/booking/8029/133906" videoType="3d" audioType="audio described"/>
                    <show time="2019-05-07T19:00:00" url="https://booking.cineworld.co.uk/booking/8029/133946" videoType="3d" audioType="audio described"/>
                    <show time="2019-05-07T20:00:00" url="https://booking.cineworld.co.uk/booking/8029/133907" videoType="3d" audioType="audio described"/>
                    <show time="2019-05-08T12:00:00" url="https://booking.cineworld.co.uk/booking/8029/134096" videoType="3d" audioType="audio described"/>
                    <show time="2019-05-08T16:00:00" url="https://booking.cineworld.co.uk/booking/8029/134097" videoType="3d" audioType="audio described"/>
                    <show time="2019-05-08T19:00:00" url="https://booking.cineworld.co.uk/booking/8029/133947" videoType="3d" audioType="audio described"/>
                    <show time="2019-05-09T12:00:00" url="https://booking.cineworld.co.uk/booking/8029/133908" videoType="3d" audioType="audio described"/>
                    <show time="2019-05-09T16:00:00" url="https://booking.cineworld.co.uk/booking/8029/133909" videoType="3d" audioType="audio described"/>
                    <show time="2019-05-09T19:00:00" url="https://booking.cineworld.co.uk/booking/8029/133948" videoType="3d" audioType="audio described"/>
                    <show time="2019-05-09T20:00:00" url="https://booking.cineworld.co.uk/booking/8029/133910" videoType="3d" audioType="audio described"/>
                </shows>
            </film>
            <film title="(2D) Avengers: Endgame" rating="12A" url="films/avengers-endgame" edi="169126" release="25/04/2019">
                <shows>
                    <show time="2019-05-06T10:10:00" url="https://booking.cineworld.co.uk/booking/8029/133687" audioType="audio described"/>
                    <show time="2019-05-06T11:10:00" url="https://booking.cineworld.co.uk/booking/8029/133696" audioType="audio described"/>
                    <show time="2019-05-06T12:30:00" url="https://booking.cineworld.co.uk/booking/8029/133711" audioType="audio described"/>
                    <show time="2019-05-06T13:40:00" url="https://booking.cineworld.co.uk/booking/8029/133703" audioType="audio described"/>
                    <show time="2019-05-06T14:20:00" url="https://booking.cineworld.co.uk/booking/8029/133688" audioType="audio described"/>
                    <show time="2019-05-06T15:10:00" url="https://booking.cineworld.co.uk/booking/8029/133697" audioType="audio described"/>
                    <show time="2019-05-06T16:30:00" url="https://booking.cineworld.co.uk/booking/8029/133712" audioType="audio described"/>
                    <show time="2019-05-06T18:00:00" url="https://booking.cineworld.co.uk/booking/8029/133704" audioType="audio described"/>
                    <show time="2019-05-06T18:30:00" url="https://booking.cineworld.co.uk/booking/8029/133689" audioType="audio described"/>
                    <show time="2019-05-06T19:20:00" url="https://booking.cineworld.co.uk/booking/8029/133698" audioType="audio described"/>
                    <show time="2019-05-06T19:40:00" url="https://booking.cineworld.co.uk/booking/8029/133678" audioType="audio described"/>
                    <show time="2019-05-06T20:30:00" url="https://booking.cineworld.co.uk/booking/8029/133713" audioType="audio described"/>
                    <show time="2019-05-07T11:10:00" url="https://booking.cineworld.co.uk/booking/8029/133972" audioType="audio described"/>
                    <show time="2019-05-07T12:30:00" url="https://booking.cineworld.co.uk/booking/8029/134090" audioType="audio described"/>
                    <show time="2019-05-07T13:40:00" url="https://booking.cineworld.co.uk/booking/8029/133984" audioType="audio described"/>
                    <show time="2019-05-07T14:20:00" url="https://booking.cineworld.co.uk/booking/8029/133960" audioType="audio described"/>
                    <show time="2019-05-07T15:10:00" url="https://booking.cineworld.co.uk/booking/8029/133973" audioType="audio described"/>
                    <show time="2019-05-07T16:30:00" url="https://booking.cineworld.co.uk/booking/8029/134091" audioType="audio described"/>
                    <show time="2019-05-07T18:00:00" url="https://booking.cineworld.co.uk/booking/8029/133985" audioType="audio described"/>
                    <show time="2019-05-07T18:30:00" url="https://booking.cineworld.co.uk/booking/8029/133961" audioType="audio described"/>
                    <show time="2019-05-07T19:20:00" url="https://booking.cineworld.co.uk/booking/8029/133974" audioType="audio described"/>
                    <show time="2019-05-07T19:40:00" url="https://booking.cineworld.co.uk/booking/8029/133878" audioType="audio described"/>
                    <show time="2019-05-07T20:30:00" url="https://booking.cineworld.co.uk/booking/8029/134092" audioType="audio described"/>
                    <show time="2019-05-08T11:10:00" url="https://booking.cineworld.co.uk/booking/8029/133975" audioType="audio described"/>
                    <show time="2019-05-08T12:30:00" url="https://booking.cineworld.co.uk/booking/8029/133902" audioType="audio described"/>
                    <show time="2019-05-08T13:40:00" url="https://booking.cineworld.co.uk/booking/8029/133986" audioType="audio described"/>
                    <show time="2019-05-08T14:20:00" url="https://booking.cineworld.co.uk/booking/8029/133962" audioType="audio described"/>
                    <show time="2019-05-08T15:10:00" url="https://booking.cineworld.co.uk/booking/8029/133976" audioType="audio described"/>
                    <show time="2019-05-08T16:30:00" url="https://booking.cineworld.co.uk/booking/8029/133903" audioType="audio described"/>
                    <show time="2019-05-08T18:00:00" url="https://booking.cineworld.co.uk/booking/8029/133987" audioType="audio described"/>
                    <show time="2019-05-08T18:30:00" url="https://booking.cineworld.co.uk/booking/8029/133963" audioType="audio described"/>
                    <show time="2019-05-08T19:30:00" url="https://booking.cineworld.co.uk/booking/8029/133977" audioType="audio described"/>
                    <show time="2019-05-08T20:00:00" url="https://booking.cineworld.co.uk/booking/8029/133879" audioType="audio described"/>
                    <show time="2019-05-08T20:30:00" url="https://booking.cineworld.co.uk/booking/8029/133904" audioType="audio described"/>
                    <show time="2019-05-09T11:10:00" url="https://booking.cineworld.co.uk/booking/8029/133978" audioType="audio described"/>
                    <show time="2019-05-09T12:30:00" url="https://booking.cineworld.co.uk/booking/8029/134093" audioType="audio described"/>
                    <show time="2019-05-09T13:40:00" url="https://booking.cineworld.co.uk/booking/8029/133988" audioType="audio described"/>
                    <show time="2019-05-09T14:20:00" url="https://booking.cineworld.co.uk/booking/8029/133967" audioType="audio described"/>
                    <show time="2019-05-09T15:10:00" url="https://booking.cineworld.co.uk/booking/8029/133979" audioType="audio described"/>
                    <show time="2019-05-09T16:30:00" url="https://booking.cineworld.co.uk/booking/8029/134094" audioType="audio described"/>
                    <show time="2019-05-09T18:00:00" url="https://booking.cineworld.co.uk/booking/8029/133989" audioType="audio described"/>
                    <show time="2019-05-09T18:30:00" url="https://booking.cineworld.co.uk/booking/8029/133968" audioType="audio described"/>
                    <show time="2019-05-09T19:20:00" url="https://booking.cineworld.co.uk/booking/8029/133980" audioType="audio described"/>
                    <show time="2019-05-09T19:40:00" url="https://booking.cineworld.co.uk/booking/8029/133880" audioType="audio described"/>
                    <show time="2019-05-09T20:30:00" url="https://booking.cineworld.co.uk/booking/8029/134095" audioType="audio described"/>
                </shows>
            </film>
            <film title="Beats : Unlimited Screening" rating="18" url="films/beats-unlimited-screening" edi="801824" release="08/05/2019">
                <shows>
                    <show time="2019-05-08T20:00:00" url="https://booking.cineworld.co.uk/booking/8029/133650" audioType="audio described"/>
                </shows>
            </film>
            <film title="Booksmart: Unlimited Screening" rating="15" url="films/booksmart-unlimited-screening" edi="801833" release="06/05/2019">
                <shows>
                    <show time="2019-05-06T19:45:00" url="https://booking.cineworld.co.uk/booking/8029/133848"/>
                </shows>
            </film>
            <film title="(2D) Captain Marvel" rating="12A" url="films/captain-marvel" edi="169122" release="08/03/2019">
                <shows>
                    <show time="2019-05-06T13:50:00" url="https://booking.cineworld.co.uk/booking/8029/133884" audioType="audio described"/>
                    <show time="2019-05-07T11:20:00" url="https://booking.cineworld.co.uk/booking/8029/133971" audioType="audio described"/>
                    <show time="2019-05-07T16:40:00" url="https://booking.cineworld.co.uk/booking/8029/133885" audioType="audio described"/>
                    <show time="2019-05-08T11:20:00" url="https://booking.cineworld.co.uk/booking/8029/133970" audioType="audio described"/>
                    <show time="2019-05-08T16:40:00" url="https://booking.cineworld.co.uk/booking/8029/133886" audioType="audio described"/>
                    <show time="2019-05-09T11:20:00" url="https://booking.cineworld.co.uk/booking/8029/133969" audioType="audio described"/>
                    <show time="2019-05-09T16:40:00" url="https://booking.cineworld.co.uk/booking/8029/133887" audioType="audio described"/>
                </shows>
            </film>
            <film title="Dr Strangelove (Or How I Learned To Stop...) [GCF]" rating="PG" url="films/dr-strangelove-or-how-i-learned-to-stop-worrying-and-love-the-bomb" edi="445976" release="20/05/2019">
                <shows>
                    <show time="2019-05-20T20:00:00" url="https://booking.cineworld.co.uk/booking/8029/134107"/>
                </shows>
            </film>
            <film title="Dumbo" rating="PG" url="films/dumbo" edi="192491" release="29/03/2019">
                <shows>
                    <show time="2019-05-06T10:50:00" url="https://booking.cineworld.co.uk/booking/8029/133964" audioType="audio described"/>
                    <show time="2019-05-06T13:30:00" url="https://booking.cineworld.co.uk/booking/8029/133965" audioType="audio described"/>
                    <show time="2019-05-06T16:10:00" url="https://booking.cineworld.co.uk/booking/8029/133966" audioType="audio described"/>
                    <show time="2019-05-07T16:10:00" url="https://booking.cineworld.co.uk/booking/8029/133950" audioType="audio described"/>
                    <show time="2019-05-08T16:10:00" url="https://booking.cineworld.co.uk/booking/8029/133951" audioType="audio described"/>
                    <show time="2019-05-09T16:10:00" url="https://booking.cineworld.co.uk/booking/8029/133953" audioType="audio described"/>
                </shows>
            </film>
            <film title="Everybody's Talking About Jamie Encore" rating="12A" url="films/everybodys-talking-about-jamie-encore" edi="249936" release="13/06/2019">
                <shows>
                    <show time="2019-06-13T19:00:00" url="https://booking.cineworld.co.uk/booking/8029/133317"/>
                </shows>
            </film>
            <film title="Greta" rating="15" url="films/greta" edi="245161" release="18/04/2019">
                <shows>
                    <show time="2019-05-07T14:10:00" url="https://booking.cineworld.co.uk/booking/8029/133894" audioType="audio described"/>
                    <show time="2019-05-08T14:10:00" url="https://booking.cineworld.co.uk/booking/8029/133895" audioType="audio described"/>
                    <show time="2019-05-09T14:10:00" url="https://booking.cineworld.co.uk/booking/8029/133896" audioType="audio described"/>
                </shows>
            </film>
            <film title="Liam Gallagher: As It Was + Live Performance" rating="TBC" url="films/liam-gallagher-as-it-was-live-performance" edi="274849" release="06/06/2019">
                <shows>
                    <show time="2019-06-06T19:30:00" url="https://booking.cineworld.co.uk/booking/8029/134121"/>
                </shows>
            </film>
            <film title="Long Shot" rating="15" url="films/long-shot" edi="240058" release="03/05/2019">
                <shows>
                    <show time="2019-05-06T11:10:00" url="https://booking.cineworld.co.uk/booking/8029/134061"/>
                    <show time="2019-05-06T14:10:00" url="https://booking.cineworld.co.uk/booking/8029/134062"/>
                    <show time="2019-05-06T17:00:00" url="https://booking.cineworld.co.uk/booking/8029/134063" audioType="audio described" subtitled="true"/>
                    <show time="2019-05-06T20:50:00" url="https://booking.cineworld.co.uk/booking/8029/134103" audioType="audio described"/>
                    <show time="2019-05-07T11:20:00" url="https://booking.cineworld.co.uk/booking/8029/133925" audioType="audio described"/>
                    <show time="2019-05-07T14:10:00" url="https://booking.cineworld.co.uk/booking/8029/133926" audioType="audio described"/>
                    <show time="2019-05-07T17:00:00" url="https://booking.cineworld.co.uk/booking/8029/133927" audioType="audio described"/>
                    <show time="2019-05-07T19:50:00" url="https://booking.cineworld.co.uk/booking/8029/133928" audioType="audio described"/>
                    <show time="2019-05-08T11:20:00" url="https://booking.cineworld.co.uk/booking/8029/133929" audioType="audio described"/>
                    <show time="2019-05-08T14:10:00" url="https://booking.cineworld.co.uk/booking/8029/133930" audioType="audio described"/>
                    <show time="2019-05-08T17:00:00" url="https://booking.cineworld.co.uk/booking/8029/133931" audioType="audio described"/>
                    <show time="2019-05-08T19:50:00" url="https://booking.cineworld.co.uk/booking/8029/133932" audioType="audio described"/>
                    <show time="2019-05-09T11:20:00" url="https://booking.cineworld.co.uk/booking/8029/133933" audioType="audio described"/>
                    <show time="2019-05-09T14:10:00" url="https://booking.cineworld.co.uk/booking/8029/133934" audioType="audio described"/>
                    <show time="2019-05-09T17:00:00" url="https://booking.cineworld.co.uk/booking/8029/133935" audioType="audio described"/>
                    <show time="2019-05-09T19:50:00" url="https://booking.cineworld.co.uk/booking/8029/133936" audioType="audio described"/>
                    <show time="2019-05-09T20:50:00" url="https://booking.cineworld.co.uk/booking/8029/134060" audioType="audio described"/>
                </shows>
            </film>
            <film title="Margaret Atwood : Live In Cinemas" rating="12A" url="films/margaret-atwood-live-in-cinemas" edi="272858" release="10/09/2019">
                <shows>
                    <show time="2019-09-10T19:30:00" url="https://booking.cineworld.co.uk/booking/8029/131912"/>
                </shows>
            </film>
            <film title="MET Opera 2019 Dialogues Des Carmelites" rating="12A" url="films/met-opera-2019-dialogues-des-carmelites" edi="249481" release="11/05/2019">
                <shows>
                    <show time="2019-05-11T17:00:00" url="https://booking.cineworld.co.uk/booking/8029/123347"/>
                </shows>
            </film>
            <film title="Missing Link" rating="PG" url="films/missing-link" edi="258465" release="05/04/2019">
                <shows>
                    <show time="2019-05-06T11:10:00" url="https://booking.cineworld.co.uk/booking/8029/133993" audioType="audio described"/>
                </shows>
            </film>
            <film title="NT Live: All My Sons" rating="12A" url="films/nt-live-all-my-sons" edi="263592" release="14/05/2019">
                <shows>
                    <show time="2019-05-14T19:00:00" url="https://booking.cineworld.co.uk/booking/8029/127480"/>
                </shows>
            </film>
            <film title="NT Live : One Man, Two Guvnors (Encore)" rating="12A" url="films/nt-live-one-man-two-guvnors-encore" edi="266343" release="26/09/2019">
                <shows>
                    <show time="2019-09-26T19:00:00" url="https://booking.cineworld.co.uk/booking/8029/133322"/>
                </shows>
            </film>
            <film title="NT Live : Small Island" rating="12A" url="films/nt-live-small-island" edi="270872" release="27/06/2019">
                <shows>
                    <show time="2019-06-27T19:00:00" url="https://booking.cineworld.co.uk/booking/8029/129913"/>
                </shows>
            </film>
            <film title="NT Live : The Lehman Trilogy" rating="12A" url="films/nt-live-the-lehman-trilogy" edi="266345" release="25/07/2019">
                <shows>
                    <show time="2019-07-25T19:00:00" url="https://booking.cineworld.co.uk/booking/8029/133321"/>
                </shows>
            </film>
            <film title="Pavarotti plus Q&amp;A" rating="TBC" url="films/pavarotti-plus-qa" edi="801820" release="13/07/2019">
                <shows>
                    <show time="2019-07-13T19:00:00" url="https://booking.cineworld.co.uk/booking/8029/134102"/>
                </shows>
            </film>
            <film title="Paw Patrol: Mighty Pups - The Movie" rating="TBC" url="films/paw-patrol-mighty-pups" edi="261550" release="17/05/2019">
                <shows>
                    <show time="2019-05-17T16:00:00" url="https://booking.cineworld.co.uk/booking/8029/133327" audioType="audio described"/>
                    <show time="2019-05-18T10:30:00" url="https://booking.cineworld.co.uk/booking/8029/133328" audioType="audio described"/>
                    <show time="2019-05-18T12:20:00" url="https://booking.cineworld.co.uk/booking/8029/133329" audioType="audio described"/>
                    <show time="2019-05-18T14:10:00" url="https://booking.cineworld.co.uk/booking/8029/133330" audioType="audio described"/>
                    <show time="2019-05-18T16:00:00" url="https://booking.cineworld.co.uk/booking/8029/133331" audioType="audio described"/>
                    <show time="2019-05-19T10:30:00" url="https://booking.cineworld.co.uk/booking/8029/133332" audioType="audio described"/>
                    <show time="2019-05-19T12:20:00" url="https://booking.cineworld.co.uk/booking/8029/133333" audioType="audio described"/>
                    <show time="2019-05-19T14:10:00" url="https://booking.cineworld.co.uk/booking/8029/133334" audioType="audio described"/>
                    <show time="2019-05-19T16:00:00" url="https://booking.cineworld.co.uk/booking/8029/133335" audioType="audio described"/>
                </shows>
            </film>
            <film title="Peppa Pig: Festival Of Fun" rating="U" url="films/peppa-pig-festival-of-fun" edi="256539" release="05/04/2019">
                <shows>
                    <show time="2019-05-06T10:00:00" url="https://booking.cineworld.co.uk/booking/8029/133911" audioType="audio described"/>
                </shows>
            </film>
            <film title="Pet Sematary" rating="15" url="films/pet-sematary" edi="245615" release="05/04/2019">
                <shows>
                    <show time="2019-05-07T11:40:00" url="https://booking.cineworld.co.uk/booking/8029/133899" audioType="audio described"/>
                    <show time="2019-05-08T11:40:00" url="https://booking.cineworld.co.uk/booking/8029/133900" audioType="audio described"/>
                    <show time="2019-05-09T11:40:00" url="https://booking.cineworld.co.uk/booking/8029/133901" audioType="audio described"/>
                </shows>
            </film>
            <film title="(2D) Detective Pikachu" rating="PG" url="films/pokemon-detective-pikachu" edi="244991" release="10/05/2019">
                <shows>
                    <show time="2019-05-10T12:30:00" url="https://booking.cineworld.co.uk/booking/8029/134109" audioType="audio described"/>
                    <show time="2019-05-10T15:00:00" url="https://booking.cineworld.co.uk/booking/8029/134110" audioType="audio described"/>
                    <show time="2019-05-10T17:30:00" url="https://booking.cineworld.co.uk/booking/8029/134111" audioType="audio described"/>
                    <show time="2019-05-10T20:00:00" url="https://booking.cineworld.co.uk/booking/8029/134112" audioType="audio described"/>
                    <show time="2019-05-11T12:30:00" url="https://booking.cineworld.co.uk/booking/8029/134113" audioType="audio described"/>
                    <show time="2019-05-11T15:00:00" url="https://booking.cineworld.co.uk/booking/8029/134114" audioType="audio described"/>
                    <show time="2019-05-11T17:30:00" url="https://booking.cineworld.co.uk/booking/8029/134115" audioType="audio described"/>
                    <show time="2019-05-11T20:00:00" url="https://booking.cineworld.co.uk/booking/8029/134116" audioType="audio described"/>
                    <show time="2019-05-12T12:30:00" url="https://booking.cineworld.co.uk/booking/8029/134117" audioType="audio described"/>
                    <show time="2019-05-12T15:00:00" url="https://booking.cineworld.co.uk/booking/8029/134118" audioType="audio described"/>
                    <show time="2019-05-12T17:30:00" url="https://booking.cineworld.co.uk/booking/8029/134119" audioType="audio described"/>
                    <show time="2019-05-12T20:00:00" url="https://booking.cineworld.co.uk/booking/8029/134120" audioType="audio described"/>
                </shows>
            </film>
            <film title="Red Joan" rating="12A" url="films/red-joan" edi="251781" release="19/04/2019">
                <shows>
                    <show time="2019-05-07T11:00:00" url="https://booking.cineworld.co.uk/booking/8029/134104" audioType="audio described"/>
                    <show time="2019-05-08T11:00:00" url="https://booking.cineworld.co.uk/booking/8029/134105" audioType="audio described"/>
                    <show time="2019-05-09T11:00:00" url="https://booking.cineworld.co.uk/booking/8029/134106" audioType="audio described"/>
                </shows>
            </film>
            <film title="ROH Royal Ballet Live 2019 Romeo And Juliet" rating="12A" url="films/roh-royal-ballet-live-2019-romeo-and-juliet" edi="252213" release="11/06/2019">
                <shows>
                    <show time="2019-06-11T19:15:00" url="https://booking.cineworld.co.uk/booking/8029/116060"/>
                </shows>
            </film>
            <film title="ROH Royal Ballet Live 2019 Triple Bill" rating="12A" url="films/roh-royal-ballet-live-2019-triple-bill" edi="252209" release="16/05/2019">
                <shows>
                    <show time="2019-05-16T19:15:00" url="https://booking.cineworld.co.uk/booking/8029/116059"/>
                </shows>
            </film>
            <film title="RSC Live : Measure For Measure" rating="12A" url="films/rsc-live-measure-for-measure" edi="263087" release="31/07/2019">
                <shows>
                    <show time="2019-07-31T19:00:00" url="https://booking.cineworld.co.uk/booking/8029/125553"/>
                </shows>
            </film>
            <film title="RSC Live : The Taming Of The Shrew" rating="12A" url="films/rsc-live-the-taming-of-the-shrew" edi="263085" release="05/06/2019">
                <shows>
                    <show time="2019-06-05T19:00:00" url="https://booking.cineworld.co.uk/booking/8029/125552"/>
                </shows>
            </film>
            <film title="Saving Private Ryan (D-Day 75th Anniversary)" rating="15" url="films/saving-private-ryan-d-day-75th-anniversary" edi="275478" release="06/06/2019">
                <shows>
                    <show time="2019-06-06T19:30:00" url="https://booking.cineworld.co.uk/booking/8029/134108" audioType="audio described"/>
                </shows>
            </film>
            <film title="(2D) Shazam!" rating="12A" url="films/shazam" edi="169941" release="05/04/2019">
                <shows>
                    <show time="2019-05-06T16:40:00" url="https://booking.cineworld.co.uk/booking/8029/133888" audioType="audio described"/>
                    <show time="2019-05-07T13:10:00" url="https://booking.cineworld.co.uk/booking/8029/133943" audioType="audio described"/>
                    <show time="2019-05-07T20:50:00" url="https://booking.cineworld.co.uk/booking/8029/134034"/>
                    <show time="2019-05-08T13:10:00" url="https://booking.cineworld.co.uk/booking/8029/133944" audioType="audio described"/>
                    <show time="2019-05-08T20:50:00" url="https://booking.cineworld.co.uk/booking/8029/134035" audioType="audio described"/>
                    <show time="2019-05-09T13:10:00" url="https://booking.cineworld.co.uk/booking/8029/133945" audioType="audio described"/>
                </shows>
            </film>
            <film title="M4J Spider-Man: Into The Spider-Verse" rating="PG" url="films/spider-man-into-the-spider-verse-movies-for-juniors" edi="801735" release="15/02/2019">
                <shows>
                    <show time="2019-05-06T10:00:00" url="https://booking.cineworld.co.uk/booking/8029/134100" audioType="audio described"/>
                </shows>
            </film>
            <film title="Take That - Greatest Hits Live" rating="12A" url="films/take-that-greatest-hits-live" edi="270195" release="08/06/2019">
                <shows>
                    <show time="2019-06-08T20:00:00" url="https://booking.cineworld.co.uk/booking/8029/131937"/>
                </shows>
            </film>
            <film title="The Curse Of La Llorona" rating="15" url="films/the-curse-of-la-llorona" edi="250922" release="03/05/2019">
                <shows>
                    <show time="2019-05-06T11:30:00" url="https://booking.cineworld.co.uk/booking/8029/133994" audioType="audio described"/>
                    <show time="2019-05-06T11:30:00" url="https://booking.cineworld.co.uk/booking/8029/133994" audioType="audio described" sessionType="dbox"/>
                    <show time="2019-05-06T13:50:00" url="https://booking.cineworld.co.uk/booking/8029/133995" audioType="audio described"/>
                    <show time="2019-05-06T13:50:00" url="https://booking.cineworld.co.uk/booking/8029/133995" audioType="audio described" sessionType="dbox"/>
                    <show time="2019-05-06T16:20:00" url="https://booking.cineworld.co.uk/booking/8029/133996" audioType="audio described"/>
                    <show time="2019-05-06T16:20:00" url="https://booking.cineworld.co.uk/booking/8029/133996" audioType="audio described" sessionType="dbox"/>
                    <show time="2019-05-06T18:40:00" url="https://booking.cineworld.co.uk/booking/8029/133997" audioType="audio described"/>
                    <show time="2019-05-06T18:40:00" url="https://booking.cineworld.co.uk/booking/8029/133997" audioType="audio described" sessionType="dbox"/>
                    <show time="2019-05-06T21:00:00" url="https://booking.cineworld.co.uk/booking/8029/133998" audioType="audio described"/>
                    <show time="2019-05-06T21:00:00" url="https://booking.cineworld.co.uk/booking/8029/133998" audioType="audio described" sessionType="dbox"/>
                    <show time="2019-05-07T11:30:00" url="https://booking.cineworld.co.uk/booking/8029/134014" audioType="audio described"/>
                    <show time="2019-05-07T11:30:00" url="https://booking.cineworld.co.uk/booking/8029/134014" audioType="audio described" sessionType="dbox"/>
                    <show time="2019-05-07T13:50:00" url="https://booking.cineworld.co.uk/booking/8029/134015" audioType="audio described"/>
                    <show time="2019-05-07T13:50:00" url="https://booking.cineworld.co.uk/booking/8029/134015" audioType="audio described" sessionType="dbox"/>
                    <show time="2019-05-07T16:20:00" url="https://booking.cineworld.co.uk/booking/8029/134016" audioType="audio described"/>
                    <show time="2019-05-07T16:20:00" url="https://booking.cineworld.co.uk/booking/8029/134016" audioType="audio described" sessionType="dbox"/>
                    <show time="2019-05-07T18:40:00" url="https://booking.cineworld.co.uk/booking/8029/134017" audioType="audio described"/>
                    <show time="2019-05-07T18:40:00" url="https://booking.cineworld.co.uk/booking/8029/134017" audioType="audio described" sessionType="dbox"/>
                    <show time="2019-05-07T21:00:00" url="https://booking.cineworld.co.uk/booking/8029/134018" audioType="audio described"/>
                    <show time="2019-05-07T21:00:00" url="https://booking.cineworld.co.uk/booking/8029/134018" audioType="audio described" sessionType="dbox"/>
                    <show time="2019-05-08T11:30:00" url="https://booking.cineworld.co.uk/booking/8029/134019" audioType="audio described"/>
                    <show time="2019-05-08T11:30:00" url="https://booking.cineworld.co.uk/booking/8029/134019" audioType="audio described" sessionType="dbox"/>
                    <show time="2019-05-08T13:50:00" url="https://booking.cineworld.co.uk/booking/8029/134020" audioType="audio described"/>
                    <show time="2019-05-08T13:50:00" url="https://booking.cineworld.co.uk/booking/8029/134020" audioType="audio described" sessionType="dbox"/>
                    <show time="2019-05-08T16:20:00" url="https://booking.cineworld.co.uk/booking/8029/134021" audioType="audio described"/>
                    <show time="2019-05-08T16:20:00" url="https://booking.cineworld.co.uk/booking/8029/134021" audioType="audio described" sessionType="dbox"/>
                    <show time="2019-05-08T18:40:00" url="https://booking.cineworld.co.uk/booking/8029/134022" audioType="audio described"/>
                    <show time="2019-05-08T18:40:00" url="https://booking.cineworld.co.uk/booking/8029/134022" audioType="audio described" sessionType="dbox"/>
                    <show time="2019-05-08T21:00:00" url="https://booking.cineworld.co.uk/booking/8029/134023" audioType="audio described"/>
                    <show time="2019-05-08T21:00:00" url="https://booking.cineworld.co.uk/booking/8029/134023" audioType="audio described" sessionType="dbox"/>
                    <show time="2019-05-09T11:30:00" url="https://booking.cineworld.co.uk/booking/8029/134024" audioType="audio described"/>
                    <show time="2019-05-09T11:30:00" url="https://booking.cineworld.co.uk/booking/8029/134024" audioType="audio described" sessionType="dbox"/>
                    <show time="2019-05-09T13:50:00" url="https://booking.cineworld.co.uk/booking/8029/134025" audioType="audio described"/>
                    <show time="2019-05-09T13:50:00" url="https://booking.cineworld.co.uk/booking/8029/134025" audioType="audio described" sessionType="dbox"/>
                    <show time="2019-05-09T16:20:00" url="https://booking.cineworld.co.uk/booking/8029/134026" audioType="audio described"/>
                    <show time="2019-05-09T16:20:00" url="https://booking.cineworld.co.uk/booking/8029/134026" audioType="audio described" sessionType="dbox"/>
                    <show time="2019-05-09T18:40:00" url="https://booking.cineworld.co.uk/booking/8029/134027" audioType="audio described"/>
                    <show time="2019-05-09T18:40:00" url="https://booking.cineworld.co.uk/booking/8029/134027" audioType="audio described" sessionType="dbox"/>
                    <show time="2019-05-09T21:00:00" url="https://booking.cineworld.co.uk/booking/8029/134028" audioType="audio described"/>
                    <show time="2019-05-09T21:00:00" url="https://booking.cineworld.co.uk/booking/8029/134028" audioType="audio described" sessionType="dbox"/>
                </shows>
            </film>
            <film title="The Merry Wives Of Windsor Live from Shakespeare G" rating="12A" url="films/the-merry-wives-of-windsor-live-from-shakespeares-globe" edi="268829" release="20/06/2019">
                <shows>
                    <show time="2019-06-20T19:20:00" url="https://booking.cineworld.co.uk/booking/8029/130260"/>
                </shows>
            </film>
            <film title="The Secret Life Of Pets 2" rating="U" url="films/the-secret-life-of-pets-2" edi="192838" release="24/05/2019">
                <shows>
                    <show time="2019-05-24T10:00:00" url="https://booking.cineworld.co.uk/booking/8029/132450" audioType="audio described"/>
                    <show time="2019-05-24T12:15:00" url="https://booking.cineworld.co.uk/booking/8029/132451" audioType="audio described"/>
                    <show time="2019-05-24T14:30:00" url="https://booking.cineworld.co.uk/booking/8029/132452" audioType="audio described"/>
                    <show time="2019-05-24T16:45:00" url="https://booking.cineworld.co.uk/booking/8029/132453" audioType="audio described"/>
                    <show time="2019-05-25T10:00:00" url="https://booking.cineworld.co.uk/booking/8029/132454" audioType="audio described"/>
                    <show time="2019-05-25T12:15:00" url="https://booking.cineworld.co.uk/booking/8029/132455" audioType="audio described"/>
                    <show time="2019-05-25T14:30:00" url="https://booking.cineworld.co.uk/booking/8029/132456" audioType="audio described"/>
                    <show time="2019-05-25T16:45:00" url="https://booking.cineworld.co.uk/booking/8029/132457" audioType="audio described"/>
                    <show time="2019-05-26T10:00:00" url="https://booking.cineworld.co.uk/booking/8029/132458" audioType="audio described"/>
                    <show time="2019-05-26T12:15:00" url="https://booking.cineworld.co.uk/booking/8029/132459" audioType="audio described"/>
                    <show time="2019-05-26T14:30:00" url="https://booking.cineworld.co.uk/booking/8029/132460" audioType="audio described"/>
                    <show time="2019-05-26T16:45:00" url="https://booking.cineworld.co.uk/booking/8029/132461" audioType="audio described"/>
                    <show time="2019-05-27T10:00:00" url="https://booking.cineworld.co.uk/booking/8029/132462" audioType="audio described"/>
                    <show time="2019-05-27T12:15:00" url="https://booking.cineworld.co.uk/booking/8029/132463" audioType="audio described"/>
                    <show time="2019-05-27T14:30:00" url="https://booking.cineworld.co.uk/booking/8029/132464" audioType="audio described"/>
                    <show time="2019-05-27T16:45:00" url="https://booking.cineworld.co.uk/booking/8029/132465" audioType="audio described"/>
                    <show time="2019-05-28T10:00:00" url="https://booking.cineworld.co.uk/booking/8029/132466" audioType="audio described"/>
                    <show time="2019-05-28T12:15:00" url="https://booking.cineworld.co.uk/booking/8029/132467" audioType="audio described"/>
                    <show time="2019-05-28T14:30:00" url="https://booking.cineworld.co.uk/booking/8029/132468" audioType="audio described"/>
                    <show time="2019-05-28T16:45:00" url="https://booking.cineworld.co.uk/booking/8029/132469" audioType="audio described"/>
                    <show time="2019-06-02T11:00:00" url="https://booking.cineworld.co.uk/booking/8029/134122" audioType="audio described"/>
                </shows>
            </film>
            <film title="Tolkien" rating="12A" url="films/tolkien" edi="271425" release="03/05/2019">
                <shows>
                    <show time="2019-05-06T12:20:00" url="https://booking.cineworld.co.uk/booking/8029/133937" audioType="audio described"/>
                    <show time="2019-05-06T15:00:00" url="https://booking.cineworld.co.uk/booking/8029/133938" audioType="audio described"/>
                    <show time="2019-05-06T17:40:00" url="https://booking.cineworld.co.uk/booking/8029/133939" audioType="audio described"/>
                    <show time="2019-05-06T20:20:00" url="https://booking.cineworld.co.uk/booking/8029/133940" audioType="audio described"/>
                    <show time="2019-05-07T11:20:00" url="https://booking.cineworld.co.uk/booking/8029/134078"/>
                    <show time="2019-05-07T14:00:00" url="https://booking.cineworld.co.uk/booking/8029/134079"/>
                    <show time="2019-05-07T16:40:00" url="https://booking.cineworld.co.uk/booking/8029/134080"/>
                    <show time="2019-05-07T19:20:00" url="https://booking.cineworld.co.uk/booking/8029/134081"/>
                    <show time="2019-05-08T12:20:00" url="https://booking.cineworld.co.uk/booking/8029/134082"/>
                    <show time="2019-05-08T15:00:00" url="https://booking.cineworld.co.uk/booking/8029/134083"/>
                    <show time="2019-05-08T17:40:00" url="https://booking.cineworld.co.uk/booking/8029/134084"/>
                    <show time="2019-05-08T20:20:00" url="https://booking.cineworld.co.uk/booking/8029/134085"/>
                    <show time="2019-05-09T12:20:00" url="https://booking.cineworld.co.uk/booking/8029/134086"/>
                    <show time="2019-05-09T15:00:00" url="https://booking.cineworld.co.uk/booking/8029/134087"/>
                    <show time="2019-05-09T17:40:00" url="https://booking.cineworld.co.uk/booking/8029/134088"/>
                    <show time="2019-05-09T20:20:00" url="https://booking.cineworld.co.uk/booking/8029/134089"/>
                </shows>
            </film>
            <film title="Victoria - Northern Ballet" rating="PG" url="films/victoria-northern-ballet" edi="270190" release="25/06/2019">
                <shows>
                    <show time="2019-06-25T19:30:00" url="https://booking.cineworld.co.uk/booking/8029/129910"/>
                </shows>
            </film>
            <film title="Westlife : The Twenty Tour Live" rating="12A" url="films/westlife-the-twenty-tour-live-from-croke-park" edi="270186" release="06/07/2019">
                <shows>
                    <show time="2019-07-06T20:00:00" url="https://booking.cineworld.co.uk/booking/8029/133323"/>
                </shows>
            </film>
            <film title="(2D) Wonder Park" rating="PG" url="films/wonder-park" edi="194897" release="12/04/2019">
                <shows>
                    <show time="2019-05-06T10:10:00" url="https://booking.cineworld.co.uk/booking/8029/133912" audioType="audio described"/>
                    <show time="2019-05-06T11:40:00" url="https://booking.cineworld.co.uk/booking/8029/133889" audioType="audio described"/>
                </shows>
            </film>
            <film title="(3D) X-Men: Dark Phoenix" rating="TBC" url="films/x-men-dark-phoenix" edi="246006" release="05/06/2019">
                <shows>
                    <show time="2019-06-05T20:00:00" url="https://booking.cineworld.co.uk/booking/8029/133854" videoType="3d" audioType="audio described"/>
                    <show time="2019-06-06T20:00:00" url="https://booking.cineworld.co.uk/booking/8029/133871" videoType="3d" audioType="audio described"/>
                    <show time="2019-06-07T20:00:00" url="https://booking.cineworld.co.uk/booking/8029/133872" videoType="3d" audioType="audio described"/>
                    <show time="2019-06-08T20:00:00" url="https://booking.cineworld.co.uk/booking/8029/133873" videoType="3d" audioType="audio described"/>
                    <show time="2019-06-09T20:00:00" url="https://booking.cineworld.co.uk/booking/8029/133874" videoType="3d" audioType="audio described"/>
                </shows>
            </film>
            <film title="X-Men: Dark Phoenix" rating="TBC" url="films/x-men-dark-phoenix" edi="220087" release="05/06/2019">
                <shows>
                    <show time="2019-06-05T12:30:00" url="https://booking.cineworld.co.uk/booking/8029/133850" audioType="audio described"/>
                    <show time="2019-06-05T15:20:00" url="https://booking.cineworld.co.uk/booking/8029/133851" audioType="audio described"/>
                    <show time="2019-06-05T18:10:00" url="https://booking.cineworld.co.uk/booking/8029/133852" audioType="audio described"/>
                    <show time="2019-06-05T21:00:00" url="https://booking.cineworld.co.uk/booking/8029/133853" audioType="audio described"/>
                    <show time="2019-06-06T12:30:00" url="https://booking.cineworld.co.uk/booking/8029/133855" audioType="audio described"/>
                    <show time="2019-06-06T15:20:00" url="https://booking.cineworld.co.uk/booking/8029/133856" audioType="audio described"/>
                    <show time="2019-06-06T18:10:00" url="https://booking.cineworld.co.uk/booking/8029/133857" audioType="audio described"/>
                    <show time="2019-06-06T21:00:00" url="https://booking.cineworld.co.uk/booking/8029/133858" audioType="audio described"/>
                    <show time="2019-06-07T12:30:00" url="https://booking.cineworld.co.uk/booking/8029/133859" audioType="audio described"/>
                    <show time="2019-06-07T15:20:00" url="https://booking.cineworld.co.uk/booking/8029/133860" audioType="audio described"/>
                    <show time="2019-06-07T18:10:00" url="https://booking.cineworld.co.uk/booking/8029/133861" audioType="audio described"/>
                    <show time="2019-06-07T21:00:00" url="https://booking.cineworld.co.uk/booking/8029/133862" audioType="audio described"/>
                    <show time="2019-06-08T12:30:00" url="https://booking.cineworld.co.uk/booking/8029/133863" audioType="audio described"/>
                    <show time="2019-06-08T15:20:00" url="https://booking.cineworld.co.uk/booking/8029/133864" audioType="audio described"/>
                    <show time="2019-06-08T18:10:00" url="https://booking.cineworld.co.uk/booking/8029/133865" audioType="audio described"/>
                    <show time="2019-06-08T21:00:00" url="https://booking.cineworld.co.uk/booking/8029/133866" audioType="audio described"/>
                    <show time="2019-06-09T12:30:00" url="https://booking.cineworld.co.uk/booking/8029/133867" audioType="audio described"/>
                    <show time="2019-06-09T15:20:00" url="https://booking.cineworld.co.uk/booking/8029/133868" audioType="audio described"/>
                    <show time="2019-06-09T18:10:00" url="https://booking.cineworld.co.uk/booking/8029/133869" audioType="audio described"/>
                    <show time="2019-06-09T21:00:00" url="https://booking.cineworld.co.uk/booking/8029/133870" audioType="audio described"/>
                </shows>
            </film>
        </listing>
    </cinema>
    <cinema name="Cineworld Bolton" root="http://www1.cineworld.co.uk/" url="cinemas/bolton" id="72" phone="0871 200 2000" address="The Valley, 15 Eagley Brook Way, Bolton" postcode="BL1 8TS">
        <listing>
            <film title="A Dog's Journey" rating="PG" url="films/a-dogs-journey" edi="255103" release="03/05/2019">
                <shows>
                    <show time="2019-05-06T11:10:00" url="https://booking.cineworld.co.uk/booking/8023/167163" audioType="audio described"/>
                    <show time="2019-05-06T13:50:00" url="https://booking.cineworld.co.uk/booking/8023/167111" audioType="audio described"/>
                    <show time="2019-05-06T16:30:00" url="https://booking.cineworld.co.uk/booking/8023/167112" audioType="audio described"/>
                    <show time="2019-05-06T19:10:00" url="https://booking.cineworld.co.uk/booking/8023/167113" audioType="audio described"/>
                    <show time="2019-05-07T13:50:00" url="https://booking.cineworld.co.uk/booking/8023/167114" audioType="audio described"/>
                    <show time="2019-05-07T16:30:00" url="https://booking.cineworld.co.uk/booking/8023/167115" audioType="audio described"/>
                    <show time="2019-05-07T19:10:00" url="https://booking.cineworld.co.uk/booking/8023/167116" audioType="audio described"/>
                    <show time="2019-05-08T13:50:00" url="https://booking.cineworld.co.uk/booking/8023/167117" audioType="audio described"/>
                    <show time="2019-05-08T16:30:00" url="https://booking.cineworld.co.uk/booking/8023/167118" audioType="audio described"/>
                    <show time="2019-05-08T19:10:00" url="https://booking.cineworld.co.uk/booking/8023/167119" audioType="audio described"/>
                    <show time="2019-05-09T13:50:00" url="https://booking.cineworld.co.uk/booking/8023/167129" audioType="audio described"/>
                    <show time="2019-05-09T16:30:00" url="https://booking.cineworld.co.uk/booking/8023/167130" audioType="audio described"/>
                    <show time="2019-05-09T19:10:00" url="https://booking.cineworld.co.uk/booking/8023/167131" audioType="audio described"/>
                </shows>
            </film>
            <film title="Andre Rieu 2019 Maastricht Concert Shall We Dance?" rating="PG" url="films/andre-rieu-2019-maastricht-concert-shall-we-dance" edi="255443" release="27/07/2019">
                <shows>
                    <show time="2019-07-27T19:00:00" url="https://booking.cineworld.co.uk/booking/8023/162012"/>
                    <show time="2019-07-28T15:00:00" url="https://booking.cineworld.co.uk/booking/8023/162013"/>
                </shows>
            </film>
            <film title="Autism Friendly Screening: Secret Life Of Pets 2" rating="U" url="films/autism-friendly-screening-secret-life-of-pets-2" edi="801857" release="02/06/2019">
                <shows>
                    <show time="2019-06-02T11:00:00" url="https://booking.cineworld.co.uk/booking/8023/167406" audioType="audio described"/>
                </shows>
            </film>
            <film title="(3D) Avengers: Endgame" rating="12A" url="films/avengers-endgame" edi="174256" release="25/04/2019">
                <shows>
                    <show time="2019-05-06T12:00:00" url="https://booking.cineworld.co.uk/booking/8023/166825" videoType="3d" audioType="audio described"/>
                    <show time="2019-05-06T16:00:00" url="https://booking.cineworld.co.uk/booking/8023/166823" videoType="3d" audioType="audio described"/>
                    <show time="2019-05-06T19:00:00" url="https://booking.cineworld.co.uk/booking/8023/166822" videoType="3d" audioType="audio described"/>
                    <show time="2019-05-06T20:00:00" url="https://booking.cineworld.co.uk/booking/8023/166824" videoType="3d" audioType="audio described"/>
                    <show time="2019-05-07T16:00:00" url="https://booking.cineworld.co.uk/booking/8023/167264" videoType="3d" audioType="audio described"/>
                    <show time="2019-05-07T19:00:00" url="https://booking.cineworld.co.uk/booking/8023/167225" videoType="3d" audioType="audio described"/>
                    <show time="2019-05-07T20:00:00" url="https://booking.cineworld.co.uk/booking/8023/167265" videoType="3d" audioType="audio described"/>
                    <show time="2019-05-08T16:00:00" url="https://booking.cineworld.co.uk/booking/8023/167266" videoType="3d" audioType="audio described"/>
                    <show time="2019-05-08T19:00:00" url="https://booking.cineworld.co.uk/booking/8023/167226" videoType="3d" audioType="audio described"/>
                    <show time="2019-05-08T20:00:00" url="https://booking.cineworld.co.uk/booking/8023/167267" videoType="3d" audioType="audio described"/>
                    <show time="2019-05-09T16:00:00" url="https://booking.cineworld.co.uk/booking/8023/167268" videoType="3d" audioType="audio described"/>
                    <show time="2019-05-09T19:00:00" url="https://booking.cineworld.co.uk/booking/8023/167227" videoType="3d" audioType="audio described"/>
                    <show time="2019-05-09T20:00:00" url="https://booking.cineworld.co.uk/booking/8023/167269" videoType="3d" audioType="audio described"/>
                </shows>
            </film>
            <film title="(2D) Avengers: Endgame" rating="12A" url="films/avengers-endgame" edi="169126" release="25/04/2019">
                <shows>
                    <show time="2019-05-06T10:10:00" url="https://booking.cineworld.co.uk/booking/8023/166821" audioType="audio described"/>
                    <show time="2019-05-06T11:10:00" url="https://booking.cineworld.co.uk/booking/8023/166815" audioType="audio described"/>
                    <show time="2019-05-06T12:30:00" url="https://booking.cineworld.co.uk/booking/8023/166818" audioType="audio described"/>
                    <show time="2019-05-06T13:40:00" url="https://booking.cineworld.co.uk/booking/8023/166810" audioType="audio described"/>
                    <show time="2019-05-06T14:20:00" url="https://booking.cineworld.co.uk/booking/8023/166819" audioType="audio described"/>
                    <show time="2019-05-06T15:10:00" url="https://booking.cineworld.co.uk/booking/8023/166813" audioType="audio described"/>
                    <show time="2019-05-06T16:30:00" url="https://booking.cineworld.co.uk/booking/8023/166816" audioType="audio described"/>
                    <show time="2019-05-06T18:00:00" url="https://booking.cineworld.co.uk/booking/8023/166811" audioType="audio described"/>
                    <show time="2019-05-06T18:30:00" url="https://booking.cineworld.co.uk/booking/8023/166820" audioType="audio described"/>
                    <show time="2019-05-06T19:20:00" url="https://booking.cineworld.co.uk/booking/8023/166814" audioType="audio described"/>
                    <show time="2019-05-06T19:40:00" url="https://booking.cineworld.co.uk/booking/8023/166812" audioType="audio described"/>
                    <show time="2019-05-06T20:30:00" url="https://booking.cineworld.co.uk/booking/8023/166817" audioType="audio described"/>
                    <show time="2019-05-07T13:40:00" url="https://booking.cineworld.co.uk/booking/8023/167167" audioType="audio described"/>
                    <show time="2019-05-07T14:20:00" url="https://booking.cineworld.co.uk/booking/8023/167215" audioType="audio described"/>
                    <show time="2019-05-07T15:10:00" url="https://booking.cineworld.co.uk/booking/8023/167197" audioType="audio described"/>
                    <show time="2019-05-07T16:30:00" url="https://booking.cineworld.co.uk/booking/8023/167203" audioType="audio described"/>
                    <show time="2019-05-07T18:00:00" url="https://booking.cineworld.co.uk/booking/8023/167168" audioType="audio described" subtitled="true"/>
                    <show time="2019-05-07T18:30:00" url="https://booking.cineworld.co.uk/booking/8023/167216" audioType="audio described"/>
                    <show time="2019-05-07T19:20:00" url="https://booking.cineworld.co.uk/booking/8023/167198" audioType="audio described"/>
                    <show time="2019-05-07T19:40:00" url="https://booking.cineworld.co.uk/booking/8023/167177" audioType="audio described"/>
                    <show time="2019-05-07T20:30:00" url="https://booking.cineworld.co.uk/booking/8023/167204" audioType="audio described"/>
                    <show time="2019-05-08T13:40:00" url="https://booking.cineworld.co.uk/booking/8023/167147" audioType="audio described"/>
                    <show time="2019-05-08T14:20:00" url="https://booking.cineworld.co.uk/booking/8023/167217" audioType="audio described"/>
                    <show time="2019-05-08T15:10:00" url="https://booking.cineworld.co.uk/booking/8023/167199" audioType="audio described"/>
                    <show time="2019-05-08T16:30:00" url="https://booking.cineworld.co.uk/booking/8023/167169" audioType="audio described"/>
                    <show time="2019-05-08T18:00:00" url="https://booking.cineworld.co.uk/booking/8023/167148" audioType="audio described"/>
                    <show time="2019-05-08T18:30:00" url="https://booking.cineworld.co.uk/booking/8023/167218" audioType="audio described"/>
                    <show time="2019-05-08T19:20:00" url="https://booking.cineworld.co.uk/booking/8023/167200" audioType="audio described"/>
                    <show time="2019-05-08T19:40:00" url="https://booking.cineworld.co.uk/booking/8023/167178" audioType="audio described"/>
                    <show time="2019-05-08T20:30:00" url="https://booking.cineworld.co.uk/booking/8023/167170" audioType="audio described"/>
                    <show time="2019-05-09T13:40:00" url="https://booking.cineworld.co.uk/booking/8023/167171" audioType="audio described"/>
                    <show time="2019-05-09T14:20:00" url="https://booking.cineworld.co.uk/booking/8023/167219" audioType="audio described"/>
                    <show time="2019-05-09T15:10:00" url="https://booking.cineworld.co.uk/booking/8023/167201" audioType="audio described"/>
                    <show time="2019-05-09T16:30:00" url="https://booking.cineworld.co.uk/booking/8023/167205" audioType="audio described"/>
                    <show time="2019-05-09T18:00:00" url="https://booking.cineworld.co.uk/booking/8023/167172" audioType="audio described"/>
                    <show time="2019-05-09T18:30:00" url="https://booking.cineworld.co.uk/booking/8023/167220" audioType="audio described"/>
                    <show time="2019-05-09T19:20:00" url="https://booking.cineworld.co.uk/booking/8023/167202" audioType="audio described"/>
                    <show time="2019-05-09T19:40:00" url="https://booking.cineworld.co.uk/booking/8023/167179" audioType="audio described"/>
                    <show time="2019-05-09T20:30:00" url="https://booking.cineworld.co.uk/booking/8023/167206" audioType="audio described"/>
                </shows>
            </film>
            <film title="Beats : Unlimited Screening" rating="18" url="films/beats-unlimited-screening" edi="801824" release="08/05/2019">
                <shows>
                    <show time="2019-05-08T20:00:00" url="https://booking.cineworld.co.uk/booking/8023/166826" audioType="audio described"/>
                </shows>
            </film>
            <film title="Bolshoi Ballet 2019 : Carmen Suite / Petrushka" rating="12A" url="films/bolshoi-ballet-2019-carmen-suite-petrushka" edi="251616" release="19/05/2019">
                <shows>
                    <show time="2019-05-19T16:00:00" url="https://booking.cineworld.co.uk/booking/8023/144673"/>
                </shows>
            </film>
            <film title="Booksmart: Unlimited Screening" rating="15" url="films/booksmart-unlimited-screening" edi="801833" release="06/05/2019">
                <shows>
                    <show time="2019-05-06T19:45:00" url="https://booking.cineworld.co.uk/booking/8023/167065" audioType="audio described"/>
                </shows>
            </film>
            <film title="(2D) Captain Marvel" rating="12A" url="films/captain-marvel" edi="169122" release="08/03/2019">
                <shows>
                    <show time="2019-05-06T14:15:00" url="https://booking.cineworld.co.uk/booking/8023/167187" audioType="audio described"/>
                    <show time="2019-05-07T13:45:00" url="https://booking.cineworld.co.uk/booking/8023/167188" audioType="audio described"/>
                    <show time="2019-05-07T16:45:00" url="https://booking.cineworld.co.uk/booking/8023/167189" audioType="audio described"/>
                    <show time="2019-05-08T13:45:00" url="https://booking.cineworld.co.uk/booking/8023/167190" audioType="audio described"/>
                    <show time="2019-05-08T16:45:00" url="https://booking.cineworld.co.uk/booking/8023/167191" audioType="audio described"/>
                    <show time="2019-05-09T13:45:00" url="https://booking.cineworld.co.uk/booking/8023/167192" audioType="audio described"/>
                    <show time="2019-05-09T16:45:00" url="https://booking.cineworld.co.uk/booking/8023/167193" audioType="audio described"/>
                </shows>
            </film>
            <film title="Dr Strangelove (Or How I Learned To Stop...) [GCF]" rating="PG" url="films/dr-strangelove-or-how-i-learned-to-stop-worrying-and-love-the-bomb" edi="445976" release="20/05/2019">
                <shows>
                    <show time="2019-05-20T20:00:00" url="https://booking.cineworld.co.uk/booking/8023/167371"/>
                </shows>
            </film>
            <film title="Dumbo" rating="PG" url="films/dumbo" edi="192491" release="29/03/2019">
                <shows>
                    <show time="2019-05-06T10:20:00" url="https://booking.cineworld.co.uk/booking/8023/167146" audioType="audio described"/>
                    <show time="2019-05-06T12:10:00" url="https://booking.cineworld.co.uk/booking/8023/167296" audioType="audio described"/>
                    <show time="2019-05-06T13:30:00" url="https://booking.cineworld.co.uk/booking/8023/167233" audioType="audio described"/>
                    <show time="2019-05-06T14:50:00" url="https://booking.cineworld.co.uk/booking/8023/167297" audioType="audio described"/>
                    <show time="2019-05-06T16:10:00" url="https://booking.cineworld.co.uk/booking/8023/167234" audioType="audio described"/>
                    <show time="2019-05-06T17:30:00" url="https://booking.cineworld.co.uk/booking/8023/167298" audioType="audio described"/>
                    <show time="2019-05-07T14:50:00" url="https://booking.cineworld.co.uk/booking/8023/167099" audioType="audio described"/>
                    <show time="2019-05-07T16:10:00" url="https://booking.cineworld.co.uk/booking/8023/167235" audioType="audio described"/>
                    <show time="2019-05-07T17:30:00" url="https://booking.cineworld.co.uk/booking/8023/167100" audioType="audio described"/>
                    <show time="2019-05-08T14:40:00" url="https://booking.cineworld.co.uk/booking/8023/167207" audioType="audio described"/>
                    <show time="2019-05-08T16:10:00" url="https://booking.cineworld.co.uk/booking/8023/167236" audioType="audio described"/>
                    <show time="2019-05-08T17:20:00" url="https://booking.cineworld.co.uk/booking/8023/167208" audioType="audio described"/>
                    <show time="2019-05-09T14:50:00" url="https://booking.cineworld.co.uk/booking/8023/167102" audioType="audio described"/>
                    <show time="2019-05-09T16:10:00" url="https://booking.cineworld.co.uk/booking/8023/167348" audioType="audio described"/>
                    <show time="2019-05-09T17:30:00" url="https://booking.cineworld.co.uk/booking/8023/167103" audioType="audio described"/>
                </shows>
            </film>
            <film title="Glyndebourne 2019 : Cinderella (Cendrillon)" rating="12A" url="films/glyndebourne-2019-cinderella-cendrillon-live" edi="273307" release="30/06/2019">
                <shows>
                    <show time="2019-06-30T17:30:00" url="https://booking.cineworld.co.uk/booking/8023/164870"/>
                </shows>
            </film>
            <film title="Glyndebourne 2019: The Barber Of Seville (Il barbi" rating="12A" url="films/glyndebourne-2019-the-barber-of-seville-il-barbiere-di-siviglia-recorded" edi="273300" release="14/07/2019">
                <shows>
                    <show time="2019-07-14T17:30:00" url="https://booking.cineworld.co.uk/booking/8023/164871"/>
                </shows>
            </film>
            <film title="Glyndebourne 2019: The Magic Flute (Die Zauberflt" rating="12A" url="films/glyndebourne-2019-the-magic-flute-die-zauberflte-live" edi="273310" release="04/08/2019">
                <shows>
                    <show time="2019-08-04T17:30:00" url="https://booking.cineworld.co.uk/booking/8023/164872"/>
                </shows>
            </film>
            <film title="Greta" rating="15" url="films/greta" edi="245161" release="18/04/2019">
                <shows>
                    <show time="2019-05-06T11:40:00" url="https://booking.cineworld.co.uk/booking/8023/167275" audioType="audio described"/>
                    <show time="2019-05-06T17:15:00" url="https://booking.cineworld.co.uk/booking/8023/167196" audioType="audio described"/>
                    <show time="2019-05-07T14:00:00" url="https://booking.cineworld.co.uk/booking/8023/167210" audioType="audio described"/>
                    <show time="2019-05-08T14:00:00" url="https://booking.cineworld.co.uk/booking/8023/167176" audioType="audio described"/>
                    <show time="2019-05-09T14:00:00" url="https://booking.cineworld.co.uk/booking/8023/167211" audioType="audio described"/>
                </shows>
            </film>
            <film title="M4J How To Train Your Dragon: The Hidden World" rating="PG" url="films/how-to-train-your-dragon-the-hidden-world-movies-for-juniors" edi="801822" release="01/02/2019">
                <shows>
                    <show time="2019-05-06T10:00:00" url="https://booking.cineworld.co.uk/booking/8023/167214" audioType="audio described"/>
                </shows>
            </film>
            <film title="Liam Gallagher: As It Was + Live Performance" rating="TBC" url="films/liam-gallagher-as-it-was-live-performance" edi="274849" release="06/06/2019">
                <shows>
                    <show time="2019-06-06T19:30:00" url="https://booking.cineworld.co.uk/booking/8023/167405"/>
                </shows>
            </film>
            <film title="Long Shot" rating="15" url="films/long-shot" edi="240058" release="03/05/2019">
                <shows>
                    <show time="2019-05-06T12:10:00" url="https://booking.cineworld.co.uk/booking/8023/167334" audioType="audio described"/>
                    <show time="2019-05-06T15:00:00" url="https://booking.cineworld.co.uk/booking/8023/167335" audioType="audio described"/>
                    <show time="2019-05-06T17:50:00" url="https://booking.cineworld.co.uk/booking/8023/167336" audioType="audio described" subtitled="true"/>
                    <show time="2019-05-06T19:30:00" url="https://booking.cineworld.co.uk/booking/8023/167086" audioType="audio described"/>
                    <show time="2019-05-06T20:40:00" url="https://booking.cineworld.co.uk/booking/8023/167337" audioType="audio described"/>
                    <show time="2019-05-07T13:10:00" url="https://booking.cineworld.co.uk/booking/8023/167271" audioType="audio described"/>
                    <show time="2019-05-07T15:00:00" url="https://booking.cineworld.co.uk/booking/8023/167285" audioType="audio described"/>
                    <show time="2019-05-07T17:50:00" url="https://booking.cineworld.co.uk/booking/8023/167286" audioType="audio described"/>
                    <show time="2019-05-07T19:30:00" url="https://booking.cineworld.co.uk/booking/8023/167089" audioType="audio described"/>
                    <show time="2019-05-07T20:40:00" url="https://booking.cineworld.co.uk/booking/8023/167287" audioType="audio described"/>
                    <show time="2019-05-08T13:10:00" url="https://booking.cineworld.co.uk/booking/8023/167272" audioType="audio described"/>
                    <show time="2019-05-08T15:00:00" url="https://booking.cineworld.co.uk/booking/8023/167288" audioType="audio described"/>
                    <show time="2019-05-08T17:50:00" url="https://booking.cineworld.co.uk/booking/8023/167289" audioType="audio described"/>
                    <show time="2019-05-08T19:30:00" url="https://booking.cineworld.co.uk/booking/8023/167092" audioType="audio described"/>
                    <show time="2019-05-08T20:40:00" url="https://booking.cineworld.co.uk/booking/8023/167290" audioType="audio described"/>
                    <show time="2019-05-09T13:10:00" url="https://booking.cineworld.co.uk/booking/8023/167273" audioType="audio described"/>
                    <show time="2019-05-09T15:00:00" url="https://booking.cineworld.co.uk/booking/8023/167291" audioType="audio described"/>
                    <show time="2019-05-09T17:50:00" url="https://booking.cineworld.co.uk/booking/8023/167292" audioType="audio described"/>
                    <show time="2019-05-09T19:30:00" url="https://booking.cineworld.co.uk/booking/8023/167095" audioType="audio described"/>
                    <show time="2019-05-09T20:40:00" url="https://booking.cineworld.co.uk/booking/8023/167293" audioType="audio described"/>
                </shows>
            </film>
            <film title="Margaret Atwood : Live In Cinemas" rating="12A" url="films/margaret-atwood-live-in-cinemas" edi="272858" release="10/09/2019">
                <shows>
                    <show time="2019-09-10T19:30:00" url="https://booking.cineworld.co.uk/booking/8023/164500"/>
                </shows>
            </film>
            <film title="Matthew Bourne's Swan Lake (2019)" rating="PG" url="films/matthew-bournes-swan-lake" edi="269440" release="21/05/2019">
                <shows>
                    <show time="2019-05-21T15:45:00" url="https://booking.cineworld.co.uk/booking/8023/162391"/>
                    <show time="2019-05-21T18:30:00" url="https://booking.cineworld.co.uk/booking/8023/162392"/>
                </shows>
            </film>
            <film title="MET Opera 2019 Dialogues Des Carmelites" rating="12A" url="films/met-opera-2019-dialogues-des-carmelites" edi="249481" release="11/05/2019">
                <shows>
                    <show time="2019-05-11T17:00:00" url="https://booking.cineworld.co.uk/booking/8023/153782"/>
                </shows>
            </film>
            <film title="NT Live: All My Sons" rating="12A" url="films/nt-live-all-my-sons" edi="263592" release="14/05/2019">
                <shows>
                    <show time="2019-05-14T19:00:00" url="https://booking.cineworld.co.uk/booking/8023/159274"/>
                </shows>
            </film>
            <film title="NT Live : One Man, Two Guvnors (Encore)" rating="12A" url="films/nt-live-one-man-two-guvnors-encore" edi="266343" release="26/09/2019">
                <shows>
                    <show time="2019-09-26T19:00:00" url="https://booking.cineworld.co.uk/booking/8023/166363"/>
                </shows>
            </film>
            <film title="NT Live : Small Island" rating="12A" url="films/nt-live-small-island" edi="270872" release="27/06/2019">
                <shows>
                    <show time="2019-06-27T19:00:00" url="https://booking.cineworld.co.uk/booking/8023/161992"/>
                </shows>
            </film>
            <film title="NT Live : The Lehman Trilogy" rating="12A" url="films/nt-live-the-lehman-trilogy" edi="266345" release="25/07/2019">
                <shows>
                    <show time="2019-07-25T19:00:00" url="https://booking.cineworld.co.uk/booking/8023/166362"/>
                </shows>
            </film>
            <film title="Pavarotti plus Q&amp;A" rating="TBC" url="films/pavarotti-plus-qa" edi="801820" release="13/07/2019">
                <shows>
                    <show time="2019-07-13T19:00:00" url="https://booking.cineworld.co.uk/booking/8023/167370"/>
                </shows>
            </film>
            <film title="Paw Patrol: Mighty Pups - The Movie" rating="TBC" url="films/paw-patrol-mighty-pups" edi="261550" release="17/05/2019">
                <shows>
                    <show time="2019-05-17T16:00:00" url="https://booking.cineworld.co.uk/booking/8023/166365" audioType="audio described"/>
                    <show time="2019-05-18T10:30:00" url="https://booking.cineworld.co.uk/booking/8023/166366" audioType="audio described"/>
                    <show time="2019-05-18T12:20:00" url="https://booking.cineworld.co.uk/booking/8023/166367" audioType="audio described"/>
                    <show time="2019-05-18T14:10:00" url="https://booking.cineworld.co.uk/booking/8023/166368" audioType="audio described"/>
                    <show time="2019-05-18T16:00:00" url="https://booking.cineworld.co.uk/booking/8023/166369" audioType="audio described"/>
                    <show time="2019-05-19T10:30:00" url="https://booking.cineworld.co.uk/booking/8023/166370" audioType="audio described"/>
                    <show time="2019-05-19T12:20:00" url="https://booking.cineworld.co.uk/booking/8023/166371" audioType="audio described"/>
                    <show time="2019-05-19T14:10:00" url="https://booking.cineworld.co.uk/booking/8023/166372" audioType="audio described"/>
                    <show time="2019-05-19T16:00:00" url="https://booking.cineworld.co.uk/booking/8023/166373" audioType="audio described"/>
                </shows>
            </film>
            <film title="(3D) Detective Pikachu" rating="PG" url="films/pokemon-detective-pikachu" edi="245036" release="10/05/2019">
                <shows>
                    <show time="2019-05-10T13:20:00" url="https://booking.cineworld.co.uk/booking/8023/167378" videoType="3d" audioType="audio described"/>
                    <show time="2019-05-10T15:50:00" url="https://booking.cineworld.co.uk/booking/8023/167379" videoType="3d" audioType="audio described"/>
                    <show time="2019-05-10T18:20:00" url="https://booking.cineworld.co.uk/booking/8023/167380" videoType="3d" audioType="audio described"/>
                    <show time="2019-05-11T10:50:00" url="https://booking.cineworld.co.uk/booking/8023/167387" videoType="3d" audioType="audio described"/>
                    <show time="2019-05-11T13:20:00" url="https://booking.cineworld.co.uk/booking/8023/167381" videoType="3d" audioType="audio described"/>
                    <show time="2019-05-11T15:50:00" url="https://booking.cineworld.co.uk/booking/8023/167382" videoType="3d" audioType="audio described"/>
                    <show time="2019-05-11T18:20:00" url="https://booking.cineworld.co.uk/booking/8023/167383" videoType="3d" audioType="audio described"/>
                    <show time="2019-05-12T10:50:00" url="https://booking.cineworld.co.uk/booking/8023/167401" videoType="3d" audioType="audio described"/>
                    <show time="2019-05-12T13:20:00" url="https://booking.cineworld.co.uk/booking/8023/167402" videoType="3d" audioType="audio described"/>
                    <show time="2019-05-12T15:50:00" url="https://booking.cineworld.co.uk/booking/8023/167403" videoType="3d" audioType="audio described"/>
                    <show time="2019-05-12T18:20:00" url="https://booking.cineworld.co.uk/booking/8023/167404" videoType="3d" audioType="audio described"/>
                </shows>
            </film>
            <film title="(2D) Detective Pikachu" rating="PG" url="films/pokemon-detective-pikachu" edi="244991" release="10/05/2019">
                <shows>
                    <show time="2019-05-10T14:10:00" url="https://booking.cineworld.co.uk/booking/8023/167376" audioType="audio described"/>
                    <show time="2019-05-10T15:10:00" url="https://booking.cineworld.co.uk/booking/8023/167373" audioType="audio described"/>
                    <show time="2019-05-10T16:40:00" url="https://booking.cineworld.co.uk/booking/8023/167377" audioType="audio described"/>
                    <show time="2019-05-10T17:40:00" url="https://booking.cineworld.co.uk/booking/8023/167374" audioType="audio described"/>
                    <show time="2019-05-10T20:10:00" url="https://booking.cineworld.co.uk/booking/8023/167375" audioType="audio described"/>
                    <show time="2019-05-11T10:10:00" url="https://booking.cineworld.co.uk/booking/8023/167388" audioType="audio described"/>
                    <show time="2019-05-11T11:40:00" url="https://booking.cineworld.co.uk/booking/8023/167384" audioType="audio described"/>
                    <show time="2019-05-11T12:40:00" url="https://booking.cineworld.co.uk/booking/8023/167389" audioType="audio described"/>
                    <show time="2019-05-11T14:10:00" url="https://booking.cineworld.co.uk/booking/8023/167385" audioType="audio described"/>
                    <show time="2019-05-11T15:10:00" url="https://booking.cineworld.co.uk/booking/8023/167390" audioType="audio described"/>
                    <show time="2019-05-11T16:40:00" url="https://booking.cineworld.co.uk/booking/8023/167386" audioType="audio described"/>
                    <show time="2019-05-11T17:40:00" url="https://booking.cineworld.co.uk/booking/8023/167391" audioType="audio described"/>
                    <show time="2019-05-11T20:10:00" url="https://booking.cineworld.co.uk/booking/8023/167392" audioType="audio described"/>
                    <show time="2019-05-12T10:10:00" url="https://booking.cineworld.co.uk/booking/8023/167396" audioType="audio described"/>
                    <show time="2019-05-12T11:40:00" url="https://booking.cineworld.co.uk/booking/8023/167393" audioType="audio described"/>
                    <show time="2019-05-12T12:40:00" url="https://booking.cineworld.co.uk/booking/8023/167397" audioType="audio described"/>
                    <show time="2019-05-12T14:10:00" url="https://booking.cineworld.co.uk/booking/8023/167394" audioType="audio described"/>
                    <show time="2019-05-12T15:10:00" url="https://booking.cineworld.co.uk/booking/8023/167398" audioType="audio described"/>
                    <show time="2019-05-12T16:40:00" url="https://booking.cineworld.co.uk/booking/8023/167395" audioType="audio described"/>
                    <show time="2019-05-12T17:40:00" url="https://booking.cineworld.co.uk/booking/8023/167399" audioType="audio described"/>
                    <show time="2019-05-12T20:10:00" url="https://booking.cineworld.co.uk/booking/8023/167400" audioType="audio described"/>
                </shows>
            </film>
            <film title="Red Joan" rating="12A" url="films/red-joan" edi="251781" release="19/04/2019">
                <shows>
                    <show time="2019-05-06T14:20:00" url="https://booking.cineworld.co.uk/booking/8023/167132" audioType="audio described"/>
                    <show time="2019-05-06T17:15:00" url="https://booking.cineworld.co.uk/booking/8023/167294" audioType="audio described"/>
                    <show time="2019-05-06T20:10:00" url="https://booking.cineworld.co.uk/booking/8023/167299" audioType="audio described"/>
                    <show time="2019-05-07T14:20:00" url="https://booking.cineworld.co.uk/booking/8023/167120" audioType="audio described"/>
                    <show time="2019-05-07T17:50:00" url="https://booking.cineworld.co.uk/booking/8023/167344" audioType="audio described"/>
                    <show time="2019-05-07T20:10:00" url="https://booking.cineworld.co.uk/booking/8023/167101" audioType="audio described"/>
                    <show time="2019-05-08T14:20:00" url="https://booking.cineworld.co.uk/booking/8023/167123" audioType="audio described"/>
                    <show time="2019-05-08T17:50:00" url="https://booking.cineworld.co.uk/booking/8023/167345" audioType="audio described"/>
                    <show time="2019-05-08T20:20:00" url="https://booking.cineworld.co.uk/booking/8023/167346" audioType="audio described"/>
                    <show time="2019-05-09T14:20:00" url="https://booking.cineworld.co.uk/booking/8023/167126" audioType="audio described"/>
                    <show time="2019-05-09T17:50:00" url="https://booking.cineworld.co.uk/booking/8023/167347" audioType="audio described"/>
                    <show time="2019-05-09T20:10:00" url="https://booking.cineworld.co.uk/booking/8023/167104" audioType="audio described"/>
                </shows>
            </film>
            <film title="ROH Royal Ballet Live 2019 Romeo And Juliet" rating="12A" url="films/roh-royal-ballet-live-2019-romeo-and-juliet" edi="252213" release="11/06/2019">
                <shows>
                    <show time="2019-06-11T19:15:00" url="https://booking.cineworld.co.uk/booking/8023/144684"/>
                </shows>
            </film>
            <film title="ROH Royal Ballet Live 2019 Triple Bill" rating="12A" url="films/roh-royal-ballet-live-2019-triple-bill" edi="252209" release="16/05/2019">
                <shows>
                    <show time="2019-05-16T19:15:00" url="https://booking.cineworld.co.uk/booking/8023/144683"/>
                </shows>
            </film>
            <film title="RSC Live : Measure For Measure" rating="12A" url="films/rsc-live-measure-for-measure" edi="263087" release="31/07/2019">
                <shows>
                    <show time="2019-07-31T19:00:00" url="https://booking.cineworld.co.uk/booking/8023/156384"/>
                </shows>
            </film>
            <film title="RSC Live : The Taming Of The Shrew" rating="12A" url="films/rsc-live-the-taming-of-the-shrew" edi="263085" release="05/06/2019">
                <shows>
                    <show time="2019-06-05T19:00:00" url="https://booking.cineworld.co.uk/booking/8023/156383"/>
                </shows>
            </film>
            <film title="Saving Private Ryan (D-Day 75th Anniversary)" rating="15" url="films/saving-private-ryan-d-day-75th-anniversary" edi="275478" release="06/06/2019">
                <shows>
                    <show time="2019-06-06T19:30:00" url="https://booking.cineworld.co.uk/booking/8023/167372" audioType="audio described"/>
                </shows>
            </film>
            <film title="(2D) Shazam!" rating="12A" url="films/shazam" edi="169941" release="05/04/2019">
                <shows>
                    <show time="2019-05-06T11:20:00" url="https://booking.cineworld.co.uk/booking/8023/167166" audioType="audio described"/>
                    <show time="2019-05-06T14:10:00" url="https://booking.cineworld.co.uk/booking/8023/167274" audioType="audio described"/>
                    <show time="2019-05-06T16:50:00" url="https://booking.cineworld.co.uk/booking/8023/167133" audioType="audio described"/>
                    <show time="2019-05-07T13:00:00" url="https://booking.cineworld.co.uk/booking/8023/167222" audioType="audio described"/>
                    <show time="2019-05-07T14:50:00" url="https://booking.cineworld.co.uk/booking/8023/167327" audioType="audio described"/>
                    <show time="2019-05-07T16:50:00" url="https://booking.cineworld.co.uk/booking/8023/167121" audioType="audio described"/>
                    <show time="2019-05-07T20:20:00" url="https://booking.cineworld.co.uk/booking/8023/167328" audioType="audio described"/>
                    <show time="2019-05-08T13:00:00" url="https://booking.cineworld.co.uk/booking/8023/167223" audioType="audio described"/>
                    <show time="2019-05-08T14:50:00" url="https://booking.cineworld.co.uk/booking/8023/167329" audioType="audio described"/>
                    <show time="2019-05-08T16:50:00" url="https://booking.cineworld.co.uk/booking/8023/167124" audioType="audio described"/>
                    <show time="2019-05-09T13:00:00" url="https://booking.cineworld.co.uk/booking/8023/167224" audioType="audio described"/>
                    <show time="2019-05-09T14:50:00" url="https://booking.cineworld.co.uk/booking/8023/167330" audioType="audio described"/>
                    <show time="2019-05-09T16:50:00" url="https://booking.cineworld.co.uk/booking/8023/167127" audioType="audio described"/>
                    <show time="2019-05-09T20:20:00" url="https://booking.cineworld.co.uk/booking/8023/167331" audioType="audio described"/>
                </shows>
            </film>
            <film title="M4J Spider-Man: Into The Spider-Verse" rating="PG" url="films/spider-man-into-the-spider-verse-movies-for-juniors" edi="801735" release="15/02/2019">
                <shows>
                    <show time="2019-05-06T10:20:00" url="https://booking.cineworld.co.uk/booking/8023/167239" audioType="audio described"/>
                </shows>
            </film>
            <film title="SubM4J Spider-Man: Into The Spider-Verse" rating="PG" url="films/spider-man-into-the-spider-verse-subtitled-movies-for-juniors" edi="801736" release="15/02/2019">
                <shows>
                    <show time="2019-05-06T10:30:00" url="https://booking.cineworld.co.uk/booking/8023/167359" audioType="audio described" subtitled="true"/>
                </shows>
            </film>
            <film title="Take That - Greatest Hits Live" rating="12A" url="films/take-that-greatest-hits-live" edi="270195" release="08/06/2019">
                <shows>
                    <show time="2019-06-08T20:00:00" url="https://booking.cineworld.co.uk/booking/8023/164524"/>
                </shows>
            </film>
            <film title="The Curse Of La Llorona" rating="15" url="films/the-curse-of-la-llorona" edi="250922" release="03/05/2019">
                <shows>
                    <show time="2019-05-06T11:40:00" url="https://booking.cineworld.co.uk/booking/8023/167156" audioType="audio described"/>
                    <show time="2019-05-06T14:00:00" url="https://booking.cineworld.co.uk/booking/8023/167157" audioType="audio described"/>
                    <show time="2019-05-06T16:20:00" url="https://booking.cineworld.co.uk/booking/8023/167158" audioType="audio described"/>
                    <show time="2019-05-06T18:40:00" url="https://booking.cineworld.co.uk/booking/8023/167159" audioType="audio described"/>
                    <show time="2019-05-06T19:45:00" url="https://booking.cineworld.co.uk/booking/8023/167134" audioType="audio described"/>
                    <show time="2019-05-06T21:00:00" url="https://booking.cineworld.co.uk/booking/8023/167160" audioType="audio described"/>
                    <show time="2019-05-07T14:00:00" url="https://booking.cineworld.co.uk/booking/8023/167309" audioType="audio described"/>
                    <show time="2019-05-07T16:20:00" url="https://booking.cineworld.co.uk/booking/8023/167310" audioType="audio described"/>
                    <show time="2019-05-07T18:40:00" url="https://booking.cineworld.co.uk/booking/8023/167311" audioType="audio described"/>
                    <show time="2019-05-07T19:45:00" url="https://booking.cineworld.co.uk/booking/8023/167122" audioType="audio described"/>
                    <show time="2019-05-07T21:00:00" url="https://booking.cineworld.co.uk/booking/8023/167312" audioType="audio described"/>
                    <show time="2019-05-08T14:00:00" url="https://booking.cineworld.co.uk/booking/8023/167313" audioType="audio described"/>
                    <show time="2019-05-08T16:20:00" url="https://booking.cineworld.co.uk/booking/8023/167314" audioType="audio described"/>
                    <show time="2019-05-08T18:40:00" url="https://booking.cineworld.co.uk/booking/8023/167315" audioType="audio described"/>
                    <show time="2019-05-08T19:45:00" url="https://booking.cineworld.co.uk/booking/8023/167125" audioType="audio described"/>
                    <show time="2019-05-08T21:00:00" url="https://booking.cineworld.co.uk/booking/8023/167316" audioType="audio described"/>
                    <show time="2019-05-09T14:00:00" url="https://booking.cineworld.co.uk/booking/8023/167317" audioType="audio described"/>
                    <show time="2019-05-09T16:20:00" url="https://booking.cineworld.co.uk/booking/8023/167318" audioType="audio described"/>
                    <show time="2019-05-09T18:40:00" url="https://booking.cineworld.co.uk/booking/8023/167319" audioType="audio described"/>
                    <show time="2019-05-09T19:45:00" url="https://booking.cineworld.co.uk/booking/8023/167128" audioType="audio described" subtitled="true"/>
                    <show time="2019-05-09T21:00:00" url="https://booking.cineworld.co.uk/booking/8023/167320" audioType="audio described"/>
                </shows>
            </film>
            <film title="The Merry Wives Of Windsor Live from Shakespeare G" rating="12A" url="films/the-merry-wives-of-windsor-live-from-shakespeares-globe" edi="268829" release="20/06/2019">
                <shows>
                    <show time="2019-06-20T19:20:00" url="https://booking.cineworld.co.uk/booking/8023/162394"/>
                </shows>
            </film>
            <film title="The Secret Life Of Pets 2" rating="U" url="films/the-secret-life-of-pets-2" edi="192838" release="24/05/2019">
                <shows>
                    <show time="2019-05-24T14:30:00" url="https://booking.cineworld.co.uk/booking/8023/165275" audioType="audio described"/>
                    <show time="2019-05-24T16:45:00" url="https://booking.cineworld.co.uk/booking/8023/165276" audioType="audio described"/>
                    <show time="2019-05-25T10:00:00" url="https://booking.cineworld.co.uk/booking/8023/165280" audioType="audio described"/>
                    <show time="2019-05-25T12:15:00" url="https://booking.cineworld.co.uk/booking/8023/165279" audioType="audio described"/>
                    <show time="2019-05-25T14:30:00" url="https://booking.cineworld.co.uk/booking/8023/165277" audioType="audio described"/>
                    <show time="2019-05-25T16:45:00" url="https://booking.cineworld.co.uk/booking/8023/165278" audioType="audio described"/>
                    <show time="2019-05-26T10:00:00" url="https://booking.cineworld.co.uk/booking/8023/165284" audioType="audio described"/>
                    <show time="2019-05-26T12:15:00" url="https://booking.cineworld.co.uk/booking/8023/165283" audioType="audio described"/>
                    <show time="2019-05-26T14:30:00" url="https://booking.cineworld.co.uk/booking/8023/165281" audioType="audio described"/>
                    <show time="2019-05-26T16:45:00" url="https://booking.cineworld.co.uk/booking/8023/165282" audioType="audio described"/>
                    <show time="2019-05-27T10:00:00" url="https://booking.cineworld.co.uk/booking/8023/165285" audioType="audio described"/>
                    <show time="2019-05-27T12:15:00" url="https://booking.cineworld.co.uk/booking/8023/165286" audioType="audio described"/>
                    <show time="2019-05-27T14:30:00" url="https://booking.cineworld.co.uk/booking/8023/165287" audioType="audio described"/>
                    <show time="2019-05-27T16:45:00" url="https://booking.cineworld.co.uk/booking/8023/165288" audioType="audio described"/>
                    <show time="2019-05-28T10:00:00" url="https://booking.cineworld.co.uk/booking/8023/165292" audioType="audio described"/>
                    <show time="2019-05-28T12:15:00" url="https://booking.cineworld.co.uk/booking/8023/165291" audioType="audio described"/>
                    <show time="2019-05-28T14:30:00" url="https://booking.cineworld.co.uk/booking/8023/165289" audioType="audio described"/>
                    <show time="2019-05-28T16:45:00" url="https://booking.cineworld.co.uk/booking/8023/165290" audioType="audio described"/>
                </shows>
            </film>
            <film title="Tolkien" rating="12A" url="films/tolkien" edi="271425" release="03/05/2019">
                <shows>
                    <show time="2019-05-06T11:50:00" url="https://booking.cineworld.co.uk/booking/8023/167254" audioType="audio described"/>
                    <show time="2019-05-06T14:30:00" url="https://booking.cineworld.co.uk/booking/8023/167251" audioType="audio described"/>
                    <show time="2019-05-06T17:10:00" url="https://booking.cineworld.co.uk/booking/8023/167252" audioType="audio described"/>
                    <show time="2019-05-06T19:50:00" url="https://booking.cineworld.co.uk/booking/8023/167253" audioType="audio described"/>
                    <show time="2019-05-07T14:30:00" url="https://booking.cineworld.co.uk/booking/8023/167255" audioType="audio described"/>
                    <show time="2019-05-07T17:10:00" url="https://booking.cineworld.co.uk/booking/8023/167256" audioType="audio described"/>
                    <show time="2019-05-07T19:50:00" url="https://booking.cineworld.co.uk/booking/8023/167257" audioType="audio described"/>
                    <show time="2019-05-08T14:30:00" url="https://booking.cineworld.co.uk/booking/8023/167258" audioType="audio described"/>
                    <show time="2019-05-08T17:10:00" url="https://booking.cineworld.co.uk/booking/8023/167259" audioType="audio described"/>
                    <show time="2019-05-08T19:50:00" url="https://booking.cineworld.co.uk/booking/8023/167260" audioType="audio described"/>
                    <show time="2019-05-09T14:30:00" url="https://booking.cineworld.co.uk/booking/8023/167261" audioType="audio described"/>
                    <show time="2019-05-09T17:10:00" url="https://booking.cineworld.co.uk/booking/8023/167262" audioType="audio described"/>
                    <show time="2019-05-09T19:50:00" url="https://booking.cineworld.co.uk/booking/8023/167263" audioType="audio described"/>
                </shows>
            </film>
            <film title="Victoria - Northern Ballet" rating="PG" url="films/victoria-northern-ballet" edi="270190" release="25/06/2019">
                <shows>
                    <show time="2019-06-25T19:30:00" url="https://booking.cineworld.co.uk/booking/8023/162010"/>
                </shows>
            </film>
            <film title="Westlife : The Twenty Tour Live" rating="12A" url="films/westlife-the-twenty-tour-live-from-croke-park" edi="270186" release="06/07/2019">
                <shows>
                    <show time="2019-07-06T20:00:00" url="https://booking.cineworld.co.uk/booking/8023/166364"/>
                </shows>
            </film>
            <film title="M4J Wheely" rating="PG" url="films/wheely-movies-for-juniors" edi="226573" release="19/04/2019">
                <shows>
                    <show time="2019-05-06T10:00:00" url="https://booking.cineworld.co.uk/booking/8023/167340"/>
                </shows>
            </film>
            <film title="(2D) Wonder Park" rating="PG" url="films/wonder-park" edi="194897" release="12/04/2019">
                <shows>
                    <show time="2019-05-06T10:00:00" url="https://booking.cineworld.co.uk/booking/8023/167295" audioType="audio described"/>
                    <show time="2019-05-06T11:30:00" url="https://booking.cineworld.co.uk/booking/8023/167175" audioType="audio described"/>
                    <show time="2019-05-06T13:00:00" url="https://booking.cineworld.co.uk/booking/8023/167143" audioType="audio described"/>
                    <show time="2019-05-06T15:10:00" url="https://booking.cineworld.co.uk/booking/8023/167084" audioType="audio described"/>
                    <show time="2019-05-06T17:20:00" url="https://booking.cineworld.co.uk/booking/8023/167085" audioType="audio described"/>
                    <show time="2019-05-07T15:10:00" url="https://booking.cineworld.co.uk/booking/8023/167087" audioType="audio described"/>
                    <show time="2019-05-07T17:20:00" url="https://booking.cineworld.co.uk/booking/8023/167088" audioType="audio described"/>
                    <show time="2019-05-08T15:10:00" url="https://booking.cineworld.co.uk/booking/8023/167090" audioType="audio described"/>
                    <show time="2019-05-08T17:20:00" url="https://booking.cineworld.co.uk/booking/8023/167091" audioType="audio described"/>
                    <show time="2019-05-09T15:10:00" url="https://booking.cineworld.co.uk/booking/8023/167093" audioType="audio described"/>
                    <show time="2019-05-09T17:20:00" url="https://booking.cineworld.co.uk/booking/8023/167094" audioType="audio described"/>
                </shows>
            </film>
            <film title="(3D) X-Men: Dark Phoenix" rating="TBC" url="films/x-men-dark-phoenix" edi="246006" release="05/06/2019">
                <shows>
                    <show time="2019-06-05T20:00:00" url="https://booking.cineworld.co.uk/booking/8023/167043" videoType="3d" audioType="audio described"/>
                    <show time="2019-06-06T20:00:00" url="https://booking.cineworld.co.uk/booking/8023/167050" videoType="3d" audioType="audio described"/>
                    <show time="2019-06-07T20:00:00" url="https://booking.cineworld.co.uk/booking/8023/167051" videoType="3d" audioType="audio described"/>
                    <show time="2019-06-08T20:00:00" url="https://booking.cineworld.co.uk/booking/8023/167058" videoType="3d" audioType="audio described"/>
                    <show time="2019-06-09T20:00:00" url="https://booking.cineworld.co.uk/booking/8023/167062" videoType="3d" audioType="audio described"/>
                </shows>
            </film>
            <film title="X-Men: Dark Phoenix" rating="TBC" url="films/x-men-dark-phoenix" edi="220087" release="05/06/2019">
                <shows>
                    <show time="2019-06-05T15:20:00" url="https://booking.cineworld.co.uk/booking/8023/167044" audioType="audio described"/>
                    <show time="2019-06-05T18:10:00" url="https://booking.cineworld.co.uk/booking/8023/167045" audioType="audio described"/>
                    <show time="2019-06-05T21:00:00" url="https://booking.cineworld.co.uk/booking/8023/167046" audioType="audio described"/>
                    <show time="2019-06-06T15:20:00" url="https://booking.cineworld.co.uk/booking/8023/167047" audioType="audio described"/>
                    <show time="2019-06-06T18:10:00" url="https://booking.cineworld.co.uk/booking/8023/167048" audioType="audio described"/>
                    <show time="2019-06-06T21:00:00" url="https://booking.cineworld.co.uk/booking/8023/167049" audioType="audio described"/>
                    <show time="2019-06-07T15:20:00" url="https://booking.cineworld.co.uk/booking/8023/167052" audioType="audio described"/>
                    <show time="2019-06-07T18:10:00" url="https://booking.cineworld.co.uk/booking/8023/167053" audioType="audio described"/>
                    <show time="2019-06-07T21:00:00" url="https://booking.cineworld.co.uk/booking/8023/167054" audioType="audio described"/>
                    <show time="2019-06-08T12:30:00" url="https://booking.cineworld.co.uk/booking/8023/167063" audioType="audio described"/>
                    <show time="2019-06-08T15:20:00" url="https://booking.cineworld.co.uk/booking/8023/167055" audioType="audio described"/>
                    <show time="2019-06-08T18:10:00" url="https://booking.cineworld.co.uk/booking/8023/167056" audioType="audio described"/>
                    <show time="2019-06-08T21:00:00" url="https://booking.cineworld.co.uk/booking/8023/167057" audioType="audio described"/>
                    <show time="2019-06-09T12:30:00" url="https://booking.cineworld.co.uk/booking/8023/167064" audioType="audio described"/>
                    <show time="2019-06-09T15:20:00" url="https://booking.cineworld.co.uk/booking/8023/167059" audioType="audio described"/>
                    <show time="2019-06-09T18:10:00" url="https://booking.cineworld.co.uk/booking/8023/167060" audioType="audio described"/>
                    <show time="2019-06-09T21:00:00" url="https://booking.cineworld.co.uk/booking/8023/167061" audioType="audio described"/>
                </shows>
            </film>
        </listing>
    </cinema>
    <cinema name="Cineworld Bracknell" root="http://www1.cineworld.co.uk/" url="cinemas/bracknell" id="116" phone="0871 200 2000" address="2 Eagle Lane, Bracknell" postcode="RG12 1BG">
        <listing>
            <film title="A Dog's Journey" rating="PG" url="films/a-dogs-journey" edi="255103" release="03/05/2019">
                <shows>
                    <show time="2019-05-06T11:20:00" url="https://booking.cineworld.co.uk/booking/8119/32069" audioType="audio described"/>
                    <show time="2019-05-06T14:00:00" url="https://booking.cineworld.co.uk/booking/8119/32070" audioType="audio described"/>
                    <show time="2019-05-06T16:30:00" url="https://booking.cineworld.co.uk/booking/8119/32071" audioType="audio described"/>
                    <show time="2019-05-06T18:20:00" url="https://booking.cineworld.co.uk/booking/8119/32216" audioType="audio described"/>
                    <show time="2019-05-07T11:20:00" url="https://booking.cineworld.co.uk/booking/8119/32072" audioType="audio described"/>
                    <show time="2019-05-07T14:00:00" url="https://booking.cineworld.co.uk/booking/8119/32073" audioType="audio described"/>
                    <show time="2019-05-07T16:30:00" url="https://booking.cineworld.co.uk/booking/8119/32074" audioType="audio described"/>
                    <show time="2019-05-07T18:20:00" url="https://booking.cineworld.co.uk/booking/8119/32217" audioType="audio described"/>
                    <show time="2019-05-08T11:20:00" url="https://booking.cineworld.co.uk/booking/8119/32075" audioType="audio described"/>
                    <show time="2019-05-08T14:00:00" url="https://booking.cineworld.co.uk/booking/8119/32076" audioType="audio described"/>
                    <show time="2019-05-08T16:30:00" url="https://booking.cineworld.co.uk/booking/8119/32077" audioType="audio described"/>
                    <show time="2019-05-08T18:20:00" url="https://booking.cineworld.co.uk/booking/8119/32218" audioType="audio described"/>
                    <show time="2019-05-09T11:20:00" url="https://booking.cineworld.co.uk/booking/8119/32078" audioType="audio described"/>
                    <show time="2019-05-09T14:00:00" url="https://booking.cineworld.co.uk/booking/8119/32079" audioType="audio described"/>
                    <show time="2019-05-09T16:30:00" url="https://booking.cineworld.co.uk/booking/8119/32080" audioType="audio described"/>
                    <show time="2019-05-09T18:20:00" url="https://booking.cineworld.co.uk/booking/8119/32219" audioType="audio described"/>
                </shows>
            </film>
            <film title="Andre Rieu 2019 Maastricht Concert Shall We Dance?" rating="PG" url="films/andre-rieu-2019-maastricht-concert-shall-we-dance" edi="255443" release="27/07/2019">
                <shows>
                    <show time="2019-07-27T19:00:00" url="https://booking.cineworld.co.uk/booking/8119/27668" audioType="audio described"/>
                    <show time="2019-07-28T15:00:00" url="https://booking.cineworld.co.uk/booking/8119/27669" audioType="audio described"/>
                </shows>
            </film>
            <film title="Autism Friendly Screening: Secret Life Of Pets 2" rating="U" url="films/autism-friendly-screening-secret-life-of-pets-2" edi="801857" release="02/06/2019">
                <shows>
                    <show time="2019-06-02T11:00:00" url="https://booking.cineworld.co.uk/booking/8119/32294"/>
                </shows>
            </film>
            <film title="(3D) Avengers: Endgame" rating="12A" url="films/avengers-endgame" edi="174256" release="25/04/2019">
                <shows>
                    <show time="2019-05-06T19:00:00" url="https://booking.cineworld.co.uk/booking/8119/31784" videoType="3d" audioType="audio described"/>
                    <show time="2019-05-07T19:00:00" url="https://booking.cineworld.co.uk/booking/8119/32057" videoType="3d" audioType="audio described"/>
                    <show time="2019-05-08T19:00:00" url="https://booking.cineworld.co.uk/booking/8119/32058" videoType="3d" audioType="audio described"/>
                    <show time="2019-05-09T19:00:00" url="https://booking.cineworld.co.uk/booking/8119/32059" videoType="3d" audioType="audio described"/>
                </shows>
            </film>
            <film title="(4DX 3D) Avengers: ENDGAME" rating="12A" url="films/avengers-endgame" edi="801784" release="25/04/2019">
                <shows>
                    <show time="2019-05-06T12:30:00" url="https://booking.cineworld.co.uk/booking/8119/31788" videoType="3d" audioType="audio described"/>
                    <show time="2019-05-06T16:30:00" url="https://booking.cineworld.co.uk/booking/8119/31789" videoType="3d" audioType="audio described"/>
                    <show time="2019-05-06T20:30:00" url="https://booking.cineworld.co.uk/booking/8119/31790" videoType="3d" audioType="audio described"/>
                    <show time="2019-05-07T12:30:00" url="https://booking.cineworld.co.uk/booking/8119/32243" videoType="3d" audioType="audio described"/>
                    <show time="2019-05-07T16:30:00" url="https://booking.cineworld.co.uk/booking/8119/32244" videoType="3d" audioType="audio described"/>
                    <show time="2019-05-07T20:30:00" url="https://booking.cineworld.co.uk/booking/8119/32245" videoType="3d" audioType="audio described"/>
                    <show time="2019-05-08T12:30:00" url="https://booking.cineworld.co.uk/booking/8119/32246" videoType="3d" audioType="audio described"/>
                    <show time="2019-05-08T16:30:00" url="https://booking.cineworld.co.uk/booking/8119/32247" videoType="3d" audioType="audio described"/>
                    <show time="2019-05-08T20:30:00" url="https://booking.cineworld.co.uk/booking/8119/32248" videoType="3d" audioType="audio described"/>
                    <show time="2019-05-09T12:30:00" url="https://booking.cineworld.co.uk/booking/8119/32249" videoType="3d" audioType="audio described"/>
                    <show time="2019-05-09T16:30:00" url="https://booking.cineworld.co.uk/booking/8119/32250" videoType="3d" audioType="audio described"/>
                    <show time="2019-05-09T20:30:00" url="https://booking.cineworld.co.uk/booking/8119/32251" videoType="3d" audioType="audio described"/>
                </shows>
            </film>
            <film title="(2D) Avengers: Endgame" rating="12A" url="films/avengers-endgame" edi="169126" release="25/04/2019">
                <shows>
                    <show time="2019-05-06T10:10:00" url="https://booking.cineworld.co.uk/booking/8119/31794" audioType="audio described"/>
                    <show time="2019-05-06T11:10:00" url="https://booking.cineworld.co.uk/booking/8119/31781" audioType="audio described"/>
                    <show time="2019-05-06T12:00:00" url="https://booking.cineworld.co.uk/booking/8119/31791" audioType="audio described"/>
                    <show time="2019-05-06T13:30:00" url="https://booking.cineworld.co.uk/booking/8119/32090" audioType="audio described"/>
                    <show time="2019-05-06T14:00:00" url="https://booking.cineworld.co.uk/booking/8119/31786" audioType="audio described"/>
                    <show time="2019-05-06T14:20:00" url="https://booking.cineworld.co.uk/booking/8119/31795" audioType="audio described"/>
                    <show time="2019-05-06T15:10:00" url="https://booking.cineworld.co.uk/booking/8119/31782" audioType="audio described"/>
                    <show time="2019-05-06T16:00:00" url="https://booking.cineworld.co.uk/booking/8119/31792" audioType="audio described"/>
                    <show time="2019-05-06T17:30:00" url="https://booking.cineworld.co.uk/booking/8119/32091" audioType="audio described"/>
                    <show time="2019-05-06T18:00:00" url="https://booking.cineworld.co.uk/booking/8119/31787" audioType="audio described"/>
                    <show time="2019-05-06T18:30:00" url="https://booking.cineworld.co.uk/booking/8119/31796" audioType="audio described"/>
                    <show time="2019-05-06T19:20:00" url="https://booking.cineworld.co.uk/booking/8119/31783" audioType="audio described"/>
                    <show time="2019-05-06T20:00:00" url="https://booking.cineworld.co.uk/booking/8119/31793" audioType="audio described"/>
                    <show time="2019-05-06T21:00:00" url="https://booking.cineworld.co.uk/booking/8119/32195" audioType="audio described"/>
                    <show time="2019-05-06T21:30:00" url="https://booking.cineworld.co.uk/booking/8119/32092" audioType="audio described"/>
                    <show time="2019-05-07T10:10:00" url="https://booking.cineworld.co.uk/booking/8119/32263" audioType="audio described"/>
                    <show time="2019-05-07T11:10:00" url="https://booking.cineworld.co.uk/booking/8119/32014" audioType="audio described"/>
                    <show time="2019-05-07T12:00:00" url="https://booking.cineworld.co.uk/booking/8119/32252" audioType="audio described"/>
                    <show time="2019-05-07T13:30:00" url="https://booking.cineworld.co.uk/booking/8119/32093" audioType="audio described"/>
                    <show time="2019-05-07T14:00:00" url="https://booking.cineworld.co.uk/booking/8119/32230" audioType="audio described"/>
                    <show time="2019-05-07T14:20:00" url="https://booking.cineworld.co.uk/booking/8119/32264" audioType="audio described"/>
                    <show time="2019-05-07T15:10:00" url="https://booking.cineworld.co.uk/booking/8119/32015" audioType="audio described"/>
                    <show time="2019-05-07T16:00:00" url="https://booking.cineworld.co.uk/booking/8119/32253" audioType="audio described"/>
                    <show time="2019-05-07T17:30:00" url="https://booking.cineworld.co.uk/booking/8119/32094" audioType="audio described"/>
                    <show time="2019-05-07T18:00:00" url="https://booking.cineworld.co.uk/booking/8119/32231" audioType="audio described"/>
                    <show time="2019-05-07T18:30:00" url="https://booking.cineworld.co.uk/booking/8119/32265" audioType="audio described"/>
                    <show time="2019-05-07T19:20:00" url="https://booking.cineworld.co.uk/booking/8119/32016" audioType="audio described"/>
                    <show time="2019-05-07T19:40:00" url="https://booking.cineworld.co.uk/booking/8119/32136" audioType="audio described"/>
                    <show time="2019-05-07T20:00:00" url="https://booking.cineworld.co.uk/booking/8119/32254" audioType="audio described"/>
                    <show time="2019-05-07T21:00:00" url="https://booking.cineworld.co.uk/booking/8119/32196" audioType="audio described"/>
                    <show time="2019-05-07T21:30:00" url="https://booking.cineworld.co.uk/booking/8119/32095" audioType="audio described"/>
                    <show time="2019-05-08T10:10:00" url="https://booking.cineworld.co.uk/booking/8119/32266" audioType="audio described"/>
                    <show time="2019-05-08T11:10:00" url="https://booking.cineworld.co.uk/booking/8119/32017" audioType="audio described"/>
                    <show time="2019-05-08T12:00:00" url="https://booking.cineworld.co.uk/booking/8119/32255" audioType="audio described"/>
                    <show time="2019-05-08T13:35:00" url="https://booking.cineworld.co.uk/booking/8119/32096" audioType="audio described"/>
                    <show time="2019-05-08T14:00:00" url="https://booking.cineworld.co.uk/booking/8119/32232" audioType="audio described"/>
                    <show time="2019-05-08T14:20:00" url="https://booking.cineworld.co.uk/booking/8119/32267" audioType="audio described"/>
                    <show time="2019-05-08T15:10:00" url="https://booking.cineworld.co.uk/booking/8119/32018" audioType="audio described"/>
                    <show time="2019-05-08T16:00:00" url="https://booking.cineworld.co.uk/booking/8119/32256" audioType="audio described"/>
                    <show time="2019-05-08T17:35:00" url="https://booking.cineworld.co.uk/booking/8119/32097" audioType="audio described"/>
