<?xml version="1.0" encoding="UTF-8" standalone="yes"?>
<cinemas>
    <cinema name="Cineworld Aberdeen - Queens Links" root="http://www1.cineworld.co.uk/" url="cinemas/aberdeen-queens-links" id="1" phone="0871 200 2000" address="Queens Links Leisure Park, Links Road, Aberdeen" postcode="AB24 5EN">
        <listing>
            <film title="(2D) Aladdin" rating="PG" url="films/aladdin" edi="205737" release="24/05/2019">
                <shows>
                    <show time="2019-07-22T14:50:00" url="https://booking.cineworld.co.uk/booking/8014/117580" audioType="audio described"/>
                    <show time="2019-07-23T14:50:00" url="https://booking.cineworld.co.uk/booking/8014/117594" audioType="audio described"/>
                    <show time="2019-07-24T14:50:00" url="https://booking.cineworld.co.uk/booking/8014/117608" audioType="audio described"/>
                    <show time="2019-07-25T14:50:00" url="https://booking.cineworld.co.uk/booking/8014/117622" audioType="audio described"/>
                </shows>
            </film>
            <film title="Andre Rieu 2019 Maastricht Concert Shall We Dance?" rating="PG" url="films/andre-rieu-2019-maastricht-concert-shall-we-dance" edi="255443" release="27/07/2019">
                <shows>
                    <show time="2019-07-27T19:00:00" url="https://booking.cineworld.co.uk/booking/8014/111111"/>
                    <show time="2019-07-28T15:00:00" url="https://booking.cineworld.co.uk/booking/8014/111112"/>
                </shows>
            </film>
            <film title="Annabelle Comes Home" rating="15" url="films/annabelle-comes-home" edi="250924" release="10/07/2019">
                <shows>
                    <show time="2019-07-22T21:00:00" url="https://booking.cineworld.co.uk/booking/8014/117587" audioType="audio described"/>
                    <show time="2019-07-23T21:00:00" url="https://booking.cineworld.co.uk/booking/8014/117601" audioType="audio described"/>
                    <show time="2019-07-24T21:00:00" url="https://booking.cineworld.co.uk/booking/8014/117615" audioType="audio described"/>
                    <show time="2019-07-25T21:00:00" url="https://booking.cineworld.co.uk/booking/8014/117629" audioType="audio described"/>
                </shows>
            </film>
            <film title="Billy Connolly: The Sex Life of Bandages" rating="18" url="films/billy-connolly-the-sex-life-of-bandages" edi="276418" release="10/10/2019">
                <shows>
                    <show time="2019-10-10T20:00:00" url="https://booking.cineworld.co.uk/booking/8014/117687"/>
                </shows>
            </film>
            <film title="Fast &amp; Furious: Hobbs &amp; Shaw" rating="TBC" url="films/fast-furious-hobbs-shaw" edi="240260" release="02/08/2019">
                <shows>
                    <show time="2019-08-01T20:15:00" url="https://booking.cineworld.co.uk/booking/8014/115841" audioType="audio described"/>
                    <show time="2019-08-02T20:15:00" url="https://booking.cineworld.co.uk/booking/8014/115842" audioType="audio described"/>
                    <show time="2019-08-03T20:15:00" url="https://booking.cineworld.co.uk/booking/8014/115843" audioType="audio described"/>
                    <show time="2019-08-04T20:15:00" url="https://booking.cineworld.co.uk/booking/8014/115844" audioType="audio described"/>
                </shows>
            </film>
            <film title="M4J Paw Patrol: Mighty Pups - The Movie" rating="U" url="films/paw-patrol-mighty-pups-movies-for-juniors" edi="801924" release="19/07/2019">
                <shows>
                    <show time="2019-07-22T10:15:00" url="https://booking.cineworld.co.uk/booking/8014/117682" audioType="audio described"/>
                    <show time="2019-07-23T10:15:00" url="https://booking.cineworld.co.uk/booking/8014/117683" audioType="audio described"/>
                    <show time="2019-07-24T10:15:00" url="https://booking.cineworld.co.uk/booking/8014/117684" audioType="audio described"/>
                    <show time="2019-07-25T10:15:00" url="https://booking.cineworld.co.uk/booking/8014/117685" audioType="audio described"/>
                </shows>
            </film>
            <film title="M4J Ralph Breaks The Internet: Wreck It Ralph 2" rating="PG" url="films/ralph-breaks-the-internet-wreck-it-ralph-2-movies-for-juniors" edi="801742" release="01/03/2019">
                <shows>
                    <show time="2019-07-22T10:00:00" url="https://booking.cineworld.co.uk/booking/8014/117676" audioType="audio described"/>
                    <show time="2019-07-23T10:00:00" url="https://booking.cineworld.co.uk/booking/8014/117677" audioType="audio described"/>
                    <show time="2019-07-24T10:00:00" url="https://booking.cineworld.co.uk/booking/8014/117678" audioType="audio described"/>
                    <show time="2019-07-25T10:00:00" url="https://booking.cineworld.co.uk/booking/8014/117679" audioType="audio described"/>
                </shows>
            </film>
            <film title="Rocketman : Sing-Along Version" rating="15" url="films/rocketman-sing-along-version" edi="263136" release="26/07/2019">
                <shows>
                    <show time="2019-07-26T19:30:00" url="https://booking.cineworld.co.uk/booking/8014/117544" audioType="audio described" subtitled="true"/>
                </shows>
            </film>
            <film title="Secret Unlimited Screening 12" rating="15" url="films/secret-unlimited-screening-12" edi="801942" release="29/07/2019">
                <shows>
                    <show time="2019-07-29T20:00:00" url="https://booking.cineworld.co.uk/booking/8014/117221" audioType="audio described"/>
                </shows>
            </film>
            <film title="(2D) Spider-Man: Far From Home" rating="12A" url="films/spider-man-far-from-home" edi="221205" release="02/07/2019">
                <shows>
                    <show time="2019-07-22T11:10:00" url="https://booking.cineworld.co.uk/booking/8014/117574" audioType="audio described"/>
                    <show time="2019-07-22T14:10:00" url="https://booking.cineworld.co.uk/booking/8014/117575" audioType="audio described"/>
                    <show time="2019-07-22T17:10:00" url="https://booking.cineworld.co.uk/booking/8014/117576" audioType="audio described"/>
                    <show time="2019-07-22T20:10:00" url="https://booking.cineworld.co.uk/booking/8014/117577" audioType="audio described"/>
                    <show time="2019-07-23T11:10:00" url="https://booking.cineworld.co.uk/booking/8014/117588" audioType="audio described"/>
                    <show time="2019-07-23T14:10:00" url="https://booking.cineworld.co.uk/booking/8014/117589" audioType="audio described"/>
                    <show time="2019-07-23T17:10:00" url="https://booking.cineworld.co.uk/booking/8014/117590" audioType="audio described"/>
                    <show time="2019-07-23T20:10:00" url="https://booking.cineworld.co.uk/booking/8014/117591" audioType="audio described"/>
                    <show time="2019-07-24T11:10:00" url="https://booking.cineworld.co.uk/booking/8014/117602" audioType="audio described"/>
                    <show time="2019-07-24T14:10:00" url="https://booking.cineworld.co.uk/booking/8014/117603" audioType="audio described"/>
                    <show time="2019-07-24T17:10:00" url="https://booking.cineworld.co.uk/booking/8014/117604" audioType="audio described"/>
                    <show time="2019-07-24T20:10:00" url="https://booking.cineworld.co.uk/booking/8014/117605" audioType="audio described"/>
                    <show time="2019-07-25T11:10:00" url="https://booking.cineworld.co.uk/booking/8014/117616" audioType="audio described"/>
                    <show time="2019-07-25T14:10:00" url="https://booking.cineworld.co.uk/booking/8014/117617" audioType="audio described"/>
                    <show time="2019-07-25T17:10:00" url="https://booking.cineworld.co.uk/booking/8014/117618" audioType="audio described"/>
                    <show time="2019-07-25T20:10:00" url="https://booking.cineworld.co.uk/booking/8014/117619" audioType="audio described"/>
                </shows>
            </film>
            <film title="Stuber" rating="15" url="films/stuber" edi="258445" release="12/07/2019">
                <shows>
                    <show time="2019-07-22T20:45:00" url="https://booking.cineworld.co.uk/booking/8014/117646" audioType="audio described"/>
                    <show time="2019-07-23T20:45:00" url="https://booking.cineworld.co.uk/booking/8014/117647" audioType="audio described"/>
                    <show time="2019-07-24T20:45:00" url="https://booking.cineworld.co.uk/booking/8014/117648" audioType="audio described"/>
                    <show time="2019-07-25T20:45:00" url="https://booking.cineworld.co.uk/booking/8014/117671" audioType="audio described"/>
                </shows>
            </film>
            <film title="(2D) The Lion King" rating="PG" url="films/the-lion-king" edi="229583" release="19/07/2019">
                <shows>
                    <show time="2019-07-22T10:30:00" url="https://booking.cineworld.co.uk/booking/8014/116861" audioType="audio described"/>
                    <show time="2019-07-22T11:00:00" url="https://booking.cineworld.co.uk/booking/8014/116857" audioType="audio described"/>
                    <show time="2019-07-22T11:30:00" url="https://booking.cineworld.co.uk/booking/8014/116865" audioType="audio described"/>
                    <show time="2019-07-22T12:30:00" url="https://booking.cineworld.co.uk/booking/8014/116869" audioType="audio described"/>
                    <show time="2019-07-22T13:30:00" url="https://booking.cineworld.co.uk/booking/8014/116862" audioType="audio described"/>
                    <show time="2019-07-22T14:00:00" url="https://booking.cineworld.co.uk/booking/8014/116858" audioType="audio described"/>
                    <show time="2019-07-22T14:30:00" url="https://booking.cineworld.co.uk/booking/8014/116866" audioType="audio described"/>
                    <show time="2019-07-22T15:30:00" url="https://booking.cineworld.co.uk/booking/8014/116870" audioType="audio described"/>
                    <show time="2019-07-22T16:30:00" url="https://booking.cineworld.co.uk/booking/8014/116863" audioType="audio described"/>
                    <show time="2019-07-22T17:00:00" url="https://booking.cineworld.co.uk/booking/8014/116859" audioType="audio described"/>
                    <show time="2019-07-22T17:30:00" url="https://booking.cineworld.co.uk/booking/8014/116867" audioType="audio described"/>
                    <show time="2019-07-22T18:30:00" url="https://booking.cineworld.co.uk/booking/8014/116871" audioType="audio described" subtitled="true"/>
                    <show time="2019-07-22T19:30:00" url="https://booking.cineworld.co.uk/booking/8014/116864" audioType="audio described"/>
                    <show time="2019-07-22T20:00:00" url="https://booking.cineworld.co.uk/booking/8014/116860" audioType="audio described"/>
                    <show time="2019-07-22T20:30:00" url="https://booking.cineworld.co.uk/booking/8014/116868" audioType="audio described"/>
                    <show time="2019-07-23T10:30:00" url="https://booking.cineworld.co.uk/booking/8014/116883" audioType="audio described"/>
                    <show time="2019-07-23T11:00:00" url="https://booking.cineworld.co.uk/booking/8014/116879" audioType="audio described"/>
                    <show time="2019-07-23T11:30:00" url="https://booking.cineworld.co.uk/booking/8014/116887" audioType="audio described"/>
                    <show time="2019-07-23T12:30:00" url="https://booking.cineworld.co.uk/booking/8014/116891" audioType="audio described"/>
                    <show time="2019-07-23T13:30:00" url="https://booking.cineworld.co.uk/booking/8014/116884" audioType="audio described"/>
                    <show time="2019-07-23T14:00:00" url="https://booking.cineworld.co.uk/booking/8014/116880" audioType="audio described"/>
                    <show time="2019-07-23T14:30:00" url="https://booking.cineworld.co.uk/booking/8014/116888" audioType="audio described"/>
                    <show time="2019-07-23T15:30:00" url="https://booking.cineworld.co.uk/booking/8014/116892" audioType="audio described"/>
                    <show time="2019-07-23T16:30:00" url="https://booking.cineworld.co.uk/booking/8014/116885" audioType="audio described"/>
                    <show time="2019-07-23T17:00:00" url="https://booking.cineworld.co.uk/booking/8014/116881" audioType="audio described"/>
                    <show time="2019-07-23T17:30:00" url="https://booking.cineworld.co.uk/booking/8014/116889" audioType="audio described"/>
                    <show time="2019-07-23T18:30:00" url="https://booking.cineworld.co.uk/booking/8014/116893" audioType="audio described"/>
                    <show time="2019-07-23T19:30:00" url="https://booking.cineworld.co.uk/booking/8014/116886" audioType="audio described"/>
                    <show time="2019-07-23T20:00:00" url="https://booking.cineworld.co.uk/booking/8014/116882" audioType="audio described"/>
                    <show time="2019-07-23T20:30:00" url="https://booking.cineworld.co.uk/booking/8014/116890" audioType="audio described"/>
                    <show time="2019-07-24T10:30:00" url="https://booking.cineworld.co.uk/booking/8014/116905" audioType="audio described"/>
                    <show time="2019-07-24T11:00:00" url="https://booking.cineworld.co.uk/booking/8014/116901" audioType="audio described"/>
                    <show time="2019-07-24T11:30:00" url="https://booking.cineworld.co.uk/booking/8014/116909" audioType="audio described"/>
                    <show time="2019-07-24T12:30:00" url="https://booking.cineworld.co.uk/booking/8014/116913" audioType="audio described"/>
                    <show time="2019-07-24T13:30:00" url="https://booking.cineworld.co.uk/booking/8014/116906" audioType="audio described"/>
                    <show time="2019-07-24T14:00:00" url="https://booking.cineworld.co.uk/booking/8014/116902" audioType="audio described"/>
                    <show time="2019-07-24T14:30:00" url="https://booking.cineworld.co.uk/booking/8014/116910" audioType="audio described"/>
                    <show time="2019-07-24T15:30:00" url="https://booking.cineworld.co.uk/booking/8014/116914" audioType="audio described"/>
                    <show time="2019-07-24T16:30:00" url="https://booking.cineworld.co.uk/booking/8014/116907" audioType="audio described"/>
                    <show time="2019-07-24T17:00:00" url="https://booking.cineworld.co.uk/booking/8014/116903" audioType="audio described"/>
                    <show time="2019-07-24T17:30:00" url="https://booking.cineworld.co.uk/booking/8014/116911" audioType="audio described"/>
                    <show time="2019-07-24T18:30:00" url="https://booking.cineworld.co.uk/booking/8014/116915" audioType="audio described"/>
                    <show time="2019-07-24T19:30:00" url="https://booking.cineworld.co.uk/booking/8014/116908" audioType="audio described"/>
                    <show time="2019-07-24T20:00:00" url="https://booking.cineworld.co.uk/booking/8014/116904" audioType="audio described"/>
                    <show time="2019-07-24T20:30:00" url="https://booking.cineworld.co.uk/booking/8014/116912" audioType="audio described"/>
                    <show time="2019-07-25T10:30:00" url="https://booking.cineworld.co.uk/booking/8014/117653" audioType="audio described"/>
                    <show time="2019-07-25T11:00:00" url="https://booking.cineworld.co.uk/booking/8014/117649" audioType="audio described"/>
                    <show time="2019-07-25T11:30:00" url="https://booking.cineworld.co.uk/booking/8014/117657" audioType="audio described"/>
                    <show time="2019-07-25T12:30:00" url="https://booking.cineworld.co.uk/booking/8014/117661" audioType="audio described"/>
                    <show time="2019-07-25T13:30:00" url="https://booking.cineworld.co.uk/booking/8014/117654" audioType="audio described"/>
                    <show time="2019-07-25T14:00:00" url="https://booking.cineworld.co.uk/booking/8014/117650" audioType="audio described"/>
                    <show time="2019-07-25T14:30:00" url="https://booking.cineworld.co.uk/booking/8014/117658" audioType="audio described"/>
                    <show time="2019-07-25T15:30:00" url="https://booking.cineworld.co.uk/booking/8014/117662" audioType="audio described"/>
                    <show time="2019-07-25T16:30:00" url="https://booking.cineworld.co.uk/booking/8014/117655" audioType="audio described"/>
                    <show time="2019-07-25T17:00:00" url="https://booking.cineworld.co.uk/booking/8014/117651" audioType="audio described"/>
                    <show time="2019-07-25T17:30:00" url="https://booking.cineworld.co.uk/booking/8014/117659" audioType="audio described"/>
                    <show time="2019-07-25T18:30:00" url="https://booking.cineworld.co.uk/booking/8014/117663" audioType="audio described"/>
                    <show time="2019-07-25T19:30:00" url="https://booking.cineworld.co.uk/booking/8014/117656" audioType="audio described"/>
                    <show time="2019-07-25T20:00:00" url="https://booking.cineworld.co.uk/booking/8014/117652" audioType="audio described"/>
                    <show time="2019-07-25T20:30:00" url="https://booking.cineworld.co.uk/booking/8014/117660" audioType="audio described"/>
                </shows>
            </film>
            <film title="(3D) The Lion King" rating="PG" url="films/the-lion-king" edi="229584" release="19/07/2019">
                <shows>
                    <show time="2019-07-22T10:00:00" url="https://booking.cineworld.co.uk/booking/8014/116872" videoType="3d" audioType="audio described"/>
                    <show time="2019-07-22T12:00:00" url="https://booking.cineworld.co.uk/booking/8014/116876" videoType="3d" audioType="audio described"/>
                    <show time="2019-07-22T13:00:00" url="https://booking.cineworld.co.uk/booking/8014/116873" videoType="3d" audioType="audio described"/>
                    <show time="2019-07-22T15:00:00" url="https://booking.cineworld.co.uk/booking/8014/116877" videoType="3d" audioType="audio described"/>
                    <show time="2019-07-22T16:00:00" url="https://booking.cineworld.co.uk/booking/8014/116874" videoType="3d" audioType="audio described"/>
                    <show time="2019-07-22T18:00:00" url="https://booking.cineworld.co.uk/booking/8014/116878" videoType="3d" audioType="audio described"/>
                    <show time="2019-07-22T19:00:00" url="https://booking.cineworld.co.uk/booking/8014/116875" videoType="3d" audioType="audio described"/>
                    <show time="2019-07-23T10:00:00" url="https://booking.cineworld.co.uk/booking/8014/116894" videoType="3d" audioType="audio described"/>
                    <show time="2019-07-23T12:00:00" url="https://booking.cineworld.co.uk/booking/8014/116898" videoType="3d" audioType="audio described"/>
                    <show time="2019-07-23T13:00:00" url="https://booking.cineworld.co.uk/booking/8014/116895" videoType="3d" audioType="audio described"/>
                    <show time="2019-07-23T15:00:00" url="https://booking.cineworld.co.uk/booking/8014/116899" videoType="3d" audioType="audio described"/>
                    <show time="2019-07-23T16:00:00" url="https://booking.cineworld.co.uk/booking/8014/116896" videoType="3d" audioType="audio described"/>
                    <show time="2019-07-23T18:00:00" url="https://booking.cineworld.co.uk/booking/8014/116900" videoType="3d" audioType="audio described"/>
                    <show time="2019-07-23T19:00:00" url="https://booking.cineworld.co.uk/booking/8014/116897" videoType="3d" audioType="audio described"/>
                    <show time="2019-07-24T10:00:00" url="https://booking.cineworld.co.uk/booking/8014/116916" videoType="3d" audioType="audio described"/>
                    <show time="2019-07-24T12:00:00" url="https://booking.cineworld.co.uk/booking/8014/116920" videoType="3d" audioType="audio described"/>
                    <show time="2019-07-24T13:00:00" url="https://booking.cineworld.co.uk/booking/8014/116917" videoType="3d" audioType="audio described"/>
                    <show time="2019-07-24T15:00:00" url="https://booking.cineworld.co.uk/booking/8014/116921" videoType="3d" audioType="audio described"/>
                    <show time="2019-07-24T16:00:00" url="https://booking.cineworld.co.uk/booking/8014/116918" videoType="3d" audioType="audio described"/>
                    <show time="2019-07-24T18:00:00" url="https://booking.cineworld.co.uk/booking/8014/116922" videoType="3d" audioType="audio described"/>
                    <show time="2019-07-24T19:00:00" url="https://booking.cineworld.co.uk/booking/8014/116919" videoType="3d" audioType="audio described"/>
                    <show time="2019-07-25T10:00:00" url="https://booking.cineworld.co.uk/booking/8014/117664" videoType="3d" audioType="audio described"/>
                    <show time="2019-07-25T12:00:00" url="https://booking.cineworld.co.uk/booking/8014/117668" videoType="3d" audioType="audio described"/>
                    <show time="2019-07-25T13:00:00" url="https://booking.cineworld.co.uk/booking/8014/117665" videoType="3d" audioType="audio described"/>
                    <show time="2019-07-25T15:00:00" url="https://booking.cineworld.co.uk/booking/8014/117669" videoType="3d" audioType="audio described"/>
                    <show time="2019-07-25T16:00:00" url="https://booking.cineworld.co.uk/booking/8014/117666" videoType="3d" audioType="audio described"/>
                    <show time="2019-07-25T18:00:00" url="https://booking.cineworld.co.uk/booking/8014/117670" videoType="3d" audioType="audio described"/>
                    <show time="2019-07-25T19:00:00" url="https://booking.cineworld.co.uk/booking/8014/117667" videoType="3d" audioType="audio described"/>
                </shows>
            </film>
            <film title="(2D) Toy Story 4" rating="U" url="films/toy-story-4" edi="148687" release="21/06/2019">
                <shows>
                    <show time="2019-07-22T10:00:00" url="https://booking.cineworld.co.uk/booking/8014/117578" audioType="audio described"/>
                    <show time="2019-07-22T11:20:00" url="https://booking.cineworld.co.uk/booking/8014/117583" audioType="audio described"/>
                    <show time="2019-07-22T12:30:00" url="https://booking.cineworld.co.uk/booking/8014/117579" audioType="audio described"/>
                    <show time="2019-07-22T13:50:00" url="https://booking.cineworld.co.uk/booking/8014/117584" audioType="audio described"/>
                    <show time="2019-07-22T16:15:00" url="https://booking.cineworld.co.uk/booking/8014/117585" audioType="audio described"/>
                    <show time="2019-07-22T18:40:00" url="https://booking.cineworld.co.uk/booking/8014/117586" audioType="audio described"/>
                    <show time="2019-07-23T10:00:00" url="https://booking.cineworld.co.uk/booking/8014/117592" audioType="audio described"/>
                    <show time="2019-07-23T11:20:00" url="https://booking.cineworld.co.uk/booking/8014/117597" audioType="audio described"/>
                    <show time="2019-07-23T12:30:00" url="https://booking.cineworld.co.uk/booking/8014/117593" audioType="audio described"/>
                    <show time="2019-07-23T13:50:00" url="https://booking.cineworld.co.uk/booking/8014/117598" audioType="audio described"/>
                    <show time="2019-07-23T16:15:00" url="https://booking.cineworld.co.uk/booking/8014/117599" audioType="audio described"/>
                    <show time="2019-07-23T18:40:00" url="https://booking.cineworld.co.uk/booking/8014/117600" audioType="audio described"/>
                    <show time="2019-07-24T10:00:00" url="https://booking.cineworld.co.uk/booking/8014/117606" audioType="audio described"/>
                    <show time="2019-07-24T11:20:00" url="https://booking.cineworld.co.uk/booking/8014/117611" audioType="audio described"/>
                    <show time="2019-07-24T12:30:00" url="https://booking.cineworld.co.uk/booking/8014/117607" audioType="audio described"/>
                    <show time="2019-07-24T13:50:00" url="https://booking.cineworld.co.uk/booking/8014/117612" audioType="audio described"/>
                    <show time="2019-07-24T16:15:00" url="https://booking.cineworld.co.uk/booking/8014/117613" audioType="audio described"/>
                    <show time="2019-07-24T18:40:00" url="https://booking.cineworld.co.uk/booking/8014/117614" audioType="audio described"/>
                    <show time="2019-07-25T10:00:00" url="https://booking.cineworld.co.uk/booking/8014/117620" audioType="audio described"/>
                    <show time="2019-07-25T11:20:00" url="https://booking.cineworld.co.uk/booking/8014/117625" audioType="audio described"/>
                    <show time="2019-07-25T12:30:00" url="https://booking.cineworld.co.uk/booking/8014/117621" audioType="audio described"/>
                    <show time="2019-07-25T13:50:00" url="https://booking.cineworld.co.uk/booking/8014/117626" audioType="audio described"/>
                    <show time="2019-07-25T16:15:00" url="https://booking.cineworld.co.uk/booking/8014/117627" audioType="audio described"/>
                    <show time="2019-07-25T18:40:00" url="https://booking.cineworld.co.uk/booking/8014/117628" audioType="audio described"/>
                </shows>
            </film>
            <film title="Yesterday" rating="12A" url="films/yesterday" edi="253917" release="28/06/2019">
                <shows>
                    <show time="2019-07-22T17:40:00" url="https://booking.cineworld.co.uk/booking/8014/117581" audioType="audio described"/>
                    <show time="2019-07-22T20:20:00" url="https://booking.cineworld.co.uk/booking/8014/117582" audioType="audio described"/>
                    <show time="2019-07-23T17:40:00" url="https://booking.cineworld.co.uk/booking/8014/117595" audioType="audio described"/>
                    <show time="2019-07-23T20:20:00" url="https://booking.cineworld.co.uk/booking/8014/117596" audioType="audio described"/>
                    <show time="2019-07-24T17:40:00" url="https://booking.cineworld.co.uk/booking/8014/117609" audioType="audio described"/>
                    <show time="2019-07-24T20:20:00" url="https://booking.cineworld.co.uk/booking/8014/117610" audioType="audio described"/>
                    <show time="2019-07-25T17:40:00" url="https://booking.cineworld.co.uk/booking/8014/117623" audioType="audio described"/>
                    <show time="2019-07-25T20:20:00" url="https://booking.cineworld.co.uk/booking/8014/117624" audioType="audio described"/>
                </shows>
            </film>
        </listing>
    </cinema>
    <cinema name="Cineworld Aberdeen - Union Square" root="http://www1.cineworld.co.uk/" url="cinemas/aberdeen-union-square" id="78" phone="0871 200 2000" address="Union Square, Guild Square, Aberdeen" postcode="AB11 5RG">
        <listing>
            <film title="(4DX) The Matrix : 20th Anniversary (4K)" rating="15" url="films/4dx-the-matrix-20th-anniversary-4k-restoration" edi="801874" release="17/07/2019">
                <shows>
                    <show time="2019-07-25T20:20:00" url="https://booking.cineworld.co.uk/booking/8018/131507" audioType="audio described"/>
                </shows>
            </film>
            <film title="(2D) Aladdin" rating="PG" url="films/aladdin" edi="205737" release="24/05/2019">
                <shows>
                    <show time="2019-07-22T11:10:00" url="https://booking.cineworld.co.uk/booking/8018/131482" audioType="audio described"/>
                    <show time="2019-07-23T11:10:00" url="https://booking.cineworld.co.uk/booking/8018/131483" audioType="audio described"/>
                    <show time="2019-07-24T11:10:00" url="https://booking.cineworld.co.uk/booking/8018/131484" audioType="audio described"/>
                    <show time="2019-07-25T11:10:00" url="https://booking.cineworld.co.uk/booking/8018/131485" audioType="audio described"/>
                </shows>
            </film>
            <film title="Andre Rieu 2019 Maastricht Concert Shall We Dance?" rating="PG" url="films/andre-rieu-2019-maastricht-concert-shall-we-dance" edi="255443" release="27/07/2019">
                <shows>
                    <show time="2019-07-27T19:00:00" url="https://booking.cineworld.co.uk/booking/8018/123918"/>
                    <show time="2019-07-27T19:00:00" url="https://booking.cineworld.co.uk/booking/8018/131477"/>
                    <show time="2019-07-28T15:00:00" url="https://booking.cineworld.co.uk/booking/8018/131478"/>
                    <show time="2019-07-28T15:00:00" url="https://booking.cineworld.co.uk/booking/8018/123919"/>
                </shows>
            </film>
            <film title="Annabelle Comes Home" rating="15" url="films/annabelle-comes-home" edi="250924" release="10/07/2019">
                <shows>
                    <show time="2019-07-22T17:15:00" url="https://booking.cineworld.co.uk/booking/8018/131658" audioType="audio described"/>
                    <show time="2019-07-22T20:50:00" url="https://booking.cineworld.co.uk/booking/8018/131523" audioType="audio described"/>
                    <show time="2019-07-23T17:15:00" url="https://booking.cineworld.co.uk/booking/8018/131659" audioType="audio described"/>
                    <show time="2019-07-23T20:50:00" url="https://booking.cineworld.co.uk/booking/8018/131524" audioType="audio described"/>
                    <show time="2019-07-24T17:15:00" url="https://booking.cineworld.co.uk/booking/8018/131660" audioType="audio described"/>
                    <show time="2019-07-24T20:50:00" url="https://booking.cineworld.co.uk/booking/8018/131525" audioType="audio described"/>
                    <show time="2019-07-25T17:15:00" url="https://booking.cineworld.co.uk/booking/8018/131661" audioType="audio described"/>
                    <show time="2019-07-25T21:15:00" url="https://booking.cineworld.co.uk/booking/8018/131533" audioType="audio described"/>
                </shows>
            </film>
            <film title="Apocalypse Now - The Final Cut + Q&amp;A" rating="15" url="films/apocalypse-now-the-final-cut-qa" edi="801886" release="13/08/2019">
                <shows>
                    <show time="2019-08-13T19:30:00" url="https://booking.cineworld.co.uk/booking/8018/129158"/>
                </shows>
            </film>
            <film title="Autism Friendly Screening: The Lion King (2019)" rating="PG" url="films/autism-friendly-screening-the-lion-king-2019" edi="801945" release="19/07/2019">
                <shows>
                    <show time="2019-08-04T11:00:00" url="https://booking.cineworld.co.uk/booking/8018/131139" audioType="audio described"/>
                </shows>
            </film>
            <film title="Balance, Not Symmetry: Biffy Clyro Acoustic Set + " rating="15" url="films/balance-not-symmetry-biffy-clyro-acoustic-set-cast-qa" edi="279749" release="01/08/2019">
                <shows>
                    <show time="2019-08-01T19:00:00" url="https://booking.cineworld.co.uk/booking/8018/130713"/>
                </shows>
            </film>
            <film title="Billy Connolly: The Sex Life of Bandages" rating="18" url="films/billy-connolly-the-sex-life-of-bandages" edi="276418" release="10/10/2019">
                <shows>
                    <show time="2019-10-10T20:00:00" url="https://booking.cineworld.co.uk/booking/8018/131675"/>
                </shows>
            </film>
            <film title="Bolshoi Ballet 2019 : Le Corsaire" rating="12A" url="films/bolshoi-ballet-2019-le-corsaire" edi="276116" release="17/11/2019">
                <shows>
                    <show time="2019-11-17T15:00:00" url="https://booking.cineworld.co.uk/booking/8018/128843"/>
                </shows>
            </film>
            <film title="Bolshoi Ballet 2019 : Raymonda" rating="12A" url="films/bolshoi-ballet-2019-raymonda" edi="276119" release="27/10/2019">
                <shows>
                    <show time="2019-10-27T15:00:00" url="https://booking.cineworld.co.uk/booking/8018/128842"/>
                </shows>
            </film>
            <film title="Bolshoi Ballet 2019 : The Nutcracker" rating="12A" url="films/bolshoi-ballet-2019-the-nutcracker" edi="276117" release="15/12/2019">
                <shows>
                    <show time="2019-12-15T15:00:00" url="https://booking.cineworld.co.uk/booking/8018/128844"/>
                </shows>
            </film>
            <film title="Bring The Soul: The Movie" rating="PG" url="films/bring-the-soul-the-movie" edi="281205" release="07/08/2019">
                <shows>
                    <show time="2019-08-07T19:30:00" url="https://booking.cineworld.co.uk/booking/8018/131135"/>
                    <show time="2019-08-11T14:00:00" url="https://booking.cineworld.co.uk/booking/8018/131136"/>
                </shows>
            </film>
            <film title="Dracula - Northern Ballet Live" rating="12A" url="films/dracula-northern-ballet-live" edi="270199" release="31/10/2019">
                <shows>
                    <show time="2019-10-31T19:15:00" url="https://booking.cineworld.co.uk/booking/8018/123902"/>
                </shows>
            </film>
            <film title="ENO Screen : The Mikado Encore (2015)" rating="PG" url="films/eno-screen-the-mikado-encore-2015" edi="187300" release="19/08/2019">
                <shows>
                    <show time="2019-08-19T19:30:00" url="https://booking.cineworld.co.uk/booking/8018/128850"/>
                </shows>
            </film>
            <film title="Fast &amp; Furious: Hobbs &amp; Shaw" rating="TBC" url="films/fast-furious-hobbs-shaw" edi="240260" release="02/08/2019">
                <shows>
                    <show time="2019-08-01T19:45:00" url="https://booking.cineworld.co.uk/booking/8018/129541" audioType="audio described"/>
                    <show time="2019-08-01T20:30:00" url="https://booking.cineworld.co.uk/booking/8018/129540" audioType="audio described"/>
                    <show time="2019-08-02T19:45:00" url="https://booking.cineworld.co.uk/booking/8018/129545" audioType="audio described"/>
                    <show time="2019-08-02T20:30:00" url="https://booking.cineworld.co.uk/booking/8018/129542" audioType="audio described"/>
                    <show time="2019-08-03T19:45:00" url="https://booking.cineworld.co.uk/booking/8018/129546" audioType="audio described"/>
                    <show time="2019-08-03T20:30:00" url="https://booking.cineworld.co.uk/booking/8018/129543" audioType="audio described"/>
                    <show time="2019-08-04T19:45:00" url="https://booking.cineworld.co.uk/booking/8018/129547" audioType="audio described"/>
                    <show time="2019-08-04T20:30:00" url="https://booking.cineworld.co.uk/booking/8018/129544" audioType="audio described"/>
                </shows>
            </film>
            <film title="Gauguin From The National Gallery, London" rating="12A" url="films/gauguin-from-the-national-gallery-london" edi="272070" release="15/11/2019">
                <shows>
                    <show time="2019-10-15T12:00:00" url="https://booking.cineworld.co.uk/booking/8018/130435"/>
                    <show time="2019-10-15T19:30:00" url="https://booking.cineworld.co.uk/booking/8018/130436"/>
                </shows>
            </film>
            <film title="Margaret Atwood : Live In Cinemas" rating="12A" url="films/margaret-atwood-live-in-cinemas" edi="272858" release="10/09/2019">
                <shows>
                    <show time="2019-09-10T19:30:00" url="https://booking.cineworld.co.uk/booking/8018/125961"/>
                </shows>
            </film>
            <film title="Met Opera 2019-20: Akhnaten" rating="TBC" url="films/met-opera-2019-20-akhnaten" edi="274678" release="23/11/2019">
                <shows>
                    <show time="2019-11-23T17:55:00" url="https://booking.cineworld.co.uk/booking/8018/131469"/>
                </shows>
            </film>
            <film title="MET Opera 2019-20: Madama Butterfly" rating="TBC" url="films/met-opera-2019-20-madama-butterfly" edi="274682" release="09/11/2019">
                <shows>
                    <show time="2019-11-09T17:55:00" url="https://booking.cineworld.co.uk/booking/8018/131468"/>
                </shows>
            </film>
            <film title="MET Opera 2019-20: Manon" rating="TBC" url="films/met-opera-2019-20-manon" edi="274680" release="26/10/2019">
                <shows>
                    <show time="2019-10-26T17:55:00" url="https://booking.cineworld.co.uk/booking/8018/131467"/>
                </shows>
            </film>
            <film title="MET Opera 2019-20: Turandot" rating="TBC" url="films/met-opera-2019-20-turandot" edi="274672" release="12/10/2019">
                <shows>
                    <show time="2019-10-12T17:55:00" url="https://booking.cineworld.co.uk/booking/8018/131466"/>
                </shows>
            </film>
            <film title="NT Live: A Midsummer Night's Dream" rating="12A" url="films/nt-live-a-midsummer-nights-dream" edi="274950" release="17/10/2019">
                <shows>
                    <show time="2019-10-17T19:00:00" url="https://booking.cineworld.co.uk/booking/8018/129849"/>
                </shows>
            </film>
            <film title="NT Live: Hansard" rating="15" url="films/nt-live-hansard" edi="270878" release="07/11/2019">
                <shows>
                    <show time="2019-11-07T19:00:00" url="https://booking.cineworld.co.uk/booking/8018/129850"/>
                </shows>
            </film>
            <film title="NT Live : One Man, Two Guvnors (Encore)" rating="12A" url="films/nt-live-one-man-two-guvnors-encore" edi="266343" release="26/09/2019">
                <shows>
                    <show time="2019-09-26T19:00:00" url="https://booking.cineworld.co.uk/booking/8018/127374"/>
                </shows>
            </film>
            <film title="NT Live: Present Laughter" rating="12A" url="films/nt-live-present-laughter" edi="278033" release="28/11/2019">
                <shows>
                    <show time="2019-11-28T19:00:00" url="https://booking.cineworld.co.uk/booking/8018/129851"/>
                </shows>
            </film>
            <film title="NT Live : The Lehman Trilogy" rating="12A" url="films/nt-live-the-lehman-trilogy" edi="266345" release="25/07/2019">
                <shows>
                    <show time="2019-07-25T19:00:00" url="https://booking.cineworld.co.uk/booking/8018/127373"/>
                </shows>
            </film>
            <film title="M4J Paw Patrol: Mighty Pups - The Movie" rating="U" url="films/paw-patrol-mighty-pups-movies-for-juniors" edi="801924" release="19/07/2019">
                <shows>
                    <show time="2019-07-22T10:20:00" url="https://booking.cineworld.co.uk/booking/8018/131636" audioType="audio described"/>
                    <show time="2019-07-23T10:20:00" url="https://booking.cineworld.co.uk/booking/8018/131637" audioType="audio described"/>
                    <show time="2019-07-24T10:20:00" url="https://booking.cineworld.co.uk/booking/8018/131638" audioType="audio described"/>
                    <show time="2019-07-25T10:20:00" url="https://booking.cineworld.co.uk/booking/8018/131639" audioType="audio described"/>
                </shows>
            </film>
            <film title="Placido Domingo 50th Anniversary Concert" rating="TBC" url="films/placido-domingo-50th-anniversary-concert" edi="270187" release="01/10/2019">
                <shows>
                    <show time="2019-10-01T19:00:00" url="https://booking.cineworld.co.uk/booking/8018/130431"/>
                </shows>
            </film>
            <film title="M4J Ralph Breaks The Internet: Wreck It Ralph 2" rating="PG" url="films/ralph-breaks-the-internet-wreck-it-ralph-2-movies-for-juniors" edi="801742" release="01/03/2019">
                <shows>
                    <show time="2019-07-22T10:00:00" url="https://booking.cineworld.co.uk/booking/8018/131537" audioType="audio described"/>
                    <show time="2019-07-23T10:00:00" url="https://booking.cineworld.co.uk/booking/8018/131538" audioType="audio described"/>
                    <show time="2019-07-25T10:00:00" url="https://booking.cineworld.co.uk/booking/8018/131540" audioType="audio described"/>
                </shows>
            </film>
            <film title="Rigoletto On The Lake" rating="TBC" url="films/rigoletto-on-the-lake" edi="270196" release="17/09/2019">
                <shows>
                    <show time="2019-09-17T19:00:00" url="https://booking.cineworld.co.uk/booking/8018/130430"/>
                </shows>
            </film>
            <film title="Rocketman : Sing-Along Version" rating="15" url="films/rocketman-sing-along-version" edi="263136" release="26/07/2019">
                <shows>
                    <show time="2019-07-26T19:30:00" url="https://booking.cineworld.co.uk/booking/8018/131476" audioType="audio described" subtitled="true"/>
                </shows>
            </film>
            <film title="Roger Waters  Us + Them" rating="12A" url="films/roger-waters-us-them" edi="276883" release="02/10/2019">
                <shows>
                    <show time="2019-10-02T19:30:00" url="https://booking.cineworld.co.uk/booking/8018/131673"/>
                    <show time="2019-10-06T14:30:00" url="https://booking.cineworld.co.uk/booking/8018/131674"/>
                </shows>
            </film>
            <film title="ROH Live Opera 2019 : Don Giovanni" rating="TBC" url="films/roh-live-opera-2019-don-giovanni" edi="274395" release="08/10/2019">
                <shows>
                    <show time="2019-10-08T18:45:00" url="https://booking.cineworld.co.uk/booking/8018/129526"/>
                </shows>
            </film>
            <film title="ROH Live Opera 2019 : Don Pasquale" rating="TBC" url="films/roh-live-opera-2019-don-pasquale" edi="274401" release="24/10/2019">
                <shows>
                    <show time="2019-10-24T19:30:00" url="https://booking.cineworld.co.uk/booking/8018/129527"/>
                </shows>
            </film>
            <film title="ROH Royal Ballet Live 2019 : Coppelia" rating="TBC" url="films/roh-royal-ballet-live-2019-coppelia" edi="274396" release="10/12/2019">
                <shows>
                    <show time="2019-12-10T19:15:00" url="https://booking.cineworld.co.uk/booking/8018/129529"/>
                </shows>
            </film>
            <film title="ROH Royal Ballet Live 2019 Triple Bill" rating="12A" url="films/roh-royal-ballet-live-2019-triple-bill" edi="252209" release="16/05/2019">
                <shows>
                    <show time="2019-11-05T19:15:00" url="https://booking.cineworld.co.uk/booking/8018/129528"/>
                </shows>
            </film>
            <film title="ROH Royal Ballet: The Nutckracker (2016 Recorded)" rating="TBC" url="films/roh-royal-ballet-the-nutckracker-2016-recorded" edi="277630" release="17/12/2019">
                <shows>
                    <show time="2019-12-17T19:15:00" url="https://booking.cineworld.co.uk/booking/8018/129530"/>
                </shows>
            </film>
            <film title="RSC Live : Measure For Measure" rating="12A" url="films/rsc-live-measure-for-measure" edi="263087" release="31/07/2019">
                <shows>
                    <show time="2019-07-31T19:00:00" url="https://booking.cineworld.co.uk/booking/8018/119753"/>
                </shows>
            </film>
            <film title="Secret Unlimited Screening 12" rating="15" url="films/secret-unlimited-screening-12" edi="801942" release="29/07/2019">
                <shows>
                    <show time="2019-07-29T20:00:00" url="https://booking.cineworld.co.uk/booking/8018/131134" audioType="audio described"/>
                </shows>
            </film>
            <film title="(2D) Spider-Man: Far From Home" rating="12A" url="films/spider-man-far-from-home" edi="221205" release="02/07/2019">
                <shows>
                    <show time="2019-07-22T11:40:00" url="https://booking.cineworld.co.uk/booking/8018/131569" audioType="audio described"/>
                    <show time="2019-07-22T14:40:00" url="https://booking.cineworld.co.uk/booking/8018/131570" audioType="audio described"/>
                    <show time="2019-07-22T16:40:00" url="https://booking.cineworld.co.uk/booking/8018/131580" audioType="audio described"/>
                    <show time="2019-07-22T17:40:00" url="https://booking.cineworld.co.uk/booking/8018/131555" audioType="audio described"/>
                    <show time="2019-07-22T19:40:00" url="https://booking.cineworld.co.uk/booking/8018/131586" audioType="audio described"/>
                    <show time="2019-07-22T20:40:00" url="https://booking.cineworld.co.uk/booking/8018/131556" audioType="audio described"/>
                    <show time="2019-07-23T11:40:00" url="https://booking.cineworld.co.uk/booking/8018/131571" audioType="audio described"/>
                    <show time="2019-07-23T14:40:00" url="https://booking.cineworld.co.uk/booking/8018/131572" audioType="audio described"/>
                    <show time="2019-07-23T16:40:00" url="https://booking.cineworld.co.uk/booking/8018/131581" audioType="audio described"/>
                    <show time="2019-07-23T17:40:00" url="https://booking.cineworld.co.uk/booking/8018/131557" audioType="audio described"/>
                    <show time="2019-07-23T19:40:00" url="https://booking.cineworld.co.uk/booking/8018/131587" audioType="audio described"/>
                    <show time="2019-07-23T20:40:00" url="https://booking.cineworld.co.uk/booking/8018/131558" audioType="audio described"/>
                    <show time="2019-07-24T11:40:00" url="https://booking.cineworld.co.uk/booking/8018/131573" audioType="audio described"/>
                    <show time="2019-07-24T14:40:00" url="https://booking.cineworld.co.uk/booking/8018/131574" audioType="audio described"/>
                    <show time="2019-07-24T16:40:00" url="https://booking.cineworld.co.uk/booking/8018/131582" audioType="audio described"/>
                    <show time="2019-07-24T17:40:00" url="https://booking.cineworld.co.uk/booking/8018/131559" audioType="audio described"/>
                    <show time="2019-07-24T19:40:00" url="https://booking.cineworld.co.uk/booking/8018/131588" audioType="audio described"/>
                    <show time="2019-07-24T20:40:00" url="https://booking.cineworld.co.uk/booking/8018/131560" audioType="audio described"/>
                    <show time="2019-07-25T11:40:00" url="https://booking.cineworld.co.uk/booking/8018/131575" audioType="audio described"/>
                    <show time="2019-07-25T14:40:00" url="https://booking.cineworld.co.uk/booking/8018/131576" audioType="audio described"/>
                    <show time="2019-07-25T16:15:00" url="https://booking.cineworld.co.uk/booking/8018/131668" audioType="audio described"/>
                    <show time="2019-07-25T17:40:00" url="https://booking.cineworld.co.uk/booking/8018/131561" audioType="audio described"/>
                    <show time="2019-07-25T20:40:00" url="https://booking.cineworld.co.uk/booking/8018/131562" audioType="audio described"/>
                </shows>
            </film>
            <film title="(4DX 3D) The Lion King" rating="PG" url="films/the-lion-king" edi="801933" release="19/07/2019">
                <shows>
                    <show time="2019-07-22T11:30:00" url="https://booking.cineworld.co.uk/booking/8018/130838" videoType="3d" audioType="audio described"/>
                    <show time="2019-07-22T14:30:00" url="https://booking.cineworld.co.uk/booking/8018/130839" videoType="3d" audioType="audio described"/>
                    <show time="2019-07-22T17:30:00" url="https://booking.cineworld.co.uk/booking/8018/130840" videoType="3d" audioType="audio described"/>
                    <show time="2019-07-22T20:30:00" url="https://booking.cineworld.co.uk/booking/8018/130841" videoType="3d" audioType="audio described"/>
                    <show time="2019-07-23T11:30:00" url="https://booking.cineworld.co.uk/booking/8018/130842" videoType="3d" audioType="audio described"/>
                    <show time="2019-07-23T14:30:00" url="https://booking.cineworld.co.uk/booking/8018/130843" videoType="3d" audioType="audio described"/>
                    <show time="2019-07-23T17:30:00" url="https://booking.cineworld.co.uk/booking/8018/130844" videoType="3d" audioType="audio described"/>
                    <show time="2019-07-23T20:30:00" url="https://booking.cineworld.co.uk/booking/8018/130845" videoType="3d" audioType="audio described"/>
                    <show time="2019-07-24T11:30:00" url="https://booking.cineworld.co.uk/booking/8018/130846" videoType="3d" audioType="audio described"/>
                    <show time="2019-07-24T14:30:00" url="https://booking.cineworld.co.uk/booking/8018/130847" videoType="3d" audioType="audio described"/>
                    <show time="2019-07-24T17:30:00" url="https://booking.cineworld.co.uk/booking/8018/130848" videoType="3d" audioType="audio described"/>
                    <show time="2019-07-24T20:30:00" url="https://booking.cineworld.co.uk/booking/8018/130849" videoType="3d" audioType="audio described"/>
                    <show time="2019-07-25T11:30:00" url="https://booking.cineworld.co.uk/booking/8018/131508" videoType="3d" audioType="audio described"/>
                    <show time="2019-07-25T14:30:00" url="https://booking.cineworld.co.uk/booking/8018/131509" videoType="3d" audioType="audio described"/>
                    <show time="2019-07-25T17:30:00" url="https://booking.cineworld.co.uk/booking/8018/131510" videoType="3d" audioType="audio described"/>
                </shows>
            </film>
            <film title="(2D) The Lion King" rating="PG" url="films/the-lion-king" edi="229583" release="19/07/2019">
                <shows>
                    <show time="2019-07-22T10:30:00" url="https://booking.cineworld.co.uk/booking/8018/130728" audioType="audio described"/>
                    <show time="2019-07-22T11:00:00" url="https://booking.cineworld.co.uk/booking/8018/130752" audioType="audio described"/>
                    <show time="2019-07-22T12:00:00" url="https://booking.cineworld.co.uk/booking/8018/130817" audioType="audio described"/>
                    <show time="2019-07-22T12:30:00" url="https://booking.cineworld.co.uk/booking/8018/130797" audioType="audio described"/>
                    <show time="2019-07-22T13:30:00" url="https://booking.cineworld.co.uk/booking/8018/130729" audioType="audio described"/>
                    <show time="2019-07-22T14:00:00" url="https://booking.cineworld.co.uk/booking/8018/130753" audioType="audio described"/>
                    <show time="2019-07-22T15:00:00" url="https://booking.cineworld.co.uk/booking/8018/130818" audioType="audio described"/>
                    <show time="2019-07-22T15:30:00" url="https://booking.cineworld.co.uk/booking/8018/130798" audioType="audio described"/>
                    <show time="2019-07-22T16:30:00" url="https://booking.cineworld.co.uk/booking/8018/130730" audioType="audio described"/>
                    <show time="2019-07-22T17:00:00" url="https://booking.cineworld.co.uk/booking/8018/130754" audioType="audio described"/>
                    <show time="2019-07-22T18:00:00" url="https://booking.cineworld.co.uk/booking/8018/130819" audioType="audio described" subtitled="true"/>
                    <show time="2019-07-22T18:30:00" url="https://booking.cineworld.co.uk/booking/8018/130799" audioType="audio described"/>
                    <show time="2019-07-22T19:30:00" url="https://booking.cineworld.co.uk/booking/8018/130731" audioType="audio described"/>
                    <show time="2019-07-22T20:00:00" url="https://booking.cineworld.co.uk/booking/8018/130755" audioType="audio described"/>
                    <show time="2019-07-22T21:15:00" url="https://booking.cineworld.co.uk/booking/8018/131527" audioType="audio described"/>
                    <show time="2019-07-23T10:30:00" url="https://booking.cineworld.co.uk/booking/8018/130732" audioType="audio described"/>
                    <show time="2019-07-23T11:00:00" url="https://booking.cineworld.co.uk/booking/8018/130756" audioType="audio described"/>
                    <show time="2019-07-23T12:00:00" url="https://booking.cineworld.co.uk/booking/8018/130820" audioType="audio described"/>
                    <show time="2019-07-23T12:30:00" url="https://booking.cineworld.co.uk/booking/8018/130800" audioType="audio described"/>
                    <show time="2019-07-23T13:30:00" url="https://booking.cineworld.co.uk/booking/8018/130733" audioType="audio described"/>
                    <show time="2019-07-23T14:00:00" url="https://booking.cineworld.co.uk/booking/8018/130757" audioType="audio described"/>
                    <show time="2019-07-23T15:00:00" url="https://booking.cineworld.co.uk/booking/8018/130821" audioType="audio described"/>
                    <show time="2019-07-23T15:30:00" url="https://booking.cineworld.co.uk/booking/8018/130801" audioType="audio described"/>
                    <show time="2019-07-23T16:30:00" url="https://booking.cineworld.co.uk/booking/8018/130734" audioType="audio described"/>
                    <show time="2019-07-23T17:00:00" url="https://booking.cineworld.co.uk/booking/8018/130758" audioType="audio described"/>
                    <show time="2019-07-23T18:00:00" url="https://booking.cineworld.co.uk/booking/8018/130822" audioType="audio described"/>
                    <show time="2019-07-23T18:30:00" url="https://booking.cineworld.co.uk/booking/8018/130802" audioType="audio described"/>
                    <show time="2019-07-23T19:30:00" url="https://booking.cineworld.co.uk/booking/8018/130735" audioType="audio described"/>
                    <show time="2019-07-23T20:00:00" url="https://booking.cineworld.co.uk/booking/8018/130759" audioType="audio described"/>
                    <show time="2019-07-23T21:15:00" url="https://booking.cineworld.co.uk/booking/8018/131528" audioType="audio described"/>
                    <show time="2019-07-24T09:45:00" url="https://booking.cineworld.co.uk/booking/8018/131671" audioType="audio described"/>
                    <show time="2019-07-24T10:30:00" url="https://booking.cineworld.co.uk/booking/8018/130736" audioType="audio described"/>
                    <show time="2019-07-24T11:00:00" url="https://booking.cineworld.co.uk/booking/8018/130760" audioType="audio described"/>
                    <show time="2019-07-24T12:00:00" url="https://booking.cineworld.co.uk/booking/8018/130823" audioType="audio described"/>
                    <show time="2019-07-24T12:30:00" url="https://booking.cineworld.co.uk/booking/8018/130803" audioType="audio described"/>
                    <show time="2019-07-24T13:30:00" url="https://booking.cineworld.co.uk/booking/8018/130737" audioType="audio described"/>
                    <show time="2019-07-24T14:00:00" url="https://booking.cineworld.co.uk/booking/8018/130761" audioType="audio described"/>
                    <show time="2019-07-24T15:00:00" url="https://booking.cineworld.co.uk/booking/8018/130824" audioType="audio described"/>
                    <show time="2019-07-24T15:30:00" url="https://booking.cineworld.co.uk/booking/8018/130804" audioType="audio described"/>
                    <show time="2019-07-24T16:30:00" url="https://booking.cineworld.co.uk/booking/8018/130738" audioType="audio described"/>
                    <show time="2019-07-24T17:00:00" url="https://booking.cineworld.co.uk/booking/8018/130762" audioType="audio described"/>
                    <show time="2019-07-24T18:00:00" url="https://booking.cineworld.co.uk/booking/8018/130825" audioType="audio described"/>
                    <show time="2019-07-24T18:30:00" url="https://booking.cineworld.co.uk/booking/8018/130805" audioType="audio described"/>
                    <show time="2019-07-24T19:30:00" url="https://booking.cineworld.co.uk/booking/8018/130739" audioType="audio described"/>
                    <show time="2019-07-24T20:00:00" url="https://booking.cineworld.co.uk/booking/8018/130763" audioType="audio described"/>
                    <show time="2019-07-24T21:15:00" url="https://booking.cineworld.co.uk/booking/8018/131529" audioType="audio described"/>
                    <show time="2019-07-25T10:30:00" url="https://booking.cineworld.co.uk/booking/8018/131542" audioType="audio described"/>
                    <show time="2019-07-25T11:00:00" url="https://booking.cineworld.co.uk/booking/8018/131547" audioType="audio described"/>
                    <show time="2019-07-25T12:00:00" url="https://booking.cineworld.co.uk/booking/8018/131518" audioType="audio described"/>
                    <show time="2019-07-25T12:30:00" url="https://booking.cineworld.co.uk/booking/8018/131531" audioType="audio described"/>
                    <show time="2019-07-25T13:30:00" url="https://booking.cineworld.co.uk/booking/8018/131543" audioType="audio described"/>
                    <show time="2019-07-25T14:00:00" url="https://booking.cineworld.co.uk/booking/8018/131548" audioType="audio described"/>
                    <show time="2019-07-25T15:00:00" url="https://booking.cineworld.co.uk/booking/8018/131519" audioType="audio described"/>
                    <show time="2019-07-25T15:30:00" url="https://booking.cineworld.co.uk/booking/8018/131532" audioType="audio described"/>
                    <show time="2019-07-25T16:30:00" url="https://booking.cineworld.co.uk/booking/8018/131544" audioType="audio described"/>
                    <show time="2019-07-25T17:00:00" url="https://booking.cineworld.co.uk/booking/8018/131545" audioType="audio described"/>
                    <show time="2019-07-25T18:00:00" url="https://booking.cineworld.co.uk/booking/8018/131516" audioType="audio described"/>
                    <show time="2019-07-25T18:30:00" url="https://booking.cineworld.co.uk/booking/8018/131530" audioType="audio described"/>
                    <show time="2019-07-25T19:40:00" url="https://booking.cineworld.co.uk/booking/8018/131541" audioType="audio described"/>
                    <show time="2019-07-25T20:10:00" url="https://booking.cineworld.co.uk/booking/8018/131546" audioType="audio described"/>
                    <show time="2019-07-25T20:50:00" url="https://booking.cineworld.co.uk/booking/8018/131517" audioType="audio described"/>
                </shows>
            </film>
            <film title="(3D) The Lion King" rating="PG" url="films/the-lion-king" edi="229584" release="19/07/2019">
                <shows>
                    <show time="2019-07-22T10:00:00" url="https://booking.cineworld.co.uk/booking/8018/130776" videoType="3d" audioType="audio described"/>
                    <show time="2019-07-22T13:00:00" url="https://booking.cineworld.co.uk/booking/8018/130777" videoType="3d" audioType="audio described"/>
                    <show time="2019-07-22T16:00:00" url="https://booking.cineworld.co.uk/booking/8018/130778" videoType="3d" audioType="audio described"/>
                    <show time="2019-07-22T19:00:00" url="https://booking.cineworld.co.uk/booking/8018/130779" videoType="3d" audioType="audio described"/>
                    <show time="2019-07-23T10:00:00" url="https://booking.cineworld.co.uk/booking/8018/130780" videoType="3d" audioType="audio described"/>
                    <show time="2019-07-23T13:00:00" url="https://booking.cineworld.co.uk/booking/8018/130781" videoType="3d" audioType="audio described"/>
                    <show time="2019-07-23T16:00:00" url="https://booking.cineworld.co.uk/booking/8018/130782" videoType="3d" audioType="audio described"/>
                    <show time="2019-07-23T19:00:00" url="https://booking.cineworld.co.uk/booking/8018/130783" videoType="3d" audioType="audio described"/>
                    <show time="2019-07-24T10:00:00" url="https://booking.cineworld.co.uk/booking/8018/130784" videoType="3d" audioType="audio described"/>
                    <show time="2019-07-24T13:00:00" url="https://booking.cineworld.co.uk/booking/8018/130785" videoType="3d" audioType="audio described"/>
                    <show time="2019-07-24T16:00:00" url="https://booking.cineworld.co.uk/booking/8018/130786" videoType="3d" audioType="audio described"/>
                    <show time="2019-07-24T19:00:00" url="https://booking.cineworld.co.uk/booking/8018/130787" videoType="3d" audioType="audio described"/>
                    <show time="2019-07-25T10:00:00" url="https://booking.cineworld.co.uk/booking/8018/131662" videoType="3d" audioType="audio described"/>
                    <show time="2019-07-25T13:00:00" url="https://booking.cineworld.co.uk/booking/8018/131663" videoType="3d" audioType="audio described"/>
                    <show time="2019-07-25T16:00:00" url="https://booking.cineworld.co.uk/booking/8018/131664" videoType="3d" audioType="audio described"/>
                    <show time="2019-07-25T19:10:00" url="https://booking.cineworld.co.uk/booking/8018/131669" videoType="3d" audioType="audio described"/>
                </shows>
            </film>
            <film title="The Matrix : 20th Anniversary (4K Restoration)" rating="15" url="films/the-matrix-20th-anniversary-4k-restoration" edi="105580" release="13/07/2019">
                <shows>
                    <show time="2019-07-30T20:00:00" url="https://booking.cineworld.co.uk/booking/8018/131672"/>
                </shows>
            </film>
            <film title="(2D) Toy Story 4" rating="U" url="films/toy-story-4" edi="148687" release="21/06/2019">
                <shows>
                    <show time="2019-07-22T10:00:00" url="https://booking.cineworld.co.uk/booking/8018/131650" audioType="audio described"/>
                    <show time="2019-07-22T11:20:00" url="https://booking.cineworld.co.uk/booking/8018/131596" audioType="audio described"/>
                    <show time="2019-07-22T12:20:00" url="https://booking.cineworld.co.uk/booking/8018/131611" audioType="audio described"/>
                    <show time="2019-07-22T13:50:00" url="https://booking.cineworld.co.uk/booking/8018/131597" audioType="audio described"/>
                    <show time="2019-07-22T14:50:00" url="https://booking.cineworld.co.uk/booking/8018/131612" audioType="audio described"/>
                    <show time="2019-07-22T17:20:00" url="https://booking.cineworld.co.uk/booking/8018/131625" audioType="audio described"/>
                    <show time="2019-07-22T19:50:00" url="https://booking.cineworld.co.uk/booking/8018/131626" audioType="audio described"/>
                    <show time="2019-07-23T10:00:00" url="https://booking.cineworld.co.uk/booking/8018/131651" audioType="audio described"/>
                    <show time="2019-07-23T11:20:00" url="https://booking.cineworld.co.uk/booking/8018/131598" audioType="audio described"/>
                    <show time="2019-07-23T12:20:00" url="https://booking.cineworld.co.uk/booking/8018/131613" audioType="audio described"/>
                    <show time="2019-07-23T13:50:00" url="https://booking.cineworld.co.uk/booking/8018/131599" audioType="audio described"/>
                    <show time="2019-07-23T14:50:00" url="https://booking.cineworld.co.uk/booking/8018/131614" audioType="audio described"/>
                    <show time="2019-07-23T17:20:00" url="https://booking.cineworld.co.uk/booking/8018/131627" audioType="audio described"/>
                    <show time="2019-07-23T19:50:00" url="https://booking.cineworld.co.uk/booking/8018/131628" audioType="audio described"/>
                    <show time="2019-07-24T10:00:00" url="https://booking.cineworld.co.uk/booking/8018/131652" audioType="audio described"/>
                    <show time="2019-07-24T11:20:00" url="https://booking.cineworld.co.uk/booking/8018/131600" audioType="audio described"/>
                    <show time="2019-07-24T12:20:00" url="https://booking.cineworld.co.uk/booking/8018/131615" audioType="audio described"/>
                    <show time="2019-07-24T13:50:00" url="https://booking.cineworld.co.uk/booking/8018/131601" audioType="audio described"/>
                    <show time="2019-07-24T14:50:00" url="https://booking.cineworld.co.uk/booking/8018/131616" audioType="audio described"/>
                    <show time="2019-07-24T17:20:00" url="https://booking.cineworld.co.uk/booking/8018/131629" audioType="audio described"/>
                    <show time="2019-07-24T19:50:00" url="https://booking.cineworld.co.uk/booking/8018/131630" audioType="audio described"/>
                    <show time="2019-07-25T10:00:00" url="https://booking.cineworld.co.uk/booking/8018/131653" audioType="audio described"/>
                    <show time="2019-07-25T11:20:00" url="https://booking.cineworld.co.uk/booking/8018/131666" audioType="audio described"/>
                    <show time="2019-07-25T12:20:00" url="https://booking.cineworld.co.uk/booking/8018/131617" audioType="audio described"/>
                    <show time="2019-07-25T13:50:00" url="https://booking.cineworld.co.uk/booking/8018/131667" audioType="audio described"/>
                    <show time="2019-07-25T14:50:00" url="https://booking.cineworld.co.uk/booking/8018/131618" audioType="audio described"/>
                    <show time="2019-07-25T17:20:00" url="https://booking.cineworld.co.uk/booking/8018/131631" audioType="audio described"/>
                    <show time="2019-07-25T19:50:00" url="https://booking.cineworld.co.uk/booking/8018/131632" audioType="audio described"/>
                </shows>
            </film>
            <film title="Wise Children" rating="15" url="films/wise-children" edi="273976" release="03/10/2019">
                <shows>
                    <show time="2019-10-03T14:00:00" url="https://booking.cineworld.co.uk/booking/8018/128840"/>
                    <show time="2019-10-03T19:00:00" url="https://booking.cineworld.co.uk/booking/8018/128841"/>
                </shows>
            </film>
            <film title="Withnail &amp; I (Re: 2014)" rating="15" url="films/withnail-i-re-2014" edi="164434" release="03/09/2019">
                <shows>
                    <show time="2019-09-03T20:00:00" url="https://booking.cineworld.co.uk/booking/8018/129854" audioType="audio described"/>
                </shows>
            </film>
            <film title="Yesterday" rating="12A" url="films/yesterday" edi="253917" release="28/06/2019">
                <shows>
                    <show time="2019-07-22T14:15:00" url="https://booking.cineworld.co.uk/booking/8018/131489" audioType="audio described"/>
                    <show time="2019-07-22T20:00:00" url="https://booking.cineworld.co.uk/booking/8018/131500" audioType="audio described"/>
                    <show time="2019-07-23T14:15:00" url="https://booking.cineworld.co.uk/booking/8018/131490" audioType="audio described"/>
                    <show time="2019-07-23T20:00:00" url="https://booking.cineworld.co.uk/booking/8018/131502" audioType="audio described"/>
                    <show time="2019-07-24T14:15:00" url="https://booking.cineworld.co.uk/booking/8018/131491" audioType="audio described"/>
                    <show time="2019-07-24T20:00:00" url="https://booking.cineworld.co.uk/booking/8018/131504" audioType="audio described"/>
                    <show time="2019-07-25T14:15:00" url="https://booking.cineworld.co.uk/booking/8018/131492" audioType="audio described"/>
                    <show time="2019-07-25T20:00:00" url="https://booking.cineworld.co.uk/booking/8018/131506" audioType="audio described"/>
                </shows>
            </film>
        </listing>
    </cinema>
    <cinema name="Cineworld Aldershot" root="http://www1.cineworld.co.uk/" url="cinemas/aldershot" id="87" phone="0871 200 2000" address="Westgate, Aldershot" postcode="GU11 1WG">
        <listing>
            <film title="Andre Rieu 2019 Maastricht Concert Shall We Dance?" rating="PG" url="films/andre-rieu-2019-maastricht-concert-shall-we-dance" edi="255443" release="27/07/2019">
                <shows>
                    <show time="2019-07-27T19:00:00" url="https://booking.cineworld.co.uk/booking/8015/76841"/>
                    <show time="2019-07-28T15:00:00" url="https://booking.cineworld.co.uk/booking/8015/76842"/>
                </shows>
            </film>
            <film title="Annabelle Comes Home" rating="15" url="films/annabelle-comes-home" edi="250924" release="10/07/2019">
                <shows>
                    <show time="2019-07-22T20:50:00" url="https://booking.cineworld.co.uk/booking/8015/81696" audioType="audio described"/>
                    <show time="2019-07-23T20:50:00" url="https://booking.cineworld.co.uk/booking/8015/81697" audioType="audio described"/>
                    <show time="2019-07-24T20:50:00" url="https://booking.cineworld.co.uk/booking/8015/81698" audioType="audio described"/>
                    <show time="2019-07-25T20:50:00" url="https://booking.cineworld.co.uk/booking/8015/81699" audioType="audio described"/>
                </shows>
            </film>
            <film title="Autism Friendly Screening: The Lion King (2019)" rating="PG" url="films/autism-friendly-screening-the-lion-king-2019" edi="801945" release="19/07/2019">
                <shows>
                    <show time="2019-08-04T11:00:00" url="https://booking.cineworld.co.uk/booking/8015/81463" audioType="audio described"/>
                </shows>
            </film>
            <film title="Dracula - Northern Ballet Live" rating="12A" url="films/dracula-northern-ballet-live" edi="270199" release="31/10/2019">
                <shows>
                    <show time="2019-10-31T19:30:00" url="https://booking.cineworld.co.uk/booking/8015/76828"/>
                </shows>
            </film>
            <film title="Fast &amp; Furious: Hobbs &amp; Shaw" rating="TBC" url="films/fast-furious-hobbs-shaw" edi="240260" release="02/08/2019">
                <shows>
                    <show time="2019-08-01T20:00:00" url="https://booking.cineworld.co.uk/booking/8015/80486" audioType="audio described"/>
                    <show time="2019-08-02T20:00:00" url="https://booking.cineworld.co.uk/booking/8015/80487" audioType="audio described"/>
                    <show time="2019-08-03T20:00:00" url="https://booking.cineworld.co.uk/booking/8015/80488" audioType="audio described"/>
                    <show time="2019-08-04T20:00:00" url="https://booking.cineworld.co.uk/booking/8015/80489" audioType="audio described"/>
                </shows>
            </film>
            <film title="Margaret Atwood : Live In Cinemas" rating="12A" url="films/margaret-atwood-live-in-cinemas" edi="272858" release="10/09/2019">
                <shows>
                    <show time="2019-09-10T19:30:00" url="https://booking.cineworld.co.uk/booking/8015/78083"/>
                </shows>
            </film>
            <film title="NT Live: A Midsummer Night's Dream" rating="12A" url="films/nt-live-a-midsummer-nights-dream" edi="274950" release="17/10/2019">
                <shows>
                    <show time="2019-10-17T19:00:00" url="https://booking.cineworld.co.uk/booking/8015/80660"/>
                </shows>
            </film>
            <film title="NT Live: Hansard" rating="15" url="films/nt-live-hansard" edi="270878" release="07/11/2019">
                <shows>
                    <show time="2019-11-07T19:00:00" url="https://booking.cineworld.co.uk/booking/8015/80661"/>
                </shows>
            </film>
            <film title="NT Live : One Man, Two Guvnors (Encore)" rating="12A" url="films/nt-live-one-man-two-guvnors-encore" edi="266343" release="26/09/2019">
                <shows>
                    <show time="2019-09-26T19:00:00" url="https://booking.cineworld.co.uk/booking/8015/79111"/>
                </shows>
            </film>
            <film title="NT Live: Present Laughter" rating="12A" url="films/nt-live-present-laughter" edi="278033" release="28/11/2019">
                <shows>
                    <show time="2019-11-28T19:00:00" url="https://booking.cineworld.co.uk/booking/8015/80662"/>
                </shows>
            </film>
            <film title="NT Live : The Lehman Trilogy" rating="12A" url="films/nt-live-the-lehman-trilogy" edi="266345" release="25/07/2019">
                <shows>
                    <show time="2019-07-25T19:00:00" url="https://booking.cineworld.co.uk/booking/8015/79099"/>
                </shows>
            </film>
            <film title="M4J Paw Patrol: Mighty Pups - The Movie" rating="U" url="films/paw-patrol-mighty-pups-movies-for-juniors" edi="801924" release="19/07/2019">
                <shows>
                    <show time="2019-07-22T10:20:00" url="https://booking.cineworld.co.uk/booking/8015/81757" audioType="audio described"/>
                    <show time="2019-07-23T10:20:00" url="https://booking.cineworld.co.uk/booking/8015/81758" audioType="audio described"/>
                    <show time="2019-07-24T10:20:00" url="https://booking.cineworld.co.uk/booking/8015/81759" audioType="audio described"/>
                    <show time="2019-07-25T10:20:00" url="https://booking.cineworld.co.uk/booking/8015/81760" audioType="audio described"/>
                </shows>
            </film>
            <film title="Placido Domingo 50th Anniversary Concert" rating="TBC" url="films/placido-domingo-50th-anniversary-concert" edi="270187" release="01/10/2019">
                <shows>
                    <show time="2019-10-01T19:00:00" url="https://booking.cineworld.co.uk/booking/8015/81000"/>
                </shows>
            </film>
            <film title="Rigoletto On The Lake" rating="TBC" url="films/rigoletto-on-the-lake" edi="270196" release="17/09/2019">
                <shows>
                    <show time="2019-09-17T19:00:00" url="https://booking.cineworld.co.uk/booking/8015/80999"/>
                </shows>
            </film>
            <film title="Rocketman : Sing-Along Version" rating="15" url="films/rocketman-sing-along-version" edi="263136" release="26/07/2019">
                <shows>
                    <show time="2019-07-26T19:30:00" url="https://booking.cineworld.co.uk/booking/8015/81647" audioType="audio described" subtitled="true"/>
                </shows>
            </film>
            <film title="Roger Waters  Us + Them" rating="12A" url="films/roger-waters-us-them" edi="276883" release="02/10/2019">
                <shows>
                    <show time="2019-10-02T19:30:00" url="https://booking.cineworld.co.uk/booking/8015/81762"/>
                </shows>
            </film>
            <film title="ROH Live Opera 2019 : Don Giovanni" rating="TBC" url="films/roh-live-opera-2019-don-giovanni" edi="274395" release="08/10/2019">
                <shows>
                    <show time="2019-10-08T18:45:00" url="https://booking.cineworld.co.uk/booking/8015/80460"/>
                </shows>
            </film>
            <film title="ROH Live Opera 2019 : Don Pasquale" rating="TBC" url="films/roh-live-opera-2019-don-pasquale" edi="274401" release="24/10/2019">
                <shows>
                    <show time="2019-10-24T19:30:00" url="https://booking.cineworld.co.uk/booking/8015/80461"/>
                </shows>
            </film>
            <film title="ROH Royal Ballet Live 2019 : Coppelia" rating="TBC" url="films/roh-royal-ballet-live-2019-coppelia" edi="274396" release="10/12/2019">
                <shows>
                    <show time="2019-12-10T19:15:00" url="https://booking.cineworld.co.uk/booking/8015/80463"/>
                </shows>
            </film>
            <film title="ROH Royal Ballet Live 2019 : Triple Bill" rating="TBC" url="films/roh-royal-ballet-live-2019-triple-bill" edi="274399" release="05/11/2019">
                <shows>
                    <show time="2019-11-05T19:15:00" url="https://booking.cineworld.co.uk/booking/8015/80462"/>
                </shows>
            </film>
            <film title="ROH Royal Ballet: The Nutckracker (2016 Recorded)" rating="TBC" url="films/roh-royal-ballet-the-nutckracker-2016-recorded" edi="277630" release="17/12/2019">
                <shows>
                    <show time="2019-12-17T19:15:00" url="https://booking.cineworld.co.uk/booking/8015/80464"/>
                </shows>
            </film>
            <film title="RSC Live : Measure For Measure" rating="12A" url="films/rsc-live-measure-for-measure" edi="263087" release="31/07/2019">
                <shows>
                    <show time="2019-07-31T19:00:00" url="https://booking.cineworld.co.uk/booking/8015/74272"/>
                </shows>
            </film>
            <film title="Secret Unlimited Screening 12" rating="15" url="films/secret-unlimited-screening-12" edi="801942" release="29/07/2019">
                <shows>
                    <show time="2019-07-29T20:00:00" url="https://booking.cineworld.co.uk/booking/8015/81461" audioType="audio described"/>
                    <show time="2019-07-29T20:10:00" url="https://booking.cineworld.co.uk/booking/8015/81763" audioType="audio described"/>
                </shows>
            </film>
            <film title="(2D) Spider-Man: Far From Home" rating="12A" url="films/spider-man-far-from-home" edi="221205" release="02/07/2019">
                <shows>
                    <show time="2019-07-22T11:10:00" url="https://booking.cineworld.co.uk/booking/8015/81726" audioType="audio described"/>
                    <show time="2019-07-22T14:10:00" url="https://booking.cineworld.co.uk/booking/8015/81727" audioType="audio described"/>
                    <show time="2019-07-22T17:20:00" url="https://booking.cineworld.co.uk/booking/8015/81728" audioType="audio described"/>
                    <show time="2019-07-22T20:20:00" url="https://booking.cineworld.co.uk/booking/8015/81729" audioType="audio described"/>
                    <show time="2019-07-23T11:10:00" url="https://booking.cineworld.co.uk/booking/8015/81730" audioType="audio described"/>
                    <show time="2019-07-23T14:10:00" url="https://booking.cineworld.co.uk/booking/8015/81731" audioType="audio described"/>
                    <show time="2019-07-23T17:20:00" url="https://booking.cineworld.co.uk/booking/8015/81732" audioType="audio described"/>
                    <show time="2019-07-23T20:20:00" url="https://booking.cineworld.co.uk/booking/8015/81733" audioType="audio described"/>
                    <show time="2019-07-24T11:10:00" url="https://booking.cineworld.co.uk/booking/8015/81734" audioType="audio described"/>
                    <show time="2019-07-24T14:10:00" url="https://booking.cineworld.co.uk/booking/8015/81735" audioType="audio described"/>
                    <show time="2019-07-24T17:20:00" url="https://booking.cineworld.co.uk/booking/8015/81736" audioType="audio described"/>
                    <show time="2019-07-24T20:20:00" url="https://booking.cineworld.co.uk/booking/8015/81737" audioType="audio described"/>
                    <show time="2019-07-25T11:10:00" url="https://booking.cineworld.co.uk/booking/8015/81738" audioType="audio described"/>
                    <show time="2019-07-25T14:10:00" url="https://booking.cineworld.co.uk/booking/8015/81739" audioType="audio described"/>
                    <show time="2019-07-25T17:20:00" url="https://booking.cineworld.co.uk/booking/8015/81740" audioType="audio described" subtitled="true"/>
                    <show time="2019-07-25T20:20:00" url="https://booking.cineworld.co.uk/booking/8015/81741" audioType="audio described"/>
                </shows>
            </film>
            <film title="(2D) The Lion King" rating="PG" url="films/the-lion-king" edi="229583" release="19/07/2019">
                <shows>
                    <show time="2019-07-22T10:10:00" url="https://booking.cineworld.co.uk/booking/8015/81223" audioType="audio described"/>
                    <show time="2019-07-22T11:30:00" url="https://booking.cineworld.co.uk/booking/8015/81227" audioType="audio described"/>
                    <show time="2019-07-22T12:10:00" url="https://booking.cineworld.co.uk/booking/8015/81231" audioType="audio described"/>
                    <show time="2019-07-22T13:00:00" url="https://booking.cineworld.co.uk/booking/8015/81224" audioType="audio described"/>
                    <show time="2019-07-22T14:20:00" url="https://booking.cineworld.co.uk/booking/8015/81228" audioType="audio described"/>
                    <show time="2019-07-22T15:00:00" url="https://booking.cineworld.co.uk/booking/8015/81232" audioType="audio described"/>
                    <show time="2019-07-22T15:50:00" url="https://booking.cineworld.co.uk/booking/8015/81225" audioType="audio described"/>
                    <show time="2019-07-22T17:10:00" url="https://booking.cineworld.co.uk/booking/8015/81229" audioType="audio described"/>
                    <show time="2019-07-22T17:50:00" url="https://booking.cineworld.co.uk/booking/8015/81233" audioType="audio described" subtitled="true"/>
                    <show time="2019-07-22T18:40:00" url="https://booking.cineworld.co.uk/booking/8015/81226" audioType="audio described"/>
                    <show time="2019-07-22T20:00:00" url="https://booking.cineworld.co.uk/booking/8015/81230" audioType="audio described"/>
                    <show time="2019-07-22T20:40:00" url="https://booking.cineworld.co.uk/booking/8015/81234" audioType="audio described"/>
                    <show time="2019-07-23T10:10:00" url="https://booking.cineworld.co.uk/booking/8015/81239" audioType="audio described"/>
                    <show time="2019-07-23T11:30:00" url="https://booking.cineworld.co.uk/booking/8015/81243" audioType="audio described"/>
                    <show time="2019-07-23T12:10:00" url="https://booking.cineworld.co.uk/booking/8015/81247" audioType="audio described"/>
                    <show time="2019-07-23T13:00:00" url="https://booking.cineworld.co.uk/booking/8015/81240" audioType="audio described"/>
                    <show time="2019-07-23T14:20:00" url="https://booking.cineworld.co.uk/booking/8015/81244" audioType="audio described"/>
                    <show time="2019-07-23T15:00:00" url="https://booking.cineworld.co.uk/booking/8015/81248" audioType="audio described"/>
                    <show time="2019-07-23T15:50:00" url="https://booking.cineworld.co.uk/booking/8015/81241" audioType="audio described"/>
                    <show time="2019-07-23T17:10:00" url="https://booking.cineworld.co.uk/booking/8015/81245" audioType="audio described"/>
                    <show time="2019-07-23T17:50:00" url="https://booking.cineworld.co.uk/booking/8015/81249" audioType="audio described"/>
                    <show time="2019-07-23T18:40:00" url="https://booking.cineworld.co.uk/booking/8015/81242" audioType="audio described"/>
                    <show time="2019-07-23T20:00:00" url="https://booking.cineworld.co.uk/booking/8015/81246" audioType="audio described"/>
                    <show time="2019-07-23T20:40:00" url="https://booking.cineworld.co.uk/booking/8015/81250" audioType="audio described"/>
                    <show time="2019-07-24T10:10:00" url="https://booking.cineworld.co.uk/booking/8015/81255" audioType="audio described"/>
                    <show time="2019-07-24T11:30:00" url="https://booking.cineworld.co.uk/booking/8015/81259" audioType="audio described"/>
                    <show time="2019-07-24T12:10:00" url="https://booking.cineworld.co.uk/booking/8015/81263" audioType="audio described"/>
                    <show time="2019-07-24T13:00:00" url="https://booking.cineworld.co.uk/booking/8015/81256" audioType="audio described"/>
                    <show time="2019-07-24T14:20:00" url="https://booking.cineworld.co.uk/booking/8015/81260" audioType="audio described"/>
                    <show time="2019-07-24T15:00:00" url="https://booking.cineworld.co.uk/booking/8015/81264" audioType="audio described"/>
                    <show time="2019-07-24T15:50:00" url="https://booking.cineworld.co.uk/booking/8015/81257" audioType="audio described"/>
                    <show time="2019-07-24T17:10:00" url="https://booking.cineworld.co.uk/booking/8015/81261" audioType="audio described"/>
                    <show time="2019-07-24T17:50:00" url="https://booking.cineworld.co.uk/booking/8015/81265" audioType="audio described"/>
                    <show time="2019-07-24T18:40:00" url="https://booking.cineworld.co.uk/booking/8015/81258" audioType="audio described"/>
                    <show time="2019-07-24T20:00:00" url="https://booking.cineworld.co.uk/booking/8015/81262" audioType="audio described"/>
                    <show time="2019-07-24T20:40:00" url="https://booking.cineworld.co.uk/booking/8015/81266" audioType="audio described"/>
                    <show time="2019-07-25T10:10:00" url="https://booking.cineworld.co.uk/booking/8015/81648" audioType="audio described"/>
                    <show time="2019-07-25T11:30:00" url="https://booking.cineworld.co.uk/booking/8015/81746" audioType="audio described"/>
                    <show time="2019-07-25T12:10:00" url="https://booking.cineworld.co.uk/booking/8015/81750" audioType="audio described"/>
                    <show time="2019-07-25T13:00:00" url="https://booking.cineworld.co.uk/booking/8015/81649" audioType="audio described"/>
                    <show time="2019-07-25T14:20:00" url="https://booking.cineworld.co.uk/booking/8015/81747" audioType="audio described"/>
                    <show time="2019-07-25T15:00:00" url="https://booking.cineworld.co.uk/booking/8015/81751" audioType="audio described"/>
                    <show time="2019-07-25T15:50:00" url="https://booking.cineworld.co.uk/booking/8015/81650" audioType="audio described"/>
                    <show time="2019-07-25T17:10:00" url="https://booking.cineworld.co.uk/booking/8015/81748" audioType="audio described"/>
                    <show time="2019-07-25T17:50:00" url="https://booking.cineworld.co.uk/booking/8015/81752" audioType="audio described"/>
                    <show time="2019-07-25T20:00:00" url="https://booking.cineworld.co.uk/booking/8015/81749" audioType="audio described"/>
                    <show time="2019-07-25T20:40:00" url="https://booking.cineworld.co.uk/booking/8015/81753" audioType="audio described"/>
                </shows>
            </film>
            <film title="(3D) The Lion King" rating="PG" url="films/the-lion-king" edi="229584" release="19/07/2019">
                <shows>
                    <show time="2019-07-22T10:50:00" url="https://booking.cineworld.co.uk/booking/8015/81275" videoType="3d" audioType="audio described"/>
                    <show time="2019-07-22T13:40:00" url="https://booking.cineworld.co.uk/booking/8015/81276" videoType="3d" audioType="audio described"/>
                    <show time="2019-07-22T16:30:00" url="https://booking.cineworld.co.uk/booking/8015/81277" videoType="3d" audioType="audio described"/>
                    <show time="2019-07-22T19:20:00" url="https://booking.cineworld.co.uk/booking/8015/81278" videoType="3d" audioType="audio described"/>
                    <show time="2019-07-23T10:50:00" url="https://booking.cineworld.co.uk/booking/8015/81279" videoType="3d" audioType="audio described"/>
                    <show time="2019-07-23T13:40:00" url="https://booking.cineworld.co.uk/booking/8015/81280" videoType="3d" audioType="audio described"/>
                    <show time="2019-07-23T16:30:00" url="https://booking.cineworld.co.uk/booking/8015/81281" videoType="3d" audioType="audio described"/>
                    <show time="2019-07-23T19:20:00" url="https://booking.cineworld.co.uk/booking/8015/81282" videoType="3d" audioType="audio described"/>
                    <show time="2019-07-24T10:50:00" url="https://booking.cineworld.co.uk/booking/8015/81283" videoType="3d" audioType="audio described"/>
                    <show time="2019-07-24T13:40:00" url="https://booking.cineworld.co.uk/booking/8015/81284" videoType="3d" audioType="audio described"/>
                    <show time="2019-07-24T16:30:00" url="https://booking.cineworld.co.uk/booking/8015/81285" videoType="3d" audioType="audio described"/>
                    <show time="2019-07-24T19:20:00" url="https://booking.cineworld.co.uk/booking/8015/81286" videoType="3d" audioType="audio described"/>
                    <show time="2019-07-25T10:50:00" url="https://booking.cineworld.co.uk/booking/8015/81687" videoType="3d" audioType="audio described"/>
                    <show time="2019-07-25T13:40:00" url="https://booking.cineworld.co.uk/booking/8015/81688" videoType="3d" audioType="audio described"/>
                    <show time="2019-07-25T16:30:00" url="https://booking.cineworld.co.uk/booking/8015/81689" videoType="3d" audioType="audio described"/>
                    <show time="2019-07-25T19:20:00" url="https://booking.cineworld.co.uk/booking/8015/81690" videoType="3d" audioType="audio described"/>
                </shows>
            </film>
            <film title="The Matrix : 20th Anniversary (4K Restoration)" rating="15" url="films/the-matrix-20th-anniversary-4k-restoration" edi="105580" release="13/07/2019">
                <shows>
                    <show time="2019-07-30T20:00:00" url="https://booking.cineworld.co.uk/booking/8015/81761" audioType="audio described"/>
                </shows>
            </film>
            <film title="(2D) Toy Story 4" rating="U" url="films/toy-story-4" edi="148687" release="21/06/2019">
                <shows>
                    <show time="2019-07-22T10:20:00" url="https://booking.cineworld.co.uk/booking/8015/81681" audioType="audio described"/>
                    <show time="2019-07-22T11:50:00" url="https://booking.cineworld.co.uk/booking/8015/81663" audioType="audio described"/>
                    <show time="2019-07-22T12:50:00" url="https://booking.cineworld.co.uk/booking/8015/81682" audioType="audio described"/>
                    <show time="2019-07-22T14:30:00" url="https://booking.cineworld.co.uk/booking/8015/81664" audioType="audio described"/>
                    <show time="2019-07-22T17:00:00" url="https://booking.cineworld.co.uk/booking/8015/81665" audioType="audio described"/>
                    <show time="2019-07-22T19:40:00" url="https://booking.cineworld.co.uk/booking/8015/81666" audioType="audio described"/>
                    <show time="2019-07-23T10:20:00" url="https://booking.cineworld.co.uk/booking/8015/81683" audioType="audio described"/>
                    <show time="2019-07-23T11:50:00" url="https://booking.cineworld.co.uk/booking/8015/81667" audioType="audio described"/>
                    <show time="2019-07-23T12:50:00" url="https://booking.cineworld.co.uk/booking/8015/81684" audioType="audio described"/>
                    <show time="2019-07-23T14:30:00" url="https://booking.cineworld.co.uk/booking/8015/81668" audioType="audio described"/>
                    <show time="2019-07-23T17:00:00" url="https://booking.cineworld.co.uk/booking/8015/81669" audioType="audio described"/>
                    <show time="2019-07-23T19:40:00" url="https://booking.cineworld.co.uk/booking/8015/81670" audioType="audio described"/>
                    <show time="2019-07-24T10:20:00" url="https://booking.cineworld.co.uk/booking/8015/81685" audioType="audio described"/>
                    <show time="2019-07-24T11:50:00" url="https://booking.cineworld.co.uk/booking/8015/81671" audioType="audio described"/>
                    <show time="2019-07-24T12:50:00" url="https://booking.cineworld.co.uk/booking/8015/81686" audioType="audio described"/>
                    <show time="2019-07-24T14:30:00" url="https://booking.cineworld.co.uk/booking/8015/81672" audioType="audio described"/>
                    <show time="2019-07-24T17:00:00" url="https://booking.cineworld.co.uk/booking/8015/81673" audioType="audio described"/>
                    <show time="2019-07-24T19:40:00" url="https://booking.cineworld.co.uk/booking/8015/81674" audioType="audio described"/>
                    <show time="2019-07-25T10:20:00" url="https://booking.cineworld.co.uk/booking/8015/81691" audioType="audio described"/>
                    <show time="2019-07-25T11:50:00" url="https://booking.cineworld.co.uk/booking/8015/81742" audioType="audio described"/>
                    <show time="2019-07-25T12:50:00" url="https://booking.cineworld.co.uk/booking/8015/81692" audioType="audio described"/>
                    <show time="2019-07-25T14:30:00" url="https://booking.cineworld.co.uk/booking/8015/81743" audioType="audio described"/>
                    <show time="2019-07-25T17:00:00" url="https://booking.cineworld.co.uk/booking/8015/81744" audioType="audio described"/>
                    <show time="2019-07-25T19:40:00" url="https://booking.cineworld.co.uk/booking/8015/81745" audioType="audio described"/>
                </shows>
            </film>
            <film title="Yesterday" rating="12A" url="films/yesterday" edi="253917" release="28/06/2019">
                <shows>
                    <show time="2019-07-22T15:20:00" url="https://booking.cineworld.co.uk/booking/8015/81706" audioType="audio described"/>
                    <show time="2019-07-22T18:10:00" url="https://booking.cineworld.co.uk/booking/8015/81707" audioType="audio described"/>
                    <show time="2019-07-23T15:20:00" url="https://booking.cineworld.co.uk/booking/8015/81708" audioType="audio described"/>
                    <show time="2019-07-23T18:10:00" url="https://booking.cineworld.co.uk/booking/8015/81709" audioType="audio described"/>
                    <show time="2019-07-24T15:20:00" url="https://booking.cineworld.co.uk/booking/8015/81710" audioType="audio described"/>
                    <show time="2019-07-24T18:10:00" url="https://booking.cineworld.co.uk/booking/8015/81711" audioType="audio described"/>
                    <show time="2019-07-25T15:20:00" url="https://booking.cineworld.co.uk/booking/8015/81712" audioType="audio described"/>
                    <show time="2019-07-25T18:10:00" url="https://booking.cineworld.co.uk/booking/8015/81713" audioType="audio described"/>
                </shows>
            </film>
        </listing>
    </cinema>
    <cinema name="Cineworld Ashford" root="http://www1.cineworld.co.uk/" url="cinemas/ashford" id="12" phone="0871 200 2000" address="Eureka Entertainment Centre , Rutherford Road, Ashford" postcode="TN25 4BN">
        <listing>
            <film title="(2D) Aladdin" rating="PG" url="films/aladdin" edi="205737" release="24/05/2019">
                <shows>
                    <show time="2019-07-22T10:30:00" url="https://booking.cineworld.co.uk/booking/8016/146679" audioType="audio described"/>
                    <show time="2019-07-23T10:30:00" url="https://booking.cineworld.co.uk/booking/8016/146680" audioType="audio described"/>
                    <show time="2019-07-24T10:30:00" url="https://booking.cineworld.co.uk/booking/8016/146681" audioType="audio described"/>
                    <show time="2019-07-25T10:30:00" url="https://booking.cineworld.co.uk/booking/8016/146682" audioType="audio described"/>
                </shows>
            </film>
            <film title="Andre Rieu 2019 Maastricht Concert Shall We Dance?" rating="PG" url="films/andre-rieu-2019-maastricht-concert-shall-we-dance" edi="255443" release="27/07/2019">
                <shows>
                    <show time="2019-07-27T19:00:00" url="https://booking.cineworld.co.uk/booking/8016/138352"/>
                    <show time="2019-07-28T15:00:00" url="https://booking.cineworld.co.uk/booking/8016/138353"/>
                </shows>
            </film>
            <film title="Annabelle Comes Home" rating="15" url="films/annabelle-comes-home" edi="250924" release="10/07/2019">
                <shows>
                    <show time="2019-07-22T13:30:00" url="https://booking.cineworld.co.uk/booking/8016/146658" audioType="audio described"/>
                    <show time="2019-07-22T18:20:00" url="https://booking.cineworld.co.uk/booking/8016/146639" audioType="audio described"/>
                    <show time="2019-07-22T20:50:00" url="https://booking.cineworld.co.uk/booking/8016/146665" audioType="audio described"/>
                    <show time="2019-07-23T13:30:00" url="https://booking.cineworld.co.uk/booking/8016/146659" audioType="audio described"/>
                    <show time="2019-07-23T15:50:00" url="https://booking.cineworld.co.uk/booking/8016/146645" audioType="audio described"/>
                    <show time="2019-07-23T18:20:00" url="https://booking.cineworld.co.uk/booking/8016/146640" audioType="audio described"/>
                    <show time="2019-07-23T20:50:00" url="https://booking.cineworld.co.uk/booking/8016/146666" audioType="audio described"/>
                    <show time="2019-07-24T13:30:00" url="https://booking.cineworld.co.uk/booking/8016/146660" audioType="audio described"/>
                    <show time="2019-07-24T15:50:00" url="https://booking.cineworld.co.uk/booking/8016/146646" audioType="audio described"/>
                    <show time="2019-07-24T18:20:00" url="https://booking.cineworld.co.uk/booking/8016/146641" audioType="audio described"/>
                    <show time="2019-07-24T20:50:00" url="https://booking.cineworld.co.uk/booking/8016/146667" audioType="audio described"/>
                    <show time="2019-07-25T13:30:00" url="https://booking.cineworld.co.uk/booking/8016/146661" audioType="audio described"/>
                    <show time="2019-07-25T15:50:00" url="https://booking.cineworld.co.uk/booking/8016/146647" audioType="audio described"/>
                    <show time="2019-07-25T18:20:00" url="https://booking.cineworld.co.uk/booking/8016/146642" audioType="audio described"/>
                    <show time="2019-07-25T20:50:00" url="https://booking.cineworld.co.uk/booking/8016/146668" audioType="audio described"/>
                </shows>
            </film>
            <film title="Apocalypse Now - The Final Cut + Q&amp;A" rating="15" url="films/apocalypse-now-the-final-cut-qa" edi="801886" release="13/08/2019">
                <shows>
                    <show time="2019-08-13T19:30:00" url="https://booking.cineworld.co.uk/booking/8016/144126"/>
                </shows>
            </film>
            <film title="Autism Friendly Screening: The Lion King (2019)" rating="PG" url="films/autism-friendly-screening-the-lion-king-2019" edi="801945" release="19/07/2019">
                <shows>
                    <show time="2019-08-04T11:00:00" url="https://booking.cineworld.co.uk/booking/8016/146218" audioType="audio described"/>
                </shows>
            </film>
            <film title="Billy Connolly: The Sex Life of Bandages" rating="18" url="films/billy-connolly-the-sex-life-of-bandages" edi="276418" release="10/10/2019">
                <shows>
                    <show time="2019-10-10T20:00:00" url="https://booking.cineworld.co.uk/booking/8016/146782"/>
                </shows>
            </film>
            <film title="Bolshoi Ballet 2019 : Le Corsaire" rating="12A" url="films/bolshoi-ballet-2019-le-corsaire" edi="276116" release="17/11/2019">
                <shows>
                    <show time="2019-11-17T15:00:00" url="https://booking.cineworld.co.uk/booking/8016/143721"/>
                </shows>
            </film>
            <film title="Bolshoi Ballet 2019 : Raymonda" rating="12A" url="films/bolshoi-ballet-2019-raymonda" edi="276119" release="27/10/2019">
                <shows>
                    <show time="2019-10-27T15:00:00" url="https://booking.cineworld.co.uk/booking/8016/143720"/>
                </shows>
            </film>
            <film title="Bolshoi Ballet 2019 : The Nutcracker" rating="12A" url="films/bolshoi-ballet-2019-the-nutcracker" edi="276117" release="15/12/2019">
                <shows>
                    <show time="2019-12-15T15:00:00" url="https://booking.cineworld.co.uk/booking/8016/143722"/>
                </shows>
            </film>
            <film title="Bring The Soul: The Movie" rating="PG" url="films/bring-the-soul-the-movie" edi="281205" release="07/08/2019">
                <shows>
                    <show time="2019-08-07T19:30:00" url="https://booking.cineworld.co.uk/booking/8016/146216"/>
                    <show time="2019-08-11T14:00:00" url="https://booking.cineworld.co.uk/booking/8016/146215"/>
                </shows>
            </film>
            <film title="Dracula - Northern Ballet Live" rating="12A" url="films/dracula-northern-ballet-live" edi="270199" release="31/10/2019">
                <shows>
                    <show time="2019-10-31T19:15:00" url="https://booking.cineworld.co.uk/booking/8016/138339"/>
                </shows>
            </film>
            <film title="ENO Screen : The Mikado Encore (2015)" rating="PG" url="films/eno-screen-the-mikado-encore-2015" edi="187300" release="19/08/2019">
                <shows>
                    <show time="2019-08-19T19:30:00" url="https://booking.cineworld.co.uk/booking/8016/143728"/>
                </shows>
            </film>
            <film title="Fast &amp; Furious: Hobbs &amp; Shaw" rating="TBC" url="films/fast-furious-hobbs-shaw" edi="240260" release="02/08/2019">
                <shows>
                    <show time="2019-08-01T20:30:00" url="https://booking.cineworld.co.uk/booking/8016/144563" audioType="audio described"/>
                    <show time="2019-08-02T20:30:00" url="https://booking.cineworld.co.uk/booking/8016/144564" audioType="audio described"/>
                    <show time="2019-08-03T20:30:00" url="https://booking.cineworld.co.uk/booking/8016/144565" audioType="audio described"/>
                    <show time="2019-08-04T20:30:00" url="https://booking.cineworld.co.uk/booking/8016/144566" audioType="audio described"/>
                </shows>
            </film>
            <film title="Gauguin From The National Gallery, London" rating="12A" url="films/gauguin-from-the-national-gallery-london" edi="272070" release="15/11/2019">
                <shows>
                    <show time="2019-10-15T12:00:00" url="https://booking.cineworld.co.uk/booking/8016/145503"/>
                    <show time="2019-10-15T19:30:00" url="https://booking.cineworld.co.uk/booking/8016/145504"/>
                </shows>
            </film>
            <film title="Glyndebourne 2019: The Magic Flute (Die t" rating="12A" url="films/glyndebourne-2019-the-magic-flute-die-zauberflote-live" edi="273310" release="04/08/2019">
                <shows>
                    <show time="2019-08-04T17:30:00" url="https://booking.cineworld.co.uk/booking/8016/140857"/>
                </shows>
            </film>
            <film title="Margaret Atwood : Live In Cinemas" rating="12A" url="films/margaret-atwood-live-in-cinemas" edi="272858" release="10/09/2019">
                <shows>
                    <show time="2019-09-10T19:30:00" url="https://booking.cineworld.co.uk/booking/8016/140537"/>
                </shows>
            </film>
            <film title="Met Opera 2019-20: Akhnaten" rating="TBC" url="films/met-opera-2019-20-akhnaten" edi="274678" release="23/11/2019">
                <shows>
                    <show time="2019-11-23T17:55:00" url="https://booking.cineworld.co.uk/booking/8016/146553"/>
                </shows>
            </film>
            <film title="MET Opera 2019-20: Madama Butterfly" rating="TBC" url="films/met-opera-2019-20-madama-butterfly" edi="274682" release="09/11/2019">
                <shows>
                    <show time="2019-11-09T17:55:00" url="https://booking.cineworld.co.uk/booking/8016/146552"/>
                </shows>
            </film>
            <film title="MET Opera 2019-20: Manon" rating="TBC" url="films/met-opera-2019-20-manon" edi="274680" release="26/10/2019">
                <shows>
                    <show time="2019-10-26T17:55:00" url="https://booking.cineworld.co.uk/booking/8016/146551"/>
                </shows>
            </film>
            <film title="MET Opera 2019-20: Turandot" rating="TBC" url="films/met-opera-2019-20-turandot" edi="274672" release="12/10/2019">
                <shows>
                    <show time="2019-10-12T17:55:00" url="https://booking.cineworld.co.uk/booking/8016/146550"/>
                </shows>
            </film>
            <film title="Midsommar" rating="18" url="films/midsommar" edi="265995" release="05/07/2019">
                <shows>
                    <show time="2019-07-23T19:40:00" url="https://booking.cineworld.co.uk/booking/8016/146765" audioType="audio described"/>
                </shows>
            </film>
            <film title="NT Live: A Midsummer Night's Dream" rating="12A" url="films/nt-live-a-midsummer-nights-dream" edi="274950" release="17/10/2019">
                <shows>
                    <show time="2019-10-17T19:00:00" url="https://booking.cineworld.co.uk/booking/8016/144885"/>
                </shows>
            </film>
            <film title="NT Live: Hansard" rating="15" url="films/nt-live-hansard" edi="270878" release="07/11/2019">
                <shows>
                    <show time="2019-11-07T19:00:00" url="https://booking.cineworld.co.uk/booking/8016/144886"/>
                </shows>
            </film>
            <film title="NT Live : One Man, Two Guvnors (Encore)" rating="12A" url="films/nt-live-one-man-two-guvnors-encore" edi="266343" release="26/09/2019">
                <shows>
                    <show time="2019-09-26T19:00:00" url="https://booking.cineworld.co.uk/booking/8016/142092"/>
                </shows>
            </film>
            <film title="NT Live: Present Laughter" rating="12A" url="films/nt-live-present-laughter" edi="278033" release="28/11/2019">
                <shows>
                    <show time="2019-11-28T19:00:00" url="https://booking.cineworld.co.uk/booking/8016/144887"/>
                </shows>
            </film>
            <film title="NT Live : The Lehman Trilogy" rating="12A" url="films/nt-live-the-lehman-trilogy" edi="266345" release="25/07/2019">
                <shows>
                    <show time="2019-07-25T19:00:00" url="https://booking.cineworld.co.uk/booking/8016/142091"/>
                </shows>
            </film>
            <film title="M4J Paw Patrol: Mighty Pups - The Movie" rating="U" url="films/paw-patrol-mighty-pups-movies-for-juniors" edi="801924" release="19/07/2019">
                <shows>
                    <show time="2019-07-22T10:10:00" url="https://booking.cineworld.co.uk/booking/8016/146756" audioType="audio described"/>
                    <show time="2019-07-23T10:10:00" url="https://booking.cineworld.co.uk/booking/8016/146757" audioType="audio described"/>
                    <show time="2019-07-24T10:10:00" url="https://booking.cineworld.co.uk/booking/8016/146758" audioType="audio described"/>
                    <show time="2019-07-25T10:10:00" url="https://booking.cineworld.co.uk/booking/8016/146759" audioType="audio described"/>
                </shows>
            </film>
            <film title="Placido Domingo 50th Anniversary Concert" rating="TBC" url="films/placido-domingo-50th-anniversary-concert" edi="270187" release="01/10/2019">
                <shows>
                    <show time="2019-10-01T19:00:00" url="https://booking.cineworld.co.uk/booking/8016/145502"/>
                </shows>
            </film>
            <film title="M4J Ralph Breaks The Internet: Wreck It Ralph 2" rating="PG" url="films/ralph-breaks-the-internet-wreck-it-ralph-2-movies-for-juniors" edi="801742" release="01/03/2019">
                <shows>
                    <show time="2019-07-22T10:00:00" url="https://booking.cineworld.co.uk/booking/8016/146769" audioType="audio described"/>
                    <show time="2019-07-23T10:00:00" url="https://booking.cineworld.co.uk/booking/8016/146770" audioType="audio described"/>
                    <show time="2019-07-24T10:00:00" url="https://booking.cineworld.co.uk/booking/8016/146771" audioType="audio described"/>
                    <show time="2019-07-25T10:00:00" url="https://booking.cineworld.co.uk/booking/8016/146772" audioType="audio described"/>
                </shows>
            </film>
            <film title="Rigoletto On The Lake" rating="TBC" url="films/rigoletto-on-the-lake" edi="270196" release="17/09/2019">
                <shows>
                    <show time="2019-09-17T19:00:00" url="https://booking.cineworld.co.uk/booking/8016/145501"/>
                </shows>
            </film>
            <film title="Rocketman : Sing-Along Version" rating="15" url="films/rocketman-sing-along-version" edi="263136" release="26/07/2019">
                <shows>
                    <show time="2019-07-26T19:30:00" url="https://booking.cineworld.co.uk/booking/8016/146561" audioType="audio described" subtitled="true"/>
                </shows>
            </film>
            <film title="Roger Waters  Us + Them" rating="12A" url="films/roger-waters-us-them" edi="276883" release="02/10/2019">
                <shows>
                    <show time="2019-10-06T14:30:00" url="https://booking.cineworld.co.uk/booking/8016/146783"/>
                </shows>
            </film>
            <film title="ROH Live Opera 2019 : Don Giovanni" rating="TBC" url="films/roh-live-opera-2019-don-giovanni" edi="274395" release="08/10/2019">
                <shows>
                    <show time="2019-10-08T18:45:00" url="https://booking.cineworld.co.uk/booking/8016/144523"/>
                </shows>
            </film>
            <film title="ROH Live Opera 2019 : Don Pasquale" rating="TBC" url="films/roh-live-opera-2019-don-pasquale" edi="274401" release="24/10/2019">
                <shows>
                    <show time="2019-10-24T19:30:00" url="https://booking.cineworld.co.uk/booking/8016/144524"/>
                </shows>
            </film>
            <film title="ROH Royal Ballet Live 2019 : Coppelia" rating="TBC" url="films/roh-royal-ballet-live-2019-coppelia" edi="274396" release="10/12/2019">
                <shows>
                    <show time="2019-12-10T19:15:00" url="https://booking.cineworld.co.uk/booking/8016/144526"/>
                </shows>
            </film>
            <film title="ROH Royal Ballet Live 2019 : Triple Bill" rating="TBC" url="films/roh-royal-ballet-live-2019-triple-bill" edi="274399" release="05/11/2019">
                <shows>
                    <show time="2019-11-05T19:15:00" url="https://booking.cineworld.co.uk/booking/8016/144525"/>
                </shows>
            </film>
            <film title="ROH Royal Ballet: The Nutckracker (2016 Recorded)" rating="TBC" url="films/roh-royal-ballet-the-nutckracker-2016-recorded" edi="277630" release="17/12/2019">
                <shows>
                    <show time="2019-12-17T19:15:00" url="https://booking.cineworld.co.uk/booking/8016/144535"/>
                </shows>
            </film>
            <film title="RSC Live : Measure For Measure" rating="12A" url="films/rsc-live-measure-for-measure" edi="263087" release="31/07/2019">
                <shows>
                    <show time="2019-07-31T19:00:00" url="https://booking.cineworld.co.uk/booking/8016/133630"/>
                </shows>
            </film>
            <film title="Secret Unlimited Screening 12" rating="15" url="films/secret-unlimited-screening-12" edi="801942" release="29/07/2019">
                <shows>
                    <show time="2019-07-29T20:00:00" url="https://booking.cineworld.co.uk/booking/8016/146784" audioType="audio described"/>
                    <show time="2019-07-29T20:00:00" url="https://booking.cineworld.co.uk/booking/8016/146217" audioType="audio described"/>
                </shows>
            </film>
            <film title="(2D) Spider-Man: Far From Home" rating="12A" url="films/spider-man-far-from-home" edi="221205" release="02/07/2019">
                <shows>
                    <show time="2019-07-22T11:20:00" url="https://booking.cineworld.co.uk/booking/8016/146613" audioType="audio described"/>
                    <show time="2019-07-22T14:20:00" url="https://booking.cineworld.co.uk/booking/8016/146614" audioType="audio described"/>
                    <show time="2019-07-22T16:10:00" url="https://booking.cineworld.co.uk/booking/8016/146630" audioType="audio described"/>
                    <show time="2019-07-22T17:20:00" url="https://booking.cineworld.co.uk/booking/8016/146603" audioType="audio described"/>
                    <show time="2019-07-22T19:10:00" url="https://booking.cineworld.co.uk/booking/8016/146626" audioType="audio described"/>
                    <show time="2019-07-22T20:20:00" url="https://booking.cineworld.co.uk/booking/8016/146604" audioType="audio described"/>
                    <show time="2019-07-23T11:20:00" url="https://booking.cineworld.co.uk/booking/8016/146615" audioType="audio described"/>
                    <show time="2019-07-23T12:50:00" url="https://booking.cineworld.co.uk/booking/8016/146590" audioType="audio described"/>
                    <show time="2019-07-23T14:20:00" url="https://booking.cineworld.co.uk/booking/8016/146616" audioType="audio described"/>
                    <show time="2019-07-23T16:10:00" url="https://booking.cineworld.co.uk/booking/8016/146631" audioType="audio described"/>
                    <show time="2019-07-23T17:20:00" url="https://booking.cineworld.co.uk/booking/8016/146605" audioType="audio described"/>
                    <show time="2019-07-23T19:10:00" url="https://booking.cineworld.co.uk/booking/8016/146627" audioType="audio described"/>
                    <show time="2019-07-23T20:20:00" url="https://booking.cineworld.co.uk/booking/8016/146606" audioType="audio described"/>
                    <show time="2019-07-24T11:20:00" url="https://booking.cineworld.co.uk/booking/8016/146617" audioType="audio described"/>
                    <show time="2019-07-24T12:50:00" url="https://booking.cineworld.co.uk/booking/8016/146591" audioType="audio described"/>
                    <show time="2019-07-24T14:20:00" url="https://booking.cineworld.co.uk/booking/8016/146618" audioType="audio described"/>
                    <show time="2019-07-24T16:10:00" url="https://booking.cineworld.co.uk/booking/8016/146632" audioType="audio described"/>
                    <show time="2019-07-24T17:20:00" url="https://booking.cineworld.co.uk/booking/8016/146607" audioType="audio described"/>
                    <show time="2019-07-24T19:10:00" url="https://booking.cineworld.co.uk/booking/8016/146628" audioType="audio described"/>
                    <show time="2019-07-24T20:20:00" url="https://booking.cineworld.co.uk/booking/8016/146608" audioType="audio described"/>
                    <show time="2019-07-25T11:20:00" url="https://booking.cineworld.co.uk/booking/8016/146619" audioType="audio described"/>
                    <show time="2019-07-25T12:50:00" url="https://booking.cineworld.co.uk/booking/8016/146592" audioType="audio described"/>
                    <show time="2019-07-25T14:20:00" url="https://booking.cineworld.co.uk/booking/8016/146620" audioType="audio described"/>
                    <show time="2019-07-25T16:00:00" url="https://booking.cineworld.co.uk/booking/8016/146633" audioType="audio described"/>
                    <show time="2019-07-25T17:20:00" url="https://booking.cineworld.co.uk/booking/8016/146609" audioType="audio described"/>
                    <show time="2019-07-25T20:20:00" url="https://booking.cineworld.co.uk/booking/8016/146610" audioType="audio described"/>
                </shows>
            </film>
            <film title="Stuber" rating="15" url="films/stuber" edi="258445" release="12/07/2019">
                <shows>
                    <show time="2019-07-22T21:00:00" url="https://booking.cineworld.co.uk/booking/8016/146651" audioType="audio described"/>
                    <show time="2019-07-23T21:00:00" url="https://booking.cineworld.co.uk/booking/8016/146652" audioType="audio described"/>
                    <show time="2019-07-24T21:00:00" url="https://booking.cineworld.co.uk/booking/8016/146653" audioType="audio described"/>
                    <show time="2019-07-25T21:00:00" url="https://booking.cineworld.co.uk/booking/8016/146654" audioType="audio described"/>
                </shows>
            </film>
            <film title="The Dead Don't Die" rating="15" url="films/the-dead-dont-die" edi="276105" release="12/07/2019">
                <shows>
                    <show time="2019-07-22T19:45:00" url="https://booking.cineworld.co.uk/booking/8016/146761" audioType="audio described"/>
                    <show time="2019-07-24T19:45:00" url="https://booking.cineworld.co.uk/booking/8016/146762" audioType="audio described"/>
                </shows>
            </film>
            <film title="(2D) The Lion King" rating="PG" url="films/the-lion-king" edi="229583" release="19/07/2019">
                <shows>
                    <show time="2019-07-22T10:00:00" url="https://booking.cineworld.co.uk/booking/8016/145844" audioType="audio described"/>
                    <show time="2019-07-22T10:20:00" url="https://booking.cineworld.co.uk/booking/8016/145851" audioType="audio described"/>
                    <show time="2019-07-22T11:00:00" url="https://booking.cineworld.co.uk/booking/8016/145840" audioType="audio described"/>
                    <show time="2019-07-22T11:30:00" url="https://booking.cineworld.co.uk/booking/8016/145842" audioType="audio described"/>
                    <show time="2019-07-22T12:30:00" url="https://booking.cineworld.co.uk/booking/8016/145847" audioType="audio described"/>
                    <show time="2019-07-22T13:00:00" url="https://booking.cineworld.co.uk/booking/8016/145845" audioType="audio described"/>
                    <show time="2019-07-22T13:20:00" url="https://booking.cineworld.co.uk/booking/8016/145852" audioType="audio described"/>
                    <show time="2019-07-22T14:00:00" url="https://booking.cineworld.co.uk/booking/8016/145841" audioType="audio described"/>
                    <show time="2019-07-22T14:30:00" url="https://booking.cineworld.co.uk/booking/8016/145843" audioType="audio described"/>
                    <show time="2019-07-22T15:30:00" url="https://booking.cineworld.co.uk/booking/8016/145848" audioType="audio described"/>
                    <show time="2019-07-22T16:00:00" url="https://booking.cineworld.co.uk/booking/8016/145846" audioType="audio described"/>
                    <show time="2019-07-22T17:00:00" url="https://booking.cineworld.co.uk/booking/8016/145877" audioType="audio described"/>
                    <show time="2019-07-22T17:30:00" url="https://booking.cineworld.co.uk/booking/8016/145889" audioType="audio described"/>
                    <show time="2019-07-22T18:30:00" url="https://booking.cineworld.co.uk/booking/8016/145894" audioType="audio described" subtitled="true"/>
                    <show time="2019-07-22T19:00:00" url="https://booking.cineworld.co.uk/booking/8016/145893" audioType="audio described"/>
                    <show time="2019-07-22T20:00:00" url="https://booking.cineworld.co.uk/booking/8016/145878" audioType="audio described"/>
                    <show time="2019-07-22T20:30:00" url="https://booking.cineworld.co.uk/booking/8016/145890" audioType="audio described"/>
                    <show time="2019-07-23T10:00:00" url="https://booking.cineworld.co.uk/booking/8016/145859" audioType="audio described"/>
                    <show time="2019-07-23T10:20:00" url="https://booking.cineworld.co.uk/booking/8016/145855" audioType="audio described"/>
                    <show time="2019-07-23T11:00:00" url="https://booking.cineworld.co.uk/booking/8016/145857" audioType="audio described"/>
                    <show time="2019-07-23T11:30:00" url="https://booking.cineworld.co.uk/booking/8016/145853" audioType="audio described"/>
                    <show time="2019-07-23T12:30:00" url="https://booking.cineworld.co.uk/booking/8016/145862" audioType="audio described"/>
                    <show time="2019-07-23T13:00:00" url="https://booking.cineworld.co.uk/booking/8016/145860" audioType="audio described"/>
                    <show time="2019-07-23T13:20:00" url="https://booking.cineworld.co.uk/booking/8016/145856" audioType="audio described" subtitled="true"/>
                    <show time="2019-07-23T14:00:00" url="https://booking.cineworld.co.uk/booking/8016/145858" audioType="audio described"/>
                    <show time="2019-07-23T14:30:00" url="https://booking.cineworld.co.uk/booking/8016/145854" audioType="audio described"/>
                    <show time="2019-07-23T15:30:00" url="https://booking.cineworld.co.uk/booking/8016/145863" audioType="audio described"/>
                    <show time="2019-07-23T16:00:00" url="https://booking.cineworld.co.uk/booking/8016/145861" audioType="audio described"/>
                    <show time="2019-07-23T17:00:00" url="https://booking.cineworld.co.uk/booking/8016/145879" audioType="audio described"/>
                    <show time="2019-07-23T17:30:00" url="https://booking.cineworld.co.uk/booking/8016/145884" audioType="audio described"/>
                    <show time="2019-07-23T18:30:00" url="https://booking.cineworld.co.uk/booking/8016/145898" audioType="audio described"/>
                    <show time="2019-07-23T19:00:00" url="https://booking.cineworld.co.uk/booking/8016/145895" audioType="audio described"/>
                    <show time="2019-07-23T20:00:00" url="https://booking.cineworld.co.uk/booking/8016/145886" audioType="audio described"/>
                    <show time="2019-07-23T20:30:00" url="https://booking.cineworld.co.uk/booking/8016/145885" audioType="audio described"/>
                    <show time="2019-07-24T10:00:00" url="https://booking.cineworld.co.uk/booking/8016/145868" audioType="audio described"/>
                    <show time="2019-07-24T10:20:00" url="https://booking.cineworld.co.uk/booking/8016/145873" audioType="audio described"/>
                    <show time="2019-07-24T11:00:00" url="https://booking.cineworld.co.uk/booking/8016/145866" audioType="audio described"/>
                    <show time="2019-07-24T11:30:00" url="https://booking.cineworld.co.uk/booking/8016/145864" audioType="audio described"/>
                    <show time="2019-07-24T12:30:00" url="https://booking.cineworld.co.uk/booking/8016/145871" audioType="audio described"/>
                    <show time="2019-07-24T13:00:00" url="https://booking.cineworld.co.uk/booking/8016/145869" audioType="audio described"/>
                    <show time="2019-07-24T13:20:00" url="https://booking.cineworld.co.uk/booking/8016/145874" audioType="audio described"/>
                    <show time="2019-07-24T14:00:00" url="https://booking.cineworld.co.uk/booking/8016/145867" audioType="audio described"/>
                    <show time="2019-07-24T14:30:00" url="https://booking.cineworld.co.uk/booking/8016/145865" audioType="audio described"/>
                    <show time="2019-07-24T15:30:00" url="https://booking.cineworld.co.uk/booking/8016/145872" audioType="audio described"/>
                    <show time="2019-07-24T16:00:00" url="https://booking.cineworld.co.uk/booking/8016/145870" audioType="audio described"/>
                    <show time="2019-07-24T17:00:00" url="https://booking.cineworld.co.uk/booking/8016/145880" audioType="audio described"/>
                    <show time="2019-07-24T17:30:00" url="https://booking.cineworld.co.uk/booking/8016/145882" audioType="audio described"/>
                    <show time="2019-07-24T18:30:00" url="https://booking.cineworld.co.uk/booking/8016/145897" audioType="audio described"/>
                    <show time="2019-07-24T19:00:00" url="https://booking.cineworld.co.uk/booking/8016/145896" audioType="audio described"/>
                    <show time="2019-07-24T20:00:00" url="https://booking.cineworld.co.uk/booking/8016/145881" audioType="audio described"/>
                    <show time="2019-07-24T20:30:00" url="https://booking.cineworld.co.uk/booking/8016/145883" audioType="audio described"/>
                    <show time="2019-07-25T10:00:00" url="https://booking.cineworld.co.uk/booking/8016/146568" audioType="audio described"/>
                    <show time="2019-07-25T10:30:00" url="https://booking.cineworld.co.uk/booking/8016/146562" audioType="audio described"/>
                    <show time="2019-07-25T11:00:00" url="https://booking.cineworld.co.uk/booking/8016/146578" audioType="audio described"/>
                    <show time="2019-07-25T11:30:00" url="https://booking.cineworld.co.uk/booking/8016/146584" audioType="audio described"/>
                    <show time="2019-07-25T12:30:00" url="https://booking.cineworld.co.uk/booking/8016/146575" audioType="audio described"/>
                    <show time="2019-07-25T13:00:00" url="https://booking.cineworld.co.uk/booking/8016/146569" audioType="audio described"/>
                    <show time="2019-07-25T13:30:00" url="https://booking.cineworld.co.uk/booking/8016/146563" audioType="audio described"/>
                    <show time="2019-07-25T14:00:00" url="https://booking.cineworld.co.uk/booking/8016/146579" audioType="audio described"/>
                    <show time="2019-07-25T14:30:00" url="https://booking.cineworld.co.uk/booking/8016/146585" audioType="audio described"/>
                    <show time="2019-07-25T15:30:00" url="https://booking.cineworld.co.uk/booking/8016/146576" audioType="audio described" subtitled="true"/>
                    <show time="2019-07-25T16:00:00" url="https://booking.cineworld.co.uk/booking/8016/146570" audioType="audio described"/>
                    <show time="2019-07-25T17:00:00" url="https://booking.cineworld.co.uk/booking/8016/146580" audioType="audio described"/>
                    <show time="2019-07-25T17:30:00" url="https://booking.cineworld.co.uk/booking/8016/146582" audioType="audio described"/>
                    <show time="2019-07-25T18:30:00" url="https://booking.cineworld.co.uk/booking/8016/146577" audioType="audio described"/>
                    <show time="2019-07-25T19:00:00" url="https://booking.cineworld.co.uk/booking/8016/146571" audioType="audio described"/>
                    <show time="2019-07-25T20:00:00" url="https://booking.cineworld.co.uk/booking/8016/146581" audioType="audio described"/>
                    <show time="2019-07-25T20:30:00" url="https://booking.cineworld.co.uk/booking/8016/146583" audioType="audio described"/>
                </shows>
            </film>
            <film title="(3D) The Lion King" rating="PG" url="films/the-lion-king" edi="229584" release="19/07/2019">
                <shows>
                    <show time="2019-07-22T10:40:00" url="https://booking.cineworld.co.uk/booking/8016/145902" videoType="3d" audioType="audio described"/>
                    <show time="2019-07-22T12:00:00" url="https://booking.cineworld.co.uk/booking/8016/145915" videoType="3d" audioType="audio described"/>
                    <show time="2019-07-22T13:40:00" url="https://booking.cineworld.co.uk/booking/8016/145903" videoType="3d" audioType="audio described"/>
                    <show time="2019-07-22T15:00:00" url="https://booking.cineworld.co.uk/booking/8016/145916" videoType="3d" audioType="audio described"/>
                    <show time="2019-07-22T16:30:00" url="https://booking.cineworld.co.uk/booking/8016/145904" videoType="3d" audioType="audio described"/>
                    <show time="2019-07-22T18:00:00" url="https://booking.cineworld.co.uk/booking/8016/145922" videoType="3d" audioType="audio described"/>
                    <show time="2019-07-22T19:30:00" url="https://booking.cineworld.co.uk/booking/8016/145921" videoType="3d" audioType="audio described"/>
                    <show time="2019-07-23T10:40:00" url="https://booking.cineworld.co.uk/booking/8016/145905" videoType="3d" audioType="audio described"/>
                    <show time="2019-07-23T12:00:00" url="https://booking.cineworld.co.uk/booking/8016/145913" videoType="3d" audioType="audio described"/>
                    <show time="2019-07-23T13:40:00" url="https://booking.cineworld.co.uk/booking/8016/145906" videoType="3d" audioType="audio described"/>
                    <show time="2019-07-23T15:00:00" url="https://booking.cineworld.co.uk/booking/8016/145914" videoType="3d" audioType="audio described"/>
                    <show time="2019-07-23T16:30:00" url="https://booking.cineworld.co.uk/booking/8016/145907" videoType="3d" audioType="audio described"/>
                    <show time="2019-07-23T18:00:00" url="https://booking.cineworld.co.uk/booking/8016/145924" videoType="3d" audioType="audio described"/>
                    <show time="2019-07-23T19:30:00" url="https://booking.cineworld.co.uk/booking/8016/145923" videoType="3d" audioType="audio described"/>
                    <show time="2019-07-24T10:40:00" url="https://booking.cineworld.co.uk/booking/8016/145908" videoType="3d" audioType="audio described"/>
                    <show time="2019-07-24T12:00:00" url="https://booking.cineworld.co.uk/booking/8016/145911" videoType="3d" audioType="audio described"/>
                    <show time="2019-07-24T13:40:00" url="https://booking.cineworld.co.uk/booking/8016/145909" videoType="3d" audioType="audio described"/>
                    <show time="2019-07-24T15:00:00" url="https://booking.cineworld.co.uk/booking/8016/145912" videoType="3d" audioType="audio described"/>
                    <show time="2019-07-24T16:30:00" url="https://booking.cineworld.co.uk/booking/8016/145910" videoType="3d" audioType="audio described"/>
                    <show time="2019-07-24T18:00:00" url="https://booking.cineworld.co.uk/booking/8016/145926" videoType="3d" audioType="audio described"/>
                    <show time="2019-07-24T19:30:00" url="https://booking.cineworld.co.uk/booking/8016/145925" videoType="3d" audioType="audio described"/>
                    <show time="2019-07-25T10:40:00" url="https://booking.cineworld.co.uk/booking/8016/146564" videoType="3d" audioType="audio described"/>
                    <show time="2019-07-25T12:00:00" url="https://booking.cineworld.co.uk/booking/8016/146572" videoType="3d" audioType="audio described"/>
                    <show time="2019-07-25T13:40:00" url="https://booking.cineworld.co.uk/booking/8016/146565" videoType="3d" audioType="audio described"/>
                    <show time="2019-07-25T15:00:00" url="https://booking.cineworld.co.uk/booking/8016/146573" videoType="3d" audioType="audio described"/>
                    <show time="2019-07-25T16:30:00" url="https://booking.cineworld.co.uk/booking/8016/146566" videoType="3d" audioType="audio described"/>
                    <show time="2019-07-25T18:00:00" url="https://booking.cineworld.co.uk/booking/8016/146574" videoType="3d" audioType="audio described"/>
                    <show time="2019-07-25T19:30:00" url="https://booking.cineworld.co.uk/booking/8016/146567" videoType="3d" audioType="audio described"/>
                </shows>
            </film>
            <film title="The Matrix : 20th Anniversary (4K Restoration)" rating="15" url="films/the-matrix-20th-anniversary-4k-restoration" edi="105580" release="13/07/2019">
                <shows>
                    <show time="2019-07-25T19:45:00" url="https://booking.cineworld.co.uk/booking/8016/146773" audioType="audio described"/>
                    <show time="2019-07-30T20:00:00" url="https://booking.cineworld.co.uk/booking/8016/146781" audioType="audio described"/>
                </shows>
            </film>
            <film title="The Queen's Corgi" rating="PG" url="films/the-queens-corgi" edi="245222" release="05/07/2019">
                <shows>
                    <show time="2019-07-23T10:30:00" url="https://booking.cineworld.co.uk/booking/8016/146673" audioType="audio described"/>
                    <show time="2019-07-24T10:30:00" url="https://booking.cineworld.co.uk/booking/8016/146674" audioType="audio described"/>
                    <show time="2019-07-25T10:30:00" url="https://booking.cineworld.co.uk/booking/8016/146675" audioType="audio described"/>
                </shows>
            </film>
            <film title="(2D) Toy Story 4" rating="U" url="films/toy-story-4" edi="148687" release="21/06/2019">
                <shows>
                    <show time="2019-07-22T10:00:00" url="https://booking.cineworld.co.uk/booking/8016/146777" audioType="audio described"/>
                    <show time="2019-07-22T10:45:00" url="https://booking.cineworld.co.uk/booking/8016/146741" audioType="audio described"/>
                    <show time="2019-07-22T12:10:00" url="https://booking.cineworld.co.uk/booking/8016/146710" audioType="audio described"/>
                    <show time="2019-07-22T13:10:00" url="https://booking.cineworld.co.uk/booking/8016/146742" audioType="audio described"/>
                    <show time="2019-07-22T14:40:00" url="https://booking.cineworld.co.uk/booking/8016/146711" audioType="audio described"/>
                    <show time="2019-07-22T15:40:00" url="https://booking.cineworld.co.uk/booking/8016/146743" audioType="audio described"/>
                    <show time="2019-07-22T17:10:00" url="https://booking.cineworld.co.uk/booking/8016/146704" audioType="audio described"/>
                    <show time="2019-07-22T18:10:00" url="https://booking.cineworld.co.uk/booking/8016/146730" audioType="audio described"/>
                    <show time="2019-07-22T20:40:00" url="https://booking.cineworld.co.uk/booking/8016/146731" audioType="audio described"/>
                    <show time="2019-07-23T10:00:00" url="https://booking.cineworld.co.uk/booking/8016/146778" audioType="audio described"/>
                    <show time="2019-07-23T10:45:00" url="https://booking.cineworld.co.uk/booking/8016/146744" audioType="audio described"/>
                    <show time="2019-07-23T12:10:00" url="https://booking.cineworld.co.uk/booking/8016/146712" audioType="audio described"/>
                    <show time="2019-07-23T13:10:00" url="https://booking.cineworld.co.uk/booking/8016/146745" audioType="audio described"/>
                    <show time="2019-07-23T14:40:00" url="https://booking.cineworld.co.uk/booking/8016/146713" audioType="audio described"/>
                    <show time="2019-07-23T15:40:00" url="https://booking.cineworld.co.uk/booking/8016/146746" audioType="audio described"/>
                    <show time="2019-07-23T17:10:00" url="https://booking.cineworld.co.uk/booking/8016/146705" audioType="audio described"/>
                    <show time="2019-07-23T18:10:00" url="https://booking.cineworld.co.uk/booking/8016/146732" audioType="audio described"/>
                    <show time="2019-07-23T20:40:00" url="https://booking.cineworld.co.uk/booking/8016/146733" audioType="audio described"/>
                    <show time="2019-07-24T10:00:00" url="https://booking.cineworld.co.uk/booking/8016/146779" audioType="audio described"/>
                    <show time="2019-07-24T10:45:00" url="https://booking.cineworld.co.uk/booking/8016/146747" audioType="audio described"/>
                    <show time="2019-07-24T12:10:00" url="https://booking.cineworld.co.uk/booking/8016/146714" audioType="audio described"/>
                    <show time="2019-07-24T13:10:00" url="https://booking.cineworld.co.uk/booking/8016/146748" audioType="audio described"/>
                    <show time="2019-07-24T14:40:00" url="https://booking.cineworld.co.uk/booking/8016/146715" audioType="audio described"/>
                    <show time="2019-07-24T15:40:00" url="https://booking.cineworld.co.uk/booking/8016/146749" audioType="audio described"/>
                    <show time="2019-07-24T17:10:00" url="https://booking.cineworld.co.uk/booking/8016/146706" audioType="audio described"/>
                    <show time="2019-07-24T18:10:00" url="https://booking.cineworld.co.uk/booking/8016/146734" audioType="audio described"/>
                    <show time="2019-07-24T20:40:00" url="https://booking.cineworld.co.uk/booking/8016/146735" audioType="audio described"/>
                    <show time="2019-07-25T10:00:00" url="https://booking.cineworld.co.uk/booking/8016/146780" audioType="audio described"/>
                    <show time="2019-07-25T10:45:00" url="https://booking.cineworld.co.uk/booking/8016/146750" audioType="audio described"/>
                    <show time="2019-07-25T12:10:00" url="https://booking.cineworld.co.uk/booking/8016/146716" audioType="audio described"/>
                    <show time="2019-07-25T13:10:00" url="https://booking.cineworld.co.uk/booking/8016/146751" audioType="audio described"/>
                    <show time="2019-07-25T14:40:00" url="https://booking.cineworld.co.uk/booking/8016/146717" audioType="audio described"/>
                    <show time="2019-07-25T15:40:00" url="https://booking.cineworld.co.uk/booking/8016/146752" audioType="audio described"/>
                    <show time="2019-07-25T17:10:00" url="https://booking.cineworld.co.uk/booking/8016/146707" audioType="audio described"/>
                    <show time="2019-07-25T18:10:00" url="https://booking.cineworld.co.uk/booking/8016/146736" audioType="audio described"/>
                    <show time="2019-07-25T20:40:00" url="https://booking.cineworld.co.uk/booking/8016/146737" audioType="audio described"/>
                </shows>
            </film>
            <film title="Wise Children" rating="15" url="films/wise-children" edi="273976" release="03/10/2019">
                <shows>
                    <show time="2019-10-03T14:00:00" url="https://booking.cineworld.co.uk/booking/8016/143716"/>
                    <show time="2019-10-03T19:30:00" url="https://booking.cineworld.co.uk/booking/8016/143717"/>
                </shows>
            </film>
            <film title="Yesterday" rating="12A" url="films/yesterday" edi="253917" release="28/06/2019">
                <shows>
                    <show time="2019-07-22T16:20:00" url="https://booking.cineworld.co.uk/booking/8016/146693" audioType="audio described"/>
                    <show time="2019-07-22T19:20:00" url="https://booking.cineworld.co.uk/booking/8016/146688" audioType="audio described"/>
                    <show time="2019-07-23T16:20:00" url="https://booking.cineworld.co.uk/booking/8016/146694" audioType="audio described"/>
                    <show time="2019-07-23T19:20:00" url="https://booking.cineworld.co.uk/booking/8016/146689" audioType="audio described"/>
                    <show time="2019-07-24T16:20:00" url="https://booking.cineworld.co.uk/booking/8016/146695" audioType="audio described"/>
                    <show time="2019-07-24T19:20:00" url="https://booking.cineworld.co.uk/booking/8016/146690" audioType="audio described"/>
                    <show time="2019-07-25T16:20:00" url="https://booking.cineworld.co.uk/booking/8016/146696" audioType="audio described"/>
                    <show time="2019-07-25T19:20:00" url="https://booking.cineworld.co.uk/booking/8016/146691" audioType="audio described"/>
                </shows>
            </film>
        </listing>
    </cinema>
    <cinema name="Cineworld Ashton-under-Lyne" root="http://www1.cineworld.co.uk/" url="cinemas/ashton-under-lyne" id="23" phone="0871 200 2000" address="Ashton Leisure Park , Fold Way, Ashton-under-Lyne" postcode="OL7 0PG">
        <listing>
            <film title="(2D) Marvel Studios' Avengers : ENDGAME" rating="12A" url="films/2d-marvel-studios-avengers-endgame" edi="801930" release="28/06/2019">
                <shows>
                    <show time="2019-07-24T19:40:00" url="https://booking.cineworld.co.uk/booking/8017/170409" audioType="audio described"/>
                </shows>
            </film>
            <film title="(2D) Aladdin" rating="PG" url="films/aladdin" edi="205737" release="24/05/2019">
                <shows>
                    <show time="2019-07-25T13:30:00" url="https://booking.cineworld.co.uk/booking/8017/170442" audioType="audio described"/>
                </shows>
            </film>
            <film title="Andre Rieu 2019 Maastricht Concert Shall We Dance?" rating="PG" url="films/andre-rieu-2019-maastricht-concert-shall-we-dance" edi="255443" release="27/07/2019">
                <shows>
                    <show time="2019-07-27T19:00:00" url="https://booking.cineworld.co.uk/booking/8017/163548"/>
                    <show time="2019-07-28T15:00:00" url="https://booking.cineworld.co.uk/booking/8017/163549"/>
                </shows>
            </film>
            <film title="Annabelle Comes Home" rating="15" url="films/annabelle-comes-home" edi="250924" release="10/07/2019">
                <shows>
                    <show time="2019-07-22T15:50:00" url="https://booking.cineworld.co.uk/booking/8017/170369" audioType="audio described"/>
                    <show time="2019-07-22T18:20:00" url="https://booking.cineworld.co.uk/booking/8017/170370" audioType="audio described"/>
                    <show time="2019-07-22T21:00:00" url="https://booking.cineworld.co.uk/booking/8017/170371" audioType="audio described"/>
                    <show time="2019-07-23T15:50:00" url="https://booking.cineworld.co.uk/booking/8017/170373" audioType="audio described"/>
                    <show time="2019-07-23T18:20:00" url="https://booking.cineworld.co.uk/booking/8017/170374" audioType="audio described"/>
                    <show time="2019-07-23T21:00:00" url="https://booking.cineworld.co.uk/booking/8017/170375" audioType="audio described"/>
                    <show time="2019-07-24T15:50:00" url="https://booking.cineworld.co.uk/booking/8017/170377" audioType="audio described"/>
                    <show time="2019-07-24T18:20:00" url="https://booking.cineworld.co.uk/booking/8017/170378" audioType="audio described"/>
                    <show time="2019-07-24T21:00:00" url="https://booking.cineworld.co.uk/booking/8017/170379" audioType="audio described"/>
                    <show time="2019-07-25T15:50:00" url="https://booking.cineworld.co.uk/booking/8017/170381" audioType="audio described"/>
                    <show time="2019-07-25T18:20:00" url="https://booking.cineworld.co.uk/booking/8017/170382" audioType="audio described"/>
                    <show time="2019-07-25T21:00:00" url="https://booking.cineworld.co.uk/booking/8017/170383" audioType="audio described"/>
                </shows>
            </film>
            <film title="(IMAX) Apocalypse Now - The Final Cut (2019) + Q&amp;A" rating="15" url="films/apocalypse-now-the-final-cut-qa" edi="801889" release="13/08/2019">
                <shows>
                    <show time="2019-08-13T19:30:00" url="https://booking.cineworld.co.uk/booking/8017/168383" videoType="imax"/>
                </shows>
            </film>
            <film title="Autism Friendly Screening: The Lion King (2019)" rating="PG" url="films/autism-friendly-screening-the-lion-king-2019" edi="801945" release="19/07/2019">
                <shows>
                    <show time="2019-08-04T11:00:00" url="https://booking.cineworld.co.uk/booking/8017/170015" audioType="audio described"/>
                </shows>
            </film>
            <film title="Billy Connolly: The Sex Life of Bandages" rating="18" url="films/billy-connolly-the-sex-life-of-bandages" edi="276418" release="10/10/2019">
                <shows>
                    <show time="2019-10-10T20:00:00" url="https://booking.cineworld.co.uk/booking/8017/170469"/>
                </shows>
            </film>
            <film title="Bring The Soul: The Movie" rating="PG" url="films/bring-the-soul-the-movie" edi="281205" release="07/08/2019">
                <shows>
                    <show time="2019-08-07T19:30:00" url="https://booking.cineworld.co.uk/booking/8017/169986"/>
                    <show time="2019-08-11T14:00:00" url="https://booking.cineworld.co.uk/booking/8017/169987"/>
                </shows>
            </film>
            <film title="Dracula - Northern Ballet Live" rating="12A" url="films/dracula-northern-ballet-live" edi="270199" release="31/10/2019">
                <shows>
                    <show time="2019-10-31T19:30:00" url="https://booking.cineworld.co.uk/booking/8017/163526"/>
                </shows>
            </film>
            <film title="(IMAX) Fast &amp; Furious: Hobbs &amp; Shaw" rating="TBC" url="films/fast-furious-hobbs-shaw" edi="240362" release="01/08/2019">
                <shows>
                    <show time="2019-08-01T20:00:00" url="https://booking.cineworld.co.uk/booking/8017/168782" videoType="imax" audioType="audio described"/>
                    <show time="2019-08-02T20:00:00" url="https://booking.cineworld.co.uk/booking/8017/168784" videoType="imax" audioType="audio described"/>
                    <show time="2019-08-03T20:00:00" url="https://booking.cineworld.co.uk/booking/8017/168785" videoType="imax" audioType="audio described"/>
                    <show time="2019-08-04T20:00:00" url="https://booking.cineworld.co.uk/booking/8017/168787" videoType="imax" audioType="audio described"/>
                </shows>
            </film>
            <film title="Fast &amp; Furious: Hobbs &amp; Shaw" rating="TBC" url="films/fast-furious-hobbs-shaw" edi="240260" release="02/08/2019">
                <shows>
                    <show time="2019-08-01T19:00:00" url="https://booking.cineworld.co.uk/booking/8017/168781" audioType="audio described"/>
                    <show time="2019-08-02T19:00:00" url="https://booking.cineworld.co.uk/booking/8017/168783" audioType="audio described"/>
                    <show time="2019-08-03T19:00:00" url="https://booking.cineworld.co.uk/booking/8017/168786" audioType="audio described"/>
                    <show time="2019-08-04T19:00:00" url="https://booking.cineworld.co.uk/booking/8017/168788" audioType="audio described"/>
                </shows>
            </film>
            <film title="Margaret Atwood : Live In Cinemas" rating="12A" url="films/margaret-atwood-live-in-cinemas" edi="272858" release="10/09/2019">
                <shows>
                    <show time="2019-09-10T19:30:00" url="https://booking.cineworld.co.uk/booking/8017/165702"/>
                </shows>
            </film>
            <film title="Met Opera 2019-20: Akhnaten" rating="TBC" url="films/met-opera-2019-20-akhnaten" edi="274678" release="23/11/2019">
                <shows>
                    <show time="2019-11-23T17:55:00" url="https://booking.cineworld.co.uk/booking/8017/170259"/>
                </shows>
            </film>
            <film title="MET Opera 2019-20: Madama Butterfly" rating="TBC" url="films/met-opera-2019-20-madama-butterfly" edi="274682" release="09/11/2019">
                <shows>
                    <show time="2019-11-09T17:55:00" url="https://booking.cineworld.co.uk/booking/8017/170258"/>
                </shows>
            </film>
            <film title="MET Opera 2019-20: Manon" rating="TBC" url="films/met-opera-2019-20-manon" edi="274680" release="26/10/2019">
                <shows>
                    <show time="2019-10-26T17:55:00" url="https://booking.cineworld.co.uk/booking/8017/170257"/>
                </shows>
            </film>
            <film title="MET Opera 2019-20: Turandot" rating="TBC" url="films/met-opera-2019-20-turandot" edi="274672" release="12/10/2019">
                <shows>
                    <show time="2019-10-12T17:55:00" url="https://booking.cineworld.co.uk/booking/8017/170256"/>
                </shows>
            </film>
            <film title="Midsommar" rating="18" url="films/midsommar" edi="265995" release="05/07/2019">
                <shows>
                    <show time="2019-07-22T19:40:00" url="https://booking.cineworld.co.uk/booking/8017/170463" audioType="audio described"/>
                    <show time="2019-07-23T19:40:00" url="https://booking.cineworld.co.uk/booking/8017/170464" audioType="audio described"/>
                </shows>
            </film>
            <film title="NT Live: A Midsummer Night's Dream" rating="12A" url="films/nt-live-a-midsummer-nights-dream" edi="274950" release="17/10/2019">
                <shows>
                    <show time="2019-10-17T19:00:00" url="https://booking.cineworld.co.uk/booking/8017/169010"/>
                </shows>
            </film>
            <film title="NT Live: Hansard" rating="15" url="films/nt-live-hansard" edi="270878" release="07/11/2019">
                <shows>
                    <show time="2019-11-07T19:00:00" url="https://booking.cineworld.co.uk/booking/8017/169011"/>
                </shows>
            </film>
            <film title="NT Live : One Man, Two Guvnors (Encore)" rating="12A" url="films/nt-live-one-man-two-guvnors-encore" edi="266343" release="26/09/2019">
                <shows>
                    <show time="2019-09-26T19:00:00" url="https://booking.cineworld.co.uk/booking/8017/166916"/>
                </shows>
            </film>
            <film title="NT Live: Present Laughter" rating="12A" url="films/nt-live-present-laughter" edi="278033" release="28/11/2019">
                <shows>
                    <show time="2019-11-28T19:00:00" url="https://booking.cineworld.co.uk/booking/8017/169012"/>
                </shows>
            </film>
            <film title="NT Live : The Lehman Trilogy" rating="12A" url="films/nt-live-the-lehman-trilogy" edi="266345" release="25/07/2019">
                <shows>
                    <show time="2019-07-25T19:00:00" url="https://booking.cineworld.co.uk/booking/8017/166915"/>
                </shows>
            </film>
            <film title="M4J Paw Patrol: Mighty Pups - The Movie" rating="U" url="films/paw-patrol-mighty-pups-movies-for-juniors" edi="801924" release="19/07/2019">
                <shows>
                    <show time="2019-07-22T11:10:00" url="https://booking.cineworld.co.uk/booking/8017/170457" audioType="audio described"/>
                    <show time="2019-07-23T11:10:00" url="https://booking.cineworld.co.uk/booking/8017/170458" audioType="audio described"/>
                    <show time="2019-07-24T11:10:00" url="https://booking.cineworld.co.uk/booking/8017/170459" audioType="audio described"/>
                </shows>
            </film>
            <film title="Rigoletto On The Lake" rating="TBC" url="films/rigoletto-on-the-lake" edi="270196" release="17/09/2019">
                <shows>
                    <show time="2019-09-17T19:00:00" url="https://booking.cineworld.co.uk/booking/8017/169435"/>
                </shows>
            </film>
            <film title="Rocketman : Sing-Along Version" rating="15" url="films/rocketman-sing-along-version" edi="263136" release="26/07/2019">
                <shows>
                    <show time="2019-07-26T19:30:00" url="https://booking.cineworld.co.uk/booking/8017/170268" audioType="audio described" subtitled="true"/>
                </shows>
            </film>
            <film title="ROH Live Opera 2019 : Don Giovanni" rating="TBC" url="films/roh-live-opera-2019-don-giovanni" edi="274395" release="08/10/2019">
                <shows>
                    <show time="2019-10-08T18:45:00" url="https://booking.cineworld.co.uk/booking/8017/168767"/>
                </shows>
            </film>
            <film title="ROH Live Opera 2019 : Don Pasquale" rating="TBC" url="films/roh-live-opera-2019-don-pasquale" edi="274401" release="24/10/2019">
                <shows>
                    <show time="2019-10-24T19:30:00" url="https://booking.cineworld.co.uk/booking/8017/168768"/>
                </shows>
            </film>
            <film title="ROH Royal Ballet Live 2019 : Coppelia" rating="TBC" url="films/roh-royal-ballet-live-2019-coppelia" edi="274396" release="10/12/2019">
                <shows>
                    <show time="2019-12-10T19:15:00" url="https://booking.cineworld.co.uk/booking/8017/168770"/>
                </shows>
            </film>
            <film title="ROH Royal Ballet Live 2019 : Triple Bill" rating="TBC" url="films/roh-royal-ballet-live-2019-triple-bill" edi="274399" release="05/11/2019">
                <shows>
                    <show time="2019-11-05T19:15:00" url="https://booking.cineworld.co.uk/booking/8017/168769"/>
                </shows>
            </film>
            <film title="ROH Royal Ballet: The Nutckracker (2016 Recorded)" rating="TBC" url="films/roh-royal-ballet-the-nutckracker-2016-recorded" edi="277630" release="17/12/2019">
                <shows>
                    <show time="2019-12-17T19:15:00" url="https://booking.cineworld.co.uk/booking/8017/168771"/>
                </shows>
            </film>
            <film title="RSC Live : Measure For Measure" rating="12A" url="films/rsc-live-measure-for-measure" edi="263087" release="31/07/2019">
                <shows>
                    <show time="2019-07-31T19:00:00" url="https://booking.cineworld.co.uk/booking/8017/157921"/>
                </shows>
            </film>
            <film title="Secret Unlimited Screening 12" rating="15" url="films/secret-unlimited-screening-12" edi="801942" release="29/07/2019">
                <shows>
                    <show time="2019-07-29T20:00:00" url="https://booking.cineworld.co.uk/booking/8017/169989" audioType="audio described"/>
                </shows>
            </film>
            <film title="(2D) Spider-Man: Far From Home" rating="12A" url="films/spider-man-far-from-home" edi="221205" release="02/07/2019">
                <shows>
                    <show time="2019-07-22T11:20:00" url="https://booking.cineworld.co.uk/booking/8017/170426" audioType="audio described"/>
                    <show time="2019-07-22T12:50:00" url="https://booking.cineworld.co.uk/booking/8017/170368" audioType="audio described"/>
                    <show time="2019-07-22T14:20:00" url="https://booking.cineworld.co.uk/booking/8017/170427" audioType="audio described"/>
                    <show time="2019-07-22T16:10:00" url="https://booking.cineworld.co.uk/booking/8017/170451" audioType="audio described" subtitled="true"/>
                    <show time="2019-07-22T17:20:00" url="https://booking.cineworld.co.uk/booking/8017/170428" audioType="audio described"/>
                    <show time="2019-07-22T19:10:00" url="https://booking.cineworld.co.uk/booking/8017/170452" audioType="audio described"/>
                    <show time="2019-07-22T20:20:00" url="https://booking.cineworld.co.uk/booking/8017/170429" audioType="audio described"/>
                    <show time="2019-07-23T11:20:00" url="https://booking.cineworld.co.uk/booking/8017/170430" audioType="audio described"/>
                    <show time="2019-07-23T12:50:00" url="https://booking.cineworld.co.uk/booking/8017/170372" audioType="audio described"/>
                    <show time="2019-07-23T14:20:00" url="https://booking.cineworld.co.uk/booking/8017/170431" audioType="audio described"/>
                    <show time="2019-07-23T16:10:00" url="https://booking.cineworld.co.uk/booking/8017/170453" audioType="audio described"/>
                    <show time="2019-07-23T17:20:00" url="https://booking.cineworld.co.uk/booking/8017/170432" audioType="audio described"/>
                    <show time="2019-07-23T19:10:00" url="https://booking.cineworld.co.uk/booking/8017/170454" audioType="audio described"/>
                    <show time="2019-07-23T20:20:00" url="https://booking.cineworld.co.uk/booking/8017/170433" audioType="audio described"/>
                    <show time="2019-07-24T11:20:00" url="https://booking.cineworld.co.uk/booking/8017/170434" audioType="audio described"/>
                    <show time="2019-07-24T12:50:00" url="https://booking.cineworld.co.uk/booking/8017/170376" audioType="audio described"/>
                    <show time="2019-07-24T14:20:00" url="https://booking.cineworld.co.uk/booking/8017/170435" audioType="audio described"/>
                    <show time="2019-07-24T16:10:00" url="https://booking.cineworld.co.uk/booking/8017/170455" audioType="audio described"/>
                    <show time="2019-07-24T17:20:00" url="https://booking.cineworld.co.uk/booking/8017/170436" audioType="audio described"/>
                    <show time="2019-07-24T19:10:00" url="https://booking.cineworld.co.uk/booking/8017/170456" audioType="audio described"/>
                    <show time="2019-07-24T20:20:00" url="https://booking.cineworld.co.uk/booking/8017/170437" audioType="audio described"/>
                    <show time="2019-07-25T11:20:00" url="https://booking.cineworld.co.uk/booking/8017/170438" audioType="audio described"/>
                    <show time="2019-07-25T12:50:00" url="https://booking.cineworld.co.uk/booking/8017/170380" audioType="audio described"/>
                    <show time="2019-07-25T14:20:00" url="https://booking.cineworld.co.uk/booking/8017/170439" audioType="audio described"/>
                    <show time="2019-07-25T17:20:00" url="https://booking.cineworld.co.uk/booking/8017/170440" audioType="audio described" subtitled="true"/>
                    <show time="2019-07-25T19:40:00" url="https://booking.cineworld.co.uk/booking/8017/170413" audioType="audio described"/>
                    <show time="2019-07-25T20:20:00" url="https://booking.cineworld.co.uk/booking/8017/170441" audioType="audio described"/>
                </shows>
            </film>
            <film title="Stuber" rating="15" url="films/stuber" edi="258445" release="12/07/2019">
                <shows>
                    <show time="2019-07-23T20:50:00" url="https://booking.cineworld.co.uk/booking/8017/170348" audioType="audio described"/>
                    <show time="2019-07-24T20:50:00" url="https://booking.cineworld.co.uk/booking/8017/170349" audioType="audio described"/>
                    <show time="2019-07-25T20:50:00" url="https://booking.cineworld.co.uk/booking/8017/170350" audioType="audio described"/>
                </shows>
            </film>
            <film title="(2D) The Lion King" rating="PG" url="films/the-lion-king" edi="229583" release="19/07/2019">
                <shows>
                    <show time="2019-07-22T11:30:00" url="https://booking.cineworld.co.uk/booking/8017/169741" audioType="audio described"/>
                    <show time="2019-07-22T12:30:00" url="https://booking.cineworld.co.uk/booking/8017/169739" audioType="audio described"/>
                    <show time="2019-07-22T13:00:00" url="https://booking.cineworld.co.uk/booking/8017/169742" audioType="audio described"/>
                    <show time="2019-07-22T13:20:00" url="https://booking.cineworld.co.uk/booking/8017/169745" audioType="audio described"/>
                    <show time="2019-07-22T14:30:00" url="https://booking.cineworld.co.uk/booking/8017/169668" audioType="audio described"/>
                    <show time="2019-07-22T15:30:00" url="https://booking.cineworld.co.uk/booking/8017/169638" audioType="audio described"/>
                    <show time="2019-07-22T16:00:00" url="https://booking.cineworld.co.uk/booking/8017/169653" audioType="audio described"/>
                    <show time="2019-07-22T17:30:00" url="https://booking.cineworld.co.uk/booking/8017/169669" audioType="audio described"/>
                    <show time="2019-07-22T18:30:00" url="https://booking.cineworld.co.uk/booking/8017/169639" audioType="audio described" subtitled="true"/>
                    <show time="2019-07-22T19:00:00" url="https://booking.cineworld.co.uk/booking/8017/169654" audioType="audio described"/>
                    <show time="2019-07-22T20:30:00" url="https://booking.cineworld.co.uk/booking/8017/169670" audioType="audio described"/>
                    <show time="2019-07-23T11:30:00" url="https://booking.cineworld.co.uk/booking/8017/169750" audioType="audio described"/>
                    <show time="2019-07-23T12:00:00" url="https://booking.cineworld.co.uk/booking/8017/169746" audioType="audio described"/>
                    <show time="2019-07-23T13:00:00" url="https://booking.cineworld.co.uk/booking/8017/169748" audioType="audio described"/>
                    <show time="2019-07-23T13:20:00" url="https://booking.cineworld.co.uk/booking/8017/169752" audioType="audio described"/>
                    <show time="2019-07-23T14:30:00" url="https://booking.cineworld.co.uk/booking/8017/169671" audioType="audio described"/>
                    <show time="2019-07-23T15:30:00" url="https://booking.cineworld.co.uk/booking/8017/169641" audioType="audio described" subtitled="true"/>
                    <show time="2019-07-23T16:00:00" url="https://booking.cineworld.co.uk/booking/8017/169655" audioType="audio described"/>
                    <show time="2019-07-23T17:30:00" url="https://booking.cineworld.co.uk/booking/8017/169672" audioType="audio described"/>
                    <show time="2019-07-23T18:30:00" url="https://booking.cineworld.co.uk/booking/8017/169642" audioType="audio described"/>
                    <show time="2019-07-23T19:00:00" url="https://booking.cineworld.co.uk/booking/8017/169656" audioType="audio described"/>
                    <show time="2019-07-23T20:30:00" url="https://booking.cineworld.co.uk/booking/8017/169673" audioType="audio described"/>
                    <show time="2019-07-24T11:30:00" url="https://booking.cineworld.co.uk/booking/8017/169757" audioType="audio described"/>
                    <show time="2019-07-24T12:30:00" url="https://booking.cineworld.co.uk/booking/8017/169753" audioType="audio described"/>
                    <show time="2019-07-24T13:00:00" url="https://booking.cineworld.co.uk/booking/8017/169755" audioType="audio described"/>
                    <show time="2019-07-24T13:20:00" url="https://booking.cineworld.co.uk/booking/8017/169759" audioType="audio described"/>
                    <show time="2019-07-24T14:30:00" url="https://booking.cineworld.co.uk/booking/8017/169674" audioType="audio described"/>
                    <show time="2019-07-24T15:30:00" url="https://booking.cineworld.co.uk/booking/8017/169644" audioType="audio described"/>
                    <show time="2019-07-24T16:00:00" url="https://booking.cineworld.co.uk/booking/8017/169657" audioType="audio described"/>
                    <show time="2019-07-24T17:30:00" url="https://booking.cineworld.co.uk/booking/8017/169675" audioType="audio described"/>
                    <show time="2019-07-24T18:30:00" url="https://booking.cineworld.co.uk/booking/8017/169645" audioType="audio described"/>
                    <show time="2019-07-24T19:00:00" url="https://booking.cineworld.co.uk/booking/8017/169658" audioType="audio described"/>
                    <show time="2019-07-24T20:30:00" url="https://booking.cineworld.co.uk/booking/8017/169676" audioType="audio described"/>
                    <show time="2019-07-25T11:30:00" url="https://booking.cineworld.co.uk/booking/8017/170339" audioType="audio described"/>
                    <show time="2019-07-25T12:30:00" url="https://booking.cineworld.co.uk/booking/8017/170270" audioType="audio described"/>
                    <show time="2019-07-25T13:00:00" url="https://booking.cineworld.co.uk/booking/8017/170465" audioType="audio described"/>
                    <show time="2019-07-25T14:30:00" url="https://booking.cineworld.co.uk/booking/8017/170340" audioType="audio described"/>
                    <show time="2019-07-25T15:30:00" url="https://booking.cineworld.co.uk/booking/8017/170271" audioType="audio described"/>
                    <show time="2019-07-25T16:00:00" url="https://booking.cineworld.co.uk/booking/8017/170466" audioType="audio described"/>
                    <show time="2019-07-25T17:30:00" url="https://booking.cineworld.co.uk/booking/8017/170341" audioType="audio described"/>
                    <show time="2019-07-25T18:30:00" url="https://booking.cineworld.co.uk/booking/8017/170272" audioType="audio described"/>
                    <show time="2019-07-25T19:00:00" url="https://booking.cineworld.co.uk/booking/8017/170467" audioType="audio described"/>
                    <show time="2019-07-25T20:30:00" url="https://booking.cineworld.co.uk/booking/8017/170342" audioType="audio described"/>
                </shows>
            </film>
            <film title="(IMAX) The Lion King" rating="PG" url="films/the-lion-king" edi="245703" release="19/07/2019">
                <shows>
                    <show time="2019-07-22T11:00:00" url="https://booking.cineworld.co.uk/booking/8017/169740" videoType="imax" audioType="audio described"/>
                    <show time="2019-07-22T14:00:00" url="https://booking.cineworld.co.uk/booking/8017/169659" videoType="imax" audioType="audio described"/>
                    <show time="2019-07-23T11:00:00" url="https://booking.cineworld.co.uk/booking/8017/169749" videoType="imax" audioType="audio described"/>
                    <show time="2019-07-23T14:00:00" url="https://booking.cineworld.co.uk/booking/8017/169662" videoType="imax" audioType="audio described"/>
                    <show time="2019-07-24T11:00:00" url="https://booking.cineworld.co.uk/booking/8017/169756" videoType="imax" audioType="audio described"/>
                    <show time="2019-07-24T14:00:00" url="https://booking.cineworld.co.uk/booking/8017/169665" videoType="imax" audioType="audio described"/>
                    <show time="2019-07-25T11:00:00" url="https://booking.cineworld.co.uk/booking/8017/170335" videoType="imax" audioType="audio described"/>
                    <show time="2019-07-25T14:00:00" url="https://booking.cineworld.co.uk/booking/8017/170336" videoType="imax" audioType="audio described"/>
                </shows>
            </film>
            <film title="(IMAX 3-D) The Lion King" rating="PG" url="films/the-lion-king" edi="245702" release="19/07/2019">
                <shows>
                    <show time="2019-07-22T17:00:00" url="https://booking.cineworld.co.uk/booking/8017/169660" videoType="imax 3d" audioType="audio described"/>
                    <show time="2019-07-22T20:00:00" url="https://booking.cineworld.co.uk/booking/8017/169661" videoType="imax 3d" audioType="audio described"/>
                    <show time="2019-07-23T17:00:00" url="https://booking.cineworld.co.uk/booking/8017/169663" videoType="imax 3d" audioType="audio described"/>
                    <show time="2019-07-23T20:00:00" url="https://booking.cineworld.co.uk/booking/8017/169664" videoType="imax 3d" audioType="audio described"/>
                    <show time="2019-07-24T17:00:00" url="https://booking.cineworld.co.uk/booking/8017/169666" videoType="imax 3d" audioType="audio described"/>
                    <show time="2019-07-24T20:00:00" url="https://booking.cineworld.co.uk/booking/8017/169667" videoType="imax 3d" audioType="audio described"/>
                    <show time="2019-07-25T17:00:00" url="https://booking.cineworld.co.uk/booking/8017/170337" videoType="imax 3d" audioType="audio described"/>
                    <show time="2019-07-25T20:00:00" url="https://booking.cineworld.co.uk/booking/8017/170338" videoType="imax 3d" audioType="audio described"/>
                </shows>
            </film>
            <film title="(3D) The Lion King" rating="PG" url="films/the-lion-king" edi="229584" release="19/07/2019">
                <shows>
                    <show time="2019-07-22T12:00:00" url="https://booking.cineworld.co.uk/booking/8017/169744" videoType="3d" audioType="audio described"/>
                    <show time="2019-07-22T13:40:00" url="https://booking.cineworld.co.uk/booking/8017/169743" videoType="3d" audioType="audio described"/>
                    <show time="2019-07-22T15:00:00" url="https://booking.cineworld.co.uk/booking/8017/169677" videoType="3d" audioType="audio described"/>
                    <show time="2019-07-22T16:30:00" url="https://booking.cineworld.co.uk/booking/8017/169647" videoType="3d" audioType="audio described"/>
                    <show time="2019-07-22T18:00:00" url="https://booking.cineworld.co.uk/booking/8017/169678" videoType="3d" audioType="audio described"/>
                    <show time="2019-07-22T19:30:00" url="https://booking.cineworld.co.uk/booking/8017/169648" videoType="3d" audioType="audio described"/>
                    <show time="2019-07-23T12:00:00" url="https://booking.cineworld.co.uk/booking/8017/169751" videoType="3d" audioType="audio described"/>
                    <show time="2019-07-23T13:40:00" url="https://booking.cineworld.co.uk/booking/8017/169747" videoType="3d" audioType="audio described"/>
                    <show time="2019-07-23T15:00:00" url="https://booking.cineworld.co.uk/booking/8017/169679" videoType="3d" audioType="audio described"/>
                    <show time="2019-07-23T16:30:00" url="https://booking.cineworld.co.uk/booking/8017/169649" videoType="3d" audioType="audio described"/>
                    <show time="2019-07-23T18:00:00" url="https://booking.cineworld.co.uk/booking/8017/169680" videoType="3d" audioType="audio described"/>
                    <show time="2019-07-23T19:30:00" url="https://booking.cineworld.co.uk/booking/8017/169650" videoType="3d" audioType="audio described"/>
                    <show time="2019-07-24T12:00:00" url="https://booking.cineworld.co.uk/booking/8017/169758" videoType="3d" audioType="audio described"/>
                    <show time="2019-07-24T13:40:00" url="https://booking.cineworld.co.uk/booking/8017/169754" videoType="3d" audioType="audio described"/>
                    <show time="2019-07-24T15:00:00" url="https://booking.cineworld.co.uk/booking/8017/169681" videoType="3d" audioType="audio described"/>
                    <show time="2019-07-24T16:30:00" url="https://booking.cineworld.co.uk/booking/8017/169651" videoType="3d" audioType="audio described"/>
                    <show time="2019-07-24T18:00:00" url="https://booking.cineworld.co.uk/booking/8017/169682" videoType="3d" audioType="audio described"/>
                    <show time="2019-07-24T19:30:00" url="https://booking.cineworld.co.uk/booking/8017/169652" videoType="3d" audioType="audio described"/>
                    <show time="2019-07-25T12:00:00" url="https://booking.cineworld.co.uk/booking/8017/170351" videoType="3d" audioType="audio described"/>
                    <show time="2019-07-25T13:40:00" url="https://booking.cineworld.co.uk/booking/8017/170332" videoType="3d" audioType="audio described"/>
                    <show time="2019-07-25T15:00:00" url="https://booking.cineworld.co.uk/booking/8017/170352" videoType="3d" audioType="audio described"/>
                    <show time="2019-07-25T16:30:00" url="https://booking.cineworld.co.uk/booking/8017/170333" videoType="3d" audioType="audio described"/>
                    <show time="2019-07-25T18:00:00" url="https://booking.cineworld.co.uk/booking/8017/170353" videoType="3d" audioType="audio described"/>
                    <show time="2019-07-25T19:30:00" url="https://booking.cineworld.co.uk/booking/8017/170334" videoType="3d" audioType="audio described"/>
                </shows>
            </film>
            <film title="The Matrix : 20th Anniversary (4K Restoration)" rating="15" url="films/the-matrix-20th-anniversary-4k-restoration" edi="105580" release="13/07/2019">
                <shows>
                    <show time="2019-07-30T20:00:00" url="https://booking.cineworld.co.uk/booking/8017/170468" audioType="audio described"/>
                </shows>
            </film>
            <film title="The Queen's Corgi" rating="PG" url="films/the-queens-corgi" edi="245222" release="05/07/2019">
                <shows>
                    <show time="2019-07-22T11:15:00" url="https://booking.cineworld.co.uk/booking/8017/170317"/>
                    <show time="2019-07-25T11:15:00" url="https://booking.cineworld.co.uk/booking/8017/170443"/>
                </shows>
            </film>
            <film title="(2D) Toy Story 4" rating="U" url="films/toy-story-4" edi="148687" release="21/06/2019">
                <shows>
                    <show time="2019-07-22T12:10:00" url="https://booking.cineworld.co.uk/booking/8017/170398" audioType="audio described"/>
                    <show time="2019-07-22T13:10:00" url="https://booking.cineworld.co.uk/booking/8017/170289" audioType="audio described"/>
                    <show time="2019-07-22T14:40:00" url="https://booking.cineworld.co.uk/booking/8017/170399" audioType="audio described"/>
                    <show time="2019-07-22T15:40:00" url="https://booking.cineworld.co.uk/booking/8017/170290" audioType="audio described"/>
                    <show time="2019-07-22T17:10:00" url="https://booking.cineworld.co.uk/booking/8017/170400" audioType="audio described"/>
                    <show time="2019-07-22T18:10:00" url="https://booking.cineworld.co.uk/booking/8017/170291" audioType="audio described"/>
                    <show time="2019-07-22T20:40:00" url="https://booking.cineworld.co.uk/booking/8017/170292" audioType="audio described"/>
                    <show time="2019-07-23T12:10:00" url="https://booking.cineworld.co.uk/booking/8017/170402" audioType="audio described"/>
                    <show time="2019-07-23T13:10:00" url="https://booking.cineworld.co.uk/booking/8017/170293" audioType="audio described"/>
                    <show time="2019-07-23T14:40:00" url="https://booking.cineworld.co.uk/booking/8017/170403" audioType="audio described"/>
                    <show time="2019-07-23T15:40:00" url="https://booking.cineworld.co.uk/booking/8017/170294" audioType="audio described"/>
                    <show time="2019-07-23T17:10:00" url="https://booking.cineworld.co.uk/booking/8017/170404" audioType="audio described"/>
                    <show time="2019-07-23T18:10:00" url="https://booking.cineworld.co.uk/booking/8017/170295" audioType="audio described"/>
                    <show time="2019-07-23T20:40:00" url="https://booking.cineworld.co.uk/booking/8017/170296" audioType="audio described"/>
                    <show time="2019-07-24T12:10:00" url="https://booking.cineworld.co.uk/booking/8017/170406" audioType="audio described"/>
                    <show time="2019-07-24T13:10:00" url="https://booking.cineworld.co.uk/booking/8017/170297" audioType="audio described"/>
                    <show time="2019-07-24T14:40:00" url="https://booking.cineworld.co.uk/booking/8017/170407" audioType="audio described"/>
                    <show time="2019-07-24T15:40:00" url="https://booking.cineworld.co.uk/booking/8017/170298" audioType="audio described"/>
                    <show time="2019-07-24T17:10:00" url="https://booking.cineworld.co.uk/booking/8017/170408" audioType="audio described"/>
                    <show time="2019-07-24T18:10:00" url="https://booking.cineworld.co.uk/booking/8017/170299" audioType="audio described"/>
                    <show time="2019-07-24T20:40:00" url="https://booking.cineworld.co.uk/booking/8017/170300" audioType="audio described"/>
                    <show time="2019-07-25T12:10:00" url="https://booking.cineworld.co.uk/booking/8017/170410" audioType="audio described"/>
                    <show time="2019-07-25T13:10:00" url="https://booking.cineworld.co.uk/booking/8017/170301" audioType="audio described"/>
                    <show time="2019-07-25T14:40:00" url="https://booking.cineworld.co.uk/booking/8017/170411" audioType="audio described"/>
                    <show time="2019-07-25T15:40:00" url="https://booking.cineworld.co.uk/booking/8017/170302" audioType="audio described"/>
                    <show time="2019-07-25T17:10:00" url="https://booking.cineworld.co.uk/booking/8017/170412" audioType="audio described"/>
                </shows>
            </film>
            <film title="Yesterday" rating="12A" url="films/yesterday" edi="253917" release="28/06/2019">
                <shows>
                    <show time="2019-07-22T20:50:00" url="https://booking.cineworld.co.uk/booking/8017/170481" audioType="audio described"/>
                    <show time="2019-07-25T16:45:00" url="https://booking.cineworld.co.uk/booking/8017/170460" audioType="audio described"/>
                    <show time="2019-07-25T19:50:00" url="https://booking.cineworld.co.uk/booking/8017/170461" audioType="audio described"/>
                </shows>
            </film>
        </listing>
    </cinema>
    <cinema name="Cineworld Basildon" root="http://www1.cineworld.co.uk/" url="cinemas/basildon" id="104" phone="0871 200 2000" address="Festival Leisure Park, Basildon" postcode="SS14 3WB">
        <listing>
            <film title="(4DX) The Matrix : 20th Anniversary (4K)" rating="15" url="films/4dx-the-matrix-20th-anniversary-4k-restoration" edi="801874" release="17/07/2019">
                <shows>
                    <show time="2019-07-25T20:40:00" url="https://booking.cineworld.co.uk/booking/8113/81091" audioType="audio described"/>
                </shows>
            </film>
            <film title="(2D) Aladdin" rating="PG" url="films/aladdin" edi="205737" release="24/05/2019">
                <shows>
                    <show time="2019-07-22T10:00:00" url="https://booking.cineworld.co.uk/booking/8113/81337" audioType="audio described"/>
                    <show time="2019-07-22T12:50:00" url="https://booking.cineworld.co.uk/booking/8113/81338" audioType="audio described"/>
                    <show time="2019-07-23T10:00:00" url="https://booking.cineworld.co.uk/booking/8113/81339" audioType="audio described"/>
                    <show time="2019-07-23T12:50:00" url="https://booking.cineworld.co.uk/booking/8113/81340" audioType="audio described"/>
                    <show time="2019-07-24T10:00:00" url="https://booking.cineworld.co.uk/booking/8113/81341" audioType="audio described"/>
                    <show time="2019-07-24T12:50:00" url="https://booking.cineworld.co.uk/booking/8113/81342" audioType="audio described"/>
                    <show time="2019-07-25T10:00:00" url="https://booking.cineworld.co.uk/booking/8113/81343" audioType="audio described"/>
                    <show time="2019-07-25T12:50:00" url="https://booking.cineworld.co.uk/booking/8113/81344" audioType="audio described"/>
                </shows>
            </film>
            <film title="Andre Rieu 2019 Maastricht Concert Shall We Dance?" rating="PG" url="films/andre-rieu-2019-maastricht-concert-shall-we-dance" edi="255443" release="27/07/2019">
                <shows>
                    <show time="2019-07-27T19:00:00" url="https://booking.cineworld.co.uk/booking/8113/68792"/>
                    <show time="2019-07-28T15:00:00" url="https://booking.cineworld.co.uk/booking/8113/68793"/>
                </shows>
            </film>
            <film title="Annabelle Comes Home" rating="15" url="films/annabelle-comes-home" edi="250924" release="10/07/2019">
                <shows>
                    <show time="2019-07-22T14:30:00" url="https://booking.cineworld.co.uk/booking/8113/81261" audioType="audio described"/>
                    <show time="2019-07-22T18:20:00" url="https://booking.cineworld.co.uk/booking/8113/81149"/>
                    <show time="2019-07-22T19:50:00" url="https://booking.cineworld.co.uk/booking/8113/81262" audioType="audio described"/>
                    <show time="2019-07-23T14:30:00" url="https://booking.cineworld.co.uk/booking/8113/81273" audioType="audio described"/>
                    <show time="2019-07-23T18:20:00" url="https://booking.cineworld.co.uk/booking/8113/81148"/>
                    <show time="2019-07-23T19:50:00" url="https://booking.cineworld.co.uk/booking/8113/81274" audioType="audio described"/>
                    <show time="2019-07-24T14:30:00" url="https://booking.cineworld.co.uk/booking/8113/81276" audioType="audio described"/>
                    <show time="2019-07-24T18:20:00" url="https://booking.cineworld.co.uk/booking/8113/81147"/>
                    <show time="2019-07-24T19:50:00" url="https://booking.cineworld.co.uk/booking/8113/81277" audioType="audio described"/>
                    <show time="2019-07-25T14:30:00" url="https://booking.cineworld.co.uk/booking/8113/81258" audioType="audio described"/>
                    <show time="2019-07-25T18:20:00" url="https://booking.cineworld.co.uk/booking/8113/81146"/>
                    <show time="2019-07-25T19:50:00" url="https://booking.cineworld.co.uk/booking/8113/81259" audioType="audio described"/>
                </shows>
            </film>
            <film title="(ScreenX) Annabelle Comes Home" rating="15" url="films/annabelle-comes-home" edi="801928" release="10/07/2019">
                <shows>
                    <show time="2019-07-22T10:00:00" url="https://booking.cineworld.co.uk/booking/8113/81111" audioType="audio described"/>
                    <show time="2019-07-22T15:30:00" url="https://booking.cineworld.co.uk/booking/8113/81112" audioType="audio described"/>
                    <show time="2019-07-22T21:15:00" url="https://booking.cineworld.co.uk/booking/8113/81113" audioType="audio described"/>
                    <show time="2019-07-23T10:00:00" url="https://booking.cineworld.co.uk/booking/8113/81116" audioType="audio described"/>
                    <show time="2019-07-23T15:30:00" url="https://booking.cineworld.co.uk/booking/8113/81117" audioType="audio described"/>
                    <show time="2019-07-23T21:15:00" url="https://booking.cineworld.co.uk/booking/8113/81118" audioType="audio described"/>
                    <show time="2019-07-24T10:00:00" url="https://booking.cineworld.co.uk/booking/8113/81121" audioType="audio described"/>
                    <show time="2019-07-24T15:30:00" url="https://booking.cineworld.co.uk/booking/8113/81122" audioType="audio described"/>
                    <show time="2019-07-24T21:15:00" url="https://booking.cineworld.co.uk/booking/8113/81123" audioType="audio described"/>
                    <show time="2019-07-25T10:00:00" url="https://booking.cineworld.co.uk/booking/8113/81126" audioType="audio described"/>
                    <show time="2019-07-25T15:30:00" url="https://booking.cineworld.co.uk/booking/8113/81127" audioType="audio described"/>
                    <show time="2019-07-25T21:15:00" url="https://booking.cineworld.co.uk/booking/8113/81128" audioType="audio described"/>
                </shows>
            </film>
            <film title="Apocalypse Now - The Final Cut + Q&amp;A" rating="15" url="films/apocalypse-now-the-final-cut-qa" edi="801886" release="13/08/2019">
                <shows>
                    <show time="2019-08-13T19:30:00" url="https://booking.cineworld.co.uk/booking/8113/77300"/>
                </shows>
            </film>
            <film title="(IMAX) Apocalypse Now - The Final Cut (2019) + Q&amp;A" rating="15" url="films/apocalypse-now-the-final-cut-qa" edi="801889" release="13/08/2019">
                <shows>
                    <show time="2019-08-13T19:30:00" url="https://booking.cineworld.co.uk/booking/8113/77304" videoType="imax"/>
                </shows>
            </film>
            <film title="Autism Friendly Screening: The Lion King (2019)" rating="PG" url="films/autism-friendly-screening-the-lion-king-2019" edi="801945" release="19/07/2019">
                <shows>
                    <show time="2019-08-04T11:00:00" url="https://booking.cineworld.co.uk/booking/8113/80469" audioType="audio described"/>
                </shows>
            </film>
            <film title="Balance, Not Symmetry: Biffy Clyro Acoustic Set + " rating="15" url="films/balance-not-symmetry-biffy-clyro-acoustic-set-cast-qa" edi="279749" release="01/08/2019">
                <shows>
                    <show time="2019-08-01T19:00:00" url="https://booking.cineworld.co.uk/booking/8113/79708"/>
                </shows>
            </film>
            <film title="Billy Connolly: The Sex Life of Bandages" rating="18" url="films/billy-connolly-the-sex-life-of-bandages" edi="276418" release="10/10/2019">
                <shows>
                    <show time="2019-10-10T20:00:00" url="https://booking.cineworld.co.uk/booking/8113/81354"/>
                </shows>
            </film>
            <film title="Bring The Soul: The Movie" rating="PG" url="films/bring-the-soul-the-movie" edi="281205" release="07/08/2019">
                <shows>
                    <show time="2019-08-07T19:30:00" url="https://booking.cineworld.co.uk/booking/8113/80466"/>
                    <show time="2019-08-11T14:00:00" url="https://booking.cineworld.co.uk/booking/8113/80467"/>
                </shows>
            </film>
            <film title="Dracula - Northern Ballet Live" rating="12A" url="films/dracula-northern-ballet-live" edi="270199" release="31/10/2019">
                <shows>
                    <show time="2019-10-31T19:15:00" url="https://booking.cineworld.co.uk/booking/8113/68777"/>
                </shows>
            </film>
            <film title="ENO Screen : The Mikado Encore (2015)" rating="PG" url="films/eno-screen-the-mikado-encore-2015" edi="187300" release="19/08/2019">
                <shows>
                    <show time="2019-08-19T19:30:00" url="https://booking.cineworld.co.uk/booking/8113/76839"/>
                </shows>
            </film>
            <film title="(IMAX) Fast &amp; Furious: Hobbs &amp; Shaw" rating="TBC" url="films/fast-furious-hobbs-shaw" edi="240362" release="01/08/2019">
                <shows>
                    <show time="2019-08-01T19:30:00" url="https://booking.cineworld.co.uk/booking/8113/77840" videoType="imax"/>
                    <show time="2019-08-02T19:30:00" url="https://booking.cineworld.co.uk/booking/8113/77842" videoType="imax"/>
                    <show time="2019-08-03T19:30:00" url="https://booking.cineworld.co.uk/booking/8113/77845" videoType="imax"/>
                    <show time="2019-08-04T19:30:00" url="https://booking.cineworld.co.uk/booking/8113/77846" videoType="imax"/>
                </shows>
            </film>
            <film title="Fast &amp; Furious: Hobbs &amp; Shaw" rating="TBC" url="films/fast-furious-hobbs-shaw" edi="240260" release="02/08/2019">
                <shows>
                    <show time="2019-08-01T19:00:00" url="https://booking.cineworld.co.uk/booking/8113/77841"/>
                    <show time="2019-08-02T19:00:00" url="https://booking.cineworld.co.uk/booking/8113/77844"/>
                    <show time="2019-08-03T19:00:00" url="https://booking.cineworld.co.uk/booking/8113/77849"/>
                    <show time="2019-08-04T19:00:00" url="https://booking.cineworld.co.uk/booking/8113/77850"/>
                </shows>
            </film>
            <film title="(4DX) Fast &amp; Furious: Hobbs &amp; Shaw" rating="TBC" url="films/fast-furious-hobbs-shaw" edi="801897" release="01/08/2019">
                <shows>
                    <show time="2019-08-01T20:30:00" url="https://booking.cineworld.co.uk/booking/8113/77839" audioType="audio described"/>
                    <show time="2019-08-02T20:30:00" url="https://booking.cineworld.co.uk/booking/8113/77843" audioType="audio described"/>
                    <show time="2019-08-03T20:30:00" url="https://booking.cineworld.co.uk/booking/8113/77847" audioType="audio described"/>
                    <show time="2019-08-04T20:30:00" url="https://booking.cineworld.co.uk/booking/8113/77848" audioType="audio described"/>
                </shows>
            </film>
            <film title="Gauguin From The National Gallery, London" rating="12A" url="films/gauguin-from-the-national-gallery-london" edi="272070" release="15/11/2019">
                <shows>
                    <show time="2019-10-15T12:00:00" url="https://booking.cineworld.co.uk/booking/8113/79268"/>
                    <show time="2019-10-15T19:30:00" url="https://booking.cineworld.co.uk/booking/8113/79269"/>
                </shows>
            </film>
            <film title="Glyndebourne 2019: The Magic Flute (Die t" rating="12A" url="films/glyndebourne-2019-the-magic-flute-die-zauberflote-live" edi="273310" release="04/08/2019">
                <shows>
                    <show time="2019-08-04T17:30:00" url="https://booking.cineworld.co.uk/booking/8113/72439"/>
                </shows>
            </film>
            <film title="Late Night" rating="15" url="films/late-night" edi="272068" release="07/06/2019">
                <shows>
                    <show time="2019-07-24T11:30:00" url="https://booking.cineworld.co.uk/booking/8113/81315"/>
                </shows>
            </film>
            <film title="Margaret Atwood : Live In Cinemas" rating="12A" url="films/margaret-atwood-live-in-cinemas" edi="272858" release="10/09/2019">
                <shows>
                    <show time="2019-09-10T19:30:00" url="https://booking.cineworld.co.uk/booking/8113/72016"/>
                </shows>
            </film>
            <film title="Met Opera 2019-20: Akhnaten" rating="TBC" url="films/met-opera-2019-20-akhnaten" edi="274678" release="23/11/2019">
                <shows>
                    <show time="2019-11-23T17:55:00" url="https://booking.cineworld.co.uk/booking/8113/80981"/>
                </shows>
            </film>
            <film title="MET Opera 2019-20: Madama Butterfly" rating="TBC" url="films/met-opera-2019-20-madama-butterfly" edi="274682" release="09/11/2019">
                <shows>
                    <show time="2019-11-09T17:55:00" url="https://booking.cineworld.co.uk/booking/8113/80980"/>
                </shows>
            </film>
            <film title="MET Opera 2019-20: Manon" rating="TBC" url="films/met-opera-2019-20-manon" edi="274680" release="26/10/2019">
                <shows>
                    <show time="2019-10-26T17:55:00" url="https://booking.cineworld.co.uk/booking/8113/80979"/>
                </shows>
            </film>
            <film title="MET Opera 2019-20: Turandot" rating="TBC" url="films/met-opera-2019-20-turandot" edi="274672" release="12/10/2019">
                <shows>
                    <show time="2019-10-12T17:55:00" url="https://booking.cineworld.co.uk/booking/8113/80978"/>
                </shows>
            </film>
            <film title="Midsommar" rating="18" url="films/midsommar" edi="265995" release="05/07/2019">
                <shows>
                    <show time="2019-07-23T19:00:00" url="https://booking.cineworld.co.uk/booking/8113/81346" audioType="audio described"/>
                </shows>
            </film>
            <film title="NT Live: A Midsummer Night's Dream" rating="12A" url="films/nt-live-a-midsummer-nights-dream" edi="274950" release="17/10/2019">
                <shows>
                    <show time="2019-10-17T19:00:00" url="https://booking.cineworld.co.uk/booking/8113/78344"/>
                </shows>
            </film>
            <film title="NT Live: Hansard" rating="15" url="films/nt-live-hansard" edi="270878" release="07/11/2019">
                <shows>
                    <show time="2019-11-07T19:00:00" url="https://booking.cineworld.co.uk/booking/8113/78345"/>
                </shows>
            </film>
            <film title="NT Live : One Man, Two Guvnors (Encore)" rating="12A" url="films/nt-live-one-man-two-guvnors-encore" edi="266343" release="26/09/2019">
                <shows>
                    <show time="2019-09-26T19:00:00" url="https://booking.cineworld.co.uk/booking/8113/78795"/>
                </shows>
            </film>
            <film title="NT Live: Present Laughter" rating="12A" url="films/nt-live-present-laughter" edi="278033" release="28/11/2019">
                <shows>
                    <show time="2019-11-28T19:00:00" url="https://booking.cineworld.co.uk/booking/8113/78346"/>
                </shows>
            </film>
            <film title="NT Live : The Lehman Trilogy" rating="12A" url="films/nt-live-the-lehman-trilogy" edi="266345" release="25/07/2019">
                <shows>
                    <show time="2019-07-25T19:00:00" url="https://booking.cineworld.co.uk/booking/8113/78794"/>
                </shows>
            </film>
            <film title="M4J Paw Patrol: Mighty Pups - The Movie" rating="U" url="films/paw-patrol-mighty-pups-movies-for-juniors" edi="801924" release="19/07/2019">
                <shows>
                    <show time="2019-07-22T09:40:00" url="https://booking.cineworld.co.uk/booking/8113/81003" audioType="audio described"/>
                    <show time="2019-07-23T10:10:00" url="https://booking.cineworld.co.uk/booking/8113/81004" audioType="audio described"/>
                    <show time="2019-07-24T09:40:00" url="https://booking.cineworld.co.uk/booking/8113/81005" audioType="audio described"/>
                    <show time="2019-07-25T09:50:00" url="https://booking.cineworld.co.uk/booking/8113/81006" audioType="audio described"/>
                </shows>
            </film>
            <film title="Placido Domingo 50th Anniversary Concert" rating="TBC" url="films/placido-domingo-50th-anniversary-concert" edi="270187" release="01/10/2019">
                <shows>
                    <show time="2019-10-01T19:00:00" url="https://booking.cineworld.co.uk/booking/8113/79263"/>
                </shows>
            </film>
            <film title="M4J Ralph Breaks The Internet: Wreck It Ralph 2" rating="PG" url="films/ralph-breaks-the-internet-wreck-it-ralph-2-movies-for-juniors" edi="801742" release="01/03/2019">
                <shows>
                    <show time="2019-07-22T09:25:00" url="https://booking.cineworld.co.uk/booking/8113/81056" audioType="audio described"/>
                    <show time="2019-07-23T10:00:00" url="https://booking.cineworld.co.uk/booking/8113/81055" audioType="audio described"/>
                    <show time="2019-07-24T10:00:00" url="https://booking.cineworld.co.uk/booking/8113/81054" audioType="audio described"/>
                    <show time="2019-07-25T10:00:00" url="https://booking.cineworld.co.uk/booking/8113/81053" audioType="audio described"/>
                </shows>
            </film>
            <film title="Rigoletto On The Lake" rating="TBC" url="films/rigoletto-on-the-lake" edi="270196" release="17/09/2019">
                <shows>
                    <show time="2019-09-17T19:00:00" url="https://booking.cineworld.co.uk/booking/8113/79262"/>
                </shows>
            </film>
            <film title="Rocketman" rating="15" url="films/rocketman" edi="256379" release="24/05/2019">
                <shows>
                    <show time="2019-07-24T18:50:00" url="https://booking.cineworld.co.uk/booking/8113/81329" audioType="audio described"/>
                    <show time="2019-07-24T21:30:00" url="https://booking.cineworld.co.uk/booking/8113/81330" audioType="audio described"/>
                </shows>
            </film>
            <film title="Rocketman : Sing-Along Version" rating="15" url="films/rocketman-sing-along-version" edi="263136" release="26/07/2019">
                <shows>
                    <show time="2019-07-26T19:30:00" url="https://booking.cineworld.co.uk/booking/8113/80988" audioType="audio described" subtitled="true"/>
                </shows>
            </film>
            <film title="Roger Waters  Us + Them" rating="12A" url="films/roger-waters-us-them" edi="276883" release="02/10/2019">
                <shows>
                    <show time="2019-10-02T19:30:00" url="https://booking.cineworld.co.uk/booking/8113/81353"/>
                </shows>
            </film>
            <film title="ROH Live Opera 2019 : Don Giovanni" rating="TBC" url="films/roh-live-opera-2019-don-giovanni" edi="274395" release="08/10/2019">
                <shows>
                    <show time="2019-10-08T18:45:00" url="https://booking.cineworld.co.uk/booking/8113/77785"/>
                </shows>
            </film>
            <film title="ROH Live Opera 2019 : Don Pasquale" rating="TBC" url="films/roh-live-opera-2019-don-pasquale" edi="274401" release="24/10/2019">
                <shows>
                    <show time="2019-10-24T19:30:00" url="https://booking.cineworld.co.uk/booking/8113/77786"/>
                </shows>
            </film>
            <film title="ROH Royal Ballet Live 2019 : Coppelia" rating="TBC" url="films/roh-royal-ballet-live-2019-coppelia" edi="274396" release="10/12/2019">
                <shows>
                    <show time="2019-12-10T19:15:00" url="https://booking.cineworld.co.uk/booking/8113/77788"/>
                </shows>
            </film>
            <film title="ROH Royal Ballet Live 2019 : Triple Bill" rating="TBC" url="films/roh-royal-ballet-live-2019-triple-bill" edi="274399" release="05/11/2019">
                <shows>
                    <show time="2019-11-05T19:15:00" url="https://booking.cineworld.co.uk/booking/8113/77787"/>
                </shows>
            </film>
            <film title="ROH Royal Ballet: The Nutckracker (2016 Recorded)" rating="TBC" url="films/roh-royal-ballet-the-nutckracker-2016-recorded" edi="277630" release="17/12/2019">
                <shows>
                    <show time="2019-12-17T19:15:00" url="https://booking.cineworld.co.uk/booking/8113/77789"/>
                </shows>
            </film>
            <film title="RSC Live : Measure For Measure" rating="12A" url="films/rsc-live-measure-for-measure" edi="263087" release="31/07/2019">
                <shows>
                    <show time="2019-07-31T19:00:00" url="https://booking.cineworld.co.uk/booking/8113/61772"/>
                </shows>
            </film>
            <film title="Secret Unlimited Screening 12" rating="15" url="films/secret-unlimited-screening-12" edi="801942" release="29/07/2019">
                <shows>
                    <show time="2019-07-29T20:00:00" url="https://booking.cineworld.co.uk/booking/8113/80468"/>
                </shows>
            </film>
            <film title="(ScreenX) Spider-Man : FAR FROM HOME" rating="12A" url="films/spider-man-far-from-home" edi="801860" release="02/07/2019">
                <shows>
                    <show time="2019-07-22T12:30:00" url="https://booking.cineworld.co.uk/booking/8113/81114" audioType="audio described"/>
                    <show time="2019-07-22T18:15:00" url="https://booking.cineworld.co.uk/booking/8113/81115" audioType="audio described"/>
                    <show time="2019-07-23T12:30:00" url="https://booking.cineworld.co.uk/booking/8113/81119" audioType="audio described"/>
                    <show time="2019-07-23T18:15:00" url="https://booking.cineworld.co.uk/booking/8113/81120" audioType="audio described"/>
                    <show time="2019-07-24T12:30:00" url="https://booking.cineworld.co.uk/booking/8113/81124" audioType="audio described"/>
                    <show time="2019-07-24T18:15:00" url="https://booking.cineworld.co.uk/booking/8113/81125" audioType="audio described"/>
                    <show time="2019-07-25T12:30:00" url="https://booking.cineworld.co.uk/booking/8113/81129" audioType="audio described"/>
                    <show time="2019-07-25T18:15:00" url="https://booking.cineworld.co.uk/booking/8113/81130" audioType="audio described"/>
                </shows>
            </film>
            <film title="(2D) Spider-Man: Far From Home" rating="12A" url="films/spider-man-far-from-home" edi="221205" release="02/07/2019">
                <shows>
                    <show time="2019-07-22T10:30:00" url="https://booking.cineworld.co.uk/booking/8113/81064"/>
                    <show time="2019-07-22T11:30:00" url="https://booking.cineworld.co.uk/booking/8113/81018" audioType="audio described"/>
                    <show time="2019-07-22T13:30:00" url="https://booking.cineworld.co.uk/booking/8113/81065"/>
                    <show time="2019-07-22T14:30:00" url="https://booking.cineworld.co.uk/booking/8113/81019" audioType="audio described"/>
                    <show time="2019-07-22T16:30:00" url="https://booking.cineworld.co.uk/booking/8113/81066"/>
                    <show time="2019-07-22T17:30:00" url="https://booking.cineworld.co.uk/booking/8113/81020" audioType="audio described"/>
                    <show time="2019-07-22T19:30:00" url="https://booking.cineworld.co.uk/booking/8113/81067"/>
                    <show time="2019-07-22T20:30:00" url="https://booking.cineworld.co.uk/booking/8113/81021" audioType="audio described"/>
                    <show time="2019-07-22T21:10:00" url="https://booking.cineworld.co.uk/booking/8113/81140"/>
                    <show time="2019-07-23T10:30:00" url="https://booking.cineworld.co.uk/booking/8113/81068"/>
                    <show time="2019-07-23T11:30:00" url="https://booking.cineworld.co.uk/booking/8113/81022" audioType="audio described"/>
                    <show time="2019-07-23T13:30:00" url="https://booking.cineworld.co.uk/booking/8113/81069"/>
                    <show time="2019-07-23T14:30:00" url="https://booking.cineworld.co.uk/booking/8113/81023" audioType="audio described"/>
                    <show time="2019-07-23T16:30:00" url="https://booking.cineworld.co.uk/booking/8113/81070"/>
                    <show time="2019-07-23T17:30:00" url="https://booking.cineworld.co.uk/booking/8113/81024" audioType="audio described" subtitled="true"/>
                    <show time="2019-07-23T19:30:00" url="https://booking.cineworld.co.uk/booking/8113/81071"/>
                    <show time="2019-07-23T20:30:00" url="https://booking.cineworld.co.uk/booking/8113/81025" audioType="audio described"/>
                    <show time="2019-07-23T21:10:00" url="https://booking.cineworld.co.uk/booking/8113/81141"/>
                    <show time="2019-07-24T11:30:00" url="https://booking.cineworld.co.uk/booking/8113/81026" audioType="audio described"/>
                    <show time="2019-07-24T13:30:00" url="https://booking.cineworld.co.uk/booking/8113/81073"/>
                    <show time="2019-07-24T14:30:00" url="https://booking.cineworld.co.uk/booking/8113/81027" audioType="audio described"/>
                    <show time="2019-07-24T16:30:00" url="https://booking.cineworld.co.uk/booking/8113/81074"/>
                    <show time="2019-07-24T17:30:00" url="https://booking.cineworld.co.uk/booking/8113/81028" audioType="audio described"/>
                    <show time="2019-07-24T19:30:00" url="https://booking.cineworld.co.uk/booking/8113/81075"/>
                    <show time="2019-07-24T20:30:00" url="https://booking.cineworld.co.uk/booking/8113/81029" audioType="audio described"/>
                    <show time="2019-07-24T21:10:00" url="https://booking.cineworld.co.uk/booking/8113/81142"/>
                    <show time="2019-07-25T10:30:00" url="https://booking.cineworld.co.uk/booking/8113/81076"/>
                    <show time="2019-07-25T11:30:00" url="https://booking.cineworld.co.uk/booking/8113/81041" audioType="audio described"/>
                    <show time="2019-07-25T13:30:00" url="https://booking.cineworld.co.uk/booking/8113/81077"/>
                    <show time="2019-07-25T14:30:00" url="https://booking.cineworld.co.uk/booking/8113/81042" audioType="audio described"/>
                    <show time="2019-07-25T16:30:00" url="https://booking.cineworld.co.uk/booking/8113/81078"/>
                    <show time="2019-07-25T17:30:00" url="https://booking.cineworld.co.uk/booking/8113/81043" audioType="audio described"/>
                    <show time="2019-07-25T19:30:00" url="https://booking.cineworld.co.uk/booking/8113/81079"/>
                    <show time="2019-07-25T20:30:00" url="https://booking.cineworld.co.uk/booking/8113/81044" audioType="audio described"/>
                </shows>
            </film>
            <film title="Stuber" rating="15" url="films/stuber" edi="258445" release="12/07/2019">
                <shows>
                    <show time="2019-07-22T17:15:00" url="https://booking.cineworld.co.uk/booking/8113/81263" audioType="audio described"/>
                    <show time="2019-07-22T21:20:00" url="https://booking.cineworld.co.uk/booking/8113/81179" audioType="audio described"/>
                    <show time="2019-07-23T17:15:00" url="https://booking.cineworld.co.uk/booking/8113/81275" audioType="audio described"/>
                    <show time="2019-07-23T21:20:00" url="https://booking.cineworld.co.uk/booking/8113/81178" audioType="audio described"/>
                    <show time="2019-07-24T17:15:00" url="https://booking.cineworld.co.uk/booking/8113/81278" audioType="audio described"/>
                    <show time="2019-07-24T21:20:00" url="https://booking.cineworld.co.uk/booking/8113/81177" audioType="audio described"/>
                    <show time="2019-07-25T17:15:00" url="https://booking.cineworld.co.uk/booking/8113/81279" audioType="audio described"/>
                    <show time="2019-07-25T21:20:00" url="https://booking.cineworld.co.uk/booking/8113/81176" audioType="audio described"/>
                </shows>
            </film>
            <film title="The Dead Don't Die" rating="15" url="films/the-dead-dont-die" edi="276105" release="12/07/2019">
                <shows>
                    <show time="2019-07-22T19:00:00" url="https://booking.cineworld.co.uk/booking/8113/81324" audioType="audio described"/>
                    <show time="2019-07-22T21:20:00" url="https://booking.cineworld.co.uk/booking/8113/81325" audioType="audio described"/>
                </shows>
            </film>
            <film title="(4DX 3D) The Lion King" rating="PG" url="films/the-lion-king" edi="801933" release="19/07/2019">
                <shows>
                    <show time="2019-07-22T11:45:00" url="https://booking.cineworld.co.uk/booking/8113/79949" videoType="3d" audioType="audio described"/>
                    <show time="2019-07-22T14:40:00" url="https://booking.cineworld.co.uk/booking/8113/79950" videoType="3d" audioType="audio described"/>
                    <show time="2019-07-22T17:40:00" url="https://booking.cineworld.co.uk/booking/8113/79951" videoType="3d" audioType="audio described"/>
                    <show time="2019-07-22T20:40:00" url="https://booking.cineworld.co.uk/booking/8113/79952" videoType="3d" audioType="audio described"/>
                    <show time="2019-07-23T11:40:00" url="https://booking.cineworld.co.uk/booking/8113/79953" videoType="3d" audioType="audio described"/>
                    <show time="2019-07-23T14:40:00" url="https://booking.cineworld.co.uk/booking/8113/79954" videoType="3d" audioType="audio described"/>
                    <show time="2019-07-23T17:40:00" url="https://booking.cineworld.co.uk/booking/8113/79955" videoType="3d" audioType="audio described"/>
                    <show time="2019-07-23T20:40:00" url="https://booking.cineworld.co.uk/booking/8113/79956" videoType="3d" audioType="audio described"/>
                    <show time="2019-07-24T11:40:00" url="https://booking.cineworld.co.uk/booking/8113/79957" videoType="3d" audioType="audio described"/>
                    <show time="2019-07-24T14:40:00" url="https://booking.cineworld.co.uk/booking/8113/79958" videoType="3d" audioType="audio described"/>
                    <show time="2019-07-24T17:40:00" url="https://booking.cineworld.co.uk/booking/8113/79959" videoType="3d" audioType="audio described"/>
                    <show time="2019-07-24T20:40:00" url="https://booking.cineworld.co.uk/booking/8113/79960" videoType="3d" audioType="audio described"/>
                    <show time="2019-07-25T11:40:00" url="https://booking.cineworld.co.uk/booking/8113/81088" videoType="3d" audioType="audio described"/>
                    <show time="2019-07-25T14:40:00" url="https://booking.cineworld.co.uk/booking/8113/81089" videoType="3d" audioType="audio described"/>
                    <show time="2019-07-25T17:40:00" url="https://booking.cineworld.co.uk/booking/8113/81090" videoType="3d" audioType="audio described"/>
                </shows>
            </film>
            <film title="(2D) The Lion King" rating="PG" url="films/the-lion-king" edi="229583" release="19/07/2019">
                <shows>
                    <show time="2019-07-22T10:20:00" url="https://booking.cineworld.co.uk/booking/8113/79928" audioType="audio described"/>
                    <show time="2019-07-22T10:40:00" url="https://booking.cineworld.co.uk/booking/8113/79752"/>
                    <show time="2019-07-22T11:20:00" url="https://booking.cineworld.co.uk/booking/8113/79899" audioType="audio described"/>
                    <show time="2019-07-22T12:00:00" url="https://booking.cineworld.co.uk/booking/8113/79835"/>
                    <show time="2019-07-22T12:30:00" url="https://booking.cineworld.co.uk/booking/8113/79851"/>
                    <show time="2019-07-22T12:40:00" url="https://booking.cineworld.co.uk/booking/8113/79771" audioType="audio described"/>
                    <show time="2019-07-22T13:20:00" url="https://booking.cineworld.co.uk/booking/8113/79929" audioType="audio described"/>
                    <show time="2019-07-22T13:40:00" url="https://booking.cineworld.co.uk/booking/8113/79753"/>
                    <show time="2019-07-22T14:20:00" url="https://booking.cineworld.co.uk/booking/8113/79900" audioType="audio described"/>
                    <show time="2019-07-22T15:00:00" url="https://booking.cineworld.co.uk/booking/8113/79836"/>
                    <show time="2019-07-22T15:20:00" url="https://booking.cineworld.co.uk/booking/8113/79852"/>
                    <show time="2019-07-22T15:40:00" url="https://booking.cineworld.co.uk/booking/8113/79772" audioType="audio described"/>
                    <show time="2019-07-22T16:20:00" url="https://booking.cineworld.co.uk/booking/8113/79930" audioType="audio described"/>
                    <show time="2019-07-22T16:40:00" url="https://booking.cineworld.co.uk/booking/8113/79754"/>
                    <show time="2019-07-22T17:20:00" url="https://booking.cineworld.co.uk/booking/8113/79901" audioType="audio described"/>
                    <show time="2019-07-22T18:00:00" url="https://booking.cineworld.co.uk/booking/8113/79826" audioType="audio described" subtitled="true"/>
                    <show time="2019-07-22T18:40:00" url="https://booking.cineworld.co.uk/booking/8113/79766" audioType="audio described"/>
                    <show time="2019-07-22T19:20:00" url="https://booking.cineworld.co.uk/booking/8113/79931" audioType="audio described"/>
                    <show time="2019-07-22T19:40:00" url="https://booking.cineworld.co.uk/booking/8113/79740"/>
                    <show time="2019-07-22T20:20:00" url="https://booking.cineworld.co.uk/booking/8113/79902" audioType="audio described"/>
                    <show time="2019-07-22T21:30:00" url="https://booking.cineworld.co.uk/booking/8113/81046" audioType="audio described"/>
                    <show time="2019-07-23T10:20:00" url="https://booking.cineworld.co.uk/booking/8113/79911" audioType="audio described"/>
                    <show time="2019-07-23T10:40:00" url="https://booking.cineworld.co.uk/booking/8113/79755"/>
                    <show time="2019-07-23T11:20:00" url="https://booking.cineworld.co.uk/booking/8113/79903" audioType="audio described"/>
                    <show time="2019-07-23T12:00:00" url="https://booking.cineworld.co.uk/booking/8113/79837"/>
                    <show time="2019-07-23T12:20:00" url="https://booking.cineworld.co.uk/booking/8113/79854"/>
                    <show time="2019-07-23T12:40:00" url="https://booking.cineworld.co.uk/booking/8113/79773" audioType="audio described"/>
                    <show time="2019-07-23T13:20:00" url="https://booking.cineworld.co.uk/booking/8113/79912" audioType="audio described"/>
                    <show time="2019-07-23T13:40:00" url="https://booking.cineworld.co.uk/booking/8113/79756"/>
                    <show time="2019-07-23T14:20:00" url="https://booking.cineworld.co.uk/booking/8113/79904" audioType="audio described"/>
                    <show time="2019-07-23T15:00:00" url="https://booking.cineworld.co.uk/booking/8113/79838"/>
                    <show time="2019-07-23T15:20:00" url="https://booking.cineworld.co.uk/booking/8113/79855"/>
                    <show time="2019-07-23T15:40:00" url="https://booking.cineworld.co.uk/booking/8113/79774" audioType="audio described"/>
                    <show time="2019-07-23T16:20:00" url="https://booking.cineworld.co.uk/booking/8113/79913" audioType="audio described"/>
                    <show time="2019-07-23T16:40:00" url="https://booking.cineworld.co.uk/booking/8113/79757"/>
                    <show time="2019-07-23T17:20:00" url="https://booking.cineworld.co.uk/booking/8113/79905" audioType="audio described"/>
                    <show time="2019-07-23T18:00:00" url="https://booking.cineworld.co.uk/booking/8113/79827"/>
                    <show time="2019-07-23T18:40:00" url="https://booking.cineworld.co.uk/booking/8113/79767" audioType="audio described"/>
                    <show time="2019-07-23T19:20:00" url="https://booking.cineworld.co.uk/booking/8113/79914" audioType="audio described"/>
                    <show time="2019-07-23T19:40:00" url="https://booking.cineworld.co.uk/booking/8113/79741"/>
                    <show time="2019-07-23T20:20:00" url="https://booking.cineworld.co.uk/booking/8113/79906" audioType="audio described"/>
                    <show time="2019-07-23T21:30:00" url="https://booking.cineworld.co.uk/booking/8113/81047" audioType="audio described"/>
                    <show time="2019-07-24T09:40:00" url="https://booking.cineworld.co.uk/booking/8113/81320"/>
                    <show time="2019-07-24T10:20:00" url="https://booking.cineworld.co.uk/booking/8113/79932" audioType="audio described"/>
                    <show time="2019-07-24T10:40:00" url="https://booking.cineworld.co.uk/booking/8113/79758"/>
                    <show time="2019-07-24T11:20:00" url="https://booking.cineworld.co.uk/booking/8113/79907" audioType="audio described"/>
                    <show time="2019-07-24T12:10:00" url="https://booking.cineworld.co.uk/booking/8113/79839"/>
                    <show time="2019-07-24T12:20:00" url="https://booking.cineworld.co.uk/booking/8113/79857"/>
                    <show time="2019-07-24T12:40:00" url="https://booking.cineworld.co.uk/booking/8113/79775" audioType="audio described"/>
                    <show time="2019-07-24T13:20:00" url="https://booking.cineworld.co.uk/booking/8113/79933" audioType="audio described"/>
                    <show time="2019-07-24T13:50:00" url="https://booking.cineworld.co.uk/booking/8113/79759"/>
                    <show time="2019-07-24T14:20:00" url="https://booking.cineworld.co.uk/booking/8113/79908" audioType="audio described"/>
                    <show time="2019-07-24T15:00:00" url="https://booking.cineworld.co.uk/booking/8113/79840"/>
                    <show time="2019-07-24T15:20:00" url="https://booking.cineworld.co.uk/booking/8113/79858"/>
                    <show time="2019-07-24T15:40:00" url="https://booking.cineworld.co.uk/booking/8113/79776" audioType="audio described"/>
                    <show time="2019-07-24T16:20:00" url="https://booking.cineworld.co.uk/booking/8113/79934" audioType="audio described"/>
                    <show time="2019-07-24T16:40:00" url="https://booking.cineworld.co.uk/booking/8113/79760"/>
                    <show time="2019-07-24T17:20:00" url="https://booking.cineworld.co.uk/booking/8113/79909" audioType="audio described"/>
                    <show time="2019-07-24T18:00:00" url="https://booking.cineworld.co.uk/booking/8113/79828"/>
                    <show time="2019-07-24T18:40:00" url="https://booking.cineworld.co.uk/booking/8113/79768" audioType="audio described"/>
                    <show time="2019-07-24T19:20:00" url="https://booking.cineworld.co.uk/booking/8113/79935" audioType="audio described"/>
                    <show time="2019-07-24T19:40:00" url="https://booking.cineworld.co.uk/booking/8113/79742"/>
                    <show time="2019-07-24T20:20:00" url="https://booking.cineworld.co.uk/booking/8113/79910" audioType="audio described"/>
                    <show time="2019-07-24T21:30:00" url="https://booking.cineworld.co.uk/booking/8113/81048" audioType="audio described"/>
                    <show time="2019-07-25T09:30:00" url="https://booking.cineworld.co.uk/booking/8113/81318" audioType="audio described" subtitled="true"/>
                    <show time="2019-07-25T10:20:00" url="https://booking.cineworld.co.uk/booking/8113/81038" audioType="audio described"/>
                    <show time="2019-07-25T10:40:00" url="https://booking.cineworld.co.uk/booking/8113/81158"/>
                    <show time="2019-07-25T11:20:00" url="https://booking.cineworld.co.uk/booking/8113/81092" audioType="audio described"/>
                    <show time="2019-07-25T12:00:00" url="https://booking.cineworld.co.uk/booking/8113/80997"/>
                    <show time="2019-07-25T12:20:00" url="https://booking.cineworld.co.uk/booking/8113/81143"/>
                    <show time="2019-07-25T12:40:00" url="https://booking.cineworld.co.uk/booking/8113/81049" audioType="audio described"/>
                    <show time="2019-07-25T13:20:00" url="https://booking.cineworld.co.uk/booking/8113/81039" audioType="audio described"/>
                    <show time="2019-07-25T13:40:00" url="https://booking.cineworld.co.uk/booking/8113/81159"/>
                    <show time="2019-07-25T14:20:00" url="https://booking.cineworld.co.uk/booking/8113/81093" audioType="audio described"/>
                    <show time="2019-07-25T15:00:00" url="https://booking.cineworld.co.uk/booking/8113/80998"/>
                    <show time="2019-07-25T15:20:00" url="https://booking.cineworld.co.uk/booking/8113/81144"/>
                    <show time="2019-07-25T15:40:00" url="https://booking.cineworld.co.uk/booking/8113/81050" audioType="audio described"/>
                    <show time="2019-07-25T16:20:00" url="https://booking.cineworld.co.uk/booking/8113/81040" audioType="audio described"/>
                    <show time="2019-07-25T16:40:00" url="https://booking.cineworld.co.uk/booking/8113/81160"/>
                    <show time="2019-07-25T17:20:00" url="https://booking.cineworld.co.uk/booking/8113/81094" audioType="audio described"/>
                    <show time="2019-07-25T18:00:00" url="https://booking.cineworld.co.uk/booking/8113/80999"/>
                    <show time="2019-07-25T18:40:00" url="https://booking.cineworld.co.uk/booking/8113/81051" audioType="audio described"/>
                    <show time="2019-07-25T19:40:00" url="https://booking.cineworld.co.uk/booking/8113/81161"/>
                    <show time="2019-07-25T20:20:00" url="https://booking.cineworld.co.uk/booking/8113/81095" audioType="audio described" subtitled="true"/>
                    <show time="2019-07-25T21:00:00" url="https://booking.cineworld.co.uk/booking/8113/81145"/>
                    <show time="2019-07-25T21:30:00" url="https://booking.cineworld.co.uk/booking/8113/81052" audioType="audio described"/>
                </shows>
            </film>
            <film title="(IMAX) The Lion King" rating="PG" url="films/the-lion-king" edi="245703" release="19/07/2019">
                <shows>
                    <show time="2019-07-22T11:00:00" url="https://booking.cineworld.co.uk/booking/8113/79719" videoType="imax"/>
                    <show time="2019-07-22T14:00:00" url="https://booking.cineworld.co.uk/booking/8113/79720" videoType="imax"/>
                    <show time="2019-07-23T11:00:00" url="https://booking.cineworld.co.uk/booking/8113/79721" videoType="imax"/>
                    <show time="2019-07-23T14:00:00" url="https://booking.cineworld.co.uk/booking/8113/79722" videoType="imax"/>
                    <show time="2019-07-24T11:00:00" url="https://booking.cineworld.co.uk/booking/8113/79723" videoType="imax"/>
                    <show time="2019-07-24T14:00:00" url="https://booking.cineworld.co.uk/booking/8113/79724" videoType="imax"/>
                    <show time="2019-07-25T11:00:00" url="https://booking.cineworld.co.uk/booking/8113/80993" videoType="imax"/>
                    <show time="2019-07-25T14:00:00" url="https://booking.cineworld.co.uk/booking/8113/80994" videoType="imax"/>
                </shows>
            </film>
            <film title="(IMAX 3-D) The Lion King" rating="PG" url="films/the-lion-king" edi="245702" release="19/07/2019">
                <shows>
                    <show time="2019-07-22T17:00:00" url="https://booking.cineworld.co.uk/booking/8113/79731" videoType="imax 3d"/>
                    <show time="2019-07-22T20:00:00" url="https://booking.cineworld.co.uk/booking/8113/79732" videoType="imax 3d"/>
                    <show time="2019-07-23T17:00:00" url="https://booking.cineworld.co.uk/booking/8113/79733" videoType="imax 3d"/>
                    <show time="2019-07-23T20:00:00" url="https://booking.cineworld.co.uk/booking/8113/79734" videoType="imax 3d"/>
                    <show time="2019-07-24T17:00:00" url="https://booking.cineworld.co.uk/booking/8113/79735" videoType="imax 3d"/>
                    <show time="2019-07-24T20:00:00" url="https://booking.cineworld.co.uk/booking/8113/79736" videoType="imax 3d"/>
                    <show time="2019-07-25T17:00:00" url="https://booking.cineworld.co.uk/booking/8113/80995" videoType="imax 3d"/>
                    <show time="2019-07-25T20:00:00" url="https://booking.cineworld.co.uk/booking/8113/80996" videoType="imax 3d"/>
                </shows>
            </film>
            <film title="(3D) The Lion King" rating="PG" url="films/the-lion-king" edi="229584" release="19/07/2019">
                <shows>
                    <show time="2019-07-22T10:00:00" url="https://booking.cineworld.co.uk/booking/8113/79792" videoType="3d" audioType="audio described"/>
                    <show time="2019-07-22T13:00:00" url="https://booking.cineworld.co.uk/booking/8113/79793" videoType="3d" audioType="audio described"/>
                    <show time="2019-07-22T16:00:00" url="https://booking.cineworld.co.uk/booking/8113/79794" videoType="3d" audioType="audio described"/>
                    <show time="2019-07-22T19:00:00" url="https://booking.cineworld.co.uk/booking/8113/79780" videoType="3d" audioType="audio described"/>
                    <show time="2019-07-22T21:40:00" url="https://booking.cineworld.co.uk/booking/8113/81326" videoType="3d" audioType="audio described"/>
                    <show time="2019-07-23T10:00:00" url="https://booking.cineworld.co.uk/booking/8113/79795" videoType="3d" audioType="audio described"/>
                    <show time="2019-07-23T13:00:00" url="https://booking.cineworld.co.uk/booking/8113/79796" videoType="3d" audioType="audio described"/>
                    <show time="2019-07-23T16:00:00" url="https://booking.cineworld.co.uk/booking/8113/79797" videoType="3d" audioType="audio described"/>
                    <show time="2019-07-23T19:00:00" url="https://booking.cineworld.co.uk/booking/8113/79781" videoType="3d" audioType="audio described"/>
                    <show time="2019-07-23T21:40:00" url="https://booking.cineworld.co.uk/booking/8113/81312" videoType="3d" audioType="audio described"/>
                    <show time="2019-07-24T10:00:00" url="https://booking.cineworld.co.uk/booking/8113/79798" videoType="3d" audioType="audio described"/>
                    <show time="2019-07-24T13:00:00" url="https://booking.cineworld.co.uk/booking/8113/79799" videoType="3d" audioType="audio described"/>
                    <show time="2019-07-24T16:00:00" url="https://booking.cineworld.co.uk/booking/8113/79800" videoType="3d" audioType="audio described"/>
                    <show time="2019-07-24T19:00:00" url="https://booking.cineworld.co.uk/booking/8113/79782" videoType="3d" audioType="audio described"/>
                    <show time="2019-07-24T21:40:00" url="https://booking.cineworld.co.uk/booking/8113/81313" videoType="3d" audioType="audio described"/>
                    <show time="2019-07-25T10:00:00" url="https://booking.cineworld.co.uk/booking/8113/81131" videoType="3d" audioType="audio described"/>
                    <show time="2019-07-25T13:00:00" url="https://booking.cineworld.co.uk/booking/8113/81132" videoType="3d" audioType="audio described"/>
                    <show time="2019-07-25T16:00:00" url="https://booking.cineworld.co.uk/booking/8113/81133" videoType="3d" audioType="audio described"/>
                    <show time="2019-07-25T19:00:00" url="https://booking.cineworld.co.uk/booking/8113/81134" videoType="3d" audioType="audio described"/>
                    <show time="2019-07-25T21:40:00" url="https://booking.cineworld.co.uk/booking/8113/81317" videoType="3d" audioType="audio described"/>
                </shows>
            </film>
            <film title="The Matrix : 20th Anniversary (4K Restoration)" rating="15" url="films/the-matrix-20th-anniversary-4k-restoration" edi="105580" release="13/07/2019">
                <shows>
                    <show time="2019-07-30T20:00:00" url="https://booking.cineworld.co.uk/booking/8113/81347"/>
                </shows>
            </film>
            <film title="The Queen's Corgi" rating="PG" url="films/the-queens-corgi" edi="245222" release="05/07/2019">
                <shows>
                    <show time="2019-07-22T10:00:00" url="https://booking.cineworld.co.uk/booking/8113/81286" audioType="audio described"/>
                    <show time="2019-07-23T10:00:00" url="https://booking.cineworld.co.uk/booking/8113/81287" audioType="audio described"/>
                    <show time="2019-07-23T12:10:00" url="https://booking.cineworld.co.uk/booking/8113/81288" audioType="audio described"/>
                    <show time="2019-07-24T10:00:00" url="https://booking.cineworld.co.uk/booking/8113/81289" audioType="audio described"/>
                    <show time="2019-07-24T12:10:00" url="https://booking.cineworld.co.uk/booking/8113/81290" audioType="audio described"/>
                    <show time="2019-07-25T10:00:00" url="https://booking.cineworld.co.uk/booking/8113/81291" audioType="audio described"/>
                    <show time="2019-07-25T12:10:00" url="https://booking.cineworld.co.uk/booking/8113/81292" audioType="audio described"/>
                </shows>
            </film>
            <film title="The Secret Life Of Pets 2" rating="U" url="films/the-secret-life-of-pets-2" edi="192838" release="24/05/2019">
                <shows>
                    <show time="2019-07-23T10:10:00" url="https://booking.cineworld.co.uk/booking/8113/81155"/>
                    <show time="2019-07-24T10:10:00" url="https://booking.cineworld.co.uk/booking/8113/81156"/>
                    <show time="2019-07-25T10:10:00" url="https://booking.cineworld.co.uk/booking/8113/81157"/>
                </shows>
            </film>
            <film title="(2D) Toy Story 4" rating="U" url="films/toy-story-4" edi="148687" release="21/06/2019">
                <shows>
                    <show time="2019-07-22T10:10:00" url="https://booking.cineworld.co.uk/booking/8113/81242" audioType="audio described"/>
                    <show time="2019-07-22T11:30:00" url="https://booking.cineworld.co.uk/booking/8113/81209" audioType="audio described"/>
                    <show time="2019-07-22T12:10:00" url="https://booking.cineworld.co.uk/booking/8113/81260" audioType="audio described"/>
                    <show time="2019-07-22T14:00:00" url="https://booking.cineworld.co.uk/booking/8113/81210" audioType="audio described"/>
                    <show time="2019-07-22T15:10:00" url="https://booking.cineworld.co.uk/booking/8113/81239" audioType="audio described"/>
                    <show time="2019-07-22T16:30:00" url="https://booking.cineworld.co.uk/booking/8113/81211" audioType="audio described"/>
                    <show time="2019-07-22T17:40:00" url="https://booking.cineworld.co.uk/booking/8113/81240" audioType="audio described"/>
                    <show time="2019-07-22T20:10:00" url="https://booking.cineworld.co.uk/booking/8113/81241" audioType="audio described"/>
                    <show time="2019-07-23T10:10:00" url="https://booking.cineworld.co.uk/booking/8113/81247" audioType="audio described"/>
                    <show time="2019-07-23T11:30:00" url="https://booking.cineworld.co.uk/booking/8113/81213" audioType="audio described"/>
                    <show time="2019-07-23T12:40:00" url="https://booking.cineworld.co.uk/booking/8113/81243" audioType="audio described"/>
                    <show time="2019-07-23T14:00:00" url="https://booking.cineworld.co.uk/booking/8113/81214" audioType="audio described"/>
                    <show time="2019-07-23T15:10:00" url="https://booking.cineworld.co.uk/booking/8113/81244" audioType="audio described"/>
                    <show time="2019-07-23T16:30:00" url="https://booking.cineworld.co.uk/booking/8113/81215" audioType="audio described"/>
                    <show time="2019-07-23T17:40:00" url="https://booking.cineworld.co.uk/booking/8113/81245" audioType="audio described"/>
                    <show time="2019-07-23T20:10:00" url="https://booking.cineworld.co.uk/booking/8113/81246" audioType="audio described"/>
                    <show time="2019-07-24T10:10:00" url="https://booking.cineworld.co.uk/booking/8113/81252" audioType="audio described"/>
                    <show time="2019-07-24T11:30:00" url="https://booking.cineworld.co.uk/booking/8113/81217" audioType="audio described"/>
                    <show time="2019-07-24T12:40:00" url="https://booking.cineworld.co.uk/booking/8113/81248" audioType="audio described"/>
                    <show time="2019-07-24T14:00:00" url="https://booking.cineworld.co.uk/booking/8113/81218" audioType="audio described"/>
                    <show time="2019-07-24T15:10:00" url="https://booking.cineworld.co.uk/booking/8113/81249" audioType="audio described"/>
                    <show time="2019-07-24T16:30:00" url="https://booking.cineworld.co.uk/booking/8113/81219" audioType="audio described"/>
                    <show time="2019-07-24T17:40:00" url="https://booking.cineworld.co.uk/booking/8113/81250" audioType="audio described"/>
                    <show time="2019-07-24T20:10:00" url="https://booking.cineworld.co.uk/booking/8113/81251" audioType="audio described"/>
                    <show time="2019-07-25T10:10:00" url="https://booking.cineworld.co.uk/booking/8113/81257" audioType="audio described"/>
                    <show time="2019-07-25T11:30:00" url="https://booking.cineworld.co.uk/booking/8113/81221" audioType="audio described"/>
                    <show time="2019-07-25T12:40:00" url="https://booking.cineworld.co.uk/booking/8113/81253" audioType="audio described"/>
                    <show time="2019-07-25T14:00:00" url="https://booking.cineworld.co.uk/booking/8113/81222" audioType="audio described"/>
                    <show time="2019-07-25T15:10:00" url="https://booking.cineworld.co.uk/booking/8113/81254" audioType="audio described"/>
                    <show time="2019-07-25T16:30:00" url="https://booking.cineworld.co.uk/booking/8113/81223" audioType="audio described"/>
                    <show time="2019-07-25T17:40:00" url="https://booking.cineworld.co.uk/booking/8113/81255" audioType="audio described"/>
                    <show time="2019-07-25T19:00:00" url="https://booking.cineworld.co.uk/booking/8113/81224" audioType="audio described"/>
                    <show time="2019-07-25T20:10:00" url="https://booking.cineworld.co.uk/booking/8113/81256" audioType="audio described"/>
                </shows>
            </film>
            <film title="Wise Children" rating="15" url="films/wise-children" edi="273976" release="03/10/2019">
                <shows>
                    <show time="2019-10-03T19:30:00" url="https://booking.cineworld.co.uk/booking/8113/76783"/>
                </shows>
            </film>
            <film title="Yesterday" rating="12A" url="films/yesterday" edi="253917" release="28/06/2019">
                <shows>
                    <show time="2019-07-22T15:50:00" url="https://booking.cineworld.co.uk/booking/8113/81189" audioType="audio described"/>
                    <show time="2019-07-22T18:30:00" url="https://booking.cineworld.co.uk/booking/8113/81190" audioType="audio described"/>
                    <show time="2019-07-22T20:50:00" url="https://booking.cineworld.co.uk/booking/8113/81010"/>
                    <show time="2019-07-23T15:50:00" url="https://booking.cineworld.co.uk/booking/8113/81191" audioType="audio described"/>
                    <show time="2019-07-23T18:30:00" url="https://booking.cineworld.co.uk/booking/8113/81192" audioType="audio described"/>
                    <show time="2019-07-23T20:50:00" url="https://booking.cineworld.co.uk/booking/8113/81011"/>
                    <show time="2019-07-24T15:50:00" url="https://booking.cineworld.co.uk/booking/8113/81193" audioType="audio described"/>
                    <show time="2019-07-24T18:30:00" url="https://booking.cineworld.co.uk/booking/8113/81194" audioType="audio described"/>
                    <show time="2019-07-24T20:50:00" url="https://booking.cineworld.co.uk/booking/8113/81012"/>
                    <show time="2019-07-25T15:50:00" url="https://booking.cineworld.co.uk/booking/8113/81195" audioType="audio described"/>
                    <show time="2019-07-25T18:30:00" url="https://booking.cineworld.co.uk/booking/8113/81196" audioType="audio described"/>
                    <show time="2019-07-25T20:50:00" url="https://booking.cineworld.co.uk/booking/8113/81013"/>
                </shows>
            </film>
        </listing>
    </cinema>
    <cinema name="Cineworld Bedford" root="http://www1.cineworld.co.uk/" url="cinemas/bedford" id="34" phone="0871 200 2000" address="Aspects Leisure Park, Newnham Avenue, Bedford" postcode="MK41 9LW">
        <listing>
            <film title="Andre Rieu 2019 Maastricht Concert Shall We Dance?" rating="PG" url="films/andre-rieu-2019-maastricht-concert-shall-we-dance" edi="255443" release="27/07/2019">
                <shows>
                    <show time="2019-07-27T19:00:00" url="https://booking.cineworld.co.uk/booking/8019/63412"/>
                    <show time="2019-07-28T15:00:00" url="https://booking.cineworld.co.uk/booking/8019/63413"/>
                </shows>
            </film>
            <film title="Autism Friendly Screening: The Lion King (2019)" rating="PG" url="films/autism-friendly-screening-the-lion-king-2019" edi="801945" release="19/07/2019">
                <shows>
                    <show time="2019-08-04T11:00:00" url="https://booking.cineworld.co.uk/booking/8019/66989" audioType="audio described"/>
                </shows>
            </film>
            <film title="Bolshoi Ballet 2019 : Le Corsaire" rating="12A" url="films/bolshoi-ballet-2019-le-corsaire" edi="276116" release="17/11/2019">
                <shows>
                    <show time="2019-11-17T15:00:00" url="https://booking.cineworld.co.uk/booking/8019/65838"/>
                </shows>
            </film>
            <film title="Bolshoi Ballet 2019 : Raymonda" rating="12A" url="films/bolshoi-ballet-2019-raymonda" edi="276119" release="27/10/2019">
                <shows>
                    <show time="2019-10-27T15:00:00" url="https://booking.cineworld.co.uk/booking/8019/65837"/>
                </shows>
            </film>
            <film title="Bolshoi Ballet 2019 : The Nutcracker" rating="12A" url="films/bolshoi-ballet-2019-the-nutcracker" edi="276117" release="15/12/2019">
                <shows>
                    <show time="2019-12-15T15:00:00" url="https://booking.cineworld.co.uk/booking/8019/65839"/>
                </shows>
            </film>
            <film title="Dracula - Northern Ballet Live" rating="12A" url="films/dracula-northern-ballet-live" edi="270199" release="31/10/2019">
                <shows>
                    <show time="2019-10-31T19:15:00" url="https://booking.cineworld.co.uk/booking/8019/63395"/>
                </shows>
            </film>
            <film title="Fast &amp; Furious: Hobbs &amp; Shaw" rating="TBC" url="films/fast-furious-hobbs-shaw" edi="240260" release="02/08/2019">
                <shows>
                    <show time="2019-08-01T20:30:00" url="https://booking.cineworld.co.uk/booking/8019/66380" audioType="audio described"/>
                    <show time="2019-08-02T20:30:00" url="https://booking.cineworld.co.uk/booking/8019/66381" audioType="audio described"/>
                    <show time="2019-08-03T20:30:00" url="https://booking.cineworld.co.uk/booking/8019/66382" audioType="audio described"/>
                    <show time="2019-08-04T20:30:00" url="https://booking.cineworld.co.uk/booking/8019/66383" audioType="audio described"/>
                </shows>
            </film>
            <film title="Gauguin From The National Gallery, London" rating="12A" url="films/gauguin-from-the-national-gallery-london" edi="272070" release="15/11/2019">
                <shows>
                    <show time="2019-10-15T12:00:00" url="https://booking.cineworld.co.uk/booking/8019/66639"/>
                    <show time="2019-10-15T19:30:00" url="https://booking.cineworld.co.uk/booking/8019/66638"/>
                </shows>
            </film>
            <film title="Glyndebourne 2019: The Magic Flute (Die t" rating="12A" url="films/glyndebourne-2019-the-magic-flute-die-zauberflote-live" edi="273310" release="04/08/2019">
                <shows>
                    <show time="2019-08-04T17:30:00" url="https://booking.cineworld.co.uk/booking/8019/64496"/>
                </shows>
            </film>
            <film title="Margaret Atwood : Live In Cinemas" rating="12A" url="films/margaret-atwood-live-in-cinemas" edi="272858" release="10/09/2019">
                <shows>
                    <show time="2019-09-10T19:30:00" url="https://booking.cineworld.co.uk/booking/8019/64370"/>
                </shows>
            </film>
            <film title="Met Opera 2019-20: Akhnaten" rating="TBC" url="films/met-opera-2019-20-akhnaten" edi="274678" release="23/11/2019">
                <shows>
                    <show time="2019-11-23T17:55:00" url="https://booking.cineworld.co.uk/booking/8019/67132"/>
                </shows>
            </film>
            <film title="MET Opera 2019-20: Madama Butterfly" rating="TBC" url="films/met-opera-2019-20-madama-butterfly" edi="274682" release="09/11/2019">
                <shows>
                    <show time="2019-11-09T17:55:00" url="https://booking.cineworld.co.uk/booking/8019/67131"/>
                </shows>
            </film>
            <film title="MET Opera 2019-20: Manon" rating="TBC" url="films/met-opera-2019-20-manon" edi="274680" release="26/10/2019">
                <shows>
                    <show time="2019-10-26T17:55:00" url="https://booking.cineworld.co.uk/booking/8019/67130"/>
                </shows>
            </film>
            <film title="MET Opera 2019-20: Turandot" rating="TBC" url="films/met-opera-2019-20-turandot" edi="274672" release="12/10/2019">
                <shows>
                    <show time="2019-10-12T17:55:00" url="https://booking.cineworld.co.uk/booking/8019/67129"/>
                </shows>
            </film>
            <film title="NT Live: A Midsummer Night's Dream" rating="12A" url="films/nt-live-a-midsummer-nights-dream" edi="274950" release="17/10/2019">
                <shows>
                    <show time="2019-10-17T19:00:00" url="https://booking.cineworld.co.uk/booking/8019/66386"/>
                </shows>
            </film>
            <film title="NT Live: Hansard" rating="15" url="films/nt-live-hansard" edi="270878" release="07/11/2019">
                <shows>
                    <show time="2019-11-07T19:00:00" url="https://booking.cineworld.co.uk/booking/8019/66387"/>
                </shows>
            </film>
            <film title="NT Live : One Man, Two Guvnors (Encore)" rating="12A" url="films/nt-live-one-man-two-guvnors-encore" edi="266343" release="26/09/2019">
                <shows>
                    <show time="2019-09-26T19:00:00" url="https://booking.cineworld.co.uk/booking/8019/65157"/>
                </shows>
            </film>
            <film title="NT Live: Present Laughter" rating="12A" url="films/nt-live-present-laughter" edi="278033" release="28/11/2019">
                <shows>
                    <show time="2019-11-28T19:00:00" url="https://booking.cineworld.co.uk/booking/8019/66388"/>
                </shows>
            </film>
            <film title="NT Live : The Lehman Trilogy" rating="12A" url="films/nt-live-the-lehman-trilogy" edi="266345" release="25/07/2019">
                <shows>
                    <show time="2019-07-25T19:00:00" url="https://booking.cineworld.co.uk/booking/8019/65156"/>
                </shows>
            </film>
            <film title="M4J Paw Patrol: Mighty Pups - The Movie" rating="U" url="films/paw-patrol-mighty-pups-movies-for-juniors" edi="801924" release="19/07/2019">
                <shows>
                    <show time="2019-07-22T10:00:00" url="https://booking.cineworld.co.uk/booking/8019/67168" audioType="audio described"/>
                    <show time="2019-07-23T10:00:00" url="https://booking.cineworld.co.uk/booking/8019/67169" audioType="audio described"/>
                    <show time="2019-07-24T10:00:00" url="https://booking.cineworld.co.uk/booking/8019/67170" audioType="audio described"/>
                    <show time="2019-07-25T10:00:00" url="https://booking.cineworld.co.uk/booking/8019/67202" audioType="audio described"/>
                </shows>
            </film>
            <film title="Placido Domingo 50th Anniversary Concert" rating="TBC" url="films/placido-domingo-50th-anniversary-concert" edi="270187" release="01/10/2019">
                <shows>
                    <show time="2019-10-01T19:00:00" url="https://booking.cineworld.co.uk/booking/8019/66637"/>
                </shows>
            </film>
            <film title="Rigoletto On The Lake" rating="TBC" url="films/rigoletto-on-the-lake" edi="270196" release="17/09/2019">
                <shows>
                    <show time="2019-09-17T19:00:00" url="https://booking.cineworld.co.uk/booking/8019/66636"/>
                </shows>
            </film>
            <film title="Rocketman : Sing-Along Version" rating="15" url="films/rocketman-sing-along-version" edi="263136" release="26/07/2019">
                <shows>
                    <show time="2019-07-26T19:30:00" url="https://booking.cineworld.co.uk/booking/8019/67139" audioType="audio described" subtitled="true"/>
                </shows>
            </film>
            <film title="ROH Live Opera 2019 : Don Giovanni" rating="TBC" url="films/roh-live-opera-2019-don-giovanni" edi="274395" release="08/10/2019">
                <shows>
                    <show time="2019-10-08T18:45:00" url="https://booking.cineworld.co.uk/booking/8019/66218"/>
                </shows>
            </film>
            <film title="ROH Live Opera 2019 : Don Pasquale" rating="TBC" url="films/roh-live-opera-2019-don-pasquale" edi="274401" release="24/10/2019">
                <shows>
                    <show time="2019-10-24T19:30:00" url="https://booking.cineworld.co.uk/booking/8019/66219"/>
                </shows>
            </film>
            <film title="ROH Royal Ballet Live 2019 : Coppelia" rating="TBC" url="films/roh-royal-ballet-live-2019-coppelia" edi="274396" release="10/12/2019">
                <shows>
                    <show time="2019-12-10T19:15:00" url="https://booking.cineworld.co.uk/booking/8019/66221"/>
                </shows>
            </film>
            <film title="ROH Royal Ballet Live 2019 : Triple Bill" rating="TBC" url="films/roh-royal-ballet-live-2019-triple-bill" edi="274399" release="05/11/2019">
                <shows>
                    <show time="2019-11-05T19:15:00" url="https://booking.cineworld.co.uk/booking/8019/66220"/>
                </shows>
            </film>
            <film title="ROH Royal Ballet: The Nutckracker (2016 Recorded)" rating="TBC" url="films/roh-royal-ballet-the-nutckracker-2016-recorded" edi="277630" release="17/12/2019">
                <shows>
                    <show time="2019-12-17T19:15:00" url="https://booking.cineworld.co.uk/booking/8019/66222"/>
                </shows>
            </film>
            <film title="RSC Live : Measure For Measure" rating="12A" url="films/rsc-live-measure-for-measure" edi="263087" release="31/07/2019">
                <shows>
                    <show time="2019-07-31T19:00:00" url="https://booking.cineworld.co.uk/booking/8019/61316"/>
                </shows>
            </film>
            <film title="Secret Unlimited Screening 12" rating="15" url="films/secret-unlimited-screening-12" edi="801942" release="29/07/2019">
                <shows>
                    <show time="2019-07-29T20:00:00" url="https://booking.cineworld.co.uk/booking/8019/66987" audioType="audio described"/>
                </shows>
            </film>
            <film title="(2D) Spider-Man: Far From Home" rating="12A" url="films/spider-man-far-from-home" edi="221205" release="02/07/2019">
                <shows>
                    <show time="2019-07-22T11:10:00" url="https://booking.cineworld.co.uk/booking/8019/67176" audioType="audio described"/>
                    <show time="2019-07-22T14:10:00" url="https://booking.cineworld.co.uk/booking/8019/67177" audioType="audio described"/>
                    <show time="2019-07-22T17:20:00" url="https://booking.cineworld.co.uk/booking/8019/67178" audioType="audio described"/>
                    <show time="2019-07-22T20:15:00" url="https://booking.cineworld.co.uk/booking/8019/67179" audioType="audio described"/>
                    <show time="2019-07-23T11:10:00" url="https://booking.cineworld.co.uk/booking/8019/67185" audioType="audio described"/>
                    <show time="2019-07-23T14:10:00" url="https://booking.cineworld.co.uk/booking/8019/67186" audioType="audio described"/>
                    <show time="2019-07-23T17:20:00" url="https://booking.cineworld.co.uk/booking/8019/67187" audioType="audio described"/>
                    <show time="2019-07-23T20:15:00" url="https://booking.cineworld.co.uk/booking/8019/67188" audioType="audio described"/>
                    <show time="2019-07-24T11:10:00" url="https://booking.cineworld.co.uk/booking/8019/67194" audioType="audio described"/>
                    <show time="2019-07-24T14:10:00" url="https://booking.cineworld.co.uk/booking/8019/67195" audioType="audio described"/>
                    <show time="2019-07-24T17:20:00" url="https://booking.cineworld.co.uk/booking/8019/67196" audioType="audio described"/>
                    <show time="2019-07-24T20:15:00" url="https://booking.cineworld.co.uk/booking/8019/67197" audioType="audio described"/>
                    <show time="2019-07-25T11:10:00" url="https://booking.cineworld.co.uk/booking/8019/67219" audioType="audio described"/>
                    <show time="2019-07-25T14:10:00" url="https://booking.cineworld.co.uk/booking/8019/67220" audioType="audio described"/>
                    <show time="2019-07-25T17:20:00" url="https://booking.cineworld.co.uk/booking/8019/67221" audioType="audio described"/>
                    <show time="2019-07-25T20:15:00" url="https://booking.cineworld.co.uk/booking/8019/67222" audioType="audio described"/>
                </shows>
            </film>
            <film title="(2D) The Lion King" rating="PG" url="films/the-lion-king" edi="229583" release="19/07/2019">
                <shows>
                    <show time="2019-07-22T10:10:00" url="https://booking.cineworld.co.uk/booking/8019/66824" audioType="audio described"/>
                    <show time="2019-07-22T11:30:00" url="https://booking.cineworld.co.uk/booking/8019/66812" audioType="audio described"/>
                    <show time="2019-07-22T12:10:00" url="https://booking.cineworld.co.uk/booking/8019/66816" audioType="audio described"/>
                    <show time="2019-07-22T13:00:00" url="https://booking.cineworld.co.uk/booking/8019/66821" audioType="audio described"/>
                    <show time="2019-07-22T14:20:00" url="https://booking.cineworld.co.uk/booking/8019/66809" audioType="audio described"/>
                    <show time="2019-07-22T15:00:00" url="https://booking.cineworld.co.uk/booking/8019/66813" audioType="audio described"/>
                    <show time="2019-07-22T15:50:00" url="https://booking.cineworld.co.uk/booking/8019/66822" audioType="audio described"/>
                    <show time="2019-07-22T17:10:00" url="https://booking.cineworld.co.uk/booking/8019/66810" audioType="audio described"/>
                    <show time="2019-07-22T17:50:00" url="https://booking.cineworld.co.uk/booking/8019/66814" audioType="audio described"/>
                    <show time="2019-07-22T18:40:00" url="https://booking.cineworld.co.uk/booking/8019/66823" audioType="audio described"/>
                    <show time="2019-07-22T20:00:00" url="https://booking.cineworld.co.uk/booking/8019/66811" audioType="audio described"/>
                    <show time="2019-07-22T20:40:00" url="https://booking.cineworld.co.uk/booking/8019/66815" audioType="audio described"/>
                    <show time="2019-07-23T10:10:00" url="https://booking.cineworld.co.uk/booking/8019/66840" audioType="audio described"/>
                    <show time="2019-07-23T11:30:00" url="https://booking.cineworld.co.uk/booking/8019/66828" audioType="audio described"/>
                    <show time="2019-07-23T12:10:00" url="https://booking.cineworld.co.uk/booking/8019/66832" audioType="audio described"/>
                    <show time="2019-07-23T13:00:00" url="https://booking.cineworld.co.uk/booking/8019/66837" audioType="audio described"/>
                    <show time="2019-07-23T14:20:00" url="https://booking.cineworld.co.uk/booking/8019/66825" audioType="audio described"/>
                    <show time="2019-07-23T15:00:00" url="https://booking.cineworld.co.uk/booking/8019/66829" audioType="audio described"/>
                    <show time="2019-07-23T15:50:00" url="https://booking.cineworld.co.uk/booking/8019/66838" audioType="audio described"/>
                    <show time="2019-07-23T17:10:00" url="https://booking.cineworld.co.uk/booking/8019/66826" audioType="audio described"/>
                    <show time="2019-07-23T17:50:00" url="https://booking.cineworld.co.uk/booking/8019/66830" audioType="audio described"/>
                    <show time="2019-07-23T18:40:00" url="https://booking.cineworld.co.uk/booking/8019/66839" audioType="audio described"/>
                    <show time="2019-07-23T20:00:00" url="https://booking.cineworld.co.uk/booking/8019/66827" audioType="audio described"/>
                    <show time="2019-07-23T20:40:00" url="https://booking.cineworld.co.uk/booking/8019/66831" audioType="audio described"/>
                    <show time="2019-07-24T10:10:00" url="https://booking.cineworld.co.uk/booking/8019/66856" audioType="audio described"/>
                    <show time="2019-07-24T11:30:00" url="https://booking.cineworld.co.uk/booking/8019/66844" audioType="audio described"/>
                    <show time="2019-07-24T12:10:00" url="https://booking.cineworld.co.uk/booking/8019/66848" audioType="audio described"/>
                    <show time="2019-07-24T13:00:00" url="https://booking.cineworld.co.uk/booking/8019/66853" audioType="audio described"/>
                    <show time="2019-07-24T14:20:00" url="https://booking.cineworld.co.uk/booking/8019/66841" audioType="audio described"/>
                    <show time="2019-07-24T15:00:00" url="https://booking.cineworld.co.uk/booking/8019/66845" audioType="audio described"/>
                    <show time="2019-07-24T15:50:00" url="https://booking.cineworld.co.uk/booking/8019/66854" audioType="audio described"/>
                    <show time="2019-07-24T17:10:00" url="https://booking.cineworld.co.uk/booking/8019/66842" audioType="audio described"/>
                    <show time="2019-07-24T17:50:00" url="https://booking.cineworld.co.uk/booking/8019/66846" audioType="audio described"/>
                    <show time="2019-07-24T18:40:00" url="https://booking.cineworld.co.uk/booking/8019/66855" audioType="audio described"/>
                    <show time="2019-07-24T20:00:00" url="https://booking.cineworld.co.uk/booking/8019/66843" audioType="audio described"/>
                    <show time="2019-07-24T20:40:00" url="https://booking.cineworld.co.uk/booking/8019/66847" audioType="audio described"/>
                    <show time="2019-07-25T10:10:00" url="https://booking.cineworld.co.uk/booking/8019/67207" audioType="audio described"/>
                    <show time="2019-07-25T11:30:00" url="https://booking.cineworld.co.uk/booking/8019/67210" audioType="audio described"/>
                    <show time="2019-07-25T12:10:00" url="https://booking.cineworld.co.uk/booking/8019/67203" audioType="audio described"/>
                    <show time="2019-07-25T13:00:00" url="https://booking.cineworld.co.uk/booking/8019/67208" audioType="audio described"/>
                    <show time="2019-07-25T14:20:00" url="https://booking.cineworld.co.uk/booking/8019/67211" audioType="audio described"/>
                    <show time="2019-07-25T15:00:00" url="https://booking.cineworld.co.uk/booking/8019/67204" audioType="audio described"/>
                    <show time="2019-07-25T15:50:00" url="https://booking.cineworld.co.uk/booking/8019/67209" audioType="audio described"/>
                    <show time="2019-07-25T17:10:00" url="https://booking.cineworld.co.uk/booking/8019/67212" audioType="audio described"/>
                    <show time="2019-07-25T18:00:00" url="https://booking.cineworld.co.uk/booking/8019/67205" audioType="audio described" subtitled="true"/>
                    <show time="2019-07-25T20:00:00" url="https://booking.cineworld.co.uk/booking/8019/67213" audioType="audio described"/>
                    <show time="2019-07-25T20:50:00" url="https://booking.cineworld.co.uk/booking/8019/67206" audioType="audio described"/>
                </shows>
            </film>
            <film title="(3D) The Lion King" rating="PG" url="films/the-lion-king" edi="229584" release="19/07/2019">
                <shows>
                    <show time="2019-07-22T10:50:00" url="https://booking.cineworld.co.uk/booking/8019/66820" videoType="3d" audioType="audio described"/>
                    <show time="2019-07-22T13:40:00" url="https://booking.cineworld.co.uk/booking/8019/66817" videoType="3d" audioType="audio described"/>
                    <show time="2019-07-22T16:30:00" url="https://booking.cineworld.co.uk/booking/8019/66818" videoType="3d" audioType="audio described"/>
                    <show time="2019-07-22T19:20:00" url="https://booking.cineworld.co.uk/booking/8019/66819" videoType="3d" audioType="audio described"/>
                    <show time="2019-07-23T10:50:00" url="https://booking.cineworld.co.uk/booking/8019/66836" videoType="3d" audioType="audio described"/>
                    <show time="2019-07-23T13:40:00" url="https://booking.cineworld.co.uk/booking/8019/66833" videoType="3d" audioType="audio described"/>
                    <show time="2019-07-23T16:30:00" url="https://booking.cineworld.co.uk/booking/8019/66834" videoType="3d" audioType="audio described"/>
                    <show time="2019-07-23T19:20:00" url="https://booking.cineworld.co.uk/booking/8019/66835" videoType="3d" audioType="audio described"/>
                    <show time="2019-07-24T10:50:00" url="https://booking.cineworld.co.uk/booking/8019/66852" videoType="3d" audioType="audio described"/>
                    <show time="2019-07-24T13:40:00" url="https://booking.cineworld.co.uk/booking/8019/66849" videoType="3d" audioType="audio described"/>
                    <show time="2019-07-24T16:30:00" url="https://booking.cineworld.co.uk/booking/8019/66850" videoType="3d" audioType="audio described"/>
                    <show time="2019-07-24T19:20:00" url="https://booking.cineworld.co.uk/booking/8019/66851" videoType="3d" audioType="audio described"/>
                    <show time="2019-07-25T10:50:00" url="https://booking.cineworld.co.uk/booking/8019/67198" videoType="3d" audioType="audio described"/>
                    <show time="2019-07-25T13:40:00" url="https://booking.cineworld.co.uk/booking/8019/67199" videoType="3d" audioType="audio described"/>
                    <show time="2019-07-25T16:30:00" url="https://booking.cineworld.co.uk/booking/8019/67200" videoType="3d" audioType="audio described"/>
                    <show time="2019-07-25T19:20:00" url="https://booking.cineworld.co.uk/booking/8019/67201" videoType="3d" audioType="audio described"/>
                </shows>
            </film>
            <film title="The Matrix : 20th Anniversary (4K Restoration)" rating="15" url="films/the-matrix-20th-anniversary-4k-restoration" edi="105580" release="13/07/2019">
                <shows>
                    <show time="2019-07-30T20:00:00" url="https://booking.cineworld.co.uk/booking/8019/67223" audioType="audio described"/>
                </shows>
            </film>
            <film title="(2D) Toy Story 4" rating="U" url="films/toy-story-4" edi="148687" release="21/06/2019">
                <shows>
                    <show time="2019-07-22T11:00:00" url="https://booking.cineworld.co.uk/booking/8019/67171" audioType="audio described"/>
                    <show time="2019-07-22T13:30:00" url="https://booking.cineworld.co.uk/booking/8019/67172" audioType="audio described"/>
                    <show time="2019-07-22T16:00:00" url="https://booking.cineworld.co.uk/booking/8019/67173" audioType="audio described"/>
                    <show time="2019-07-22T18:30:00" url="https://booking.cineworld.co.uk/booking/8019/67174" audioType="audio described"/>
                    <show time="2019-07-23T11:00:00" url="https://booking.cineworld.co.uk/booking/8019/67180" audioType="audio described"/>
                    <show time="2019-07-23T13:30:00" url="https://booking.cineworld.co.uk/booking/8019/67181" audioType="audio described"/>
                    <show time="2019-07-23T16:00:00" url="https://booking.cineworld.co.uk/booking/8019/67182" audioType="audio described"/>
                    <show time="2019-07-23T18:30:00" url="https://booking.cineworld.co.uk/booking/8019/67183" audioType="audio described"/>
                    <show time="2019-07-24T11:00:00" url="https://booking.cineworld.co.uk/booking/8019/67189" audioType="audio described"/>
                    <show time="2019-07-24T13:30:00" url="https://booking.cineworld.co.uk/booking/8019/67190" audioType="audio described"/>
                    <show time="2019-07-24T16:00:00" url="https://booking.cineworld.co.uk/booking/8019/67191" audioType="audio described"/>
                    <show time="2019-07-24T18:30:00" url="https://booking.cineworld.co.uk/booking/8019/67192" audioType="audio described"/>
                    <show time="2019-07-25T11:00:00" url="https://booking.cineworld.co.uk/booking/8019/67214" audioType="audio described"/>
                    <show time="2019-07-25T13:30:00" url="https://booking.cineworld.co.uk/booking/8019/67215" audioType="audio described"/>
                    <show time="2019-07-25T16:00:00" url="https://booking.cineworld.co.uk/booking/8019/67216" audioType="audio described"/>
                    <show time="2019-07-25T18:30:00" url="https://booking.cineworld.co.uk/booking/8019/67217" audioType="audio described"/>
                </shows>
            </film>
            <film title="Wise Children" rating="15" url="films/wise-children" edi="273976" release="03/10/2019">
                <shows>
                    <show time="2019-10-03T14:00:00" url="https://booking.cineworld.co.uk/booking/8019/65835"/>
                    <show time="2019-10-03T19:30:00" url="https://booking.cineworld.co.uk/booking/8019/65836"/>
                </shows>
            </film>
            <film title="Yesterday" rating="12A" url="films/yesterday" edi="253917" release="28/06/2019">
                <shows>
                    <show time="2019-07-22T20:50:00" url="https://booking.cineworld.co.uk/booking/8019/67175" audioType="audio described"/>
                    <show time="2019-07-23T20:50:00" url="https://booking.cineworld.co.uk/booking/8019/67184" audioType="audio described"/>
                    <show time="2019-07-24T20:50:00" url="https://booking.cineworld.co.uk/booking/8019/67193" audioType="audio described"/>
                    <show time="2019-07-25T20:50:00" url="https://booking.cineworld.co.uk/booking/8019/67218" audioType="audio described"/>
                </shows>
            </film>
        </listing>
    </cinema>
    <cinema name="Cineworld Birmingham - Broad Street" root="http://www1.cineworld.co.uk/" url="cinemas/birmingham-broad-street" id="56" phone="0871 200 2000" address="181 Broad Street, Birmingham" postcode="B15 1DA">
        <listing>
            <film title="(4DX) The Matrix : 20th Anniversary (4K)" rating="15" url="films/4dx-the-matrix-20th-anniversary-4k-restoration" edi="801874" release="17/07/2019">
                <shows>
                    <show time="2019-07-25T20:30:00" url="https://booking.cineworld.co.uk/booking/8022/160051" audioType="audio described"/>
                </shows>
            </film>
            <film title="(2D) Aladdin" rating="PG" url="films/aladdin" edi="205737" release="24/05/2019">
                <shows>
                    <show time="2019-07-22T11:10:00" url="https://booking.cineworld.co.uk/booking/8022/160223" audioType="audio described"/>
                    <show time="2019-07-23T11:10:00" url="https://booking.cineworld.co.uk/booking/8022/160224" audioType="audio described"/>
                    <show time="2019-07-24T10:40:00" url="https://booking.cineworld.co.uk/booking/8022/160225" audioType="audio described"/>
                    <show time="2019-07-25T10:40:00" url="https://booking.cineworld.co.uk/booking/8022/160226" audioType="audio described"/>
                </shows>
            </film>
            <film title="Andre Rieu 2019 Maastricht Concert Shall We Dance?" rating="PG" url="films/andre-rieu-2019-maastricht-concert-shall-we-dance" edi="255443" release="27/07/2019">
                <shows>
                    <show time="2019-07-27T19:00:00" url="https://booking.cineworld.co.uk/booking/8022/151066"/>
                    <show time="2019-07-28T15:00:00" url="https://booking.cineworld.co.uk/booking/8022/151067"/>
                </shows>
            </film>
            <film title="Annabelle Comes Home" rating="15" url="films/annabelle-comes-home" edi="250924" release="10/07/2019">
                <shows>
                    <show time="2019-07-22T18:20:00" url="https://booking.cineworld.co.uk/booking/8022/160066" audioType="audio described"/>
                    <show time="2019-07-22T21:00:00" url="https://booking.cineworld.co.uk/booking/8022/160067" audioType="audio described"/>
                    <show time="2019-07-23T18:20:00" url="https://booking.cineworld.co.uk/booking/8022/160070" audioType="audio described"/>
                    <show time="2019-07-23T21:00:00" url="https://booking.cineworld.co.uk/booking/8022/160071" audioType="audio described"/>
                    <show time="2019-07-24T18:20:00" url="https://booking.cineworld.co.uk/booking/8022/160074" audioType="audio described"/>
                    <show time="2019-07-24T21:00:00" url="https://booking.cineworld.co.uk/booking/8022/160075" audioType="audio described"/>
                    <show time="2019-07-25T18:20:00" url="https://booking.cineworld.co.uk/booking/8022/160078" audioType="audio described"/>
                    <show time="2019-07-25T21:15:00" url="https://booking.cineworld.co.uk/booking/8022/160088" audioType="audio described"/>
                </shows>
            </film>
            <film title="(IMAX) Apocalypse Now - The Final Cut (2019) + Q&amp;A" rating="15" url="films/apocalypse-now-the-final-cut-qa" edi="801889" release="13/08/2019">
                <shows>
                    <show time="2019-08-13T19:30:00" url="https://booking.cineworld.co.uk/booking/8022/157331" videoType="imax"/>
                </shows>
            </film>
            <film title="Autism Friendly Screening: The Lion King (2019)" rating="PG" url="films/autism-friendly-screening-the-lion-king-2019" edi="801945" release="19/07/2019">
                <shows>
                    <show time="2019-08-04T11:00:00" url="https://booking.cineworld.co.uk/booking/8022/159650" audioType="audio described"/>
                </shows>
            </film>
            <film title="Balance, Not Symmetry: Biffy Clyro Acoustic Set + " rating="15" url="films/balance-not-symmetry-biffy-clyro-acoustic-set-cast-qa" edi="279749" release="01/08/2019">
                <shows>
                    <show time="2019-08-01T19:00:00" url="https://booking.cineworld.co.uk/booking/8022/159125"/>
                </shows>
            </film>
            <film title="Billy Connolly: The Sex Life of Bandages" rating="18" url="films/billy-connolly-the-sex-life-of-bandages" edi="276418" release="10/10/2019">
                <shows>
                    <show time="2019-10-10T20:00:00" url="https://booking.cineworld.co.uk/booking/8022/160257"/>
                </shows>
            </film>
            <film title="Bring The Soul: The Movie" rating="PG" url="films/bring-the-soul-the-movie" edi="281205" release="07/08/2019">
                <shows>
                    <show time="2019-08-07T19:30:00" url="https://booking.cineworld.co.uk/booking/8022/159647"/>
                    <show time="2019-08-11T14:00:00" url="https://booking.cineworld.co.uk/booking/8022/159648"/>
                </shows>
            </film>
            <film title="Dracula - Northern Ballet Live" rating="12A" url="films/dracula-northern-ballet-live" edi="270199" release="31/10/2019">
                <shows>
                    <show time="2019-10-31T19:15:00" url="https://booking.cineworld.co.uk/booking/8022/151049"/>
                </shows>
            </film>
            <film title="ENO Screen : The Mikado Encore (2015)" rating="PG" url="films/eno-screen-the-mikado-encore-2015" edi="187300" release="19/08/2019">
                <shows>
                    <show time="2019-08-19T19:30:00" url="https://booking.cineworld.co.uk/booking/8022/156955"/>
                </shows>
            </film>
            <film title="(IMAX) Fast &amp; Furious: Hobbs &amp; Shaw" rating="TBC" url="films/fast-furious-hobbs-shaw" edi="240362" release="01/08/2019">
                <shows>
                    <show time="2019-08-01T19:30:00" url="https://booking.cineworld.co.uk/booking/8022/157773" videoType="imax" audioType="audio described"/>
                    <show time="2019-08-02T19:30:00" url="https://booking.cineworld.co.uk/booking/8022/157778" videoType="imax" audioType="audio described"/>
                    <show time="2019-08-03T19:30:00" url="https://booking.cineworld.co.uk/booking/8022/157781" videoType="imax" audioType="audio described"/>
                    <show time="2019-08-04T19:30:00" url="https://booking.cineworld.co.uk/booking/8022/157782" videoType="imax" audioType="audio described"/>
                </shows>
            </film>
            <film title="Fast &amp; Furious: Hobbs &amp; Shaw" rating="TBC" url="films/fast-furious-hobbs-shaw" edi="240260" release="02/08/2019">
                <shows>
                    <show time="2019-08-01T20:00:00" url="https://booking.cineworld.co.uk/booking/8022/157775" audioType="audio described"/>
                    <show time="2019-08-02T20:00:00" url="https://booking.cineworld.co.uk/booking/8022/157776" audioType="audio described"/>
                    <show time="2019-08-03T20:00:00" url="https://booking.cineworld.co.uk/booking/8022/157779" audioType="audio described"/>
                    <show time="2019-08-04T20:00:00" url="https://booking.cineworld.co.uk/booking/8022/157783" audioType="audio described"/>
                </shows>
            </film>
            <film title="(4DX) Fast &amp; Furious: Hobbs &amp; Shaw" rating="TBC" url="films/fast-furious-hobbs-shaw" edi="801897" release="01/08/2019">
                <shows>
                    <show time="2019-08-01T20:30:00" url="https://booking.cineworld.co.uk/booking/8022/157774" audioType="audio described"/>
                    <show time="2019-08-02T20:30:00" url="https://booking.cineworld.co.uk/booking/8022/157777" audioType="audio described"/>
                    <show time="2019-08-03T20:30:00" url="https://booking.cineworld.co.uk/booking/8022/157780" audioType="audio described"/>
                    <show time="2019-08-04T20:30:00" url="https://booking.cineworld.co.uk/booking/8022/157784" audioType="audio described"/>
                </shows>
            </film>
            <film title="Gauguin From The National Gallery, London" rating="12A" url="films/gauguin-from-the-national-gallery-london" edi="272070" release="15/11/2019">
                <shows>
                    <show time="2019-10-15T12:00:00" url="https://booking.cineworld.co.uk/booking/8022/158813"/>
                    <show time="2019-10-15T19:30:00" url="https://booking.cineworld.co.uk/booking/8022/158814"/>
                </shows>
            </film>
            <film title="Kadaram Kondan (Tamil)" rating="12A" url="films/kadaram-kondan-tamil" edi="280612" release="19/07/2019">
                <shows>
                    <show time="2019-07-22T19:50:00" url="https://booking.cineworld.co.uk/booking/8022/160193"/>
                    <show time="2019-07-23T19:50:00" url="https://booking.cineworld.co.uk/booking/8022/160197"/>
                    <show time="2019-07-24T19:50:00" url="https://booking.cineworld.co.uk/booking/8022/160250"/>
                </shows>
            </film>
            <film title="Margaret Atwood : Live In Cinemas" rating="12A" url="films/margaret-atwood-live-in-cinemas" edi="272858" release="10/09/2019">
                <shows>
                    <show time="2019-09-10T19:30:00" url="https://booking.cineworld.co.uk/booking/8022/153437"/>
                </shows>
            </film>
            <film title="Met Opera 2019-20: Akhnaten" rating="TBC" url="films/met-opera-2019-20-akhnaten" edi="274678" release="23/11/2019">
                <shows>
                    <show time="2019-11-23T17:55:00" url="https://booking.cineworld.co.uk/booking/8022/160009"/>
                </shows>
            </film>
            <film title="MET Opera 2019-20: Madama Butterfly" rating="TBC" url="films/met-opera-2019-20-madama-butterfly" edi="274682" release="09/11/2019">
                <shows>
                    <show time="2019-11-09T17:55:00" url="https://booking.cineworld.co.uk/booking/8022/160008"/>
                </shows>
            </film>
            <film title="MET Opera 2019-20: Manon" rating="TBC" url="films/met-opera-2019-20-manon" edi="274680" release="26/10/2019">
                <shows>
                    <show time="2019-10-26T17:55:00" url="https://booking.cineworld.co.uk/booking/8022/160007"/>
                </shows>
            </film>
            <film title="MET Opera 2019-20: Turandot" rating="TBC" url="films/met-opera-2019-20-turandot" edi="274672" release="12/10/2019">
                <shows>
                    <show time="2019-10-12T17:55:00" url="https://booking.cineworld.co.uk/booking/8022/160006"/>
                </shows>
            </film>
            <film title="Midsommar" rating="18" url="films/midsommar" edi="265995" release="05/07/2019">
                <shows>
                    <show time="2019-07-22T20:40:00" url="https://booking.cineworld.co.uk/booking/8022/160130" audioType="audio described"/>
                    <show time="2019-07-23T20:40:00" url="https://booking.cineworld.co.uk/booking/8022/160135" audioType="audio described"/>
                    <show time="2019-07-24T20:40:00" url="https://booking.cineworld.co.uk/booking/8022/160140" audioType="audio described"/>
                    <show time="2019-07-25T20:40:00" url="https://booking.cineworld.co.uk/booking/8022/160145" audioType="audio described"/>
                </shows>
            </film>
            <film title="NT Live: A Midsummer Night's Dream" rating="12A" url="films/nt-live-a-midsummer-nights-dream" edi="274950" release="17/10/2019">
                <shows>
                    <show time="2019-10-17T19:00:00" url="https://booking.cineworld.co.uk/booking/8022/158114"/>
                </shows>
            </film>
            <film title="NT Live: Hansard" rating="15" url="films/nt-live-hansard" edi="270878" release="07/11/2019">
                <shows>
                    <show time="2019-11-07T19:00:00" url="https://booking.cineworld.co.uk/booking/8022/158115"/>
                </shows>
            </film>
            <film title="NT Live : One Man, Two Guvnors (Encore)" rating="12A" url="films/nt-live-one-man-two-guvnors-encore" edi="266343" release="26/09/2019">
                <shows>
                    <show time="2019-09-26T19:00:00" url="https://booking.cineworld.co.uk/booking/8022/155126"/>
                </shows>
            </film>
            <film title="NT Live: Present Laughter" rating="12A" url="films/nt-live-present-laughter" edi="278033" release="28/11/2019">
                <shows>
                    <show time="2019-11-28T19:00:00" url="https://booking.cineworld.co.uk/booking/8022/158116"/>
                </shows>
            </film>
            <film title="NT Live : The Lehman Trilogy" rating="12A" url="films/nt-live-the-lehman-trilogy" edi="266345" release="25/07/2019">
                <shows>
                    <show time="2019-07-25T19:00:00" url="https://booking.cineworld.co.uk/booking/8022/155125"/>
                </shows>
            </film>
            <film title="M4J Paw Patrol: Mighty Pups - The Movie" rating="U" url="films/paw-patrol-mighty-pups-movies-for-juniors" edi="801924" release="19/07/2019">
                <shows>
                    <show time="2019-07-22T10:10:00" url="https://booking.cineworld.co.uk/booking/8022/160216" audioType="audio described"/>
                    <show time="2019-07-23T10:10:00" url="https://booking.cineworld.co.uk/booking/8022/160217" audioType="audio described"/>
                    <show time="2019-07-24T10:10:00" url="https://booking.cineworld.co.uk/booking/8022/160218" audioType="audio described"/>
                    <show time="2019-07-25T10:10:00" url="https://booking.cineworld.co.uk/booking/8022/160219" audioType="audio described"/>
                </shows>
            </film>
            <film title="Placido Domingo 50th Anniversary Concert" rating="TBC" url="films/placido-domingo-50th-anniversary-concert" edi="270187" release="01/10/2019">
                <shows>
                    <show time="2019-10-01T19:00:00" url="https://booking.cineworld.co.uk/booking/8022/158805"/>
                </shows>
            </film>
            <film title="M4J Ralph Breaks The Internet: Wreck It Ralph 2" rating="PG" url="films/ralph-breaks-the-internet-wreck-it-ralph-2-movies-for-juniors" edi="801742" release="01/03/2019">
                <shows>
                    <show time="2019-07-22T10:00:00" url="https://booking.cineworld.co.uk/booking/8022/160083" audioType="audio described"/>
                    <show time="2019-07-23T10:00:00" url="https://booking.cineworld.co.uk/booking/8022/160084" audioType="audio described"/>
                    <show time="2019-07-24T10:00:00" url="https://booking.cineworld.co.uk/booking/8022/160085" audioType="audio described"/>
                    <show time="2019-07-25T10:00:00" url="https://booking.cineworld.co.uk/booking/8022/160086" audioType="audio described"/>
                </shows>
            </film>
            <film title="Rigoletto On The Lake" rating="TBC" url="films/rigoletto-on-the-lake" edi="270196" release="17/09/2019">
                <shows>
                    <show time="2019-09-17T19:00:00" url="https://booking.cineworld.co.uk/booking/8022/158804"/>
                </shows>
            </film>
            <film title="Rocketman : Sing-Along Version" rating="15" url="films/rocketman-sing-along-version" edi="263136" release="26/07/2019">
                <shows>
                    <show time="2019-07-26T19:30:00" url="https://booking.cineworld.co.uk/booking/8022/160016" audioType="audio described" subtitled="true"/>
                </shows>
            </film>
            <film title="ROH Live Opera 2019 : Don Giovanni" rating="TBC" url="films/roh-live-opera-2019-don-giovanni" edi="274395" release="08/10/2019">
                <shows>
                    <show time="2019-10-08T18:45:00" url="https://booking.cineworld.co.uk/booking/8022/157724"/>
                </shows>
            </film>
            <film title="ROH Live Opera 2019 : Don Pasquale" rating="TBC" url="films/roh-live-opera-2019-don-pasquale" edi="274401" release="24/10/2019">
                <shows>
                    <show time="2019-10-24T19:30:00" url="https://booking.cineworld.co.uk/booking/8022/157725"/>
                </shows>
            </film>
            <film title="ROH Royal Ballet Live 2019 : Coppelia" rating="TBC" url="films/roh-royal-ballet-live-2019-coppelia" edi="274396" release="10/12/2019">
                <shows>
                    <show time="2019-12-10T19:15:00" url="https://booking.cineworld.co.uk/booking/8022/157727"/>
                </shows>
            </film>
            <film title="ROH Royal Ballet Live 2019 : Triple Bill" rating="TBC" url="films/roh-royal-ballet-live-2019-triple-bill" edi="274399" release="05/11/2019">
                <shows>
                    <show time="2019-11-05T19:15:00" url="https://booking.cineworld.co.uk/booking/8022/157726"/>
                </shows>
            </film>
            <film title="ROH Royal Ballet: The Nutckracker (2016 Recorded)" rating="TBC" url="films/roh-royal-ballet-the-nutckracker-2016-recorded" edi="277630" release="17/12/2019">
                <shows>
                    <show time="2019-12-17T19:15:00" url="https://booking.cineworld.co.uk/booking/8022/157728"/>
                </shows>
            </film>
            <film title="RSC Live : Measure For Measure" rating="12A" url="films/rsc-live-measure-for-measure" edi="263087" release="31/07/2019">
                <shows>
                    <show time="2019-07-31T19:00:00" url="https://booking.cineworld.co.uk/booking/8022/145957"/>
                </shows>
            </film>
            <film title="Secret Unlimited Screening 12" rating="15" url="films/secret-unlimited-screening-12" edi="801942" release="29/07/2019">
                <shows>
                    <show time="2019-07-29T20:00:00" url="https://booking.cineworld.co.uk/booking/8022/159649" audioType="audio described"/>
                </shows>
            </film>
            <film title="(2D) Spider-Man: Far From Home" rating="12A" url="films/spider-man-far-from-home" edi="221205" release="02/07/2019">
                <shows>
                    <show time="2019-07-22T11:20:00" url="https://booking.cineworld.co.uk/booking/8022/160158" audioType="audio described"/>
                    <show time="2019-07-22T12:50:00" url="https://booking.cineworld.co.uk/booking/8022/160064" audioType="audio described"/>
                    <show time="2019-07-22T14:20:00" url="https://booking.cineworld.co.uk/booking/8022/160159" audioType="audio described"/>
                    <show time="2019-07-22T16:20:00" url="https://booking.cineworld.co.uk/booking/8022/160037" audioType="audio described"/>
                    <show time="2019-07-22T17:20:00" url="https://booking.cineworld.co.uk/booking/8022/160160" audioType="audio described" subtitled="true"/>
                    <show time="2019-07-22T19:20:00" url="https://booking.cineworld.co.uk/booking/8022/160038" audioType="audio described"/>
                    <show time="2019-07-22T20:20:00" url="https://booking.cineworld.co.uk/booking/8022/160161" audioType="audio described"/>
                    <show time="2019-07-23T11:20:00" url="https://booking.cineworld.co.uk/booking/8022/160162" audioType="audio described"/>
                    <show time="2019-07-23T12:50:00" url="https://booking.cineworld.co.uk/booking/8022/160068" audioType="audio described"/>
                    <show time="2019-07-23T14:20:00" url="https://booking.cineworld.co.uk/booking/8022/160163" audioType="audio described"/>
                    <show time="2019-07-23T16:20:00" url="https://booking.cineworld.co.uk/booking/8022/160039" audioType="audio described"/>
                    <show time="2019-07-23T17:20:00" url="https://booking.cineworld.co.uk/booking/8022/160164" audioType="audio described"/>
                    <show time="2019-07-23T19:20:00" url="https://booking.cineworld.co.uk/booking/8022/160040" audioType="audio described"/>
                    <show time="2019-07-23T20:20:00" url="https://booking.cineworld.co.uk/booking/8022/160165" audioType="audio described"/>
                    <show time="2019-07-24T11:20:00" url="https://booking.cineworld.co.uk/booking/8022/160166" audioType="audio described"/>
                    <show time="2019-07-24T12:50:00" url="https://booking.cineworld.co.uk/booking/8022/160072" audioType="audio described"/>
                    <show time="2019-07-24T14:20:00" url="https://booking.cineworld.co.uk/booking/8022/160167" audioType="audio described"/>
                    <show time="2019-07-24T16:20:00" url="https://booking.cineworld.co.uk/booking/8022/160041" audioType="audio described"/>
                    <show time="2019-07-24T17:20:00" url="https://booking.cineworld.co.uk/booking/8022/160168" audioType="audio described"/>
                    <show time="2019-07-24T19:20:00" url="https://booking.cineworld.co.uk/booking/8022/160042" audioType="audio described"/>
                    <show time="2019-07-24T20:20:00" url="https://booking.cineworld.co.uk/booking/8022/160169" audioType="audio described"/>
                    <show time="2019-07-25T11:20:00" url="https://booking.cineworld.co.uk/booking/8022/160170" audioType="audio described"/>
                    <show time="2019-07-25T12:50:00" url="https://booking.cineworld.co.uk/booking/8022/160076" audioType="audio described"/>
                    <show time="2019-07-25T14:20:00" url="https://booking.cineworld.co.uk/booking/8022/160171" audioType="audio described"/>
                    <show time="2019-07-25T16:20:00" url="https://booking.cineworld.co.uk/booking/8022/160043" audioType="audio described"/>
                    <show time="2019-07-25T17:20:00" url="https://booking.cineworld.co.uk/booking/8022/160172" audioType="audio described"/>
                    <show time="2019-07-25T19:20:00" url="https://booking.cineworld.co.uk/booking/8022/160044" audioType="audio described"/>
                    <show time="2019-07-25T20:20:00" url="https://booking.cineworld.co.uk/booking/8022/160173" audioType="audio described"/>
                </shows>
            </film>
            <film title="Stuber" rating="15" url="films/stuber" edi="258445" release="12/07/2019">
                <shows>
                    <show time="2019-07-22T10:10:00" url="https://booking.cineworld.co.uk/booking/8022/160092" audioType="audio described"/>
                    <show time="2019-07-22T15:50:00" url="https://booking.cineworld.co.uk/booking/8022/160065" audioType="audio described"/>
                    <show time="2019-07-23T10:10:00" url="https://booking.cineworld.co.uk/booking/8022/160093" audioType="audio described"/>
                    <show time="2019-07-23T15:50:00" url="https://booking.cineworld.co.uk/booking/8022/160069" audioType="audio described"/>
                    <show time="2019-07-24T10:10:00" url="https://booking.cineworld.co.uk/booking/8022/160094" audioType="audio described"/>
                    <show time="2019-07-24T15:50:00" url="https://booking.cineworld.co.uk/booking/8022/160073" audioType="audio described"/>
                    <show time="2019-07-25T10:10:00" url="https://booking.cineworld.co.uk/booking/8022/160095" audioType="audio described"/>
                    <show time="2019-07-25T15:50:00" url="https://booking.cineworld.co.uk/booking/8022/160077" audioType="audio described"/>
                </shows>
            </film>
            <film title="(4DX 3D) The Lion King" rating="PG" url="films/the-lion-king" edi="801933" release="19/07/2019">
                <shows>
                    <show time="2019-07-22T11:30:00" url="https://booking.cineworld.co.uk/booking/8022/159280" videoType="3d" audioType="audio described"/>
                    <show time="2019-07-22T14:30:00" url="https://booking.cineworld.co.uk/booking/8022/159281" videoType="3d" audioType="audio described"/>
                    <show time="2019-07-22T17:30:00" url="https://booking.cineworld.co.uk/booking/8022/159286" videoType="3d" audioType="audio described"/>
                    <show time="2019-07-22T20:30:00" url="https://booking.cineworld.co.uk/booking/8022/159287" videoType="3d" audioType="audio described"/>
                    <show time="2019-07-23T11:30:00" url="https://booking.cineworld.co.uk/booking/8022/159282" videoType="3d" audioType="audio described"/>
                    <show time="2019-07-23T14:30:00" url="https://booking.cineworld.co.uk/booking/8022/159283" videoType="3d" audioType="audio described"/>
                    <show time="2019-07-23T17:30:00" url="https://booking.cineworld.co.uk/booking/8022/159288" videoType="3d" audioType="audio described"/>
                    <show time="2019-07-23T20:30:00" url="https://booking.cineworld.co.uk/booking/8022/159289" videoType="3d" audioType="audio described"/>
                    <show time="2019-07-24T11:30:00" url="https://booking.cineworld.co.uk/booking/8022/159284" videoType="3d" audioType="audio described"/>
                    <show time="2019-07-24T14:30:00" url="https://booking.cineworld.co.uk/booking/8022/159285" videoType="3d" audioType="audio described"/>
                    <show time="2019-07-24T17:30:00" url="https://booking.cineworld.co.uk/booking/8022/159290" videoType="3d" audioType="audio described"/>
                    <show time="2019-07-24T20:30:00" url="https://booking.cineworld.co.uk/booking/8022/159291" videoType="3d" audioType="audio described"/>
                    <show time="2019-07-25T11:30:00" url="https://booking.cineworld.co.uk/booking/8022/160047" videoType="3d" audioType="audio described"/>
                    <show time="2019-07-25T14:30:00" url="https://booking.cineworld.co.uk/booking/8022/160048" videoType="3d" audioType="audio described"/>
                    <show time="2019-07-25T17:30:00" url="https://booking.cineworld.co.uk/booking/8022/160049" videoType="3d" audioType="audio described"/>
                </shows>
            </film>
            <film title="(2D) The Lion King" rating="PG" url="films/the-lion-king" edi="229583" release="19/07/2019">
                <shows>
                    <show time="2019-07-22T10:00:00" url="https://booking.cineworld.co.uk/booking/8022/159201" audioType="audio described"/>
                    <show time="2019-07-22T10:20:00" url="https://booking.cineworld.co.uk/booking/8022/159192" audioType="audio described"/>
                    <show time="2019-07-22T11:00:00" url="https://booking.cineworld.co.uk/booking/8022/159188" audioType="audio described"/>
                    <show time="2019-07-22T12:00:00" url="https://booking.cineworld.co.uk/booking/8022/159205" audioType="audio described"/>
                    <show time="2019-07-22T13:00:00" url="https://booking.cineworld.co.uk/booking/8022/159202" audioType="audio described"/>
                    <show time="2019-07-22T13:20:00" url="https://booking.cineworld.co.uk/booking/8022/159193" audioType="audio described"/>
                    <show time="2019-07-22T14:00:00" url="https://booking.cineworld.co.uk/booking/8022/159189" audioType="audio described"/>
                    <show time="2019-07-22T15:00:00" url="https://booking.cineworld.co.uk/booking/8022/159206" audioType="audio described"/>
                    <show time="2019-07-22T16:00:00" url="https://booking.cineworld.co.uk/booking/8022/159203" audioType="audio described"/>
                    <show time="2019-07-22T17:00:00" url="https://booking.cineworld.co.uk/booking/8022/159190" audioType="audio described"/>
                    <show time="2019-07-22T18:00:00" url="https://booking.cineworld.co.uk/booking/8022/159207" audioType="audio described"/>
                    <show time="2019-07-22T18:30:00" url="https://booking.cineworld.co.uk/booking/8022/159297" audioType="audio described"/>
                    <show time="2019-07-22T19:00:00" url="https://booking.cineworld.co.uk/booking/8022/159204" audioType="audio described"/>
                    <show time="2019-07-22T20:00:00" url="https://booking.cineworld.co.uk/booking/8022/159191" audioType="audio described"/>
                    <show time="2019-07-22T21:15:00" url="https://booking.cineworld.co.uk/booking/8022/160252" audioType="audio described"/>
                    <show time="2019-07-23T10:00:00" url="https://booking.cineworld.co.uk/booking/8022/159221" audioType="audio described"/>
                    <show time="2019-07-23T10:20:00" url="https://booking.cineworld.co.uk/booking/8022/159212" audioType="audio described"/>
                    <show time="2019-07-23T11:00:00" url="https://booking.cineworld.co.uk/booking/8022/159208" audioType="audio described"/>
                    <show time="2019-07-23T12:00:00" url="https://booking.cineworld.co.uk/booking/8022/159225" audioType="audio described"/>
                    <show time="2019-07-23T13:00:00" url="https://booking.cineworld.co.uk/booking/8022/159222" audioType="audio described"/>
                    <show time="2019-07-23T13:20:00" url="https://booking.cineworld.co.uk/booking/8022/159213" audioType="audio described"/>
                    <show time="2019-07-23T14:00:00" url="https://booking.cineworld.co.uk/booking/8022/159209" audioType="audio described"/>
                    <show time="2019-07-23T15:00:00" url="https://booking.cineworld.co.uk/booking/8022/159226" audioType="audio described"/>
                    <show time="2019-07-23T16:00:00" url="https://booking.cineworld.co.uk/booking/8022/159223" audioType="audio described"/>
                    <show time="2019-07-23T17:00:00" url="https://booking.cineworld.co.uk/booking/8022/159210" audioType="audio described"/>
                    <show time="2019-07-23T18:00:00" url="https://booking.cineworld.co.uk/booking/8022/159227" audioType="audio described"/>
                    <show time="2019-07-23T18:30:00" url="https://booking.cineworld.co.uk/booking/8022/159298" audioType="audio described"/>
                    <show time="2019-07-23T19:00:00" url="https://booking.cineworld.co.uk/booking/8022/159224" audioType="audio described"/>
                    <show time="2019-07-23T20:00:00" url="https://booking.cineworld.co.uk/booking/8022/159211" audioType="audio described"/>
                    <show time="2019-07-23T21:15:00" url="https://booking.cineworld.co.uk/booking/8022/160253" audioType="audio described"/>
                    <show time="2019-07-24T10:00:00" url="https://booking.cineworld.co.uk/booking/8022/159241" audioType="audio described"/>
                    <show time="2019-07-24T10:20:00" url="https://booking.cineworld.co.uk/booking/8022/159232" audioType="audio described"/>
                    <show time="2019-07-24T11:00:00" url="https://booking.cineworld.co.uk/booking/8022/159228" audioType="audio described"/>
                    <show time="2019-07-24T12:00:00" url="https://booking.cineworld.co.uk/booking/8022/159245" audioType="audio described"/>
                    <show time="2019-07-24T13:00:00" url="https://booking.cineworld.co.uk/booking/8022/159242" audioType="audio described"/>
                    <show time="2019-07-24T13:20:00" url="https://booking.cineworld.co.uk/booking/8022/159233" audioType="audio described"/>
                    <show time="2019-07-24T14:00:00" url="https://booking.cineworld.co.uk/booking/8022/159229" audioType="audio described"/>
                    <show time="2019-07-24T15:00:00" url="https://booking.cineworld.co.uk/booking/8022/159246" audioType="audio described"/>
                    <show time="2019-07-24T16:00:00" url="https://booking.cineworld.co.uk/booking/8022/159243" audioType="audio described"/>
                    <show time="2019-07-24T17:00:00" url="https://booking.cineworld.co.uk/booking/8022/159230" audioType="audio described"/>
                    <show time="2019-07-24T18:00:00" url="https://booking.cineworld.co.uk/booking/8022/159247" audioType="audio described"/>
                    <show time="2019-07-24T18:30:00" url="https://booking.cineworld.co.uk/booking/8022/159299" audioType="audio described"/>
                    <show time="2019-07-24T19:00:00" url="https://booking.cineworld.co.uk/booking/8022/159244" audioType="audio described"/>
                    <show time="2019-07-24T20:00:00" url="https://booking.cineworld.co.uk/booking/8022/159231" audioType="audio described"/>
                    <show time="2019-07-24T21:15:00" url="https://booking.cineworld.co.uk/booking/8022/160254" audioType="audio described"/>
                    <show time="2019-07-25T10:00:00" url="https://booking.cineworld.co.uk/booking/8022/160102" audioType="audio described"/>
                    <show time="2019-07-25T10:20:00" url="https://booking.cineworld.co.uk/booking/8022/160045" audioType="audio described"/>
                    <show time="2019-07-25T11:00:00" url="https://booking.cineworld.co.uk/booking/8022/160023" audioType="audio described"/>
                    <show time="2019-07-25T12:00:00" url="https://booking.cineworld.co.uk/booking/8022/160204" audioType="audio described"/>
                    <show time="2019-07-25T13:00:00" url="https://booking.cineworld.co.uk/booking/8022/160103" audioType="audio described"/>
                    <show time="2019-07-25T13:20:00" url="https://booking.cineworld.co.uk/booking/8022/160046" audioType="audio described"/>
                    <show time="2019-07-25T14:00:00" url="https://booking.cineworld.co.uk/booking/8022/160024" audioType="audio described"/>
                    <show time="2019-07-25T15:00:00" url="https://booking.cineworld.co.uk/booking/8022/160205" audioType="audio described"/>
                    <show time="2019-07-25T16:00:00" url="https://booking.cineworld.co.uk/booking/8022/160104" audioType="audio described"/>
                    <show time="2019-07-25T17:00:00" url="https://booking.cineworld.co.uk/booking/8022/160025" audioType="audio described" subtitled="true"/>
                    <show time="2019-07-25T18:00:00" url="https://booking.cineworld.co.uk/booking/8022/160206" audioType="audio described"/>
                    <show time="2019-07-25T18:30:00" url="https://booking.cineworld.co.uk/booking/8022/160110" audioType="audio described"/>
                    <show time="2019-07-25T19:00:00" url="https://booking.cineworld.co.uk/booking/8022/160105" audioType="audio described"/>
                    <show time="2019-07-25T20:00:00" url="https://booking.cineworld.co.uk/booking/8022/160026" audioType="audio described"/>
                    <show time="2019-07-25T20:50:00" url="https://booking.cineworld.co.uk/booking/8022/160207" audioType="audio described"/>
                    <show time="2019-07-25T21:30:00" url="https://booking.cineworld.co.uk/booking/8022/160255" audioType="audio described"/>
                </shows>
            </film>
            <film title="(IMAX) The Lion King" rating="PG" url="films/the-lion-king" edi="245703" release="19/07/2019">
                <shows>
                    <show time="2019-07-22T10:40:00" url="https://booking.cineworld.co.uk/booking/8022/159197" videoType="imax" audioType="audio described"/>
                    <show time="2019-07-22T13:40:00" url="https://booking.cineworld.co.uk/booking/8022/159198" videoType="imax" audioType="audio described"/>
                    <show time="2019-07-23T10:40:00" url="https://booking.cineworld.co.uk/booking/8022/159217" videoType="imax" audioType="audio described"/>
                    <show time="2019-07-23T13:40:00" url="https://booking.cineworld.co.uk/booking/8022/159218" videoType="imax" audioType="audio described"/>
                    <show time="2019-07-24T10:40:00" url="https://booking.cineworld.co.uk/booking/8022/159237" videoType="imax" audioType="audio described"/>
                    <show time="2019-07-24T13:40:00" url="https://booking.cineworld.co.uk/booking/8022/159238" videoType="imax" audioType="audio described"/>
                    <show time="2019-07-25T10:40:00" url="https://booking.cineworld.co.uk/booking/8022/160098" videoType="imax" audioType="audio described"/>
                    <show time="2019-07-25T13:40:00" url="https://booking.cineworld.co.uk/booking/8022/160099" videoType="imax" audioType="audio described"/>
                </shows>
            </film>
            <film title="(IMAX 3-D) The Lion King" rating="PG" url="films/the-lion-king" edi="245702" release="19/07/2019">
                <shows>
                    <show time="2019-07-22T16:30:00" url="https://booking.cineworld.co.uk/booking/8022/159199" videoType="imax 3d" audioType="audio described"/>
                    <show time="2019-07-22T19:30:00" url="https://booking.cineworld.co.uk/booking/8022/159200" videoType="imax 3d" audioType="audio described"/>
                    <show time="2019-07-23T16:30:00" url="https://booking.cineworld.co.uk/booking/8022/159219" videoType="imax 3d" audioType="audio described"/>
                    <show time="2019-07-23T19:30:00" url="https://booking.cineworld.co.uk/booking/8022/159220" videoType="imax 3d" audioType="audio described"/>
                    <show time="2019-07-24T16:30:00" url="https://booking.cineworld.co.uk/booking/8022/159239" videoType="imax 3d" audioType="audio described"/>
                    <show time="2019-07-24T19:30:00" url="https://booking.cineworld.co.uk/booking/8022/159240" videoType="imax 3d" audioType="audio described"/>
                    <show time="2019-07-25T16:30:00" url="https://booking.cineworld.co.uk/booking/8022/160100" videoType="imax 3d" audioType="audio described"/>
                    <show time="2019-07-25T19:30:00" url="https://booking.cineworld.co.uk/booking/8022/160101" videoType="imax 3d" audioType="audio described"/>
                </shows>
            </film>
            <film title="(3D) The Lion King" rating="PG" url="films/the-lion-king" edi="229584" release="19/07/2019">
                <shows>
                    <show time="2019-07-22T12:30:00" url="https://booking.cineworld.co.uk/booking/8022/159302" videoType="3d" audioType="audio described"/>
                    <show time="2019-07-22T15:30:00" url="https://booking.cineworld.co.uk/booking/8022/159303" videoType="3d" audioType="audio described"/>
                    <show time="2019-07-23T12:30:00" url="https://booking.cineworld.co.uk/booking/8022/159304" videoType="3d" audioType="audio described"/>
                    <show time="2019-07-23T15:30:00" url="https://booking.cineworld.co.uk/booking/8022/159305" videoType="3d" audioType="audio described"/>
                    <show time="2019-07-24T12:30:00" url="https://booking.cineworld.co.uk/booking/8022/159306" videoType="3d" audioType="audio described"/>
                    <show time="2019-07-24T15:30:00" url="https://booking.cineworld.co.uk/booking/8022/159307" videoType="3d" audioType="audio described"/>
                    <show time="2019-07-25T12:30:00" url="https://booking.cineworld.co.uk/booking/8022/160108" videoType="3d" audioType="audio described"/>
                    <show time="2019-07-25T15:30:00" url="https://booking.cineworld.co.uk/booking/8022/160109" videoType="3d" audioType="audio described"/>
                </shows>
            </film>
            <film title="The Matrix : 20th Anniversary (4K Restoration)" rating="15" url="films/the-matrix-20th-anniversary-4k-restoration" edi="105580" release="13/07/2019">
                <shows>
                    <show time="2019-07-30T20:00:00" url="https://booking.cineworld.co.uk/booking/8022/160256" audioType="audio described"/>
                </shows>
            </film>
            <film title="(2D) Toy Story 4" rating="U" url="films/toy-story-4" edi="148687" release="21/06/2019">
                <shows>
                    <show time="2019-07-22T10:40:00" url="https://booking.cineworld.co.uk/booking/8022/160126" audioType="audio described"/>
                    <show time="2019-07-22T12:10:00" url="https://booking.cineworld.co.uk/booking/8022/160190" audioType="audio described"/>
                    <show time="2019-07-22T13:10:00" url="https://booking.cineworld.co.uk/booking/8022/160127" audioType="audio described"/>
                    <show time="2019-07-22T14:40:00" url="https://booking.cineworld.co.uk/booking/8022/160191" audioType="audio described"/>
                    <show time="2019-07-22T15:40:00" url="https://booking.cineworld.co.uk/booking/8022/160128" audioType="audio described"/>
                    <show time="2019-07-22T17:10:00" url="https://booking.cineworld.co.uk/booking/8022/160192" audioType="audio described"/>
                    <show time="2019-07-22T18:10:00" url="https://booking.cineworld.co.uk/booking/8022/160129" audioType="audio described"/>
                    <show time="2019-07-22T19:40:00" url="https://booking.cineworld.co.uk/booking/8022/160230" audioType="audio described"/>
                    <show time="2019-07-23T10:40:00" url="https://booking.cineworld.co.uk/booking/8022/160131" audioType="audio described"/>
                    <show time="2019-07-23T12:10:00" url="https://booking.cineworld.co.uk/booking/8022/160194" audioType="audio described"/>
                    <show time="2019-07-23T13:10:00" url="https://booking.cineworld.co.uk/booking/8022/160132" audioType="audio described"/>
                    <show time="2019-07-23T14:40:00" url="https://booking.cineworld.co.uk/booking/8022/160195" audioType="audio described"/>
                    <show time="2019-07-23T15:40:00" url="https://booking.cineworld.co.uk/booking/8022/160133" audioType="audio described"/>
                    <show time="2019-07-23T17:10:00" url="https://booking.cineworld.co.uk/booking/8022/160196" audioType="audio described"/>
                    <show time="2019-07-23T18:10:00" url="https://booking.cineworld.co.uk/booking/8022/160134" audioType="audio described"/>
                    <show time="2019-07-23T19:40:00" url="https://booking.cineworld.co.uk/booking/8022/160231" audioType="audio described"/>
                    <show time="2019-07-24T10:40:00" url="https://booking.cineworld.co.uk/booking/8022/160136" audioType="audio described"/>
                    <show time="2019-07-24T12:10:00" url="https://booking.cineworld.co.uk/booking/8022/160198" audioType="audio described"/>
                    <show time="2019-07-24T13:10:00" url="https://booking.cineworld.co.uk/booking/8022/160137" audioType="audio described"/>
                    <show time="2019-07-24T14:40:00" url="https://booking.cineworld.co.uk/booking/8022/160199" audioType="audio described"/>
                    <show time="2019-07-24T15:40:00" url="https://booking.cineworld.co.uk/booking/8022/160138" audioType="audio described"/>
                    <show time="2019-07-24T17:10:00" url="https://booking.cineworld.co.uk/booking/8022/160200" audioType="audio described"/>
                    <show time="2019-07-24T18:10:00" url="https://booking.cineworld.co.uk/booking/8022/160139" audioType="audio described"/>
                    <show time="2019-07-24T19:40:00" url="https://booking.cineworld.co.uk/booking/8022/160232" audioType="audio described"/>
                    <show time="2019-07-25T10:40:00" url="https://booking.cineworld.co.uk/booking/8022/160141" audioType="audio described"/>
                    <show time="2019-07-25T12:10:00" url="https://booking.cineworld.co.uk/booking/8022/160174" audioType="audio described"/>
                    <show time="2019-07-25T13:10:00" url="https://booking.cineworld.co.uk/booking/8022/160142" audioType="audio described"/>
                    <show time="2019-07-25T14:40:00" url="https://booking.cineworld.co.uk/booking/8022/160175" audioType="audio described"/>
                    <show time="2019-07-25T15:40:00" url="https://booking.cineworld.co.uk/booking/8022/160143" audioType="audio described"/>
                    <show time="2019-07-25T17:10:00" url="https://booking.cineworld.co.uk/booking/8022/160176" audioType="audio described"/>
                    <show time="2019-07-25T18:10:00" url="https://booking.cineworld.co.uk/booking/8022/160144" audioType="audio described"/>
                    <show time="2019-07-25T19:50:00" url="https://booking.cineworld.co.uk/booking/8022/160202" audioType="audio described"/>
                </shows>
            </film>
            <film title="Wise Children" rating="15" url="films/wise-children" edi="273976" release="03/10/2019">
                <shows>
                    <show time="2019-10-03T14:00:00" url="https://booking.cineworld.co.uk/booking/8022/156951"/>
                    <show time="2019-10-03T19:30:00" url="https://booking.cineworld.co.uk/booking/8022/156952"/>
                </shows>
            </film>
            <film title="Withnail &amp; I (Re: 2014)" rating="15" url="films/withnail-i-re-2014" edi="164434" release="03/09/2019">
                <shows>
                    <show time="2019-09-03T20:00:00" url="https://booking.cineworld.co.uk/booking/8022/158117"/>
                </shows>
            </film>
            <film title="Yesterday" rating="12A" url="films/yesterday" edi="253917" release="28/06/2019">
                <shows>
                    <show time="2019-07-22T14:10:00" url="https://booking.cineworld.co.uk/booking/8022/160241" audioType="audio described"/>
                    <show time="2019-07-22T16:50:00" url="https://booking.cineworld.co.uk/booking/8022/160242" audioType="audio described"/>
                    <show time="2019-07-22T20:50:00" url="https://booking.cineworld.co.uk/booking/8022/160209" audioType="audio described"/>
                    <show time="2019-07-23T14:10:00" url="https://booking.cineworld.co.uk/booking/8022/160243" audioType="audio described"/>
                    <show time="2019-07-23T16:50:00" url="https://booking.cineworld.co.uk/booking/8022/160244" audioType="audio described"/>
                    <show time="2019-07-23T20:50:00" url="https://booking.cineworld.co.uk/booking/8022/160208" audioType="audio described"/>
                    <show time="2019-07-24T13:40:00" url="https://booking.cineworld.co.uk/booking/8022/160245" audioType="audio described"/>
                    <show time="2019-07-24T16:20:00" url="https://booking.cineworld.co.uk/booking/8022/160246" audioType="audio described"/>
                    <show time="2019-07-24T20:50:00" url="https://booking.cineworld.co.uk/booking/8022/160249" audioType="audio described"/>
                    <show time="2019-07-25T13:40:00" url="https://booking.cineworld.co.uk/booking/8022/160247" audioType="audio described"/>
                    <show time="2019-07-25T16:20:00" url="https://booking.cineworld.co.uk/booking/8022/160248" audioType="audio described"/>
                    <show time="2019-07-25T21:00:00" url="https://booking.cineworld.co.uk/booking/8022/160087" audioType="audio described"/>
                </shows>
            </film>
        </listing>
    </cinema>
    <cinema name="Cineworld Birmingham - NEC" root="http://www1.cineworld.co.uk/" url="cinemas/birmingham-nec" id="96" phone="0871 200 2000" address="Resorts World, Pendigo Way, Birmingham" postcode="B40 1PU">
        <listing>
            <film title="(2D) Aladdin" rating="PG" url="films/aladdin" edi="205737" release="24/05/2019">
                <shows>
                    <show time="2019-07-22T12:40:00" url="https://booking.cineworld.co.uk/booking/8102/64393" audioType="audio described"/>
                    <show time="2019-07-23T12:40:00" url="https://booking.cineworld.co.uk/booking/8102/64394" audioType="audio described"/>
                    <show time="2019-07-24T12:40:00" url="https://booking.cineworld.co.uk/booking/8102/64395" audioType="audio described"/>
                    <show time="2019-07-25T12:40:00" url="https://booking.cineworld.co.uk/booking/8102/64396" audioType="audio described"/>
                </shows>
            </film>
            <film title="Andre Rieu 2019 Maastricht Concert Shall We Dance?" rating="PG" url="films/andre-rieu-2019-maastricht-concert-shall-we-dance" edi="255443" release="27/07/2019">
                <shows>
                    <show time="2019-07-27T19:00:00" url="https://booking.cineworld.co.uk/booking/8102/57246"/>
                    <show time="2019-07-28T15:00:00" url="https://booking.cineworld.co.uk/booking/8102/57247"/>
                </shows>
            </film>
            <film title="Annabelle Comes Home" rating="15" url="films/annabelle-comes-home" edi="250924" release="10/07/2019">
                <shows>
                    <show time="2019-07-22T15:40:00" url="https://booking.cineworld.co.uk/booking/8102/64258" audioType="audio described"/>
                    <show time="2019-07-22T18:10:00" url="https://booking.cineworld.co.uk/booking/8102/64259" audioType="audio described"/>
                    <show time="2019-07-22T20:50:00" url="https://booking.cineworld.co.uk/booking/8102/64360" audioType="audio described"/>
                    <show time="2019-07-23T15:40:00" url="https://booking.cineworld.co.uk/booking/8102/64260" audioType="audio described"/>
                    <show time="2019-07-23T18:10:00" url="https://booking.cineworld.co.uk/booking/8102/64261" audioType="audio described"/>
                    <show time="2019-07-23T20:50:00" url="https://booking.cineworld.co.uk/booking/8102/64361" audioType="audio described"/>
                    <show time="2019-07-24T15:40:00" url="https://booking.cineworld.co.uk/booking/8102/64262" audioType="audio described"/>
                    <show time="2019-07-24T18:10:00" url="https://booking.cineworld.co.uk/booking/8102/64263" audioType="audio described"/>
                    <show time="2019-07-24T20:50:00" url="https://booking.cineworld.co.uk/booking/8102/64362" audioType="audio described"/>
                    <show time="2019-07-25T15:40:00" url="https://booking.cineworld.co.uk/booking/8102/64264" audioType="audio described"/>
                    <show time="2019-07-25T18:10:00" url="https://booking.cineworld.co.uk/booking/8102/64265" audioType="audio described"/>
                    <show time="2019-07-25T20:50:00" url="https://booking.cineworld.co.uk/booking/8102/64363" audioType="audio described"/>
                </shows>
            </film>
            <film title="(IMAX) Apocalypse Now - The Final Cut (2019) + Q&amp;A" rating="15" url="films/apocalypse-now-the-final-cut-qa" edi="801889" release="13/08/2019">
                <shows>
                    <show time="2019-08-13T19:30:00" url="https://booking.cineworld.co.uk/booking/8102/62175" videoType="imax"/>
                </shows>
            </film>
            <film title="Billy Connolly: The Sex Life of Bandages" rating="18" url="films/billy-connolly-the-sex-life-of-bandages" edi="276418" release="10/10/2019">
                <shows>
                    <show time="2019-10-10T20:00:00" url="https://booking.cineworld.co.uk/booking/8102/64398"/>
                </shows>
            </film>
            <film title="Bring The Soul: The Movie" rating="PG" url="films/bring-the-soul-the-movie" edi="281205" release="07/08/2019">
                <shows>
                    <show time="2019-08-07T19:30:00" url="https://booking.cineworld.co.uk/booking/8102/63922"/>
                    <show time="2019-08-11T14:00:00" url="https://booking.cineworld.co.uk/booking/8102/63921"/>
                </shows>
            </film>
            <film title="(IMAX) Fast &amp; Furious: Hobbs &amp; Shaw" rating="TBC" url="films/fast-furious-hobbs-shaw" edi="240362" release="01/08/2019">
                <shows>
                    <show time="2019-08-01T20:20:00" url="https://booking.cineworld.co.uk/booking/8102/62506" videoType="imax" audioType="audio described"/>
                    <show time="2019-08-02T20:20:00" url="https://booking.cineworld.co.uk/booking/8102/62508" videoType="imax" audioType="audio described"/>
                    <show time="2019-08-03T20:20:00" url="https://booking.cineworld.co.uk/booking/8102/62510" videoType="imax" audioType="audio described"/>
                    <show time="2019-08-04T20:20:00" url="https://booking.cineworld.co.uk/booking/8102/62512" videoType="imax" audioType="audio described"/>
                </shows>
            </film>
            <film title="Fast &amp; Furious: Hobbs &amp; Shaw" rating="TBC" url="films/fast-furious-hobbs-shaw" edi="240260" release="02/08/2019">
                <shows>
                    <show time="2019-08-01T19:20:00" url="https://booking.cineworld.co.uk/booking/8102/62507" audioType="audio described"/>
                    <show time="2019-08-02T19:20:00" url="https://booking.cineworld.co.uk/booking/8102/62509" audioType="audio described"/>
                    <show time="2019-08-03T19:20:00" url="https://booking.cineworld.co.uk/booking/8102/62511" audioType="audio described"/>
                    <show time="2019-08-04T19:20:00" url="https://booking.cineworld.co.uk/booking/8102/62513" audioType="audio described"/>
                </shows>
            </film>
            <film title="Margaret Atwood : Live In Cinemas" rating="12A" url="films/margaret-atwood-live-in-cinemas" edi="272858" release="10/09/2019">
                <shows>
                    <show time="2019-09-10T19:30:00" url="https://booking.cineworld.co.uk/booking/8102/59021"/>
                </shows>
            </film>
            <film title="NT Live: A Midsummer Night's Dream" rating="12A" url="films/nt-live-a-midsummer-nights-dream" edi="274950" release="17/10/2019">
                <shows>
                    <show time="2019-10-17T19:00:00" url="https://booking.cineworld.co.uk/booking/8102/62774"/>
                </shows>
            </film>
            <film title="NT Live: Hansard" rating="15" url="films/nt-live-hansard" edi="270878" release="07/11/2019">
                <shows>
                    <show time="2019-11-07T19:00:00" url="https://booking.cineworld.co.uk/booking/8102/62775"/>
                </shows>
            </film>
            <film title="NT Live : One Man, Two Guvnors (Encore)" rating="12A" url="films/nt-live-one-man-two-guvnors-encore" edi="266343" release="26/09/2019">
                <shows>
                    <show time="2019-09-26T19:00:00" url="https://booking.cineworld.co.uk/booking/8102/60389"/>
                </shows>
            </film>
            <film title="NT Live: Present Laughter" rating="12A" url="films/nt-live-present-laughter" edi="278033" release="28/11/2019">
                <shows>
                    <show time="2019-11-28T19:00:00" url="https://booking.cineworld.co.uk/booking/8102/62776"/>
                </shows>
            </film>
            <film title="NT Live : The Lehman Trilogy" rating="12A" url="films/nt-live-the-lehman-trilogy" edi="266345" release="25/07/2019">
                <shows>
                    <show time="2019-07-25T19:00:00" url="https://booking.cineworld.co.uk/booking/8102/60388"/>
                </shows>
            </film>
            <film title="M4J Paw Patrol: Mighty Pups - The Movie" rating="U" url="films/paw-patrol-mighty-pups-movies-for-juniors" edi="801924" release="19/07/2019">
                <shows>
                    <show time="2019-07-22T10:10:00" url="https://booking.cineworld.co.uk/booking/8102/64367" audioType="audio described"/>
                    <show time="2019-07-23T10:10:00" url="https://booking.cineworld.co.uk/booking/8102/64368" audioType="audio described"/>
                    <show time="2019-07-24T10:10:00" url="https://booking.cineworld.co.uk/booking/8102/64369" audioType="audio described"/>
                    <show time="2019-07-25T10:10:00" url="https://booking.cineworld.co.uk/booking/8102/64370" audioType="audio described"/>
                </shows>
            </film>
            <film title="M4J Ralph Breaks The Internet: Wreck It Ralph 2" rating="PG" url="films/ralph-breaks-the-internet-wreck-it-ralph-2-movies-for-juniors" edi="801742" release="01/03/2019">
                <shows>
                    <show time="2019-07-22T10:00:00" url="https://booking.cineworld.co.uk/booking/8102/64236" audioType="audio described"/>
                    <show time="2019-07-23T10:00:00" url="https://booking.cineworld.co.uk/booking/8102/64237" audioType="audio described"/>
                    <show time="2019-07-24T10:00:00" url="https://booking.cineworld.co.uk/booking/8102/64238" audioType="audio described"/>
                    <show time="2019-07-25T10:00:00" url="https://booking.cineworld.co.uk/booking/8102/64239" audioType="audio described"/>
                </shows>
            </film>
            <film title="Rocketman : Sing-Along Version" rating="15" url="films/rocketman-sing-along-version" edi="263136" release="26/07/2019">
                <shows>
                    <show time="2019-07-26T19:30:00" url="https://booking.cineworld.co.uk/booking/8102/64200" audioType="audio described" subtitled="true"/>
                </shows>
            </film>
            <film title="Secret Unlimited Screening 12" rating="15" url="films/secret-unlimited-screening-12" edi="801942" release="29/07/2019">
                <shows>
                    <show time="2019-07-29T20:00:00" url="https://booking.cineworld.co.uk/booking/8102/63923" audioType="audio described"/>
                </shows>
            </film>
            <film title="(2D) Spider-Man: Far From Home" rating="12A" url="films/spider-man-far-from-home" edi="221205" release="02/07/2019">
                <shows>
                    <show time="2019-07-22T11:20:00" url="https://booking.cineworld.co.uk/booking/8102/64213" audioType="audio described"/>
                    <show time="2019-07-22T14:20:00" url="https://booking.cineworld.co.uk/booking/8102/64214" audioType="audio described"/>
                    <show time="2019-07-22T16:10:00" url="https://booking.cineworld.co.uk/booking/8102/64377" audioType="audio described"/>
                    <show time="2019-07-22T17:20:00" url="https://booking.cineworld.co.uk/booking/8102/64215" audioType="audio described"/>
                    <show time="2019-07-22T19:10:00" url="https://booking.cineworld.co.uk/booking/8102/64378" audioType="audio described"/>
                    <show time="2019-07-22T20:20:00" url="https://booking.cineworld.co.uk/booking/8102/64216" audioType="audio described"/>
                    <show time="2019-07-23T11:20:00" url="https://booking.cineworld.co.uk/booking/8102/64217" audioType="audio described"/>
                    <show time="2019-07-23T14:20:00" url="https://booking.cineworld.co.uk/booking/8102/64218" audioType="audio described"/>
                    <show time="2019-07-23T16:10:00" url="https://booking.cineworld.co.uk/booking/8102/64379" audioType="audio described"/>
                    <show time="2019-07-23T17:20:00" url="https://booking.cineworld.co.uk/booking/8102/64219" audioType="audio described"/>
                    <show time="2019-07-23T19:10:00" url="https://booking.cineworld.co.uk/booking/8102/64380" audioType="audio described"/>
                    <show time="2019-07-23T20:20:00" url="https://booking.cineworld.co.uk/booking/8102/64220" audioType="audio described"/>
                    <show time="2019-07-24T11:20:00" url="https://booking.cineworld.co.uk/booking/8102/64221" audioType="audio described"/>
                    <show time="2019-07-24T14:20:00" url="https://booking.cineworld.co.uk/booking/8102/64222" audioType="audio described"/>
                    <show time="2019-07-24T16:10:00" url="https://booking.cineworld.co.uk/booking/8102/64381" audioType="audio described"/>
                    <show time="2019-07-24T17:20:00" url="https://booking.cineworld.co.uk/booking/8102/64223" audioType="audio described"/>
                    <show time="2019-07-24T19:10:00" url="https://booking.cineworld.co.uk/booking/8102/64389" audioType="audio described"/>
                    <show time="2019-07-24T20:20:00" url="https://booking.cineworld.co.uk/booking/8102/64224" audioType="audio described"/>
                    <show time="2019-07-25T11:20:00" url="https://booking.cineworld.co.uk/booking/8102/64225" audioType="audio described"/>
                    <show time="2019-07-25T14:20:00" url="https://booking.cineworld.co.uk/booking/8102/64226" audioType="audio described"/>
                    <show time="2019-07-25T16:10:00" url="https://booking.cineworld.co.uk/booking/8102/64382" audioType="audio described"/>
                    <show time="2019-07-25T17:20:00" url="https://booking.cineworld.co.uk/booking/8102/64227" audioType="audio described"/>
                    <show time="2019-07-25T20:20:00" url="https://booking.cineworld.co.uk/booking/8102/64228" audioType="audio described"/>
                </shows>
            </film>
            <film title="Stuber" rating="15" url="films/stuber" edi="258445" release="12/07/2019">
                <shows>
                    <show time="2019-07-22T21:00:00" url="https://booking.cineworld.co.uk/booking/8102/64318" audioType="audio described"/>
                    <show time="2019-07-23T21:00:00" url="https://booking.cineworld.co.uk/booking/8102/64319" audioType="audio described"/>
                    <show time="2019-07-24T21:00:00" url="https://booking.cineworld.co.uk/booking/8102/64320" audioType="audio described"/>
                    <show time="2019-07-25T21:00:00" url="https://booking.cineworld.co.uk/booking/8102/64321" audioType="audio described"/>
                </shows>
            </film>
            <film title="(2D) The Lion King" rating="PG" url="films/the-lion-king" edi="229583" release="19/07/2019">
                <shows>
                    <show time="2019-07-22T10:20:00" url="https://booking.cineworld.co.uk/booking/8102/63645" audioType="audio described"/>
                    <show time="2019-07-22T10:40:00" url="https://booking.cineworld.co.uk/booking/8102/63590" audioType="audio described"/>
                    <show time="2019-07-22T11:30:00" url="https://booking.cineworld.co.uk/booking/8102/63553" audioType="audio described"/>
                    <show time="2019-07-22T12:30:00" url="https://booking.cineworld.co.uk/booking/8102/63637" audioType="audio described"/>
                    <show time="2019-07-22T13:20:00" url="https://booking.cineworld.co.uk/booking/8102/63646" audioType="audio described"/>
                    <show time="2019-07-22T13:40:00" url="https://booking.cineworld.co.uk/booking/8102/63591" audioType="audio described"/>
                    <show time="2019-07-22T14:30:00" url="https://booking.cineworld.co.uk/booking/8102/63554" audioType="audio described"/>
                    <show time="2019-07-22T15:30:00" url="https://booking.cineworld.co.uk/booking/8102/63638" audioType="audio described"/>
                    <show time="2019-07-22T16:30:00" url="https://booking.cineworld.co.uk/booking/8102/63592" audioType="audio described"/>
                    <show time="2019-07-22T17:30:00" url="https://booking.cineworld.co.uk/booking/8102/63569" audioType="audio described"/>
                    <show time="2019-07-22T18:30:00" url="https://booking.cineworld.co.uk/booking/8102/63628" audioType="audio described" subtitled="true"/>
                    <show time="2019-07-22T19:30:00" url="https://booking.cineworld.co.uk/booking/8102/63578" audioType="audio described"/>
                    <show time="2019-07-22T20:30:00" url="https://booking.cineworld.co.uk/booking/8102/63570" audioType="audio described"/>
                    <show time="2019-07-22T21:20:00" url="https://booking.cineworld.co.uk/booking/8102/64230" audioType="audio described"/>
                    <show time="2019-07-23T10:20:00" url="https://booking.cineworld.co.uk/booking/8102/63647" audioType="audio described"/>
                    <show time="2019-07-23T10:40:00" url="https://booking.cineworld.co.uk/booking/8102/63593" audioType="audio described"/>
                    <show time="2019-07-23T11:30:00" url="https://booking.cineworld.co.uk/booking/8102/63555" audioType="audio described"/>
                    <show time="2019-07-23T12:30:00" url="https://booking.cineworld.co.uk/booking/8102/63639" audioType="audio described"/>
                    <show time="2019-07-23T13:20:00" url="https://booking.cineworld.co.uk/booking/8102/63648" audioType="audio described"/>
                    <show time="2019-07-23T13:40:00" url="https://booking.cineworld.co.uk/booking/8102/63594" audioType="audio described"/>
                    <show time="2019-07-23T14:30:00" url="https://booking.cineworld.co.uk/booking/8102/63556" audioType="audio described"/>
                    <show time="2019-07-23T15:30:00" url="https://booking.cineworld.co.uk/booking/8102/63640" audioType="audio described"/>
                    <show time="2019-07-23T16:30:00" url="https://booking.cineworld.co.uk/booking/8102/63595" audioType="audio described"/>
                    <show time="2019-07-23T17:30:00" url="https://booking.cineworld.co.uk/booking/8102/63571" audioType="audio described"/>
                    <show time="2019-07-23T18:30:00" url="https://booking.cineworld.co.uk/booking/8102/63629" audioType="audio described"/>
                    <show time="2019-07-23T19:30:00" url="https://booking.cineworld.co.uk/booking/8102/63579" audioType="audio described"/>
                    <show time="2019-07-23T20:30:00" url="https://booking.cineworld.co.uk/booking/8102/63572" audioType="audio described"/>
                    <show time="2019-07-23T21:20:00" url="https://booking.cineworld.co.uk/booking/8102/64231" audioType="audio described"/>
                    <show time="2019-07-24T10:20:00" url="https://booking.cineworld.co.uk/booking/8102/63649" audioType="audio described"/>
                    <show time="2019-07-24T10:40:00" url="https://booking.cineworld.co.uk/booking/8102/63596" audioType="audio described"/>
                    <show time="2019-07-24T11:30:00" url="https://booking.cineworld.co.uk/booking/8102/63557" audioType="audio described"/>
                    <show time="2019-07-24T12:30:00" url="https://booking.cineworld.co.uk/booking/8102/63641" audioType="audio described"/>
                    <show time="2019-07-24T13:20:00" url="https://booking.cineworld.co.uk/booking/8102/63650" audioType="audio described"/>
                    <show time="2019-07-24T13:40:00" url="https://booking.cineworld.co.uk/booking/8102/63597" audioType="audio described"/>
                    <show time="2019-07-24T14:30:00" url="https://booking.cineworld.co.uk/booking/8102/63558" audioType="audio described"/>
                    <show time="2019-07-24T15:30:00" url="https://booking.cineworld.co.uk/booking/8102/63642" audioType="audio described"/>
                    <show time="2019-07-24T16:30:00" url="https://booking.cineworld.co.uk/booking/8102/63598" audioType="audio described"/>
                    <show time="2019-07-24T17:30:00" url="https://booking.cineworld.co.uk/booking/8102/63573" audioType="audio described"/>
                    <show time="2019-07-24T18:30:00" url="https://booking.cineworld.co.uk/booking/8102/63630" audioType="audio described"/>
                    <show time="2019-07-24T19:30:00" url="https://booking.cineworld.co.uk/booking/8102/63580" audioType="audio described"/>
                    <show time="2019-07-24T20:30:00" url="https://booking.cineworld.co.uk/booking/8102/63574" audioType="audio described"/>
                    <show time="2019-07-24T21:20:00" url="https://booking.cineworld.co.uk/booking/8102/64232" audioType="audio described"/>
                    <show time="2019-07-25T10:20:00" url="https://booking.cineworld.co.uk/booking/8102/64383" audioType="audio described"/>
                    <show time="2019-07-25T10:40:00" url="https://booking.cineworld.co.uk/booking/8102/64350" audioType="audio described"/>
                    <show time="2019-07-25T11:30:00" url="https://booking.cineworld.co.uk/booking/8102/64244" audioType="audio described"/>
                    <show time="2019-07-25T12:30:00" url="https://booking.cineworld.co.uk/booking/8102/64385" audioType="audio described"/>
                    <show time="2019-07-25T13:20:00" url="https://booking.cineworld.co.uk/booking/8102/64384" audioType="audio described"/>
                    <show time="2019-07-25T13:40:00" url="https://booking.cineworld.co.uk/booking/8102/64351" audioType="audio described"/>
                    <show time="2019-07-25T14:30:00" url="https://booking.cineworld.co.uk/booking/8102/64245" audioType="audio described"/>
                    <show time="2019-07-25T15:30:00" url="https://booking.cineworld.co.uk/booking/8102/64386" audioType="audio described"/>
                    <show time="2019-07-25T16:30:00" url="https://booking.cineworld.co.uk/booking/8102/64352" audioType="audio described"/>
                    <show time="2019-07-25T17:30:00" url="https://booking.cineworld.co.uk/booking/8102/64246" audioType="audio described"/>
                    <show time="2019-07-25T18:30:00" url="https://booking.cineworld.co.uk/booking/8102/64387" audioType="audio described"/>
                    <show time="2019-07-25T19:30:00" url="https://booking.cineworld.co.uk/booking/8102/64353" audioType="audio described"/>
                    <show time="2019-07-25T20:30:00" url="https://booking.cineworld.co.uk/booking/8102/64247" audioType="audio described"/>
                    <show time="2019-07-25T21:20:00" url="https://booking.cineworld.co.uk/booking/8102/64388" audioType="audio described"/>
                </shows>
            </film>
            <film title="(IMAX) The Lion King" rating="PG" url="films/the-lion-king" edi="245703" release="19/07/2019">
                <shows>
                    <show time="2019-07-22T11:00:00" url="https://booking.cineworld.co.uk/booking/8102/63533" videoType="imax" audioType="audio described"/>
                    <show time="2019-07-22T14:00:00" url="https://booking.cineworld.co.uk/booking/8102/63534" videoType="imax" audioType="audio described"/>
                    <show time="2019-07-23T11:00:00" url="https://booking.cineworld.co.uk/booking/8102/63535" videoType="imax" audioType="audio described"/>
                    <show time="2019-07-23T14:00:00" url="https://booking.cineworld.co.uk/booking/8102/63536" videoType="imax" audioType="audio described"/>
                    <show time="2019-07-24T11:00:00" url="https://booking.cineworld.co.uk/booking/8102/63537" videoType="imax" audioType="audio described"/>
                    <show time="2019-07-24T14:00:00" url="https://booking.cineworld.co.uk/booking/8102/63538" videoType="imax" audioType="audio described"/>
                    <show time="2019-07-25T11:00:00" url="https://booking.cineworld.co.uk/booking/8102/64240" videoType="imax" audioType="audio described"/>
                    <show time="2019-07-25T14:00:00" url="https://booking.cineworld.co.uk/booking/8102/64241" videoType="imax" audioType="audio described"/>
                </shows>
            </film>
            <film title="(IMAX 3-D) The Lion King" rating="PG" url="films/the-lion-king" edi="245702" release="19/07/2019">
                <shows>
                    <show time="2019-07-22T17:00:00" url="https://booking.cineworld.co.uk/booking/8102/63545" videoType="imax 3d" audioType="audio described"/>
                    <show time="2019-07-22T20:00:00" url="https://booking.cineworld.co.uk/booking/8102/63546" videoType="imax 3d" audioType="audio described"/>
                    <show time="2019-07-23T17:00:00" url="https://booking.cineworld.co.uk/booking/8102/63547" videoType="imax 3d" audioType="audio described"/>
                    <show time="2019-07-23T20:00:00" url="https://booking.cineworld.co.uk/booking/8102/63548" videoType="imax 3d" audioType="audio described"/>
                    <show time="2019-07-24T17:00:00" url="https://booking.cineworld.co.uk/booking/8102/63549" videoType="imax 3d" audioType="audio described"/>
                    <show time="2019-07-24T20:00:00" url="https://booking.cineworld.co.uk/booking/8102/63550" videoType="imax 3d" audioType="audio described"/>
                    <show time="2019-07-25T17:00:00" url="https://booking.cineworld.co.uk/booking/8102/64242" videoType="imax 3d" audioType="audio described"/>
                    <show time="2019-07-25T20:00:00" url="https://booking.cineworld.co.uk/booking/8102/64243" videoType="imax 3d" audioType="audio described"/>
                </shows>
            </film>
            <film title="(3D) The Lion King" rating="PG" url="films/the-lion-king" edi="229584" release="19/07/2019">
                <shows>
                    <show time="2019-07-22T10:00:00" url="https://booking.cineworld.co.uk/booking/8102/63602" videoType="3d" audioType="audio described"/>
                    <show time="2019-07-22T12:00:00" url="https://booking.cineworld.co.uk/booking/8102/63667" videoType="3d" audioType="audio described"/>
                    <show time="2019-07-22T13:00:00" url="https://booking.cineworld.co.uk/booking/8102/63603" videoType="3d" audioType="audio described"/>
                    <show time="2019-07-22T15:00:00" url="https://booking.cineworld.co.uk/booking/8102/63668" videoType="3d" audioType="audio described"/>
                    <show time="2019-07-22T16:00:00" url="https://booking.cineworld.co.uk/booking/8102/63604" videoType="3d" audioType="audio described"/>
                    <show time="2019-07-22T18:00:00" url="https://booking.cineworld.co.uk/booking/8102/63658" videoType="3d" audioType="audio described"/>
                    <show time="2019-07-22T19:00:00" url="https://booking.cineworld.co.uk/booking/8102/63620" videoType="3d" audioType="audio described"/>
                    <show time="2019-07-23T10:00:00" url="https://booking.cineworld.co.uk/booking/8102/63605" videoType="3d" audioType="audio described"/>
                    <show time="2019-07-23T12:00:00" url="https://booking.cineworld.co.uk/booking/8102/63669" videoType="3d" audioType="audio described"/>
                    <show time="2019-07-23T13:00:00" url="https://booking.cineworld.co.uk/booking/8102/63606" videoType="3d" audioType="audio described"/>
                    <show time="2019-07-23T15:00:00" url="https://booking.cineworld.co.uk/booking/8102/63670" videoType="3d" audioType="audio described"/>
                    <show time="2019-07-23T16:00:00" url="https://booking.cineworld.co.uk/booking/8102/63607" videoType="3d" audioType="audio described"/>
                    <show time="2019-07-23T18:00:00" url="https://booking.cineworld.co.uk/booking/8102/63659" videoType="3d" audioType="audio described"/>
                    <show time="2019-07-23T19:00:00" url="https://booking.cineworld.co.uk/booking/8102/63621" videoType="3d" audioType="audio described"/>
                    <show time="2019-07-24T10:00:00" url="https://booking.cineworld.co.uk/booking/8102/63608" videoType="3d" audioType="audio described"/>
                    <show time="2019-07-24T12:00:00" url="https://booking.cineworld.co.uk/booking/8102/63671" videoType="3d" audioType="audio described"/>
                    <show time="2019-07-24T13:00:00" url="https://booking.cineworld.co.uk/booking/8102/63609" videoType="3d" audioType="audio described"/>
                    <show time="2019-07-24T15:00:00" url="https://booking.cineworld.co.uk/booking/8102/63672" videoType="3d" audioType="audio described"/>
                    <show time="2019-07-24T16:00:00" url="https://booking.cineworld.co.uk/booking/8102/63610" videoType="3d" audioType="audio described"/>
                    <show time="2019-07-24T18:00:00" url="https://booking.cineworld.co.uk/booking/8102/63660" videoType="3d" audioType="audio described"/>
                    <show time="2019-07-24T19:00:00" url="https://booking.cineworld.co.uk/booking/8102/63622" videoType="3d" audioType="audio described"/>
                    <show time="2019-07-25T10:00:00" url="https://booking.cineworld.co.uk/booking/8102/64248" videoType="3d" audioType="audio described"/>
                    <show time="2019-07-25T12:00:00" url="https://booking.cineworld.co.uk/booking/8102/64354" videoType="3d" audioType="audio described"/>
                    <show time="2019-07-25T13:00:00" url="https://booking.cineworld.co.uk/booking/8102/64249" videoType="3d" audioType="audio described"/>
                    <show time="2019-07-25T15:00:00" url="https://booking.cineworld.co.uk/booking/8102/64355" videoType="3d" audioType="audio described"/>
                    <show time="2019-07-25T16:00:00" url="https://booking.cineworld.co.uk/booking/8102/64250" videoType="3d" audioType="audio described"/>
                    <show time="2019-07-25T18:00:00" url="https://booking.cineworld.co.uk/booking/8102/64356" videoType="3d" audioType="audio described"/>
                    <show time="2019-07-25T19:00:00" url="https://booking.cineworld.co.uk/booking/8102/64251" videoType="3d" audioType="audio described"/>
                </shows>
            </film>
            <film title="The Matrix : 20th Anniversary (4K Restoration)" rating="15" url="films/the-matrix-20th-anniversary-4k-restoration" edi="105580" release="13/07/2019">
                <shows>
                    <show time="2019-07-30T20:00:00" url="https://booking.cineworld.co.uk/booking/8102/64397" audioType="audio described"/>
                </shows>
            </film>
            <film title="The Queen's Corgi" rating="PG" url="films/the-queens-corgi" edi="245222" release="05/07/2019">
                <shows>
                    <show time="2019-07-22T10:15:00" url="https://booking.cineworld.co.uk/booking/8102/64276"/>
                    <show time="2019-07-23T10:15:00" url="https://booking.cineworld.co.uk/booking/8102/64277"/>
                    <show time="2019-07-24T10:15:00" url="https://booking.cineworld.co.uk/booking/8102/64278"/>
                    <show time="2019-07-25T10:15:00" url="https://booking.cineworld.co.uk/booking/8102/64279"/>
                </shows>
            </film>
            <film title="(2D) Toy Story 4" rating="U" url="films/toy-story-4" edi="148687" release="21/06/2019">
                <shows>
                    <show time="2019-07-22T10:30:00" url="https://booking.cineworld.co.uk/booking/8102/64299" audioType="audio described"/>
                    <show time="2019-07-22T12:10:00" url="https://booking.cineworld.co.uk/booking/8102/64331" audioType="audio described"/>
                    <show time="2019-07-22T13:10:00" url="https://booking.cineworld.co.uk/booking/8102/64300" audioType="audio described"/>
                    <show time="2019-07-22T14:40:00" url="https://booking.cineworld.co.uk/booking/8102/64332" audioType="audio described"/>
                    <show time="2019-07-22T15:50:00" url="https://booking.cineworld.co.uk/booking/8102/64301" audioType="audio described"/>
                    <show time="2019-07-22T18:20:00" url="https://booking.cineworld.co.uk/booking/8102/64302" audioType="audio described"/>
                    <show time="2019-07-22T19:50:00" url="https://booking.cineworld.co.uk/booking/8102/64333" audioType="audio described"/>
                    <show time="2019-07-23T10:30:00" url="https://booking.cineworld.co.uk/booking/8102/64303" audioType="audio described"/>
                    <show time="2019-07-23T12:10:00" url="https://booking.cineworld.co.uk/booking/8102/64334" audioType="audio described"/>
                    <show time="2019-07-23T13:10:00" url="https://booking.cineworld.co.uk/booking/8102/64304" audioType="audio described"/>
                    <show time="2019-07-23T14:40:00" url="https://booking.cineworld.co.uk/booking/8102/64335" audioType="audio described"/>
                    <show time="2019-07-23T15:50:00" url="https://booking.cineworld.co.uk/booking/8102/64305" audioType="audio described"/>
                    <show time="2019-07-23T18:20:00" url="https://booking.cineworld.co.uk/booking/8102/64306" audioType="audio described"/>
                    <show time="2019-07-23T19:50:00" url="https://booking.cineworld.co.uk/booking/8102/64336" audioType="audio described"/>
                    <show time="2019-07-24T10:30:00" url="https://booking.cineworld.co.uk/booking/8102/64307" audioType="audio described"/>
                    <show time="2019-07-24T12:10:00" url="https://booking.cineworld.co.uk/booking/8102/64337" audioType="audio described"/>
                    <show time="2019-07-24T13:10:00" url="https://booking.cineworld.co.uk/booking/8102/64308" audioType="audio described"/>
                    <show time="2019-07-24T14:40:00" url="https://booking.cineworld.co.uk/booking/8102/64338" audioType="audio described"/>
                    <show time="2019-07-24T15:50:00" url="https://booking.cineworld.co.uk/booking/8102/64309" audioType="audio described"/>
                    <show time="2019-07-24T18:20:00" url="https://booking.cineworld.co.uk/booking/8102/64310" audioType="audio described"/>
                    <show time="2019-07-24T19:50:00" url="https://booking.cineworld.co.uk/booking/8102/64339" audioType="audio described"/>
                    <show time="2019-07-25T10:30:00" url="https://booking.cineworld.co.uk/booking/8102/64311" audioType="audio described"/>
                    <show time="2019-07-25T12:10:00" url="https://booking.cineworld.co.uk/booking/8102/64340" audioType="audio described"/>
                    <show time="2019-07-25T13:10:00" url="https://booking.cineworld.co.uk/booking/8102/64312" audioType="audio described"/>
                    <show time="2019-07-25T14:40:00" url="https://booking.cineworld.co.uk/booking/8102/64341" audioType="audio described"/>
                    <show time="2019-07-25T15:50:00" url="https://booking.cineworld.co.uk/booking/8102/64313" audioType="audio described"/>
                    <show time="2019-07-25T18:20:00" url="https://booking.cineworld.co.uk/booking/8102/64314" audioType="audio described"/>
                    <show time="2019-07-25T19:50:00" url="https://booking.cineworld.co.uk/booking/8102/64342" audioType="audio described"/>
                </shows>
            </film>
            <film title="Yesterday" rating="12A" url="films/yesterday" edi="253917" release="28/06/2019">
                <shows>
                    <show time="2019-07-22T17:10:00" url="https://booking.cineworld.co.uk/booking/8102/64346" audioType="audio described"/>
                    <show time="2019-07-22T20:40:00" url="https://booking.cineworld.co.uk/booking/8102/64283" audioType="audio described"/>
                    <show time="2019-07-23T17:10:00" url="https://booking.cineworld.co.uk/booking/8102/64347" audioType="audio described"/>
                    <show time="2019-07-23T20:40:00" url="https://booking.cineworld.co.uk/booking/8102/64284" audioType="audio described"/>
                    <show time="2019-07-24T17:10:00" url="https://booking.cineworld.co.uk/booking/8102/64348" audioType="audio described"/>
                    <show time="2019-07-24T20:40:00" url="https://booking.cineworld.co.uk/booking/8102/64285" audioType="audio described"/>
                    <show time="2019-07-25T17:10:00" url="https://booking.cineworld.co.uk/booking/8102/64349" audioType="audio described"/>
                    <show time="2019-07-25T20:40:00" url="https://booking.cineworld.co.uk/booking/8102/64286" audioType="audio described"/>
                </shows>
            </film>
        </listing>
    </cinema>
    <cinema name="Cineworld Boldon Tyne and Wear" root="http://www1.cineworld.co.uk/" url="cinemas/boldon-tyne-and-wear" id="67" phone="0871 200 2000" address="Boldon Leisure Park, Bolden Colliery, Tyne and Wear" postcode="NE35 9PB">
        <listing>
            <film title="Andre Rieu 2019 Maastricht Concert Shall We Dance?" rating="PG" url="films/andre-rieu-2019-maastricht-concert-shall-we-dance" edi="255443" release="27/07/2019">
                <shows>
                    <show time="2019-07-27T19:00:00" url="https://booking.cineworld.co.uk/booking/8029/129930"/>
                    <show time="2019-07-28T15:00:00" url="https://booking.cineworld.co.uk/booking/8029/129931"/>
                </shows>
            </film>
            <film title="Annabelle Comes Home" rating="15" url="films/annabelle-comes-home" edi="250924" release="10/07/2019">
                <shows>
                    <show time="2019-07-22T13:15:00" url="https://booking.cineworld.co.uk/booking/8029/137490" audioType="audio described"/>
                    <show time="2019-07-22T15:50:00" url="https://booking.cineworld.co.uk/booking/8029/137491" audioType="audio described"/>
                    <show time="2019-07-22T18:20:00" url="https://booking.cineworld.co.uk/booking/8029/137492" audioType="audio described"/>
                    <show time="2019-07-22T21:00:00" url="https://booking.cineworld.co.uk/booking/8029/137493" audioType="audio described"/>
                    <show time="2019-07-23T13:15:00" url="https://booking.cineworld.co.uk/booking/8029/137494" audioType="audio described"/>
                    <show time="2019-07-23T15:50:00" url="https://booking.cineworld.co.uk/booking/8029/137495" audioType="audio described"/>
                    <show time="2019-07-23T18:20:00" url="https://booking.cineworld.co.uk/booking/8029/137496" audioType="audio described"/>
                    <show time="2019-07-23T21:00:00" url="https://booking.cineworld.co.uk/booking/8029/137497" audioType="audio described"/>
                    <show time="2019-07-24T13:15:00" url="https://booking.cineworld.co.uk/booking/8029/137498" audioType="audio described"/>
                    <show time="2019-07-24T15:50:00" url="https://booking.cineworld.co.uk/booking/8029/137499" audioType="audio described"/>
                    <show time="2019-07-24T18:20:00" url="https://booking.cineworld.co.uk/booking/8029/137500" audioType="audio described"/>
                    <show time="2019-07-24T21:00:00" url="https://booking.cineworld.co.uk/booking/8029/137501" audioType="audio described"/>
                    <show time="2019-07-25T13:15:00" url="https://booking.cineworld.co.uk/booking/8029/137502" audioType="audio described"/>
                    <show time="2019-07-25T15:50:00" url="https://booking.cineworld.co.uk/booking/8029/137503" audioType="audio described"/>
                    <show time="2019-07-25T18:20:00" url="https://booking.cineworld.co.uk/booking/8029/137504" audioType="audio described"/>
                    <show time="2019-07-25T21:00:00" url="https://booking.cineworld.co.uk/booking/8029/137505" audioType="audio described"/>
                </shows>
            </film>
            <film title="Apocalypse Now - The Final Cut + Q&amp;A" rating="15" url="films/apocalypse-now-the-final-cut-qa" edi="801886" release="13/08/2019">
                <shows>
                    <show time="2019-08-13T19:30:00" url="https://booking.cineworld.co.uk/booking/8029/135185"/>
                </shows>
            </film>
            <film title="Autism Friendly Screening: The Lion King (2019)" rating="PG" url="films/autism-friendly-screening-the-lion-king-2019" edi="801945" release="19/07/2019">
                <shows>
                    <show time="2019-08-04T11:00:00" url="https://booking.cineworld.co.uk/booking/8029/137157" audioType="audio described"/>
                </shows>
            </film>
            <film title="Billy Connolly: The Sex Life of Bandages" rating="18" url="films/billy-connolly-the-sex-life-of-bandages" edi="276418" release="10/10/2019">
                <shows>
                    <show time="2019-10-10T20:00:00" url="https://booking.cineworld.co.uk/booking/8029/137672"/>
                </shows>
            </film>
            <film title="Bring The Soul: The Movie" rating="PG" url="films/bring-the-soul-the-movie" edi="281205" release="07/08/2019">
                <shows>
                    <show time="2019-08-07T19:30:00" url="https://booking.cineworld.co.uk/booking/8029/137149"/>
                    <show time="2019-08-11T14:00:00" url="https://booking.cineworld.co.uk/booking/8029/137150"/>
                </shows>
            </film>
            <film title="Dracula - Northern Ballet Live" rating="12A" url="films/dracula-northern-ballet-live" edi="270199" release="31/10/2019">
                <shows>
                    <show time="2019-10-31T17:15:00" url="https://booking.cineworld.co.uk/booking/8029/129911"/>
                </shows>
            </film>
            <film title="ENO Screen : The Mikado Encore (2015)" rating="PG" url="films/eno-screen-the-mikado-encore-2015" edi="187300" release="19/08/2019">
                <shows>
                    <show time="2019-08-19T19:30:00" url="https://booking.cineworld.co.uk/booking/8029/134825"/>
                </shows>
            </film>
            <film title="Fast &amp; Furious: Hobbs &amp; Shaw" rating="TBC" url="films/fast-furious-hobbs-shaw" edi="240260" release="02/08/2019">
                <shows>
                    <show time="2019-08-01T20:30:00" url="https://booking.cineworld.co.uk/booking/8029/135587" audioType="audio described"/>
                    <show time="2019-08-02T20:30:00" url="https://booking.cineworld.co.uk/booking/8029/135588" audioType="audio described"/>
                    <show time="2019-08-03T20:30:00" url="https://booking.cineworld.co.uk/booking/8029/135589" audioType="audio described"/>
                    <show time="2019-08-04T20:30:00" url="https://booking.cineworld.co.uk/booking/8029/135590" audioType="audio described"/>
                </shows>
            </film>
            <film title="Margaret Atwood : Live In Cinemas" rating="12A" url="films/margaret-atwood-live-in-cinemas" edi="272858" release="10/09/2019">
                <shows>
                    <show time="2019-09-10T19:30:00" url="https://booking.cineworld.co.uk/booking/8029/131912"/>
                </shows>
            </film>
            <film title="Met Opera 2019-20: Akhnaten" rating="TBC" url="films/met-opera-2019-20-akhnaten" edi="274678" release="23/11/2019">
                <shows>
                    <show time="2019-11-23T17:55:00" url="https://booking.cineworld.co.uk/booking/8029/137467"/>
                </shows>
            </film>
            <film title="MET Opera 2019-20: Madama Butterfly" rating="TBC" url="films/met-opera-2019-20-madama-butterfly" edi="274682" release="09/11/2019">
                <shows>
                    <show time="2019-11-09T17:55:00" url="https://booking.cineworld.co.uk/booking/8029/137466"/>
                </shows>
            </film>
            <film title="MET Opera 2019-20: Manon" rating="TBC" url="films/met-opera-2019-20-manon" edi="274680" release="26/10/2019">
                <shows>
                    <show time="2019-10-26T17:55:00" url="https://booking.cineworld.co.uk/booking/8029/137465"/>
                </shows>
            </film>
            <film title="MET Opera 2019-20: Turandot" rating="TBC" url="films/met-opera-2019-20-turandot" edi="274672" release="12/10/2019">
                <shows>
                    <show time="2019-10-12T17:55:00" url="https://booking.cineworld.co.uk/booking/8029/137464"/>
                </shows>
            </film>
            <film title="Midsommar" rating="18" url="films/midsommar" edi="265995" release="05/07/2019">
                <shows>
                    <show time="2019-07-22T20:50:00" url="https://booking.cineworld.co.uk/booking/8029/137565" audioType="audio described"/>
                    <show time="2019-07-24T20:50:00" url="https://booking.cineworld.co.uk/booking/8029/137566" audioType="audio described"/>
                </shows>
            </film>
            <film title="NT Live: A Midsummer Night's Dream" rating="12A" url="films/nt-live-a-midsummer-nights-dream" edi="274950" release="17/10/2019">
                <shows>
                    <show time="2019-10-17T19:10:00" url="https://booking.cineworld.co.uk/booking/8029/135886"/>
                </shows>
            </film>
            <film title="NT Live: Hansard" rating="15" url="films/nt-live-hansard" edi="270878" release="07/11/2019">
                <shows>
                    <show time="2019-11-07T19:00:00" url="https://booking.cineworld.co.uk/booking/8029/135887"/>
                </shows>
            </film>
            <film title="NT Live : One Man, Two Guvnors (Encore)" rating="12A" url="films/nt-live-one-man-two-guvnors-encore" edi="266343" release="26/09/2019">
                <shows>
                    <show time="2019-09-26T19:00:00" url="https://booking.cineworld.co.uk/booking/8029/133322"/>
                </shows>
            </film>
            <film title="NT Live: Present Laughter" rating="12A" url="films/nt-live-present-laughter" edi="278033" release="28/11/2019">
                <shows>
                    <show time="2019-11-28T19:00:00" url="https://booking.cineworld.co.uk/booking/8029/135888"/>
                </shows>
            </film>
            <film title="NT Live : The Lehman Trilogy" rating="12A" url="films/nt-live-the-lehman-trilogy" edi="266345" release="25/07/2019">
                <shows>
                    <show time="2019-07-25T19:00:00" url="https://booking.cineworld.co.uk/booking/8029/133321"/>
                </shows>
            </film>
            <film title="M4J Paw Patrol: Mighty Pups - The Movie" rating="U" url="films/paw-patrol-mighty-pups-movies-for-juniors" edi="801924" release="19/07/2019">
                <shows>
                    <show time="2019-07-22T10:10:00" url="https://booking.cineworld.co.uk/booking/8029/137643" audioType="audio described"/>
                    <show time="2019-07-23T10:10:00" url="https://booking.cineworld.co.uk/booking/8029/137644" audioType="audio described"/>
                    <show time="2019-07-24T10:10:00" url="https://booking.cineworld.co.uk/booking/8029/137645" audioType="audio described"/>
                    <show time="2019-07-25T10:10:00" url="https://booking.cineworld.co.uk/booking/8029/137646" audioType="audio described"/>
                </shows>
            </film>
            <film title="Placido Domingo 50th Anniversary Concert" rating="TBC" url="films/placido-domingo-50th-anniversary-concert" edi="270187" release="01/10/2019">
                <shows>
                    <show time="2019-10-01T19:00:00" url="https://booking.cineworld.co.uk/booking/8029/136433"/>
                </shows>
            </film>
            <film title="M4J Ralph Breaks The Internet: Wreck It Ralph 2" rating="PG" url="films/ralph-breaks-the-internet-wreck-it-ralph-2-movies-for-juniors" edi="801742" release="01/03/2019">
                <shows>
                    <show time="2019-07-22T10:00:00" url="https://booking.cineworld.co.uk/booking/8029/137521" audioType="audio described"/>
                    <show time="2019-07-23T10:00:00" url="https://booking.cineworld.co.uk/booking/8029/137522" audioType="audio described"/>
                    <show time="2019-07-24T10:00:00" url="https://booking.cineworld.co.uk/booking/8029/137523" audioType="audio described"/>
                    <show time="2019-07-25T10:00:00" url="https://booking.cineworld.co.uk/booking/8029/137661" audioType="audio described"/>
                </shows>
            </film>
            <film title="Rigoletto On The Lake" rating="TBC" url="films/rigoletto-on-the-lake" edi="270196" release="17/09/2019">
                <shows>
                    <show time="2019-09-17T19:00:00" url="https://booking.cineworld.co.uk/booking/8029/136432"/>
                </shows>
            </film>
            <film title="Rocketman : Sing-Along Version" rating="15" url="films/rocketman-sing-along-version" edi="263136" release="26/07/2019">
                <shows>
                    <show time="2019-07-26T19:30:00" url="https://booking.cineworld.co.uk/booking/8029/137476" audioType="audio described" subtitled="true"/>
                </shows>
            </film>
            <film title="Roger Waters  Us + Them" rating="12A" url="films/roger-waters-us-them" edi="276883" release="02/10/2019">
                <shows>
                    <show time="2019-10-02T19:30:00" url="https://booking.cineworld.co.uk/booking/8029/137671"/>
                </shows>
            </film>
            <film title="ROH Live Opera 2019 : Don Giovanni" rating="TBC" url="films/roh-live-opera-2019-don-giovanni" edi="274395" release="08/10/2019">
                <shows>
                    <show time="2019-10-07T18:45:00" url="https://booking.cineworld.co.uk/booking/8029/135547"/>
                </shows>
            </film>
            <film title="ROH Live Opera 2019 : Don Pasquale" rating="TBC" url="films/roh-live-opera-2019-don-pasquale" edi="274401" release="24/10/2019">
                <shows>
                    <show time="2019-10-24T19:30:00" url="https://booking.cineworld.co.uk/booking/8029/135548"/>
                </shows>
            </film>
            <film title="ROH Royal Ballet Live 2019 : Coppelia" rating="TBC" url="films/roh-royal-ballet-live-2019-coppelia" edi="274396" release="10/12/2019">
                <shows>
                    <show time="2019-12-10T19:15:00" url="https://booking.cineworld.co.uk/booking/8029/135550"/>
                </shows>
            </film>
            <film title="ROH Royal Ballet Live 2019 : Triple Bill" rating="TBC" url="films/roh-royal-ballet-live-2019-triple-bill" edi="274399" release="05/11/2019">
                <shows>
                    <show time="2019-11-05T19:15:00" url="https://booking.cineworld.co.uk/booking/8029/135549"/>
                </shows>
            </film>
            <film title="ROH Royal Ballet: The Nutckracker (2016 Recorded)" rating="TBC" url="films/roh-royal-ballet-the-nutckracker-2016-recorded" edi="277630" release="17/12/2019">
                <shows>
                    <show time="2019-12-17T19:15:00" url="https://booking.cineworld.co.uk/booking/8029/135551"/>
                </shows>
            </film>
            <film title="RSC Live : Measure For Measure" rating="12A" url="films/rsc-live-measure-for-measure" edi="263087" release="31/07/2019">
                <shows>
                    <show time="2019-07-31T19:00:00" url="https://booking.cineworld.co.uk/booking/8029/125553"/>
                </shows>
            </film>
            <film title="Secret Unlimited Screening 12" rating="15" url="films/secret-unlimited-screening-12" edi="801942" release="29/07/2019">
                <shows>
                    <show time="2019-07-29T20:00:00" url="https://booking.cineworld.co.uk/booking/8029/137151" audioType="audio described"/>
                </shows>
            </film>
            <film title="(2D) Spider-Man: Far From Home" rating="12A" url="films/spider-man-far-from-home" edi="221205" release="02/07/2019">
                <shows>
                    <show time="2019-07-22T11:10:00" url="https://booking.cineworld.co.uk/booking/8029/137597" audioType="audio described"/>
                    <show time="2019-07-22T11:10:00" url="https://booking.cineworld.co.uk/booking/8029/137597" audioType="audio described" sessionType="dbox"/>
                    <show time="2019-07-22T14:10:00" url="https://booking.cineworld.co.uk/booking/8029/137598" audioType="audio described"/>
                    <show time="2019-07-22T14:10:00" url="https://booking.cineworld.co.uk/booking/8029/137598" audioType="audio described" sessionType="dbox"/>
                    <show time="2019-07-22T17:20:00" url="https://booking.cineworld.co.uk/booking/8029/137599" audioType="audio described"/>
                    <show time="2019-07-22T17:20:00" url="https://booking.cineworld.co.uk/booking/8029/137599" audioType="audio described" sessionType="dbox"/>
                    <show time="2019-07-22T19:10:00" url="https://booking.cineworld.co.uk/booking/8029/137651"/>
                    <show time="2019-07-22T20:20:00" url="https://booking.cineworld.co.uk/booking/8029/137600" audioType="audio described"/>
                    <show time="2019-07-22T20:20:00" url="https://booking.cineworld.co.uk/booking/8029/137600" audioType="audio described" sessionType="dbox"/>
                    <show time="2019-07-23T11:10:00" url="https://booking.cineworld.co.uk/booking/8029/137601" audioType="audio described"/>
                    <show time="2019-07-23T11:10:00" url="https://booking.cineworld.co.uk/booking/8029/137601" audioType="audio described" sessionType="dbox"/>
                    <show time="2019-07-23T14:10:00" url="https://booking.cineworld.co.uk/booking/8029/137602" audioType="audio described"/>
                    <show time="2019-07-23T14:10:00" url="https://booking.cineworld.co.uk/booking/8029/137602" audioType="audio described" sessionType="dbox"/>
                    <show time="2019-07-23T17:20:00" url="https://booking.cineworld.co.uk/booking/8029/137603" audioType="audio described"/>
                    <show time="2019-07-23T17:20:00" url="https://booking.cineworld.co.uk/booking/8029/137603" audioType="audio described" sessionType="dbox"/>
                    <show time="2019-07-23T19:10:00" url="https://booking.cineworld.co.uk/booking/8029/137652"/>
                    <show time="2019-07-23T20:20:00" url="https://booking.cineworld.co.uk/booking/8029/137604" audioType="audio described"/>
                    <show time="2019-07-23T20:20:00" url="https://booking.cineworld.co.uk/booking/8029/137604" audioType="audio described" sessionType="dbox"/>
                    <show time="2019-07-24T11:10:00" url="https://booking.cineworld.co.uk/booking/8029/137605" audioType="audio described"/>
                    <show time="2019-07-24T11:10:00" url="https://booking.cineworld.co.uk/booking/8029/137605" audioType="audio described" sessionType="dbox"/>
                    <show time="2019-07-24T14:10:00" url="https://booking.cineworld.co.uk/booking/8029/137606" audioType="audio described"/>
                    <show time="2019-07-24T14:10:00" url="https://booking.cineworld.co.uk/booking/8029/137606" audioType="audio described" sessionType="dbox"/>
                    <show time="2019-07-24T17:20:00" url="https://booking.cineworld.co.uk/booking/8029/137607" audioType="audio described"/>
                    <show time="2019-07-24T17:20:00" url="https://booking.cineworld.co.uk/booking/8029/137607" audioType="audio described" sessionType="dbox"/>
                    <show time="2019-07-24T19:10:00" url="https://booking.cineworld.co.uk/booking/8029/137653"/>
                    <show time="2019-07-24T20:20:00" url="https://booking.cineworld.co.uk/booking/8029/137608" audioType="audio described"/>
                    <show time="2019-07-24T20:20:00" url="https://booking.cineworld.co.uk/booking/8029/137608" audioType="audio described" sessionType="dbox"/>
                    <show time="2019-07-25T11:10:00" url="https://booking.cineworld.co.uk/booking/8029/137609" audioType="audio described"/>
                    <show time="2019-07-25T11:10:00" url="https://booking.cineworld.co.uk/booking/8029/137609" audioType="audio described" sessionType="dbox"/>
                    <show time="2019-07-25T14:10:00" url="https://booking.cineworld.co.uk/booking/8029/137610" audioType="audio described"/>
                    <show time="2019-07-25T14:10:00" url="https://booking.cineworld.co.uk/booking/8029/137610" audioType="audio described" sessionType="dbox"/>
                    <show time="2019-07-25T17:20:00" url="https://booking.cineworld.co.uk/booking/8029/137611" audioType="audio described"/>
                    <show time="2019-07-25T17:20:00" url="https://booking.cineworld.co.uk/booking/8029/137611" audioType="audio described" sessionType="dbox"/>
                    <show time="2019-07-25T20:20:00" url="https://booking.cineworld.co.uk/booking/8029/137612" audioType="audio described"/>
                    <show time="2019-07-25T20:20:00" url="https://booking.cineworld.co.uk/booking/8029/137612" audioType="audio described" sessionType="dbox"/>
                </shows>
            </film>
            <film title="Stuber" rating="15" url="films/stuber" edi="258445" release="12/07/2019">
                <shows>
                    <show time="2019-07-23T20:50:00" url="https://booking.cineworld.co.uk/booking/8029/137569" audioType="audio described"/>
                    <show time="2019-07-25T20:50:00" url="https://booking.cineworld.co.uk/booking/8029/137570" audioType="audio described"/>
                </shows>
            </film>
            <film title="(2D) The Lion King" rating="PG" url="films/the-lion-king" edi="229583" release="19/07/2019">
                <shows>
                    <show time="2019-07-22T10:00:00" url="https://booking.cineworld.co.uk/booking/8029/136744" audioType="audio described"/>
                    <show time="2019-07-22T10:20:00" url="https://booking.cineworld.co.uk/booking/8029/136810"/>
                    <show time="2019-07-22T11:00:00" url="https://booking.cineworld.co.uk/booking/8029/136696" audioType="audio described"/>
                    <show time="2019-07-22T11:30:00" url="https://booking.cineworld.co.uk/booking/8029/136720" audioType="audio described"/>
                    <show time="2019-07-22T12:30:00" url="https://booking.cineworld.co.uk/booking/8029/136799" audioType="audio described"/>
                    <show time="2019-07-22T13:00:00" url="https://booking.cineworld.co.uk/booking/8029/136745" audioType="audio described"/>
                    <show time="2019-07-22T13:20:00" url="https://booking.cineworld.co.uk/booking/8029/136811"/>
                    <show time="2019-07-22T14:00:00" url="https://booking.cineworld.co.uk/booking/8029/136697" audioType="audio described"/>
                    <show time="2019-07-22T14:30:00" url="https://booking.cineworld.co.uk/booking/8029/136721" audioType="audio described"/>
                    <show time="2019-07-22T15:30:00" url="https://booking.cineworld.co.uk/booking/8029/136800" audioType="audio described"/>
                    <show time="2019-07-22T16:00:00" url="https://booking.cineworld.co.uk/booking/8029/136746" audioType="audio described"/>
                    <show time="2019-07-22T17:00:00" url="https://booking.cineworld.co.uk/booking/8029/136698" audioType="audio described"/>
                    <show time="2019-07-22T17:30:00" url="https://booking.cineworld.co.uk/booking/8029/136722" audioType="audio described"/>
                    <show time="2019-07-22T18:30:00" url="https://booking.cineworld.co.uk/booking/8029/136801" audioType="audio described" subtitled="true"/>
                    <show time="2019-07-22T19:00:00" url="https://booking.cineworld.co.uk/booking/8029/136747" audioType="audio described"/>
                    <show time="2019-07-22T20:00:00" url="https://booking.cineworld.co.uk/booking/8029/136699" audioType="audio described"/>
                    <show time="2019-07-22T20:30:00" url="https://booking.cineworld.co.uk/booking/8029/136723" audioType="audio described"/>
                    <show time="2019-07-22T21:30:00" url="https://booking.cineworld.co.uk/booking/8029/137514" audioType="audio described"/>
                    <show time="2019-07-23T10:00:00" url="https://booking.cineworld.co.uk/booking/8029/136748" audioType="audio described"/>
                    <show time="2019-07-23T10:20:00" url="https://booking.cineworld.co.uk/booking/8029/136812"/>
                    <show time="2019-07-23T11:00:00" url="https://booking.cineworld.co.uk/booking/8029/136700" audioType="audio described"/>
                    <show time="2019-07-23T11:30:00" url="https://booking.cineworld.co.uk/booking/8029/136724" audioType="audio described"/>
                    <show time="2019-07-23T12:30:00" url="https://booking.cineworld.co.uk/booking/8029/136802" audioType="audio described"/>
                    <show time="2019-07-23T13:00:00" url="https://booking.cineworld.co.uk/booking/8029/136749" audioType="audio described"/>
                    <show time="2019-07-23T13:20:00" url="https://booking.cineworld.co.uk/booking/8029/136813"/>
                    <show time="2019-07-23T14:00:00" url="https://booking.cineworld.co.uk/booking/8029/136701" audioType="audio described"/>
                    <show time="2019-07-23T14:30:00" url="https://booking.cineworld.co.uk/booking/8029/136725" audioType="audio described"/>
                    <show time="2019-07-23T15:30:00" url="https://booking.cineworld.co.uk/booking/8029/136803" audioType="audio described"/>
                    <show time="2019-07-23T16:00:00" url="https://booking.cineworld.co.uk/booking/8029/136750" audioType="audio described"/>
                    <show time="2019-07-23T17:00:00" url="https://booking.cineworld.co.uk/booking/8029/136702" audioType="audio described"/>
                    <show time="2019-07-23T17:30:00" url="https://booking.cineworld.co.uk/booking/8029/136726" audioType="audio described"/>
                    <show time="2019-07-23T18:30:00" url="https://booking.cineworld.co.uk/booking/8029/136804" audioType="audio described"/>
                    <show time="2019-07-23T19:00:00" url="https://booking.cineworld.co.uk/booking/8029/136751" audioType="audio described"/>
                    <show time="2019-07-23T20:00:00" url="https://booking.cineworld.co.uk/booking/8029/136703" audioType="audio described"/>
                    <show time="2019-07-23T20:30:00" url="https://booking.cineworld.co.uk/booking/8029/136727" audioType="audio described"/>
                    <show time="2019-07-23T21:30:00" url="https://booking.cineworld.co.uk/booking/8029/137515" audioType="audio described"/>
                    <show time="2019-07-24T10:00:00" url="https://booking.cineworld.co.uk/booking/8029/136752" audioType="audio described"/>
                    <show time="2019-07-24T10:20:00" url="https://booking.cineworld.co.uk/booking/8029/136814"/>
                    <show time="2019-07-24T11:00:00" url="https://booking.cineworld.co.uk/booking/8029/136704" audioType="audio described"/>
                    <show time="2019-07-24T11:30:00" url="https://booking.cineworld.co.uk/booking/8029/136728" audioType="audio described"/>
                    <show time="2019-07-24T12:30:00" url="https://booking.cineworld.co.uk/booking/8029/136805" audioType="audio described"/>
                    <show time="2019-07-24T13:00:00" url="https://booking.cineworld.co.uk/booking/8029/136753" audioType="audio described"/>
                    <show time="2019-07-24T13:20:00" url="https://booking.cineworld.co.uk/booking/8029/136815"/>
                    <show time="2019-07-24T14:00:00" url="https://booking.cineworld.co.uk/booking/8029/136705" audioType="audio described"/>
                    <show time="2019-07-24T14:30:00" url="https://booking.cineworld.co.uk/booking/8029/136729" audioType="audio described"/>
                    <show time="2019-07-24T15:30:00" url="https://booking.cineworld.co.uk/booking/8029/136806" audioType="audio described"/>
                    <show time="2019-07-24T16:00:00" url="https://booking.cineworld.co.uk/booking/8029/136754" audioType="audio described"/>
                    <show time="2019-07-24T17:00:00" url="https://booking.cineworld.co.uk/booking/8029/136706" audioType="audio described"/>
                    <show time="2019-07-24T17:30:00" url="https://booking.cineworld.co.uk/booking/8029/136730" audioType="audio described"/>
                    <show time="2019-07-24T18:30:00" url="https://booking.cineworld.co.uk/booking/8029/136807" audioType="audio described"/>
                    <show time="2019-07-24T19:00:00" url="https://booking.cineworld.co.uk/booking/8029/136755" audioType="audio described"/>
                    <show time="2019-07-24T20:00:00" url="https://booking.cineworld.co.uk/booking/8029/136707" audioType="audio described"/>
                    <show time="2019-07-24T20:30:00" url="https://booking.cineworld.co.uk/booking/8029/136731" audioType="audio described"/>
                    <show time="2019-07-24T21:30:00" url="https://booking.cineworld.co.uk/booking/8029/137516" audioType="audio described"/>
                    <show time="2019-07-25T10:00:00" url="https://booking.cineworld.co.uk/booking/8029/137573" audioType="audio described"/>
                    <show time="2019-07-25T10:20:00" url="https://booking.cineworld.co.uk/booking/8029/137517" audioType="audio described"/>
                    <show time="2019-07-25T11:00:00" url="https://booking.cineworld.co.uk/booking/8029/137577" audioType="audio described"/>
                    <show time="2019-07-25T11:30:00" url="https://booking.cineworld.co.uk/booking/8029/137666" audioType="audio described"/>
                    <show time="2019-07-25T12:30:00" url="https://booking.cineworld.co.uk/booking/8029/137662"/>
                    <show time="2019-07-25T13:00:00" url="https://booking.cineworld.co.uk/booking/8029/137574" audioType="audio described"/>
                    <show time="2019-07-25T13:20:00" url="https://booking.cineworld.co.uk/booking/8029/137518" audioType="audio described"/>
                    <show time="2019-07-25T14:00:00" url="https://booking.cineworld.co.uk/booking/8029/137578" audioType="audio described"/>
                    <show time="2019-07-25T14:30:00" url="https://booking.cineworld.co.uk/booking/8029/137667" audioType="audio described"/>
                    <show time="2019-07-25T15:30:00" url="https://booking.cineworld.co.uk/booking/8029/137663"/>
                    <show time="2019-07-25T16:00:00" url="https://booking.cineworld.co.uk/booking/8029/137575" audioType="audio described"/>
                    <show time="2019-07-25T17:00:00" url="https://booking.cineworld.co.uk/booking/8029/137579" audioType="audio described"/>
                    <show time="2019-07-25T17:30:00" url="https://booking.cineworld.co.uk/booking/8029/137668" audioType="audio described"/>
                    <show time="2019-07-25T18:30:00" url="https://booking.cineworld.co.uk/booking/8029/137664"/>
                    <show time="2019-07-25T19:00:00" url="https://booking.cineworld.co.uk/booking/8029/137576" audioType="audio described"/>
                    <show time="2019-07-25T20:00:00" url="https://booking.cineworld.co.uk/booking/8029/137580" audioType="audio described"/>
                    <show time="2019-07-25T20:30:00" url="https://booking.cineworld.co.uk/booking/8029/137669" audioType="audio described"/>
                    <show time="2019-07-25T21:30:00" url="https://booking.cineworld.co.uk/booking/8029/137665"/>
                </shows>
            </film>
            <film title="(3D) The Lion King" rating="PG" url="films/the-lion-king" edi="229584" release="19/07/2019">
                <shows>
                    <show time="2019-07-22T10:40:00" url="https://booking.cineworld.co.uk/booking/8029/136768" videoType="3d" audioType="audio described"/>
                    <show time="2019-07-22T12:00:00" url="https://booking.cineworld.co.uk/booking/8029/136823" videoType="3d" audioType="audio described"/>
                    <show time="2019-07-22T13:40:00" url="https://booking.cineworld.co.uk/booking/8029/136769" videoType="3d" audioType="audio described"/>
                    <show time="2019-07-22T15:00:00" url="https://booking.cineworld.co.uk/booking/8029/136824" videoType="3d" audioType="audio described"/>
                    <show time="2019-07-22T16:30:00" url="https://booking.cineworld.co.uk/booking/8029/136770" videoType="3d" audioType="audio described"/>
                    <show time="2019-07-22T18:00:00" url="https://booking.cineworld.co.uk/booking/8029/136825" videoType="3d" audioType="audio described"/>
                    <show time="2019-07-22T19:30:00" url="https://booking.cineworld.co.uk/booking/8029/136771" videoType="3d" audioType="audio described"/>
                    <show time="2019-07-23T10:40:00" url="https://booking.cineworld.co.uk/booking/8029/136772" videoType="3d" audioType="audio described"/>
                    <show time="2019-07-23T12:00:00" url="https://booking.cineworld.co.uk/booking/8029/136826" videoType="3d" audioType="audio described"/>
                    <show time="2019-07-23T13:40:00" url="https://booking.cineworld.co.uk/booking/8029/136773" videoType="3d" audioType="audio described"/>
                    <show time="2019-07-23T15:00:00" url="https://booking.cineworld.co.uk/booking/8029/136827" videoType="3d" audioType="audio described"/>
                    <show time="2019-07-23T16:30:00" url="https://booking.cineworld.co.uk/booking/8029/136774" videoType="3d" audioType="audio described"/>
                    <show time="2019-07-23T18:00:00" url="https://booking.cineworld.co.uk/booking/8029/136828" videoType="3d" audioType="audio described"/>
                    <show time="2019-07-23T19:30:00" url="https://booking.cineworld.co.uk/booking/8029/136775" videoType="3d" audioType="audio described"/>
                    <show time="2019-07-24T10:40:00" url="https://booking.cineworld.co.uk/booking/8029/136776" videoType="3d" audioType="audio described"/>
                    <show time="2019-07-24T12:00:00" url="https://booking.cineworld.co.uk/booking/8029/136829" videoType="3d" audioType="audio described"/>
                    <show time="2019-07-24T13:40:00" url="https://booking.cineworld.co.uk/booking/8029/136777" videoType="3d" audioType="audio described"/>
                    <show time="2019-07-24T15:00:00" url="https://booking.cineworld.co.uk/booking/8029/136830" videoType="3d" audioType="audio described"/>
                    <show time="2019-07-24T16:30:00" url="https://booking.cineworld.co.uk/booking/8029/136778" videoType="3d" audioType="audio described"/>
                    <show time="2019-07-24T18:00:00" url="https://booking.cineworld.co.uk/booking/8029/136831" videoType="3d" audioType="audio described"/>
                    <show time="2019-07-24T19:30:00" url="https://booking.cineworld.co.uk/booking/8029/136779" videoType="3d" audioType="audio described"/>
                    <show time="2019-07-25T10:40:00" url="https://booking.cineworld.co.uk/booking/8029/137581" videoType="3d" audioType="audio described"/>
                    <show time="2019-07-25T12:00:00" url="https://booking.cineworld.co.uk/booking/8029/137560" videoType="3d" audioType="audio described"/>
                    <show time="2019-07-25T13:40:00" url="https://booking.cineworld.co.uk/booking/8029/137582" videoType="3d" audioType="audio described"/>
                    <show time="2019-07-25T15:00:00" url="https://booking.cineworld.co.uk/booking/8029/137561" videoType="3d" audioType="audio described"/>
                    <show time="2019-07-25T16:30:00" url="https://booking.cineworld.co.uk/booking/8029/137583" videoType="3d" audioType="audio described"/>
                    <show time="2019-07-25T18:00:00" url="https://booking.cineworld.co.uk/booking/8029/137562" videoType="3d" audioType="audio described"/>
                    <show time="2019-07-25T19:30:00" url="https://booking.cineworld.co.uk/booking/8029/137584" videoType="3d" audioType="audio described"/>
                </shows>
            </film>
            <film title="The Matrix : 20th Anniversary (4K Restoration)" rating="15" url="films/the-matrix-20th-anniversary-4k-restoration" edi="105580" release="13/07/2019">
                <shows>
                    <show time="2019-07-30T20:00:00" url="https://booking.cineworld.co.uk/booking/8029/137670" audioType="audio described"/>
                </shows>
            </film>
            <film title="The Queen's Corgi" rating="PG" url="films/the-queens-corgi" edi="245222" release="05/07/2019">
                <shows>
                    <show time="2019-07-22T10:50:00" url="https://booking.cineworld.co.uk/booking/8029/137509"/>
                    <show time="2019-07-23T10:50:00" url="https://booking.cineworld.co.uk/booking/8029/137510"/>
                    <show time="2019-07-24T10:50:00" url="https://booking.cineworld.co.uk/booking/8029/137511"/>
                    <show time="2019-07-25T10:50:00" url="https://booking.cineworld.co.uk/booking/8029/137512"/>
                </shows>
            </film>
            <film title="(2D) Toy Story 4" rating="U" url="films/toy-story-4" edi="148687" release="21/06/2019">
                <shows>
                    <show time="2019-07-22T10:40:00" url="https://booking.cineworld.co.uk/booking/8029/137537" audioType="audio described"/>
                    <show time="2019-07-22T12:10:00" url="https://booking.cineworld.co.uk/booking/8029/137625" audioType="audio described"/>
                    <show time="2019-07-22T13:10:00" url="https://booking.cineworld.co.uk/booking/8029/137538" audioType="audio described"/>
                    <show time="2019-07-22T14:40:00" url="https://booking.cineworld.co.uk/booking/8029/137626" audioType="audio described"/>
                    <show time="2019-07-22T15:40:00" url="https://booking.cineworld.co.uk/booking/8029/137539" audioType="audio described"/>
                    <show time="2019-07-22T17:10:00" url="https://booking.cineworld.co.uk/booking/8029/137627" audioType="audio described"/>
                    <show time="2019-07-22T18:10:00" url="https://booking.cineworld.co.uk/booking/8029/137540" audioType="audio described"/>
                    <show time="2019-07-22T19:50:00" url="https://booking.cineworld.co.uk/booking/8029/137628" audioType="audio described"/>
                    <show time="2019-07-23T10:40:00" url="https://booking.cineworld.co.uk/booking/8029/137541" audioType="audio described"/>
                    <show time="2019-07-23T12:10:00" url="https://booking.cineworld.co.uk/booking/8029/137629" audioType="audio described"/>
                    <show time="2019-07-23T13:10:00" url="https://booking.cineworld.co.uk/booking/8029/137542" audioType="audio described"/>
                    <show time="2019-07-23T14:40:00" url="https://booking.cineworld.co.uk/booking/8029/137630" audioType="audio described"/>
                    <show time="2019-07-23T15:40:00" url="https://booking.cineworld.co.uk/booking/8029/137543" audioType="audio described"/>
                    <show time="2019-07-23T17:10:00" url="https://booking.cineworld.co.uk/booking/8029/137631" audioType="audio described"/>
                    <show time="2019-07-23T18:10:00" url="https://booking.cineworld.co.uk/booking/8029/137544" audioType="audio described"/>
                    <show time="2019-07-23T19:50:00" url="https://booking.cineworld.co.uk/booking/8029/137632" audioType="audio described"/>
                    <show time="2019-07-24T10:40:00" url="https://booking.cineworld.co.uk/booking/8029/137545" audioType="audio described"/>
                    <show time="2019-07-24T12:10:00" url="https://booking.cineworld.co.uk/booking/8029/137633" audioType="audio described"/>
                    <show time="2019-07-24T13:10:00" url="https://booking.cineworld.co.uk/booking/8029/137546" audioType="audio described"/>
                    <show time="2019-07-24T14:40:00" url="https://booking.cineworld.co.uk/booking/8029/137634" audioType="audio described"/>
                    <show time="2019-07-24T15:40:00" url="https://booking.cineworld.co.uk/booking/8029/137547" audioType="audio described"/>
                    <show time="2019-07-24T17:10:00" url="https://booking.cineworld.co.uk/booking/8029/137635" audioType="audio described"/>
                    <show time="2019-07-24T18:10:00" url="https://booking.cineworld.co.uk/booking/8029/137548" audioType="audio described"/>
                    <show time="2019-07-24T19:50:00" url="https://booking.cineworld.co.uk/booking/8029/137636" audioType="audio described"/>
                    <show time="2019-07-25T10:40:00" url="https://booking.cineworld.co.uk/booking/8029/137549" audioType="audio described"/>
                    <show time="2019-07-25T12:10:00" url="https://booking.cineworld.co.uk/booking/8029/137637" audioType="audio described"/>
                    <show time="2019-07-25T13:10:00" url="https://booking.cineworld.co.uk/booking/8029/137550" audioType="audio described"/>
                    <show time="2019-07-25T14:40:00" url="https://booking.cineworld.co.uk/booking/8029/137638" audioType="audio described"/>
                    <show time="2019-07-25T15:40:00" url="https://booking.cineworld.co.uk/booking/8029/137551" audioType="audio described"/>
                    <show time="2019-07-25T17:10:00" url="https://booking.cineworld.co.uk/booking/8029/137639" audioType="audio described"/>
                    <show time="2019-07-25T18:10:00" url="https://booking.cineworld.co.uk/booking/8029/137552" audioType="audio described"/>
                    <show time="2019-07-25T19:50:00" url="https://booking.cineworld.co.uk/booking/8029/137640" audioType="audio described"/>
                </shows>
            </film>
            <film title="Wise Children" rating="15" url="films/wise-children" edi="273976" release="03/10/2019">
                <shows>
                    <show time="2019-10-03T14:00:00" url="https://booking.cineworld.co.uk/booking/8029/134822"/>
                    <show time="2019-10-03T19:30:00" url="https://booking.cineworld.co.uk/booking/8029/134823"/>
                </shows>
            </film>
            <film title="Yesterday" rating="12A" url="films/yesterday" edi="253917" release="28/06/2019">
                <shows>
                    <show time="2019-07-22T16:20:00" url="https://booking.cineworld.co.uk/booking/8029/137658"/>
                    <show time="2019-07-22T20:40:00" url="https://booking.cineworld.co.uk/booking/8029/137556" audioType="audio described"/>
                    <show time="2019-07-23T16:20:00" url="https://booking.cineworld.co.uk/booking/8029/137659"/>
                    <show time="2019-07-23T20:40:00" url="https://booking.cineworld.co.uk/booking/8029/137557" audioType="audio described"/>
                    <show time="2019-07-24T16:20:00" url="https://booking.cineworld.co.uk/booking/8029/137660"/>
                    <show time="2019-07-24T20:40:00" url="https://booking.cineworld.co.uk/booking/8029/137558" audioType="audio described"/>
                    <show time="2019-07-25T16:20:00" url="https://booking.cineworld.co.uk/booking/8029/137524" audioType="audio described"/>
                    <show time="2019-07-25T20:40:00" url="https://booking.cineworld.co.uk/booking/8029/137559" audioType="audio described"/>
                </shows>
            </film>
        </listing>
    </cinema>
    <cinema name="Cineworld Bolton" root="http://www1.cineworld.co.uk/" url="cinemas/bolton" id="72" phone="0871 200 2000" address="The Valley, 15 Eagley Brook Way, Bolton" postcode="BL1 8TS">
        <listing>
            <film title="M4J A Dog's Journey" rating="PG" url="films/a-dogs-journey-movies-for-juniors" edi="801922" release="28/06/2019">
                <shows>
                    <show time="2019-07-22T10:30:00" url="https://booking.cineworld.co.uk/booking/8023/171770" audioType="audio described"/>
                    <show time="2019-07-23T10:30:00" url="https://booking.cineworld.co.uk/booking/8023/171771" audioType="audio described"/>
                    <show time="2019-07-24T10:30:00" url="https://booking.cineworld.co.uk/booking/8023/171772" audioType="audio described"/>
                    <show time="2019-07-25T10:30:00" url="https://booking.cineworld.co.uk/booking/8023/171773" audioType="audio described"/>
                </shows>
            </film>
            <film title="(2D) Aladdin" rating="PG" url="films/aladdin" edi="205737" release="24/05/2019">
                <shows>
                    <show time="2019-07-22T10:00:00" url="https://booking.cineworld.co.uk/booking/8023/171510" audioType="audio described"/>
                    <show time="2019-07-22T13:10:00" url="https://booking.cineworld.co.uk/booking/8023/171763" audioType="audio described"/>
                    <show time="2019-07-22T16:10:00" url="https://booking.cineworld.co.uk/booking/8023/171750" audioType="audio described"/>
                    <show time="2019-07-22T19:10:00" url="https://booking.cineworld.co.uk/booking/8023/171751" audioType="audio described"/>
                    <show time="2019-07-23T10:00:00" url="https://booking.cineworld.co.uk/booking/8023/171511" audioType="audio described"/>
                    <show time="2019-07-23T13:10:00" url="https://booking.cineworld.co.uk/booking/8023/171764" audioType="audio described"/>
                    <show time="2019-07-23T16:10:00" url="https://booking.cineworld.co.uk/booking/8023/171752" audioType="audio described"/>
                    <show time="2019-07-23T19:10:00" url="https://booking.cineworld.co.uk/booking/8023/171753" audioType="audio described"/>
                    <show time="2019-07-24T10:00:00" url="https://booking.cineworld.co.uk/booking/8023/171512" audioType="audio described"/>
                    <show time="2019-07-24T13:10:00" url="https://booking.cineworld.co.uk/booking/8023/171765" audioType="audio described"/>
                    <show time="2019-07-24T16:10:00" url="https://booking.cineworld.co.uk/booking/8023/171754" audioType="audio described"/>
                    <show time="2019-07-24T19:10:00" url="https://booking.cineworld.co.uk/booking/8023/171755" audioType="audio described"/>
                    <show time="2019-07-25T10:00:00" url="https://booking.cineworld.co.uk/booking/8023/171513" audioType="audio described"/>
                    <show time="2019-07-25T13:10:00" url="https://booking.cineworld.co.uk/booking/8023/171766" audioType="audio described"/>
                    <show time="2019-07-25T16:10:00" url="https://booking.cineworld.co.uk/booking/8023/171758" audioType="audio described"/>
                    <show time="2019-07-25T19:10:00" url="https://booking.cineworld.co.uk/booking/8023/171759" audioType="audio described"/>
                </shows>
            </film>
            <film title="Andre Rieu 2019 Maastricht Concert Shall We Dance?" rating="PG" url="films/andre-rieu-2019-maastricht-concert-shall-we-dance" edi="255443" release="27/07/2019">
                <shows>
                    <show time="2019-07-27T19:00:00" url="https://booking.cineworld.co.uk/booking/8023/162012"/>
                    <show time="2019-07-28T15:00:00" url="https://booking.cineworld.co.uk/booking/8023/162013"/>
                </shows>
            </film>
            <film title="Annabelle Comes Home" rating="15" url="films/annabelle-comes-home" edi="250924" release="10/07/2019">
                <shows>
                    <show time="2019-07-22T13:00:00" url="https://booking.cineworld.co.uk/booking/8023/171526" audioType="audio described"/>
                    <show time="2019-07-22T15:40:00" url="https://booking.cineworld.co.uk/booking/8023/171527" audioType="audio described"/>
                    <show time="2019-07-22T18:20:00" url="https://booking.cineworld.co.uk/booking/8023/171528" audioType="audio described"/>
                    <show time="2019-07-22T21:00:00" url="https://booking.cineworld.co.uk/booking/8023/171529" audioType="audio described"/>
                    <show time="2019-07-23T13:00:00" url="https://booking.cineworld.co.uk/booking/8023/171530" audioType="audio described"/>
                    <show time="2019-07-23T15:40:00" url="https://booking.cineworld.co.uk/booking/8023/171531" audioType="audio described"/>
                    <show time="2019-07-23T18:20:00" url="https://booking.cineworld.co.uk/booking/8023/171532" audioType="audio described"/>
                    <show time="2019-07-23T21:00:00" url="https://booking.cineworld.co.uk/booking/8023/171533" audioType="audio described"/>
                    <show time="2019-07-24T13:00:00" url="https://booking.cineworld.co.uk/booking/8023/171534" audioType="audio described"/>
                    <show time="2019-07-24T15:40:00" url="https://booking.cineworld.co.uk/booking/8023/171535" audioType="audio described"/>
                    <show time="2019-07-24T18:20:00" url="https://booking.cineworld.co.uk/booking/8023/171536" audioType="audio described"/>
                    <show time="2019-07-24T21:00:00" url="https://booking.cineworld.co.uk/booking/8023/171537" audioType="audio described"/>
                    <show time="2019-07-25T13:00:00" url="https://booking.cineworld.co.uk/booking/8023/171538" audioType="audio described"/>
                    <show time="2019-07-25T15:40:00" url="https://booking.cineworld.co.uk/booking/8023/171539" audioType="audio described"/>
                    <show time="2019-07-25T18:20:00" url="https://booking.cineworld.co.uk/booking/8023/171540" audioType="audio described"/>
                    <show time="2019-07-25T21:00:00" url="https://booking.cineworld.co.uk/booking/8023/171541" audioType="audio described"/>
                </shows>
            </film>
            <film title="Apocalypse Now - The Final Cut + Q&amp;A" rating="15" url="films/apocalypse-now-the-final-cut-qa" edi="801886" release="13/08/2019">
                <shows>
                    <show time="2019-08-13T19:30:00" url="https://booking.cineworld.co.uk/booking/8023/168705"/>
                </shows>
            </film>
            <film title="Billy Connolly: The Sex Life of Bandages" rating="18" url="films/billy-connolly-the-sex-life-of-bandages" edi="276418" release="10/10/2019">
                <shows>
                    <show time="2019-10-10T20:00:00" url="https://booking.cineworld.co.uk/booking/8023/171826"/>
                </shows>
            </film>
            <film title="Bolshoi Ballet 2019 : Le Corsaire" rating="12A" url="films/bolshoi-ballet-2019-le-corsaire" edi="276116" release="17/11/2019">
                <shows>
                    <show time="2019-11-17T15:00:00" url="https://booking.cineworld.co.uk/booking/8023/168193"/>
                </shows>
            </film>
            <film title="Bolshoi Ballet 2019 : Raymonda" rating="12A" url="films/bolshoi-ballet-2019-raymonda" edi="276119" release="27/10/2019">
                <shows>
                    <show time="2019-10-27T15:00:00" url="https://booking.cineworld.co.uk/booking/8023/168192"/>
                </shows>
            </film>
            <film title="Bolshoi Ballet 2019 : The Nutcracker" rating="12A" url="films/bolshoi-ballet-2019-the-nutcracker" edi="276117" release="15/12/2019">
                <shows>
                    <show time="2019-12-15T15:00:00" url="https://booking.cineworld.co.uk/booking/8023/168194"/>
                </shows>
            </film>
            <film title="Bring The Soul: The Movie" rating="PG" url="films/bring-the-soul-the-movie" edi="281205" release="07/08/2019">
                <shows>
                    <show time="2019-08-07T19:30:00" url="https://booking.cineworld.co.uk/booking/8023/171106"/>
                    <show time="2019-08-11T14:00:00" url="https://booking.cineworld.co.uk/booking/8023/171107"/>
                </shows>
            </film>
            <film title="Dracula - Northern Ballet Live" rating="12A" url="films/dracula-northern-ballet-live" edi="270199" release="31/10/2019">
                <shows>
                    <show time="2019-10-31T19:15:00" url="https://booking.cineworld.co.uk/booking/8023/162011"/>
                </shows>
            </film>
            <film title="ENO Screen : The Mikado Encore (2015)" rating="PG" url="films/eno-screen-the-mikado-encore-2015" edi="187300" release="19/08/2019">
                <shows>
                    <show time="2019-08-19T19:00:00" url="https://booking.cineworld.co.uk/booking/8023/168200"/>
                </shows>
            </film>
            <film title="Fast &amp; Furious: Hobbs &amp; Shaw" rating="TBC" url="films/fast-furious-hobbs-shaw" edi="240260" release="02/08/2019">
                <shows>
                    <show time="2019-08-01T20:30:00" url="https://booking.cineworld.co.uk/booking/8023/169198" audioType="audio described"/>
                    <show time="2019-08-02T20:30:00" url="https://booking.cineworld.co.uk/booking/8023/169199" audioType="audio described"/>
                    <show time="2019-08-03T20:30:00" url="https://booking.cineworld.co.uk/booking/8023/169200" audioType="audio described"/>
                    <show time="2019-08-04T20:30:00" url="https://booking.cineworld.co.uk/booking/8023/169201" audioType="audio described"/>
                </shows>
            </film>
            <film title="Glyndebourne 2019: The Magic Flute (Die t" rating="12A" url="films/glyndebourne-2019-the-magic-flute-die-zauberflote-live" edi="273310" release="04/08/2019">
                <shows>
                    <show time="2019-08-04T17:30:00" url="https://booking.cineworld.co.uk/booking/8023/164872"/>
                </shows>
            </film>
            <film title="Margaret Atwood : Live In Cinemas" rating="12A" url="films/margaret-atwood-live-in-cinemas" edi="272858" release="10/09/2019">
                <shows>
                    <show time="2019-09-10T19:30:00" url="https://booking.cineworld.co.uk/booking/8023/164500"/>
                </shows>
            </film>
            <film title="Met Opera 2019-20: Akhnaten" rating="TBC" url="films/met-opera-2019-20-akhnaten" edi="274678" release="23/11/2019">
                <shows>
                    <show time="2019-11-23T17:55:00" url="https://booking.cineworld.co.uk/booking/8023/171491"/>
                </shows>
            </film>
            <film title="MET Opera 2019-20: Madama Butterfly" rating="TBC" url="films/met-opera-2019-20-madama-butterfly" edi="274682" release="09/11/2019">
                <shows>
                    <show time="2019-11-09T17:55:00" url="https://booking.cineworld.co.uk/booking/8023/171490"/>
                </shows>
            </film>
            <film title="MET Opera 2019-20: Manon" rating="TBC" url="films/met-opera-2019-20-manon" edi="274680" release="26/10/2019">
                <shows>
                    <show time="2019-10-26T17:55:00" url="https://booking.cineworld.co.uk/booking/8023/171489"/>
                </shows>
            </film>
            <film title="MET Opera 2019-20: Turandot" rating="TBC" url="films/met-opera-2019-20-turandot" edi="274672" release="12/10/2019">
                <shows>
                    <show time="2019-10-12T17:55:00" url="https://booking.cineworld.co.uk/booking/8023/171488"/>
                </shows>
            </film>
            <film title="Midsommar" rating="18" url="films/midsommar" edi="265995" release="05/07/2019">
                <shows>
                    <show time="2019-07-22T14:20:00" url="https://booking.cineworld.co.uk/booking/8023/171585" audioType="audio described"/>
                    <show time="2019-07-22T20:10:00" url="https://booking.cineworld.co.uk/booking/8023/171586" audioType="audio described"/>
                    <show time="2019-07-23T14:20:00" url="https://booking.cineworld.co.uk/booking/8023/171590" audioType="audio described"/>
                    <show time="2019-07-23T20:10:00" url="https://booking.cineworld.co.uk/booking/8023/171591" audioType="audio described"/>
                    <show time="2019-07-24T14:20:00" url="https://booking.cineworld.co.uk/booking/8023/171595" audioType="audio described"/>
                    <show time="2019-07-24T20:10:00" url="https://booking.cineworld.co.uk/booking/8023/171596" audioType="audio described"/>
                    <show time="2019-07-25T14:20:00" url="https://booking.cineworld.co.uk/booking/8023/171600" audioType="audio described"/>
                    <show time="2019-07-25T20:10:00" url="https://booking.cineworld.co.uk/booking/8023/171601" audioType="audio described"/>
                </shows>
            </film>
            <film title="NT Live: A Midsummer Night's Dream" rating="12A" url="films/nt-live-a-midsummer-nights-dream" edi="274950" release="17/10/2019">
                <shows>
                    <show time="2019-10-17T19:00:00" url="https://booking.cineworld.co.uk/booking/8023/169569"/>
                </shows>
            </film>
            <film title="NT Live: Hansard" rating="15" url="films/nt-live-hansard" edi="270878" release="07/11/2019">
                <shows>
                    <show time="2019-11-07T19:00:00" url="https://booking.cineworld.co.uk/booking/8023/169570"/>
                </shows>
            </film>
            <film title="NT Live : One Man, Two Guvnors (Encore)" rating="12A" url="films/nt-live-one-man-two-guvnors-encore" edi="266343" release="26/09/2019">
                <shows>
                    <show time="2019-09-26T19:00:00" url="https://booking.cineworld.co.uk/booking/8023/166363"/>
                </shows>
            </film>
            <film title="NT Live: Present Laughter" rating="12A" url="films/nt-live-present-laughter" edi="278033" release="28/11/2019">
                <shows>
                    <show time="2019-11-28T19:00:00" url="https://booking.cineworld.co.uk/booking/8023/169571"/>
                </shows>
            </film>
            <film title="NT Live : The Lehman Trilogy" rating="12A" url="films/nt-live-the-lehman-trilogy" edi="266345" release="25/07/2019">
                <shows>
                    <show time="2019-07-25T19:00:00" url="https://booking.cineworld.co.uk/booking/8023/166362"/>
                </shows>
            </film>
            <film title="M4J Paw Patrol: Mighty Pups - The Movie" rating="U" url="films/paw-patrol-mighty-pups-movies-for-juniors" edi="801924" release="19/07/2019">
                <shows>
                    <show time="2019-07-22T10:10:00" url="https://booking.cineworld.co.uk/booking/8023/171731" audioType="audio described"/>
                    <show time="2019-07-23T10:10:00" url="https://booking.cineworld.co.uk/booking/8023/171732" audioType="audio described"/>
                    <show time="2019-07-24T10:10:00" url="https://booking.cineworld.co.uk/booking/8023/171733" audioType="audio described"/>
                    <show time="2019-07-25T10:10:00" url="https://booking.cineworld.co.uk/booking/8023/171734" audioType="audio described"/>
                </shows>
            </film>
            <film title="Placido Domingo 50th Anniversary Concert" rating="TBC" url="films/placido-domingo-50th-anniversary-concert" edi="270187" release="01/10/2019">
                <shows>
                    <show time="2019-10-01T19:00:00" url="https://booking.cineworld.co.uk/booking/8023/170261"/>
                </shows>
            </film>
            <film title="M4J Ralph Breaks The Internet: Wreck It Ralph 2" rating="PG" url="films/ralph-breaks-the-internet-wreck-it-ralph-2-movies-for-juniors" edi="801742" release="01/03/2019">
                <shows>
                    <show time="2019-07-22T10:00:00" url="https://booking.cineworld.co.uk/booking/8023/171665" audioType="audio described"/>
                    <show time="2019-07-23T10:00:00" url="https://booking.cineworld.co.uk/booking/8023/171666" audioType="audio described"/>
                    <show time="2019-07-24T10:00:00" url="https://booking.cineworld.co.uk/booking/8023/171667" audioType="audio described"/>
                    <show time="2019-07-25T10:00:00" url="https://booking.cineworld.co.uk/booking/8023/171668" audioType="audio described"/>
                </shows>
            </film>
            <film title="Rigoletto On The Lake" rating="TBC" url="films/rigoletto-on-the-lake" edi="270196" release="17/09/2019">
                <shows>
                    <show time="2019-09-17T19:00:00" url="https://booking.cineworld.co.uk/booking/8023/170260"/>
                </shows>
            </film>
            <film title="Rocketman : Sing-Along Version" rating="15" url="films/rocketman-sing-along-version" edi="263136" release="26/07/2019">
                <shows>
                    <show time="2019-07-26T19:30:00" url="https://booking.cineworld.co.uk/booking/8023/171505" audioType="audio described" subtitled="true"/>
                </shows>
            </film>
            <film title="ROH Live Opera 2019 : Don Giovanni" rating="TBC" url="films/roh-live-opera-2019-don-giovanni" edi="274395" release="08/10/2019">
                <shows>
                    <show time="2019-10-08T18:45:00" url="https://booking.cineworld.co.uk/booking/8023/169149"/>
                </shows>
            </film>
            <film title="ROH Live Opera 2019 : Don Pasquale" rating="TBC" url="films/roh-live-opera-2019-don-pasquale" edi="274401" release="24/10/2019">
                <shows>
                    <show time="2019-10-24T19:30:00" url="https://booking.cineworld.co.uk/booking/8023/169150"/>
                </shows>
            </film>
            <film title="ROH Royal Ballet Live 2019 : Coppelia" rating="TBC" url="films/roh-royal-ballet-live-2019-coppelia" edi="274396" release="10/12/2019">
                <shows>
                    <show time="2019-12-10T19:15:00" url="https://booking.cineworld.co.uk/booking/8023/169152"/>
                </shows>
            </film>
            <film title="ROH Royal Ballet Live 2019 : Triple Bill" rating="TBC" url="films/roh-royal-ballet-live-2019-triple-bill" edi="274399" release="05/11/2019">
                <shows>
                    <show time="2019-11-05T19:15:00" url="https://booking.cineworld.co.uk/booking/8023/169151"/>
                </shows>
            </film>
            <film title="ROH Royal Ballet: The Nutckracker (2016 Recorded)" rating="TBC" url="films/roh-royal-ballet-the-nutckracker-2016-recorded" edi="277630" release="17/12/2019">
                <shows>
                    <show time="2019-12-17T19:15:00" url="https://booking.cineworld.co.uk/booking/8023/169161"/>
                </shows>
            </film>
            <film title="RSC Live : Measure For Measure" rating="12A" url="films/rsc-live-measure-for-measure" edi="263087" release="31/07/2019">
                <shows>
                    <show time="2019-07-31T19:00:00" url="https://booking.cineworld.co.uk/booking/8023/156384"/>
                </shows>
            </film>
            <film title="Secret Unlimited Screening 12" rating="15" url="films/secret-unlimited-screening-12" edi="801942" release="29/07/2019">
                <shows>
                    <show time="2019-07-29T20:00:00" url="https://booking.cineworld.co.uk/booking/8023/171104" audioType="audio described"/>
                </shows>
            </film>
            <film title="(2D) Spider-Man: Far From Home" rating="12A" url="films/spider-man-far-from-home" edi="221205" release="02/07/2019">
                <shows>
                    <show time="2019-07-22T10:15:00" url="https://booking.cineworld.co.uk/booking/8023/171710" audioType="audio described"/>
                    <show time="2019-07-22T11:45:00" url="https://booking.cineworld.co.uk/booking/8023/171681" audioType="audio described"/>
                    <show time="2019-07-22T13:15:00" url="https://booking.cineworld.co.uk/booking/8023/171711" audioType="audio described"/>
                    <show time="2019-07-22T14:45:00" url="https://booking.cineworld.co.uk/booking/8023/171682" audioType="audio described"/>
                    <show time="2019-07-22T16:15:00" url="https://booking.cineworld.co.uk/booking/8023/171712" audioType="audio described"/>
                    <show time="2019-07-22T17:45:00" url="https://booking.cineworld.co.uk/booking/8023/171683" audioType="audio described"/>
                    <show time="2019-07-22T19:15:00" url="https://booking.cineworld.co.uk/booking/8023/171713" audioType="audio described"/>
                    <show time="2019-07-22T20:45:00" url="https://booking.cineworld.co.uk/booking/8023/171684" audioType="audio described"/>
                    <show time="2019-07-23T10:15:00" url="https://booking.cineworld.co.uk/booking/8023/171714" audioType="audio described"/>
                    <show time="2019-07-23T11:45:00" url="https://booking.cineworld.co.uk/booking/8023/171685" audioType="audio described"/>
                    <show time="2019-07-23T13:15:00" url="https://booking.cineworld.co.uk/booking/8023/171715" audioType="audio described"/>
                    <show time="2019-07-23T14:45:00" url="https://booking.cineworld.co.uk/booking/8023/171686" audioType="audio described"/>
                    <show time="2019-07-23T16:15:00" url="https://booking.cineworld.co.uk/booking/8023/171716" audioType="audio described"/>
                    <show time="2019-07-23T17:45:00" url="https://booking.cineworld.co.uk/booking/8023/171687" audioType="audio described"/>
                    <show time="2019-07-23T19:15:00" url="https://booking.cineworld.co.uk/booking/8023/171717" audioType="audio described"/>
                    <show time="2019-07-23T20:45:00" url="https://booking.cineworld.co.uk/booking/8023/171688" audioType="audio described"/>
                    <show time="2019-07-24T10:15:00" url="https://booking.cineworld.co.uk/booking/8023/171718" audioType="audio described"/>
                    <show time="2019-07-24T11:45:00" url="https://booking.cineworld.co.uk/booking/8023/171689" audioType="audio described"/>
                    <show time="2019-07-24T13:15:00" url="https://booking.cineworld.co.uk/booking/8023/171719" audioType="audio described"/>
                    <show time="2019-07-24T14:45:00" url="https://booking.cineworld.co.uk/booking/8023/171690" audioType="audio described"/>
                    <show time="2019-07-24T16:15:00" url="https://booking.cineworld.co.uk/booking/8023/171720" audioType="audio described"/>
                    <show time="2019-07-24T17:45:00" url="https://booking.cineworld.co.uk/booking/8023/171691" audioType="audio described"/>
                    <show time="2019-07-24T19:15:00" url="https://booking.cineworld.co.uk/booking/8023/171721" audioType="audio described"/>
                    <show time="2019-07-24T20:45:00" url="https://booking.cineworld.co.uk/booking/8023/171692" audioType="audio described"/>
                    <show time="2019-07-25T10:15:00" url="https://booking.cineworld.co.uk/booking/8023/171722" audioType="audio described"/>
                    <show time="2019-07-25T11:45:00" url="https://booking.cineworld.co.uk/booking/8023/171693" audioType="audio described"/>
                    <show time="2019-07-25T13:15:00" url="https://booking.cineworld.co.uk/booking/8023/171723" audioType="audio described"/>
                    <show time="2019-07-25T14:45:00" url="https://booking.cineworld.co.uk/booking/8023/171694" audioType="audio described"/>
                    <show time="2019-07-25T16:15:00" url="https://booking.cineworld.co.uk/booking/8023/171724" audioType="audio described"/>
                    <show time="2019-07-25T17:45:00" url="https://booking.cineworld.co.uk/booking/8023/171695" audioType="audio described"/>
                    <show time="2019-07-25T19:15:00" url="https://booking.cineworld.co.uk/booking/8023/171725" audioType="audio described"/>
                    <show time="2019-07-25T20:45:00" url="https://booking.cineworld.co.uk/booking/8023/171696" audioType="audio described"/>
                </shows>
            </film>
            <film title="Stuber" rating="15" url="films/stuber" edi="258445" release="12/07/2019">
                <shows>
                    <show time="2019-07-22T16:20:00" url="https://booking.cineworld.co.uk/booking/8023/171780" audioType="audio described"/>
                    <show time="2019-07-22T18:40:00" url="https://booking.cineworld.co.uk/booking/8023/171781" audioType="audio described"/>
                    <show time="2019-07-22T20:50:00" url="https://booking.cineworld.co.uk/booking/8023/171738" audioType="audio described"/>
                    <show time="2019-07-23T16:20:00" url="https://booking.cineworld.co.uk/booking/8023/171782" audioType="audio described"/>
                    <show time="2019-07-23T18:40:00" url="https://booking.cineworld.co.uk/booking/8023/171783" audioType="audio described"/>
                    <show time="2019-07-23T20:50:00" url="https://booking.cineworld.co.uk/booking/8023/171739" audioType="audio described"/>
                    <show time="2019-07-24T16:20:00" url="https://booking.cineworld.co.uk/booking/8023/171784" audioType="audio described"/>
                    <show time="2019-07-24T18:40:00" url="https://booking.cineworld.co.uk/booking/8023/171785" audioType="audio described"/>
                    <show time="2019-07-24T20:50:00" url="https://booking.cineworld.co.uk/booking/8023/171740" audioType="audio described"/>
                    <show time="2019-07-25T16:20:00" url="https://booking.cineworld.co.uk/booking/8023/171786" audioType="audio described"/>
                    <show time="2019-07-25T18:40:00" url="https://booking.cineworld.co.uk/booking/8023/171787" audioType="audio described"/>
                    <show time="2019-07-25T20:50:00" url="https://booking.cineworld.co.uk/booking/8023/171741" audioType="audio described"/>
                </shows>
            </film>
            <film title="The Dead Don't Die" rating="15" url="films/the-dead-dont-die" edi="276105" release="12/07/2019">
                <shows>
                    <show time="2019-07-22T17:40:00" url="https://booking.cineworld.co.uk/booking/8023/171587" audioType="audio described"/>
                    <show time="2019-07-22T21:10:00" url="https://booking.cineworld.co.uk/booking/8023/171791" audioType="audio described"/>
                    <show time="2019-07-23T17:40:00" url="https://booking.cineworld.co.uk/booking/8023/171592" audioType="audio described" subtitled="true"/>
                    <show time="2019-07-23T21:10:00" url="https://booking.cineworld.co.uk/booking/8023/171792" audioType="audio described"/>
                    <show time="2019-07-24T17:40:00" url="https://booking.cineworld.co.uk/booking/8023/171597" audioType="audio described"/>
                    <show time="2019-07-24T21:10:00" url="https://booking.cineworld.co.uk/booking/8023/171793" audioType="audio described"/>
                    <show time="2019-07-25T17:40:00" url="https://booking.cineworld.co.uk/booking/8023/171602" audioType="audio described"/>
                    <show time="2019-07-25T21:10:00" url="https://booking.cineworld.co.uk/booking/8023/171794" audioType="audio described"/>
                </shows>
            </film>
            <film title="(2D) The Lion King" rating="PG" url="films/the-lion-king" edi="229583" release="19/07/2019">
                <shows>
                    <show time="2019-07-22T10:00:00" url="https://booking.cineworld.co.uk/booking/8023/170670" audioType="audio described"/>
                    <show time="2019-07-22T10:20:00" url="https://booking.cineworld.co.uk/booking/8023/170739" audioType="audio described"/>
                    <show time="2019-07-22T11:00:00" url="https://booking.cineworld.co.uk/booking/8023/170674" audioType="audio described"/>
                    <show time="2019-07-22T11:10:00" url="https://booking.cineworld.co.uk/booking/8023/171823" audioType="audio described"/>
                    <show time="2019-07-22T11:30:00" url="https://booking.cineworld.co.uk/booking/8023/170678" audioType="audio described"/>
                    <show time="2019-07-22T12:30:00" url="https://booking.cineworld.co.uk/booking/8023/170682" audioType="audio described"/>
                    <show time="2019-07-22T13:00:00" url="https://booking.cineworld.co.uk/booking/8023/170671" audioType="audio described"/>
                    <show time="2019-07-22T13:20:00" url="https://booking.cineworld.co.uk/booking/8023/170741" audioType="audio described"/>
                    <show time="2019-07-22T14:00:00" url="https://booking.cineworld.co.uk/booking/8023/170675" audioType="audio described"/>
                    <show time="2019-07-22T14:30:00" url="https://booking.cineworld.co.uk/booking/8023/170679" audioType="audio described"/>
                    <show time="2019-07-22T15:30:00" url="https://booking.cineworld.co.uk/booking/8023/170683" audioType="audio described"/>
                    <show time="2019-07-22T16:00:00" url="https://booking.cineworld.co.uk/booking/8023/170672" audioType="audio described"/>
                    <show time="2019-07-22T17:00:00" url="https://booking.cineworld.co.uk/booking/8023/170676" audioType="audio described"/>
                    <show time="2019-07-22T17:30:00" url="https://booking.cineworld.co.uk/booking/8023/170680" audioType="audio described"/>
                    <show time="2019-07-22T18:30:00" url="https://booking.cineworld.co.uk/booking/8023/170684" audioType="audio described" subtitled="true"/>
                    <show time="2019-07-22T19:00:00" url="https://booking.cineworld.co.uk/booking/8023/170673" audioType="audio described"/>
                    <show time="2019-07-22T20:00:00" url="https://booking.cineworld.co.uk/booking/8023/170677" audioType="audio described"/>
                    <show time="2019-07-22T20:30:00" url="https://booking.cineworld.co.uk/booking/8023/170681" audioType="audio described"/>
                    <show time="2019-07-22T21:30:00" url="https://booking.cineworld.co.uk/booking/8023/171661" audioType="audio described"/>
                    <show time="2019-07-23T10:00:00" url="https://booking.cineworld.co.uk/booking/8023/170688" audioType="audio described"/>
                    <show time="2019-07-23T10:20:00" url="https://booking.cineworld.co.uk/booking/8023/170737" audioType="audio described"/>
                    <show time="2019-07-23T11:00:00" url="https://booking.cineworld.co.uk/booking/8023/170690" audioType="audio described"/>
                    <show time="2019-07-23T11:30:00" url="https://booking.cineworld.co.uk/booking/8023/170691" audioType="audio described"/>
                    <show time="2019-07-23T12:30:00" url="https://booking.cineworld.co.uk/booking/8023/170693" audioType="audio described"/>
                    <show time="2019-07-23T13:00:00" url="https://booking.cineworld.co.uk/booking/8023/170694" audioType="audio described"/>
                    <show time="2019-07-23T13:20:00" url="https://booking.cineworld.co.uk/booking/8023/170738" audioType="audio described"/>
                    <show time="2019-07-23T14:00:00" url="https://booking.cineworld.co.uk/booking/8023/170696" audioType="audio described"/>
                    <show time="2019-07-23T14:30:00" url="https://booking.cineworld.co.uk/booking/8023/170697" audioType="audio described"/>
                    <show time="2019-07-23T15:30:00" url="https://booking.cineworld.co.uk/booking/8023/170699" audioType="audio described"/>
                    <show time="2019-07-23T16:00:00" url="https://booking.cineworld.co.uk/booking/8023/170700" audioType="audio described"/>
                    <show time="2019-07-23T17:00:00" url="https://booking.cineworld.co.uk/booking/8023/170702" audioType="audio described"/>
                    <show time="2019-07-23T17:30:00" url="https://booking.cineworld.co.uk/booking/8023/170703" audioType="audio described"/>
                    <show time="2019-07-23T18:30:00" url="https://booking.cineworld.co.uk/booking/8023/170705" audioType="audio described"/>
                    <show time="2019-07-23T19:00:00" url="https://booking.cineworld.co.uk/booking/8023/170706" audioType="audio described"/>
                    <show time="2019-07-23T20:00:00" url="https://booking.cineworld.co.uk/booking/8023/170708" audioType="audio described"/>
                    <show time="2019-07-23T20:30:00" url="https://booking.cineworld.co.uk/booking/8023/170709" audioType="audio described"/>
                    <show time="2019-07-23T21:30:00" url="https://booking.cineworld.co.uk/booking/8023/171659" audioType="audio described"/>
                    <show time="2019-07-24T10:00:00" url="https://booking.cineworld.co.uk/booking/8023/170710" audioType="audio described"/>
                    <show time="2019-07-24T10:20:00" url="https://booking.cineworld.co.uk/booking/8023/170732" audioType="audio described"/>
                    <show time="2019-07-24T11:00:00" url="https://booking.cineworld.co.uk/booking/8023/170712" audioType="audio described"/>
                    <show time="2019-07-24T11:30:00" url="https://booking.cineworld.co.uk/booking/8023/170713" audioType="audio described"/>
                    <show time="2019-07-24T12:30:00" url="https://booking.cineworld.co.uk/booking/8023/170715" audioType="audio described"/>
                    <show time="2019-07-24T13:00:00" url="https://booking.cineworld.co.uk/booking/8023/170716" audioType="audio described"/>
                    <show time="2019-07-24T13:20:00" url="https://booking.cineworld.co.uk/booking/8023/170733" audioType="audio described"/>
                    <show time="2019-07-24T14:00:00" url="https://booking.cineworld.co.uk/booking/8023/170718" audioType="audio described"/>
                    <show time="2019-07-24T14:30:00" url="https://booking.cineworld.co.uk/booking/8023/170719" audioType="audio described"/>
                    <show time="2019-07-24T15:30:00" url="https://booking.cineworld.co.uk/booking/8023/170721" audioType="audio described"/>
                    <show time="2019-07-24T16:00:00" url="https://booking.cineworld.co.uk/booking/8023/170722" audioType="audio described"/>
                    <show time="2019-07-24T17:00:00" url="https://booking.cineworld.co.uk/booking/8023/170724" audioType="audio described"/>
                    <show time="2019-07-24T17:30:00" url="https://booking.cineworld.co.uk/booking/8023/170725" audioType="audio described"/>
                    <show time="2019-07-24T18:30:00" url="https://booking.cineworld.co.uk/booking/8023/170727" audioType="audio described"/>
                    <show time="2019-07-24T19:00:00" url="https://booking.cineworld.co.uk/booking/8023/170728" audioType="audio described"/>
                    <show time="2019-07-24T20:00:00" url="https://booking.cineworld.co.uk/booking/8023/170730" audioType="audio described"/>
                    <show time="2019-07-24T20:30:00" url="https://booking.cineworld.co.uk/booking/8023/170731" audioType="audio described"/>
                    <show time="2019-07-24T21:30:00" url="https://booking.cineworld.co.uk/booking/8023/171654" audioType="audio described"/>
                    <show time="2019-07-25T10:00:00" url="https://booking.cineworld.co.uk/booking/8023/171639" audioType="audio described"/>
                    <show time="2019-07-25T10:20:00" url="https://booking.cineworld.co.uk/booking/8023/171756" audioType="audio described"/>
                    <show time="2019-07-25T11:00:00" url="https://booking.cineworld.co.uk/booking/8023/171646" audioType="audio described"/>
                    <show time="2019-07-25T11:30:00" url="https://booking.cineworld.co.uk/booking/8023/171650" audioType="audio described"/>
                    <show time="2019-07-25T12:30:00" url="https://booking.cineworld.co.uk/booking/8023/171655" audioType="audio described"/>
                    <show time="2019-07-25T13:00:00" url="https://booking.cineworld.co.uk/booking/8023/171640" audioType="audio described"/>
                    <show time="2019-07-25T13:20:00" url="https://booking.cineworld.co.uk/booking/8023/171757" audioType="audio described"/>
                    <show time="2019-07-25T14:00:00" url="https://booking.cineworld.co.uk/booking/8023/171647" audioType="audio described"/>
                    <show time="2019-07-25T14:30:00" url="https://booking.cineworld.co.uk/booking/8023/171651" audioType="audio described"/>
                    <show time="2019-07-25T15:30:00" url="https://booking.cineworld.co.uk/booking/8023/171656" audioType="audio described"/>
                    <show time="2019-07-25T16:00:00" url="https://booking.cineworld.co.uk/booking/8023/171641" audioType="audio described"/>
                    <show time="2019-07-25T17:00:00" url="https://booking.cineworld.co.uk/booking/8023/171648" audioType="audio described"/>
                    <show time="2019-07-25T17:30:00" url="https://booking.cineworld.co.uk/booking/8023/171652" audioType="audio described"/>
                    <show time="2019-07-25T18:30:00" url="https://booking.cineworld.co.uk/booking/8023/171657" audioType="audio described"/>
                    <show time="2019-07-25T20:00:00" url="https://booking.cineworld.co.uk/booking/8023/171649" audioType="audio described"/>
                    <show time="2019-07-25T20:30:00" url="https://booking.cineworld.co.uk/booking/8023/171653" audioType="audio described"/>
                    <show time="2019-07-25T21:30:00" url="https://booking.cineworld.co.uk/booking/8023/171658" audioType="audio described" subtitled="true"/>
                </shows>
            </film>
            <film title="(3D) The Lion King" rating="PG" url="films/the-lion-king" edi="229584" release="19/07/2019">
                <shows>
                    <show time="2019-07-22T10:40:00" url="https://booking.cineworld.co.uk/booking/8023/170666" videoType="3d" audioType="audio described"/>
                    <show time="2019-07-22T12:00:00" url="https://booking.cineworld.co.uk/booking/8023/170740" videoType="3d" audioType="audio described"/>
                    <show time="2019-07-22T13:40:00" url="https://booking.cineworld.co.uk/booking/8023/170667" videoType="3d" audioType="audio described"/>
                    <show time="2019-07-22T15:00:00" url="https://booking.cineworld.co.uk/booking/8023/170759" videoType="3d" audioType="audio described"/>
                    <show time="2019-07-22T16:30:00" url="https://booking.cineworld.co.uk/booking/8023/170668" videoType="3d" audioType="audio described"/>
                    <show time="2019-07-22T18:00:00" url="https://booking.cineworld.co.uk/booking/8023/170743" videoType="3d" audioType="audio described"/>
                    <show time="2019-07-22T19:30:00" url="https://booking.cineworld.co.uk/booking/8023/170669" videoType="3d" audioType="audio described"/>
                    <show time="2019-07-23T10:40:00" url="https://booking.cineworld.co.uk/booking/8023/170689" videoType="3d" audioType="audio described"/>
                    <show time="2019-07-23T12:00:00" url="https://booking.cineworld.co.uk/booking/8023/170734" videoType="3d" audioType="audio described"/>
                    <show time="2019-07-23T13:40:00" url="https://booking.cineworld.co.uk/booking/8023/170695" videoType="3d" audioType="audio described"/>
                    <show time="2019-07-23T15:00:00" url="https://booking.cineworld.co.uk/booking/8023/170735" videoType="3d" audioType="audio described"/>
                    <show time="2019-07-23T16:30:00" url="https://booking.cineworld.co.uk/booking/8023/170701" videoType="3d" audioType="audio described"/>
                    <show time="2019-07-23T18:00:00" url="https://booking.cineworld.co.uk/booking/8023/170736" videoType="3d" audioType="audio described"/>
                    <show time="2019-07-23T19:30:00" url="https://booking.cineworld.co.uk/booking/8023/170707" videoType="3d" audioType="audio described"/>
                    <show time="2019-07-24T10:40:00" url="https://booking.cineworld.co.uk/booking/8023/170711" videoType="3d" audioType="audio described"/>
                    <show time="2019-07-24T12:00:00" url="https://booking.cineworld.co.uk/booking/8023/170714" videoType="3d" audioType="audio described"/>
                    <show time="2019-07-24T13:40:00" url="https://booking.cineworld.co.uk/booking/8023/170717" videoType="3d" audioType="audio described"/>
                    <show time="2019-07-24T15:00:00" url="https://booking.cineworld.co.uk/booking/8023/170720" videoType="3d" audioType="audio described"/>
                    <show time="2019-07-24T16:30:00" url="https://booking.cineworld.co.uk/booking/8023/170723" videoType="3d" audioType="audio described"/>
                    <show time="2019-07-24T18:00:00" url="https://booking.cineworld.co.uk/booking/8023/170726" videoType="3d" audioType="audio described"/>
                    <show time="2019-07-24T19:30:00" url="https://booking.cineworld.co.uk/booking/8023/170729" videoType="3d" audioType="audio described"/>
                    <show time="2019-07-25T10:40:00" url="https://booking.cineworld.co.uk/booking/8023/171642" videoType="3d" audioType="audio described"/>
                    <show time="2019-07-25T12:00:00" url="https://booking.cineworld.co.uk/booking/8023/171726" videoType="3d" audioType="audio described"/>
                    <show time="2019-07-25T13:40:00" url="https://booking.cineworld.co.uk/booking/8023/171643" videoType="3d" audioType="audio described"/>
                    <show time="2019-07-25T15:00:00" url="https://booking.cineworld.co.uk/booking/8023/171727" videoType="3d" audioType="audio described"/>
                    <show time="2019-07-25T16:30:00" url="https://booking.cineworld.co.uk/booking/8023/171644" videoType="3d" audioType="audio described"/>
                    <show time="2019-07-25T18:00:00" url="https://booking.cineworld.co.uk/booking/8023/171728" videoType="3d" audioType="audio described"/>
                    <show time="2019-07-25T19:30:00" url="https://booking.cineworld.co.uk/booking/8023/171645" videoType="3d" audioType="audio described"/>
                </shows>
            </film>
            <film title="The Queen's Corgi" rating="PG" url="films/the-queens-corgi" edi="245222" release="05/07/2019">
                <shows>
                    <show time="2019-07-22T10:00:00" url="https://booking.cineworld.co.uk/booking/8023/171588"/>
                    <show time="2019-07-22T12:10:00" url="https://booking.cineworld.co.uk/booking/8023/171589"/>
                    <show time="2019-07-23T10:00:00" url="https://booking.cineworld.co.uk/booking/8023/171593"/>
                    <show time="2019-07-23T12:10:00" url="https://booking.cineworld.co.uk/booking/8023/171594"/>
                    <show time="2019-07-24T10:00:00" url="https://booking.cineworld.co.uk/booking/8023/171598"/>
                    <show time="2019-07-24T12:10:00" url="https://booking.cineworld.co.uk/booking/8023/171599"/>
                    <show time="2019-07-25T10:00:00" url="https://booking.cineworld.co.uk/booking/8023/171603"/>
                    <show time="2019-07-25T12:10:00" url="https://booking.cineworld.co.uk/booking/8023/171604"/>
                </shows>
            </film>
            <film title="(2D) Toy Story 4" rating="U" url="films/toy-story-4" edi="148687" release="21/06/2019">
                <shows>
                    <show time="2019-07-22T10:20:00" url="https://booking.cineworld.co.uk/booking/8023/171623" audioType="audio described"/>
                    <show time="2019-07-22T11:40:00" url="https://booking.cineworld.co.uk/booking/8023/171554" audioType="audio described"/>
                    <show time="2019-07-22T12:50:00" url="https://booking.cineworld.co.uk/booking/8023/171619" audioType="audio described"/>
                    <show time="2019-07-22T14:10:00" url="https://booking.cineworld.co.uk/booking/8023/171555" audioType="audio described"/>
                    <show time="2019-07-22T15:20:00" url="https://booking.cineworld.co.uk/booking/8023/171620" audioType="audio described"/>
                    <show time="2019-07-22T16:40:00" url="https://booking.cineworld.co.uk/booking/8023/171556" audioType="audio described"/>
                    <show time="2019-07-22T17:50:00" url="https://booking.cineworld.co.uk/booking/8023/171621" audioType="audio described"/>
                    <show time="2019-07-22T19:20:00" url="https://booking.cineworld.co.uk/booking/8023/171557" audioType="audio described"/>
                    <show time="2019-07-22T20:20:00" url="https://booking.cineworld.co.uk/booking/8023/171622" audioType="audio described"/>
                    <show time="2019-07-23T10:20:00" url="https://booking.cineworld.co.uk/booking/8023/171628" audioType="audio described"/>
                    <show time="2019-07-23T11:40:00" url="https://booking.cineworld.co.uk/booking/8023/171558" audioType="audio described"/>
                    <show time="2019-07-23T12:50:00" url="https://booking.cineworld.co.uk/booking/8023/171624" audioType="audio described"/>
                    <show time="2019-07-23T14:10:00" url="https://booking.cineworld.co.uk/booking/8023/171559" audioType="audio described"/>
                    <show time="2019-07-23T15:20:00" url="https://booking.cineworld.co.uk/booking/8023/171625" audioType="audio described"/>
                    <show time="2019-07-23T16:40:00" url="https://booking.cineworld.co.uk/booking/8023/171560" audioType="audio described"/>
                    <show time="2019-07-23T17:50:00" url="https://booking.cineworld.co.uk/booking/8023/171626" audioType="audio described"/>
                    <show time="2019-07-23T19:20:00" url="https://booking.cineworld.co.uk/booking/8023/171561" audioType="audio described"/>
                    <show time="2019-07-23T20:20:00" url="https://booking.cineworld.co.uk/booking/8023/171627" audioType="audio described"/>
                    <show time="2019-07-24T10:20:00" url="https://booking.cineworld.co.uk/booking/8023/171633" audioType="audio described"/>
                    <show time="2019-07-24T11:40:00" url="https://booking.cineworld.co.uk/booking/8023/171562" audioType="audio described"/>
                    <show time="2019-07-24T12:50:00" url="https://booking.cineworld.co.uk/booking/8023/171629" audioType="audio described"/>
                    <show time="2019-07-24T14:10:00" url="https://booking.cineworld.co.uk/booking/8023/171563" audioType="audio described"/>
                    <show time="2019-07-24T15:20:00" url="https://booking.cineworld.co.uk/booking/8023/171630" audioType="audio described"/>
                    <show time="2019-07-24T16:40:00" url="https://booking.cineworld.co.uk/booking/8023/171564" audioType="audio described"/>
                    <show time="2019-07-24T17:50:00" url="https://booking.cineworld.co.uk/booking/8023/171631" audioType="audio described"/>
                    <show time="2019-07-24T19:20:00" url="https://booking.cineworld.co.uk/booking/8023/171565" audioType="audio described"/>
                    <show time="2019-07-24T20:20:00" url="https://booking.cineworld.co.uk/booking/8023/171632" audioType="audio described"/>
                    <show time="2019-07-25T10:20:00" url="https://booking.cineworld.co.uk/booking/8023/171638" audioType="audio described"/>
                    <show time="2019-07-25T11:40:00" url="https://booking.cineworld.co.uk/booking/8023/171566" audioType="audio described"/>
                    <show time="2019-07-25T12:50:00" url="https://booking.cineworld.co.uk/booking/8023/171634" audioType="audio described"/>
                    <show time="2019-07-25T14:10:00" url="https://booking.cineworld.co.uk/booking/8023/171567" audioType="audio described"/>
                    <show time="2019-07-25T15:20:00" url="https://booking.cineworld.co.uk/booking/8023/171635" audioType="audio described"/>
                    <show time="2019-07-25T16:40:00" url="https://booking.cineworld.co.uk/booking/8023/171568" audioType="audio described"/>
                    <show time="2019-07-25T17:50:00" url="https://booking.cineworld.co.uk/booking/8023/171636" audioType="audio described"/>
                    <show time="2019-07-25T19:20:00" url="https://booking.cineworld.co.uk/booking/8023/171569" audioType="audio described"/>
                    <show time="2019-07-25T20:20:00" url="https://booking.cineworld.co.uk/booking/8023/171637" audioType="audio described"/>
                </shows>
            </film>
            <film title="Wise Children" rating="15" url="films/wise-children" edi="273976" release="03/10/2019">
                <shows>
                    <show time="2019-10-03T14:00:00" url="https://booking.cineworld.co.uk/booking/8023/168190"/>
                    <show time="2019-10-03T19:30:00" url="https://booking.cineworld.co.uk/booking/8023/168191"/>
                </shows>
            </film>
            <film title="Yesterday" rating="12A" url="films/yesterday" edi="253917" release="28/06/2019">
                <shows>
                    <show time="2019-07-22T14:00:00" url="https://booking.cineworld.co.uk/booking/8023/171808" audioType="audio described"/>
                    <show time="2019-07-22T16:50:00" url="https://booking.cineworld.co.uk/booking/8023/171809" audioType="audio described"/>
                    <show time="2019-07-22T19:40:00" url="https://booking.cineworld.co.uk/booking/8023/171810" audioType="audio described"/>
                    <show time="2019-07-23T11:10:00" url="https://booking.cineworld.co.uk/booking/8023/171803" audioType="audio described"/>
                    <show time="2019-07-23T14:00:00" url="https://booking.cineworld.co.uk/booking/8023/171804" audioType="audio described"/>
                    <show time="2019-07-23T16:50:00" url="https://booking.cineworld.co.uk/booking/8023/171805" audioType="audio described"/>
                    <show time="2019-07-23T19:40:00" url="https://booking.cineworld.co.uk/booking/8023/171806" audioType="audio described"/>
                    <show time="2019-07-24T11:10:00" url="https://booking.cineworld.co.uk/booking/8023/171799" audioType="audio described"/>
                    <show time="2019-07-24T14:00:00" url="https://booking.cineworld.co.uk/booking/8023/171800" audioType="audio described"/>
                    <show time="2019-07-24T16:50:00" url="https://booking.cineworld.co.uk/booking/8023/171801" audioType="audio described"/>
                    <show time="2019-07-24T19:40:00" url="https://booking.cineworld.co.uk/booking/8023/171802" audioType="audio described"/>
                    <show time="2019-07-25T11:10:00" url="https://booking.cineworld.co.uk/booking/8023/171795" audioType="audio described"/>
                    <show time="2019-07-25T14:00:00" url="https://booking.cineworld.co.uk/booking/8023/171796" audioType="audio described"/>
                    <show time="2019-07-25T16:50:00" url="https://booking.cineworld.co.uk/booking/8023/171797" audioType="audio described"/>
                    <show time="2019-07-25T19:40:00" url="https://booking.cineworld.co.uk/booking/8023/171798" audioType="audio described"/>
                </shows>
            </film>
        </listing>
    </cinema>
    <cinema name="Cineworld Bracknell" root="http://www1.cineworld.co.uk/" url="cinemas/bracknell" id="116" phone="0871 200 2000" address="2 Eagle Lane, Bracknell" postcode="RG12 1BG">
        <listing>
            <film title="(2D) Marvel Studios' Avengers : ENDGAME" rating="12A" url="films/2d-marvel-studios-avengers-endgame" edi="801930" release="28/06/2019">
                <shows>
                    <show time="2019-07-22T16:00:00" url="https://booking.cineworld.co.uk/booking/8119/36015" audioType="audio described"/>
                    <show time="2019-07-23T16:00:00" url="https://booking.cineworld.co.uk/booking/8119/36016" audioType="audio described"/>
                    <show time="2019-07-24T16:00:00" url="https://booking.cineworld.co.uk/booking/8119/36017" audioType="audio described"/>
                    <show time="2019-07-25T16:00:00" url="https://booking.cineworld.co.uk/booking/8119/36018" audioType="audio described"/>
                </shows>
            </film>
            <film title="(4DX) The Matrix : 20th Anniversary (4K)" rating="15" url="films/4dx-the-matrix-20th-anniversary-4k-restoration" edi="801874" release="17/07/2019">
                <shows>
                    <show time="2019-07-25T19:30:00" url="https://booking.cineworld.co.uk/booking/8119/36026" audioType="audio described"/>
                </shows>
            </film>
            <film title="(2D) Aladdin" rating="PG" url="films/aladdin" edi="205737" release="24/05/2019">
                <shows>
                    <show time="2019-07-22T10:30:00" url="https://booking.cineworld.co.uk/booking/8119/35827"/>
                    <show time="2019-07-23T10:30:00" url="https://booking.cineworld.co.uk/booking/8119/35828"/>
                    <show time="2019-07-24T10:30:00" url="https://booking.cineworld.co.uk/booking/8119/35829"/>
                    <show time="2019-07-25T10:30:00" url="https://booking.cineworld.co.uk/booking/8119/35830"/>
                </shows>
            </film>
            <film title="Andre Rieu 2019 Maastricht Concert Shall We Dance?" rating="PG" url="films/andre-rieu-2019-maastricht-concert-shall-we-dance" edi="255443" release="27/07/2019">
                <shows>
                    <show time="2019-07-27T19:00:00" url="https://booking.cineworld.co.uk/booking/8119/27668" audioType="audio described"/>
                    <show time="2019-07-28T15:00:00" url="https://booking.cineworld.co.uk/booking/8119/27669" audioType="audio described"/>
                </shows>
            </film>
            <film title="Annabelle Comes Home" rating="15" url="films/annabelle-comes-home" edi="250924" release="10/07/2019">
                <shows>
                    <show time="2019-07-22T13:30:00" url="https://booking.cineworld.co.uk/booking/8119/35854"/>
                    <show time="2019-07-22T15:50:00" url="https://booking.cineworld.co.uk/booking/8119/35955" audioType="audio described"/>
                    <show time="2019-07-22T18:20:00" url="https://booking.cineworld.co.uk/booking/8119/35956" audioType="audio described"/>
                    <show time="2019-07-22T20:50:00" url="https://booking.cineworld.co.uk/booking/8119/35875" audioType="audio described"/>
                    <show time="2019-07-23T13:30:00" url="https://booking.cineworld.co.uk/booking/8119/35855"/>
                    <show time="2019-07-23T15:50:00" url="https://booking.cineworld.co.uk/booking/8119/35957" audioType="audio described"/>
                    <show time="2019-07-23T18:20:00" url="https://booking.cineworld.co.uk/booking/8119/35958" audioType="audio described"/>
                    <show time="2019-07-23T20:50:00" url="https://booking.cineworld.co.uk/booking/8119/35876" audioType="audio described"/>
                    <show time="2019-07-24T13:30:00" url="https://booking.cineworld.co.uk/booking/8119/35856"/>
                    <show time="2019-07-24T15:50:00" url="https://booking.cineworld.co.uk/booking/8119/35959" audioType="audio described"/>
                    <show time="2019-07-24T18:20:00" url="https://booking.cineworld.co.uk/booking/8119/35960" audioType="audio described"/>
                    <show time="2019-07-24T20:50:00" url="https://booking.cineworld.co.uk/booking/8119/35877" audioType="audio described"/>
                    <show time="2019-07-25T13:30:00" url="https://booking.cineworld.co.uk/booking/8119/35857"/>
                    <show time="2019-07-25T15:50:00" url="https://booking.cineworld.co.uk/booking/8119/35961" audioType="audio described"/>
                    <show time="2019-07-25T18:20:00" url="https://booking.cineworld.co.uk/booking/8119/35962" audioType="audio described"/>
                    <show time="2019-07-25T20:50:00" url="https://booking.cineworld.co.uk/booking/8119/35878" audioType="audio described"/>
                </shows>
            </film>
            <film title="Autism Friendly Screening: The Lion King (2019)" rating="PG" url="films/autism-friendly-screening-the-lion-king-2019" edi="801945" release="19/07/2019">
                <shows>
                    <show time="2019-08-04T11:00:00" url="https://booking.cineworld.co.uk/booking/8119/35478" audioType="audio described"/>
                </shows>
            </film>
            <film title="Billy Connolly: The Sex Life of Bandages" rating="18" url="films/billy-connolly-the-sex-life-of-bandages" edi="276418" release="10/10/2019">
                <shows>
                    <show time="2019-10-10T20:00:00" url="https://booking.cineworld.co.uk/booking/8119/36038"/>
                </shows>
            </film>
            <film title="Bring The Soul: The Movie" rating="PG" url="films/bring-the-soul-the-movie" edi="281205" release="07/08/2019">
                <shows>
                    <show time="2019-08-07T19:30:00" url="https://booking.cineworld.co.uk/booking/8119/35475"/>
                    <show time="2019-08-11T14:00:00" url="https://booking.cineworld.co.uk/booking/8119/35476"/>
                </shows>
            </film>
            <film title="Fast &amp; Furious: Hobbs &amp; Shaw" rating="TBC" url="films/fast-furious-hobbs-shaw" edi="240260" release="02/08/2019">
                <shows>
                    <show time="2019-08-01T19:30:00" url="https://booking.cineworld.co.uk/booking/8119/33834" audioType="audio described"/>
                    <show time="2019-08-02T19:30:00" url="https://booking.cineworld.co.uk/booking/8119/33836" audioType="audio described"/>
                    <show time="2019-08-03T19:30:00" url="https://booking.cineworld.co.uk/booking/8119/33838" audioType="audio described"/>
                    <show time="2019-08-04T19:30:00" url="https://booking.cineworld.co.uk/booking/8119/33840" audioType="audio described"/>
                </shows>
            </film>
            <film title="(4DX) Fast &amp; Furious: Hobbs &amp; Shaw" rating="TBC" url="films/fast-furious-hobbs-shaw" edi="801897" release="01/08/2019">
                <shows>
                    <show time="2019-08-01T20:35:00" url="https://booking.cineworld.co.uk/booking/8119/33835" audioType="audio described"/>
                    <show time="2019-08-02T20:35:00" url="https://booking.cineworld.co.uk/booking/8119/33837" audioType="audio described"/>
                    <show time="2019-08-03T20:35:00" url="https://booking.cineworld.co.uk/booking/8119/33839" audioType="audio described"/>
                    <show time="2019-08-04T20:35:00" url="https://booking.cineworld.co.uk/booking/8119/33841" audioType="audio described"/>
                </shows>
            </film>
            <film title="Jurassic Park [Lexicon]" rating="PG" url="films/jurassic-park-[lexicon]" edi="801947" release="02/08/2019">
                <shows>
                    <show time="2019-08-02T11:00:00" url="https://booking.cineworld.co.uk/booking/8119/36034"/>
                </shows>
            </film>
            <film title="Jurassic World : Fallen Kingdom [Lexicon]" rating="12A" url="films/jurassic-world-fallen-kingdom-[lexicon]" edi="801951" release="30/08/2019">
                <shows>
                    <show time="2019-08-23T11:00:00" url="https://booking.cineworld.co.uk/booking/8119/36037"/>
                </shows>
            </film>
            <film title="Jurassic World [Lexicon]" rating="12A" url="films/jurassic-world-[lexicon]" edi="801950" release="23/08/2019">
                <shows>
                    <show time="2019-08-16T11:00:00" url="https://booking.cineworld.co.uk/booking/8119/36036" audioType="audio described"/>
                </shows>
            </film>
            <film title="Met Opera 2019-20: Akhnaten" rating="TBC" url="films/met-opera-2019-20-akhnaten" edi="274678" release="23/11/2019">
                <shows>
                    <show time="2019-11-23T17:55:00" url="https://booking.cineworld.co.uk/booking/8119/35812"/>
                </shows>
            </film>
            <film title="MET Opera 2019-20: Madama Butterfly" rating="TBC" url="films/met-opera-2019-20-madama-butterfly" edi="274682" release="09/11/2019">
                <shows>
                    <show time="2019-11-09T17:55:00" url="https://booking.cineworld.co.uk/booking/8119/35811"/>
                </shows>
            </film>
            <film title="MET Opera 2019-20: Manon" rating="TBC" url="films/met-opera-2019-20-manon" edi="274680" release="26/10/2019">
                <shows>
                    <show time="2019-10-26T17:55:00" url="https://booking.cineworld.co.uk/booking/8119/35810"/>
                </shows>
            </film>
            <film title="MET Opera 2019-20: Turandot" rating="TBC" url="films/met-opera-2019-20-turandot" edi="274672" release="12/10/2019">
                <shows>
                    <show time="2019-10-12T17:55:00" url="https://booking.cineworld.co.uk/booking/8119/35809"/>
                </shows>
            </film>
            <film title="M4J Paw Patrol: Mighty Pups - The Movie" rating="U" url="films/paw-patrol-mighty-pups-movies-for-juniors" edi="801924" release="19/07/2019">
                <shows>
                    <show time="2019-07-22T10:10:00" url="https://booking.cineworld.co.uk/booking/8119/35903" audioType="audio described"/>
                    <show time="2019-07-23T10:10:00" url="https://booking.cineworld.co.uk/booking/8119/35904" audioType="audio described"/>
                    <show time="2019-07-24T10:10:00" url="https://booking.cineworld.co.uk/booking/8119/35905" audioType="audio described"/>
                    <show time="2019-07-25T10:10:00" url="https://booking.cineworld.co.uk/booking/8119/35906" audioType="audio described"/>
                </shows>
            </film>
            <film title="M4J Ralph Breaks The Internet: Wreck It Ralph 2" rating="PG" url="films/ralph-breaks-the-internet-wreck-it-ralph-2-movies-for-juniors" edi="801742" release="01/03/2019">
                <shows>
                    <show time="2019-07-22T10:00:00" url="https://booking.cineworld.co.uk/booking/8119/36030" audioType="audio described"/>
                    <show time="2019-07-23T10:00:00" url="https://booking.cineworld.co.uk/booking/8119/36031" audioType="audio described"/>
                    <show time="2019-07-24T10:00:00" url="https://booking.cineworld.co.uk/booking/8119/36032" audioType="audio described"/>
                    <show time="2019-07-25T10:00:00" url="https://booking.cineworld.co.uk/booking/8119/36033" audioType="audio described"/>
                </shows>
            </film>
            <film title="ROH Live Opera 2019 : Don Giovanni" rating="TBC" url="films/roh-live-opera-2019-don-giovanni" edi="274395" release="08/10/2019">
                <shows>
                    <show time="2019-10-08T18:45:00" url="https://booking.cineworld.co.uk/booking/8119/33821"/>
                </shows>
            </film>
            <film title="ROH Live Opera 2019 : Don Pasquale" rating="TBC" url="films/roh-live-opera-2019-don-pasquale" edi="274401" release="24/10/2019">
                <shows>
                    <show time="2019-10-24T19:30:00" url="https://booking.cineworld.co.uk/booking/8119/33822"/>
                </shows>
            </film>
            <film title="ROH Royal Ballet Live 2019 : Coppelia" rating="TBC" url="films/roh-royal-ballet-live-2019-coppelia" edi="274396" release="10/12/2019">
                <shows>
                    <show time="2019-12-10T19:15:00" url="https://booking.cineworld.co.uk/booking/8119/33824"/>
                </shows>
            </film>
            <film title="ROH Royal Ballet Live 2019 : Triple Bill" rating="TBC" url="films/roh-royal-ballet-live-2019-triple-bill" edi="274399" release="05/11/2019">
                <shows>
                    <show time="2019-11-05T19:15:00" url="https://booking.cineworld.co.uk/booking/8119/33823"/>
                </shows>
            </film>
            <film title="ROH Royal Ballet: The Nutckracker (2016 Recorded)" rating="TBC" url="films/roh-royal-ballet-the-nutckracker-2016-recorded" edi="277630" release="17/12/2019">
                <shows>
                    <show time="2019-12-17T19:15:00" url="https://booking.cineworld.co.uk/booking/8119/33825"/>
                </shows>
            </film>
            <film title="RSC Live : Measure For Measure" rating="12A" url="films/rsc-live-measure-for-measure" edi="263087" release="31/07/2019">
                <shows>
                    <show time="2019-07-31T19:00:00" url="https://booking.cineworld.co.uk/booking/8119/22643"/>
                </shows>
            </film>
            <film title="Secret Unlimited Screening 12" rating="15" url="films/secret-unlimited-screening-12" edi="801942" release="29/07/2019">
                <shows>
                    <show time="2019-07-29T20:00:00" url="https://booking.cineworld.co.uk/booking/8119/35477" audioType="audio described"/>
                </shows>
            </film>
            <film title="(2D) Spider-Man: Far From Home" rating="12A" url="films/spider-man-far-from-home" edi="221205" release="02/07/2019">
                <shows>
                    <show time="2019-07-22T11:20:00" url="https://booking.cineworld.co.uk/booking/8119/35926" audioType="audio described"/>
                    <show time="2019-07-22T12:50:00" url="https://booking.cineworld.co.uk/booking/8119/35945" audioType="audio described"/>
                    <show time="2019-07-22T14:20:00" url="https://booking.cineworld.co.uk/booking/8119/35927" audioType="audio described"/>
                    <show time="2019-07-22T17:20:00" url="https://booking.cineworld.co.uk/booking/8119/35928" audioType="audio described"/>
                    <show time="2019-07-22T19:50:00" url="https://booking.cineworld.co.uk/booking/8119/36022" audioType="audio described"/>
                    <show time="2019-07-22T20:20:00" url="https://booking.cineworld.co.uk/booking/8119/35929" audioType="audio described"/>
                    <show time="2019-07-23T11:20:00" url="https://booking.cineworld.co.uk/booking/8119/35930" audioType="audio described"/>
                    <show time="2019-07-23T12:50:00" url="https://booking.cineworld.co.uk/booking/8119/35946" audioType="audio described"/>
                    <show time="2019-07-23T14:20:00" url="https://booking.cineworld.co.uk/booking/8119/35931" audioType="audio described"/>
                    <show time="2019-07-23T17:20:00" url="https://booking.cineworld.co.uk/booking/8119/35932" audioType="audio described"/>
                    <show time="2019-07-23T19:50:00" url="https://booking.cineworld.co.uk/booking/8119/36023" audioType="audio described"/>
                    <show time="2019-07-23T20:20:00" url="https://booking.cineworld.co.uk/booking/8119/35933" audioType="audio described"/>
                    <show time="2019-07-24T11:20:00" url="https://booking.cineworld.co.uk/booking/8119/35934" audioType="audio described"/>
                    <show time="2019-07-24T12:50:00" url="https://booking.cineworld.co.uk/booking/8119/35947" audioType="audio described"/>
                    <show time="2019-07-24T14:20:00" url="https://booking.cineworld.co.uk/booking/8119/35935" audioType="audio described"/>
                    <show time="2019-07-24T17:20:00" url="https://booking.cineworld.co.uk/booking/8119/35936" audioType="audio described"/>
                    <show time="2019-07-24T19:50:00" url="https://booking.cineworld.co.uk/booking/8119/36024" audioType="audio described"/>
                    <show time="2019-07-24T20:20:00" url="https://booking.cineworld.co.uk/booking/8119/35937" audioType="audio described"/>
                    <show time="2019-07-25T11:20:00" url="https://booking.cineworld.co.uk/booking/8119/35938" audioType="audio described"/>
                    <show time="2019-07-25T12:50:00" url="https://booking.cineworld.co.uk/booking/8119/35948" audioType="audio described"/>
                    <show time="2019-07-25T14:20:00" url="https://booking.cineworld.co.uk/booking/8119/35939" audioType="audio described"/>
                    <show time="2019-07-25T17:20:00" url="https://booking.cineworld.co.uk/booking/8119/35940" audioType="audio described"/>
                    <show time="2019-07-25T19:50:00" url="https://booking.cineworld.co.uk/booking/8119/36025" audioType="audio described"/>
                    <show time="2019-07-25T20:20:00" url="https://booking.cineworld.co.uk/booking/8119/35941" audioType="audio described"/>
                </shows>
            </film>
            <film title="Stuber" rating="15" url="films/stuber" edi="258445" release="12/07/2019">
                <shows>
                    <show time="2019-07-22T21:00:00" url="https://booking.cineworld.co.uk/booking/8119/35970" audioType="audio described"/>
                    <show time="2019-07-23T21:00:00" url="https://booking.cineworld.co.uk/booking/8119/35972" audioType="audio described"/>
                    <show time="2019-07-24T21:00:00" url="https://booking.cineworld.co.uk/booking/8119/35974" audioType="audio described"/>
                    <show time="2019-07-25T21:00:00" url="https://booking.cineworld.co.uk/booking/8119/35976" audioType="audio described"/>
                </shows>
            </film>
            <film title="Super 30 (Hindi)" rating="12A" url="films/super-30-hindi" edi="262795" release="12/07/2019">
                <shows>
                    <show time="2019-07-22T19:40:00" url="https://booking.cineworld.co.uk/booking/8119/35910" audioType="audio described"/>
                    <show time="2019-07-23T19:40:00" url="https://booking.cineworld.co.uk/booking/8119/35911" audioType="audio described"/>
                    <show time="2019-07-24T19:40:00" url="https://booking.cineworld.co.uk/booking/8119/35912" audioType="audio described"/>
                    <show time="2019-07-25T19:40:00" url="https://booking.cineworld.co.uk/booking/8119/35913" audioType="audio described"/>
                </shows>
            </film>
            <film title="(4DX 3D) The Lion King" rating="PG" url="films/the-lion-king" edi="801933" release="19/07/2019">
                <shows>
                    <show time="2019-07-22T10:40:00" url="https://booking.cineworld.co.uk/booking/8119/35184" videoType="3d" audioType="audio described"/>
                    <show time="2019-07-22T13:40:00" url="https://booking.cineworld.co.uk/booking/8119/35185" videoType="3d" audioType="audio described"/>
                    <show time="2019-07-22T16:30:00" url="https://booking.cineworld.co.uk/booking/8119/35186" videoType="3d" audioType="audio described"/>
                    <show time="2019-07-22T19:30:00" url="https://booking.cineworld.co.uk/booking/8119/35187" videoType="3d" audioType="audio described"/>
                    <show time="2019-07-23T10:40:00" url="https://booking.cineworld.co.uk/booking/8119/35188" videoType="3d" audioType="audio described"/>
                    <show time="2019-07-23T13:40:00" url="https://booking.cineworld.co.uk/booking/8119/35189" videoType="3d" audioType="audio described"/>
                    <show time="2019-07-23T16:30:00" url="https://booking.cineworld.co.uk/booking/8119/35190" videoType="3d" audioType="audio described"/>
                    <show time="2019-07-23T19:30:00" url="https://booking.cineworld.co.uk/booking/8119/35191" videoType="3d" audioType="audio described"/>
                    <show time="2019-07-24T10:40:00" url="https://booking.cineworld.co.uk/booking/8119/35192" videoType="3d" audioType="audio described"/>
                    <show time="2019-07-24T13:40:00" url="https://booking.cineworld.co.uk/booking/8119/35193" videoType="3d" audioType="audio described"/>
                    <show time="2019-07-24T16:30:00" url="https://booking.cineworld.co.uk/booking/8119/35194" videoType="3d" audioType="audio described"/>
                    <show time="2019-07-24T19:30:00" url="https://booking.cineworld.co.uk/booking/8119/35195" videoType="3d" audioType="audio described"/>
                    <show time="2019-07-25T10:40:00" url="https://booking.cineworld.co.uk/booking/8119/35831" videoType="3d" audioType="audio described"/>
                    <show time="2019-07-25T13:40:00" url="https://booking.cineworld.co.uk/booking/8119/35832" videoType="3d" audioType="audio described"/>
                    <show time="2019-07-25T16:30:00" url="https://booking.cineworld.co.uk/booking/8119/35833" videoType="3d" audioType="audio described"/>
                </shows>
            </film>
            <film title="(2D) The Lion King" rating="PG" url="films/the-lion-king" edi="229583" release="19/07/2019">
                <shows>
                    <show time="2019-07-22T10:00:00" url="https://booking.cineworld.co.uk/booking/8119/35119" audioType="audio described"/>
                    <show time="2019-07-22T10:20:00" url="https://booking.cineworld.co.uk/booking/8119/35123" audioType="audio described"/>
                    <show time="2019-07-22T11:00:00" url="https://booking.cineworld.co.uk/booking/8119/35112" audioType="audio described"/>
                    <show time="2019-07-22T11:30:00" url="https://booking.cineworld.co.uk/booking/8119/35125" audioType="audio described"/>
                    <show time="2019-07-22T12:30:00" url="https://booking.cineworld.co.uk/booking/8119/35129" audioType="audio described"/>
                    <show time="2019-07-22T13:00:00" url="https://booking.cineworld.co.uk/booking/8119/35120" audioType="audio described"/>
                    <show time="2019-07-22T13:20:00" url="https://booking.cineworld.co.uk/booking/8119/35124" audioType="audio described"/>
                    <show time="2019-07-22T14:00:00" url="https://booking.cineworld.co.uk/booking/8119/35113" audioType="audio described"/>
                    <show time="2019-07-22T14:30:00" url="https://booking.cineworld.co.uk/booking/8119/35126" audioType="audio described"/>
                    <show time="2019-07-22T15:30:00" url="https://booking.cineworld.co.uk/booking/8119/35130" audioType="audio described"/>
                    <show time="2019-07-22T16:00:00" url="https://booking.cineworld.co.uk/booking/8119/35121" audioType="audio described"/>
                    <show time="2019-07-22T17:00:00" url="https://booking.cineworld.co.uk/booking/8119/35114" audioType="audio described"/>
                    <show time="2019-07-22T17:30:00" url="https://booking.cineworld.co.uk/booking/8119/35127" audioType="audio described" subtitled="true"/>
                    <show time="2019-07-22T18:30:00" url="https://booking.cineworld.co.uk/booking/8119/35131" audioType="audio described"/>
                    <show time="2019-07-22T19:00:00" url="https://booking.cineworld.co.uk/booking/8119/35122" audioType="audio described"/>
                    <show time="2019-07-22T20:00:00" url="https://booking.cineworld.co.uk/booking/8119/35115" audioType="audio described"/>
                    <show time="2019-07-22T20:30:00" url="https://booking.cineworld.co.uk/booking/8119/35128" audioType="audio described"/>
                    <show time="2019-07-23T10:00:00" url="https://booking.cineworld.co.uk/booking/8119/35139" audioType="audio described"/>
                    <show time="2019-07-23T10:20:00" url="https://booking.cineworld.co.uk/booking/8119/35143" audioType="audio described"/>
                    <show time="2019-07-23T11:00:00" url="https://booking.cineworld.co.uk/booking/8119/35132" audioType="audio described"/>
                    <show time="2019-07-23T11:30:00" url="https://booking.cineworld.co.uk/booking/8119/35145" audioType="audio described"/>
                    <show time="2019-07-23T12:30:00" url="https://booking.cineworld.co.uk/booking/8119/35149" audioType="audio described"/>
                    <show time="2019-07-23T13:00:00" url="https://booking.cineworld.co.uk/booking/8119/35140" audioType="audio described"/>
                    <show time="2019-07-23T13:20:00" url="https://booking.cineworld.co.uk/booking/8119/35144" audioType="audio described"/>
                    <show time="2019-07-23T14:00:00" url="https://booking.cineworld.co.uk/booking/8119/35133" audioType="audio described"/>
                    <show time="2019-07-23T14:30:00" url="https://booking.cineworld.co.uk/booking/8119/35146" audioType="audio described"/>
                    <show time="2019-07-23T15:30:00" url="https://booking.cineworld.co.uk/booking/8119/35150" audioType="audio described"/>
                    <show time="2019-07-23T16:00:00" url="https://booking.cineworld.co.uk/booking/8119/35141" audioType="audio described"/>
                    <show time="2019-07-23T17:00:00" url="https://booking.cineworld.co.uk/booking/8119/35134" audioType="audio described"/>
                    <show time="2019-07-23T17:30:00" url="https://booking.cineworld.co.uk/booking/8119/35147" audioType="audio described"/>
                    <show time="2019-07-23T18:30:00" url="https://booking.cineworld.co.uk/booking/8119/35151" audioType="audio described"/>
                    <show time="2019-07-23T19:00:00" url="https://booking.cineworld.co.uk/booking/8119/35142" audioType="audio described"/>
                    <show time="2019-07-23T20:00:00" url="https://booking.cineworld.co.uk/booking/8119/35135" audioType="audio described"/>
                    <show time="2019-07-23T20:30:00" url="https://booking.cineworld.co.uk/booking/8119/35148" audioType="audio described"/>
                    <show time="2019-07-24T10:00:00" url="https://booking.cineworld.co.uk/booking/8119/35159" audioType="audio described"/>
                    <show time="2019-07-24T10:20:00" url="https://booking.cineworld.co.uk/booking/8119/35163" audioType="audio described"/>
                    <show time="2019-07-24T11:00:00" url="https://booking.cineworld.co.uk/booking/8119/35152" audioType="audio described"/>
                    <show time="2019-07-24T11:30:00" url="https://booking.cineworld.co.uk/booking/8119/35165" audioType="audio described"/>
                    <show time="2019-07-24T12:30:00" url="https://booking.cineworld.co.uk/booking/8119/35169" audioType="audio described"/>
                    <show time="2019-07-24T13:00:00" url="https://booking.cineworld.co.uk/booking/8119/35160" audioType="audio described"/>
                    <show time="2019-07-24T13:20:00" url="https://booking.cineworld.co.uk/booking/8119/35164" audioType="audio described"/>
                    <show time="2019-07-24T14:00:00" url="https://booking.cineworld.co.uk/booking/8119/35153" audioType="audio described"/>
                    <show time="2019-07-24T14:30:00" url="https://booking.cineworld.co.uk/booking/8119/35166" audioType="audio described"/>
                    <show time="2019-07-24T15:30:00" url="https://booking.cineworld.co.uk/booking/8119/35170" audioType="audio described"/>
                    <show time="2019-07-24T16:00:00" url="https://booking.cineworld.co.uk/booking/8119/35161" audioType="audio described"/>
                    <show time="2019-07-24T17:00:00" url="https://booking.cineworld.co.uk/booking/8119/35154" audioType="audio described"/>
                    <show time="2019-07-24T17:30:00" url="https://booking.cineworld.co.uk/booking/8119/35167" audioType="audio described"/>
                    <show time="2019-07-24T18:30:00" url="https://booking.cineworld.co.uk/booking/8119/35171" audioType="audio described"/>
                    <show time="2019-07-24T19:00:00" url="https://booking.cineworld.co.uk/booking/8119/35162" audioType="audio described"/>
                    <show time="2019-07-24T20:00:00" url="https://booking.cineworld.co.uk/booking/8119/35155" audioType="audio described"/>
                    <show time="2019-07-24T20:30:00" url="https://booking.cineworld.co.uk/booking/8119/35168" audioType="audio described"/>
                    <show time="2019-07-25T10:00:00" url="https://booking.cineworld.co.uk/booking/8119/35845" audioType="audio described"/>
                    <show time="2019-07-25T10:20:00" url="https://booking.cineworld.co.uk/booking/8119/35849" audioType="audio described"/>
                    <show time="2019-07-25T11:00:00" url="https://booking.cineworld.co.uk/booking/8119/35820" audioType="audio described"/>
                    <show time="2019-07-25T11:30:00" url="https://booking.cineworld.co.uk/booking/8119/35835" audioType="audio described"/>
                    <show time="2019-07-25T12:30:00" url="https://booking.cineworld.co.uk/booking/8119/35839" audioType="audio described"/>
                    <show time="2019-07-25T13:00:00" url="https://booking.cineworld.co.uk/booking/8119/35846" audioType="audio described" subtitled="true"/>
                    <show time="2019-07-25T13:20:00" url="https://booking.cineworld.co.uk/booking/8119/35850" audioType="audio described"/>
                    <show time="2019-07-25T14:00:00" url="https://booking.cineworld.co.uk/booking/8119/35821" audioType="audio described"/>
                    <show time="2019-07-25T14:30:00" url="https://booking.cineworld.co.uk/booking/8119/35836" audioType="audio described"/>
                    <show time="2019-07-25T15:30:00" url="https://booking.cineworld.co.uk/booking/8119/35840" audioType="audio described"/>
                    <show time="2019-07-25T16:00:00" url="https://booking.cineworld.co.uk/booking/8119/35847" audioType="audio described"/>
                    <show time="2019-07-25T17:00:00" url="https://booking.cineworld.co.uk/booking/8119/35822" audioType="audio described"/>
                    <show time="2019-07-25T17:30:00" url="https://booking.cineworld.co.uk/booking/8119/35837" audioType="audio described"/>
                    <show time="2019-07-25T18:30:00" url="https://booking.cineworld.co.uk/booking/8119/35841" audioType="audio described"/>
                    <show time="2019-07-25T19:00:00" url="https://booking.cineworld.co.uk/booking/8119/35848" audioType="audio described"/>
                    <show time="2019-07-25T20:00:00" url="https://booking.cineworld.co.uk/booking/8119/35823" audioType="audio described"/>
                    <show time="2019-07-25T20:30:00" url="https://booking.cineworld.co.uk/booking/8119/35838" audioType="audio described"/>
                </shows>
            </film>
            <film title="(3D) The Lion King" rating="PG" url="films/the-lion-king" edi="229584" release="19/07/2019">
                <shows>
                    <show time="2019-07-22T12:00:00" url="https://booking.cineworld.co.uk/booking/8119/35116" videoType="3d" audioType="audio described"/>
                    <show time="2019-07-22T15:00:00" url="https://booking.cineworld.co.uk/booking/8119/35117" videoType="3d" audioType="audio described"/>
                    <show time="2019-07-22T18:00:00" url="https://booking.cineworld.co.uk/booking/8119/35118" videoType="3d" audioType="audio described"/>
                    <show time="2019-07-23T12:00:00" url="https://booking.cineworld.co.uk/booking/8119/35136" videoType="3d" audioType="audio described"/>
                    <show time="2019-07-23T15:00:00" url="https://booking.cineworld.co.uk/booking/8119/35137" videoType="3d" audioType="audio described"/>
                    <show time="2019-07-23T18:00:00" url="https://booking.cineworld.co.uk/booking/8119/35138" videoType="3d" audioType="audio described"/>
                    <show time="2019-07-24T12:00:00" url="https://booking.cineworld.co.uk/booking/8119/35156" videoType="3d" audioType="audio described"/>
                    <show time="2019-07-24T15:00:00" url="https://booking.cineworld.co.uk/booking/8119/35157" videoType="3d" audioType="audio described"/>
                    <show time="2019-07-24T18:00:00" url="https://booking.cineworld.co.uk/booking/8119/35158" videoType="3d" audioType="audio described"/>
                    <show time="2019-07-25T12:00:00" url="https://booking.cineworld.co.uk/booking/8119/35842" videoType="3d" audioType="audio described"/>
                    <show time="2019-07-25T15:00:00" url="https://booking.cineworld.co.uk/booking/8119/35843" videoType="3d" audioType="audio described"/>
                    <show time="2019-07-25T18:00:00" url="https://booking.cineworld.co.uk/booking/8119/35844" videoType="3d" audioType="audio described"/>
                </shows>
            </film>
            <film title="The Lost World : Jurassic Park [Lexicon]" rating="PG" url="films/the-lost-world-jurassic-park-[lexicon]" edi="801948" release="09/08/2019">
                <shows>
                    <show time="2019-08-09T11:00:00" url="https://booking.cineworld.co.uk/booking/8119/36035"/>
                </shows>
            </film>
            <film title="The Queen's Corgi" rating="PG" url="films/the-queens-corgi" edi="245222" release="05/07/2019">
                <shows>
                    <show time="2019-07-22T10:30:00" url="https://booking.cineworld.co.uk/booking/8119/35969" audioType="audio described"/>
                    <show time="2019-07-23T10:30:00" url="https://booking.cineworld.co.uk/booking/8119/35971" audioType="audio described"/>
                    <show time="2019-07-24T10:30:00" url="https://booking.cineworld.co.uk/booking/8119/35973" audioType="audio described"/>
                    <show time="2019-07-25T10:30:00" url="https://booking.cineworld.co.uk/booking/8119/35975" audioType="audio described"/>
                </shows>
            </film>
            <film title="(2D) Toy Story 4" rating="U" url="films/toy-story-4" edi="148687" release="21/06/2019">
                <shows>
                    <show time="2019-07-22T10:45:00" url="https://booking.cineworld.co.uk/booking/8119/35992" audioType="audio described"/>
                    <show time="2019-07-22T12:10:00" url="https://booking.cineworld.co.uk/booking/8119/35888" audioType="audio described"/>
                    <show time="2019-07-22T13:10:00" url="https://booking.cineworld.co.uk/booking/8119/35993" audioType="audio described"/>
                    <show time="2019-07-22T14:40:00" url="https://booking.cineworld.co.uk/booking/8119/35889" audioType="audio described"/>
                    <show time="2019-07-22T15:40:00" url="https://booking.cineworld.co.uk/booking/8119/35994" audioType="audio described"/>
                    <show time="2019-07-22T17:10:00" url="https://booking.cineworld.co.uk/booking/8119/35890" audioType="audio described"/>
                    <show time="2019-07-22T18:10:00" url="https://booking.cineworld.co.uk/booking/8119/35995" audioType="audio described"/>
                    <show time="2019-07-22T20:40:00" url="https://booking.cineworld.co.uk/booking/8119/35996" audioType="audio described"/>
                    <show time="2019-07-23T10:45:00" url="https://booking.cineworld.co.uk/booking/8119/35997" audioType="audio described"/>
                    <show time="2019-07-23T12:10:00" url="https://booking.cineworld.co.uk/booking/8119/35891" audioType="audio described"/>
                    <show time="2019-07-23T13:10:00" url="https://booking.cineworld.co.uk/booking/8119/35998" audioType="audio described"/>
                    <show time="2019-07-23T14:40:00" url="https://booking.cineworld.co.uk/booking/8119/35892" audioType="audio described"/>
                    <show time="2019-07-23T15:40:00" url="https://booking.cineworld.co.uk/booking/8119/35999" audioType="audio described"/>
                    <show time="2019-07-23T17:10:00" url="https://booking.cineworld.co.uk/booking/8119/35893" audioType="audio described"/>
                    <show time="2019-07-23T18:10:00" url="https://booking.cineworld.co.uk/booking/8119/36000" audioType="audio described"/>
                    <show time="2019-07-23T20:40:00" url="https://booking.cineworld.co.uk/booking/8119/36001" audioType="audio described"/>
                    <show time="2019-07-24T10:45:00" url="https://booking.cineworld.co.uk/booking/8119/36002" audioType="audio described"/>
                    <show time="2019-07-24T12:10:00" url="https://booking.cineworld.co.uk/booking/8119/35894" audioType="audio described"/>
                    <show time="2019-07-24T13:10:00" url="https://booking.cineworld.co.uk/booking/8119/36003" audioType="audio described"/>
                    <show time="2019-07-24T14:40:00" url="https://booking.cineworld.co.uk/booking/8119/35895" audioType="audio described"/>
                    <show time="2019-07-24T15:40:00" url="https://booking.cineworld.co.uk/booking/8119/36004" audioType="audio described"/>
                    <show time="2019-07-24T17:10:00" url="https://booking.cineworld.co.uk/booking/8119/35896" audioType="audio described"/>
                    <show time="2019-07-24T18:10:00" url="https://booking.cineworld.co.uk/booking/8119/36005" audioType="audio described"/>
                    <show time="2019-07-24T20:40:00" url="https://booking.cineworld.co.uk/booking/8119/36006" audioType="audio described"/>
                    <show time="2019-07-25T10:45:00" url="https://booking.cineworld.co.uk/booking/8119/36007" audioType="audio described"/>
                    <show time="2019-07-25T12:10:00" url="https://booking.cineworld.co.uk/booking/8119/35897" audioType="audio described"/>
                    <show time="2019-07-25T13:10:00" url="https://booking.cineworld.co.uk/booking/8119/36008" audioType="audio described"/>
                    <show time="2019-07-25T14:40:00" url="https://booking.cineworld.co.uk/booking/8119/35898" audioType="audio described"/>
                    <show time="2019-07-25T15:40:00" url="https://booking.cineworld.co.uk/booking/8119/36009" audioType="audio described"/>
                    <show time="2019-07-25T17:10:00" url="https://booking.cineworld.co.uk/booking/8119/35899" audioType="audio described"/>
                    <show time="2019-07-25T18:10:00" url="https://booking.cineworld.co.uk/booking/8119/36010" audioType="audio described"/>
                    <show time="2019-07-25T20:40:00" url="https://booking.cineworld.co.uk/booking/8119/36011" audioType="audio described"/>
                </shows>
            </film>
            <film title="Yesterday" rating="12A" url="films/yesterday" edi="253917" release="28/06/2019">
                <shows>
                    <show time="2019-07-22T16:20:00" url="https://booking.cineworld.co.uk/booking/8119/35864"/>
                    <show time="2019-07-22T19:20:00" url="https://booking.cineworld.co.uk/booking/8119/35865"/>
                    <show time="2019-07-23T16:20:00" url="https://booking.cineworld.co.uk/booking/8119/35866"/>
                    <show time="2019-07-23T19:20:00" url="https://booking.cineworld.co.uk/booking/8119/35867"/>
                    <show time="2019-07-24T16:20:00" url="https://booking.cineworld.co.uk/booking/8119/35868"/>
                    <show time="2019-07-24T19:20:00" url="https://booking.cineworld.co.uk/booking/8119/35869"/>
                    <show time="2019-07-25T16:20:00" url="https://booking.cineworld.co.uk/booking/8119/35870"/>
                    <show time="2019-07-25T19:20:00" url="https://booking.cineworld.co.uk/booking/8119/35871"/>
                </shows>
            </film>
        </listing>
    </cinema>
    <cinema name="Cineworld Bradford" root="http://www1.cineworld.co.uk/" url="cinemas/bradford" id="73" phone="0871 200 2000" address="Bradford Leisure Exchange, Vicar Lane, Bradford" postcode="BD1 5LD">
        <listing>
            <film title="(2D) Marvel Studios' Avengers : ENDGAME" rating="12A" url="films/2d-marvel-studios-avengers-endgame" edi="801930" release="28/06/2019">
                <shows>
                    <show time="2019-07-22T13:50:00" url="https://booking.cineworld.co.uk/booking/8021/191195" audioType="audio described"/>
                    <show time="2019-07-23T13:50:00" url="https://booking.cineworld.co.uk/booking/8021/191238" audioType="audio described"/>
                    <show time="2019-07-24T13:50:00" url="https://booking.cineworld.co.uk/booking/8021/191281" audioType="audio described"/>
                    <show time="2019-07-25T13:50:00" url="https://booking.cineworld.co.uk/booking/8021/191344" audioType="audio described"/>
                </shows>
            </film>
            <film title="M4J A Dog's Journey" rating="PG" url="films/a-dogs-journey-movies-for-juniors" edi="801922" release="28/06/2019">
                <shows>
                    <show time="2019-07-22T10:20:00" url="https://booking.cineworld.co.uk/booking/8021/191358" audioType="audio described"/>
                    <show time="2019-07-23T10:20:00" url="https://booking.cineworld.co.uk/booking/8021/191359" audioType="audio described"/>
                    <show time="2019-07-24T10:20:00" url="https://booking.cineworld.co.uk/booking/8021/191360" audioType="audio described"/>
                    <show time="2019-07-25T10:20:00" url="https://booking.cineworld.co.uk/booking/8021/191361" audioType="audio described"/>
                </shows>
            </film>
            <film title="(2D) Aladdin" rating="PG" url="films/aladdin" edi="205737" release="24/05/2019">
                <shows>
                    <show time="2019-07-22T11:10:00" url="https://booking.cineworld.co.uk/booking/8021/191185" audioType="audio described"/>
                    <show time="2019-07-22T14:10:00" url="https://booking.cineworld.co.uk/booking/8021/191186" audioType="audio described"/>
                    <show time="2019-07-22T17:10:00" url="https://booking.cineworld.co.uk/booking/8021/191187" audioType="audio described"/>
                    <show time="2019-07-22T20:10:00" url="https://booking.cineworld.co.uk/booking/8021/191188" audioType="audio described"/>
                    <show time="2019-07-23T11:10:00" url="https://booking.cineworld.co.uk/booking/8021/191228" audioType="audio described"/>
                    <show time="2019-07-23T14:10:00" url="https://booking.cineworld.co.uk/booking/8021/191229" audioType="audio described"/>
                    <show time="2019-07-23T17:10:00" url="https://booking.cineworld.co.uk/booking/8021/191230" audioType="audio described"/>
                    <show time="2019-07-23T20:10:00" url="https://booking.cineworld.co.uk/booking/8021/191231" audioType="audio described"/>
                    <show time="2019-07-24T11:10:00" url="https://booking.cineworld.co.uk/booking/8021/191271" audioType="audio described"/>
                    <show time="2019-07-24T14:10:00" url="https://booking.cineworld.co.uk/booking/8021/191272" audioType="audio described"/>
                    <show time="2019-07-24T17:10:00" url="https://booking.cineworld.co.uk/booking/8021/191273" audioType="audio described"/>
                    <show time="2019-07-24T20:10:00" url="https://booking.cineworld.co.uk/booking/8021/191274" audioType="audio described"/>
                    <show time="2019-07-25T11:10:00" url="https://booking.cineworld.co.uk/booking/8021/191334" audioType="audio described"/>
                    <show time="2019-07-25T14:10:00" url="https://booking.cineworld.co.uk/booking/8021/191335" audioType="audio described"/>
                    <show time="2019-07-25T17:10:00" url="https://booking.cineworld.co.uk/booking/8021/191336" audioType="audio described"/>
                    <show time="2019-07-25T20:10:00" url="https://booking.cineworld.co.uk/booking/8021/191337" audioType="audio described"/>
                </shows>
            </film>
            <film title="Andre Rieu 2019 Maastricht Concert Shall We Dance?" rating="PG" url="films/andre-rieu-2019-maastricht-concert-shall-we-dance" edi="255443" release="27/07/2019">
                <shows>
                    <show time="2019-07-27T19:00:00" url="https://booking.cineworld.co.uk/booking/8021/180823"/>
                    <show time="2019-07-28T15:00:00" url="https://booking.cineworld.co.uk/booking/8021/180824"/>
                </shows>
            </film>
            <film title="Anna" rating="15" url="films/anna" edi="252614" release="05/07/2019">
                <shows>
                    <show time="2019-07-22T21:00:00" url="https://booking.cineworld.co.uk/booking/8021/191172" audioType="audio described"/>
                    <show time="2019-07-23T21:00:00" url="https://booking.cineworld.co.uk/booking/8021/191215" audioType="audio described"/>
                    <show time="2019-07-24T21:00:00" url="https://booking.cineworld.co.uk/booking/8021/191258" audioType="audio described"/>
                    <show time="2019-07-25T21:00:00" url="https://booking.cineworld.co.uk/booking/8021/191302" audioType="audio described"/>
                </shows>
            </film>
            <film title="Annabelle Comes Home" rating="15" url="films/annabelle-comes-home" edi="250924" release="10/07/2019">
                <shows>
                    <show time="2019-07-22T12:50:00" url="https://booking.cineworld.co.uk/booking/8021/191162" audioType="audio described"/>
                    <show time="2019-07-22T15:30:00" url="https://booking.cineworld.co.uk/booking/8021/191163" audioType="audio described"/>
                    <show time="2019-07-22T18:10:00" url="https://booking.cineworld.co.uk/booking/8021/191164" audioType="audio described"/>
                    <show time="2019-07-22T20:50:00" url="https://booking.cineworld.co.uk/booking/8021/191165" audioType="audio described"/>
                    <show time="2019-07-23T12:50:00" url="https://booking.cineworld.co.uk/booking/8021/191205" audioType="audio described"/>
                    <show time="2019-07-23T15:30:00" url="https://booking.cineworld.co.uk/booking/8021/191206" audioType="audio described"/>
                    <show time="2019-07-23T18:10:00" url="https://booking.cineworld.co.uk/booking/8021/191207" audioType="audio described"/>
                    <show time="2019-07-23T20:50:00" url="https://booking.cineworld.co.uk/booking/8021/191208" audioType="audio described"/>
                    <show time="2019-07-24T12:50:00" url="https://booking.cineworld.co.uk/booking/8021/191248" audioType="audio described"/>
                    <show time="2019-07-24T15:30:00" url="https://booking.cineworld.co.uk/booking/8021/191249" audioType="audio described"/>
                    <show time="2019-07-24T18:10:00" url="https://booking.cineworld.co.uk/booking/8021/191250" audioType="audio described"/>
                    <show time="2019-07-24T20:50:00" url="https://booking.cineworld.co.uk/booking/8021/191251" audioType="audio described"/>
                    <show time="2019-07-25T12:50:00" url="https://booking.cineworld.co.uk/booking/8021/191290" audioType="audio described"/>
                    <show time="2019-07-25T15:30:00" url="https://booking.cineworld.co.uk/booking/8021/191291" audioType="audio described"/>
                    <show time="2019-07-25T18:10:00" url="https://booking.cineworld.co.uk/booking/8021/191292" audioType="audio described"/>
                    <show time="2019-07-25T20:50:00" url="https://booking.cineworld.co.uk/booking/8021/191293" audioType="audio described"/>
                </shows>
            </film>
            <film title="Ardaas Karaan (Punjabi)" rating="12A" url="films/ardaas-karaan-punjabi" edi="801908" release="19/07/2019">
                <shows>
                    <show time="2019-07-22T15:20:00" url="https://booking.cineworld.co.uk/booking/8021/191175"/>
                    <show time="2019-07-22T19:20:00" url="https://booking.cineworld.co.uk/booking/8021/191176"/>
                    <show time="2019-07-23T15:20:00" url="https://booking.cineworld.co.uk/booking/8021/191218"/>
                    <show time="2019-07-23T19:20:00" url="https://booking.cineworld.co.uk/booking/8021/191219"/>
                    <show time="2019-07-24T15:20:00" url="https://booking.cineworld.co.uk/booking/8021/191261"/>
                    <show time="2019-07-24T19:20:00" url="https://booking.cineworld.co.uk/booking/8021/191262"/>
                    <show time="2019-07-25T15:20:00" url="https://booking.cineworld.co.uk/booking/8021/191316"/>
                    <show time="2019-07-25T19:20:00" url="https://booking.cineworld.co.uk/booking/8021/191317"/>
                </shows>
            </film>
            <film title="Autism Friendly Screening: The Lion King (2019)" rating="PG" url="films/autism-friendly-screening-the-lion-king-2019" edi="801945" release="19/07/2019">
                <shows>
                    <show time="2019-08-04T11:00:00" url="https://booking.cineworld.co.uk/booking/8021/190703" audioType="audio described"/>
                </shows>
            </film>
            <film title="Billy Connolly: The Sex Life of Bandages" rating="18" url="films/billy-connolly-the-sex-life-of-bandages" edi="276418" release="10/10/2019">
                <shows>
                    <show time="2019-10-10T20:00:00" url="https://booking.cineworld.co.uk/booking/8021/191375"/>
                </shows>
            </film>
            <film title="Bring The Soul: The Movie" rating="PG" url="films/bring-the-soul-the-movie" edi="281205" release="07/08/2019">
                <shows>
                    <show time="2019-08-07T19:30:00" url="https://booking.cineworld.co.uk/booking/8021/190701"/>
                    <show time="2019-08-11T14:00:00" url="https://booking.cineworld.co.uk/booking/8021/190702"/>
                </shows>
            </film>
            <film title="Fast &amp; Furious: Hobbs &amp; Shaw" rating="TBC" url="films/fast-furious-hobbs-shaw" edi="240260" release="02/08/2019">
                <shows>
                    <show time="2019-08-01T20:30:00" url="https://booking.cineworld.co.uk/booking/8021/188946" audioType="audio described"/>
                    <show time="2019-08-02T20:30:00" url="https://booking.cineworld.co.uk/booking/8021/188947" audioType="audio described"/>
                    <show time="2019-08-03T20:30:00" url="https://booking.cineworld.co.uk/booking/8021/188948" audioType="audio described"/>
                    <show time="2019-08-04T20:30:00" url="https://booking.cineworld.co.uk/booking/8021/188949" audioType="audio described"/>
                </shows>
            </film>
            <film title="Midsommar" rating="18" url="films/midsommar" edi="265995" release="05/07/2019">
                <shows>
                    <show time="2019-07-22T20:20:00" url="https://booking.cineworld.co.uk/booking/8021/191197" audioType="audio described"/>
                    <show time="2019-07-23T20:20:00" url="https://booking.cineworld.co.uk/booking/8021/191240" audioType="audio described"/>
                    <show time="2019-07-24T20:20:00" url="https://booking.cineworld.co.uk/booking/8021/191283" audioType="audio described"/>
                    <show time="2019-07-25T20:20:00" url="https://booking.cineworld.co.uk/booking/8021/191346" audioType="audio described"/>
                </shows>
            </film>
            <film title="Munda Hi Chahida (Punjabi)" rating="PG" url="films/munda-hi-chahida-punjabi" edi="275481" release="12/07/2019">
                <shows>
                    <show time="2019-07-22T19:45:00" url="https://booking.cineworld.co.uk/booking/8021/191193"/>
                    <show time="2019-07-23T19:45:00" url="https://booking.cineworld.co.uk/booking/8021/191236"/>
                    <show time="2019-07-24T19:45:00" url="https://booking.cineworld.co.uk/booking/8021/191279"/>
                    <show time="2019-07-25T19:45:00" url="https://booking.cineworld.co.uk/booking/8021/191342"/>
                </shows>
            </film>
            <film title="M4J Paw Patrol: Mighty Pups - The Movie" rating="U" url="films/paw-patrol-mighty-pups-movies-for-juniors" edi="801924" release="19/07/2019">
                <shows>
                    <show time="2019-07-22T10:10:00" url="https://booking.cineworld.co.uk/booking/8021/191364" audioType="audio described"/>
                    <show time="2019-07-23T10:10:00" url="https://booking.cineworld.co.uk/booking/8021/191365" audioType="audio described"/>
                    <show time="2019-07-24T10:10:00" url="https://booking.cineworld.co.uk/booking/8021/191366" audioType="audio described"/>
                    <show time="2019-07-25T10:10:00" url="https://booking.cineworld.co.uk/booking/8021/191367" audioType="audio described"/>
                </shows>
            </film>
            <film title="M4J Ralph Breaks The Internet: Wreck It Ralph 2" rating="PG" url="films/ralph-breaks-the-internet-wreck-it-ralph-2-movies-for-juniors" edi="801742" release="01/03/2019">
                <shows>
                    <show time="2019-07-22T10:00:00" url="https://booking.cineworld.co.uk/booking/8021/191370" audioType="audio described"/>
                    <show time="2019-07-23T10:00:00" url="https://booking.cineworld.co.uk/booking/8021/191371" audioType="audio described"/>
                    <show time="2019-07-24T10:00:00" url="https://booking.cineworld.co.uk/booking/8021/191372" audioType="audio described"/>
                    <show time="2019-07-25T10:00:00" url="https://booking.cineworld.co.uk/booking/8021/191373" audioType="audio described"/>
                </shows>
            </film>
            <film title="Rocketman : Sing-Along Version" rating="15" url="films/rocketman-sing-along-version" edi="263136" release="26/07/2019">
                <shows>
                    <show time="2019-07-26T19:30:00" url="https://booking.cineworld.co.uk/booking/8021/191040" audioType="audio described" subtitled="true"/>
                </shows>
            </film>
            <film title="Secret Unlimited Screening 12" rating="15" url="films/secret-unlimited-screening-12" edi="801942" release="29/07/2019">
                <shows>
                    <show time="2019-07-29T20:00:00" url="https://booking.cineworld.co.uk/booking/8021/190700" audioType="audio described"/>
                </shows>
            </film>
            <film title="Shadaa (Punjabi)" rating="PG" url="films/shadaa-punjabi" edi="278952" release="21/06/2019">
                <shows>
                    <show time="2019-07-22T20:45:00" url="https://booking.cineworld.co.uk/booking/8021/191173"/>
                    <show time="2019-07-23T20:45:00" url="https://booking.cineworld.co.uk/booking/8021/191216"/>
                    <show time="2019-07-24T20:45:00" url="https://booking.cineworld.co.uk/booking/8021/191259"/>
                    <show time="2019-07-25T20:45:00" url="https://booking.cineworld.co.uk/booking/8021/191314"/>
                </shows>
            </film>
            <film title="(2D) Spider-Man: Far From Home" rating="12A" url="films/spider-man-far-from-home" edi="221205" release="02/07/2019">
                <shows>
                    <show time="2019-07-22T10:10:00" url="https://booking.cineworld.co.uk/booking/8021/191177" audioType="audio described"/>
                    <show time="2019-07-22T11:40:00" url="https://booking.cineworld.co.uk/booking/8021/191181" audioType="audio described"/>
                    <show time="2019-07-22T13:10:00" url="https://booking.cineworld.co.uk/booking/8021/191178" audioType="audio described"/>
                    <show time="2019-07-22T14:40:00" url="https://booking.cineworld.co.uk/booking/8021/191182" audioType="audio described"/>
                    <show time="2019-07-22T16:10:00" url="https://booking.cineworld.co.uk/booking/8021/191179" audioType="audio described"/>
                    <show time="2019-07-22T17:40:00" url="https://booking.cineworld.co.uk/booking/8021/191183" audioType="audio described"/>
                    <show time="2019-07-22T19:10:00" url="https://booking.cineworld.co.uk/booking/8021/191180" audioType="audio described"/>
                    <show time="2019-07-22T20:40:00" url="https://booking.cineworld.co.uk/booking/8021/191184" audioType="audio described"/>
                    <show time="2019-07-23T10:10:00" url="https://booking.cineworld.co.uk/booking/8021/191220" audioType="audio described"/>
                    <show time="2019-07-23T11:40:00" url="https://booking.cineworld.co.uk/booking/8021/191224" audioType="audio described"/>
                    <show time="2019-07-23T13:10:00" url="https://booking.cineworld.co.uk/booking/8021/191221" audioType="audio described"/>
                    <show time="2019-07-23T14:40:00" url="https://booking.cineworld.co.uk/booking/8021/191225" audioType="audio described"/>
                    <show time="2019-07-23T16:10:00" url="https://booking.cineworld.co.uk/booking/8021/191222" audioType="audio described"/>
                    <show time="2019-07-23T17:40:00" url="https://booking.cineworld.co.uk/booking/8021/191226" audioType="audio described"/>
                    <show time="2019-07-23T19:10:00" url="https://booking.cineworld.co.uk/booking/8021/191223" audioType="audio described"/>
                    <show time="2019-07-23T20:40:00" url="https://booking.cineworld.co.uk/booking/8021/191227" audioType="audio described"/>
                    <show time="2019-07-24T10:10:00" url="https://booking.cineworld.co.uk/booking/8021/191263" audioType="audio described"/>
                    <show time="2019-07-24T11:40:00" url="https://booking.cineworld.co.uk/booking/8021/191267" audioType="audio described"/>
                    <show time="2019-07-24T13:10:00" url="https://booking.cineworld.co.uk/booking/8021/191264" audioType="audio described"/>
                    <show time="2019-07-24T14:40:00" url="https://booking.cineworld.co.uk/booking/8021/191268" audioType="audio described"/>
                    <show time="2019-07-24T16:10:00" url="https://booking.cineworld.co.uk/booking/8021/191265" audioType="audio described"/>
                    <show time="2019-07-24T17:40:00" url="https://booking.cineworld.co.uk/booking/8021/191269" audioType="audio described"/>
